brand,description,price,website,search_term,scrape_timestamp,cantidad,unidad,price_numeric
CAMPOMAR,S贸lido de Caballa en Aceite 170 g,S/ 5.70,tottus,CABALLA,2024-12-04 13:15:35.916640,170.0,g,5.7
FRESCOMAR,Trozos De Caballa 170 g,S/ 4.80,tottus,CABALLA,2024-12-04 13:15:35.916640,170.0,g,4.8
CARABELA,Trozos de Caballa en aceite vegetal 170gr Pack x12,S/ 55,tottus,CABALLA,2024-12-04 13:15:35.916640,170.0,g,55.0
CARABELA,Filetes de Caballa en aceite vegetal 170gr Pack x12,S/ 63.50,tottus,CABALLA,2024-12-04 13:15:35.916640,170.0,g,63.5
BRAVERY,Caballa para Gatitos Lata 70gr x12und,S/ 157.90,tottus,CABALLA,2024-12-04 13:15:35.916640,70.0,g,157.9
AMITY,Caballa Sardina y Salm贸n para Gatos Adultos Lata 80gr,S/ 17.28,tottus,CABALLA,2024-12-04 13:15:35.916640,80.0,g,17.28
AMITY,Caballa Sardina Y Salm贸n Gatos Adultos Lata 80gr 20und,S/ 150,tottus,CABALLA,2024-12-04 13:15:35.916640,80.0,g,150.0
AMITY,Caballa Sardina Salm贸n Gatos Adultos Lata 80gr x10 und,S/ 75,tottus,CABALLA,2024-12-04 13:15:35.916640,80.0,g,75.0
GENERICO,Leonardo Libre de Granos para Gatitos 1.8 Kg,S/ 117.90,tottus,CABALLA,2024-12-04 13:15:35.916640,1.8,kg,117.9
