description,price,website,search_term,scrape_timestamp,cantidad,unidad,price_numeric
Alas Pollo Congeladas San Fernando x kg,S/ 16.30 x kg,metro,ALAS DE POLLO,2024-12-04 21:00:00.198372,1.0,kg,16.3
Ala Media de de Pollo Redondos x kg,S/ 17.50 x kg,metro,ALAS DE POLLO,2024-12-04 21:00:00.198372,1.0,kg,17.5
Ala Entera de Pollo Redondos x kg,S/ 14.90 x kg,metro,ALAS DE POLLO,2024-12-04 21:00:00.198372,1.0,kg,14.9
Alas con Punta de Pollo Natural x kg,S/ 14.90 x kg,metro,ALAS DE POLLO,2024-12-04 21:00:00.198372,1.0,kg,14.9
Alas de Pollo Artisan x Kg. Libre de Antibióticos,S/ 27.50 x kg,metro,ALAS DE POLLO,2024-12-04 21:00:00.198372,1.0,kg,27.5
Pechuga de Pollo con Alas Congelada San Fernando x kg,S/ 18.30 x kg,metro,ALAS DE POLLO,2024-12-04 21:00:00.198372,1.0,kg,18.3
