description,price,website,search_term,scrape_timestamp,cantidad,unidad,price_numeric
Cereal Corn Flakes Sin Gluten 740g,S/ 20.90,metro,CEREALES PROCESADOS SIMPLES (HOJUELAS),2024-12-04 20:54:40.266422,740.0,g,20.9
Cereal Copix con Marshmallows Bolsa 740 g,S/ 23.20,metro,CEREALES PROCESADOS SIMPLES (HOJUELAS),2024-12-04 20:54:40.266422,740.0,g,23.2
Hojuelas de Maíz Kellogg's Corn Flakes 410g,S/ 13.00,metro,CEREALES PROCESADOS SIMPLES (HOJUELAS),2024-12-04 20:54:40.266422,410.0,g,13.0
Cereal Flakes Angel 1 kg,S/ 16.50,metro,CEREALES PROCESADOS SIMPLES (HOJUELAS),2024-12-04 20:54:40.266422,1.0,kg,16.5
Cereal de Trigo Integral Fitness Original 570g,S/ 24.90,metro,CEREALES PROCESADOS SIMPLES (HOJUELAS),2024-12-04 20:54:40.266422,570.0,g,24.9
Cereal Zuck Bolsa 1 Kg,S/ 23.20,metro,CEREALES PROCESADOS SIMPLES (HOJUELAS),2024-12-04 20:54:40.266422,1.0,kg,23.2
Cereal Copix Chocolate con Marshmallows Bolsa 380 g,S/ 11.90,metro,CEREALES PROCESADOS SIMPLES (HOJUELAS),2024-12-04 20:54:40.266422,380.0,g,11.9
Cereal Bar 12un Display Costa Choco,S/ 6.30,metro,CEREALES PROCESADOS SIMPLES (HOJUELAS),2024-12-04 20:54:40.266422,12.0,un,6.3
Cereal Chocapic 540g,S/ 22.90,metro,CEREALES PROCESADOS SIMPLES (HOJUELAS),2024-12-04 20:54:40.266422,540.0,g,22.9
Cereal de Maíz Corn Flakes 405g,S/ 13.90,metro,CEREALES PROCESADOS SIMPLES (HOJUELAS),2024-12-04 20:54:40.266422,405.0,g,13.9
Cereal Angel Chock Contenido 840 g,S/ 23.20,metro,CEREALES PROCESADOS SIMPLES (HOJUELAS),2024-12-04 20:54:40.266422,840.0,g,23.2
Cereal Bar 12un Display Costa Golden,S/ 6.30,metro,CEREALES PROCESADOS SIMPLES (HOJUELAS),2024-12-04 20:54:40.266422,12.0,un,6.3
Cereales Bañados con Chocolate Choco Yogurt 2 Cerritos Caja 350 gr,S/ 20.50,metro,CEREALES PROCESADOS SIMPLES (HOJUELAS),2024-12-04 20:54:40.266422,350.0,g,20.5
Cereal Zuck Bolsa 500 g,S/ 14.90,metro,CEREALES PROCESADOS SIMPLES (HOJUELAS),2024-12-04 20:54:40.266422,500.0,g,14.9
Cereal Cuisine & Co Fruty Color Sin Gluten 350g,S/ 15.70,metro,CEREALES PROCESADOS SIMPLES (HOJUELAS),2024-12-04 20:54:40.266422,350.0,g,15.7
Cereal Angel Meli Bolsa 840 g,S/ 23.20,metro,CEREALES PROCESADOS SIMPLES (HOJUELAS),2024-12-04 20:54:40.266422,840.0,g,23.2
Cereal Flakes Bolsa 500 g,S/ 11.90,metro,CEREALES PROCESADOS SIMPLES (HOJUELAS),2024-12-04 20:54:40.266422,500.0,g,11.9
Cereal de Trigo Integral Fitness Miel y Almendras 330g,S/ 18.90,metro,CEREALES PROCESADOS SIMPLES (HOJUELAS),2024-12-04 20:54:40.266422,330.0,g,18.9
Cereales Angel Life Protein Caja 300 g,S/ 12.80,metro,CEREALES PROCESADOS SIMPLES (HOJUELAS),2024-12-04 20:54:40.266422,300.0,g,12.8
Cereal Angel Life Multrigrano Caja 300 g,S/ 12.80,metro,CEREALES PROCESADOS SIMPLES (HOJUELAS),2024-12-04 20:54:40.266422,300.0,g,12.8
Cereal de Trigo Integral Fitness Original 285g,S/ 14.50,metro,CEREALES PROCESADOS SIMPLES (HOJUELAS),2024-12-04 20:54:40.266422,285.0,g,14.5
Cereal Trix 330g,S/ 17.90,metro,CEREALES PROCESADOS SIMPLES (HOJUELAS),2024-12-04 20:54:40.266422,330.0,g,17.9
Cereal con Sabor a Frutas Angel Frutt Bolsa 840 gr,S/ 23.20,metro,CEREALES PROCESADOS SIMPLES (HOJUELAS),2024-12-04 20:54:40.266422,840.0,g,23.2
Cereales Angel Life Protein Contenido 560 g,S/ 22.60,metro,CEREALES PROCESADOS SIMPLES (HOJUELAS),2024-12-04 20:54:40.266422,560.0,g,22.6
Cereal de Avena y Arroz Cuisine & Co 350g,S/ 15.70,metro,CEREALES PROCESADOS SIMPLES (HOJUELAS),2024-12-04 20:54:40.266422,350.0,g,15.7
Cereal Kiwigen Duomix 180g,S/ 10.20,metro,CEREALES PROCESADOS SIMPLES (HOJUELAS),2024-12-04 20:54:40.266422,180.0,g,10.2
Barra de Cereales Mini Cereal Bar Golden 24un,S/ 10.10,metro,CEREALES PROCESADOS SIMPLES (HOJUELAS),2024-12-04 20:54:40.266422,24.0,un,10.1
Cereal Naturandes 7 Semillas Chocolate 200g,S/ 20.50,metro,CEREALES PROCESADOS SIMPLES (HOJUELAS),2024-12-04 20:54:40.266422,200.0,g,20.5
Cereales Angel Life Cero 300g,S/ 12.80,metro,CEREALES PROCESADOS SIMPLES (HOJUELAS),2024-12-04 20:54:40.266422,300.0,g,12.8
Cereales Cuisine & Co Monstrobolitas 120g,S/ 3.50,metro,CEREALES PROCESADOS SIMPLES (HOJUELAS),2024-12-04 20:54:40.266422,120.0,g,3.5
Cereal Chock Bolsa 420 g,S/ 14.90,metro,CEREALES PROCESADOS SIMPLES (HOJUELAS),2024-12-04 20:54:40.266422,420.0,g,14.9
Cereal Tito Almohada Angel Chocolate Bolsa 350 g,S/ 16.90,metro,CEREALES PROCESADOS SIMPLES (HOJUELAS),2024-12-04 20:54:40.266422,350.0,g,16.9
Cereales Kellogg's Hot Wheels Sabor Frutas 135g,S/ 12.00,metro,CEREALES PROCESADOS SIMPLES (HOJUELAS),2024-12-04 20:54:40.266422,135.0,g,12.0
Cereal de Garbanzo Sabor Chocolate Brownie Dyfferent 210g,S/ 16.10,metro,CEREALES PROCESADOS SIMPLES (HOJUELAS),2024-12-04 20:54:40.266422,210.0,g,16.1
Cereal de Avena y Arroz Cuisine & Co Sin Gluten 250g,S/ 13.20,metro,CEREALES PROCESADOS SIMPLES (HOJUELAS),2024-12-04 20:54:40.266422,250.0,g,13.2
Cereal Semillitas Con Harina 7 Semillas Angel Bolsa 350 g,S/ 14.90,metro,CEREALES PROCESADOS SIMPLES (HOJUELAS),2024-12-04 20:54:40.266422,350.0,g,14.9
Cereales de Trigo con Cacao Chocapic 170g,S/ 10.50,metro,CEREALES PROCESADOS SIMPLES (HOJUELAS),2024-12-04 20:54:40.266422,170.0,g,10.5
Cereal Angel Meli Bolsa 420 g,S/ 14.90,metro,CEREALES PROCESADOS SIMPLES (HOJUELAS),2024-12-04 20:54:40.266422,420.0,g,14.9
Cereal Infantil en Polvo Nestum Arroz 350g,S/ 17.90,metro,CEREALES PROCESADOS SIMPLES (HOJUELAS),2024-12-04 20:54:40.266422,350.0,g,17.9
Cereal de Avena Cuisine & Co Sin Gluten 250g,S/ 13.20,metro,CEREALES PROCESADOS SIMPLES (HOJUELAS),2024-12-04 20:54:40.266422,250.0,g,13.2
Cereal de Trigo Integral Fitness Frutas 330g,S/ 18.90,metro,CEREALES PROCESADOS SIMPLES (HOJUELAS),2024-12-04 20:54:40.266422,330.0,g,18.9
Hojuelas de Maíz Azucaradas Kellogg's Zucaritas 420g,S/ 16.90,metro,CEREALES PROCESADOS SIMPLES (HOJUELAS),2024-12-04 20:54:40.266422,420.0,g,16.9
Cereal Chocapic Nestlé 350g,S/ 20.90,metro,CEREALES PROCESADOS SIMPLES (HOJUELAS),2024-12-04 20:54:40.266422,350.0,g,20.9
Hojuelas de Maíz Corn Flakes Kellogg's 200g,S/ 10.00,metro,CEREALES PROCESADOS SIMPLES (HOJUELAS),2024-12-04 20:54:40.266422,200.0,g,10.0
Cereal Infantil en Polvo Nestum Trigo Quinua y Otros Cereales 350g,S/ 17.90,metro,CEREALES PROCESADOS SIMPLES (HOJUELAS),2024-12-04 20:54:40.266422,350.0,g,17.9
Cereal Kit Kat 210g,S/ 13.90,metro,CEREALES PROCESADOS SIMPLES (HOJUELAS),2024-12-04 20:54:40.266422,210.0,g,13.9
Hojuelas de Maíz Corn Flakes Cuisine & Co Caja 500 g,S/ 12.90,metro,CEREALES PROCESADOS SIMPLES (HOJUELAS),2024-12-04 20:54:40.266422,500.0,g,12.9
Cereal de Quinua Nura Choco Pops 200g,S/ 21.50,metro,CEREALES PROCESADOS SIMPLES (HOJUELAS),2024-12-04 20:54:40.266422,200.0,g,21.5
Cereales Angel Life Fibra 300g,S/ 12.80,metro,CEREALES PROCESADOS SIMPLES (HOJUELAS),2024-12-04 20:54:40.266422,300.0,g,12.8
Cereal Fruta Aros Maiz Cereal Angel Bolsa 420 g,S/ 14.90,metro,CEREALES PROCESADOS SIMPLES (HOJUELAS),2024-12-04 20:54:40.266422,420.0,g,14.9
"Cereal Orgánico de Quinua, Arroz y Cacao Kids Organics Caja 240 gr",S/ 20.10,metro,CEREALES PROCESADOS SIMPLES (HOJUELAS),2024-12-04 20:54:40.266422,240.0,g,20.1
Hojuelas de Avena Integral Sin Gluten Mi Tierra Bolsa 400 g,S/ 11.30,metro,CEREALES PROCESADOS SIMPLES (HOJUELAS),2024-12-04 20:54:40.266422,400.0,g,11.3
Cereal Corn Flakes Sin Gluten 180g,S/ 13.40,metro,CEREALES PROCESADOS SIMPLES (HOJUELAS),2024-12-04 20:54:40.266422,180.0,g,13.4
Cereales Angel Life Fibra Contenido 560 g,S/ 22.60,metro,CEREALES PROCESADOS SIMPLES (HOJUELAS),2024-12-04 20:54:40.266422,560.0,g,22.6
Cereal Infantil en Polvo Cerelac 5 Cereales y Leche 400g,S/ 24.60,metro,CEREALES PROCESADOS SIMPLES (HOJUELAS),2024-12-04 20:54:40.266422,400.0,g,24.6
Cereales Bañados con Chocolate Choco Yogurt 2 Cerritos Bolsa 125 g,S/ 11.20,metro,CEREALES PROCESADOS SIMPLES (HOJUELAS),2024-12-04 20:54:40.266422,125.0,g,11.2
Cereal Infantil en Polvo Nestum 5 Cereales 350g,S/ 17.90,metro,CEREALES PROCESADOS SIMPLES (HOJUELAS),2024-12-04 20:54:40.266422,350.0,g,17.9
Hojuelas de Maíz Corn Flakes Cuisine & Co 200g,S/ 6.90,metro,CEREALES PROCESADOS SIMPLES (HOJUELAS),2024-12-04 20:54:40.266422,200.0,g,6.9
Cereal Naturandes 7 Semillas Vainilla 200g,S/ 20.50,metro,CEREALES PROCESADOS SIMPLES (HOJUELAS),2024-12-04 20:54:40.266422,200.0,g,20.5
Hojuelas de Maíz Azucaradas Kellogg's Zucaritas 260g,S/ 12.90,metro,CEREALES PROCESADOS SIMPLES (HOJUELAS),2024-12-04 20:54:40.266422,260.0,g,12.9
Cereal Kiwigen Mix Chocolate 180g,S/ 10.20,metro,CEREALES PROCESADOS SIMPLES (HOJUELAS),2024-12-04 20:54:40.266422,180.0,g,10.2
Trigo Nuclear 110 g,S/ 4.20,metro,CEREALES PROCESADOS SIMPLES (HOJUELAS),2024-12-04 20:54:40.266422,110.0,g,4.2
Cereal de Maíz Azucarado Cuisine & Co Reggae Flakes 480g,S/ 10.90,metro,CEREALES PROCESADOS SIMPLES (HOJUELAS),2024-12-04 20:54:40.266422,480.0,g,10.9
Hojuelas Integrales Cheerios Honey Nut 306g,S/ 38.90,metro,CEREALES PROCESADOS SIMPLES (HOJUELAS),2024-12-04 20:54:40.266422,306.0,g,38.9
Cereal Cuadritos de Avena Cuisine & Co Caja 370 gr,S/ 12.90,metro,CEREALES PROCESADOS SIMPLES (HOJUELAS),2024-12-04 20:54:40.266422,370.0,g,12.9
Cereal Froot Loops Spinners 265g,S/ 20.90,metro,CEREALES PROCESADOS SIMPLES (HOJUELAS),2024-12-04 20:54:40.266422,265.0,g,20.9
Cereales Kellogg's Barbie Sabor Frutilla 135g,S/ 12.00,metro,CEREALES PROCESADOS SIMPLES (HOJUELAS),2024-12-04 20:54:40.266422,135.0,g,12.0
Cereal de Garbanzo Sabor Cinnamon Roll Dyfferent 210g,S/ 16.10,metro,CEREALES PROCESADOS SIMPLES (HOJUELAS),2024-12-04 20:54:40.266422,210.0,g,16.1
Hojuelas de Cereales Sabor Chocolate Chocapic Bolsa 90 g,S/ 6.00,metro,CEREALES PROCESADOS SIMPLES (HOJUELAS),2024-12-04 20:54:40.266422,90.0,g,6.0
Cereal Corn Flakes Ángel 650g,S/ 14.30,metro,CEREALES PROCESADOS SIMPLES (HOJUELAS),2024-12-04 20:54:40.266422,650.0,g,14.3
Cereal de Quinua Nura Caramel Pops 200g,S/ 21.50,metro,CEREALES PROCESADOS SIMPLES (HOJUELAS),2024-12-04 20:54:40.266422,200.0,g,21.5
Cereal Naturandes 7 Semillas Clásico 200g,S/ 20.50,metro,CEREALES PROCESADOS SIMPLES (HOJUELAS),2024-12-04 20:54:40.266422,200.0,g,20.5
Cereal Sublime 230g,S/ 14.40,metro,CEREALES PROCESADOS SIMPLES (HOJUELAS),2024-12-04 20:54:40.266422,230.0,g,14.4
Hojuelas de Galletas Oreo 311g,S/ 42.90,metro,CEREALES PROCESADOS SIMPLES (HOJUELAS),2024-12-04 20:54:40.266422,311.0,g,42.9
Cereal Up Tradicional Cuisine & Co 380g,S/ 12.90,metro,CEREALES PROCESADOS SIMPLES (HOJUELAS),2024-12-04 20:54:40.266422,380.0,g,12.9
Cereales con Marshmellows Trix 300g,S/ 21.50,metro,CEREALES PROCESADOS SIMPLES (HOJUELAS),2024-12-04 20:54:40.266422,300.0,g,21.5
Cereal Infantil en Polvo Nestum Trigo y Miel 350g,S/ 17.90,metro,CEREALES PROCESADOS SIMPLES (HOJUELAS),2024-12-04 20:54:40.266422,350.0,g,17.9
Aritos Nuclear 110 g,S/ 5.70,metro,CEREALES PROCESADOS SIMPLES (HOJUELAS),2024-12-04 20:54:40.266422,110.0,g,5.7
Cereal Up Miel Cuisine & Co 380g,S/ 12.90,metro,CEREALES PROCESADOS SIMPLES (HOJUELAS),2024-12-04 20:54:40.266422,380.0,g,12.9
Cereal Flips Chocolate 220g,S/ 12.70,metro,CEREALES PROCESADOS SIMPLES (HOJUELAS),2024-12-04 20:54:40.266422,220.0,g,12.7
Cereal Azucarado Trix Minis 300g,S/ 16.90,metro,CEREALES PROCESADOS SIMPLES (HOJUELAS),2024-12-04 20:54:40.266422,300.0,g,16.9
Cereal Flips Dulce de Leche 220g,S/ 12.70,metro,CEREALES PROCESADOS SIMPLES (HOJUELAS),2024-12-04 20:54:40.266422,220.0,g,12.7
Cereal para Bebés Gerber Corazoncitos 25g,S/ 12.10,metro,CEREALES PROCESADOS SIMPLES (HOJUELAS),2024-12-04 20:54:40.266422,25.0,g,12.1
Trigo Nuclear Light 110 g,S/ 4.20,metro,CEREALES PROCESADOS SIMPLES (HOJUELAS),2024-12-04 20:54:40.266422,110.0,g,4.2
Hojuelas Integrales Cinnamon Toast Crunch 340g,S/ 38.90,metro,CEREALES PROCESADOS SIMPLES (HOJUELAS),2024-12-04 20:54:40.266422,340.0,g,38.9
Hojuelas Integrales Honey Bunches Almendras 340g,S/ 38.90,metro,CEREALES PROCESADOS SIMPLES (HOJUELAS),2024-12-04 20:54:40.266422,340.0,g,38.9
Cereal de Garbanzo Sabor Miel Vainilla Dyfferent 210g,S/ 16.10,metro,CEREALES PROCESADOS SIMPLES (HOJUELAS),2024-12-04 20:54:40.266422,210.0,g,16.1
Cereal Chocapic Minis 330g,S/ 17.50,metro,CEREALES PROCESADOS SIMPLES (HOJUELAS),2024-12-04 20:54:40.266422,330.0,g,17.5
Hojuelas Integrales Honey Bunches Miel Tostada 340g,S/ 38.90,metro,CEREALES PROCESADOS SIMPLES (HOJUELAS),2024-12-04 20:54:40.266422,340.0,g,38.9
Cereales Bañados con Chocolate Pelotitas 2 Cerritos Bolsa 125 gr,S/ 10.50,metro,CEREALES PROCESADOS SIMPLES (HOJUELAS),2024-12-04 20:54:40.266422,125.0,g,10.5
Cereal Azucarado Zucosos 500g,S/ 16.90,metro,CEREALES PROCESADOS SIMPLES (HOJUELAS),2024-12-04 20:54:40.266422,500.0,g,16.9
Cereal Cuisine & Co Dj Honey 500g,S/ 12.90,metro,CEREALES PROCESADOS SIMPLES (HOJUELAS),2024-12-04 20:54:40.266422,500.0,g,12.9
Cereal Mix Avena y Almendras Cuisine & Co Caja 380 gr,S/ 13.90,metro,CEREALES PROCESADOS SIMPLES (HOJUELAS),2024-12-04 20:54:40.266422,380.0,g,13.9
Cereales Bañados con Chocolate Estrellas 2 Cerritos Bolsa 125 gr,S/ 9.90,metro,CEREALES PROCESADOS SIMPLES (HOJUELAS),2024-12-04 20:54:40.266422,125.0,g,9.9
Hojuelas de Chocolate Cocoa Pebbles 311g,S/ 34.90,metro,CEREALES PROCESADOS SIMPLES (HOJUELAS),2024-12-04 20:54:40.266422,311.0,g,34.9
Arrocito Cereal Nuclear 110 g,S/ 4.50,metro,CEREALES PROCESADOS SIMPLES (HOJUELAS),2024-12-04 20:54:40.266422,110.0,g,4.5
Cereales Metro Bolicolor 120g,S/ 3.30,metro,CEREALES PROCESADOS SIMPLES (HOJUELAS),2024-12-04 20:54:40.266422,120.0,g,3.3
Hojuelas de Fruta Fruity Pebbles 311g,S/ 34.90,metro,CEREALES PROCESADOS SIMPLES (HOJUELAS),2024-12-04 20:54:40.266422,311.0,g,34.9
Cereal Milo 320g,S/ 15.50,metro,CEREALES PROCESADOS SIMPLES (HOJUELAS),2024-12-04 20:54:40.266422,320.0,g,15.5
Cereal Insuflado de Trigo Maca Trigo Bio Maca Bolsa 120g,S/ 3.50,metro,CEREALES PROCESADOS SIMPLES (HOJUELAS),2024-12-04 20:54:40.266422,120.0,g,3.5
Cereal de Maíz Trix 90g,S/ 5.00,metro,CEREALES PROCESADOS SIMPLES (HOJUELAS),2024-12-04 20:54:40.266422,90.0,g,5.0
Cereal de Trigo Cuisine & Co Electro Choc 400g,S/ 12.90,metro,CEREALES PROCESADOS SIMPLES (HOJUELAS),2024-12-04 20:54:40.266422,400.0,g,12.9
Cereal Cuisine & Co Fruty Flow 370g,S/ 12.90,metro,CEREALES PROCESADOS SIMPLES (HOJUELAS),2024-12-04 20:54:40.266422,370.0,g,12.9
Spray de Entrenamiento para Perro Simple Solution 473ml,S/ 29.90,metro,CEREALES PROCESADOS SIMPLES (HOJUELAS),2024-12-04 20:54:40.266422,473.0,ml,29.9
Pañales de Entrenamiento para Perros Simple Solution 10un,S/ 30.99,metro,CEREALES PROCESADOS SIMPLES (HOJUELAS),2024-12-04 20:54:40.266422,10.0,un,30.99
Arena Aglomerable para Gatos Simple 4kg,S/ 35.99,metro,CEREALES PROCESADOS SIMPLES (HOJUELAS),2024-12-04 20:54:40.266422,4.0,kg,35.99
Avena Quaker Tradicional 900g,S/ 14.50,metro,CEREALES PROCESADOS SIMPLES (HOJUELAS),2024-12-04 20:54:40.266422,900.0,g,14.5
Piña Golden Metro x kg,S/ 4.99 x kg,metro,CEREALES PROCESADOS SIMPLES (HOJUELAS),2024-12-04 20:54:40.266422,1.0,kg,4.99
Avena Tradicional Cuisine & Co 1kg,S/ 9.90,metro,CEREALES PROCESADOS SIMPLES (HOJUELAS),2024-12-04 20:54:40.266422,1.0,kg,9.9
Granola con Miel de Abeja Unión Doypack 400 g,S/ 16.30,metro,CEREALES PROCESADOS SIMPLES (HOJUELAS),2024-12-04 20:54:40.266422,400.0,g,16.3
Granola con Pasas y Almendras Unión Doypack 400 g,S/ 16.90,metro,CEREALES PROCESADOS SIMPLES (HOJUELAS),2024-12-04 20:54:40.266422,400.0,g,16.9
Ricocan Alimento para Perros Adultos Raza Pequeña Cordero y Cereales Bolsa 15 Kg,S/ 109.90,metro,CEREALES PROCESADOS SIMPLES (HOJUELAS),2024-12-04 20:54:40.266422,15.0,kg,109.9
Avena Natural Santa Catalina 900g,S/ 9.90,metro,CEREALES PROCESADOS SIMPLES (HOJUELAS),2024-12-04 20:54:40.266422,900.0,g,9.9
Avena Precocida 3 Ositos 900g,S/ 11.50,metro,CEREALES PROCESADOS SIMPLES (HOJUELAS),2024-12-04 20:54:40.266422,900.0,g,11.5
Avena Integral en Hojuelas Grano de Oro 500g,S/ 5.50,metro,CEREALES PROCESADOS SIMPLES (HOJUELAS),2024-12-04 20:54:40.266422,500.0,g,5.5
Piña para Jugo x kg,S/ 2.42 x kg,metro,CEREALES PROCESADOS SIMPLES (HOJUELAS),2024-12-04 20:54:40.266422,1.0,kg,2.42
Granola con Granos Andinos Unión Doypack 280 g,S/ 14.60,metro,CEREALES PROCESADOS SIMPLES (HOJUELAS),2024-12-04 20:54:40.266422,280.0,g,14.6
Granola Frutos del Bosque Cuisine & Co 300g,S/ 9.90,metro,CEREALES PROCESADOS SIMPLES (HOJUELAS),2024-12-04 20:54:40.266422,300.0,g,9.9
Avena Quaker Tradicional 500g,S/ 8.90,metro,CEREALES PROCESADOS SIMPLES (HOJUELAS),2024-12-04 20:54:40.266422,500.0,g,8.9
