description,price,website,search_term,scrape_timestamp,cantidad,unidad,price_numeric
Tableta para Taza Sabor Chocolate Clavo y Canela 90g,S/ 2.90,metro,CHOCOLATE EN TABLETA,2024-12-04 21:59:37.820159,90.0,g,2.9
Tableta para Taza Sabor Chocolate 90g,S/ 2.90,metro,CHOCOLATE EN TABLETA,2024-12-04 21:59:37.820159,90.0,g,2.9
Chocolate para Taza 42% Cacao Tableta 90 g,S/ 7.20,metro,CHOCOLATE EN TABLETA,2024-12-04 21:59:37.820159,90.0,g,7.2
Tableta para Taza Sabor Canela y Clavo Tableta 80 g,S/ 2.40,metro,CHOCOLATE EN TABLETA,2024-12-04 21:59:37.820159,80.0,g,2.4
Tableta para Taza Sabor Chocolate Tableta 80 g,S/ 2.40,metro,CHOCOLATE EN TABLETA,2024-12-04 21:59:37.820159,80.0,g,2.4
Tableta para Taza Tableta 90g,S/ 2.90,metro,CHOCOLATE EN TABLETA,2024-12-04 21:59:37.820159,90.0,g,2.9
Chocolate Bitter con Maní Sublime Tableta 40 g Caja 8 unid,S/ 27.90,metro,CHOCOLATE EN TABLETA,2024-12-04 21:59:37.820159,40.0,g,27.9
Chocolate KitKat Tableta 41.5 g,S/ 4.90,metro,CHOCOLATE EN TABLETA,2024-12-04 21:59:37.820159,41.5,g,4.9
Chocolate con Leche con Almendras Sublime Tableta 50 g,S/ 4.90,metro,CHOCOLATE EN TABLETA,2024-12-04 21:59:37.820159,50.0,g,4.9
Chocolate Orgánico 72% Cacao Orquídea Tableta 90 g,S/ 21.50,metro,CHOCOLATE EN TABLETA,2024-12-04 21:59:37.820159,90.0,g,21.5
Chocolate Bitter Orquidea 80% Cacao Tableta 90 gr,S/ 21.50,metro,CHOCOLATE EN TABLETA,2024-12-04 21:59:37.820159,90.0,g,21.5
Chocolate Bitter La Ibérica Fondant Tableta 40 g,S/ 7.50,metro,CHOCOLATE EN TABLETA,2024-12-04 21:59:37.820159,40.0,g,7.5
Chocolate Bitter Sin Azúcar 60% Cacao Orgánico Slender Tableta 100 g,S/ 19.60,metro,CHOCOLATE EN TABLETA,2024-12-04 21:59:37.820159,100.0,g,19.6
Chocolate para Taza 46% Cacao Tableta 90 g,S/ 8.00,metro,CHOCOLATE EN TABLETA,2024-12-04 21:59:37.820159,90.0,g,8.0
Chocolate con Leche Hershey's Tableta 40 g,S/ 3.99,metro,CHOCOLATE EN TABLETA,2024-12-04 21:59:37.820159,40.0,g,3.99
Chocolate Dark Menta Sin Azúcar 60% Cacao Orgánico Slender Tableta 100 g,S/ 19.60,metro,CHOCOLATE EN TABLETA,2024-12-04 21:59:37.820159,100.0,g,19.6
Chocolate Schogetten Trumpf White Tableta 100 g,S/ 9.90,metro,CHOCOLATE EN TABLETA,2024-12-04 21:59:37.820159,100.0,g,9.9
Chocolate Bitter Fondant La Ibérica Tableta 100 g,S/ 16.00,metro,CHOCOLATE EN TABLETA,2024-12-04 21:59:37.820159,100.0,g,16.0
Chocolate con Crema de Maní Princesa Tableta 30 g,S/ 3.80,metro,CHOCOLATE EN TABLETA,2024-12-04 21:59:37.820159,30.0,g,3.8
Chocolate Puro 52% Cacao Sin Azúcar Añadida Valor Tableta 100 g,S/ 12.90,metro,CHOCOLATE EN TABLETA,2024-12-04 21:59:37.820159,100.0,g,12.9
Chocolate Dark Naranja Sin Azucar 60 % Cacao Orgánico Slender Tableta 100 g,S/ 19.60,metro,CHOCOLATE EN TABLETA,2024-12-04 21:59:37.820159,100.0,g,19.6
Chocolate con Leche Hershey's Tableta 92 g,S/ 7.50,metro,CHOCOLATE EN TABLETA,2024-12-04 21:59:37.820159,92.0,g,7.5
Chocolate Schogetten Alpine Milk Hazelnut Tableta 100 g,S/ 9.90,metro,CHOCOLATE EN TABLETA,2024-12-04 21:59:37.820159,100.0,g,9.9
Chocolate con Leche y Almendras Sublime Tableta 100 g,S/ 9.90,metro,CHOCOLATE EN TABLETA,2024-12-04 21:59:37.820159,100.0,g,9.9
Chocolate con Leche con Maní Extremo Sublime Tableta 50 g,S/ 4.80,metro,CHOCOLATE EN TABLETA,2024-12-04 21:59:37.820159,50.0,g,4.8
Chocolate Stracciatella Schogetten Tableta 100 g,S/ 9.90,metro,CHOCOLATE EN TABLETA,2024-12-04 21:59:37.820159,100.0,g,9.9
Chocolate Milky La Iberica Con 30% Almendras y 38% Cacao Tableta 100 g,S/ 20.20,metro,CHOCOLATE EN TABLETA,2024-12-04 21:59:37.820159,100.0,g,20.2
Chocolate Yoghurt Strawberry Schogetten Tableta 100 g,S/ 9.90,metro,CHOCOLATE EN TABLETA,2024-12-04 21:59:37.820159,100.0,g,9.9
Chocolate Puro con Almendras 52% Cacao Sin Azúcar Añadida Valor Tableta 150 g,S/ 24.60,metro,CHOCOLATE EN TABLETA,2024-12-04 21:59:37.820159,150.0,g,24.6
Chocolate de Leche con Almendras Sin Azúcar Añadida Valor Tableta 150 g,S/ 24.60,metro,CHOCOLATE EN TABLETA,2024-12-04 21:59:37.820159,150.0,g,24.6
Chocolate Schogetten Caramel Brownie Tableta 100 g,S/ 9.90,metro,CHOCOLATE EN TABLETA,2024-12-04 21:59:37.820159,100.0,g,9.9
Chocolate Puro Con Mousse Trufa Sin Azúcar Valor Tableta 100 g,S/ 12.90,metro,CHOCOLATE EN TABLETA,2024-12-04 21:59:37.820159,100.0,g,12.9
Chocolate Oscuro sin Azúcar 100% Cacao Extremo Domenico Tableta 70 g,S/ 18.50,metro,CHOCOLATE EN TABLETA,2024-12-04 21:59:37.820159,70.0,g,18.5
Chocolate Blanco con Galletas Sublime Cookies Tableta 100 g,S/ 9.90,metro,CHOCOLATE EN TABLETA,2024-12-04 21:59:37.820159,100.0,g,9.9
Chocolate Leche Avellana Mousse Sin Azúcar Valor Tableta 100 g,S/ 12.90,metro,CHOCOLATE EN TABLETA,2024-12-04 21:59:37.820159,100.0,g,12.9
Chocolate con Almendras Hershey's Tableta 41 gr,S/ 4.20,metro,CHOCOLATE EN TABLETA,2024-12-04 21:59:37.820159,41.0,g,4.2
Chocolate de Leche La Ibérica Tableta 100 g,S/ 16.00,metro,CHOCOLATE EN TABLETA,2024-12-04 21:59:37.820159,100.0,g,16.0
Chocolate Oscuro 70% Cacao Domenico Tableta 70 g,S/ 17.00,metro,CHOCOLATE EN TABLETA,2024-12-04 21:59:37.820159,70.0,g,17.0
Chocolate Milky La Iberica Con 25% Pecanas y Pasas y 38% Cacao Tableta 100 g,S/ 20.20,metro,CHOCOLATE EN TABLETA,2024-12-04 21:59:37.820159,100.0,g,20.2
Chocolate Bitter con Maní Sublime Tableta 100 g,S/ 10.90,metro,CHOCOLATE EN TABLETA,2024-12-04 21:59:37.820159,100.0,g,10.9
Chocolate 70% Dark Toffee Valor Tableta 100 g,S/ 12.90,metro,CHOCOLATE EN TABLETA,2024-12-04 21:59:37.820159,100.0,g,12.9
Chocolate de Leche Sin Azúcar Añadida Valor Tableta 100 g,S/ 12.90,metro,CHOCOLATE EN TABLETA,2024-12-04 21:59:37.820159,100.0,g,12.9
Chocolate con Leche Hershey's Extra Cremoso Tableta 92 g,S/ 7.50,metro,CHOCOLATE EN TABLETA,2024-12-04 21:59:37.820159,92.0,g,7.5
Chocolate Orquidea Bitter Tableta 85 g,S/ 17.50,metro,CHOCOLATE EN TABLETA,2024-12-04 21:59:37.820159,85.0,g,17.5
Chocolate Orgánico 65% Cacao Mild Dark Orquídea Tableta 90 g,S/ 21.50,metro,CHOCOLATE EN TABLETA,2024-12-04 21:59:37.820159,90.0,g,21.5
Chocolate con Leche y Quinua 45% Cacao Orquídea Tableta 80 g,S/ 17.90,metro,CHOCOLATE EN TABLETA,2024-12-04 21:59:37.820159,80.0,g,17.9
Chocolate para Taza Sin Gluten Tableta 300 g,S/ 21.90,metro,CHOCOLATE EN TABLETA,2024-12-04 21:59:37.820159,300.0,g,21.9
Tabletas de Chocolate Monedas del Perú 2 Cerritos Doypack 150 gr,S/ 21.10,metro,CHOCOLATE EN TABLETA,2024-12-04 21:59:37.820159,150.0,g,21.1
Tableta Arcor Rocklets 65g,S/ 3.90,metro,CHOCOLATE EN TABLETA,2024-12-04 21:59:37.820159,65.0,g,3.9
Chocolate con Leche con Castañas 40% Cacao Milky La Ibérica Tableta 100 g,S/ 20.20,metro,CHOCOLATE EN TABLETA,2024-12-04 21:59:37.820159,100.0,g,20.2
Chocolate Orgánico 65% Cacao Nibs de Cacao Orquídea Tableta 90 g,S/ 21.50,metro,CHOCOLATE EN TABLETA,2024-12-04 21:59:37.820159,90.0,g,21.5
Tabletas de Chocolate ChocoFichas 2 Cerritos Bolsa 125 gr,S/ 12.10,metro,CHOCOLATE EN TABLETA,2024-12-04 21:59:37.820159,125.0,g,12.1
Chocolate Bitter Valor 70% Dark Tableta 100 g,S/ 12.90,metro,CHOCOLATE EN TABLETA,2024-12-04 21:59:37.820159,100.0,g,12.9
Chocolate Oscuro 70% Cacao Sal Rosada Domenico Tableta 70 g,S/ 17.00,metro,CHOCOLATE EN TABLETA,2024-12-04 21:59:37.820159,70.0,g,17.0
Chocolate con Leche con Maní Clásico Sublime Tableta 100 g,S/ 9.90,metro,CHOCOLATE EN TABLETA,2024-12-04 21:59:37.820159,100.0,g,9.9
Chocolate Bitter Valor Naranja Tableta 100 g,S/ 12.90,metro,CHOCOLATE EN TABLETA,2024-12-04 21:59:37.820159,100.0,g,12.9
Cobertura Bitter La Ibérica Tableta 200 g,S/ 26.10,metro,CHOCOLATE EN TABLETA,2024-12-04 21:59:37.820159,200.0,g,26.1
Cobertura Sabor a Chocolate Bitter Nestlé Tableta 500 g,S/ 17.20,metro,CHOCOLATE EN TABLETA,2024-12-04 21:59:37.820159,500.0,g,17.2
Alpine Milk Chocolate Schogetten Tableta 100 g,S/ 9.90,metro,CHOCOLATE EN TABLETA,2024-12-04 21:59:37.820159,100.0,g,9.9
Dark Chocolate Schogetten Tableta 100 g,S/ 9.90,metro,CHOCOLATE EN TABLETA,2024-12-04 21:59:37.820159,100.0,g,9.9
Cobertura de Leche La Ibérica Tableta 200 g,S/ 26.10,metro,CHOCOLATE EN TABLETA,2024-12-04 21:59:37.820159,200.0,g,26.1
