unit,description,price,website,search_term,scrape_timestamp,cantidad,unidad,price_numeric
Bolsa 1kg,Sal Marina EMSAL Mesa Bolsa 1Kg,S/ 2.40 un,plaza_vea,HARINA SIETE SEMILLAS O MIXTAS,2024-12-04 12:57:38.588371,1.0,kg,2.4
Bolsa 1kg,Sal Marina EMSAL Cocina Bolsa 1Kg,S/ 2.40 un,plaza_vea,HARINA SIETE SEMILLAS O MIXTAS,2024-12-04 12:57:38.588371,1.0,kg,2.4
Pack 300g,Pack Mixto Queso Edam + Jamón Americano LAIVE ...,S/ 11.90 un,plaza_vea,HARINA SIETE SEMILLAS O MIXTAS,2024-12-04 12:57:38.588371,300.0,g,11.9
Bolsa 1kg,Harina de Trigo Preparada BLANCA FLOR Bolsa 1K...,S/ 8.49 un,plaza_vea,HARINA SIETE SEMILLAS O MIXTAS,2024-12-04 12:57:38.588371,1.0,kg,8.49
Bolsa 1kg,Harina BELL'S De trigo preparada Bolsa 1Kg,S/ 6.90 un,plaza_vea,HARINA SIETE SEMILLAS O MIXTAS,2024-12-04 12:57:38.588371,1.0,kg,6.9
Bolsa 200g,Sémola MOLITALIA Bolsa 200g,S/ 1.70 un,plaza_vea,HARINA SIETE SEMILLAS O MIXTAS,2024-12-04 12:57:38.588371,200.0,g,1.7
Bolsa 1kg,Harina de Trigo sin Preparar BELL'S Bolsa 1Kg,S/ 4.29 un,plaza_vea,HARINA SIETE SEMILLAS O MIXTAS,2024-12-04 12:57:38.588371,1.0,kg,4.29
Bolsa 600g,Pan de Molde Blanco BIMBO Vital de Semillas Bo...,S/ 14.80 un,plaza_vea,HARINA SIETE SEMILLAS O MIXTAS,2024-12-04 12:57:38.588371,600.0,g,14.8
Bolsa 180g,Sémola de Trigo Duro BELL'S Bolsa 180g,S/ 1.09 un,plaza_vea,HARINA SIETE SEMILLAS O MIXTAS,2024-12-04 12:57:38.588371,180.0,g,1.09
Pack 340g,Pack Mixto Jamón Pizza y Queso Edam OTTO KUNZ ...,S/ 14.50 un,plaza_vea,HARINA SIETE SEMILLAS O MIXTAS,2024-12-04 12:57:38.588371,340.0,g,14.5
Paquete 1kg,Harina Sin Preparar FAVORITA Paquete 1kg,S/ 4.50 un,plaza_vea,HARINA SIETE SEMILLAS O MIXTAS,2024-12-04 12:57:38.588371,1.0,kg,4.5
Bolsa 1kg,Harina de Maíz Blanco P.A.N. Precocida Bolsa 1...,S/ 9.50 un,plaza_vea,HARINA SIETE SEMILLAS O MIXTAS,2024-12-04 12:57:38.588371,1.0,kg,9.5
Pote 450g,Margarina Light DORINA Pote 450g,S/ 11.50 un,plaza_vea,HARINA SIETE SEMILLAS O MIXTAS,2024-12-04 12:57:38.588371,450.0,g,11.5
Bolsa 360g,Pan de Molde BIMBO Vital Semillas Bolsa 360g,S/ 10.50 un,plaza_vea,HARINA SIETE SEMILLAS O MIXTAS,2024-12-04 12:57:38.588371,360.0,g,10.5
Paquete 340g,Pack Mixto BRAEDT Jamón York + Queso Gouda 340...,S/ 14.99 un,plaza_vea,HARINA SIETE SEMILLAS O MIXTAS,2024-12-04 12:57:38.588371,340.0,g,14.99
Pote 450g,Margarina Clásica DORINA Pote 450g,S/ 11.50 un,plaza_vea,HARINA SIETE SEMILLAS O MIXTAS,2024-12-04 12:57:38.588371,450.0,g,11.5
Botella 500ml,Desinfectante de Baño PATO Líquido Marina Bote...,S/ 16.60 un,plaza_vea,HARINA SIETE SEMILLAS O MIXTAS,2024-12-04 12:57:38.588371,500.0,ml,16.6
Bolsa 180g,Harina sin Preparar MOLITALIA Bolsa 180g,S/ 1.20 un,plaza_vea,HARINA SIETE SEMILLAS O MIXTAS,2024-12-04 12:57:38.588371,180.0,g,1.2
Bolsa 1kg,Harina sin Preparar BLANCA FLOR Bolsa 1kg,S/ 7.50 un,plaza_vea,HARINA SIETE SEMILLAS O MIXTAS,2024-12-04 12:57:38.588371,1.0,kg,7.5
Caja 126g,Galletas de Maíz SALMAS Horneadas con Granos y...,S/ 10.90 un,plaza_vea,HARINA SIETE SEMILLAS O MIXTAS,2024-12-04 12:57:38.588371,126.0,g,10.9
Bolsa 1kg,Harina de Trigo NICOLINI Preparada Bolsa 1Kg,S/ 6.99 un,plaza_vea,HARINA SIETE SEMILLAS O MIXTAS,2024-12-04 12:57:38.588371,1.0,kg,6.99
Bolsa 1kg,Harina de Trigo sin Preparar MOLITALIA sin Pre...,S/ 6.50 un,plaza_vea,HARINA SIETE SEMILLAS O MIXTAS,2024-12-04 12:57:38.588371,1.0,kg,6.5
Pote 900g,Margarina Clásica DORINA Pote 900g,S/ 20.50 un,plaza_vea,HARINA SIETE SEMILLAS O MIXTAS,2024-12-04 12:57:38.588371,900.0,g,20.5
Bolsa 260g,Tortillas de Maíz NACHOS Mixtas Bolsa 260g,S/ 12.30 un,plaza_vea,HARINA SIETE SEMILLAS O MIXTAS,2024-12-04 12:57:38.588371,260.0,g,12.3
Bolsa 1kg,Harina MOLITALIA Preparada Bolsa 1kg,S/ 7.60 un,plaza_vea,HARINA SIETE SEMILLAS O MIXTAS,2024-12-04 12:57:38.588371,1.0,kg,7.6
Bolsa 500g,Pan de Molde Integral 6 Semillas LA FLORENCIA ...,S/ 12.90 un,plaza_vea,HARINA SIETE SEMILLAS O MIXTAS,2024-12-04 12:57:38.588371,500.0,g,12.9
Paquete 3un,Desinfectante de Baño PATO Pastilla Fragancia ...,S/ 23 un,plaza_vea,HARINA SIETE SEMILLAS O MIXTAS,2024-12-04 12:57:38.588371,3.0,un,23.0
Bolsa 1Kg,Harina Integral GRANO DE ORO Bolsa 1Kg,S/ 7.50 un,plaza_vea,HARINA SIETE SEMILLAS O MIXTAS,2024-12-04 12:57:38.588371,1.0,kg,7.5
Bolsa 400g,Harina de Avena MI TIERRA Sin Gluten Bolsa 400...,S/ 9.90 un,plaza_vea,HARINA SIETE SEMILLAS O MIXTAS,2024-12-04 12:57:38.588371,400.0,g,9.9
Bolsa 170g,Multicereales 7 Semillas ACSUR Bolsa 150g,S/ 4.40 un,plaza_vea,HARINA SIETE SEMILLAS O MIXTAS,2024-12-04 12:57:38.588371,170.0,g,4.4
Pote 220g,Margarina Light DORINA Pote 220g,S/ 6.90 un,plaza_vea,HARINA SIETE SEMILLAS O MIXTAS,2024-12-04 12:57:38.588371,220.0,g,6.9
Pack 750ml,Pack Gin TANQUERAY Flor de Sevilla Botella 700...,S/ 87.90 un,plaza_vea,HARINA SIETE SEMILLAS O MIXTAS,2024-12-04 12:57:38.588371,750.0,ml,87.9
Bolsa 48un,Toallitas Húmedas para Bebé HUGGIES Manitos y ...,S/ 7.50 un,plaza_vea,HARINA SIETE SEMILLAS O MIXTAS,2024-12-04 12:57:38.588371,48.0,un,7.5
Bolsa 200g,Harina 7 Semillas LA CASA MARIMIEL Bolsa 200g,S/ 8.80 un,plaza_vea,HARINA SIETE SEMILLAS O MIXTAS,2024-12-04 12:57:38.588371,200.0,g,8.8
Frasco 1L,Limpiavidrios BOREAL Brisa Marina Frasco 1000m...,S/ 8.90 un,plaza_vea,HARINA SIETE SEMILLAS O MIXTAS,2024-12-04 12:57:38.588371,1.0,l,8.9
Doypack 184g,Mezcla en Polvo MISKÍSIMOO 7 Semillas Doypack ...,S/ 9.90 un,plaza_vea,HARINA SIETE SEMILLAS O MIXTAS,2024-12-04 12:57:38.588371,184.0,g,9.9
Bolsa 1kg,Harina de Trigo NICOLINI Sin Preparar Bolsa 1K...,S/ 6.10 un,plaza_vea,HARINA SIETE SEMILLAS O MIXTAS,2024-12-04 12:57:38.588371,1.0,kg,6.1
Bandeja 500g,Ensalada Mixta BELL'S Bandeja 500g,S/ 10.99 un,plaza_vea,HARINA SIETE SEMILLAS O MIXTAS,2024-12-04 12:57:38.588371,500.0,g,10.99
Pote 220g,Margarina Clásica DORINA Pote 220g,S/ 6.90 un,plaza_vea,HARINA SIETE SEMILLAS O MIXTAS,2024-12-04 12:57:38.588371,220.0,g,6.9
Bolsa 135g,Papas LAY'S Artesanas Sal Marina Bolsa 135g,S/ 6.50 un,plaza_vea,HARINA SIETE SEMILLAS O MIXTAS,2024-12-04 12:57:38.588371,135.0,g,6.5
Caja 5un,Barra Nibs de Cacao y Cañihua SIETE DRAGONES C...,S/ 18.80 un,plaza_vea,HARINA SIETE SEMILLAS O MIXTAS,2024-12-04 12:57:38.588371,5.0,un,18.8
Doypack 500g,Sal Marina de Mesa EMSAL Ecológica Doypack 500...,S/ 4.59 un,plaza_vea,HARINA SIETE SEMILLAS O MIXTAS,2024-12-04 12:57:38.588371,500.0,g,4.59
Bolsa 1kg,Harina de Maíz Amarillo P.A.N. Precocida Bolsa...,S/ 9.50 un,plaza_vea,HARINA SIETE SEMILLAS O MIXTAS,2024-12-04 12:57:38.588371,1.0,kg,9.5
Bandeja 500g,Sopa Mixta BELL'S Bandeja 500g,S/ 9.99 un,plaza_vea,HARINA SIETE SEMILLAS O MIXTAS,2024-12-04 12:57:38.588371,500.0,g,9.99
Bolsa 300g,Cereal NATURANDES Harina de linaza Bolsa 300Gr,S/ 10 un,plaza_vea,HARINA SIETE SEMILLAS O MIXTAS,2024-12-04 12:57:38.588371,300.0,g,10.0
Bolsa 34g,Papas Artesanales LAYS Sal Marina Bolsa 34g,S/ 2.49 un,plaza_vea,HARINA SIETE SEMILLAS O MIXTAS,2024-12-04 12:57:38.588371,34.0,g,2.49
Bolsa 1Kg,Harina de Arroz COSTEÑO Bolsa 1kg,S/ 8.90 un,plaza_vea,HARINA SIETE SEMILLAS O MIXTAS,2024-12-04 12:57:38.588371,1.0,kg,8.9
Paquete 80un,Toallitas Húmedas HUGGIES Manitos y Carita Paq...,S/ 9.90 un,plaza_vea,HARINA SIETE SEMILLAS O MIXTAS,2024-12-04 12:57:38.588371,80.0,un,9.9
Doypack 300g,Harina de Avena Integral LA CASA MARIMIEL Doyp...,S/ 13.90 un,plaza_vea,HARINA SIETE SEMILLAS O MIXTAS,2024-12-04 12:57:38.588371,300.0,g,13.9
Bolsa 200g,Harina de Linaza LA CASA MARIMIEL Bolsa 200g,S/ 6.70 un,plaza_vea,HARINA SIETE SEMILLAS O MIXTAS,2024-12-04 12:57:38.588371,200.0,g,6.7
Bolsa 200g,Harina de Maca LA CASA MARIMIEL Bolsa 200g,S/ 15.50 un,plaza_vea,HARINA SIETE SEMILLAS O MIXTAS,2024-12-04 12:57:38.588371,200.0,g,15.5
Bolsa 142g,Papas Nativas Mixtas TIYAPUY Bolsa 142g,S/ 7.60 un,plaza_vea,HARINA SIETE SEMILLAS O MIXTAS,2024-12-04 12:57:38.588371,142.0,g,7.6
Paquete 1kg,Harina Preparada GRANO DE ORO Paquete 1Kg,S/ 6.99 un,plaza_vea,HARINA SIETE SEMILLAS O MIXTAS,2024-12-04 12:57:38.588371,1.0,kg,6.99
Doypack 400g,Harina de Almendras LA CASA MARIMIEL Doypaack ...,S/ 37.90 un,plaza_vea,HARINA SIETE SEMILLAS O MIXTAS,2024-12-04 12:57:38.588371,400.0,g,37.9
Bolsa 150g,Harina de Haba Tostada COSECHA DEL SUR Bolsa 1...,S/ 4.20 un,plaza_vea,HARINA SIETE SEMILLAS O MIXTAS,2024-12-04 12:57:38.588371,150.0,g,4.2
Doypack 100g,Mostaza LIBBY'S Base de semilla de mostaza Doy...,S/ 3.80 un,plaza_vea,HARINA SIETE SEMILLAS O MIXTAS,2024-12-04 12:57:38.588371,100.0,g,3.8
Bolsa 1kg,Harina LA CASA MARIMEL Integral Bolsa 1Kg,S/ 12.90 un,plaza_vea,HARINA SIETE SEMILLAS O MIXTAS,2024-12-04 12:57:38.588371,1.0,kg,12.9
Frasco 113g,Colado HEINZ Fruta Mixtas Frasco 113g,S/ 4 un,plaza_vea,HARINA SIETE SEMILLAS O MIXTAS,2024-12-04 12:57:38.588371,113.0,g,4.0
Bolsa 160g,Multicereales COSECHA DEL SUR 7 Semillas Choco...,S/ 4.40 un,plaza_vea,HARINA SIETE SEMILLAS O MIXTAS,2024-12-04 12:57:38.588371,160.0,g,4.4
Paquete 6un,Bizcocho COSTA Caritas Paquete 6un,S/ 3.79 un,plaza_vea,HARINA SIETE SEMILLAS O MIXTAS,2024-12-04 12:57:38.588371,6.0,un,3.79
Bolsa 200g,Harina de Cañihua LA CASA MARIMEL Bolsa 200g,S/ 13.40 un,plaza_vea,HARINA SIETE SEMILLAS O MIXTAS,2024-12-04 12:57:38.588371,200.0,g,13.4
Caja 5un,Barra Chía y Coco SIETE DRAGONES Caja 5un,S/ 19.90 un,plaza_vea,HARINA SIETE SEMILLAS O MIXTAS,2024-12-04 12:57:38.588371,5.0,un,19.9
Bolsa 200g,Cereal NATURANDES Harina 7 semillas Bolsa 200G...,S/ 10.90 un,plaza_vea,HARINA SIETE SEMILLAS O MIXTAS,2024-12-04 12:57:38.588371,200.0,g,10.9
Bolsa 200g,Harina de Quinua LA CASA MARIMIEL Bolsa 200g,S/ 12.50 un,plaza_vea,HARINA SIETE SEMILLAS O MIXTAS,2024-12-04 12:57:38.588371,200.0,g,12.5
Doypack 460g,Harina 7 Semillas NATURANDES Chocolate Doypack...,S/ 29.50 un,plaza_vea,HARINA SIETE SEMILLAS O MIXTAS,2024-12-04 12:57:38.588371,460.0,g,29.5
Bolsa 1kg,Harina Sin Preparar GRANO DE ORO Bolsa 1Kg,S/ 6 un,plaza_vea,HARINA SIETE SEMILLAS O MIXTAS,2024-12-04 12:57:38.588371,1.0,kg,6.0
Bolsa 200g,Harina de Maca Negra LA CASA MARIMIEL Bolsa 20...,S/ 28.90 un,plaza_vea,HARINA SIETE SEMILLAS O MIXTAS,2024-12-04 12:57:38.588371,200.0,g,28.9
Doypack 216g,Harina Mix Proteína NATURANDES Doypack 216g,S/ 23 un,plaza_vea,HARINA SIETE SEMILLAS O MIXTAS,2024-12-04 12:57:38.588371,216.0,g,23.0
Doypack 250g,Salvado de Trigo con Harina de Linaza GRANO DE...,S/ 8.90 un,plaza_vea,HARINA SIETE SEMILLAS O MIXTAS,2024-12-04 12:57:38.588371,250.0,g,8.9
Bolsa 80g,Harina de Avena BELL'S Vainilla Bolsa 80g,S/ 1.20 un,plaza_vea,HARINA SIETE SEMILLAS O MIXTAS,2024-12-04 12:57:38.588371,80.0,g,1.2
Doypack 160g,Mix Fibra NATURANDES Semillas Doypack 160g,S/ 15.50 un,plaza_vea,HARINA SIETE SEMILLAS O MIXTAS,2024-12-04 12:57:38.588371,160.0,g,15.5
