description,brand,cantidad,unidad,price_numeric,website,scrape_timestamp,search_term,cantidad_escalada,unidad_escalada,price_numeric_escalado
Aceite de Soya VEGA Botella 500ml,Vega,500.0,ml,4.3,vega,2024-12-05 12:28:47.117979,ACEITE VEGETAL ENVASADO,1.0,l,8.6
Aceite Vegetal Del Cielo Botella x 900 mL,,900.0,ml,5.8,tottus,2024-12-05 11:52:34.523088,ACEITE VEGETAL ENVASADO,1.0,l,6.444444444444445
Aceite VEGA de Soya Botella 900ml,Vega,900.0,ml,5.8,vega,2024-12-05 12:28:47.117979,ACEITE VEGETAL ENVASADO,1.0,l,6.444444444444445
Aceite Vegetal Máxima 900ml,,900.0,ml,5.8,metro,2024-12-05 15:51:25.925663,ACEITE VEGETAL ENVASADO,1.0,l,6.444444444444445
Aceite Vegetal Máxima 900ml,,900.0,ml,5.8,metro,2024-12-05 15:51:25.925663,ACEITE VEGETAL ENVASADO,1.0,l,6.444444444444445
Aceite Vegetal Metro 900ml,,900.0,ml,5.9,metro,2024-12-05 15:51:25.925663,ACEITE VEGETAL ENVASADO,1.0,l,6.555555555555556
Aceite Vegetal Metro 900ml,,900.0,ml,5.9,metro,2024-12-05 15:51:25.925663,ACEITE VEGETAL ENVASADO,1.0,l,6.555555555555556
Aceite de Soya SOYA Botella 900ml,SOYA,900.0,ml,6.1,vivanda,2024-12-05 21:57:06.369987,ACEITE VEGETAL ENVASADO,1.0,l,6.777777777777778
Aceite de Soya Sao Botella 900ml,,900.0,ml,6.6,metro,2024-12-05 15:51:25.925663,ACEITE VEGETAL ENVASADO,1.0,l,7.333333333333333
Aceite Vegetal Premium 900mL,DELEITE,900.0,ml,6.8,tottus,2024-12-05 11:52:34.523088,ACEITE VEGETAL ENVASADO,1.0,l,7.555555555555555
Aceite 100% Vegetal Premium 900mL,ALPA,900.0,ml,7.6,tottus,2024-12-05 11:52:34.523088,ACEITE VEGETAL ENVASADO,1.0,l,8.444444444444445
Aceite de Girasol Cuisine & Co 900ml,,900.0,ml,7.9,wong,2024-12-05 18:25:04.371161,ACEITE VEGETAL ENVASADO,1.0,l,8.777777777777779
Aceite de Girasol Cuisine & Co 900ml,,900.0,ml,7.9,wong,2024-12-05 18:25:04.371161,ACEITE VEGETAL ENVASADO,1.0,l,8.777777777777779
Aceite de Girasol Mucho Gussto 900ml,,900.0,ml,7.9,metro,2024-12-05 15:51:25.925663,ACEITE VEGETAL ENVASADO,1.0,l,8.777777777777779
Aceite Vegetal Cuisine & Co 900ml,,900.0,ml,8.9,wong,2024-12-05 18:25:04.371161,ACEITE VEGETAL ENVASADO,1.0,l,9.88888888888889
Aceite de Soya Costeño 900ml,,900.0,ml,9.0,metro,2024-12-05 15:51:25.925663,ACEITE VEGETAL ENVASADO,1.0,l,10.0
Aceite Vegetal PRIMOR Clásico Botella 900ml,PRIMOR,900.0,ml,9.5,vivanda,2024-12-05 21:57:06.369987,ACEITE VEGETAL ENVASADO,1.0,l,10.555555555555555
Aceite vegetal de 900 mL,PRIMOR,900.0,ml,9.5,tottus,2024-12-05 11:52:34.523088,ACEITE VEGETAL ENVASADO,1.0,l,10.555555555555555
Aceite Vegetal PRIMOR Premium Botella 900L,Primor,900.0,l,9.5,vega,2024-12-05 12:28:47.117979,ACEITE VEGETAL ENVASADO,1.0,l,0.010555555555555556
Aceite Vegetal Primor Clásico Botella 900ml,,900.0,ml,9.6,metro,2024-12-05 15:51:25.925663,ACEITE VEGETAL ENVASADO,1.0,l,10.666666666666666
Aceite Vegetal Primor Clásico Botella 900ml,,900.0,ml,9.8,wong,2024-12-05 18:25:04.371161,ACEITE VEGETAL ENVASADO,1.0,l,10.88888888888889
Aceite vegetal Premium de 900 mL,PRIMOR,900.0,ml,10.5,tottus,2024-12-05 11:52:34.523088,ACEITE VEGETAL ENVASADO,1.0,l,11.666666666666668
Aceite Vegetal PRIMOR Premium Botella 900ml,PRIMOR,900.0,ml,10.5,vivanda,2024-12-05 21:57:06.369987,ACEITE VEGETAL ENVASADO,1.0,l,11.666666666666668
Aceite Vegetal Primor Premium Botella 900ml,,900.0,ml,10.6,metro,2024-12-05 15:51:25.925663,ACEITE VEGETAL ENVASADO,1.0,l,11.777777777777779
Aceite de Ajonjolí Tostado Q'inti Botella 100 ml,,100.0,ml,11.1,wong,2024-12-05 18:25:04.371161,ACEITE VEGETAL ENVASADO,1.0,l,111.0
Aceite de Canola Cuisine & Co Botella 1 lt,,1.0,l,11.9,wong,2024-12-05 18:25:04.371161,ACEITE VEGETAL ENVASADO,1.0,l,11.9
Aceite Ajonjoli Olivos Del Sur 100 ml,,100.0,ml,12.4,metro,2024-12-05 15:51:25.925663,ACEITE VEGETAL ENVASADO,1.0,l,124.0
Aceite de Girasol BASSO Botella 1L,BASSO,1.0,l,12.9,vivanda,2024-12-05 21:57:06.369987,ACEITE VEGETAL ENVASADO,1.0,l,12.9
Aceite de Ajonjolí Bárcidda 270ml,,270.0,ml,12.9,metro,2024-12-05 15:51:25.925663,ACEITE VEGETAL ENVASADO,1.0,l,47.77777777777777
Aceite de Girasol Cuisine & Co 900ml,,900.0,ml,12.9,metro,2024-12-05 15:51:25.925663,ACEITE VEGETAL ENVASADO,1.0,l,14.333333333333334
Aceite de Ajonjolí Bárcidda 270ml,,270.0,ml,13.1,wong,2024-12-05 18:25:04.371161,ACEITE VEGETAL ENVASADO,1.0,l,48.51851851851851
Aceite de Maíz BASSO Botella 1L,BASSO,1.0,l,14.5,vivanda,2024-12-05 21:57:06.369987,ACEITE VEGETAL ENVASADO,1.0,l,14.5
Aceite De Girasol Borges Botella 1 L,,1.0,l,14.5,metro,2024-12-05 15:51:25.925663,ACEITE VEGETAL ENVASADO,1.0,l,14.5
Aceite de Ajonjolí Olivos del Sur 200ml,,200.0,ml,14.5,metro,2024-12-05 15:51:25.925663,ACEITE VEGETAL ENVASADO,1.0,l,72.5
Aceite de Oliva BELL'S Puro Botella 200ml,BELL'S,200.0,ml,15.9,vivanda,2024-12-05 21:57:06.369987,ACEITE VEGETAL ENVASADO,1.0,l,79.5
Agua Micelar en Aceite Garnier Skin Active 100ml,,100.0,ml,16.5,metro,2024-12-05 15:51:25.925663,ACEITE VEGETAL ENVASADO,1.0,l,165.0
Aceite De Canola Borges Botella 1 Litro,,1.0,l,16.5,metro,2024-12-05 15:51:25.925663,ACEITE VEGETAL ENVASADO,1.0,l,16.5
Aceite Vegetal Primor Clásico Botella 1.8L,,1.8,l,16.5,metro,2024-12-05 15:51:25.925663,ACEITE VEGETAL ENVASADO,1.0,l,9.166666666666668
Twopack Aceite Vegetal Primor Clásico 900ml,,900.0,ml,16.7,metro,2024-12-05 15:51:25.925663,ACEITE VEGETAL ENVASADO,1.0,l,18.555555555555557
Aceite de ManÍ BASSO Botella 1L,BASSO,1.0,l,16.9,vivanda,2024-12-05 21:57:06.369987,ACEITE VEGETAL ENVASADO,1.0,l,16.9
Aceite De Canola Borges Botella 1 Litro,,1.0,l,16.9,wong,2024-12-05 18:25:04.371161,ACEITE VEGETAL ENVASADO,1.0,l,16.9
Aceite de Oliva El Olivar Extra Virgen Botella 200 ml,,200.0,ml,17.9,metro,2024-12-05 15:51:25.925663,ACEITE VEGETAL ENVASADO,1.0,l,89.5
Aceite Vegetal PRIMOR Clásico Botella 900L x2u,Primor,900.0,l,18.2,vega,2024-12-05 12:28:47.117979,ACEITE VEGETAL ENVASADO,1.0,l,0.02022222222222222
Twopack Aceite Vegetal Primor Premium 900ml,,900.0,ml,18.5,metro,2024-12-05 15:51:25.925663,ACEITE VEGETAL ENVASADO,1.0,l,20.555555555555557
Aceite de Oliva Cuisine & Co 250ml,,250.0,ml,18.9,metro,2024-12-05 15:51:25.925663,ACEITE VEGETAL ENVASADO,1.0,l,75.6
Aceite Oliva Cuisine & Co 250ml,,250.0,ml,18.9,metro,2024-12-05 15:51:25.925663,ACEITE VEGETAL ENVASADO,1.0,l,75.6
Aceite para Bebés Dr Zaidman 200ml,,200.0,ml,19.5,metro,2024-12-05 15:51:25.925663,ACEITE VEGETAL ENVASADO,1.0,l,97.5
Aceite de Oliva HUERTO ALAMEIN Extra Virgen Botella 200ml,HUERTO ALAMEIN,200.0,ml,19.5,vivanda,2024-12-05 21:57:06.369987,ACEITE VEGETAL ENVASADO,1.0,l,97.5
Aceite Oliva Cuisine & Co 250ml,,250.0,ml,19.8,wong,2024-12-05 18:25:04.371161,ACEITE VEGETAL ENVASADO,1.0,l,79.2
Aceite de Oliva Cuisine & Co 250ml,,250.0,ml,19.8,wong,2024-12-05 18:25:04.371161,ACEITE VEGETAL ENVASADO,1.0,l,79.2
Aceite de Oliva Borges Extra Virgen Botella 250 ml,,250.0,ml,19.9,wong,2024-12-05 18:25:04.371161,ACEITE VEGETAL ENVASADO,1.0,l,79.6
Aceite de Oliva Sabor Suave Botella 200 ml,,200.0,ml,20.5,metro,2024-12-05 15:51:25.925663,ACEITE VEGETAL ENVASADO,1.0,l,102.5
Aceite De Oliva Puro El Olivar Botella 200 ml,,200.0,ml,20.9,metro,2024-12-05 15:51:25.925663,ACEITE VEGETAL ENVASADO,1.0,l,104.5
Aceite de Oliva Oli21 Extra Virgen 200ml,,200.0,ml,20.9,metro,2024-12-05 15:51:25.925663,ACEITE VEGETAL ENVASADO,1.0,l,104.5
Aceite de Coco Olivos del Sur 200ml,,200.0,ml,20.99,metro,2024-12-05 15:51:25.925663,ACEITE VEGETAL ENVASADO,1.0,l,104.94999999999999
Aceite de Oliva TIMONEL Extra Virgen Botella 200ml,Timonel,200.0,ml,21.2,vega,2024-12-05 12:28:47.117979,ACEITE VEGETAL ENVASADO,1.0,l,106.0
Aceite para Bebés Dr Zaidman 200ml,,200.0,ml,21.2,wong,2024-12-05 18:25:04.371161,ACEITE VEGETAL ENVASADO,1.0,l,106.0
Aceite De Arroz Costeño Botella 900 ml,,900.0,ml,21.7,metro,2024-12-05 15:51:25.925663,ACEITE VEGETAL ENVASADO,1.0,l,24.11111111111111
Aceite de Oliva Extra Virgen Carbonell Botella 250 ml,,250.0,ml,21.9,wong,2024-12-05 18:25:04.371161,ACEITE VEGETAL ENVASADO,1.0,l,87.6
Aceite de Oliva Extra Virgen Carbonell Botella 250 ml,,250.0,ml,21.9,metro,2024-12-05 15:51:25.925663,ACEITE VEGETAL ENVASADO,1.0,l,87.6
Aceite de Oliva El Olivar Virgen Botella 200 ml,,200.0,ml,22.4,metro,2024-12-05 15:51:25.925663,ACEITE VEGETAL ENVASADO,1.0,l,112.0
Aceite de Oliva La Española Puro Botella 250 ml,,250.0,ml,22.5,metro,2024-12-05 15:51:25.925663,ACEITE VEGETAL ENVASADO,1.0,l,90.0
Aceite de Oliva La Española Puro Botella 250 ml,,250.0,ml,22.9,wong,2024-12-05 18:25:04.371161,ACEITE VEGETAL ENVASADO,1.0,l,91.6
Aceite de Tratamiento TONNO Óleo Reparador Argán Frasco 50ml,TONNO,50.0,ml,23.5,vivanda,2024-12-05 21:57:06.369987,ACEITE VEGETAL ENVASADO,1.0,l,470.0
Aceite de Coco Orgánico Peruvian Health Frasco 250 ml,,250.0,ml,24.1,metro,2024-12-05 15:51:25.925663,ACEITE VEGETAL ENVASADO,1.0,l,96.4
Aceite de Maíz Arcor 900ml,,900.0,ml,24.2,wong,2024-12-05 18:25:04.371161,ACEITE VEGETAL ENVASADO,1.0,l,26.88888888888889
Aceite de Oliva VALDEPORRES Extra Virgen Botella 250ml,VALDEPORRES,250.0,ml,24.6,vivanda,2024-12-05 21:57:06.369987,ACEITE VEGETAL ENVASADO,1.0,l,98.4
Aceite de Oliva Virgen Botella 200 ml,,200.0,ml,24.65,metro,2024-12-05 15:51:25.925663,ACEITE VEGETAL ENVASADO,1.0,l,123.25
Aceite De Oliva Extra Suave Borges Botella 500 ml,,500.0,ml,24.9,wong,2024-12-05 18:25:04.371161,ACEITE VEGETAL ENVASADO,1.0,l,49.8
Aceite de Oliva CARBONELL Puro Frasco 200ml,CARBONELL,200.0,ml,25.1,vivanda,2024-12-05 21:57:06.369987,ACEITE VEGETAL ENVASADO,1.0,l,125.5
Aceite de Oliva CARBONELL Extra Virgen Spray 200ml,CARBONELL,200.0,ml,25.1,vivanda,2024-12-05 21:57:06.369987,ACEITE VEGETAL ENVASADO,1.0,l,125.5
Aceite Vegetal Primor Premium 900ml + Mayonesa AlaCena 850g,,900.0,ml,25.5,metro,2024-12-05 15:51:25.925663,ACEITE VEGETAL ENVASADO,1.0,l,28.333333333333336
Aceite Vegetal Primor Premium 900ml + Mayonesa AlaCena 850g,,900.0,ml,25.5,wong,2024-12-05 18:25:04.371161,ACEITE VEGETAL ENVASADO,1.0,l,28.333333333333336
Aceite de Oliva La Española Extra Virgen Botella 250 ml,,250.0,ml,25.7,wong,2024-12-05 18:25:04.371161,ACEITE VEGETAL ENVASADO,1.0,l,102.8
Aceite de Oliva ACAVILLE Extra Virgen Gourmet Botella 250ml,ACAVILLE,250.0,ml,25.7,vivanda,2024-12-05 21:57:06.369987,ACEITE VEGETAL ENVASADO,1.0,l,102.8
Aceite Sacha Inchi Nutriomega Extra Virgen Botella 250 ml,,250.0,ml,25.8,metro,2024-12-05 15:51:25.925663,ACEITE VEGETAL ENVASADO,1.0,l,103.2
Aceite de Oliva Carbonell Extra Virgen Spray 200 ml,,200.0,ml,25.9,wong,2024-12-05 18:25:04.371161,ACEITE VEGETAL ENVASADO,1.0,l,129.5
Aceite de Sacha Inchi Extra Virgen Qhalikay Botella 250 ml,,250.0,ml,26.7,wong,2024-12-05 18:25:04.371161,ACEITE VEGETAL ENVASADO,1.0,l,106.8
Aceite de Oliva Filippo Berio Extra Virgen 250ml,,250.0,ml,27.5,metro,2024-12-05 15:51:25.925663,ACEITE VEGETAL ENVASADO,1.0,l,110.0
Aceite de Oliva Filippo Berio Extra Virgen 250ml,,250.0,ml,27.9,wong,2024-12-05 18:25:04.371161,ACEITE VEGETAL ENVASADO,1.0,l,111.6
Aceite De Oliva En Spray La Española Frasco 200 ml,,200.0,ml,27.9,metro,2024-12-05 15:51:25.925663,ACEITE VEGETAL ENVASADO,1.0,l,139.5
Aceite de Coco Orgánico Cuisine & Co 350ml,,350.0,ml,28.1,metro,2024-12-05 15:51:25.925663,ACEITE VEGETAL ENVASADO,1.0,l,80.28571428571429
Aceite de Coco Gatti Extra Virgen Frasco 200 ml,,200.0,ml,28.2,wong,2024-12-05 18:25:04.371161,ACEITE VEGETAL ENVASADO,1.0,l,141.0
Aceite VEGA Botella 900ml + Azúcar Rubia VEGA 5kg,Vega,900.0,ml,28.3,vega,2024-12-05 12:28:47.117979,ACEITE VEGETAL ENVASADO,1.0,l,31.444444444444446
Aceite de Ajonjolí Q'inti Extra Virgen Botella 250 ml,,250.0,ml,28.9,wong,2024-12-05 18:25:04.371161,ACEITE VEGETAL ENVASADO,1.0,l,115.6
Aceite de Oliva CREMONINI Extra Virgen Botella 250ml,CREMONINI,250.0,ml,28.9,vivanda,2024-12-05 21:57:06.369987,ACEITE VEGETAL ENVASADO,1.0,l,115.6
Aceite de Coco Olivos del Sur 350ml,,350.0,ml,28.99,metro,2024-12-05 15:51:25.925663,ACEITE VEGETAL ENVASADO,1.0,l,82.82857142857142
Aceite de Coco Orgánico Cuisine & Co 350ml,,350.0,ml,29.2,wong,2024-12-05 18:25:04.371161,ACEITE VEGETAL ENVASADO,1.0,l,83.42857142857143
Aceite de Oliva con Ajo El Olivar Botella 250ml,,250.0,ml,29.9,wong,2024-12-05 18:25:04.371161,ACEITE VEGETAL ENVASADO,1.0,l,119.6
Aceite de Oliva EL OLIVAR Extra Virgen Botella 250ml,EL OLIVAR,250.0,ml,30.5,vivanda,2024-12-05 21:57:06.369987,ACEITE VEGETAL ENVASADO,1.0,l,122.0
Aceite Vegetal de Soya Máxima 5L,,5.0,l,31.9,metro,2024-12-05 15:51:25.925663,ACEITE VEGETAL ENVASADO,1.0,l,6.38
Aceite de Oliva Extra Virgen Olivos del Sur 250ml,,250.0,ml,32.5,wong,2024-12-05 18:25:04.371161,ACEITE VEGETAL ENVASADO,1.0,l,130.0
Aceite de Oliva El Olivar Extra Virgen Botella 250ml,,250.0,ml,32.7,wong,2024-12-05 18:25:04.371161,ACEITE VEGETAL ENVASADO,1.0,l,130.8
Aceite de Oliva El Olivar Extra Virgen Botella 250ml,,250.0,ml,32.7,metro,2024-12-05 15:51:25.925663,ACEITE VEGETAL ENVASADO,1.0,l,130.8
Aceite Vegetal 5L,TOTTUS,5.0,l,32.9,tottus,2024-12-05 11:52:34.523088,ACEITE VEGETAL ENVASADO,1.0,l,6.58
Aceite de Cártamo OLEICO Botella 710ml,OLEICO,710.0,ml,33.6,vivanda,2024-12-05 21:57:06.369987,ACEITE VEGETAL ENVASADO,1.0,l,47.32394366197184
Aceite De Cartamo Oléico Botella 710 ml,,710.0,ml,33.6,wong,2024-12-05 18:25:04.371161,ACEITE VEGETAL ENVASADO,1.0,l,47.32394366197184
Aceite Vegetal Premium 5L,DELEITE,5.0,l,35.5,tottus,2024-12-05 11:52:34.523088,ACEITE VEGETAL ENVASADO,1.0,l,7.1000000000000005
Aceite de Canola Wesson Botella 710 ml,,710.0,ml,35.8,wong,2024-12-05 18:25:04.371161,ACEITE VEGETAL ENVASADO,1.0,l,50.42253521126761
Aceite Corporal para Bebé Johnson's Original 300ml,,300.0,ml,36.0,wong,2024-12-05 18:25:04.371161,ACEITE VEGETAL ENVASADO,1.0,l,120.0
Aceite ALPA Soya Galón 5L,ALPA,5.0,l,36.5,vega,2024-12-05 12:28:47.117979,ACEITE VEGETAL ENVASADO,1.0,l,7.300000000000001
Aceite de Oliva Cuisine & Co Botella 500 ml,,500.0,ml,36.8,wong,2024-12-05 18:25:04.371161,ACEITE VEGETAL ENVASADO,1.0,l,73.6
Aceite Natural para Cabello SUMAQ Sacha Inchi Frasco 60ml,SUMAQ,60.0,ml,36.9,vivanda,2024-12-05 21:57:06.369987,ACEITE VEGETAL ENVASADO,1.0,l,615.0
Aceite de Oliva El Olivar Extra Virgen 500ml,,500.0,ml,37.9,metro,2024-12-05 15:51:25.925663,ACEITE VEGETAL ENVASADO,1.0,l,75.8
Aceite de Oliva Extra Virgen Cuisine & Co 500ml,,500.0,ml,38.5,metro,2024-12-05 15:51:25.925663,ACEITE VEGETAL ENVASADO,1.0,l,77.0
Aceite de Ajonjolí OLIVOS DEL SUR Botella 500ml,OLIVOS DEL SUR,500.0,ml,38.6,vivanda,2024-12-05 21:57:06.369987,ACEITE VEGETAL ENVASADO,1.0,l,77.2
Aceite Vegetal WESSON Canola Botella 1.18L,WESSON,1.18,l,38.7,vivanda,2024-12-05 21:57:06.369987,ACEITE VEGETAL ENVASADO,1.0,l,32.79661016949153
Aceite de Canola Wesson 1.18L,,1.18,l,38.7,metro,2024-12-05 15:51:25.925663,ACEITE VEGETAL ENVASADO,1.0,l,32.79661016949153
Aceite de Oliva La Española Puro Botella 500 ml,,500.0,ml,38.9,metro,2024-12-05 15:51:25.925663,ACEITE VEGETAL ENVASADO,1.0,l,77.8
Aceite de Oliva Filippo Berio Puro Botella 500 ml,,500.0,ml,39.5,metro,2024-12-05 15:51:25.925663,ACEITE VEGETAL ENVASADO,1.0,l,79.0
Aceite de Oliva Filippo Berio Extra Virgen 500ml,,500.0,ml,39.9,metro,2024-12-05 15:51:25.925663,ACEITE VEGETAL ENVASADO,1.0,l,79.8
Aceite de Oliva Filippo Berio Puro Botella 500 ml,,500.0,ml,39.9,wong,2024-12-05 18:25:04.371161,ACEITE VEGETAL ENVASADO,1.0,l,79.8
Aceite de Oliva Filippo Berio Extra Virgen 500ml,,500.0,ml,39.9,wong,2024-12-05 18:25:04.371161,ACEITE VEGETAL ENVASADO,1.0,l,79.8
Aceite de Girasol Monteagle 3L,,3.0,l,39.9,wong,2024-12-05 18:25:04.371161,ACEITE VEGETAL ENVASADO,1.0,l,13.299999999999999
Aceite de Cártamo OLEICO Botella 946ml,OLEICO,946.0,ml,41.6,vivanda,2024-12-05 21:57:06.369987,ACEITE VEGETAL ENVASADO,1.0,l,43.97463002114165
Aceite de Oliva Puro Huerto Alamein 500ml,,500.0,ml,41.9,metro,2024-12-05 15:51:25.925663,ACEITE VEGETAL ENVASADO,1.0,l,83.8
Aceite de Oliva La Española Extra Virgen 500ml,,500.0,ml,42.5,metro,2024-12-05 15:51:25.925663,ACEITE VEGETAL ENVASADO,1.0,l,85.0
Aceite de Oliva La Española Extra Virgen 500ml,,500.0,ml,42.9,wong,2024-12-05 18:25:04.371161,ACEITE VEGETAL ENVASADO,1.0,l,85.8
Aceite de Oliva Extra Virgen Huerto Alamein 500ml,,500.0,ml,43.1,metro,2024-12-05 15:51:25.925663,ACEITE VEGETAL ENVASADO,1.0,l,86.2
Aceite de Oliva El Olivar Suave Botella 500 ml,,500.0,ml,44.0,metro,2024-12-05 15:51:25.925663,ACEITE VEGETAL ENVASADO,1.0,l,88.0
Aceite de Oliva Oli21 Extra Virgen 500ml,,500.0,ml,44.9,metro,2024-12-05 15:51:25.925663,ACEITE VEGETAL ENVASADO,1.0,l,89.8
Aceite de Oliva El Olivar Puro Botella 500 ml,,500.0,ml,44.9,metro,2024-12-05 15:51:25.925663,ACEITE VEGETAL ENVASADO,1.0,l,89.8
Aceite de Oliva Extra Virgen Carbonell Botella 500 ml,,500.0,ml,44.9,wong,2024-12-05 18:25:04.371161,ACEITE VEGETAL ENVASADO,1.0,l,89.8
Aceite de Oliva CARBONELL Sabor Afrutado Intenso Botella 500ml,CARBONELL,500.0,ml,44.9,vivanda,2024-12-05 21:57:06.369987,ACEITE VEGETAL ENVASADO,1.0,l,89.8
Aceite Oliva Extra Virgen Borges Botella 1 Litro,,1.0,l,45.6,wong,2024-12-05 18:25:04.371161,ACEITE VEGETAL ENVASADO,1.0,l,45.6
Aceite de Oliva Extra Virgen Orgánico Borges Botella 500 ml,,500.0,ml,45.9,wong,2024-12-05 18:25:04.371161,ACEITE VEGETAL ENVASADO,1.0,l,91.8
Aceite Capilar Hask Argan Oil 59ml,,59.0,ml,46.8,wong,2024-12-05 18:25:04.371161,ACEITE VEGETAL ENVASADO,1.0,l,793.2203389830509
Aceite de Oliva EL OLIVAR Extra Virgen Botella 500ml,EL OLIVAR,500.0,ml,47.4,vivanda,2024-12-05 21:57:06.369987,ACEITE VEGETAL ENVASADO,1.0,l,94.8
Aceite ELVIVE Óleo Extraordinario Frasco 100ml,ELVIVE,100.0,ml,48.0,vivanda,2024-12-05 21:57:06.369987,ACEITE VEGETAL ENVASADO,1.0,l,480.0
Aceite de Palta Sabor a Ajo OLIVOS DEL SUR Botella 250ml,OLIVOS DEL SUR,250.0,ml,48.4,vivanda,2024-12-05 21:57:06.369987,ACEITE VEGETAL ENVASADO,1.0,l,193.6
Aceite de Palta Virgen OLIVOS DEL SUR Botella 250ml,OLIVOS DEL SUR,250.0,ml,48.4,vivanda,2024-12-05 21:57:06.369987,ACEITE VEGETAL ENVASADO,1.0,l,193.6
Aceite de Oliva ACAVILLE Extra Virgen Gourmet Botella 500ml,ACAVILLE,500.0,ml,48.99,vivanda,2024-12-05 21:57:06.369987,ACEITE VEGETAL ENVASADO,1.0,l,97.98
Aceite de Palta con Albahaca Olivos del Sur 250ml,,250.0,ml,49.9,wong,2024-12-05 18:25:04.371161,ACEITE VEGETAL ENVASADO,1.0,l,199.6
Aceite de Palta con Ajos Olivos del Sur 250ml,,250.0,ml,49.9,wong,2024-12-05 18:25:04.371161,ACEITE VEGETAL ENVASADO,1.0,l,199.6
Agua Micelar en Aceite Frasco 400 ml,,400.0,ml,49.9,metro,2024-12-05 15:51:25.925663,ACEITE VEGETAL ENVASADO,1.0,l,124.75
Aceite de Palta Virgen Olivos del Sur 250ml,,250.0,ml,49.9,wong,2024-12-05 18:25:04.371161,ACEITE VEGETAL ENVASADO,1.0,l,199.6
Aceite de Oliva CREMONINI Extra Virgen Botella 500ml,CREMONINI,500.0,ml,49.9,vivanda,2024-12-05 21:57:06.369987,ACEITE VEGETAL ENVASADO,1.0,l,99.8
Aceite De Oliva Extra Virgen Trufa Blanca Pons Frasco 250 ml,,250.0,ml,50.9,wong,2024-12-05 18:25:04.371161,ACEITE VEGETAL ENVASADO,1.0,l,203.6
Aceite de Oliva El Olivar Extra Virgen Intenso 500ml,,500.0,ml,53.3,wong,2024-12-05 18:25:04.371161,ACEITE VEGETAL ENVASADO,1.0,l,106.6
Aceite de Oliva El Olivar Extra Virgen Intenso 500ml,,500.0,ml,53.4,metro,2024-12-05 15:51:25.925663,ACEITE VEGETAL ENVASADO,1.0,l,106.8
Aceite de Oliva Olivos del Sur Extra Virgen Botella 500 ml,,500.0,ml,53.8,metro,2024-12-05 15:51:25.925663,ACEITE VEGETAL ENVASADO,1.0,l,107.6
Aceite de Oliva Olivos del Sur Extra Virgen Botella 500 ml,,500.0,ml,53.9,wong,2024-12-05 18:25:04.371161,ACEITE VEGETAL ENVASADO,1.0,l,107.8
Aceite Vegetal Cocinero Botella 5 Litros,,5.0,l,54.5,metro,2024-12-05 15:51:25.925663,ACEITE VEGETAL ENVASADO,1.0,l,10.9
Aceite de Oliva Cuisine & Co Botella 1 Lt,,1.0,l,54.8,metro,2024-12-05 15:51:25.925663,ACEITE VEGETAL ENVASADO,1.0,l,54.8
Aceite Bronceador en Spray Nivea Sun FPS6 200ml,,200.0,ml,54.9,metro,2024-12-05 15:51:25.925663,ACEITE VEGETAL ENVASADO,1.0,l,274.5
Aceite Primor Botella 5 Litros,,5.0,l,54.9,metro,2024-12-05 15:51:25.925663,ACEITE VEGETAL ENVASADO,1.0,l,10.98
Aceite de Oliva Extra Virgen Filippo Berio 750ml,,750.0,ml,59.9,wong,2024-12-05 18:25:04.371161,ACEITE VEGETAL ENVASADO,1.0,l,79.86666666666666
Aceite de Oliva Puro Huerto Alamein 1L,,1.0,l,65.7,metro,2024-12-05 15:51:25.925663,ACEITE VEGETAL ENVASADO,1.0,l,65.7
Aceite de Oliva BELL'S Extra Virgen Botella 1L,BELL'S,1.0,l,65.9,vivanda,2024-12-05 21:57:06.369987,ACEITE VEGETAL ENVASADO,1.0,l,65.9
Aceite de Oliva Extra Virgen Cuisine & Co 1L,,1.0,l,65.9,wong,2024-12-05 18:25:04.371161,ACEITE VEGETAL ENVASADO,1.0,l,65.9
Aceite de Oliva Extra Virgen Cuisine & Co 1L,,1.0,l,66.9,metro,2024-12-05 15:51:25.925663,ACEITE VEGETAL ENVASADO,1.0,l,66.9
Aceite de Oliva EL OLIVAR Extra Virgen Botella 1L,EL OLIVAR,1.0,l,66.9,vivanda,2024-12-05 21:57:06.369987,ACEITE VEGETAL ENVASADO,1.0,l,66.9
Aceite de Oliva Filippo Berio Puro Botella 1 L,,1.0,l,67.9,wong,2024-12-05 18:25:04.371161,ACEITE VEGETAL ENVASADO,1.0,l,67.9
Aceite Vegetal PRIMOR Clásico Botella 900ml x6u,Primor,900.0,ml,69.6,vega,2024-12-05 12:28:47.117979,ACEITE VEGETAL ENVASADO,1.0,l,77.33333333333333
Aceite de Oliva La Española Extra Virgen Botella 1 L,,1.0,l,72.5,metro,2024-12-05 15:51:25.925663,ACEITE VEGETAL ENVASADO,1.0,l,72.5
Aceite de Oliva Extra Virgen Olivos del Sur 750ml,,750.0,ml,75.9,wong,2024-12-05 18:25:04.371161,ACEITE VEGETAL ENVASADO,1.0,l,101.2
Aceite de Oliva El Olivar Puro Botella 1 L,,1.0,l,77.8,metro,2024-12-05 15:51:25.925663,ACEITE VEGETAL ENVASADO,1.0,l,77.8
Aceite de Coco Orgánico Peruvian Health 1L,,1.0,l,80.0,wong,2024-12-05 18:25:04.371161,ACEITE VEGETAL ENVASADO,1.0,l,80.0
Aceite de Oliva Santolivo Extra Virgen 1L,,1.0,l,83.2,wong,2024-12-05 18:25:04.371161,ACEITE VEGETAL ENVASADO,1.0,l,83.2
Aceite de Oliva Huerto Extra Virgen Alamein Premium 1L,,1.0,l,84.2,wong,2024-12-05 18:25:04.371161,ACEITE VEGETAL ENVASADO,1.0,l,84.2
Aceite de Oliva Clásico Carbonell Botella 1 Lt,,1.0,l,84.5,metro,2024-12-05 15:51:25.925663,ACEITE VEGETAL ENVASADO,1.0,l,84.5
Aceite de Oliva Clásico Carbonell Botella 1 Lt,,1.0,l,84.9,wong,2024-12-05 18:25:04.371161,ACEITE VEGETAL ENVASADO,1.0,l,84.9
Aceite para Bebé Caléndula Weleda Frasco 200 ml,,200.0,ml,85.0,wong,2024-12-05 18:25:04.371161,ACEITE VEGETAL ENVASADO,1.0,l,425.0
Aceite de Oliva Olivos del Sur Extra Virgen Botella 1 L,,1.0,l,85.5,metro,2024-12-05 15:51:25.925663,ACEITE VEGETAL ENVASADO,1.0,l,85.5
Aceite de Oliva Extra Virgen Carbonell Botella 1 Lt,,1.0,l,89.5,metro,2024-12-05 15:51:25.925663,ACEITE VEGETAL ENVASADO,1.0,l,89.5
Aceite de Oliva Extra Virgen Carbonell Botella 1 Lt,,1.0,l,89.9,wong,2024-12-05 18:25:04.371161,ACEITE VEGETAL ENVASADO,1.0,l,89.9
Aceite de Oliva Olivos del Sur Extra Virgen Botella 1 L,,1.0,l,92.9,wong,2024-12-05 18:25:04.371161,ACEITE VEGETAL ENVASADO,1.0,l,92.9
Aceite de Oliva El Olivar Extra Virgen Intenso Botella 1 L,,1.0,l,97.5,wong,2024-12-05 18:25:04.371161,ACEITE VEGETAL ENVASADO,1.0,l,97.5
Aceite de Oliva BELL'S Extra Virgen Botella 2L,BELL'S,2.0,l,102.9,vivanda,2024-12-05 21:57:06.369987,ACEITE VEGETAL ENVASADO,1.0,l,51.45
Aceite de Maíz Mazola 2.84L,,2.84,l,104.9,wong,2024-12-05 18:25:04.371161,ACEITE VEGETAL ENVASADO,1.0,l,36.93661971830986
Aceite VEGA Botella 900ml Caja 12 und,Vega,900.0,ml,110.4,vega,2024-12-05 12:28:47.117979,ACEITE VEGETAL ENVASADO,1.0,l,122.66666666666667
Aceite para Celulitis Abedul Weleda Frasco 100 ml,,100.0,ml,129.0,wong,2024-12-05 18:25:04.371161,ACEITE VEGETAL ENVASADO,1.0,l,1290.0
Aceite de Ducha Bioderma Atoderm 1L,,1.0,l,131.0,wong,2024-12-05 18:25:04.371161,ACEITE VEGETAL ENVASADO,1.0,l,131.0
Aceite EL PALMERO Balde 18L,EL PALMERO,18.0,l,135.0,vega,2024-12-05 12:28:47.117979,ACEITE VEGETAL ENVASADO,1.0,l,7.5
Aceite de Oliva Extra Virgen Huerto Alamein 2L,,2.0,l,141.7,metro,2024-12-05 15:51:25.925663,ACEITE VEGETAL ENVASADO,1.0,l,70.85
Aceite de Oliva Extra Virgen Huerto Alamein 2L,,2.0,l,158.8,wong,2024-12-05 18:25:04.371161,ACEITE VEGETAL ENVASADO,1.0,l,79.4
Aceite Lavante Mustela Stelatopia 500ml,,500.0,ml,161.0,wong,2024-12-05 18:25:04.371161,ACEITE VEGETAL ENVASADO,1.0,l,322.0
