description,price,website,search_term,scrape_timestamp,cantidad,unidad,description_no_unit,price_numeric,WEB,brand,CLASIFICACION
Galleta de Arroz Baby Mum-Mum Zanahoria Caja 50 gr,S/ 13.95,metro,ARROZ ENVASADO,2024-12-05 15:03:32.699540,50.0,g,Galleta de Arroz Baby Mum-Mum Zanahoria Caja r,13.95,metro,,ARROZ ENVASADO
Galleta de Arroz Original Hot Kid 50 g,S/ 13.99,tottus,ARROZ ENVASADO,2024-12-05 11:07:40.526558,50.0,g,Galleta de Arroz Original Hot Kid,13.99,tottus,,ARROZ ENVASADO
Verduras para Arroz con Pollo Wong Bandeja 200g,S/ 14.00,wong,ARROZ ENVASADO,2024-12-05 17:30:42.491945,200.0,g,Verduras para Arroz con Pollo Wong Bandeja,14.0,wong,,ARROZ ENVASADO
Galleta de Arroz Baby Mum-Mum Zanahoria Caja 50 gr,S/ 14.10,wong,ARROZ ENVASADO,2024-12-05 17:30:42.491945,50.0,g,Galleta de Arroz Baby Mum-Mum Zanahoria Caja r,14.1,wong,,ARROZ ENVASADO
Galleta de Arroz Baby Mum-Mum Manzana Caja 50 gr,S/ 14.10,wong,ARROZ ENVASADO,2024-12-05 17:30:42.491945,50.0,g,Galleta de Arroz Baby Mum-Mum Manzana Caja r,14.1,wong,,ARROZ ENVASADO
Galleta de Arroz Baby Mum-Mum Original Caja 50 gr,S/ 14.10,wong,ARROZ ENVASADO,2024-12-05 17:30:42.491945,50.0,g,Galleta de Arroz Baby Mum-Mum Original Caja r,14.1,wong,,ARROZ ENVASADO
Zero Carbo Pasta Precocida de Konjac Arroz Konjac Sin Gluten Doypack 270 g,S/ 14.40,wong,ARROZ ENVASADO,2024-12-05 17:30:42.491945,270.0,g,Zero Carbo Pasta Precocida de Konjac Arroz Konjac Sin Gluten Doypack,14.4,wong,,ARROZ ENVASADO
Arroz con Pollo Wong Ready Bandeja 320 g,S/ 14.50,wong,ARROZ ENVASADO,2024-12-05 17:30:42.491945,320.0,g,Arroz con Pollo Wong Ready Bandeja,14.5,wong,,ARROZ ENVASADO
Arroz Blanco Añejo Faraon Mostaza 3kg,S/ 14.50,metro,ARROZ ENVASADO,2024-12-05 15:03:32.699540,3.0,kg,Arroz Blanco Añejo Faraon Mostaza,14.5,metro,,ARROZ ENVASADO
Arroz Arborio Paisana Bolsa 1 kg,S/ 14.90,metro,ARROZ ENVASADO,2024-12-05 15:03:32.699540,1.0,kg,Arroz Arborio Paisana Bolsa,14.9,metro,,ARROZ ENVASADO
Aji de gallina con arroz Nadú Caja 340 g,S/ 14.90,metro,ARROZ ENVASADO,2024-12-05 15:03:32.699540,340.0,g,Aji de gallina con arroz Nadú Caja,14.9,metro,,ARROZ ENVASADO
Galleta de Arroz Banana 50 g,S/ 14.99,tottus,ARROZ ENVASADO,2024-12-05 11:07:40.526558,50.0,g,Galleta de Arroz Banana,14.99,tottus,,ARROZ ENVASADO
Galletas de Arroz BABY MUM sabor Fresca Caja 50g,S/ 14.99,vivanda,ARROZ ENVASADO,2024-12-05 21:27:43.230292,50.0,g,Galletas de Arroz BABY MUM sabor Fresca Caja,14.99,vivanda,BABY MUM,ARROZ ENVASADO
Galleta de Arroz Toddler Mum-Mum Banana Caja 50 gr,S/ 15.10,wong,ARROZ ENVASADO,2024-12-05 17:30:42.491945,50.0,g,Galleta de Arroz Toddler Mum-Mum Banana Caja r,15.1,wong,,ARROZ ENVASADO
Salsa Culantrito con Espinaca Envasado 550 g,S/ 15.20,wong,ARROZ ENVASADO,2024-12-05 17:30:42.491945,550.0,g,Salsa Culantrito con Espinaca Envasado,15.2,wong,,ARROZ ENVASADO
Mimma Galletas para Perros Huesitos Raza Grande Arroz con Carne Sachet 500 g,S/ 15.20,metro,ARROZ ENVASADO,2024-12-05 15:03:32.699540,500.0,g,Mimma Galletas para Perros Huesitos Raza Grande Arroz con Carne Sachet,15.2,metro,,ARROZ ENVASADO
Salsa Culantrito con Espinaca Envasado 550 g,S/ 15.20,metro,ARROZ ENVASADO,2024-12-05 15:03:32.699540,550.0,g,Salsa Culantrito con Espinaca Envasado,15.2,metro,,ARROZ ENVASADO
Arroz con Pollo NADU Bandeja 320g,S/ 15.40,vivanda,ARROZ ENVASADO,2024-12-05 21:27:43.230292,320.0,g,Arroz con Pollo NADU Bandeja,15.4,vivanda,NADU,ARROZ ENVASADO
Vinagre de Arroz Bárcidda 500ml,S/ 15.40,metro,ARROZ ENVASADO,2024-12-05 15:03:32.699540,500.0,ml,Vinagre de Arroz Bárcidda,15.4,metro,,ARROZ ENVASADO
Harina De Coco Mi Tierra x 400 g,S/ 15.50,tottus,ARROZ ENVASADO,2024-12-05 11:07:40.526558,400.0,g,Harina De Coco Mi Tierra x,15.5,tottus,NUTRISA,ARROZ ENVASADO
Arroz Arborio Paisana Bolsa 1 kg,S/ 15.60,wong,ARROZ ENVASADO,2024-12-05 17:30:42.491945,1.0,kg,Arroz Arborio Paisana Bolsa,15.6,wong,,ARROZ ENVASADO
Cereal de Avena y Arroz Cuisine & Co 350g,S/ 15.70,metro,ARROZ ENVASADO,2024-12-05 15:03:32.699540,350.0,g,Cereal de Avena y Arroz Cuisine & Co,15.7,metro,,ARROZ ENVASADO
Cereal de Avena y Arroz Cuisine & Co 350g,S/ 15.70,wong,ARROZ ENVASADO,2024-12-05 17:30:42.491945,350.0,g,Cereal de Avena y Arroz Cuisine & Co,15.7,wong,,ARROZ ENVASADO
Pasta De Arroz Spaghetti x 250 g,S/ 15.90,tottus,ARROZ ENVASADO,2024-12-05 11:07:40.526558,250.0,g,Pasta De Arroz Spaghetti x,15.9,tottus,EL DORADO,ARROZ ENVASADO
PAN BLANCO SIN BORDES 650G,S/ 16,tottus,ARROZ ENVASADO,2024-12-05 11:07:40.526558,650.0,g,PAN BLANCO SIN BORDES,16.0,tottus,BIMBO,ARROZ ENVASADO
Vinagre de Arroz Bárcidda 500ml,S/ 16.10,wong,ARROZ ENVASADO,2024-12-05 17:30:42.491945,500.0,ml,Vinagre de Arroz Bárcidda,16.1,wong,,ARROZ ENVASADO
Pasta Orgánica de Quinua y Arroz Fusilli América Orgánica 227g,S/ 16.50,wong,ARROZ ENVASADO,2024-12-05 17:30:42.491945,227.0,g,Pasta Orgánica de Quinua y Arroz Fusilli América Orgánica,16.5,wong,,ARROZ ENVASADO
Penne de Quinua y Arroz América Orgánica 227g,S/ 16.50,wong,ARROZ ENVASADO,2024-12-05 17:30:42.491945,227.0,g,Penne de Quinua y Arroz América Orgánica,16.5,wong,,ARROZ ENVASADO
Arroz Tostado Choco Krispis Kellogg's 420g,S/ 16.90,wong,ARROZ ENVASADO,2024-12-05 17:30:42.491945,420.0,g,Arroz Tostado Choco Krispis Kellogg's,16.9,wong,,ARROZ ENVASADO
Pasta de Arroz Spaghetti Sin Gluten El Dorado Bolsa 250 g,S/ 16.90,wong,ARROZ ENVASADO,2024-12-05 17:30:42.491945,250.0,g,Pasta de Arroz Spaghetti Sin Gluten El Dorado Bolsa,16.9,wong,,ARROZ ENVASADO
Arroz Tostado Choco Krispis Kellogg's 420g,S/ 16.90,metro,ARROZ ENVASADO,2024-12-05 15:03:32.699540,420.0,g,Arroz Tostado Choco Krispis Kellogg's,16.9,metro,,ARROZ ENVASADO
Arroz con Leche x kg,S/ 16.90 x kg,wong,ARROZ ENVASADO,2024-12-05 17:30:42.491945,1.0,kg,Arroz con Leche,16.9,wong,,ARROZ ENVASADO
Cereal infantil Nestum® de arroz de 350 g,S/ 17.50,tottus,ARROZ ENVASADO,2024-12-05 11:07:40.526558,350.0,g,Cereal infantil Nestum® de arroz de,17.5,tottus,NESTUM,ARROZ ENVASADO
Arroz Familiar Maxima Bolsa 5 kg,S/ 17.50,metro,ARROZ ENVASADO,2024-12-05 15:03:32.699540,5.0,kg,Arroz Familiar Maxima Bolsa,17.5,metro,,ARROZ ENVASADO
Pasta Orgánica de Quinua y Arroz Spaghetti América Orgánica 227g,S/ 17.90,wong,ARROZ ENVASADO,2024-12-05 17:30:42.491945,227.0,g,Pasta Orgánica de Quinua y Arroz Spaghetti América Orgánica,17.9,wong,,ARROZ ENVASADO
GALLETAS ARROZ SIN GLUTEN MARIA X210GR,S/ 17.90,tottus,ARROZ ENVASADO,2024-12-05 11:07:40.526558,210.0,g,GALLETAS ARROZ SIN GLUTEN MARIA XR,17.9,tottus,SANTIVERI,ARROZ ENVASADO
Salsa de Ají Amarillo Envasado 550 g,S/ 18.10,metro,ARROZ ENVASADO,2024-12-05 15:03:32.699540,550.0,g,Salsa de Ají Amarillo Envasado,18.1,metro,,ARROZ ENVASADO
Salsa de Ají Amarillo Envasado 550 g,S/ 18.10,wong,ARROZ ENVASADO,2024-12-05 17:30:42.491945,550.0,g,Salsa de Ají Amarillo Envasado,18.1,wong,,ARROZ ENVASADO
Arroz Basmati Riso Scotti Caja 500 g,S/ 18.50,metro,ARROZ ENVASADO,2024-12-05 15:03:32.699540,500.0,g,Arroz Basmati Riso Scotti Caja,18.5,metro,,ARROZ ENVASADO
"Papilla de Cereal Orgánico Instantáneo de Quinua, Kiwicha, Cañihua y Arroz Kids Organics Caja 300 gr",S/ 18.90,metro,ARROZ ENVASADO,2024-12-05 15:03:32.699540,300.0,g,"Papilla de Cereal Orgánico Instantáneo de Quinua, Kiwicha, Cañihua y Arroz Kids Organics Caja r",18.9,metro,,ARROZ ENVASADO
"Papilla de Cereal Orgánico Instantáneo de Quinua, Kiwicha, Cañihua y Arroz Kids Organics Caja 300 gr",S/ 18.90,wong,ARROZ ENVASADO,2024-12-05 17:30:42.491945,300.0,g,"Papilla de Cereal Orgánico Instantáneo de Quinua, Kiwicha, Cañihua y Arroz Kids Organics Caja r",18.9,wong,,ARROZ ENVASADO
Arroz Economico VEGA Bolsa 5Kg,S/ 19.50,vega,ARROZ ENVASADO,2024-12-05 11:36:02.001973,5.0,kg,Arroz Economico VEGA Bolsa,19.5,vega,Vega,ARROZ ENVASADO
Arroz Superior BELL'S Bolsa 5Kg,S/ 19.90,vivanda,ARROZ ENVASADO,2024-12-05 21:27:43.230292,5.0,kg,Arroz Superior BELL'S Bolsa,19.9,vivanda,BELL'S,ARROZ ENVASADO
Cereal Infantil en Polvo Nestum Arroz 350g,S/ 19.90,wong,ARROZ ENVASADO,2024-12-05 17:30:42.491945,350.0,g,Cereal Infantil en Polvo Nestum Arroz,19.9,wong,,ARROZ ENVASADO
"Cereal Orgánico de Quinua, Arroz y Cacao Kids Organics Caja 240 gr",S/ 20.10,wong,ARROZ ENVASADO,2024-12-05 17:30:42.491945,240.0,g,"Cereal Orgánico de Quinua, Arroz y Cacao Kids Organics Caja r",20.1,wong,,ARROZ ENVASADO
"Cereal Orgánico de Quinua, Kiwicha y Arroz Kids Organics Caja 240 gr",S/ 20.10,wong,ARROZ ENVASADO,2024-12-05 17:30:42.491945,240.0,g,"Cereal Orgánico de Quinua, Kiwicha y Arroz Kids Organics Caja r",20.1,wong,,ARROZ ENVASADO
Arroz Extra BELL'S Bolsa 5Kg,S/ 20.80,vivanda,ARROZ ENVASADO,2024-12-05 21:27:43.230292,5.0,kg,Arroz Extra BELL'S Bolsa,20.8,vivanda,BELL'S,ARROZ ENVASADO
Arroz con Pollo Wong x kg,S/ 20.90 x kg,metro,ARROZ ENVASADO,2024-12-05 15:03:32.699540,1.0,kg,Arroz con Pollo Wong,20.9,metro,,ARROZ ENVASADO
Arroz Extra Metro 5kg,S/ 20.90,metro,ARROZ ENVASADO,2024-12-05 15:03:32.699540,5.0,kg,Arroz Extra Metro,20.9,metro,,ARROZ ENVASADO
Arroz Superior Cuisine & Co 5kg,S/ 20.90,metro,ARROZ ENVASADO,2024-12-05 15:03:32.699540,5.0,kg,Arroz Superior Cuisine & Co,20.9,metro,,ARROZ ENVASADO
Arroz Integral Cuisine & Co 5kg,S/ 21.50,metro,ARROZ ENVASADO,2024-12-05 15:03:32.699540,5.0,kg,Arroz Integral Cuisine & Co,21.5,metro,,ARROZ ENVASADO
Fettuccini de arroz y yuca sin gluten 400 g,S/ 21.50,tottus,ARROZ ENVASADO,2024-12-05 11:07:40.526558,400.0,g,Fettuccini de arroz y yuca sin gluten,21.5,tottus,MOLINOS DEL MUNDO,ARROZ ENVASADO
Aceite De Arroz Costeño Botella 900 ml,S/ 21.70,metro,ARROZ ENVASADO,2024-12-05 15:03:32.699540,900.0,ml,Aceite De Arroz Costeño Botella,21.7,metro,,ARROZ ENVASADO
Arroz Integral Cuisine & Co 5kg,S/ 21.90,wong,ARROZ ENVASADO,2024-12-05 17:30:42.491945,5.0,kg,Arroz Integral Cuisine & Co,21.9,wong,,ARROZ ENVASADO
Arroz Extra Cuisine & Co 5kg,S/ 21.90,metro,ARROZ ENVASADO,2024-12-05 15:03:32.699540,5.0,kg,Arroz Extra Cuisine & Co,21.9,metro,,ARROZ ENVASADO
Arroz Extra Wong Bolsa 5 Kg,S/ 21.90,wong,ARROZ ENVASADO,2024-12-05 17:30:42.491945,5.0,kg,Arroz Extra Wong Bolsa,21.9,wong,,ARROZ ENVASADO
Arroz Superior 5 kg,S/ 21.96,tottus,ARROZ ENVASADO,2024-12-05 11:07:40.526558,5.0,kg,Arroz Superior,21.96,tottus,TOTTUS,ARROZ ENVASADO
Arroz Superior Valle Norte Primera cosecha Bolsa 5 Kg,S/ 22.50,metro,ARROZ ENVASADO,2024-12-05 15:03:32.699540,5.0,kg,Arroz Superior Valle Norte Primera cosecha Bolsa,22.5,metro,,ARROZ ENVASADO
Arroz Extra Cuisine & Co 5kg,S/ 22.90,wong,ARROZ ENVASADO,2024-12-05 17:30:42.491945,5.0,kg,Arroz Extra Cuisine & Co,22.9,wong,,ARROZ ENVASADO
Arroz Superior VALLENORTE Bolsa 5Kg,S/ 22.90,vivanda,ARROZ ENVASADO,2024-12-05 21:27:43.230292,5.0,kg,Arroz Superior VALLENORTE Bolsa,22.9,vivanda,VALLENORTE,ARROZ ENVASADO
Arroz Añejo Superior Valle Norte 5kg,S/ 22.90,metro,ARROZ ENVASADO,2024-12-05 15:03:32.699540,5.0,kg,Arroz Añejo Superior Valle Norte,22.9,metro,,ARROZ ENVASADO
Arroz Superior Gran Chalán 5kg,S/ 23.49,metro,ARROZ ENVASADO,2024-12-05 15:03:32.699540,5.0,kg,Arroz Superior Gran Chalán,23.49,metro,,ARROZ ENVASADO
Arroz Extra Añejo Cuisine&Co Bolsa 5 kg,S/ 23.50,wong,ARROZ ENVASADO,2024-12-05 17:30:42.491945,5.0,kg,Arroz Extra Añejo Cuisine&Co Bolsa,23.5,wong,,ARROZ ENVASADO
Arroz Superior Valle Norte 5 kg,S/ 23.50,tottus,ARROZ ENVASADO,2024-12-05 11:07:40.526558,5.0,kg,Arroz Superior Valle Norte,23.5,tottus,VALLENORTE,ARROZ ENVASADO
Arroz Superior Paisana Bolsa 5 kg,S/ 24.20,metro,ARROZ ENVASADO,2024-12-05 15:03:32.699540,5.0,kg,Arroz Superior Paisana Bolsa,24.2,metro,,ARROZ ENVASADO
Arroz Integral 5 kg,S/ 24.46,tottus,ARROZ ENVASADO,2024-12-05 11:07:40.526558,5.0,kg,Arroz Integral,24.46,tottus,TOTTUS,ARROZ ENVASADO
Arroz Superior Costeño 5 kg,S/ 24.50,tottus,ARROZ ENVASADO,2024-12-05 11:07:40.526558,5.0,kg,Arroz Superior Costeño,24.5,tottus,COSTENO,ARROZ ENVASADO
Arroz Superior Paisana Bolsa 5 kg,S/ 24.60,wong,ARROZ ENVASADO,2024-12-05 17:30:42.491945,5.0,kg,Arroz Superior Paisana Bolsa,24.6,wong,,ARROZ ENVASADO
Arroz Superior Faraón de 5 Kg,S/ 24.90,tottus,ARROZ ENVASADO,2024-12-05 11:07:40.526558,5.0,kg,Arroz Superior Faraón de,24.9,tottus,FARAON,ARROZ ENVASADO
Arroz Extra GRAN CHALAN Bolsa 5 kg,S/ 24.90 4%,vega,ARROZ ENVASADO,2024-12-05 11:36:02.001973,5.0,kg,Arroz Extra GRAN CHALAN Bolsa,24.9,vega,Gran Chalan,ARROZ ENVASADO
Arroz Superior Añejo VALLENORTE Bolsa 5Kg,S/ 24.90,vivanda,ARROZ ENVASADO,2024-12-05 21:27:43.230292,5.0,kg,Arroz Superior Añejo VALLENORTE Bolsa,24.9,vivanda,VALLENORTE,ARROZ ENVASADO
Arroz Superior Gran Chalán 5 kg,S/ 24.90,tottus,ARROZ ENVASADO,2024-12-05 11:07:40.526558,5.0,kg,Arroz Superior Gran Chalán,24.9,tottus,GRAN CHALAN,ARROZ ENVASADO
Arroz Gran Reserva Extra Valle Norte Bolsa 5 Kg,S/ 25.49,metro,ARROZ ENVASADO,2024-12-05 15:03:32.699540,5.0,kg,Arroz Gran Reserva Extra Valle Norte Bolsa,25.49,metro,,ARROZ ENVASADO
Arroz Fortificado Superior Bolsa 5 Kg,S/ 25.50,metro,ARROZ ENVASADO,2024-12-05 15:03:32.699540,5.0,kg,Arroz Fortificado Superior Bolsa,25.5,metro,,ARROZ ENVASADO
Arroz Superior Costeño 5kg,S/ 25.60,metro,ARROZ ENVASADO,2024-12-05 15:03:32.699540,5.0,kg,Arroz Superior Costeño,25.6,metro,,ARROZ ENVASADO
Arroz Costeño Añejo Extra 5kg,S/ 25.90,metro,ARROZ ENVASADO,2024-12-05 15:03:32.699540,5.0,kg,Arroz Costeño Añejo Extra,25.9,metro,,ARROZ ENVASADO
Arroz Extra Añejo Campo Norte 5kg,S/ 25.90,metro,ARROZ ENVASADO,2024-12-05 15:03:32.699540,5.0,kg,Arroz Extra Añejo Campo Norte,25.9,metro,,ARROZ ENVASADO
Arroz Superior Añejo 5 Kg,S/ 25.90,tottus,ARROZ ENVASADO,2024-12-05 11:07:40.526558,5.0,kg,Arroz Superior Añejo,25.9,tottus,VALLENORTE,ARROZ ENVASADO
Arroz Extra Costeño 5kg,S/ 25.90,metro,ARROZ ENVASADO,2024-12-05 15:03:32.699540,5.0,kg,Arroz Extra Costeño,25.9,metro,,ARROZ ENVASADO
Arroz Extra FARAON Bolsa 5Kg,S/ 26.20 6%,vega,ARROZ ENVASADO,2024-12-05 11:36:02.001973,5.0,kg,Arroz Extra FARAON Bolsa,26.2,vega,Faraon,ARROZ ENVASADO
Arroz Superior Añejo Faraón Rojo 5kg,S/ 26.25,metro,ARROZ ENVASADO,2024-12-05 15:03:32.699540,5.0,kg,Arroz Superior Añejo Faraón Rojo,26.25,metro,,ARROZ ENVASADO
Arroz Extra Gran Chalán 5 kg,S/ 26.30,tottus,ARROZ ENVASADO,2024-12-05 11:07:40.526558,5.0,kg,Arroz Extra Gran Chalán,26.3,tottus,GRAN CHALAN,ARROZ ENVASADO
Arroz Gran Reserva Extra Valle Norte Bolsa 5 Kg,S/ 26.50,wong,ARROZ ENVASADO,2024-12-05 17:30:42.491945,5.0,kg,Arroz Gran Reserva Extra Valle Norte Bolsa,26.5,wong,,ARROZ ENVASADO
Arroz Superior Añejo Faraón Rojo 5kg,S/ 26.75,wong,ARROZ ENVASADO,2024-12-05 17:30:42.491945,5.0,kg,Arroz Superior Añejo Faraón Rojo,26.75,wong,,ARROZ ENVASADO
Arroz Añejo Extra COSTEÑO Bolsa 5kg,S/ 26.90,vivanda,ARROZ ENVASADO,2024-12-05 21:27:43.230292,5.0,kg,Arroz Añejo Extra COSTEÑO Bolsa,26.9,vivanda,COSTENO,ARROZ ENVASADO
Arroz Costeño Añejo Extra 5kg,S/ 26.90,wong,ARROZ ENVASADO,2024-12-05 17:30:42.491945,5.0,kg,Arroz Costeño Añejo Extra,26.9,wong,,ARROZ ENVASADO
Harina Arroz Organica 680Gr - ENVASE 680 GR,S/ 27,tottus,ARROZ ENVASADO,2024-12-05 11:07:40.526558,680.0,g,Harina Arroz Organica r - ENVASE R,27.0,tottus,BOB'S RED MILL,ARROZ ENVASADO
Arroz Mix Kiwicha y Linaza Huella Verde 500g,S/ 27.30,wong,ARROZ ENVASADO,2024-12-05 17:30:42.491945,500.0,g,Arroz Mix Kiwicha y Linaza Huella Verde,27.3,wong,,ARROZ ENVASADO
Arroz Extra VALLENORTE Gran Reserva Bolsa 5Kg,S/ 27.50,vivanda,ARROZ ENVASADO,2024-12-05 21:27:43.230292,5.0,kg,Arroz Extra VALLENORTE Gran Reserva Bolsa,27.5,vivanda,VALLENORTE,ARROZ ENVASADO
Arroz Gourmet Extra Añejo Gran Chalán de 5 Kg,S/ 27.50,tottus,ARROZ ENVASADO,2024-12-05 11:07:40.526558,5.0,kg,Arroz Gourmet Extra Añejo Gran Chalán de,27.5,tottus,GRAN CHALAN,ARROZ ENVASADO
Arroz Extra Añejo FARAON Naranja Bolsa 5kg,S/ 27.50,vivanda,ARROZ ENVASADO,2024-12-05 21:27:43.230292,5.0,kg,Arroz Extra Añejo FARAON Naranja Bolsa,27.5,vivanda,FARAON,ARROZ ENVASADO
Arroz Extra Costeño 5 kg,S/ 27.50,tottus,ARROZ ENVASADO,2024-12-05 11:07:40.526558,5.0,kg,Arroz Extra Costeño,27.5,tottus,COSTENO,ARROZ ENVASADO
Arroz Extra Faraón de 5 Kg,S/ 27.60,tottus,ARROZ ENVASADO,2024-12-05 11:07:40.526558,5.0,kg,Arroz Extra Faraón de,27.6,tottus,FARAON,ARROZ ENVASADO
Arroz Extra COSTEÑO Bolsa 5Kg,S/ 27.70,vivanda,ARROZ ENVASADO,2024-12-05 21:27:43.230292,5.0,kg,Arroz Extra COSTEÑO Bolsa,27.7,vivanda,COSTENO,ARROZ ENVASADO
Arroz Blanco Extra Añejo Faraón Naranja 5kg,S/ 28.30,wong,ARROZ ENVASADO,2024-12-05 17:30:42.491945,5.0,kg,Arroz Blanco Extra Añejo Faraón Naranja,28.3,wong,,ARROZ ENVASADO
Arroz Extra Valle Norte 5 kg,S/ 28.50,tottus,ARROZ ENVASADO,2024-12-05 11:07:40.526558,5.0,kg,Arroz Extra Valle Norte,28.5,tottus,VALLENORTE,ARROZ ENVASADO
Arroz Extra Costeño 5kg,S/ 28.60,wong,ARROZ ENVASADO,2024-12-05 17:30:42.491945,5.0,kg,Arroz Extra Costeño,28.6,wong,,ARROZ ENVASADO
Arroz Extra Tesoro Del Campo Bolsa 5 Kg,S/ 30.30,wong,ARROZ ENVASADO,2024-12-05 17:30:42.491945,5.0,kg,Arroz Extra Tesoro Del Campo Bolsa,30.3,wong,,ARROZ ENVASADO
Arroz Extra Añejo Campo Norte 5kg + 750g,S/ 30.30,metro,ARROZ ENVASADO,2024-12-05 15:03:32.699540,5.0,kg,Arroz Extra Añejo Campo Norte  +,30.3,metro,,ARROZ ENVASADO
Ajo en Pasta Envasado 550 g,S/ 31.90,metro,ARROZ ENVASADO,2024-12-05 15:03:32.699540,550.0,g,Ajo en Pasta Envasado,31.9,metro,,ARROZ ENVASADO
Arroz Arborio SCOTTI Caja 1Kg,S/ 32.50,vivanda,ARROZ ENVASADO,2024-12-05 21:27:43.230292,1.0,kg,Arroz Arborio SCOTTI Caja,32.5,vivanda,SCOTT,ARROZ ENVASADO
Arroz Arborio Scotti Rissoto Caja 1 Kg,S/ 32.50,metro,ARROZ ENVASADO,2024-12-05 15:03:32.699540,1.0,kg,Arroz Arborio Scotti Rissoto Caja,32.5,metro,,ARROZ ENVASADO
Arroz Risotto Arborio Inverni 1kg,S/ 36.20,wong,ARROZ ENVASADO,2024-12-05 17:30:42.491945,1.0,kg,Arroz Risotto Arborio Inverni,36.2,wong,,ARROZ ENVASADO
Arroz Chaufa x kg,S/ 37.90 x kg,wong,ARROZ ENVASADO,2024-12-05 17:30:42.491945,1.0,kg,Arroz Chaufa,37.9,wong,,ARROZ ENVASADO
Arroz Extra de 10 kg,S/ 44.05,tottus,ARROZ ENVASADO,2024-12-05 11:07:40.526558,10.0,kg,Arroz Extra de,44.05,tottus,TOTTUS,ARROZ ENVASADO
Arroz Extra Añejo Bolsa x 10 Kg,S/ 44.50,tottus,ARROZ ENVASADO,2024-12-05 11:07:40.526558,10.0,kg,Arroz Extra Añejo Bolsa x,44.5,tottus,GRAN CHALAN,ARROZ ENVASADO
Arroz Costeño Añejo Bolsa x 10 Kg,S/ 45,tottus,ARROZ ENVASADO,2024-12-05 11:07:40.526558,10.0,kg,Arroz Costeño Añejo Bolsa x,45.0,tottus,COSTENO,ARROZ ENVASADO
Arroz Extra VEGA Pacasmayo Saco 10Kg,S/ 45.00,vega,ARROZ ENVASADO,2024-12-05 11:36:02.001973,10.0,kg,Arroz Extra VEGA Pacasmayo Saco,45.0,vega,Veguita,ARROZ ENVASADO
Arroz Blanco Extra Añejo Faraón Naranja 10kg,S/ 45.90,metro,ARROZ ENVASADO,2024-12-05 15:03:32.699540,10.0,kg,Arroz Blanco Extra Añejo Faraón Naranja,45.9,metro,,ARROZ ENVASADO
Arroz Blanco Extra Añejo Faraón Naranja 10kg,S/ 45.90,wong,ARROZ ENVASADO,2024-12-05 17:30:42.491945,10.0,kg,Arroz Blanco Extra Añejo Faraón Naranja,45.9,wong,,ARROZ ENVASADO
Arroz Nir Añejado Chaparri Bolsa 10 Kg,S/ 47.00,metro,ARROZ ENVASADO,2024-12-05 15:03:32.699540,10.0,kg,Arroz Nir Añejado Chaparri Bolsa,47.0,metro,,ARROZ ENVASADO
Twopack Arroz Costeño Añejo Extra 5kg,S/ 53.80,metro,ARROZ ENVASADO,2024-12-05 15:03:32.699540,5.0,kg,Twopack Arroz Costeño Añejo Extra,53.8,metro,,ARROZ ENVASADO
Twopack Arroz Costeño Añejo Extra 5kg,S/ 53.80,wong,ARROZ ENVASADO,2024-12-05 17:30:42.491945,5.0,kg,Twopack Arroz Costeño Añejo Extra,53.8,wong,,ARROZ ENVASADO
Twopack Arroz Extra Costeño 5kg,S/ 57.00,wong,ARROZ ENVASADO,2024-12-05 17:30:42.491945,5.0,kg,Twopack Arroz Extra Costeño,57.0,wong,,ARROZ ENVASADO
Arroz Superior TIMONEL Bolsa 1Kg,,vega,ARROZ ENVASADO,2024-12-05 11:36:02.001973,1.0,kg,Arroz Superior TIMONEL Bolsa,,vega,Timonel,ARROZ ENVASADO
