description,price,website,search_term,scrape_timestamp,cantidad,unidad,description_no_unit,price_numeric,WEB,unit,brand,CLASIFICACION
Alverja Verde Tesoro del Campo Bolsa 350 g,S/ 2.90,metro,ARVEJA VERDE,2024-12-05 16:13:33.669101,350.0,g,Alverja Verde Tesoro del Campo Bolsa,2.9,metro,,,ARVEJA VERDE
Arveja VEGA Bolsa 400g,S/ 2.90,vega,ARVEJA VERDE,2024-12-05 12:52:13.888658,400.0,g,Arveja VEGA Bolsa,2.9,vega,,Vega,ARVEJA VERDE
Arveja TIMONEL Bolsa 400gr,S/ 3.20,vega,ARVEJA VERDE,2024-12-05 12:52:13.888658,400.0,g,Arveja TIMONEL Bolsa r,3.2,vega,,Timonel,ARVEJA VERDE
Arroz Superior VEGA Bolsa 750g,S/ 3.70,vega,ARVEJA VERDE,2024-12-05 12:52:13.888658,750.0,g,Arroz Superior VEGA Bolsa,3.7,vega,,Vega,ARVEJA VERDE
Arveja Verde Tesoro Del Campo Bolsa 500 g,S/ 3.80,metro,ARVEJA VERDE,2024-12-05 16:13:33.669101,500.0,g,Arveja Verde Tesoro Del Campo Bolsa,3.8,metro,,,ARVEJA VERDE
Arroz Superior COSTEÑO Bolsa 750g,S/ 4.20,vega,ARVEJA VERDE,2024-12-05 12:52:13.888658,750.0,g,Arroz Superior COSTEÑO Bolsa,4.2,vega,,Costeño,ARVEJA VERDE
Arveja Verde Partida INCATRAIL Bolsa 500g,S/ 4.29,vivanda,ARVEJA VERDE,2024-12-05 22:12:00.640073,500.0,g,Arveja Verde Partida INCATRAIL Bolsa,4.29,vivanda,,INCATRAIL,ARVEJA VERDE
Arveja Verde Partida INCATRAIL Bolsa 500g,S/ 4.29 un,plaza_vea,ARVEJA VERDE,2024-12-05 15:31:18.617332,500.0,g,Arveja Verde Partida INCATRAIL Bolsa,4.29,plaza_vea,Bolsa 500g,,ARVEJA VERDE
Arveja Verde Tesoro Del Campo Bolsa 500 g,S/ 4.30,wong,ARVEJA VERDE,2024-12-05 18:49:06.950751,500.0,g,Arveja Verde Tesoro Del Campo Bolsa,4.3,wong,,,ARVEJA VERDE
Arveja Verde COSTEÑO Bolsa 500g,S/ 4.40 un,plaza_vea,ARVEJA VERDE,2024-12-05 15:31:18.617332,500.0,g,Arveja Verde COSTEÑO Bolsa,4.4,plaza_vea,Bolsa 500g,,ARVEJA VERDE
Arveja Verde COSTEÑO Bolsa 500g,S/ 4.40,vivanda,ARVEJA VERDE,2024-12-05 22:12:00.640073,500.0,g,Arveja Verde COSTEÑO Bolsa,4.4,vivanda,,COSTENO,ARVEJA VERDE
Arveja Verde Valle Norte Bolsa 500 g,S/ 4.70,metro,ARVEJA VERDE,2024-12-05 16:13:33.669101,500.0,g,Arveja Verde Valle Norte Bolsa,4.7,metro,,,ARVEJA VERDE
Arveja Verde VALLENORTE Bolsa 500g,S/ 4.90 un,plaza_vea,ARVEJA VERDE,2024-12-05 15:31:18.617332,500.0,g,Arveja Verde VALLENORTE Bolsa,4.9,plaza_vea,Bolsa 500g,,ARVEJA VERDE
Arveja Verde VALLENORTE Bolsa 500g,S/ 4.90,vivanda,ARVEJA VERDE,2024-12-05 22:12:00.640073,500.0,g,Arveja Verde VALLENORTE Bolsa,4.9,vivanda,,VALLENORTE,ARVEJA VERDE
Arveja Verde Valle Norte Bolsa 500 g,S/ 4.90,wong,ARVEJA VERDE,2024-12-05 18:49:06.950751,500.0,g,Arveja Verde Valle Norte Bolsa,4.9,wong,,,ARVEJA VERDE
Arroz Extra FARAON Bolsa 750g,S/ 5.00,vega,ARVEJA VERDE,2024-12-05 12:52:13.888658,750.0,g,Arroz Extra FARAON Bolsa,5.0,vega,,Faraon,ARVEJA VERDE
Arveja Desvainada 150g,S/ 8.30,metro,ARVEJA VERDE,2024-12-05 16:13:33.669101,150.0,g,Arveja Desvainada,8.3,metro,,,ARVEJA VERDE
Arvejas Verdes Fruto de Oro 425g,S/ 8.40,wong,ARVEJA VERDE,2024-12-05 18:49:06.950751,425.0,g,Arvejas Verdes Fruto de Oro,8.4,wong,,,ARVEJA VERDE
Arveja Desvainada 150g,S/ 8.50,wong,ARVEJA VERDE,2024-12-05 18:49:06.950751,150.0,g,Arveja Desvainada,8.5,wong,,,ARVEJA VERDE
Arveja x kg,S/ 10.79 x kg,metro,ARVEJA VERDE,2024-12-05 16:13:33.669101,1.0,kg,Arveja,10.79,metro,,,ARVEJA VERDE
Arveja x kg,S/ 10.99 x kg,wong,ARVEJA VERDE,2024-12-05 18:49:06.950751,1.0,kg,Arveja,10.99,wong,,,ARVEJA VERDE
Arveja x kg,S/ 10.99 x kg,metro,ARVEJA VERDE,2024-12-05 16:13:33.669101,1.0,kg,Arveja,10.99,metro,,,ARVEJA VERDE
Arroz Economico VEGA Bolsa 5Kg,S/ 19.50,vega,ARVEJA VERDE,2024-12-05 12:52:13.888658,5.0,kg,Arroz Economico VEGA Bolsa,19.5,vega,,Vega,ARVEJA VERDE
Cerveza PILSEN Pack 6 Botella 305ml,S/ 21.50 20%,vega,ARVEJA VERDE,2024-12-05 12:52:13.888658,305.0,ml,Cerveza PILSEN Pack 6 Botella,21.5,vega,,Pilsen,ARVEJA VERDE
Pañal PLENITUD Classic Verde Talla M Paquete 20un,S/ 34.90 31%,vega,ARVEJA VERDE,2024-12-05 12:52:13.888658,20.0,un,Pañal PLENITUD Classic Verde Talla M Paquete,34.9,vega,,Plenitud,ARVEJA VERDE
Arroz Extra VEGA Pacasmayo Saco 10Kg,S/ 45.00,vega,ARVEJA VERDE,2024-12-05 12:52:13.888658,10.0,kg,Arroz Extra VEGA Pacasmayo Saco,45.0,vega,,Veguita,ARVEJA VERDE
Arroz Superior TIMONEL Bolsa 1Kg,,vega,ARVEJA VERDE,2024-12-05 12:52:13.888658,1.0,kg,Arroz Superior TIMONEL Bolsa,,vega,,Timonel,ARVEJA VERDE
