description,price,website,search_term,scrape_timestamp,cantidad,unidad,description_no_unit,price_numeric,WEB,unit,brand,CLASIFICACION
Café Instantáneo ALTOMAYO Gourmet Frasco 170g,S/ 28.70 un,plaza_vea,CAFÉ INSTANTÁNEO,2024-12-05 16:03:03.191071,170.0,g,Café Instantáneo ALTOMAYO Gourmet Frasco,28.7,plaza_vea,Frasco 170g,,CAFÉ INSTANTÁNEO
Café Instantáneo ALTOMAYO Gourmet Frasco 170g,S/ 28.70,vivanda,CAFÉ INSTANTÁNEO,2024-12-05 22:32:41.998572,170.0,g,Café Instantáneo ALTOMAYO Gourmet Frasco,28.7,vivanda,,ALTOMAYO,CAFÉ INSTANTÁNEO
Café Instantáneo Nescafé Tradición 170g + Taza,S/ 28.90,metro,CAFÉ INSTANTÁNEO,2024-12-05 16:50:45.582436,170.0,g,Café Instantáneo Nescafé Tradición  + Taza,28.9,metro,,,CAFÉ INSTANTÁNEO
Café Descafeinado Instantáneo Jacobs Frasco 100 g,S/ 28.90,metro,CAFÉ INSTANTÁNEO,2024-12-05 16:50:45.582436,100.0,g,Café Descafeinado Instantáneo Jacobs Frasco,28.9,metro,,,CAFÉ INSTANTÁNEO
Café Instantáneo KIRMA Doypack 250g,S/ 28.90 un,plaza_vea,CAFÉ INSTANTÁNEO,2024-12-05 16:03:03.191071,250.0,g,Café Instantáneo KIRMA Doypack,28.9,plaza_vea,Doypack 250g,,CAFÉ INSTANTÁNEO
Café Instantáneo Altomayo Gourmet 170g,S/ 28.90,metro,CAFÉ INSTANTÁNEO,2024-12-05 16:50:45.582436,170.0,g,Café Instantáneo Altomayo Gourmet,28.9,metro,,,CAFÉ INSTANTÁNEO
Café Gold Suave Cronat Gold Jacobs Frasco 100 g,S/ 28.90,metro,CAFÉ INSTANTÁNEO,2024-12-05 16:50:45.582436,100.0,g,Café Gold Suave Cronat Gold Jacobs Frasco,28.9,metro,,,CAFÉ INSTANTÁNEO
Café Gold Suave Cronat Gold Jacobs Frasco 100 g,S/ 28.90,wong,CAFÉ INSTANTÁNEO,2024-12-05 19:27:58.296003,100.0,g,Café Gold Suave Cronat Gold Jacobs Frasco,28.9,wong,,,CAFÉ INSTANTÁNEO
Café Instantáneo Nescafé Descafeinado 100g,S/ 29.30,metro,CAFÉ INSTANTÁNEO,2024-12-05 16:50:45.582436,100.0,g,Café Instantáneo Nescafé Descafeinado,29.3,metro,,,CAFÉ INSTANTÁNEO
Café Instantáneo Nescafé Descafeinado 100g,S/ 29.40,wong,CAFÉ INSTANTÁNEO,2024-12-05 19:27:58.296003,100.0,g,Café Instantáneo Nescafé Descafeinado,29.4,wong,,,CAFÉ INSTANTÁNEO
Café Instantáneo Altomayo Gourmet 150g,S/ 29.50,wong,CAFÉ INSTANTÁNEO,2024-12-05 19:27:58.296003,150.0,g,Café Instantáneo Altomayo Gourmet,29.5,wong,,,CAFÉ INSTANTÁNEO
Café Instantáneo Clásico 250 g,S/ 29.90,tottus,CAFÉ INSTANTÁNEO,2024-12-05 12:44:01.248496,250.0,g,Café Instantáneo Clásico,29.9,tottus,,KIRMA,CAFÉ INSTANTÁNEO
Café Instantáneo NESCAFÉ Fina Selección Frasco...,S/ 29.90 un,plaza_vea,CAFÉ INSTANTÁNEO,2024-12-05 16:03:03.191071,200.0,g,Café Instantáneo NESCAFÉ Fina Selección Frasco,29.9,plaza_vea,Frasco 200g,,CAFÉ INSTANTÁNEO
Café instantáneo Nescafé Tradición 250 g,S/ 29.90,tottus,CAFÉ INSTANTÁNEO,2024-12-05 12:44:01.248496,250.0,g,Café instantáneo Nescafé Tradición,29.9,tottus,,NESCAFE,CAFÉ INSTANTÁNEO
Café granulado Colcafé de 170 g,S/ 29.90,tottus,CAFÉ INSTANTÁNEO,2024-12-05 12:44:01.248496,170.0,g,Café granulado Colcafé de,29.9,tottus,,COLCAFE,CAFÉ INSTANTÁNEO
Café Instantáneo ALTOMAYO Descafeinado Frasco ...,S/ 29.90 un,plaza_vea,CAFÉ INSTANTÁNEO,2024-12-05 16:03:03.191071,170.0,g,Café Instantáneo ALTOMAYO Descafeinado Frasco,29.9,plaza_vea,Frasco 170g,,CAFÉ INSTANTÁNEO
Café instantáneo Nescafé Fina Selección de 200 g,S/ 29.90,tottus,CAFÉ INSTANTÁNEO,2024-12-05 12:44:01.248496,200.0,g,Café instantáneo Nescafé Fina Selección de,29.9,tottus,,NESCAFE,CAFÉ INSTANTÁNEO
Café Instantáneo Nescafé Fina Selección 200g,S/ 30.50,metro,CAFÉ INSTANTÁNEO,2024-12-05 16:50:45.582436,200.0,g,Café Instantáneo Nescafé Fina Selección,30.5,metro,,,CAFÉ INSTANTÁNEO
Café Instantáneo Nescafé Fina Selección 200g,S/ 30.50,wong,CAFÉ INSTANTÁNEO,2024-12-05 19:27:58.296003,200.0,g,Café Instantáneo Nescafé Fina Selección,30.5,wong,,,CAFÉ INSTANTÁNEO
Café Instántaneo Intenso CAFETAL Frasco 180g,S/ 30.60 un,plaza_vea,CAFÉ INSTANTÁNEO,2024-12-05 16:03:03.191071,180.0,g,Café Instántaneo Intenso CAFETAL Frasco,30.6,plaza_vea,Frasco 180g,,CAFÉ INSTANTÁNEO
Café Instantáneo Liofilizado Cafetal 180g,S/ 30.60,metro,CAFÉ INSTANTÁNEO,2024-12-05 16:50:45.582436,180.0,g,Café Instantáneo Liofilizado Cafetal,30.6,metro,,,CAFÉ INSTANTÁNEO
Café Instantáneo NESCAFÉ Tradición Doypack 250...,S/ 30.90 un,plaza_vea,CAFÉ INSTANTÁNEO,2024-12-05 16:03:03.191071,250.0,g,Café Instantáneo NESCAFÉ Tradición Doypack 250,30.9,plaza_vea,Doypack 250g,,CAFÉ INSTANTÁNEO
Chocolate Instantáneo Choco Listo Chocolate 1kg,S/ 31.90,metro,CAFÉ INSTANTÁNEO,2024-12-05 16:50:45.582436,1.0,kg,Chocolate Instantáneo Choco Listo Chocolate,31.9,metro,,,CAFÉ INSTANTÁNEO
Café Instantáneo Illy Intenso 95g,S/ 33.00,wong,CAFÉ INSTANTÁNEO,2024-12-05 19:27:58.296003,95.0,g,Café Instantáneo Illy Intenso,33.0,wong,,,CAFÉ INSTANTÁNEO
Café Instantáneo Bustelo Espresso 100g,S/ 34.90,metro,CAFÉ INSTANTÁNEO,2024-12-05 16:50:45.582436,100.0,g,Café Instantáneo Bustelo Espresso,34.9,metro,,,CAFÉ INSTANTÁNEO
Café Liofilizado Clásico 95 g,S/ 34.90,tottus,CAFÉ INSTANTÁNEO,2024-12-05 12:44:01.248496,95.0,g,Café Liofilizado Clásico,34.9,tottus,,JUAN VALDEZ,CAFÉ INSTANTÁNEO
Café Instantáneo Cuisine & Co 190g,S/ 34.90,metro,CAFÉ INSTANTÁNEO,2024-12-05 16:50:45.582436,190.0,g,Café Instantáneo Cuisine & Co,34.9,metro,,,CAFÉ INSTANTÁNEO
Café Instantáneo Descafeinado Cuisine & Co 190g,S/ 34.90,wong,CAFÉ INSTANTÁNEO,2024-12-05 19:27:58.296003,190.0,g,Café Instantáneo Descafeinado Cuisine & Co,34.9,wong,,,CAFÉ INSTANTÁNEO
Café Instantáneo Nescafé Tradición 250g,S/ 34.90,metro,CAFÉ INSTANTÁNEO,2024-12-05 16:50:45.582436,250.0,g,Café Instantáneo Nescafé Tradición,34.9,metro,,,CAFÉ INSTANTÁNEO
CAFE INSTANTANEO PREMIUM FRASCO 170 G,S/ 35.90,tottus,CAFÉ INSTANTÁNEO,2024-12-05 12:44:01.248496,170.0,g,CAFE INSTANTANEO PREMIUM FRASCO,35.9,tottus,,ALTOMAYO,CAFÉ INSTANTÁNEO
Café Instantáneo ALTOMAYO Liofilizado Frasco 170g,S/ 35.90,vivanda,CAFÉ INSTANTÁNEO,2024-12-05 22:32:41.998572,170.0,g,Café Instantáneo ALTOMAYO Liofilizado Frasco,35.9,vivanda,,ALTOMAYO,CAFÉ INSTANTÁNEO
Café Instantáneo NESCAFÉ Tradición Doypack 250g,S/ 36.80,vivanda,CAFÉ INSTANTÁNEO,2024-12-05 22:32:41.998572,250.0,g,Café Instantáneo NESCAFÉ Tradición Doypack,36.8,vivanda,,NESCAFÉ,CAFÉ INSTANTÁNEO
Café Instantáneo Descafeinado Altomayo 170g,S/ 36.90,metro,CAFÉ INSTANTÁNEO,2024-12-05 16:50:45.582436,170.0,g,Café Instantáneo Descafeinado Altomayo,36.9,metro,,,CAFÉ INSTANTÁNEO
Café Instantáneo Nescafé Gold 100g,S/ 38.10,metro,CAFÉ INSTANTÁNEO,2024-12-05 16:50:45.582436,100.0,g,Café Instantáneo Nescafé Gold,38.1,metro,,,CAFÉ INSTANTÁNEO
CAFE INSTANTANEO DESCAFEINADO 170 GR,S/ 38.50,tottus,CAFÉ INSTANTÁNEO,2024-12-05 12:44:01.248496,170.0,g,CAFE INSTANTANEO DESCAFEINADO R,38.5,tottus,,ALTOMAYO,CAFÉ INSTANTÁNEO
Lata Café Instantáneo Altomayo Gourmet 170g + 90g,S/ 38.50,wong,CAFÉ INSTANTÁNEO,2024-12-05 19:27:58.296003,170.0,g,Lata Café Instantáneo Altomayo Gourmet  +,38.5,wong,,,CAFÉ INSTANTÁNEO
Café Instantáneo Descafeinado Bustelo Espresso 100g,S/ 38.90,wong,CAFÉ INSTANTÁNEO,2024-12-05 19:27:58.296003,100.0,g,Café Instantáneo Descafeinado Bustelo Espresso,38.9,wong,,,CAFÉ INSTANTÁNEO
Café Instantáneo Altomayo Premium 170g,S/ 39.80,metro,CAFÉ INSTANTÁNEO,2024-12-05 16:50:45.582436,170.0,g,Café Instantáneo Altomayo Premium,39.8,metro,,,CAFÉ INSTANTÁNEO
Café Instantáneo Nescafé Descafeinado 170g,S/ 41.10,metro,CAFÉ INSTANTÁNEO,2024-12-05 16:50:45.582436,170.0,g,Café Instantáneo Nescafé Descafeinado,41.1,metro,,,CAFÉ INSTANTÁNEO
Café Instantáneo Altomayo Gourmet 190g,S/ 41.50,wong,CAFÉ INSTANTÁNEO,2024-12-05 19:27:58.296003,190.0,g,Café Instantáneo Altomayo Gourmet,41.5,wong,,,CAFÉ INSTANTÁNEO
Café Instantáneo Nescafé Gold 200g,S/ 43.90,metro,CAFÉ INSTANTÁNEO,2024-12-05 16:50:45.582436,200.0,g,Café Instantáneo Nescafé Gold,43.9,metro,,,CAFÉ INSTANTÁNEO
Café Instantáneo Liofilizado Cronat Gold Suave 200 g,S/ 48.50,tottus,CAFÉ INSTANTÁNEO,2024-12-05 12:44:01.248496,200.0,g,Café Instantáneo Liofilizado Cronat Gold Suave,48.5,tottus,,JACOBS,CAFÉ INSTANTÁNEO
Café Instantáneo Liofilizado Descafeinado Supreme by Bustelo 100g,S/ 49.90,wong,CAFÉ INSTANTÁNEO,2024-12-05 19:27:58.296003,100.0,g,Café Instantáneo Liofilizado Descafeinado Supreme by Bustelo,49.9,wong,,,CAFÉ INSTANTÁNEO
Café Instantáneo Bustelo Espresso 200g,S/ 49.90,wong,CAFÉ INSTANTÁNEO,2024-12-05 19:27:58.296003,200.0,g,Café Instantáneo Bustelo Espresso,49.9,wong,,,CAFÉ INSTANTÁNEO
Café instantáneo Nescafé Gold Blend 200 gr,S/ 53.90,tottus,CAFÉ INSTANTÁNEO,2024-12-05 12:44:01.248496,200.0,g,Café instantáneo Nescafé Gold Blend r,53.9,tottus,,NESCAFE,CAFÉ INSTANTÁNEO
Café Instantáneo Folgers Classic Roast 226g,S/ 61.90,metro,CAFÉ INSTANTÁNEO,2024-12-05 16:50:45.582436,226.0,g,Café Instantáneo Folgers Classic Roast,61.9,metro,,,CAFÉ INSTANTÁNEO
Café Instantáneo Folgers Classic Roast 226g,S/ 61.90,wong,CAFÉ INSTANTÁNEO,2024-12-05 19:27:58.296003,226.0,g,Café Instantáneo Folgers Classic Roast,61.9,wong,,,CAFÉ INSTANTÁNEO
Café Instantáneo Nescafé Tradición Lata 500 g,S/ 64.60,metro,CAFÉ INSTANTÁNEO,2024-12-05 16:50:45.582436,500.0,g,Café Instantáneo Nescafé Tradición Lata,64.6,metro,,,CAFÉ INSTANTÁNEO
Café Instantáneo Descafeinado Folgers Classic 226g,S/ 65.90,metro,CAFÉ INSTANTÁNEO,2024-12-05 16:50:45.582436,226.0,g,Café Instantáneo Descafeinado Folgers Classic,65.9,metro,,,CAFÉ INSTANTÁNEO
Café Instantáneo Folgers Classic Roast 340g,S/ 75.90,metro,CAFÉ INSTANTÁNEO,2024-12-05 16:50:45.582436,340.0,g,Café Instantáneo Folgers Classic Roast,75.9,metro,,,CAFÉ INSTANTÁNEO
Café Instantáneo Altomayo Gourmet 450g,S/ 78.90,metro,CAFÉ INSTANTÁNEO,2024-12-05 16:50:45.582436,450.0,g,Café Instantáneo Altomayo Gourmet,78.9,metro,,,CAFÉ INSTANTÁNEO
