description,brand,cantidad,unidad,price_numeric,website,scrape_timestamp,search_term,cantidad_escalada,unidad_escalada,price_numeric_escalado
Sopa Instántanea AJINOMEN Sabor a Carne Bolsa 80g,AJINOMEN,80.0,g,1.6,vivanda,2024-12-05 21:39:55.601870,CARNE MOLIDA DE VACUNO,1.0,kg,20.0
Caldo de Carne DOÑA GUSTA Concentrado en Polvo Caja 42g,DOÑA GUSTA,42.0,g,2.2,vivanda,2024-12-05 21:39:55.601870,CARNE MOLIDA DE VACUNO,1.0,kg,52.38095238095238
Pimienta Negra Molida BELL'S Sobre 15g,BELL'S,15.0,g,2.5,vivanda,2024-12-05 21:39:55.601870,CARNE MOLIDA DE VACUNO,1.0,kg,166.66666666666669
Pimienta Negra Molida Cuisine & Co 18g,,18.0,g,3.2,metro,2024-12-05 15:27:03.017612,CARNE MOLIDA DE VACUNO,1.0,kg,177.7777777777778
Canela Molida KARIÑO Sobre 12g,KARINO,12.0,g,4.2,vivanda,2024-12-05 21:39:55.601870,CARNE MOLIDA DE VACUNO,1.0,kg,350.0
Caldo en cubitos MAGGI Sabor carne Caja 75.2Gr,MAGGI,75.2,g,4.5,vivanda,2024-12-05 21:39:55.601870,CARNE MOLIDA DE VACUNO,1.0,kg,59.84042553191489
Comida para Gatos FELIX Sensaciones de Carne en Salsa Pouch 85g,FELIX,85.0,g,4.8,vivanda,2024-12-05 21:39:55.601870,CARNE MOLIDA DE VACUNO,1.0,kg,56.47058823529411
Comida para Perros DOG CHOW Adultos Cena de Carne Pouch 100g,DOG CHOW,100.0,g,4.9,vivanda,2024-12-05 21:39:55.601870,CARNE MOLIDA DE VACUNO,1.0,kg,49.0
"Comida para Perros DOG CHOW Cachorros Razas Pequeñas Sabor Carne, Leche y Arroz Pouch 100g",DOG CHOW,100.0,g,4.9,vivanda,2024-12-05 21:39:55.601870,CARNE MOLIDA DE VACUNO,1.0,kg,49.0
Pimienta Negra Molida 4 ESTACIONES Frasco 35g,4ESTACIONES,35.0,g,4.99,vivanda,2024-12-05 21:39:55.601870,CARNE MOLIDA DE VACUNO,1.0,kg,142.57142857142856
Nuggets de Pollo San Fernando 180g,,180.0,g,5.0,metro,2024-12-05 15:27:03.017612,CARNE MOLIDA DE VACUNO,1.0,kg,27.77777777777778
Caldo MAGGI Cubito Sabor Carne 100g Paquete 25un,MAGGI,100.0,g,5.5,vivanda,2024-12-05 21:39:55.601870,CARNE MOLIDA DE VACUNO,1.0,kg,55.0
Comida para Perros RICOCAN Adultos Paté con Carne Lata 330g,RICOCAN,330.0,g,5.9,vivanda,2024-12-05 21:39:55.601870,CARNE MOLIDA DE VACUNO,1.0,kg,17.87878787878788
Sangrecita Sin Condimentos Redondos Bolsa 500 g,,500.0,g,6.39,metro,2024-12-05 15:27:03.017612,CARNE MOLIDA DE VACUNO,1.0,kg,12.78
Sangrecita Criolla Cuisine & Co 500g,,500.0,g,6.4,metro,2024-12-05 15:27:03.017612,CARNE MOLIDA DE VACUNO,1.0,kg,12.8
Bonito Entero x kg,,1.0,kg,6.9,metro,2024-12-05 15:27:03.017612,CARNE MOLIDA DE VACUNO,1.0,kg,6.9
Pimienta KARIÑO Negra molida Frasco 40Gr,KARINO,40.0,g,6.99,vivanda,2024-12-05 21:39:55.601870,CARNE MOLIDA DE VACUNO,1.0,kg,174.75
Patas de Pollo Redondos x kg,,1.0,kg,7.9,metro,2024-12-05 15:27:03.017612,CARNE MOLIDA DE VACUNO,1.0,kg,7.9
Pierna con Encuentro Congelada Importada x kg,,1.0,kg,7.9,metro,2024-12-05 15:27:03.017612,CARNE MOLIDA DE VACUNO,1.0,kg,7.9
Pierna de Pollo Importada x kg,,1.0,kg,8.9,metro,2024-12-05 15:27:03.017612,CARNE MOLIDA DE VACUNO,1.0,kg,8.9
Hígado de Pollo Redondos x kg,,1.0,kg,8.9,metro,2024-12-05 15:27:03.017612,CARNE MOLIDA DE VACUNO,1.0,kg,8.9
Gallina Entera Con Menudencia Importada x Kg,,1.0,kg,8.9,metro,2024-12-05 15:27:03.017612,CARNE MOLIDA DE VACUNO,1.0,kg,8.9
Pollo Entero Fresco Metro x kg,,1.0,kg,9.4,metro,2024-12-05 15:27:03.017612,CARNE MOLIDA DE VACUNO,1.0,kg,9.4
Porciones de Bonito Congelado Bolsa 500 g,,500.0,g,9.5,metro,2024-12-05 15:27:03.017612,CARNE MOLIDA DE VACUNO,1.0,kg,19.0
Pimienta BADIA Negra molida Frasco 56.7Gr,BADIA,56.7,g,9.9,vivanda,2024-12-05 21:39:55.601870,CARNE MOLIDA DE VACUNO,1.0,kg,174.60317460317458
Pollo con Menudencia Redondos x kg,,1.0,kg,10.25,metro,2024-12-05 15:27:03.017612,CARNE MOLIDA DE VACUNO,1.0,kg,10.25
Pollo Fresco con Menudencia San Fernando x Kg,,1.0,kg,10.45,metro,2024-12-05 15:27:03.017612,CARNE MOLIDA DE VACUNO,1.0,kg,10.45
Lunch Picante de Carne con Arroz LA FLORENCIA 450g,LA FLORENCIA,450.0,g,10.9,vivanda,2024-12-05 21:39:55.601870,CARNE MOLIDA DE VACUNO,1.0,kg,24.222222222222225
Ravioles de Carne y Verdura BELL'S Paquete 500g,BELL'S,500.0,g,10.9,vivanda,2024-12-05 21:39:55.601870,CARNE MOLIDA DE VACUNO,1.0,kg,21.8
Ravioles de Carne Metro 500g,,500.0,g,10.99,metro,2024-12-05 15:27:03.017612,CARNE MOLIDA DE VACUNO,1.0,kg,21.98
Hamburguesa de Carne La Casera SAN FERNANDO Bolsa 910g,SAN FERNANDO,910.0,g,12.6,vivanda,2024-12-05 21:39:55.601870,CARNE MOLIDA DE VACUNO,1.0,kg,13.846153846153845
Carne de Pollo Molida San Fernando 500g,,500.0,g,12.7,metro,2024-12-05 15:27:03.017612,CARNE MOLIDA DE VACUNO,1.0,kg,25.4
Pulmón Precocido para Chanfainita x kg,,1.0,kg,12.9,metro,2024-12-05 15:27:03.017612,CARNE MOLIDA DE VACUNO,1.0,kg,12.9
Tilapia en Filetes Congelada Cuisine & Co 500g,,500.0,g,12.9,metro,2024-12-05 15:27:03.017612,CARNE MOLIDA DE VACUNO,1.0,kg,25.8
Corazón de Pollo Redondos x kg,,1.0,kg,12.9,metro,2024-12-05 15:27:03.017612,CARNE MOLIDA DE VACUNO,1.0,kg,12.9
Porciones de Perico Pescanova 300g,,300.0,g,13.5,metro,2024-12-05 15:27:03.017612,CARNE MOLIDA DE VACUNO,1.0,kg,45.0
Hígado de Res Importado Trozado x kg,,1.0,kg,13.9,metro,2024-12-05 15:27:03.017612,CARNE MOLIDA DE VACUNO,1.0,kg,13.9
Carne Molida Económica Congelada Los Hierros x 500 g,,500.0,g,13.9,metro,2024-12-05 15:27:03.017612,CARNE MOLIDA DE VACUNO,1.0,kg,27.8
Molleja de Pollo Redondos x kg,,1.0,kg,13.9,metro,2024-12-05 15:27:03.017612,CARNE MOLIDA DE VACUNO,1.0,kg,13.9
Comida para gatos RICOCAT Gatitos carne pescado y leche Bolsa 1Kg,RICOCAT,1.0,kg,14.5,vivanda,2024-12-05 21:39:55.601870,CARNE MOLIDA DE VACUNO,1.0,kg,14.5
Pierna con Encuentro de Pollo Redondos x kg,,1.0,kg,14.5,metro,2024-12-05 15:27:03.017612,CARNE MOLIDA DE VACUNO,1.0,kg,14.5
Chuleta Punta de Lomo x kg,,1.0,kg,14.9,metro,2024-12-05 15:27:03.017612,CARNE MOLIDA DE VACUNO,1.0,kg,14.9
Pavo Entero Redondos x kg,,1.0,kg,14.9,metro,2024-12-05 15:27:03.017612,CARNE MOLIDA DE VACUNO,1.0,kg,14.9
Pavo Entero Congelado San Fernando x kg,,1.0,kg,15.4,metro,2024-12-05 15:27:03.017612,CARNE MOLIDA DE VACUNO,1.0,kg,15.4
Pechuga Entera de Pollo Redondos x kg,,1.0,kg,15.5,metro,2024-12-05 15:27:03.017612,CARNE MOLIDA DE VACUNO,1.0,kg,15.5
Carne Molida de Cerdo SAN FERNANDO Paquete 500g,SAN FERNANDO,500.0,g,15.5,vivanda,2024-12-05 21:39:55.601870,CARNE MOLIDA DE VACUNO,1.0,kg,31.0
Milanesa de Pollo Cuisine & Co 400g,,400.0,g,15.7,metro,2024-12-05 15:27:03.017612,CARNE MOLIDA DE VACUNO,1.0,kg,39.25
Carne Molida de Pavita x 500g,VIVANDA,500.0,g,15.9,vivanda,2024-12-05 21:39:55.601870,CARNE MOLIDA DE VACUNO,1.0,kg,31.8
Pierna de Pollo Redondos x kg,,1.0,kg,15.9,metro,2024-12-05 15:27:03.017612,CARNE MOLIDA DE VACUNO,1.0,kg,15.9
Carne Molida de Pavita San Fernando Bolsa 500 g,,500.0,g,16.4,metro,2024-12-05 15:27:03.017612,CARNE MOLIDA DE VACUNO,1.0,kg,32.8
Muslo de de Pollo Redondos x kg,,1.0,kg,16.49,metro,2024-12-05 15:27:03.017612,CARNE MOLIDA DE VACUNO,1.0,kg,16.49
Pierna de Pollo Congelada San Fernando x kg,,1.0,kg,16.5,metro,2024-12-05 15:27:03.017612,CARNE MOLIDA DE VACUNO,1.0,kg,16.5
Muslo de Pollo Congelado San Fernando x kg,,1.0,kg,16.5,metro,2024-12-05 15:27:03.017612,CARNE MOLIDA DE VACUNO,1.0,kg,16.5
Filete de Pechuga Importado x kg,,1.0,kg,16.5,metro,2024-12-05 15:27:03.017612,CARNE MOLIDA DE VACUNO,1.0,kg,16.5
Mondongo Picado para Cau Cau x kg,,1.0,kg,16.9,metro,2024-12-05 15:27:03.017612,CARNE MOLIDA DE VACUNO,1.0,kg,16.9
Mondongo Picado a La Italiana x kg,,1.0,kg,16.9,metro,2024-12-05 15:27:03.017612,CARNE MOLIDA DE VACUNO,1.0,kg,16.9
Pechuga Especial de Pollo Redondos x kg,,1.0,kg,17.5,metro,2024-12-05 15:27:03.017612,CARNE MOLIDA DE VACUNO,1.0,kg,17.5
Trucha Entera Eviscerada x kg,,1.0,kg,18.9,metro,2024-12-05 15:27:03.017612,CARNE MOLIDA DE VACUNO,1.0,kg,18.9
Chuleta de Pierna de Cerdo con Piel Porcionada x kg,,1.0,kg,18.9,metro,2024-12-05 15:27:03.017612,CARNE MOLIDA DE VACUNO,1.0,kg,18.9
Carne Molida Especial Congelada Los Hierros x 500 g,,500.0,g,18.9,metro,2024-12-05 15:27:03.017612,CARNE MOLIDA DE VACUNO,1.0,kg,37.8
Chuleta de Lomo de Cerdo con Piel Porcionado x kg,,1.0,kg,18.9,metro,2024-12-05 15:27:03.017612,CARNE MOLIDA DE VACUNO,1.0,kg,18.9
Costillar Nacional x kg,,1.0,kg,18.9,metro,2024-12-05 15:27:03.017612,CARNE MOLIDA DE VACUNO,1.0,kg,18.9
Pechuga de Pavita en Trozos San Fernando x Kg,,1.0,kg,18.99,metro,2024-12-05 15:27:03.017612,CARNE MOLIDA DE VACUNO,1.0,kg,18.99
Pechuga Light de Pollo Redondos x kg,,1.0,kg,19.5,metro,2024-12-05 15:27:03.017612,CARNE MOLIDA DE VACUNO,1.0,kg,19.5
Salsa de Carne DON ITALO Pote 250g,DON ITALO,250.0,g,19.7,vivanda,2024-12-05 21:39:55.601870,CARNE MOLIDA DE VACUNO,1.0,kg,78.8
Carne Molida de Res Empacada al vacío EL BUEN ...,,0.6,kg,19.8,plaza_vea,2024-12-05 14:43:30.656453,CARNE MOLIDA DE VACUNO,1.0,kg,33.0
Carne Molida Porcionada Los Hierros 800g,,800.0,g,19.9,metro,2024-12-05 15:27:03.017612,CARNE MOLIDA DE VACUNO,1.0,kg,24.875
Filete de Tilapia Umi Foods 1kg,,1.0,kg,20.5,metro,2024-12-05 15:27:03.017612,CARNE MOLIDA DE VACUNO,1.0,kg,20.5
Pollo Entero Marinado Sazón Brasa San Fernando 1.4kg,,1.4,kg,21.9,metro,2024-12-05 15:27:03.017612,CARNE MOLIDA DE VACUNO,1.0,kg,15.642857142857142
Sancochado Punta de Pecho Nacional x kg,,1.0,kg,21.9,metro,2024-12-05 15:27:03.017612,CARNE MOLIDA DE VACUNO,1.0,kg,21.9
Guiso de Pechuga de Pavita San Fernando x kg,,1.0,kg,22.7,metro,2024-12-05 15:27:03.017612,CARNE MOLIDA DE VACUNO,1.0,kg,22.7
Filete de Pierna de Pollo Sin Piel Redondos x kg,,1.0,kg,22.9,metro,2024-12-05 15:27:03.017612,CARNE MOLIDA DE VACUNO,1.0,kg,22.9
Medallón de Muslo de Pavita San Fernando x kg,,1.0,kg,23.99,metro,2024-12-05 15:27:03.017612,CARNE MOLIDA DE VACUNO,1.0,kg,23.99
Comida para Perros DOG CHOW Adultos razas Medianas y Grandes Carne y Pollo Bolsa 1.5kg,DOG CHOW,1.5,kg,24.5,vivanda,2024-12-05 21:39:55.601870,CARNE MOLIDA DE VACUNO,1.0,kg,16.333333333333332
Comida para Perros DOG CHOW Adultos razas Pequeñas Carne y Pollo Bolsa 1.5kg,DOG CHOW,1.5,kg,24.5,vivanda,2024-12-05 21:39:55.601870,CARNE MOLIDA DE VACUNO,1.0,kg,16.333333333333332
"Comida para Perros DOG CHOW Cachorros Medianos y Grandes Carne, Pollo, Verduras y Leche Bolsa 1.5kg",DOG CHOW,1.5,kg,24.5,vivanda,2024-12-05 21:39:55.601870,CARNE MOLIDA DE VACUNO,1.0,kg,16.333333333333332
Guiso de Cerdo x kg,,1.0,kg,24.9,metro,2024-12-05 15:27:03.017612,CARNE MOLIDA DE VACUNO,1.0,kg,24.9
Carne Molida Económica Congelada Los Hierros x 1 Kg,,1.0,kg,24.9,metro,2024-12-05 15:27:03.017612,CARNE MOLIDA DE VACUNO,1.0,kg,24.9
Carne Molida Especial Nacional x kg,,1.0,kg,24.99,metro,2024-12-05 15:27:03.017612,CARNE MOLIDA DE VACUNO,1.0,kg,24.99
Carne Molida EL BUEN CORTE x kg,EL BUEN CORTE,1.0,kg,25.0,vivanda,2024-12-05 21:39:55.601870,CARNE MOLIDA DE VACUNO,1.0,kg,25.0
Filete de Pechuga Pollo Redondos x kg,,1.0,kg,25.4,metro,2024-12-05 15:27:03.017612,CARNE MOLIDA DE VACUNO,1.0,kg,25.4
Sancochado de Osobuco Nacional Porcionado x kg,,1.0,kg,25.9,metro,2024-12-05 15:27:03.017612,CARNE MOLIDA DE VACUNO,1.0,kg,25.9
Comida para Gatitos PURINA ONE Toda Razas Carne Bolsa 500g,PURINA ONE,500.0,g,26.2,vivanda,2024-12-05 21:39:55.601870,CARNE MOLIDA DE VACUNO,1.0,kg,52.4
Filete de Pechuga de Pollo Congelada San Fernando x kg,,1.0,kg,26.7,metro,2024-12-05 15:27:03.017612,CARNE MOLIDA DE VACUNO,1.0,kg,26.7
Tilapia en Filetes Congelada Cuisine & Co 1kg,,1.0,kg,26.9,metro,2024-12-05 15:27:03.017612,CARNE MOLIDA DE VACUNO,1.0,kg,26.9
Filete de Trucha Cuisine & Co 500g,,500.0,g,28.9,metro,2024-12-05 15:27:03.017612,CARNE MOLIDA DE VACUNO,1.0,kg,57.8
Filete de Trucha Arco Iris Bolsa 500 g,,500.0,g,29.5,metro,2024-12-05 15:27:03.017612,CARNE MOLIDA DE VACUNO,1.0,kg,59.0
Albóndiga de Res De la Casa x kg,,1.0,kg,29.9,metro,2024-12-05 15:27:03.017612,CARNE MOLIDA DE VACUNO,1.0,kg,29.9
Chuleta de Pechuga de Pavita San Fernando x kg,,1.0,kg,29.9,metro,2024-12-05 15:27:03.017612,CARNE MOLIDA DE VACUNO,1.0,kg,29.9
Panceta de Cerdo en Tiras con Piel y con Hueso x kg,,1.0,kg,29.9,metro,2024-12-05 15:27:03.017612,CARNE MOLIDA DE VACUNO,1.0,kg,29.9
Ravioles DON ITALO De carne Bandeja 500Gr,DON ITALO,500.0,g,32.5,vivanda,2024-12-05 21:39:55.601870,CARNE MOLIDA DE VACUNO,1.0,kg,65.0
Carne para Guiso Nacional x kg,,1.0,kg,33.9,metro,2024-12-05 15:27:03.017612,CARNE MOLIDA DE VACUNO,1.0,kg,33.9
Carne para Guiso Nacional x kg,,1.0,kg,33.9,metro,2024-12-05 15:27:03.017612,CARNE MOLIDA DE VACUNO,1.0,kg,33.9
Panceta de Cerdo con Piel y con Hueso x kg,,1.0,kg,33.9,metro,2024-12-05 15:27:03.017612,CARNE MOLIDA DE VACUNO,1.0,kg,33.9
Carne Molida Light de Res Empacada al vacío EL...,,0.6,kg,34.8,plaza_vea,2024-12-05 14:43:30.656453,CARNE MOLIDA DE VACUNO,1.0,kg,58.0
Lechón Entero Congelado Redondos x kg,,1.0,kg,34.9,metro,2024-12-05 15:27:03.017612,CARNE MOLIDA DE VACUNO,1.0,kg,34.9
Carne Molida de Bisteck Nacional x kg,,1.0,kg,35.8,metro,2024-12-05 15:27:03.017612,CARNE MOLIDA DE VACUNO,1.0,kg,35.8
Carne Molida Light EL BUEN CORTE x kg,EL BUEN CORTE,1.0,kg,36.5,vivanda,2024-12-05 21:39:55.601870,CARNE MOLIDA DE VACUNO,1.0,kg,36.5
Churrasco Largo Nacional Porcionado x kg,,1.0,kg,36.9,metro,2024-12-05 15:27:03.017612,CARNE MOLIDA DE VACUNO,1.0,kg,36.9
Churrasco Redondo Nacional Porcionado x kg,,1.0,kg,36.9,metro,2024-12-05 15:27:03.017612,CARNE MOLIDA DE VACUNO,1.0,kg,36.9
Carne para Guiso de Ternero Wong x kg,,1.0,kg,37.6,metro,2024-12-05 15:27:03.017612,CARNE MOLIDA DE VACUNO,1.0,kg,37.6
Panceta de Cerdo en Tiras con Piel y con Hueso San Fernando x kg,,1.0,kg,38.9,metro,2024-12-05 15:27:03.017612,CARNE MOLIDA DE VACUNO,1.0,kg,38.9
Carne Picada de Res Metro x kg,,1.0,kg,38.9,metro,2024-12-05 15:27:03.017612,CARNE MOLIDA DE VACUNO,1.0,kg,38.9
Bisteck de Paleta Nacional x kg,,1.0,kg,39.9,metro,2024-12-05 15:27:03.017612,CARNE MOLIDA DE VACUNO,1.0,kg,39.9
Bisteck Bola de Lomo Nacional x kg,,1.0,kg,39.9,metro,2024-12-05 15:27:03.017612,CARNE MOLIDA DE VACUNO,1.0,kg,39.9
Bisteck de Tapa Nacional x kg,,1.0,kg,39.9,metro,2024-12-05 15:27:03.017612,CARNE MOLIDA DE VACUNO,1.0,kg,39.9
Carne para Guiso Especial Nacional x kg,,1.0,kg,41.9,metro,2024-12-05 15:27:03.017612,CARNE MOLIDA DE VACUNO,1.0,kg,41.9
Guiso Especial Nacional x kg,,1.0,kg,41.9,metro,2024-12-05 15:27:03.017612,CARNE MOLIDA DE VACUNO,1.0,kg,41.9
Comida para Perros RICOCAN Cachorros Razas Medianas y Grandes Carne y Leche Bolsa 3Kg,RICOCAN,3.0,kg,42.6,vivanda,2024-12-05 21:39:55.601870,CARNE MOLIDA DE VACUNO,1.0,kg,14.2
Comida para Perros RICOCAN Cachorros Razas Pequeñas Carne y Leche Bolsa 3Kg,RICOCAN,3.0,kg,42.6,vivanda,2024-12-05 21:39:55.601870,CARNE MOLIDA DE VACUNO,1.0,kg,14.2
Carne para Saltado de Res Nacional Metro x Kg,,1.0,kg,43.9,metro,2024-12-05 15:27:03.017612,CARNE MOLIDA DE VACUNO,1.0,kg,43.9
"Comida para Perros DOG CHOW Cachorros Medianos y Grandes Carne, Pollo, Verduras y Leche Bolsa 3kg",DOG CHOW,3.0,kg,44.6,vivanda,2024-12-05 21:39:55.601870,CARNE MOLIDA DE VACUNO,1.0,kg,14.866666666666667
Comida para Perros DOG CHOW Adultos todos los tamaños Carne y Pollo Bolsa 3kg,DOG CHOW,3.0,kg,44.6,vivanda,2024-12-05 21:39:55.601870,CARNE MOLIDA DE VACUNO,1.0,kg,14.866666666666667
Carne para Lomo Saltado EL BUEN CORTE x kg,EL BUEN CORTE,1.0,kg,45.0,vivanda,2024-12-05 21:39:55.601870,CARNE MOLIDA DE VACUNO,1.0,kg,45.0
Filete de Pechuga Artisan x Kg. Libre de Antibióticos,,1.0,kg,46.6,metro,2024-12-05 15:27:03.017612,CARNE MOLIDA DE VACUNO,1.0,kg,46.6
Filete de Trucha x kg,,1.0,kg,47.5,metro,2024-12-05 15:27:03.017612,CARNE MOLIDA DE VACUNO,1.0,kg,47.5
Bife Angosto Metro x kg,,1.0,kg,49.9,metro,2024-12-05 15:27:03.017612,CARNE MOLIDA DE VACUNO,1.0,kg,49.9
Filete de Salmón Atlántico Aqua 500g,,500.0,g,52.5,metro,2024-12-05 15:27:03.017612,CARNE MOLIDA DE VACUNO,1.0,kg,105.0
Lasagna DON ITALO de Carne Caja 1Kg,DON ITALO,1.0,kg,58.2,vivanda,2024-12-05 21:39:55.601870,CARNE MOLIDA DE VACUNO,1.0,kg,58.2
Comida para Perros DOG CHOW Adultos razas Medianas y Grandes Carne y Pollo Bolsa 3kg,DOG CHOW,3.0,kg,58.8,vivanda,2024-12-05 21:39:55.601870,CARNE MOLIDA DE VACUNO,1.0,kg,19.599999999999998
Comida para Perros DOG CHOW Adultos razas Pequeñas Carne y Pollo Bolsa 3kg,DOG CHOW,3.0,kg,58.8,vivanda,2024-12-05 21:39:55.601870,CARNE MOLIDA DE VACUNO,1.0,kg,19.599999999999998
Comida para Perros PURINA ONE Cachorros Toda Razas Pollo Carne Bolsa 2Kg,PURINA ONE,2.0,kg,61.1,vivanda,2024-12-05 21:39:55.601870,CARNE MOLIDA DE VACUNO,1.0,kg,30.55
Carne para Guiso Especial Wong Premium x kg,,1.0,kg,61.5,metro,2024-12-05 15:27:03.017612,CARNE MOLIDA DE VACUNO,1.0,kg,61.5
Filete de Salmón Fresco x kg,,1.0,kg,64.9,metro,2024-12-05 15:27:03.017612,CARNE MOLIDA DE VACUNO,1.0,kg,64.9
Picanha x kg,,1.0,kg,73.9,metro,2024-12-05 15:27:03.017612,CARNE MOLIDA DE VACUNO,1.0,kg,73.9
Comida para Perros RICOCAN Cachorros Razas Pequeñas Carnes y Leche Bolsa 8Kg,RICOCAN,8.0,kg,76.9,vivanda,2024-12-05 21:39:55.601870,CARNE MOLIDA DE VACUNO,1.0,kg,9.6125
Comida para Gatitos PURINA ONE Toda Razas Carne Bolsa 2Kg,PURINA ONE,2.0,kg,78.8,vivanda,2024-12-05 21:39:55.601870,CARNE MOLIDA DE VACUNO,1.0,kg,39.4
Lomo Fino Metro x kg,,1.0,kg,85.9,metro,2024-12-05 15:27:03.017612,CARNE MOLIDA DE VACUNO,1.0,kg,85.9
Ricocat Cachorro Carne Pescado Leche 9Kg,,9.0,kg,89.9,metro,2024-12-05 15:27:03.017612,CARNE MOLIDA DE VACUNO,1.0,kg,9.988888888888889
Alimento para Perros Adultos Mimaskot Carnes Medianos y Grandes 15kg,,15.0,kg,97.9,metro,2024-12-05 15:27:03.017612,CARNE MOLIDA DE VACUNO,1.0,kg,6.526666666666667
Comida para Gatos RICOCAT Gatitos Carne Pescado y Leche Bolsa 9Kg,RICOCAT,9.0,kg,99.0,vivanda,2024-12-05 21:39:55.601870,CARNE MOLIDA DE VACUNO,1.0,kg,11.0
Comida para Perros DOG CHOW Adultos razas Medianas y Grandes Carne y Pollo Bolsa 8kg,DOG CHOW,8.0,kg,120.1,vivanda,2024-12-05 21:39:55.601870,CARNE MOLIDA DE VACUNO,1.0,kg,15.0125
Comida para Perros DOG CHOW Adultos razas Pequeñas Carne y Pollo Bolsa 8kg,DOG CHOW,8.0,kg,120.1,vivanda,2024-12-05 21:39:55.601870,CARNE MOLIDA DE VACUNO,1.0,kg,15.0125
Comida para Perros DOG CHOW Adultos todos los tamaños Carne y Pollo Bolsa 8kg,DOG CHOW,8.0,kg,120.6,vivanda,2024-12-05 21:39:55.601870,CARNE MOLIDA DE VACUNO,1.0,kg,15.075
"Comida para Perros DOG CHOW Adultos todos los tamaños Carne, Pollo y Pescado Bolsa 8kg",DOG CHOW,8.0,kg,124.8,vivanda,2024-12-05 21:39:55.601870,CARNE MOLIDA DE VACUNO,1.0,kg,15.6
Comida para Gatos ONE adultos esterilizados sabor pollo y carne bolsa 6kg,ONE,6.0,kg,187.5,vivanda,2024-12-05 21:39:55.601870,CARNE MOLIDA DE VACUNO,1.0,kg,31.25
