description,price,website,search_term,scrape_timestamp,cantidad,unidad,description_no_unit,price_numeric,WEB,unit,brand,CLASIFICACION
Cereal de Quinua Toffee +NUTRI Co Caja 200g,S/ 18.90,vivanda,CEREALES PROCESADOS SIMPLES (HOJUELAS),2024-12-05 21:37:42.977210,200.0,g,Cereal de Quinua Toffee +NUTRI Co Caja,18.9,vivanda,,+NUTRI CO,CEREALES PROCESADOS SIMPLES (HOJUELAS)
Cereal de Trigo Integral Fitness Miel y Almendras 330g,S/ 18.90,metro,CEREALES PROCESADOS SIMPLES (HOJUELAS),2024-12-05 15:22:04.245656,330.0,g,Cereal de Trigo Integral Fitness Miel y Almendras,18.9,metro,,,CEREALES PROCESADOS SIMPLES (HOJUELAS)
Cereal de Trigo Integral Fitness Miel y Almendras 330g,S/ 18.90,wong,CEREALES PROCESADOS SIMPLES (HOJUELAS),2024-12-05 17:51:19.506134,330.0,g,Cereal de Trigo Integral Fitness Miel y Almendras,18.9,wong,,,CEREALES PROCESADOS SIMPLES (HOJUELAS)
Cereal de Trigo Integral Fitness Frutas 330g,S/ 18.90,metro,CEREALES PROCESADOS SIMPLES (HOJUELAS),2024-12-05 15:22:04.245656,330.0,g,Cereal de Trigo Integral Fitness Frutas,18.9,metro,,,CEREALES PROCESADOS SIMPLES (HOJUELAS)
Cereal Zucaritas Milkshake de Fresa 330g,S/ 19.00,wong,CEREALES PROCESADOS SIMPLES (HOJUELAS),2024-12-05 17:51:19.506134,330.0,g,Cereal Zucaritas Milkshake de Fresa,19.0,wong,,,CEREALES PROCESADOS SIMPLES (HOJUELAS)
Cereal NESTLE Chocapic Caja 350g,S/ 19.70,vega,CEREALES PROCESADOS SIMPLES (HOJUELAS),2024-12-05 11:52:55.078757,350.0,g,Cereal NESTLE Chocapic Caja,19.7,vega,,Nestle,CEREALES PROCESADOS SIMPLES (HOJUELAS)
Cereal en hojuelas con pasas y coco de 330 g,S/ 19.70,tottus,CEREALES PROCESADOS SIMPLES (HOJUELAS),2024-12-05 11:23:25.420356,330.0,g,Cereal en hojuelas con pasas y coco de,19.7,tottus,,FITNESS,CEREALES PROCESADOS SIMPLES (HOJUELAS)
Cereal ÁNGEL Chocolate Bolsa 840g,S/ 19.80 un,plaza_vea,CEREALES PROCESADOS SIMPLES (HOJUELAS),2024-12-05 14:39:33.755116,840.0,g,Cereal ÁNGEL Chocolate Bolsa,19.8,plaza_vea,Bolsa 840g,,CEREALES PROCESADOS SIMPLES (HOJUELAS)
"Cereal Orgánico de Quinua, Arroz y Cacao Kids Organics Caja 240 gr",S/ 20.10,metro,CEREALES PROCESADOS SIMPLES (HOJUELAS),2024-12-05 15:22:04.245656,240.0,g,"Cereal Orgánico de Quinua, Arroz y Cacao Kids Organics Caja r",20.1,metro,,,CEREALES PROCESADOS SIMPLES (HOJUELAS)
"Cereal Orgánico de Quinua, Kiwicha y Arroz Kids Organics Caja 240 gr",S/ 20.10,wong,CEREALES PROCESADOS SIMPLES (HOJUELAS),2024-12-05 17:51:19.506134,240.0,g,"Cereal Orgánico de Quinua, Kiwicha y Arroz Kids Organics Caja r",20.1,wong,,,CEREALES PROCESADOS SIMPLES (HOJUELAS)
Cereal 2 CERRITOS Cubierto de chocolate Caja 3...,S/ 20.50 un,plaza_vea,CEREALES PROCESADOS SIMPLES (HOJUELAS),2024-12-05 14:39:33.755116,350.0,g,Cereal 2 CERRITOS Cubierto de chocolate Caja 3,20.5,plaza_vea,Caja 350g,,CEREALES PROCESADOS SIMPLES (HOJUELAS)
Cereal Naturandes 7 Semillas Vainilla 200g,S/ 20.50,metro,CEREALES PROCESADOS SIMPLES (HOJUELAS),2024-12-05 15:22:04.245656,200.0,g,Cereal Naturandes 7 Semillas Vainilla,20.5,metro,,,CEREALES PROCESADOS SIMPLES (HOJUELAS)
Hojuelas de Avena Huella Verde 400g,S/ 20.70,wong,CEREALES PROCESADOS SIMPLES (HOJUELAS),2024-12-05 17:51:19.506134,400.0,g,Hojuelas de Avena Huella Verde,20.7,wong,,,CEREALES PROCESADOS SIMPLES (HOJUELAS)
Cereal CHOCAPIC Caja 540g,S/ 20.80 un,plaza_vea,CEREALES PROCESADOS SIMPLES (HOJUELAS),2024-12-05 14:39:33.755116,540.0,g,Cereal CHOCAPIC Caja,20.8,plaza_vea,Caja 540g,,CEREALES PROCESADOS SIMPLES (HOJUELAS)
Cereal Froot Loops Spinners 265g,S/ 20.90,wong,CEREALES PROCESADOS SIMPLES (HOJUELAS),2024-12-05 17:51:19.506134,265.0,g,Cereal Froot Loops Spinners,20.9,wong,,,CEREALES PROCESADOS SIMPLES (HOJUELAS)
Cereal Froot Loops Spinners 265g,S/ 20.90,metro,CEREALES PROCESADOS SIMPLES (HOJUELAS),2024-12-05 15:22:04.245656,265.0,g,Cereal Froot Loops Spinners,20.9,metro,,,CEREALES PROCESADOS SIMPLES (HOJUELAS)
Cereal Chocapic Nestlé 350g,S/ 20.90,metro,CEREALES PROCESADOS SIMPLES (HOJUELAS),2024-12-05 15:22:04.245656,350.0,g,Cereal Chocapic Nestlé,20.9,metro,,,CEREALES PROCESADOS SIMPLES (HOJUELAS)
Cereal Corn Flakes Sin Gluten 740g,S/ 20.90,metro,CEREALES PROCESADOS SIMPLES (HOJUELAS),2024-12-05 15:22:04.245656,740.0,g,Cereal Corn Flakes Sin Gluten,20.9,metro,,,CEREALES PROCESADOS SIMPLES (HOJUELAS)
Cereal Marshmellows TRIX Caja 300g,S/ 20.90,vivanda,CEREALES PROCESADOS SIMPLES (HOJUELAS),2024-12-05 21:37:42.977210,300.0,g,Cereal Marshmellows TRIX Caja,20.9,vivanda,,TRIX,CEREALES PROCESADOS SIMPLES (HOJUELAS)
Cereal NESTLÉ Corn Flakes sin Gluten Bolsa 740g,S/ 20.90,vivanda,CEREALES PROCESADOS SIMPLES (HOJUELAS),2024-12-05 21:37:42.977210,740.0,g,Cereal NESTLÉ Corn Flakes sin Gluten Bolsa,20.9,vivanda,,NESTLÉ,CEREALES PROCESADOS SIMPLES (HOJUELAS)
Cereal Infantil CERELAC 5 Cereales y Leche Caj...,S/ 21.10 un,plaza_vea,CEREALES PROCESADOS SIMPLES (HOJUELAS),2024-12-05 14:39:33.755116,400.0,g,Cereal Infantil CERELAC 5 Cereales y Leche Caj,21.1,plaza_vea,Caja 400g,,CEREALES PROCESADOS SIMPLES (HOJUELAS)
Cereales con Marshmellows Trix 300g,S/ 21.50,metro,CEREALES PROCESADOS SIMPLES (HOJUELAS),2024-12-05 15:22:04.245656,300.0,g,Cereales con Marshmellows Trix,21.5,metro,,,CEREALES PROCESADOS SIMPLES (HOJUELAS)
Cereal de Quinua Nura Choco Pops 200g,S/ 21.50,metro,CEREALES PROCESADOS SIMPLES (HOJUELAS),2024-12-05 15:22:04.245656,200.0,g,Cereal de Quinua Nura Choco Pops,21.5,metro,,,CEREALES PROCESADOS SIMPLES (HOJUELAS)
Cereal Ángel Life Fibra en Hojuelas de Trigo 560 g,S/ 21.50,tottus,CEREALES PROCESADOS SIMPLES (HOJUELAS),2024-12-05 11:23:25.420356,560.0,g,Cereal Ángel Life Fibra en Hojuelas de Trigo,21.5,tottus,,ANGEL,CEREALES PROCESADOS SIMPLES (HOJUELAS)
Cereal ANGEL Aritos de Maíz Trigo y Miel Bolsa...,S/ 21.90 un,plaza_vea,CEREALES PROCESADOS SIMPLES (HOJUELAS),2024-12-05 14:39:33.755116,840.0,g,Cereal ANGEL Aritos de Maíz Trigo y Miel Bolsa,21.9,plaza_vea,Bolsa 840g,,CEREALES PROCESADOS SIMPLES (HOJUELAS)
Cereal ÁNGEL Zuck Hojuelas de Maíz Azucaradas ...,S/ 21.90 un,plaza_vea,CEREALES PROCESADOS SIMPLES (HOJUELAS),2024-12-05 14:39:33.755116,1.0,kg,Cereal ÁNGEL Zuck Hojuelas de Maíz Azucaradas,21.9,plaza_vea,Bolsa 1Kg,,CEREALES PROCESADOS SIMPLES (HOJUELAS)
Cereal en Barra NATURA VALLEY Crunchy Miel y A...,S/ 22.30 un,plaza_vea,CEREALES PROCESADOS SIMPLES (HOJUELAS),2024-12-05 14:39:33.755116,253.0,g,Cereal en Barra NATURA VALLEY Crunchy Miel y A,22.3,plaza_vea,Caja 253g,,CEREALES PROCESADOS SIMPLES (HOJUELAS)
Cereales Angel Life Protein Contenido 560 g,S/ 22.60,metro,CEREALES PROCESADOS SIMPLES (HOJUELAS),2024-12-05 15:22:04.245656,560.0,g,Cereales Angel Life Protein Contenido,22.6,metro,,,CEREALES PROCESADOS SIMPLES (HOJUELAS)
Cereales Angel Life Fibra Contenido 560 g,S/ 22.60,metro,CEREALES PROCESADOS SIMPLES (HOJUELAS),2024-12-05 15:22:04.245656,560.0,g,Cereales Angel Life Fibra Contenido,22.6,metro,,,CEREALES PROCESADOS SIMPLES (HOJUELAS)
Cereales Angel Life Fibra Contenido 560 g,S/ 22.60,wong,CEREALES PROCESADOS SIMPLES (HOJUELAS),2024-12-05 17:51:19.506134,560.0,g,Cereales Angel Life Fibra Contenido,22.6,wong,,,CEREALES PROCESADOS SIMPLES (HOJUELAS)
Cereal ÁNGEL Copix Chocolate Bolsa 740g,S/ 22.80,vivanda,CEREALES PROCESADOS SIMPLES (HOJUELAS),2024-12-05 21:37:42.977210,740.0,g,Cereal ÁNGEL Copix Chocolate Bolsa,22.8,vivanda,,ÁNGEL,CEREALES PROCESADOS SIMPLES (HOJUELAS)
Cereal Chocapic 540g,S/ 22.90,metro,CEREALES PROCESADOS SIMPLES (HOJUELAS),2024-12-05 15:22:04.245656,540.0,g,Cereal Chocapic,22.9,metro,,,CEREALES PROCESADOS SIMPLES (HOJUELAS)
Cereal Chocapic 540g,S/ 22.90,wong,CEREALES PROCESADOS SIMPLES (HOJUELAS),2024-12-05 17:51:19.506134,540.0,g,Cereal Chocapic,22.9,wong,,,CEREALES PROCESADOS SIMPLES (HOJUELAS)
Cereal con Sabor a Frutas Angel Frutt Bolsa 840 gr,S/ 23.20,metro,CEREALES PROCESADOS SIMPLES (HOJUELAS),2024-12-05 15:22:04.245656,840.0,g,Cereal con Sabor a Frutas Angel Frutt Bolsa r,23.2,metro,,,CEREALES PROCESADOS SIMPLES (HOJUELAS)
Cereal Angel Meli Bolsa 840 g,S/ 23.20,metro,CEREALES PROCESADOS SIMPLES (HOJUELAS),2024-12-05 15:22:04.245656,840.0,g,Cereal Angel Meli Bolsa,23.2,metro,,,CEREALES PROCESADOS SIMPLES (HOJUELAS)
Cereal Angel Chock Contenido 840 g,S/ 23.20,metro,CEREALES PROCESADOS SIMPLES (HOJUELAS),2024-12-05 15:22:04.245656,840.0,g,Cereal Angel Chock Contenido,23.2,metro,,,CEREALES PROCESADOS SIMPLES (HOJUELAS)
Cereal Zuck Bolsa 1 Kg,S/ 23.20,metro,CEREALES PROCESADOS SIMPLES (HOJUELAS),2024-12-05 15:22:04.245656,1.0,kg,Cereal Zuck Bolsa,23.2,metro,,,CEREALES PROCESADOS SIMPLES (HOJUELAS)
Cereal Copix con Marshmallows Bolsa 740 g,S/ 23.20,metro,CEREALES PROCESADOS SIMPLES (HOJUELAS),2024-12-05 15:22:04.245656,740.0,g,Cereal Copix con Marshmallows Bolsa,23.2,metro,,,CEREALES PROCESADOS SIMPLES (HOJUELAS)
Cereal Angel Chock Contenido 840 g,S/ 23.50,wong,CEREALES PROCESADOS SIMPLES (HOJUELAS),2024-12-05 17:51:19.506134,840.0,g,Cereal Angel Chock Contenido,23.5,wong,,,CEREALES PROCESADOS SIMPLES (HOJUELAS)
Cereal de Quinua MAMALAMA Cacao Caja 240g,S/ 23.90 un,plaza_vea,CEREALES PROCESADOS SIMPLES (HOJUELAS),2024-12-05 14:39:33.755116,240.0,g,Cereal de Quinua MAMALAMA Cacao Caja,23.9,plaza_vea,Caja 240g,,CEREALES PROCESADOS SIMPLES (HOJUELAS)
Cereal Copix con Marshmallows Bolsa 740 g,S/ 24.40,wong,CEREALES PROCESADOS SIMPLES (HOJUELAS),2024-12-05 17:51:19.506134,740.0,g,Cereal Copix con Marshmallows Bolsa,24.4,wong,,,CEREALES PROCESADOS SIMPLES (HOJUELAS)
Cereal Zuck Bolsa 1 Kg,S/ 24.40,wong,CEREALES PROCESADOS SIMPLES (HOJUELAS),2024-12-05 17:51:19.506134,1.0,kg,Cereal Zuck Bolsa,24.4,wong,,,CEREALES PROCESADOS SIMPLES (HOJUELAS)
Cereal Infantil en Polvo Cerelac 5 Cereales y Leche 400g,S/ 24.60,wong,CEREALES PROCESADOS SIMPLES (HOJUELAS),2024-12-05 17:51:19.506134,400.0,g,Cereal Infantil en Polvo Cerelac 5 Cereales y Leche,24.6,wong,,,CEREALES PROCESADOS SIMPLES (HOJUELAS)
Cereal Infantil en Polvo Cerelac 5 Cereales y Leche 400g,S/ 24.60,metro,CEREALES PROCESADOS SIMPLES (HOJUELAS),2024-12-05 15:22:04.245656,400.0,g,Cereal Infantil en Polvo Cerelac 5 Cereales y Leche,24.6,metro,,,CEREALES PROCESADOS SIMPLES (HOJUELAS)
Cereal de Trigo Integral Fitness Original 570g,S/ 24.90,metro,CEREALES PROCESADOS SIMPLES (HOJUELAS),2024-12-05 15:22:04.245656,570.0,g,Cereal de Trigo Integral Fitness Original,24.9,metro,,,CEREALES PROCESADOS SIMPLES (HOJUELAS)
Cereal de Trigo Integral Fitness Original 570g,S/ 24.90,wong,CEREALES PROCESADOS SIMPLES (HOJUELAS),2024-12-05 17:51:19.506134,570.0,g,Cereal de Trigo Integral Fitness Original,24.9,wong,,,CEREALES PROCESADOS SIMPLES (HOJUELAS)
Cereal NESTLÉ FITNESS Caja 570g,S/ 27.50 un,plaza_vea,CEREALES PROCESADOS SIMPLES (HOJUELAS),2024-12-05 14:39:33.755116,570.0,g,Cereal NESTLÉ FITNESS Caja,27.5,plaza_vea,Caja 570g,,CEREALES PROCESADOS SIMPLES (HOJUELAS)
Hojuelas de Maíz Orgánico Sin Gluten Fruit Juice Nature's Path Caja 300 g,S/ 27.50,wong,CEREALES PROCESADOS SIMPLES (HOJUELAS),2024-12-05 17:51:19.506134,300.0,g,Hojuelas de Maíz Orgánico Sin Gluten Fruit Juice Nature's Path Caja,27.5,wong,,,CEREALES PROCESADOS SIMPLES (HOJUELAS)
Hojuelas de Maíz con Miel Sin Gluten Nature's Path Caja 300 g,S/ 27.50,wong,CEREALES PROCESADOS SIMPLES (HOJUELAS),2024-12-05 17:51:19.506134,300.0,g,Hojuelas de Maíz con Miel Sin Gluten Nature's Path Caja,27.5,wong,,,CEREALES PROCESADOS SIMPLES (HOJUELAS)
Comida para Perros RICOCAN Adultos Razas Peque...,S/ 28.90 un,plaza_vea,CEREALES PROCESADOS SIMPLES (HOJUELAS),2024-12-05 14:39:33.755116,3.0,kg,Comida para Perros RICOCAN Adultos Razas Peque,28.9,plaza_vea,Bolsa 3Kg,,CEREALES PROCESADOS SIMPLES (HOJUELAS)
Spray de Entrenamiento para Perro Simple Solution 473ml,S/ 29.90,metro,CEREALES PROCESADOS SIMPLES (HOJUELAS),2024-12-05 15:22:04.245656,473.0,ml,Spray de Entrenamiento para Perro Simple Solution,29.9,metro,,,CEREALES PROCESADOS SIMPLES (HOJUELAS)
Avena con Hojuela sin Gluten LA PURITA Frasco ...,S/ 29.90 un,plaza_vea,CEREALES PROCESADOS SIMPLES (HOJUELAS),2024-12-05 14:39:33.755116,1.5,kg,Avena con Hojuela sin Gluten LA PURITA Frasco,29.9,plaza_vea,Pote 1.5Kg,,CEREALES PROCESADOS SIMPLES (HOJUELAS)
Pañales de Entrenamiento para Perros Simple Solution 10un,S/ 30.99,wong,CEREALES PROCESADOS SIMPLES (HOJUELAS),2024-12-05 17:51:19.506134,10.0,un,Pañales de Entrenamiento para Perros Simple Solution,30.99,wong,,,CEREALES PROCESADOS SIMPLES (HOJUELAS)
Pañales de Entrenamiento para Perros Simple Solution 10un,S/ 30.99,metro,CEREALES PROCESADOS SIMPLES (HOJUELAS),2024-12-05 15:22:04.245656,10.0,un,Pañales de Entrenamiento para Perros Simple Solution,30.99,metro,,,CEREALES PROCESADOS SIMPLES (HOJUELAS)
Hojuelas de Chocolate Cocoa Pebbles 311g,S/ 34.90,wong,CEREALES PROCESADOS SIMPLES (HOJUELAS),2024-12-05 17:51:19.506134,311.0,g,Hojuelas de Chocolate Cocoa Pebbles,34.9,wong,,,CEREALES PROCESADOS SIMPLES (HOJUELAS)
Hojuelas de Chocolate Cocoa Pebbles 311g,S/ 34.90,metro,CEREALES PROCESADOS SIMPLES (HOJUELAS),2024-12-05 15:22:04.245656,311.0,g,Hojuelas de Chocolate Cocoa Pebbles,34.9,metro,,,CEREALES PROCESADOS SIMPLES (HOJUELAS)
Cereal en Barra PROTEIN SNACK Rich Caramel Caja 210g,S/ 38.50,vivanda,CEREALES PROCESADOS SIMPLES (HOJUELAS),2024-12-05 21:37:42.977210,210.0,g,Cereal en Barra PROTEIN SNACK Rich Caramel Caja,38.5,vivanda,,PROTEIN SNACK,CEREALES PROCESADOS SIMPLES (HOJUELAS)
Hojuelas Integrales Honey Bunches Miel Tostada 340g,S/ 38.90,metro,CEREALES PROCESADOS SIMPLES (HOJUELAS),2024-12-05 15:22:04.245656,340.0,g,Hojuelas Integrales Honey Bunches Miel Tostada,38.9,metro,,,CEREALES PROCESADOS SIMPLES (HOJUELAS)
Hojuelas Integrales Honey Bunches Almendras 340g,S/ 38.90,wong,CEREALES PROCESADOS SIMPLES (HOJUELAS),2024-12-05 17:51:19.506134,340.0,g,Hojuelas Integrales Honey Bunches Almendras,38.9,wong,,,CEREALES PROCESADOS SIMPLES (HOJUELAS)
Hojuelas Integrales Cheerios Honey Nut 306g,S/ 38.90,metro,CEREALES PROCESADOS SIMPLES (HOJUELAS),2024-12-05 15:22:04.245656,306.0,g,Hojuelas Integrales Cheerios Honey Nut,38.9,metro,,,CEREALES PROCESADOS SIMPLES (HOJUELAS)
Hojuelas Integrales Cinnamon Toast Crunch 340g,S/ 38.90,metro,CEREALES PROCESADOS SIMPLES (HOJUELAS),2024-12-05 15:22:04.245656,340.0,g,Hojuelas Integrales Cinnamon Toast Crunch,38.9,metro,,,CEREALES PROCESADOS SIMPLES (HOJUELAS)
Hojuelas Integrales Honey Bunches Almendras 340g,S/ 38.90,metro,CEREALES PROCESADOS SIMPLES (HOJUELAS),2024-12-05 15:22:04.245656,340.0,g,Hojuelas Integrales Honey Bunches Almendras,38.9,metro,,,CEREALES PROCESADOS SIMPLES (HOJUELAS)
Cereal en Barra PROTEIN SNACK Chocolate & Crispis Caja 210g,S/ 39.90,vivanda,CEREALES PROCESADOS SIMPLES (HOJUELAS),2024-12-05 21:37:42.977210,210.0,g,Cereal en Barra PROTEIN SNACK Chocolate & Crispis Caja,39.9,vivanda,,PROTEIN SNACK,CEREALES PROCESADOS SIMPLES (HOJUELAS)
Removedor de Olor de Perro Simple Solution 500ml,S/ 39.99,wong,CEREALES PROCESADOS SIMPLES (HOJUELAS),2024-12-05 17:51:19.506134,500.0,ml,Removedor de Olor de Perro Simple Solution,39.99,wong,,,CEREALES PROCESADOS SIMPLES (HOJUELAS)
Removedor de Olor de Gato Simple Solution 500ml,S/ 39.99,wong,CEREALES PROCESADOS SIMPLES (HOJUELAS),2024-12-05 17:51:19.506134,500.0,ml,Removedor de Olor de Gato Simple Solution,39.99,wong,,,CEREALES PROCESADOS SIMPLES (HOJUELAS)
Comida para Perros MIMASKOT Adultos Raza Media...,S/ 94.90 un,plaza_vea,CEREALES PROCESADOS SIMPLES (HOJUELAS),2024-12-05 14:39:33.755116,15.0,kg,Comida para Perros MIMASKOT Adultos Raza Media,94.9,plaza_vea,Bolsa 15Kg,,CEREALES PROCESADOS SIMPLES (HOJUELAS)
Comida para Perros RICOCAN Adultos Razas Peque...,S/ 105.90 un,plaza_vea,CEREALES PROCESADOS SIMPLES (HOJUELAS),2024-12-05 14:39:33.755116,15.0,kg,Comida para Perros RICOCAN Adultos Razas Peque,105.9,plaza_vea,Bolsa 15Kg,,CEREALES PROCESADOS SIMPLES (HOJUELAS)
Comida para Perros RICOCAN Adultos Razas Media...,S/ 105.90 un,plaza_vea,CEREALES PROCESADOS SIMPLES (HOJUELAS),2024-12-05 14:39:33.755116,15.0,kg,Comida para Perros RICOCAN Adultos Razas Media,105.9,plaza_vea,Bolsa 15Kg,,CEREALES PROCESADOS SIMPLES (HOJUELAS)
Ricocan Alimento para Perros Adultos Raza Pequeña Cordero y Cereales Bolsa 15 Kg,S/ 109.90,metro,CEREALES PROCESADOS SIMPLES (HOJUELAS),2024-12-05 15:22:04.245656,15.0,kg,Ricocan Alimento para Perros Adultos Raza Pequeña Cordero y Cereales Bolsa,109.9,metro,,,CEREALES PROCESADOS SIMPLES (HOJUELAS)
"Comida para Perros MIMASKOT Carne, Cereal y Ve...",S/ 133.90 un,plaza_vea,CEREALES PROCESADOS SIMPLES (HOJUELAS),2024-12-05 14:39:33.755116,22.0,kg,"Comida para Perros MIMASKOT Carne, Cereal y Ve",133.9,plaza_vea,Bolsa 22Kg,,CEREALES PROCESADOS SIMPLES (HOJUELAS)
