description,price,website,search_term,scrape_timestamp,cantidad,unidad,description_no_unit,price_numeric,WEB,unit,brand,CLASIFICACION
Cereal VEGA Aritos Frutados Bolsa 20g,S/ 0.50,vega,CEREALES PROCESADOS SIMPLES (HOJUELAS),2024-12-05 11:52:55.078757,20.0,g,Cereal VEGA Aritos Frutados Bolsa,0.5,vega,,Vega,CEREALES PROCESADOS SIMPLES (HOJUELAS)
Cereal BELL'S Corn Flakes Bolsa 20g,S/ 0.59,vivanda,CEREALES PROCESADOS SIMPLES (HOJUELAS),2024-12-05 21:37:42.977210,20.0,g,Cereal BELL'S Corn Flakes Bolsa,0.59,vivanda,,BELL'S,CEREALES PROCESADOS SIMPLES (HOJUELAS)
Cereal ÁNGEL Copix Chocolate Bolsa 18g,S/ 0.80,vega,CEREALES PROCESADOS SIMPLES (HOJUELAS),2024-12-05 11:52:55.078757,18.0,g,Cereal ÁNGEL Copix Chocolate Bolsa,0.8,vega,,Angel,CEREALES PROCESADOS SIMPLES (HOJUELAS)
Piña para Jugo x kg,S/ 2.42 x kg,metro,CEREALES PROCESADOS SIMPLES (HOJUELAS),2024-12-05 15:22:04.245656,1.0,kg,Piña para Jugo,2.42,metro,,,CEREALES PROCESADOS SIMPLES (HOJUELAS)
Camote Amarillo Procesado,S/ 2.79 x kg,plaza_vea,CEREALES PROCESADOS SIMPLES (HOJUELAS),2024-12-05 14:39:33.755116,1.0,kg,Camote Amarillo Procesado,2.79,plaza_vea,Presentación 1 kg aprox.,,CEREALES PROCESADOS SIMPLES (HOJUELAS)
Cereal VEGA Hojuelas Azucaradas Bolsa 140g,S/ 2.90,vega,CEREALES PROCESADOS SIMPLES (HOJUELAS),2024-12-05 11:52:55.078757,140.0,g,Cereal VEGA Hojuelas Azucaradas Bolsa,2.9,vega,,Vega,CEREALES PROCESADOS SIMPLES (HOJUELAS)
Cereal VEGA Bolitas Sabor a Chocolate Bolsa 140g,S/ 2.90,vega,CEREALES PROCESADOS SIMPLES (HOJUELAS),2024-12-05 11:52:55.078757,140.0,g,Cereal VEGA Bolitas Sabor a Chocolate Bolsa,2.9,vega,,Vega,CEREALES PROCESADOS SIMPLES (HOJUELAS)
Hojuelas de Papas Nativas TIYAPUY Mix Fritas B...,S/ 2.90 un,plaza_vea,CEREALES PROCESADOS SIMPLES (HOJUELAS),2024-12-05 14:39:33.755116,40.0,g,Hojuelas de Papas Nativas TIYAPUY Mix Fritas B,2.9,plaza_vea,Bolsa 40g,,CEREALES PROCESADOS SIMPLES (HOJUELAS)
Yogur Battimix GLORIA Vainilla con Hojuelas Va...,S/ 3.10 un,plaza_vea,CEREALES PROCESADOS SIMPLES (HOJUELAS),2024-12-05 14:39:33.755116,144.0,g,Yogur BattimiLORIA Vainilla con Hojuelas Va,3.1,plaza_vea,Vaso 144g,,CEREALES PROCESADOS SIMPLES (HOJUELAS)
Yogurt LAIVE Mix Vainilla Francesa con Hojuela...,S/ 3.10 un,plaza_vea,CEREALES PROCESADOS SIMPLES (HOJUELAS),2024-12-05 14:39:33.755116,125.0,g,Yogurt LAIVE Mix Vainilla Francesa con Hojuela,3.1,plaza_vea,Vaso 125g,,CEREALES PROCESADOS SIMPLES (HOJUELAS)
Camote Amarillo Procesado Wong x kg,S/ 3.19 x kg,wong,CEREALES PROCESADOS SIMPLES (HOJUELAS),2024-12-05 17:51:19.506134,1.0,kg,Camote Amarillo Procesado Wong,3.19,wong,,,CEREALES PROCESADOS SIMPLES (HOJUELAS)
Camote Morado Procesado x kg,S/ 3.19 x kg,wong,CEREALES PROCESADOS SIMPLES (HOJUELAS),2024-12-05 17:51:19.506134,1.0,kg,Camote Morado Procesado,3.19,wong,,,CEREALES PROCESADOS SIMPLES (HOJUELAS)
Camote Amarillo Procesado Meza x kg,S/ 3.19 x kg,wong,CEREALES PROCESADOS SIMPLES (HOJUELAS),2024-12-05 17:51:19.506134,1.0,kg,Camote Amarillo Procesado Meza,3.19,wong,,,CEREALES PROCESADOS SIMPLES (HOJUELAS)
Cereal ÁNGEL Flakes Bolsa 130g,S/ 3.20,vega,CEREALES PROCESADOS SIMPLES (HOJUELAS),2024-12-05 11:52:55.078757,130.0,g,Cereal ÁNGEL Flakes Bolsa,3.2,vega,,Angel,CEREALES PROCESADOS SIMPLES (HOJUELAS)
Cereal ÁNGEL Meli Arito Bolsa 130g,S/ 3.20,vega,CEREALES PROCESADOS SIMPLES (HOJUELAS),2024-12-05 11:52:55.078757,130.0,g,Cereal ÁNGEL Meli Arito Bolsa,3.2,vega,,Angel,CEREALES PROCESADOS SIMPLES (HOJUELAS)
Cereal ÁNGEL Zuck Bolsa 130g,S/ 3.20,vega,CEREALES PROCESADOS SIMPLES (HOJUELAS),2024-12-05 11:52:55.078757,130.0,g,Cereal ÁNGEL Zuck Bolsa,3.2,vega,,Angel,CEREALES PROCESADOS SIMPLES (HOJUELAS)
Cereal ANGEL Almohada Fresia Bolsa 110g,S/ 3.20,vega,CEREALES PROCESADOS SIMPLES (HOJUELAS),2024-12-05 11:52:55.078757,110.0,g,Cereal ANGEL Almohada Fresia Bolsa,3.2,vega,,Angel,CEREALES PROCESADOS SIMPLES (HOJUELAS)
Cereal ANGEL Copix Choco Bolsa 120g,S/ 3.20,vega,CEREALES PROCESADOS SIMPLES (HOJUELAS),2024-12-05 11:52:55.078757,120.0,g,Cereal ANGEL Copix Choco Bolsa,3.2,vega,,Angel,CEREALES PROCESADOS SIMPLES (HOJUELAS)
Cereal ÁNGEL Zuck Bolsa 130g,S/ 3.20 un,plaza_vea,CEREALES PROCESADOS SIMPLES (HOJUELAS),2024-12-05 14:39:33.755116,130.0,g,Cereal ÁNGEL Zuck Bolsa,3.2,plaza_vea,Bolsa 130g,,CEREALES PROCESADOS SIMPLES (HOJUELAS)
Cereal ÁNGEL Frutt Doypack 840g,S/ 3.20,vega,CEREALES PROCESADOS SIMPLES (HOJUELAS),2024-12-05 11:52:55.078757,840.0,g,Cereal ÁNGEL Frutt Doypack,3.2,vega,,Angel,CEREALES PROCESADOS SIMPLES (HOJUELAS)
Cereales Metro Bolicolor 120g,S/ 3.30,metro,CEREALES PROCESADOS SIMPLES (HOJUELAS),2024-12-05 15:22:04.245656,120.0,g,Cereales Metro Bolicolor,3.3,metro,,,CEREALES PROCESADOS SIMPLES (HOJUELAS)
Trigo Light CEREALES ATOMICO de Soya Bolsa 100...,S/ 3.50 un,plaza_vea,CEREALES PROCESADOS SIMPLES (HOJUELAS),2024-12-05 14:39:33.755116,100.0,g,Trigo Light CEREALES ATOMICO de Soya Bolsa 100,3.5,plaza_vea,Bolsa 100g,,CEREALES PROCESADOS SIMPLES (HOJUELAS)
Cereales Cuisine & Co Monstrobolitas 120g,S/ 3.50,wong,CEREALES PROCESADOS SIMPLES (HOJUELAS),2024-12-05 17:51:19.506134,120.0,g,Cereales Cuisine & Co Monstrobolitas,3.5,wong,,,CEREALES PROCESADOS SIMPLES (HOJUELAS)
Cereales Cuisine & Co Monstrobolitas 120g,S/ 3.50,metro,CEREALES PROCESADOS SIMPLES (HOJUELAS),2024-12-05 15:22:04.245656,120.0,g,Cereales Cuisine & Co Monstrobolitas,3.5,metro,,,CEREALES PROCESADOS SIMPLES (HOJUELAS)
Cereal Insuflado de Trigo Maca Trigo Bio Maca Bolsa 120g,S/ 3.50,metro,CEREALES PROCESADOS SIMPLES (HOJUELAS),2024-12-05 15:22:04.245656,120.0,g,Cereal Insuflado de Trigo Maca Trigo Bio Maca Bolsa,3.5,metro,,,CEREALES PROCESADOS SIMPLES (HOJUELAS)
Cereal VITAPLUS Arrocito con miel Bolsa 150Gr,S/ 3.60 un,plaza_vea,CEREALES PROCESADOS SIMPLES (HOJUELAS),2024-12-05 14:39:33.755116,150.0,g,Cereal VITAPLUS Arrocito con miel Bolsa r,3.6,plaza_vea,Bolsa 150g,,CEREALES PROCESADOS SIMPLES (HOJUELAS)
Cereal VITAPLUS Maíz con miel Bolsa 140Gr,S/ 3.60 un,plaza_vea,CEREALES PROCESADOS SIMPLES (HOJUELAS),2024-12-05 14:39:33.755116,140.0,g,Cereal VITAPLUS Maíz con miel Bolsa r,3.6,plaza_vea,Bolsa 140g,,CEREALES PROCESADOS SIMPLES (HOJUELAS)
Hojuelas al Ajo EL CEDRO con Pan Árabe Bolsa 5...,S/ 3.60 un,plaza_vea,CEREALES PROCESADOS SIMPLES (HOJUELAS),2024-12-05 14:39:33.755116,50.0,g,Hojuelas al Ajo EL CEDRO con Pan Árabe Bolsa 5,3.6,plaza_vea,Bolsa 50g,,CEREALES PROCESADOS SIMPLES (HOJUELAS)
Yogurt YOLEIT Mix Vainilla con Cereales de Cho...,S/ 3.90 un,plaza_vea,CEREALES PROCESADOS SIMPLES (HOJUELAS),2024-12-05 14:39:33.755116,125.0,g,Yogurt YOLEIT Mix Vainilla con Cereales de Cho,3.9,plaza_vea,Vaso 125g,,CEREALES PROCESADOS SIMPLES (HOJUELAS)
Avena y Chía en Hojuelas de 380 g,S/ 4,tottus,CEREALES PROCESADOS SIMPLES (HOJUELAS),2024-12-05 11:23:25.420356,380.0,g,Avena y Chía en Hojuelas de,4.0,tottus,,TOTTUS,CEREALES PROCESADOS SIMPLES (HOJUELAS)
Avena en Hojuelas Precocida 380 g,S/ 4,tottus,CEREALES PROCESADOS SIMPLES (HOJUELAS),2024-12-05 11:23:25.420356,380.0,g,Avena en Hojuelas Precocida,4.0,tottus,,TOTTUS,CEREALES PROCESADOS SIMPLES (HOJUELAS)
Trigo Nuclear Light 110 g,S/ 4.20,metro,CEREALES PROCESADOS SIMPLES (HOJUELAS),2024-12-05 15:22:04.245656,110.0,g,Trigo Nuclear Light,4.2,metro,,,CEREALES PROCESADOS SIMPLES (HOJUELAS)
Trigo Nuclear 110 g,S/ 4.20,metro,CEREALES PROCESADOS SIMPLES (HOJUELAS),2024-12-05 15:22:04.245656,110.0,g,Trigo Nuclear,4.2,metro,,,CEREALES PROCESADOS SIMPLES (HOJUELAS)
Galletas de Cacao COSTA Gran Cereal Paquete 6u...,S/ 4.20 un,plaza_vea,CEREALES PROCESADOS SIMPLES (HOJUELAS),2024-12-05 14:39:33.755116,6.0,un,Galletas de Cacao COSTA Gran Cereal Paquete 6u,4.2,plaza_vea,Paquete 6un,,CEREALES PROCESADOS SIMPLES (HOJUELAS)
Maca Avena GRANO DE ORO Hojuelas Precocidas Bo...,S/ 4.50 un,plaza_vea,CEREALES PROCESADOS SIMPLES (HOJUELAS),2024-12-05 14:39:33.755116,370.0,g,Maca Avena GRANO DE ORO Hojuelas Precocidas Bo,4.5,plaza_vea,Bolsa 370g,,CEREALES PROCESADOS SIMPLES (HOJUELAS)
Chía Avena GRANO DE ORO Hojuelas Precocidas Bo...,S/ 4.50 un,plaza_vea,CEREALES PROCESADOS SIMPLES (HOJUELAS),2024-12-05 14:39:33.755116,370.0,g,Chía Avena GRANO DE ORO Hojuelas Precocidas Bo,4.5,plaza_vea,Bolsa 370g,,CEREALES PROCESADOS SIMPLES (HOJUELAS)
Kiwicha Avena GRANO DE ORO Hojuelas Precocidas...,S/ 4.50 un,plaza_vea,CEREALES PROCESADOS SIMPLES (HOJUELAS),2024-12-05 14:39:33.755116,370.0,g,Kiwicha Avena GRANO DE ORO Hojuelas Precocidas,4.5,plaza_vea,Bolsa 370g,,CEREALES PROCESADOS SIMPLES (HOJUELAS)
Arrocito Cereal Nuclear 110 g,S/ 4.50,metro,CEREALES PROCESADOS SIMPLES (HOJUELAS),2024-12-05 15:22:04.245656,110.0,g,Arrocito Cereal Nuclear,4.5,metro,,,CEREALES PROCESADOS SIMPLES (HOJUELAS)
Hojuelas Precocidas de Avena con Maca 370 g,S/ 4.90,tottus,CEREALES PROCESADOS SIMPLES (HOJUELAS),2024-12-05 11:23:25.420356,370.0,g,Hojuelas Precocidas de Avena con Maca,4.9,tottus,,GRANO DE ORO,CEREALES PROCESADOS SIMPLES (HOJUELAS)
Piña Golden Metro x kg,S/ 4.99 x kg,metro,CEREALES PROCESADOS SIMPLES (HOJUELAS),2024-12-05 15:22:04.245656,1.0,kg,Piña Golden Metro,4.99,metro,,,CEREALES PROCESADOS SIMPLES (HOJUELAS)
Cereal de Maíz Trix 90g,S/ 5.00,metro,CEREALES PROCESADOS SIMPLES (HOJUELAS),2024-12-05 15:22:04.245656,90.0,g,Cereal de Maíz Trix,5.0,metro,,,CEREALES PROCESADOS SIMPLES (HOJUELAS)
Cereal NESTLÉ TRIX Bolsa 90g,S/ 5.00,vivanda,CEREALES PROCESADOS SIMPLES (HOJUELAS),2024-12-05 21:37:42.977210,90.0,g,Cereal NESTLÉ TRIX Bolsa,5.0,vivanda,,TRIX,CEREALES PROCESADOS SIMPLES (HOJUELAS)
Avena Hojuela 3 Ositos Precocida Clásica 250g,S/ 5,tottus,CEREALES PROCESADOS SIMPLES (HOJUELAS),2024-12-05 11:23:25.420356,250.0,g,Avena Hojuela 3 Ositos Precocida Clásica,5.0,tottus,,MOLITALIA,CEREALES PROCESADOS SIMPLES (HOJUELAS)
Avena Integral en Hojuelas Grano de Oro 500g,S/ 5.50,metro,CEREALES PROCESADOS SIMPLES (HOJUELAS),2024-12-05 15:22:04.245656,500.0,g,Avena Integral en Hojuelas Grano de Oro,5.5,metro,,,CEREALES PROCESADOS SIMPLES (HOJUELAS)
Avena con Cereales Andinos Premium 3 OSITOS Bo...,S/ 5.60 un,plaza_vea,CEREALES PROCESADOS SIMPLES (HOJUELAS),2024-12-05 14:39:33.755116,270.0,g,Avena con Cereales Andinos Premium 3 OSITOS Bo,5.6,plaza_vea,Bolsa 270g,,CEREALES PROCESADOS SIMPLES (HOJUELAS)
Piña Golden Wong x kg,S/ 5.69 x kg,wong,CEREALES PROCESADOS SIMPLES (HOJUELAS),2024-12-05 17:51:19.506134,1.0,kg,Piña Golden Wong,5.69,wong,,,CEREALES PROCESADOS SIMPLES (HOJUELAS)
Cereal VEGA Bolitas Chocolate Bolsa 20g,S/ 5.70,vega,CEREALES PROCESADOS SIMPLES (HOJUELAS),2024-12-05 11:52:55.078757,20.0,g,Cereal VEGA Bolitas Chocolate Bolsa,5.7,vega,,Vega,CEREALES PROCESADOS SIMPLES (HOJUELAS)
Aritos Nuclear 110 g,S/ 5.70,metro,CEREALES PROCESADOS SIMPLES (HOJUELAS),2024-12-05 15:22:04.245656,110.0,g,Aritos Nuclear,5.7,metro,,,CEREALES PROCESADOS SIMPLES (HOJUELAS)
Cereal Bar COSTA Choco Caja 12un,S/ 6 un,plaza_vea,CEREALES PROCESADOS SIMPLES (HOJUELAS),2024-12-05 14:39:33.755116,12.0,un,Cereal Bar COSTA Choco Caja,6.0,plaza_vea,Caja 12un,,CEREALES PROCESADOS SIMPLES (HOJUELAS)
Cereal Bar COSTA Golden Caja 12un,S/ 6 un,plaza_vea,CEREALES PROCESADOS SIMPLES (HOJUELAS),2024-12-05 14:39:33.755116,12.0,un,Cereal Bar COSTA Golden Caja,6.0,plaza_vea,Caja 12un,,CEREALES PROCESADOS SIMPLES (HOJUELAS)
Cereal Bar COSTA Arándanos Caja 12un,S/ 6 un,plaza_vea,CEREALES PROCESADOS SIMPLES (HOJUELAS),2024-12-05 14:39:33.755116,12.0,un,Cereal Bar COSTA Arándanos Caja,6.0,plaza_vea,Caja 12un,,CEREALES PROCESADOS SIMPLES (HOJUELAS)
Cereal Bar COSTA Manzana y Canela Caja 12un,S/ 6 un,plaza_vea,CEREALES PROCESADOS SIMPLES (HOJUELAS),2024-12-05 14:39:33.755116,12.0,un,Cereal Bar COSTA Manzana y Canela Caja,6.0,plaza_vea,Caja 12un,,CEREALES PROCESADOS SIMPLES (HOJUELAS)
Cereal Bar COSTA Chips Caja 12un,S/ 6 un,plaza_vea,CEREALES PROCESADOS SIMPLES (HOJUELAS),2024-12-05 14:39:33.755116,12.0,un,Cereal Bar COSTA Chips Caja,6.0,plaza_vea,Caja 12un,,CEREALES PROCESADOS SIMPLES (HOJUELAS)
Hojuelas de Cereales Sabor Chocolate Chocapic Bolsa 90 g,S/ 6.00,metro,CEREALES PROCESADOS SIMPLES (HOJUELAS),2024-12-05 15:22:04.245656,90.0,g,Hojuelas de Cereales Sabor Chocolate Chocapic Bolsa,6.0,metro,,,CEREALES PROCESADOS SIMPLES (HOJUELAS)
Cereal Bar 12un Display Costa Golden,S/ 6.20,wong,CEREALES PROCESADOS SIMPLES (HOJUELAS),2024-12-05 17:51:19.506134,12.0,un,Cereal Bar  Display Costa Golden,6.2,wong,,,CEREALES PROCESADOS SIMPLES (HOJUELAS)
Cereal Bar 12un Display Costa Choco,S/ 6.20,wong,CEREALES PROCESADOS SIMPLES (HOJUELAS),2024-12-05 17:51:19.506134,12.0,un,Cereal Bar  Display Costa Choco,6.2,wong,,,CEREALES PROCESADOS SIMPLES (HOJUELAS)
Cereal Bar 12un Display Costa Choco,S/ 6.30,metro,CEREALES PROCESADOS SIMPLES (HOJUELAS),2024-12-05 15:22:04.245656,12.0,un,Cereal Bar  Display Costa Choco,6.3,metro,,,CEREALES PROCESADOS SIMPLES (HOJUELAS)
Cereal Bar COSTA Chips Caja 12un,S/ 6.50,vivanda,CEREALES PROCESADOS SIMPLES (HOJUELAS),2024-12-05 21:37:42.977210,12.0,un,Cereal Bar COSTA Chips Caja,6.5,vivanda,,COSTA,CEREALES PROCESADOS SIMPLES (HOJUELAS)
Cereal Bar COSTA Choco Caja 12un,S/ 6.50,vivanda,CEREALES PROCESADOS SIMPLES (HOJUELAS),2024-12-05 21:37:42.977210,12.0,un,Cereal Bar COSTA Choco Caja,6.5,vivanda,,COSTA,CEREALES PROCESADOS SIMPLES (HOJUELAS)
Avena Hojuela Precocida Clásica 500g,S/ 6.90,tottus,CEREALES PROCESADOS SIMPLES (HOJUELAS),2024-12-05 11:23:25.420356,500.0,g,Avena Hojuela Precocida Clásica,6.9,tottus,,3 OSITOS,CEREALES PROCESADOS SIMPLES (HOJUELAS)
Hojuelas de Maíz Corn Flakes Cuisine & Co 200g,S/ 6.90,metro,CEREALES PROCESADOS SIMPLES (HOJUELAS),2024-12-05 15:22:04.245656,200.0,g,Hojuelas de Maíz Corn Flakes Cuisine & Co,6.9,metro,,,CEREALES PROCESADOS SIMPLES (HOJUELAS)
Hojuelas de Kiwicha 200 g,S/ 7.65,tottus,CEREALES PROCESADOS SIMPLES (HOJUELAS),2024-12-05 11:23:25.420356,200.0,g,Hojuelas de Kiwicha,7.65,tottus,,MOLICUSCO,CEREALES PROCESADOS SIMPLES (HOJUELAS)
Hojuelas de Maíz Corn Flakes Cuisine & Co 200g,S/ 7.90,wong,CEREALES PROCESADOS SIMPLES (HOJUELAS),2024-12-05 17:51:19.506134,200.0,g,Hojuelas de Maíz Corn Flakes Cuisine & Co,7.9,wong,,,CEREALES PROCESADOS SIMPLES (HOJUELAS)
Cereal KIWIGÉN DuoMix Bolsa 180g,S/ 8.80 un,plaza_vea,CEREALES PROCESADOS SIMPLES (HOJUELAS),2024-12-05 14:39:33.755116,180.0,g,Cereal KIWIGÉN DuoMix Bolsa,8.8,plaza_vea,Bolsa 180g,,CEREALES PROCESADOS SIMPLES (HOJUELAS)
Avena Quaker Tradicional 500g,S/ 8.90,metro,CEREALES PROCESADOS SIMPLES (HOJUELAS),2024-12-05 15:22:04.245656,500.0,g,Avena Quaker Tradicional,8.9,metro,,,CEREALES PROCESADOS SIMPLES (HOJUELAS)
Piqueo VEGGIE CHIPS MIX Hojuelas de vegetales ...,S/ 8.90 un,plaza_vea,CEREALES PROCESADOS SIMPLES (HOJUELAS),2024-12-05 14:39:33.755116,250.0,g,Piqueo VEGGIE CHIPS MIX Hojuelas de vegetales,8.9,plaza_vea,Bolsa 250g,,CEREALES PROCESADOS SIMPLES (HOJUELAS)
Avena QUAKER Hojuelas de Avena Instantánea Caj...,S/ 9.29 un,plaza_vea,CEREALES PROCESADOS SIMPLES (HOJUELAS),2024-12-05 14:39:33.755116,350.0,g,Avena QUAKER Hojuelas de Avena Instantánea Caj,9.29,plaza_vea,Caja 350g,,CEREALES PROCESADOS SIMPLES (HOJUELAS)
Cereal BELL'S Corn Flakes Azucarados Bolsa 500g,S/ 9.40,vivanda,CEREALES PROCESADOS SIMPLES (HOJUELAS),2024-12-05 21:37:42.977210,500.0,g,Cereal BELL'S Corn Flakes Azucarados Bolsa,9.4,vivanda,,BELL'S,CEREALES PROCESADOS SIMPLES (HOJUELAS)
Cereal GRANO DE ORO Salvado de Avena Doypack 300g,S/ 9.40,vivanda,CEREALES PROCESADOS SIMPLES (HOJUELAS),2024-12-05 21:37:42.977210,300.0,g,Cereal GRANO DE ORO Salvado de Avena Doypack,9.4,vivanda,,GRANO DE ORO,CEREALES PROCESADOS SIMPLES (HOJUELAS)
Cereal KELLOGG'S Corn Flakes Caja 200g,S/ 9.60 un,plaza_vea,CEREALES PROCESADOS SIMPLES (HOJUELAS),2024-12-05 14:39:33.755116,200.0,g,Cereal KELLOGG'S Corn Flakes Caja,9.6,plaza_vea,Caja 200g,,CEREALES PROCESADOS SIMPLES (HOJUELAS)
Cereal COSECHA DEL PARAISO Tostado molido Bolsa 400Gr,S/ 9.70,vivanda,CEREALES PROCESADOS SIMPLES (HOJUELAS),2024-12-05 21:37:42.977210,400.0,g,Cereal COSECHA DEL PARAISO Tostado molido Bolsa r,9.7,vivanda,,COSECHA DEL PARAÍSO,CEREALES PROCESADOS SIMPLES (HOJUELAS)
Piña Madura Golden x kg,S/ 9.89 x kg,wong,CEREALES PROCESADOS SIMPLES (HOJUELAS),2024-12-05 17:51:19.506134,1.0,kg,Piña Madura Golden,9.89,wong,,,CEREALES PROCESADOS SIMPLES (HOJUELAS)
Cereales Bañados con Chocolate Estrellas 2 Cerritos Bolsa 125 gr,S/ 9.90,metro,CEREALES PROCESADOS SIMPLES (HOJUELAS),2024-12-05 15:22:04.245656,125.0,g,Cereales Bañados con Chocolate Estrellas 2 Cerritos Bolsa r,9.9,metro,,,CEREALES PROCESADOS SIMPLES (HOJUELAS)
Avena Tradicional Cuisine & Co 1kg,S/ 9.90,wong,CEREALES PROCESADOS SIMPLES (HOJUELAS),2024-12-05 17:51:19.506134,1.0,kg,Avena Tradicional Cuisine & Co,9.9,wong,,,CEREALES PROCESADOS SIMPLES (HOJUELAS)
Granola Frutos del Bosque Cuisine & Co 300g,S/ 9.90,metro,CEREALES PROCESADOS SIMPLES (HOJUELAS),2024-12-05 15:22:04.245656,300.0,g,Granola Frutos del Bosque Cuisine & Co,9.9,metro,,,CEREALES PROCESADOS SIMPLES (HOJUELAS)
Cereal Bar COSTA Chocochips 21gr,S/ 9.90,vega,CEREALES PROCESADOS SIMPLES (HOJUELAS),2024-12-05 11:52:55.078757,21.0,g,Cereal Bar COSTA Chocochips r,9.9,vega,,Costa,CEREALES PROCESADOS SIMPLES (HOJUELAS)
Avena Tradicional Cuisine & Co 1kg,S/ 9.90,metro,CEREALES PROCESADOS SIMPLES (HOJUELAS),2024-12-05 15:22:04.245656,1.0,kg,Avena Tradicional Cuisine & Co,9.9,metro,,,CEREALES PROCESADOS SIMPLES (HOJUELAS)
Hojuelas de Kiwicha LA CASA MIRAMIEL Bolsa 190...,S/ 9.90 un,plaza_vea,CEREALES PROCESADOS SIMPLES (HOJUELAS),2024-12-05 14:39:33.755116,190.0,g,Hojuelas de Kiwicha LA CASA MIRAMIEL Bolsa 190,9.9,plaza_vea,Bolsa 190g,,CEREALES PROCESADOS SIMPLES (HOJUELAS)
Cereal NATURANDES Harina de linaza Bolsa 300Gr,S/ 10 un,plaza_vea,CEREALES PROCESADOS SIMPLES (HOJUELAS),2024-12-05 14:39:33.755116,300.0,g,Cereal NATURANDES Harina de linaza Bolsa r,10.0,plaza_vea,Bolsa 300g,,CEREALES PROCESADOS SIMPLES (HOJUELAS)
Hojuelas de Maíz Corn Flakes Kellogg's 200g,S/ 10.00,metro,CEREALES PROCESADOS SIMPLES (HOJUELAS),2024-12-05 15:22:04.245656,200.0,g,Hojuelas de Maíz Corn Flakes Kellogg's,10.0,metro,,,CEREALES PROCESADOS SIMPLES (HOJUELAS)
Barra de Cereales Mini Cereal Bar Golden 24un,S/ 10.10,metro,CEREALES PROCESADOS SIMPLES (HOJUELAS),2024-12-05 15:22:04.245656,24.0,un,Barra de Cereales Mini Cereal Bar Golden,10.1,metro,,,CEREALES PROCESADOS SIMPLES (HOJUELAS)
Cereal Kiwigen Duomix 180g,S/ 10.20,metro,CEREALES PROCESADOS SIMPLES (HOJUELAS),2024-12-05 15:22:04.245656,180.0,g,Cereal Kiwigen Duomix,10.2,metro,,,CEREALES PROCESADOS SIMPLES (HOJUELAS)
Barra de Cereales Mini Cereal Bar Golden 24un,S/ 10.20,wong,CEREALES PROCESADOS SIMPLES (HOJUELAS),2024-12-05 17:51:19.506134,24.0,un,Barra de Cereales Mini Cereal Bar Golden,10.2,wong,,,CEREALES PROCESADOS SIMPLES (HOJUELAS)
Cereal Kiwigen Mix Chocolate 180g,S/ 10.20,metro,CEREALES PROCESADOS SIMPLES (HOJUELAS),2024-12-05 15:22:04.245656,180.0,g,Cereal Kiwigen Mix Chocolate,10.2,metro,,,CEREALES PROCESADOS SIMPLES (HOJUELAS)
Hojuelas de Kiwicha Molicusco 200g,S/ 10.20,wong,CEREALES PROCESADOS SIMPLES (HOJUELAS),2024-12-05 17:51:19.506134,200.0,g,Hojuelas de Kiwicha Molicusco,10.2,wong,,,CEREALES PROCESADOS SIMPLES (HOJUELAS)
Hojuelas precocidas de avena de 1 kg,S/ 10.50,tottus,CEREALES PROCESADOS SIMPLES (HOJUELAS),2024-12-05 11:23:25.420356,1.0,kg,Hojuelas precocidas de avena de,10.5,tottus,,GRANO DE ORO,CEREALES PROCESADOS SIMPLES (HOJUELAS)
Cereales de Trigo con Cacao Chocapic 170g,S/ 10.50,metro,CEREALES PROCESADOS SIMPLES (HOJUELAS),2024-12-05 15:22:04.245656,170.0,g,Cereales de Trigo con Cacao Chocapic,10.5,metro,,,CEREALES PROCESADOS SIMPLES (HOJUELAS)
Cereales Bañados con Chocolate Pelotitas 2 Cerritos Bolsa 125 gr,S/ 10.50,metro,CEREALES PROCESADOS SIMPLES (HOJUELAS),2024-12-05 15:22:04.245656,125.0,g,Cereales Bañados con Chocolate Pelotitas 2 Cerritos Bolsa r,10.5,metro,,,CEREALES PROCESADOS SIMPLES (HOJUELAS)
Cereal KELLOGGS Hot Wheels Caja 135g,S/ 10.90,vivanda,CEREALES PROCESADOS SIMPLES (HOJUELAS),2024-12-05 21:37:42.977210,135.0,g,Cereal KELLOGGS Hot Wheels Caja,10.9,vivanda,,KELLOGG S,CEREALES PROCESADOS SIMPLES (HOJUELAS)
Cereal en Barra DYFFERENT Chocolate con Maní C...,S/ 10.90 un,plaza_vea,CEREALES PROCESADOS SIMPLES (HOJUELAS),2024-12-05 14:39:33.755116,175.0,g,Cereal en Barra DYFFERENT Chocolate con Maní C,10.9,plaza_vea,Caja 175g,,CEREALES PROCESADOS SIMPLES (HOJUELAS)
Cereal NATURANDES Harina 7 semillas Bolsa 200Gr,S/ 10.90,vivanda,CEREALES PROCESADOS SIMPLES (HOJUELAS),2024-12-05 21:37:42.977210,200.0,g,Cereal NATURANDES Harina 7 semillas Bolsa r,10.9,vivanda,,NATURANDES,CEREALES PROCESADOS SIMPLES (HOJUELAS)
Cereal de Maíz Azucarado Cuisine & Co Reggae Flakes 480g,S/ 10.90,wong,CEREALES PROCESADOS SIMPLES (HOJUELAS),2024-12-05 17:51:19.506134,480.0,g,Cereal de Maíz Azucarado Cuisine & Co Reggae Flakes,10.9,wong,,,CEREALES PROCESADOS SIMPLES (HOJUELAS)
Cereal de Maíz Azucarado Cuisine & Co Reggae Flakes 480g,S/ 10.90,metro,CEREALES PROCESADOS SIMPLES (HOJUELAS),2024-12-05 15:22:04.245656,480.0,g,Cereal de Maíz Azucarado Cuisine & Co Reggae Flakes,10.9,metro,,,CEREALES PROCESADOS SIMPLES (HOJUELAS)
Cereal ÁNGEL Flakes Bolsa 500g,S/ 11.10 un,plaza_vea,CEREALES PROCESADOS SIMPLES (HOJUELAS),2024-12-05 14:39:33.755116,500.0,g,Cereal ÁNGEL Flakes Bolsa,11.1,plaza_vea,Bolsa 500g,,CEREALES PROCESADOS SIMPLES (HOJUELAS)
Cereales Bañados con Chocolate Choco Yogurt 2 Cerritos Bolsa 125 g,S/ 11.20,metro,CEREALES PROCESADOS SIMPLES (HOJUELAS),2024-12-05 15:22:04.245656,125.0,g,Cereales Bañados con Chocolate Choco Yogurt 2 Cerritos Bolsa,11.2,metro,,,CEREALES PROCESADOS SIMPLES (HOJUELAS)
Hojuelas de Avena Integral Sin Gluten Mi Tierra Bolsa 400 g,S/ 11.30,metro,CEREALES PROCESADOS SIMPLES (HOJUELAS),2024-12-05 15:22:04.245656,400.0,g,Hojuelas de Avena Integral Sin Gluten Mi Tierra Bolsa,11.3,metro,,,CEREALES PROCESADOS SIMPLES (HOJUELAS)
Cereales Bañados con Chocolate Choco Yogurt 2 Cerritos Bolsa 125 g,S/ 11.50,wong,CEREALES PROCESADOS SIMPLES (HOJUELAS),2024-12-05 17:51:19.506134,125.0,g,Cereales Bañados con Chocolate Choco Yogurt 2 Cerritos Bolsa,11.5,wong,,,CEREALES PROCESADOS SIMPLES (HOJUELAS)
Avena Precocida 3 Ositos 900g,S/ 11.50,wong,CEREALES PROCESADOS SIMPLES (HOJUELAS),2024-12-05 17:51:19.506134,900.0,g,Avena Precocida 3 Ositos,11.5,wong,,,CEREALES PROCESADOS SIMPLES (HOJUELAS)
Avena Precocida 3 Ositos 900g,S/ 11.50,metro,CEREALES PROCESADOS SIMPLES (HOJUELAS),2024-12-05 15:22:04.245656,900.0,g,Avena Precocida 3 Ositos,11.5,metro,,,CEREALES PROCESADOS SIMPLES (HOJUELAS)
Cereal Flakes Bolsa 500 g,S/ 11.90,wong,CEREALES PROCESADOS SIMPLES (HOJUELAS),2024-12-05 17:51:19.506134,500.0,g,Cereal Flakes Bolsa,11.9,wong,,,CEREALES PROCESADOS SIMPLES (HOJUELAS)
Cereal Flakes Bolsa 500 g,S/ 11.90,metro,CEREALES PROCESADOS SIMPLES (HOJUELAS),2024-12-05 15:22:04.245656,500.0,g,Cereal Flakes Bolsa,11.9,metro,,,CEREALES PROCESADOS SIMPLES (HOJUELAS)
Cereal Copix Chocolate con Marshmallows Bolsa 380 g,S/ 11.90,metro,CEREALES PROCESADOS SIMPLES (HOJUELAS),2024-12-05 15:22:04.245656,380.0,g,Cereal Copix Chocolate con Marshmallows Bolsa,11.9,metro,,,CEREALES PROCESADOS SIMPLES (HOJUELAS)
Quinua Avena Hojuela Precocida 900g,S/ 11.90,tottus,CEREALES PROCESADOS SIMPLES (HOJUELAS),2024-12-05 11:23:25.420356,900.0,g,Quinua Avena Hojuela Precocida,11.9,tottus,,3 OSITOS,CEREALES PROCESADOS SIMPLES (HOJUELAS)
Cereal Up Tradicional Cuisine & Co 380g,S/ 11.90,wong,CEREALES PROCESADOS SIMPLES (HOJUELAS),2024-12-05 17:51:19.506134,380.0,g,Cereal Up Tradicional Cuisine & Co,11.9,wong,,,CEREALES PROCESADOS SIMPLES (HOJUELAS)
Cereales Kellogg's Hot Wheels Sabor Frutas 135g,S/ 12.00,metro,CEREALES PROCESADOS SIMPLES (HOJUELAS),2024-12-05 15:22:04.245656,135.0,g,Cereales Kellogg's Hot Wheels Sabor Frutas,12.0,metro,,,CEREALES PROCESADOS SIMPLES (HOJUELAS)
Cereales Kellogg's Barbie Sabor Frutilla 135g,S/ 12.00,metro,CEREALES PROCESADOS SIMPLES (HOJUELAS),2024-12-05 15:22:04.245656,135.0,g,Cereales Kellogg's Barbie Sabor Frutilla,12.0,metro,,,CEREALES PROCESADOS SIMPLES (HOJUELAS)
Cereales Kellogg's Hot Wheels Sabor Frutas 135g,S/ 12.00,wong,CEREALES PROCESADOS SIMPLES (HOJUELAS),2024-12-05 17:51:19.506134,135.0,g,Cereales Kellogg's Hot Wheels Sabor Frutas,12.0,wong,,,CEREALES PROCESADOS SIMPLES (HOJUELAS)
Cereal para Bebés Gerber Corazoncitos 25g,S/ 12.10,wong,CEREALES PROCESADOS SIMPLES (HOJUELAS),2024-12-05 17:51:19.506134,25.0,g,Cereal para Bebés Gerber Corazoncitos,12.1,wong,,,CEREALES PROCESADOS SIMPLES (HOJUELAS)
Cereal para Bebés Gerber Corazoncitos 25g,S/ 12.10,metro,CEREALES PROCESADOS SIMPLES (HOJUELAS),2024-12-05 15:22:04.245656,25.0,g,Cereal para Bebés Gerber Corazoncitos,12.1,metro,,,CEREALES PROCESADOS SIMPLES (HOJUELAS)
Cereal en Barra DYFFERENT Chocolate con Maní Caja 175g,S/ 12.20,vivanda,CEREALES PROCESADOS SIMPLES (HOJUELAS),2024-12-05 21:37:42.977210,175.0,g,Cereal en Barra DYFFERENT Chocolate con Maní Caja,12.2,vivanda,,DYFFERENT,CEREALES PROCESADOS SIMPLES (HOJUELAS)
Cereal en Barra DYFFERENT Mantequilla de Maní Caja 175g,S/ 12.20,vivanda,CEREALES PROCESADOS SIMPLES (HOJUELAS),2024-12-05 21:37:42.977210,175.0,g,Cereal en Barra DYFFERENT Mantequilla de Maní Caja,12.2,vivanda,,DYFFERENT,CEREALES PROCESADOS SIMPLES (HOJUELAS)
Cereal Ángel Life Multigrain en Hojuelas de Trigo y Cranberries 300 g,S/ 12.50,tottus,CEREALES PROCESADOS SIMPLES (HOJUELAS),2024-12-05 11:23:25.420356,300.0,g,Cereal Ángel Life Multigrain en Hojuelas de Trigo y Cranberries,12.5,tottus,,ANGEL,CEREALES PROCESADOS SIMPLES (HOJUELAS)
Cereal Ángel Life Fibra en Hojuelas de Trigo 300 g,S/ 12.50,tottus,CEREALES PROCESADOS SIMPLES (HOJUELAS),2024-12-05 11:23:25.420356,300.0,g,Cereal Ángel Life Fibra en Hojuelas de Trigo,12.5,tottus,,ANGEL,CEREALES PROCESADOS SIMPLES (HOJUELAS)
Cereal Protein ÁNGEL Life Caja 300g,S/ 12.50 un,plaza_vea,CEREALES PROCESADOS SIMPLES (HOJUELAS),2024-12-05 14:39:33.755116,300.0,g,Cereal Protein ÁNGEL Life Caja,12.5,plaza_vea,Caja 300g,,CEREALES PROCESADOS SIMPLES (HOJUELAS)
