description,brand,cantidad,unidad,price_numeric,website,scrape_timestamp,search_term,cantidad_escalada,unidad_escalada,price_numeric_escalado
Caramelo BUBBALO Sparkies Bolsa 25gr,Sparkies,25.0,g,1.5,vega,2024-12-05 13:22:59.756381,CHIFLE (BOCADITOS),25.0,g,1.5
Sazonador Ajinomix para Chifa Ajinomoto Pack 4 Unid x 12 g,,4.0,un,2.2,metro,2024-12-05 16:47:01.663159,CHIFLE (BOCADITOS),4.0,un,2.2
Chifoncito de Naranja Wong 50g,,50.0,g,2.72,wong,2024-12-05 19:25:09.251456,CHIFLE (BOCADITOS),50.0,g,2.72
Marshmellows Mr. Mallo Watermelons Bolsa 100 g,,100.0,g,2.9,metro,2024-12-05 16:47:01.663159,CHIFLE (BOCADITOS),100.0,g,2.9
Marshmellows Mr. Mallo Fresas Bolsa 100 g,,100.0,g,2.9,metro,2024-12-05 16:47:01.663159,CHIFLE (BOCADITOS),100.0,g,2.9
Gomitas Ambrosoli Ambrosito Ácido 90g,,90.0,g,3.2,metro,2024-12-05 16:47:01.663159,CHIFLE (BOCADITOS),90.0,g,3.2
Gomitas Ambrosito 90g,,90.0,g,3.4,wong,2024-12-05 19:25:09.251456,CHIFLE (BOCADITOS),90.0,g,3.4
Gomitas Ambrosito 90g,,90.0,g,3.4,metro,2024-12-05 16:47:01.663159,CHIFLE (BOCADITOS),90.0,g,3.4
Chicle Sin Azúcar Trident X Splash Fresa y Limón 9un,,9.0,un,3.5,wong,2024-12-05 19:25:09.251456,CHIFLE (BOCADITOS),9.0,un,3.5
Chicle Sin Azúcar Trident X Splash Fresa y Limón 9un,,9.0,un,3.5,metro,2024-12-05 16:47:01.663159,CHIFLE (BOCADITOS),9.0,un,3.5
Chicles Sin Azúcar Trident Splash Sabor Fresa y Limón 9un,,9.0,un,3.6,metro,2024-12-05 16:47:01.663159,CHIFLE (BOCADITOS),9.0,un,3.6
Chicles Sin Azúcar Trident Splash Sabor Fresa y Limón 9un,,9.0,un,3.6,wong,2024-12-05 19:25:09.251456,CHIFLE (BOCADITOS),9.0,un,3.6
Chicles Sin Azúcar Trident Splash Sabor Menta y Vainilla 9un,,9.0,un,3.6,metro,2024-12-05 16:47:01.663159,CHIFLE (BOCADITOS),9.0,un,3.6
Chicles Sin Azúcar Trident Splash Sabor Menta y Vainilla 9un,,9.0,un,3.6,wong,2024-12-05 19:25:09.251456,CHIFLE (BOCADITOS),9.0,un,3.6
Chicles Sin Azúcar Trident Splash Sabor Hierbabuena y Sandía 9un,,9.0,un,3.6,metro,2024-12-05 16:47:01.663159,CHIFLE (BOCADITOS),9.0,un,3.6
Chicle TRIDENT Sin Azúcar sabor Mora Azul Envase 18un,TRIDENT,18.0,un,3.7,vivanda,2024-12-05 22:31:17.105023,CHIFLE (BOCADITOS),18.0,un,3.7
Chicle TRIDENT Sin Azúcar sabor Tutti Frutti Envase 18un,TRIDENT,18.0,un,3.7,vivanda,2024-12-05 22:31:17.105023,CHIFLE (BOCADITOS),18.0,un,3.7
Chicle TRIDENT Sin Azúcar sabor Menta Herbal Envase 18un,TRIDENT,18.0,un,3.7,vivanda,2024-12-05 22:31:17.105023,CHIFLE (BOCADITOS),18.0,un,3.7
Chifles Salados 100 g,TOTTUS,100.0,g,3.79,tottus,2024-12-05 12:43:20.637065,CHIFLE (BOCADITOS),100.0,g,3.79
Piqueo BELL'S Chifles Salados Táper 100g,BELL'S,100.0,g,3.79,vivanda,2024-12-05 22:31:17.105023,CHIFLE (BOCADITOS),100.0,g,3.79
Chicles Sin Azúcar Trident Evup Yerbabuena 18un,,18.0,un,4.0,wong,2024-12-05 19:25:09.251456,CHIFLE (BOCADITOS),18.0,un,4.0
Chicles Sin Azúcar Trident Evup Menta 18un,,18.0,un,4.0,metro,2024-12-05 16:47:01.663159,CHIFLE (BOCADITOS),18.0,un,4.0
Chicles Sin Azúcar Trident Evup Menta 18un,,18.0,un,4.0,wong,2024-12-05 19:25:09.251456,CHIFLE (BOCADITOS),18.0,un,4.0
Chicles Sin Azúcar Trident Evup Fresh Herbal 18un,,18.0,un,4.1,metro,2024-12-05 16:47:01.663159,CHIFLE (BOCADITOS),18.0,un,4.1
Chicle Trident Evup Freshmint 18un,,18.0,un,4.1,metro,2024-12-05 16:47:01.663159,CHIFLE (BOCADITOS),18.0,un,4.1
Chicle Trident Evup Freshmint 18un,,18.0,un,4.1,wong,2024-12-05 19:25:09.251456,CHIFLE (BOCADITOS),18.0,un,4.1
Chicles Sin Azúcar Trident Mora Azul 30.6g,,30.6,g,4.1,wong,2024-12-05 19:25:09.251456,CHIFLE (BOCADITOS),30.6,g,4.1
Chicles Sin Azúcar Trident Evup Fresh Herbal 18un,,18.0,un,4.1,wong,2024-12-05 19:25:09.251456,CHIFLE (BOCADITOS),18.0,un,4.1
Chicles Sin Azúcar Trident Evup Sandia 18un,,18.0,un,4.1,wong,2024-12-05 19:25:09.251456,CHIFLE (BOCADITOS),18.0,un,4.1
Chicle FINI Huevos de Dinos Bolsa 80gr,Fini,80.0,g,4.2,vega,2024-12-05 13:22:59.756381,CHIFLE (BOCADITOS),80.0,g,4.2
Chicle FINI Sabor a Sandia Acida Bolsa 80gr,Fini,80.0,g,4.2,vega,2024-12-05 13:22:59.756381,CHIFLE (BOCADITOS),80.0,g,4.2
Cancha Chullpi + Chifle Salado VEGA Pote 150g,Vega,150.0,g,4.3,vega,2024-12-05 13:22:59.756381,CHIFLE (BOCADITOS),150.0,g,4.3
Marshmellows Colombina Millows Navidad 145g,,145.0,g,4.4,wong,2024-12-05 19:25:09.251456,CHIFLE (BOCADITOS),145.0,g,4.4
Marshmellows Colombina Millows Navidad 145g,,145.0,g,4.4,metro,2024-12-05 16:47:01.663159,CHIFLE (BOCADITOS),145.0,g,4.4
Sixpack Galleta con Crema Casino Choco Chill 43g,,43.0,g,4.5,metro,2024-12-05 16:47:01.663159,CHIFLE (BOCADITOS),43.0,g,4.5
Fideos Especiales Tipo Chifa La Pasta 500g,,500.0,g,4.5,wong,2024-12-05 19:25:09.251456,CHIFLE (BOCADITOS),500.0,g,4.5
Chives Verde Puro 45g,,45.0,g,4.5,wong,2024-12-05 19:25:09.251456,CHIFLE (BOCADITOS),45.0,g,4.5
Gomitas Mogul Extreme Tutti Frutti 80g,,80.0,g,4.6,metro,2024-12-05 16:47:01.663159,CHIFLE (BOCADITOS),80.0,g,4.6
Gomitas Mogul Extreme Sandía 80g,,80.0,g,4.6,metro,2024-12-05 16:47:01.663159,CHIFLE (BOCADITOS),80.0,g,4.6
Marshmellows Mr. Mallo American BBQ Bolsa 250 g,,250.0,g,4.9,metro,2024-12-05 16:47:01.663159,CHIFLE (BOCADITOS),250.0,g,4.9
Marshmellows Mr. Mallo American BBQ Bolsa 250 g,,250.0,g,4.9,wong,2024-12-05 19:25:09.251456,CHIFLE (BOCADITOS),250.0,g,4.9
Gomitas Ácidas Sabores Surtidos Fini Gusanos Ácidos 90g,,90.0,g,4.9,metro,2024-12-05 16:47:01.663159,CHIFLE (BOCADITOS),90.0,g,4.9
Gomitas Ácidas Sabores Surtidos Fini Gusanos Ácidos 90g,,90.0,g,4.9,wong,2024-12-05 19:25:09.251456,CHIFLE (BOCADITOS),90.0,g,4.9
Chifles Picantes Cuisine & Co 100g,,100.0,g,4.9,wong,2024-12-05 19:25:09.251456,CHIFLE (BOCADITOS),100.0,g,4.9
Chicle Sabores Surtidos Fini Ensalada de Frutas Ácidas 80g,,80.0,g,4.9,metro,2024-12-05 16:47:01.663159,CHIFLE (BOCADITOS),80.0,g,4.9
Marshmallows Millows Cilindro Bolsa 145 g,,145.0,g,5.0,metro,2024-12-05 16:47:01.663159,CHIFLE (BOCADITOS),145.0,g,5.0
Chifles Dulces VILLA NATURA Bolsa 150g,VILLA NATURA,150.0,g,5.0,vivanda,2024-12-05 22:31:17.105023,CHIFLE (BOCADITOS),150.0,g,5.0
Marshmellows Ambrosoli Mellows Bolsa 230 g,,230.0,g,5.5,metro,2024-12-05 16:47:01.663159,CHIFLE (BOCADITOS),230.0,g,5.5
Camote Frito en Hojuelas Cuisine & Co Pote 100 g,,100.0,g,5.5,metro,2024-12-05 16:47:01.663159,CHIFLE (BOCADITOS),100.0,g,5.5
Chifle Salado 150 g,TOTTUS,150.0,g,5.5,tottus,2024-12-05 12:43:20.637065,CHIFLE (BOCADITOS),150.0,g,5.5
Camote Frito Cuisine & Co Bolsa 130 gr,,130.0,g,5.9,metro,2024-12-05 16:47:01.663159,CHIFLE (BOCADITOS),130.0,g,5.9
Gomitas Trolli Octopus 100g,,100.0,g,5.9,wong,2024-12-05 19:25:09.251456,CHIFLE (BOCADITOS),100.0,g,5.9
Chifles salados de 125 g,GELCE,125.0,g,5.9,tottus,2024-12-05 12:43:20.637065,CHIFLE (BOCADITOS),125.0,g,5.9
Gomitas Trolli Sharks 100g,,100.0,g,5.9,wong,2024-12-05 19:25:09.251456,CHIFLE (BOCADITOS),100.0,g,5.9
Gomitas Trolli Classic Bears 100g,,100.0,g,5.9,wong,2024-12-05 19:25:09.251456,CHIFLE (BOCADITOS),100.0,g,5.9
Gomitas Trolli Sour Glow Worms 100g,,100.0,g,5.9,wong,2024-12-05 19:25:09.251456,CHIFLE (BOCADITOS),100.0,g,5.9
Chifle Crickets Leche De Tigre 150 g,CRICKET'S,150.0,g,5.93,tottus,2024-12-05 12:43:20.637065,CHIFLE (BOCADITOS),150.0,g,5.93
Marshmellows Ambrosoli Mellows Bolsa 230 g,,230.0,g,6.2,wong,2024-12-05 19:25:09.251456,CHIFLE (BOCADITOS),230.0,g,6.2
Hojuelas de Camote Tiyapuy Bolsa 160 g,,160.0,g,6.2,metro,2024-12-05 16:47:01.663159,CHIFLE (BOCADITOS),160.0,g,6.2
Maíz Gigante Inka Corn Chile Picante 100g,,100.0,g,6.2,wong,2024-12-05 19:25:09.251456,CHIFLE (BOCADITOS),100.0,g,6.2
Chifles del Vraem Tiyapuy 142g,,142.0,g,6.3,metro,2024-12-05 16:47:01.663159,CHIFLE (BOCADITOS),142.0,g,6.3
Chifle Salado Snack de 180 g,BUCKY,180.0,g,6.38,tottus,2024-12-05 12:43:20.637065,CHIFLE (BOCADITOS),180.0,g,6.38
Chifles Jalapeños Cuisine & Co 100g,,100.0,g,6.6,metro,2024-12-05 16:47:01.663159,CHIFLE (BOCADITOS),100.0,g,6.6
Chifles Norteños Cuisine & Co Pote 100 g,,100.0,g,6.6,metro,2024-12-05 16:47:01.663159,CHIFLE (BOCADITOS),100.0,g,6.6
Hojuelas de Camote Natuchips 135g,,135.0,g,6.6,metro,2024-12-05 16:47:01.663159,CHIFLE (BOCADITOS),135.0,g,6.6
Chicles Wrigley's Spearmint 15un,,15.0,un,6.7,wong,2024-12-05 19:25:09.251456,CHIFLE (BOCADITOS),15.0,un,6.7
Chicle Wrigley's Juicy Fruit 15un,,15.0,un,6.7,wong,2024-12-05 19:25:09.251456,CHIFLE (BOCADITOS),15.0,un,6.7
Chicle Sin Azúcar Classic Bubble Wrigley's Extra Caja 15 unid,,15.0,un,6.7,wong,2024-12-05 19:25:09.251456,CHIFLE (BOCADITOS),15.0,un,6.7
Canchita con Chifles Cuisine & Co Pote 180 g,,180.0,g,6.7,wong,2024-12-05 19:25:09.251456,CHIFLE (BOCADITOS),180.0,g,6.7
Marshmellows Tropical Mini Bolsa 100 g,,100.0,g,6.7,wong,2024-12-05 19:25:09.251456,CHIFLE (BOCADITOS),100.0,g,6.7
Chicle Sin Azúcar Menta Polar Wrigley's Extra Caja 15 unid,,15.0,un,6.7,wong,2024-12-05 19:25:09.251456,CHIFLE (BOCADITOS),15.0,un,6.7
Chicle Wrigley's Doublemint 15un,,15.0,un,6.8,wong,2024-12-05 19:25:09.251456,CHIFLE (BOCADITOS),15.0,un,6.8
Chifles Norteños Cuisine & Co Pote 100 g,,100.0,g,6.8,wong,2024-12-05 19:25:09.251456,CHIFLE (BOCADITOS),100.0,g,6.8
Chicle Wrigley's Orbit Peppermint 14un,,14.0,un,6.9,metro,2024-12-05 16:47:01.663159,CHIFLE (BOCADITOS),14.0,un,6.9
Chifles Sabor Norteño 160 g,GELCE,160.0,g,6.9,tottus,2024-12-05 12:43:20.637065,CHIFLE (BOCADITOS),160.0,g,6.9
Chicle Wrigley's Doublemint 15un,,15.0,un,6.9,metro,2024-12-05 16:47:01.663159,CHIFLE (BOCADITOS),15.0,un,6.9
Chifle Dulce150g,VILLA NATURA,150.0,g,6.9,tottus,2024-12-05 12:43:20.637065,CHIFLE (BOCADITOS),150.0,g,6.9
Chicle Wrigley's Orbit Spearmint 14un,,14.0,un,6.9,wong,2024-12-05 19:25:09.251456,CHIFLE (BOCADITOS),14.0,un,6.9
Keke Marmoleado Magdalena 12un,,12.0,un,6.9,metro,2024-12-05 16:47:01.663159,CHIFLE (BOCADITOS),12.0,un,6.9
Keke Magdalena Vainilla Dolcezza 12un,,12.0,un,6.9,metro,2024-12-05 16:47:01.663159,CHIFLE (BOCADITOS),12.0,un,6.9
Chifles Salados Villa Natura 150g,,150.0,g,7.3,metro,2024-12-05 16:47:01.663159,CHIFLE (BOCADITOS),150.0,g,7.3
Chifles Norteños MILYS Bolsa 160g,GELCE,160.0,g,7.4,vivanda,2024-12-05 22:31:17.105023,CHIFLE (BOCADITOS),160.0,g,7.4
Piqueo BELL'S Chifles salados Bolsa 220Gr,BELL'S,220.0,g,7.4,vivanda,2024-12-05 22:31:17.105023,CHIFLE (BOCADITOS),220.0,g,7.4
Chifles Dulces BELL'S Bolsa 220g,BELL'S,220.0,g,7.4,vivanda,2024-12-05 22:31:17.105023,CHIFLE (BOCADITOS),220.0,g,7.4
Camote en Hojuelas Inka Chips 130g,,130.0,g,7.5,metro,2024-12-05 16:47:01.663159,CHIFLE (BOCADITOS),130.0,g,7.5
Marshmallow Rocky Mountain Mini 150g,,150.0,g,7.7,metro,2024-12-05 16:47:01.663159,CHIFLE (BOCADITOS),150.0,g,7.7
Marshmallow Rocky Mountain Mini 150g,,150.0,g,7.7,wong,2024-12-05 19:25:09.251456,CHIFLE (BOCADITOS),150.0,g,7.7
Chupete GLOBO POP con Chicle Surtido Bolsa 24un,Globo Pop,24.0,un,7.8,vega,2024-12-05 13:22:59.756381,CHIFLE (BOCADITOS),24.0,un,7.8
Marshmallow con Cobertura Sabor Chocolate Olé Olé 50un,,50.0,un,7.9,metro,2024-12-05 16:47:01.663159,CHIFLE (BOCADITOS),50.0,un,7.9
Marshmallow con Cobertura Sabor Chocolate Olé Olé 50un,,50.0,un,7.9,wong,2024-12-05 19:25:09.251456,CHIFLE (BOCADITOS),50.0,un,7.9
Chupetes GLOBO POP!! Con chicle sabores surtidos Bolsa 480Gr,GLOBO POP,480.0,g,8.0,vivanda,2024-12-05 22:31:17.105023,CHIFLE (BOCADITOS),480.0,g,8.0
Chupetes GLOBO POP NEON!! Con chicle sabor limonada Bolsa 480Gr,GLOBO POP,480.0,g,8.0,vivanda,2024-12-05 22:31:17.105023,CHIFLE (BOCADITOS),480.0,g,8.0
Chupetes BOM BOM BUM con Chicle sabores Surtidos Bolsa 456g,BON BON,456.0,g,8.0,vivanda,2024-12-05 22:31:17.105023,CHIFLE (BOCADITOS),456.0,g,8.0
Chupetes BOM BOM BUM con Chicle sabor Fresa Bolsa 456g,BON BON,456.0,g,8.0,vivanda,2024-12-05 22:31:17.105023,CHIFLE (BOCADITOS),456.0,g,8.0
Chupetes GLOBO POP!! Relleno con chicle sabor fresa Bolsa 480Gr,GLOBO POP,480.0,g,8.0,vivanda,2024-12-05 22:31:17.105023,CHIFLE (BOCADITOS),480.0,g,8.0
Caramelos AMBROSOLI Super Rellenos con chicle Bolsa 100 un,Ambrosoli,100.0,un,8.0,vega,2024-12-05 13:22:59.756381,CHIFLE (BOCADITOS),100.0,un,8.0
Pituca Chips Original 146g,,146.0,g,8.2,wong,2024-12-05 19:25:09.251456,CHIFLE (BOCADITOS),146.0,g,8.2
Chicle Sin Azúcar Spearmint Mentos Pure Fresh Frasco 15 unid,,15.0,un,8.3,metro,2024-12-05 16:47:01.663159,CHIFLE (BOCADITOS),15.0,un,8.3
Chicle Sin Azúcar Mentos Full Fruit Frasco 15 unid,,15.0,un,8.3,wong,2024-12-05 19:25:09.251456,CHIFLE (BOCADITOS),15.0,un,8.3
Chifle Crickets Leche De Tigre 250 g,CRICKET'S,250.0,g,8.48,tottus,2024-12-05 12:43:20.637065,CHIFLE (BOCADITOS),250.0,g,8.48
Chifles Crickets Sabor Leche de Tigre 150g,,150.0,g,8.5,wong,2024-12-05 19:25:09.251456,CHIFLE (BOCADITOS),150.0,g,8.5
Yuca en Hojuelas Inka Chips 130g,,130.0,g,8.5,metro,2024-12-05 16:47:01.663159,CHIFLE (BOCADITOS),130.0,g,8.5
Caramelos Arcor Halloween Sangrientos 312g,,312.0,g,8.5,metro,2024-12-05 16:47:01.663159,CHIFLE (BOCADITOS),312.0,g,8.5
Chifles Crickets Sabor Leche de Tigre 150g,,150.0,g,8.5,metro,2024-12-05 16:47:01.663159,CHIFLE (BOCADITOS),150.0,g,8.5
Chifle Salado CRICKETS Sabor Leche de Tigre Bolsa 150g,CRICKET S,150.0,g,8.5,vivanda,2024-12-05 22:31:17.105023,CHIFLE (BOCADITOS),150.0,g,8.5
Chicle Sin Azúcar Trident X Splash Fresa y Limón 23un,,23.0,un,8.9,wong,2024-12-05 19:25:09.251456,CHIFLE (BOCADITOS),23.0,un,8.9
Fideos Especiales Tipo Chifa La Pasta 1kg,,1.0,kg,8.9,metro,2024-12-05 16:47:01.663159,CHIFLE (BOCADITOS),1.0,kg,8.9
Golosina ARCOR Masticable Frutas Bolsa 412 g,Arcor,412.0,g,8.9,vega,2024-12-05 13:22:59.756381,CHIFLE (BOCADITOS),412.0,g,8.9
Chicle Sin Azúcar Trident X Splash Fresa y Limón 23un,,23.0,un,8.9,metro,2024-12-05 16:47:01.663159,CHIFLE (BOCADITOS),23.0,un,8.9
Yuca en Hojuelas Inka Chips 130g,,130.0,g,9.0,wong,2024-12-05 19:25:09.251456,CHIFLE (BOCADITOS),130.0,g,9.0
Chicles Sin Azúcar Trident Sabor Menta 45.5g,,45.5,g,9.2,metro,2024-12-05 16:47:01.663159,CHIFLE (BOCADITOS),45.5,g,9.2
Chicles Sin Azúcar Trident Fresa 35un,,35.0,un,9.2,metro,2024-12-05 16:47:01.663159,CHIFLE (BOCADITOS),35.0,un,9.2
Chicles Sin Azúcar Trident Fresa 35un,,35.0,un,9.2,wong,2024-12-05 19:25:09.251456,CHIFLE (BOCADITOS),35.0,un,9.2
Chicles Sin Azúcar Trident Sabor Yerbabuena 45.5g,,45.5,g,9.2,metro,2024-12-05 16:47:01.663159,CHIFLE (BOCADITOS),45.5,g,9.2
Chicles Sin Azúcar Trident Sabor Menta 45.5g,,45.5,g,9.2,wong,2024-12-05 19:25:09.251456,CHIFLE (BOCADITOS),45.5,g,9.2
Chifles Karinto Salados 150g,,150.0,g,9.3,metro,2024-12-05 16:47:01.663159,CHIFLE (BOCADITOS),150.0,g,9.3
Chifles KARINTO Salado Bolsa 150g,KARINTO,150.0,g,9.3,vivanda,2024-12-05 22:31:17.105023,CHIFLE (BOCADITOS),150.0,g,9.3
Chifles Karinto Salados 150g,,150.0,g,9.6,wong,2024-12-05 19:25:09.251456,CHIFLE (BOCADITOS),150.0,g,9.6
Chili En Polvo Badia 70.8 g,,70.8,g,9.6,wong,2024-12-05 19:25:09.251456,CHIFLE (BOCADITOS),70.8,g,9.6
Chifles Corte Delgado Cuisine & Co Bolsa 200 gr,,200.0,g,9.6,metro,2024-12-05 16:47:01.663159,CHIFLE (BOCADITOS),200.0,g,9.6
Chifles Corte Delgado Cuisine & Co Bolsa 200 gr,,200.0,g,9.7,wong,2024-12-05 19:25:09.251456,CHIFLE (BOCADITOS),200.0,g,9.7
Bocaditos Salvado con Orégano Fibralight 200 g,FIBERLIGHT,200.0,g,9.8,tottus,2024-12-05 12:43:20.637065,CHIFLE (BOCADITOS),200.0,g,9.8
Chifles Norteños Milys 250g,,250.0,g,9.9,metro,2024-12-05 16:47:01.663159,CHIFLE (BOCADITOS),250.0,g,9.9
Keke Inglés Vainilla Caja 18 Porciones,,18.0,un,9.9,metro,2024-12-05 16:47:01.663159,CHIFLE (BOCADITOS),18.0,un,9.9
Chifles Picantes Crickets 200g,,200.0,g,9.9,wong,2024-12-05 19:25:09.251456,CHIFLE (BOCADITOS),200.0,g,9.9
Marshmallows Cuisine & Co 283g,,283.0,g,9.9,wong,2024-12-05 19:25:09.251456,CHIFLE (BOCADITOS),283.0,g,9.9
Gomitas Menta 2 Cerritos 150g,,150.0,g,10.2,wong,2024-12-05 19:25:09.251456,CHIFLE (BOCADITOS),150.0,g,10.2
Marshmellows Millows Unicornio 50un,,50.0,un,10.7,wong,2024-12-05 19:25:09.251456,CHIFLE (BOCADITOS),50.0,un,10.7
Marshmellows Millows Unicornio 50un,,50.0,un,10.7,metro,2024-12-05 16:47:01.663159,CHIFLE (BOCADITOS),50.0,un,10.7
Chifles Salados Veggie Chips 250g,,250.0,g,10.8,wong,2024-12-05 19:25:09.251456,CHIFLE (BOCADITOS),250.0,g,10.8
Marshmallow Millows Fresa Bolsa 290g,,290.0,g,10.9,metro,2024-12-05 16:47:01.663159,CHIFLE (BOCADITOS),290.0,g,10.9
Marshmellows Tropical Bolsa 255 g,,255.0,g,10.9,wong,2024-12-05 19:25:09.251456,CHIFLE (BOCADITOS),255.0,g,10.9
Chifón Marmoleado Metro 320g,,320.0,g,10.97,metro,2024-12-05 16:47:01.663159,CHIFLE (BOCADITOS),320.0,g,10.97
Chifón de Naranja Metro 320g,,320.0,g,10.97,metro,2024-12-05 16:47:01.663159,CHIFLE (BOCADITOS),320.0,g,10.97
Chifles Crickets Leche de Tigre 250g,,250.0,g,11.2,metro,2024-12-05 16:47:01.663159,CHIFLE (BOCADITOS),250.0,g,11.2
Chifles Salados CRICKETS Bolsa 250g,CRICKET S,250.0,g,11.2,vivanda,2024-12-05 22:31:17.105023,CHIFLE (BOCADITOS),250.0,g,11.2
Chifles CRICKETS Sabor a Leche de Tigre Bolsa 250g,CRICKET S,250.0,g,11.2,vivanda,2024-12-05 22:31:17.105023,CHIFLE (BOCADITOS),250.0,g,11.2
Chifles Salados Crickets 250g,,250.0,g,11.2,wong,2024-12-05 19:25:09.251456,CHIFLE (BOCADITOS),250.0,g,11.2
Chifles Salados Crickets 250g,,250.0,g,11.2,metro,2024-12-05 16:47:01.663159,CHIFLE (BOCADITOS),250.0,g,11.2
Chifles Picantes CRICKETS Bolsa 250g,CRICKET S,250.0,g,11.2,vivanda,2024-12-05 22:31:17.105023,CHIFLE (BOCADITOS),250.0,g,11.2
Caja Sorpresa Arcor Halloween Sorpresa Dinos 100g,,100.0,g,11.3,metro,2024-12-05 16:47:01.663159,CHIFLE (BOCADITOS),100.0,g,11.3
Gomitas Ambrosoli Flipy 480g,,480.0,g,11.5,wong,2024-12-05 19:25:09.251456,CHIFLE (BOCADITOS),480.0,g,11.5
Gomitas Ambrosoli Ambrosia Bolsa 480 g,,480.0,g,12.2,wong,2024-12-05 19:25:09.251456,CHIFLE (BOCADITOS),480.0,g,12.2
Chifón de Naranja Wong 320g,,320.0,g,12.33,wong,2024-12-05 19:25:09.251456,CHIFLE (BOCADITOS),320.0,g,12.33
Chicle Wrigley's Hubba Bubba Bubble Tap 56.7g,,56.7,g,13.0,wong,2024-12-05 19:25:09.251456,CHIFLE (BOCADITOS),56.7,g,13.0
Chicle Wrigley's Hubba Bubba Bubble Tap 56.7g,,56.7,g,13.0,metro,2024-12-05 16:47:01.663159,CHIFLE (BOCADITOS),56.7,g,13.0
Marshmellows Tropical Bolsa 255 g,,255.0,g,13.1,metro,2024-12-05 16:47:01.663159,CHIFLE (BOCADITOS),255.0,g,13.1
Desodorante en Aerosol AXE Ice Chill Menta Frasco 150 ml,Axe,150.0,ml,13.5,vega,2024-12-05 13:22:59.756381,CHIFLE (BOCADITOS),150.0,ml,13.5
Chifles Salados con Cancha y Cecina Bolsa 250 g,,250.0,g,13.9,metro,2024-12-05 16:47:01.663159,CHIFLE (BOCADITOS),250.0,g,13.9
Chifles Salados con Cancha y Cecina Bolsa 250 g,,250.0,g,13.9,wong,2024-12-05 19:25:09.251456,CHIFLE (BOCADITOS),250.0,g,13.9
Chifles Salados Bolsa 250 g,,250.0,g,13.9,wong,2024-12-05 19:25:09.251456,CHIFLE (BOCADITOS),250.0,g,13.9
Pack x2 Chicle Sin Azúcar Trident X Splash Sabor Fresa y Limón 44.6g,,44.6,g,14.0,wong,2024-12-05 19:25:09.251456,CHIFLE (BOCADITOS),44.6,g,14.0
Pack x2 Chicles Sin Azúcar Trident Sabor Fresa 45.5g,,45.5,g,14.0,wong,2024-12-05 19:25:09.251456,CHIFLE (BOCADITOS),45.5,g,14.0
Pack x2 Chicles Sin Azúcar Trident Sabor Menta 45.5g,,45.5,g,14.0,metro,2024-12-05 16:47:01.663159,CHIFLE (BOCADITOS),45.5,g,14.0
Pack x2 Chicles Sin Azúcar Trident Sabor Fresa 45.5g,,45.5,g,14.0,metro,2024-12-05 16:47:01.663159,CHIFLE (BOCADITOS),45.5,g,14.0
Pack x2 Chicle Sin Azúcar Trident X Splash Sabor Fresa y Limón 44.6g,,44.6,g,14.0,metro,2024-12-05 16:47:01.663159,CHIFLE (BOCADITOS),44.6,g,14.0
Gomitas Ambrosoli Frugel 430g,,430.0,g,14.9,metro,2024-12-05 16:47:01.663159,CHIFLE (BOCADITOS),430.0,g,14.9
Gomitas Ambrosoli Frugel 430g,,430.0,g,14.9,wong,2024-12-05 19:25:09.251456,CHIFLE (BOCADITOS),430.0,g,14.9
Desodorante Bodyspray Axe Ice Chill 150ml,,150.0,ml,14.9,metro,2024-12-05 16:47:01.663159,CHIFLE (BOCADITOS),150.0,ml,14.9
Antitranspirante Antibacterial en Aerosol Axe Ice Chill 152ml,,152.0,ml,14.9,wong,2024-12-05 19:25:09.251456,CHIFLE (BOCADITOS),152.0,ml,14.9
Deocolonia para hombre en Aerosol para Hombre AXE Ice Chill Efecto Frío Frasco 150ml,AXE,150.0,ml,14.9,vivanda,2024-12-05 22:31:17.105023,CHIFLE (BOCADITOS),150.0,ml,14.9
Chicle Sabores Surtidos Grosso Arcor Bolsa 325 g,,325.0,g,15.0,metro,2024-12-05 16:47:01.663159,CHIFLE (BOCADITOS),325.0,g,15.0
Keke de Manzana con Canela 8 Porciones,,8.0,un,15.12,metro,2024-12-05 16:47:01.663159,CHIFLE (BOCADITOS),8.0,un,15.12
Tostones Inka Chips Sabor Jalapeño 230g,,230.0,g,15.5,wong,2024-12-05 19:25:09.251456,CHIFLE (BOCADITOS),230.0,g,15.5
Tostones Inka Chips Sabor Jalapeño 230g,,230.0,g,15.5,metro,2024-12-05 16:47:01.663159,CHIFLE (BOCADITOS),230.0,g,15.5
Tostones con Sal Inka Chips 240g,,240.0,g,15.5,wong,2024-12-05 19:25:09.251456,CHIFLE (BOCADITOS),240.0,g,15.5
Tostones con Sal Inka Chips 240g,,240.0,g,15.7,metro,2024-12-05 16:47:01.663159,CHIFLE (BOCADITOS),240.0,g,15.7
Paleta de Marshmallow Chin Chin Choco Paletón Navidad 10un,,10.0,un,15.9,metro,2024-12-05 16:47:01.663159,CHIFLE (BOCADITOS),10.0,un,15.9
Chile Casero HERDEZ Frasco 453g,HERDEZ,453.0,g,16.4,vivanda,2024-12-05 22:31:17.105023,CHIFLE (BOCADITOS),453.0,g,16.4
Chifles Dulces ARTICHAY Sabor a Salsa Acevichada Bolsa 210g,ARTICHAY,210.0,g,16.5,vivanda,2024-12-05 22:31:17.105023,CHIFLE (BOCADITOS),210.0,g,16.5
CHIFLES SALADOS CANCHA CARNE RES 250G,ARTICHAY,250.0,g,16.5,tottus,2024-12-05 12:43:20.637065,CHIFLE (BOCADITOS),250.0,g,16.5
Keke de Manzana con Canela 8 Porciones,,8.0,un,16.72,wong,2024-12-05 19:25:09.251456,CHIFLE (BOCADITOS),8.0,un,16.72
Chifle Norteño Con Canchita Milys 500 g,TOTTUS,500.0,g,16.9,tottus,2024-12-05 12:43:20.637065,CHIFLE (BOCADITOS),500.0,g,16.9
Keke Vegano de Plátano y Canela Yöy 275g,,275.0,g,16.92,wong,2024-12-05 19:25:09.251456,CHIFLE (BOCADITOS),275.0,g,16.92
Malvaviscos Bañados con Chocolate Conguitos 2 Cerritos Bolsa 200 gr,,200.0,g,17.2,wong,2024-12-05 19:25:09.251456,CHIFLE (BOCADITOS),200.0,g,17.2
Keke de Manzana + Gaseosa Botella 1.5L,,1.5,l,18.32,wong,2024-12-05 19:25:09.251456,CHIFLE (BOCADITOS),1.5,l,18.32
Chifón de Naranja Metro 850g,,850.0,g,18.6,metro,2024-12-05 16:47:01.663159,CHIFLE (BOCADITOS),850.0,g,18.6
Chifón Marmoleado Metro 850g,,850.0,g,18.62,metro,2024-12-05 16:47:01.663159,CHIFLE (BOCADITOS),850.0,g,18.62
Chifles Salados Villa Natura 500g,,500.0,g,18.9,wong,2024-12-05 19:25:09.251456,CHIFLE (BOCADITOS),500.0,g,18.9
Chifles Salados Villa Natura 500g,,500.0,g,18.9,metro,2024-12-05 16:47:01.663159,CHIFLE (BOCADITOS),500.0,g,18.9
Chifles Norteños Milys 500g,,500.0,g,18.9,wong,2024-12-05 19:25:09.251456,CHIFLE (BOCADITOS),500.0,g,18.9
Chifles Norteños Milys 500g,,500.0,g,18.9,metro,2024-12-05 16:47:01.663159,CHIFLE (BOCADITOS),500.0,g,18.9
Cigarros Lucky Strike Big Chill 20un,,20.0,un,19.1,metro,2024-12-05 16:47:01.663159,CHIFLE (BOCADITOS),20.0,un,19.1
Cigarros Lucky Strike Big Chill 20un,,20.0,un,19.1,wong,2024-12-05 19:25:09.251456,CHIFLE (BOCADITOS),20.0,un,19.1
Cigarrillos Lucky Strike Double Chill 20un,,20.0,un,19.7,metro,2024-12-05 16:47:01.663159,CHIFLE (BOCADITOS),20.0,un,19.7
Chifón de Naranja Wong 850g,,850.0,g,20.83,wong,2024-12-05 19:25:09.251456,CHIFLE (BOCADITOS),850.0,g,20.83
Chifles Salados Crickets 500g,,500.0,g,21.9,wong,2024-12-05 19:25:09.251456,CHIFLE (BOCADITOS),500.0,g,21.9
Chifles Picantes Crickets 500 g,,500.0,g,21.9,wong,2024-12-05 19:25:09.251456,CHIFLE (BOCADITOS),500.0,g,21.9
Chifles Salados CRICKETS Bolsa 500g,CRICKET S,500.0,g,21.9,vivanda,2024-12-05 22:31:17.105023,CHIFLE (BOCADITOS),500.0,g,21.9
Chifles Salados Crickets 500g,,500.0,g,21.9,metro,2024-12-05 16:47:01.663159,CHIFLE (BOCADITOS),500.0,g,21.9
Chifles Picantes CRICKETS Bolsa 500g,CRICKET S,500.0,g,21.9,vivanda,2024-12-05 22:31:17.105023,CHIFLE (BOCADITOS),500.0,g,21.9
Chifles Estilo Piurano Máxima 750g,,750.0,g,23.9,metro,2024-12-05 16:47:01.663159,CHIFLE (BOCADITOS),750.0,g,23.9
Gomitas Masticables Sour Patch Kids 340g,,340.0,g,29.9,metro,2024-12-05 16:47:01.663159,CHIFLE (BOCADITOS),340.0,g,29.9
Gomitas Masticables Sour Patch Kids 340g,,340.0,g,29.9,wong,2024-12-05 19:25:09.251456,CHIFLE (BOCADITOS),340.0,g,29.9
CHIFLES SALADOS CANCHA CARNE RES 500G,ARTICHAY,500.0,g,30.5,tottus,2024-12-05 12:43:20.637065,CHIFLE (BOCADITOS),500.0,g,30.5
Chifles Salados con Cancha y Cecina Bolsa 500 g,,500.0,g,30.5,wong,2024-12-05 19:25:09.251456,CHIFLE (BOCADITOS),500.0,g,30.5
