description,price,website,search_term,scrape_timestamp,cantidad,unidad,description_no_unit,price_numeric,WEB,unit,brand,CLASIFICACION
Pan para Hot Dog 5un,S/ 2.50,wong,HOT DOG,2024-12-05 18:03:40.462080,5.0,un,Pan para Hot Dog,2.5,wong,,,HOT DOG
Hot Dog de Pavita San Fernando 100g,S/ 3.10,metro,HOT DOG,2024-12-05 15:34:33.175471,100.0,g,Hot Dog de Pavita San Fernando,3.1,metro,,,HOT DOG
Salchicha de pollo 250 g,S/ 3.50,tottus,HOT DOG,2024-12-05 11:34:40.326979,250.0,g,Salchicha de pollo,3.5,tottus,,REDONDOS,HOT DOG
Comida para Perros DOG CHOW Cachorros con Carne Pouch 100 gr,S/ 3.90,vega,HOT DOG,2024-12-05 12:07:26.982545,100.0,g,Comida para Perros DOG CHOW Cachorros con Carne Pouch r,3.9,vega,,Dog Chow,HOT DOG
Alimento Húmedo DOG CHOW Pollo Cachorro Doypack 100g,S/ 3.90,vega,HOT DOG,2024-12-05 12:07:26.982545,100.0,g,Alimento Húmedo DOG CHOW Pollo Cachorro Doypack,3.9,vega,,Dog Chow,HOT DOG
Hot Dog de Pollo Ahumado San Fernando 220g,S/ 4.20,metro,HOT DOG,2024-12-05 15:34:33.175471,220.0,g,Hot Dog de Pollo Ahumado San Fernando,4.2,metro,,,HOT DOG
Pan Hot Dog LA FLORENCIA Paquete 360g,S/ 4.20 un,plaza_vea,HOT DOG,2024-12-05 14:52:09.431114,6.0,un,Pan Hot Dog LA FLORENCIA Paquete,4.2,plaza_vea,Bolsa 6un,,HOT DOG
Pan Hot Dog LA FLORENCIA Paquete 360g,S/ 4.30,vivanda,HOT DOG,2024-12-05 21:45:02.380175,360.0,g,Pan Hot Dog LA FLORENCIA Paquete,4.3,vivanda,,LA FLORENCIA,HOT DOG
Hot Dog de Cerdo San Fernando 200g,S/ 4.35,metro,HOT DOG,2024-12-05 15:34:33.175471,200.0,g,Hot Dog de Cerdo San Fernando,4.35,metro,,,HOT DOG
Pan para Hot Dog 5un,S/ 4.59,metro,HOT DOG,2024-12-05 15:34:33.175471,5.0,un,Pan para Hot Dog,4.59,metro,,,HOT DOG
Hot Dog Ahumado de Pollo SAN FERNANDO Paquete ...,S/ 4.60 un,plaza_vea,HOT DOG,2024-12-05 14:52:09.431114,220.0,g,Hot Dog Ahumado de Pollo SAN FERNANDO Paquete,4.6,plaza_vea,Paquete 220g,,HOT DOG
Hot Dog de Pollo Metro Paquete 250 g,S/ 4.90,metro,HOT DOG,2024-12-05 15:34:33.175471,250.0,g,Hot Dog de Pollo Metro Paquete,4.9,metro,,,HOT DOG
Hot Dog SAN FERNANDO Paquete 200g,S/ 5.20 un,plaza_vea,HOT DOG,2024-12-05 14:52:09.431114,200.0,g,Hot Dog SAN FERNANDO Paquete,5.2,plaza_vea,Paquete 200g,,HOT DOG
Hot Dog BELL'S Paquete 250g,S/ 5.49 un,plaza_vea,HOT DOG,2024-12-05 14:52:09.431114,250.0,g,Hot Dog BELL'S Paquete,5.49,plaza_vea,Paquete 250g,,HOT DOG
Pan Hot Dog Wong Bolsa 6 Unid,S/ 5.49,wong,HOT DOG,2024-12-05 18:03:40.462080,6.0,un,Pan Hot Dog Wong Bolsa,5.49,wong,,,HOT DOG
Salchicha de pollo San Fernando 250 g,S/ 5.50,tottus,HOT DOG,2024-12-05 11:34:40.326979,250.0,g,Salchicha de pollo San Fernando,5.5,tottus,,,HOT DOG
Hot Dog Bredt 200 g,S/ 5.50,tottus,HOT DOG,2024-12-05 11:34:40.326979,200.0,g,Hot Dog Bredt,5.5,tottus,,BRAEDT,HOT DOG
Hot Dog Pollo SALCHICHERÍA SUIZA Paquete 200g,S/ 5.50 un,plaza_vea,HOT DOG,2024-12-05 14:52:09.431114,200.0,g,Hot Dog Pollo SALCHICHERÍA SUIZA Paquete,5.5,plaza_vea,Paquete 200g,,HOT DOG
Hot Dog con Pollo Suiza 200g,S/ 5.60,metro,HOT DOG,2024-12-05 15:34:33.175471,200.0,g,Hot Dog con Pollo Suiza,5.6,metro,,,HOT DOG
Hot Dog Rico Pollo 250 g,S/ 5.60,metro,HOT DOG,2024-12-05 15:34:33.175471,250.0,g,Hot Dog Rico Pollo,5.6,metro,,,HOT DOG
Hot Dog de Pollo Ahumado San Fernando 220g,S/ 5.70,wong,HOT DOG,2024-12-05 18:03:40.462080,220.0,g,Hot Dog de Pollo Ahumado San Fernando,5.7,wong,,,HOT DOG
HOT DOG VIENESA SALCHICHERI ALE PQ 250G,S/ 5.80,tottus,HOT DOG,2024-12-05 11:34:40.326979,250.0,g,HOT DOG VIENESA SALCHICHERI ALE PQ,5.8,tottus,,SALCHICHERIA ALEMANA,HOT DOG
Hot Dog de Cerdo San Fernando 200g,S/ 5.80,wong,HOT DOG,2024-12-05 18:03:40.462080,200.0,g,Hot Dog de Cerdo San Fernando,5.8,wong,,,HOT DOG
Hot Dog con Pollo Suiza 200g,S/ 5.80,wong,HOT DOG,2024-12-05 18:03:40.462080,200.0,g,Hot Dog con Pollo Suiza,5.8,wong,,,HOT DOG
Hot Dog de Cerdo Cuisine & Co 250g,S/ 5.90,wong,HOT DOG,2024-12-05 18:03:40.462080,250.0,g,Hot Dog de Cerdo Cuisine & Co,5.9,wong,,,HOT DOG
Pan Hot Dog Metro 6un.,S/ 5.90,metro,HOT DOG,2024-12-05 15:34:33.175471,6.0,un,Pan Hot Dog Metro .,5.9,metro,,,HOT DOG
Hot Dog de Cerdo Cuisine & Co 250g,S/ 5.90,metro,HOT DOG,2024-12-05 15:34:33.175471,250.0,g,Hot Dog de Cerdo Cuisine & Co,5.9,metro,,,HOT DOG
Hot Dog Braedt Paquete 200 g,S/ 6.20,metro,HOT DOG,2024-12-05 15:34:33.175471,200.0,g,Hot Dog Braedt Paquete,6.2,metro,,,HOT DOG
Hot Dog SALCHICHERÍA SUIZA Paquete 200g,S/ 6.30,vivanda,HOT DOG,2024-12-05 21:45:02.380175,200.0,g,Hot Dog SALCHICHERÍA SUIZA Paquete,6.3,vivanda,,SUIZA,HOT DOG
Hot Dog de Pavita San Fernando paquete 250 g,S/ 6.37,metro,HOT DOG,2024-12-05 15:34:33.175471,250.0,g,Hot Dog de Pavita San Fernando paquete,6.37,metro,,,HOT DOG
Hot Dog Braedt 200g,S/ 6.40,wong,HOT DOG,2024-12-05 18:03:40.462080,200.0,g,Hot Dog Braedt,6.4,wong,,,HOT DOG
Hot Dog Pelado Suiza 200g,S/ 6.50,metro,HOT DOG,2024-12-05 15:34:33.175471,200.0,g,Hot Dog Pelado Suiza,6.5,metro,,,HOT DOG
Hot Dog Pelado Suiza 200g,S/ 6.50,wong,HOT DOG,2024-12-05 18:03:40.462080,200.0,g,Hot Dog Pelado Suiza,6.5,wong,,,HOT DOG
Carnaza Natural de Salchicha para Perros Pet 10 Unidades,S/ 6.50,tottus,HOT DOG,2024-12-05 11:34:40.326979,10.0,un,Carnaza Natural de Salchicha para Perros Pet ades,6.5,tottus,,TOTTUS,HOT DOG
Hot Dog de Pavita SAN FERNANDO Paquete 250g,S/ 6.50 un,plaza_vea,HOT DOG,2024-12-05 14:52:09.431114,250.0,g,Hot Dog de Pavita SAN FERNANDO Paquete,6.5,plaza_vea,Paquete 250g,,HOT DOG
Hot Dog de Pavita SAN FERNANDO Paquete 250g,S/ 6.50,vivanda,HOT DOG,2024-12-05 21:45:02.380175,250.0,g,Hot Dog de Pavita SAN FERNANDO Paquete,6.5,vivanda,,SAN FERNANDO,HOT DOG
SALCHICHA DE HUACHO X150 GR,S/ 6.50,tottus,HOT DOG,2024-12-05 11:34:40.326979,150.0,g,SALCHICHA DE HUACHO XR,6.5,tottus,,BRAEDT,HOT DOG
Salchicha de pollo 500 g,S/ 6.90,tottus,HOT DOG,2024-12-05 11:34:40.326979,500.0,g,Salchicha de pollo,6.9,tottus,,REDONDOS,HOT DOG
Pan para Hot Dog Cuisine & Co 8un,S/ 6.90,wong,HOT DOG,2024-12-05 18:03:40.462080,8.0,un,Pan para Hot Dog Cuisine & Co,6.9,wong,,,HOT DOG
Hot Dog De Pavita 250 g,S/ 7.20,tottus,HOT DOG,2024-12-05 11:34:40.326979,250.0,g,Hot Dog De Pavita,7.2,tottus,,SAN FERNANDO,HOT DOG
Pan para Hot Dog BELL’S Bolsa 8un,S/ 7.50,vivanda,HOT DOG,2024-12-05 21:45:02.380175,8.0,un,Pan para Hot Dog BELL’S Bolsa,7.5,vivanda,,BELL'S,HOT DOG
Hot Dog Zimmermann Paquete 250 g,S/ 7.74,wong,HOT DOG,2024-12-05 18:03:40.462080,250.0,g,Hot Dog Zimmermann Paquete,7.74,wong,,,HOT DOG
Hot Dog Vienesa Salchichería Alemana 250g,S/ 8.10,metro,HOT DOG,2024-12-05 15:34:33.175471,250.0,g,Hot Dog Vienesa Salchichería Alemana,8.1,metro,,,HOT DOG
Pan Hot Dog x Kg,S/ 8.10,vivanda,HOT DOG,2024-12-05 21:45:02.380175,1.0,kg,Pan Hot Dog,8.1,vivanda,,VIVANDA,HOT DOG
Hot Dog de Pollo Nino 900g,S/ 8.50,metro,HOT DOG,2024-12-05 15:34:33.175471,900.0,g,Hot Dog de Pollo Nino,8.5,metro,,,HOT DOG
Hot Dog Vienesa Salchichería Alemana 250g,S/ 8.50,wong,HOT DOG,2024-12-05 18:03:40.462080,250.0,g,Hot Dog Vienesa Salchichería Alemana,8.5,wong,,,HOT DOG
Hot Dog de Pavo Braedt Balance 250g,S/ 8.91,wong,HOT DOG,2024-12-05 18:03:40.462080,250.0,g,Hot Dog de Pavo Braedt Balance,8.91,wong,,,HOT DOG
Hot Dog de Cerdo San Fernando 400g,S/ 8.92,metro,HOT DOG,2024-12-05 15:34:33.175471,400.0,g,Hot Dog de Cerdo San Fernando,8.92,metro,,,HOT DOG
Hot Dog Zimmermann Paquete 250 g,S/ 9.10,metro,HOT DOG,2024-12-05 15:34:33.175471,250.0,g,Hot Dog Zimmermann Paquete,9.1,metro,,,HOT DOG
Comida para Perros DOG CHOW Cachorros Sabor Carne Doypack 100g x 2u,S/ 9.20,vega,HOT DOG,2024-12-05 12:07:26.982545,100.0,g,Comida para Perros DOG CHOW Cachorros Sabor Carne Doypack  x 2u,9.2,vega,,Dog Chow,HOT DOG
Comida para Perros DOG CHOW Cachorros Sabor Pollo Doypack 100g x 2u,S/ 9.20,vega,HOT DOG,2024-12-05 12:07:26.982545,100.0,g,Comida para Perros DOG CHOW Cachorros Sabor Pollo Doypack  x 2u,9.2,vega,,Dog Chow,HOT DOG
Comida para Perros DOG CHOW Adultos Sabor Cordero Doypack 100g x 2u,S/ 9.20,vega,HOT DOG,2024-12-05 12:07:26.982545,100.0,g,Comida para Perros DOG CHOW Adultos Sabor Cordero Doypack  x 2u,9.2,vega,,Dog Chow,HOT DOG
Alimento para Perros DOG CHOW Carne Molida Lata 368g,S/ 9.50,vega,HOT DOG,2024-12-05 12:07:26.982545,368.0,g,Alimento para Perros DOG CHOW Carne Molida Lata,9.5,vega,,Dog Chow,HOT DOG
Alimento para Perros DOG CHOW Todas las Razas Sabor a Pollo Molido Lata 368gr,S/ 9.50,vega,HOT DOG,2024-12-05 12:07:26.982545,368.0,g,Alimento para Perros DOG CHOW Todas las Razas Sabor a Pollo Molido Lata r,9.5,vega,,Dog Chow,HOT DOG
Salchichas TULIP Hot Dog Lata 125g,S/ 9.50,vivanda,HOT DOG,2024-12-05 21:45:02.380175,125.0,g,Salchichas TULIP Hot Dog Lata,9.5,vivanda,,TULIP,HOT DOG
Hot Dog de Pollo 250 g,S/ 9.60,metro,HOT DOG,2024-12-05 15:34:33.175471,250.0,g,Hot Dog de Pollo,9.6,metro,,,HOT DOG
Gomitas Trolli Hot Dog 90g,S/ 9.70,metro,HOT DOG,2024-12-05 15:34:33.175471,90.0,g,Gomitas Trolli Hot Dog,9.7,metro,,,HOT DOG
Hot Dog de Pollo 250 g,S/ 9.80,wong,HOT DOG,2024-12-05 18:03:40.462080,250.0,g,Hot Dog de Pollo,9.8,wong,,,HOT DOG
Alimento Húmedo para Perros DOG CHOW Adultos Cordero Doypack 100g x3u,S/ 9.90 28%,vega,HOT DOG,2024-12-05 12:07:26.982545,100.0,g,Alimento Húmedo para Perros DOG CHOW Adultos Cordero Doypack  x3u,9.9,vega,,Dog Chow,HOT DOG
Hot Dog Pollo SALCHICHERÍA SUIZA Paquete 400g,S/ 9.90 un,plaza_vea,HOT DOG,2024-12-05 14:52:09.431114,400.0,g,Hot Dog Pollo SALCHICHERÍA SUIZA Paquete,9.9,plaza_vea,Paquete 400g,,HOT DOG
Pan para Hot Dogs 8 Unidades,S/ 9.90,tottus,HOT DOG,2024-12-05 11:34:40.326979,8.0,un,Pan para Hot Dogs ades,9.9,tottus,,BIMBO,HOT DOG
Salchicha de pollo San Fernando 500 g,S/ 9.90,tottus,HOT DOG,2024-12-05 11:34:40.326979,500.0,g,Salchicha de pollo San Fernando,9.9,tottus,,,HOT DOG
Pan para Hot Dog BIMBO Bolsa 8un,S/ 9.90 un,plaza_vea,HOT DOG,2024-12-05 14:52:09.431114,8.0,un,Pan para Hot Dog BIMBO Bolsa,9.9,plaza_vea,Bolsa 8un,,HOT DOG
HOT DOG DE POLLO X 500G,S/ 9.90,tottus,HOT DOG,2024-12-05 11:34:40.326979,500.0,g,HOT DOG DE POLLO X,9.9,tottus,,TOTTUS,HOT DOG
Hot Dog BELL'S Paquete 500g,S/ 9.90 un,plaza_vea,HOT DOG,2024-12-05 14:52:09.431114,500.0,g,Hot Dog BELL'S Paquete,9.9,plaza_vea,Paquete 500g,,HOT DOG
Hot Dog de Pavo Braedt Balance 250g,S/ 9.90,metro,HOT DOG,2024-12-05 15:34:33.175471,250.0,g,Hot Dog de Pavo Braedt Balance,9.9,metro,,,HOT DOG
Hot Dog de Pavo BRAEDT Balance Paquete 250g,S/ 9.99,vivanda,HOT DOG,2024-12-05 21:45:02.380175,250.0,g,Hot Dog de Pavo BRAEDT Balance Paquete,9.99,vivanda,,BRAEDT,HOT DOG
Hot Dog de Pavo BRAEDT Balance Paquete 250g,S/ 9.99 un,plaza_vea,HOT DOG,2024-12-05 14:52:09.431114,250.0,g,Hot Dog de Pavo BRAEDT Balance Paquete,9.99,plaza_vea,Paquete 250g,,HOT DOG
Hot Dog Ahumado de Pollo SAN FERNANDO Paquete ...,S/ 10 un,plaza_vea,HOT DOG,2024-12-05 14:52:09.431114,440.0,g,Hot Dog Ahumado de Pollo SAN FERNANDO Paquete,10.0,plaza_vea,Paquete 440g,,HOT DOG
Hot Dog San Fernando ahumado de pollo de 440 g,S/ 10,tottus,HOT DOG,2024-12-05 11:34:40.326979,440.0,g,Hot Dog San Fernando ahumado de pollo de,10.0,tottus,,,HOT DOG
Hot Dog S. SUIZA Paquete 400g,S/ 10.50 un,plaza_vea,HOT DOG,2024-12-05 14:52:09.431114,400.0,g,Hot Dog S. SUIZA Paquete,10.5,plaza_vea,Paquete 400g,,HOT DOG
Hot Dog S. SUIZA Paquete 400g,S/ 10.50,vivanda,HOT DOG,2024-12-05 21:45:02.380175,400.0,g,Hot Dog S. SUIZA Paquete,10.5,vivanda,,SALCHICHERÍA SUIZA,HOT DOG
Hot Dog Suiza 400g,S/ 10.50,wong,HOT DOG,2024-12-05 18:03:40.462080,400.0,g,Hot Dog Suiza,10.5,wong,,,HOT DOG
Hot Dog de Pollo Suiza Paquete 400 g,S/ 10.60,metro,HOT DOG,2024-12-05 15:34:33.175471,400.0,g,Hot Dog de Pollo Suiza Paquete,10.6,metro,,,HOT DOG
Hot Dog 400 g,S/ 10.80,tottus,HOT DOG,2024-12-05 11:34:40.326979,400.0,g,Hot Dog,10.8,tottus,,SAN FERNANDO,HOT DOG
Hot Dog SAN FERNANDO Paquete 400g,S/ 10.80,vivanda,HOT DOG,2024-12-05 21:45:02.380175,400.0,g,Hot Dog SAN FERNANDO Paquete,10.8,vivanda,,SAN FERNANDO,HOT DOG
Hot Dog SAN FERNANDO Paquete 400g,S/ 10.80 un,plaza_vea,HOT DOG,2024-12-05 14:52:09.431114,400.0,g,Hot Dog SAN FERNANDO Paquete,10.8,plaza_vea,Paquete 400g,,HOT DOG
Hot Dog Braedt Paquete 400 g,S/ 10.90,wong,HOT DOG,2024-12-05 18:03:40.462080,400.0,g,Hot Dog Braedt Paquete,10.9,wong,,,HOT DOG
Pack x3 Hot Dog Braedt 200g,S/ 10.96,metro,HOT DOG,2024-12-05 15:34:33.175471,200.0,g,Pack x3 Hot Dog Braedt,10.96,metro,,,HOT DOG
Pan para Hot Dog Bimbo Bolsa 8 unid,S/ 11.30,metro,HOT DOG,2024-12-05 15:34:33.175471,8.0,un,Pan para Hot Dog Bimbo Bolsa,11.3,metro,,,HOT DOG
Hot Dog de Pollo BRAEDT Paquete 500g,S/ 11.40 un,plaza_vea,HOT DOG,2024-12-05 14:52:09.431114,500.0,g,Hot Dog de Pollo BRAEDT Paquete,11.4,plaza_vea,Paquete 500g,,HOT DOG
Pan para Hot Dog Bimbo Bolsa 8 unid,S/ 11.50,wong,HOT DOG,2024-12-05 18:03:40.462080,8.0,un,Pan para Hot Dog Bimbo Bolsa,11.5,wong,,,HOT DOG
SALCHICHA FRANKFURTER PREMIUM X 235G,S/ 11.50,tottus,HOT DOG,2024-12-05 11:34:40.326979,235.0,g,SALCHICHA FRANKFURTER PREMIUM X,11.5,tottus,,TOTTUS,HOT DOG
Hot Dog La Segoviana Paquete 10 unid,S/ 12.30,metro,HOT DOG,2024-12-05 15:34:33.175471,10.0,un,Hot Dog La Segoviana Paquete,12.3,metro,,,HOT DOG
Hot Dog de Pollo Braedt Paquete 500 g,S/ 12.60,metro,HOT DOG,2024-12-05 15:34:33.175471,500.0,g,Hot Dog de Pollo Braedt Paquete,12.6,metro,,,HOT DOG
Pack Suiza: Hot Dog 400g + Hot Dog 200g,S/ 12.90,wong,HOT DOG,2024-12-05 18:03:40.462080,400.0,g,Pack Suiza: Hot Dog  + Hot Dog,12.9,wong,,,HOT DOG
Hot Dog de Pollo Braedt Paquete 500 g,S/ 12.90,wong,HOT DOG,2024-12-05 18:03:40.462080,500.0,g,Hot Dog de Pollo Braedt Paquete,12.9,wong,,,HOT DOG
Pack Suiza: Hot Dog 400g + Hot Dog 200g,S/ 12.90,metro,HOT DOG,2024-12-05 15:34:33.175471,400.0,g,Pack Suiza: Hot Dog  + Hot Dog,12.9,metro,,,HOT DOG
Hot Dog de 600 g,S/ 12.90,tottus,HOT DOG,2024-12-05 11:34:40.326979,600.0,g,Hot Dog de,12.9,tottus,,BRAEDT,HOT DOG
Hot Dog BELL'S Paquete 900g,S/ 12.99 un,plaza_vea,HOT DOG,2024-12-05 14:52:09.431114,900.0,g,Hot Dog BELL'S Paquete,12.99,plaza_vea,Paquete 900g,,HOT DOG
Pack Hot Dog San Fernando 220g + 440g,S/ 13.12,metro,HOT DOG,2024-12-05 15:34:33.175471,220.0,g,Pack Hot Dog San Fernando  +,13.12,metro,,,HOT DOG
Pack Hot Dog S. SUIZA Paquete 600g,S/ 13.49,vivanda,HOT DOG,2024-12-05 21:45:02.380175,600.0,g,Pack Hot Dog S. SUIZA Paquete,13.49,vivanda,,SALCHICHERÍA SUIZA,HOT DOG
Pack Hot Dog & Salchicha Vienesa Ahumada 500gr+250gr,S/ 13.50,tottus,HOT DOG,2024-12-05 11:34:40.326979,500.0,g,Pack Hot Dog & Salchicha Vienesa Ahumada r+r,13.5,tottus,,SALCHICHERIA ALEMANA,HOT DOG
Super Hot Dog San Fernando 1kg,S/ 13.51,metro,HOT DOG,2024-12-05 15:34:33.175471,1.0,kg,Super Hot Dog San Fernando,13.51,metro,,,HOT DOG
Hot Dog Salchipapero Naranja La Segoviana Paquete 920 g,S/ 13.70,metro,HOT DOG,2024-12-05 15:34:33.175471,920.0,g,Hot Dog Salchipapero Naranja La Segoviana Paquete,13.7,metro,,,HOT DOG
Pack Hot Dog Vienesa Salchichería Alemana: 500g + 250g,S/ 14.50,metro,HOT DOG,2024-12-05 15:34:33.175471,500.0,g,Pack Hot Dog Vienesa Salchichería Alemana:  +,14.5,metro,,,HOT DOG
Hot Dog SAN FERNANDO Paquete 600g,S/ 14.99,vivanda,HOT DOG,2024-12-05 21:45:02.380175,600.0,g,Hot Dog SAN FERNANDO Paquete,14.99,vivanda,,SAN FERNANDO,HOT DOG
Pack Hot Dog 600 g,S/ 15.40,tottus,HOT DOG,2024-12-05 11:34:40.326979,600.0,g,Pack Hot Dog,15.4,tottus,,SAN FERNANDO,HOT DOG
Hot Dog Ahumado Suiza 1kg,S/ 15.90,metro,HOT DOG,2024-12-05 15:34:33.175471,1.0,kg,Hot Dog Ahumado Suiza,15.9,metro,,,HOT DOG
Hot Dog Rico 24un.,S/ 15.90,metro,HOT DOG,2024-12-05 15:34:33.175471,24.0,un,Hot Dog Rico .,15.9,metro,,,HOT DOG
Pack Hot Dog La Segoviana Paquete 500 g + 250 g,S/ 15.99,metro,HOT DOG,2024-12-05 15:34:33.175471,500.0,g,Pack Hot Dog La Segoviana Paquete  +,15.99,metro,,,HOT DOG
Pack Hot Dog Vienesa SALCHICHERÍA ALEMANA Paquete 250g + 500g,S/ 15.99,vivanda,HOT DOG,2024-12-05 21:45:02.380175,250.0,g,Pack Hot Dog Vienesa SALCHICHERÍA ALEMANA Paquete  +,15.99,vivanda,,SALCHICHERÍA ALEMANA,HOT DOG
Pack Hot Dog Vienesa SALCHICHERÍA ALEMANA Paqu...,S/ 15.99 un,plaza_vea,HOT DOG,2024-12-05 14:52:09.431114,750.0,g,Pack Hot Dog Vienesa SALCHICHERÍA ALEMANA Paqu,15.99,plaza_vea,Paquete 750g,,HOT DOG
Hot Dog de Cerdo Zimmermann Paquete 500 g,S/ 16.66,wong,HOT DOG,2024-12-05 18:03:40.462080,500.0,g,Hot Dog de Cerdo Zimmermann Paquete,16.66,wong,,,HOT DOG
Combo: 4 Enrollados Hot Dog + Gaseosa Botella 1.5L,S/ 18.90,wong,HOT DOG,2024-12-05 18:03:40.462080,1.5,l,Combo: 4 Enrollados Hot Dog + Gaseosa Botella,18.9,wong,,,HOT DOG
Hot Dog de Pavo BRAEDT Balance Paquete 500g,S/ 18.90 un,plaza_vea,HOT DOG,2024-12-05 14:52:09.431114,500.0,g,Hot Dog de Pavo BRAEDT Balance Paquete,18.9,plaza_vea,Paquete 500g,,HOT DOG
Hot Dog de Pavo Braedt Balance Paquete 500 g,S/ 19.50,wong,HOT DOG,2024-12-05 18:03:40.462080,500.0,g,Hot Dog de Pavo Braedt Balance Paquete,19.5,wong,,,HOT DOG
Hot Dog de Cerdo Zimmermann Paquete 500 g,S/ 19.80,metro,HOT DOG,2024-12-05 15:34:33.175471,500.0,g,Hot Dog de Cerdo Zimmermann Paquete,19.8,metro,,,HOT DOG
Hot Dog Ahumado Suiza 1kg,S/ 23.30,wong,HOT DOG,2024-12-05 18:03:40.462080,1.0,kg,Hot Dog Ahumado Suiza,23.3,wong,,,HOT DOG
Comida para perros DOGCHOW Adultos Razas Medianas y Grandes Bolsa 8kg,S/ 88.50 11%,vega,HOT DOG,2024-12-05 12:07:26.982545,8.0,kg,Comida para perros DOGCHOW Adultos Razas Medianas y Grandes Bolsa,88.5,vega,,Dog Chow,HOT DOG
Comida para Perros DOG CHOW Adultos Razas Medianas y Grandes Bolsa 15Kg,S/ 149.50 0%,vega,HOT DOG,2024-12-05 12:07:26.982545,15.0,kg,Comida para Perros DOG CHOW Adultos Razas Medianas y Grandes Bolsa,149.5,vega,,Dog Chow,HOT DOG
Comida para Perros DOG CHOW Adultos Razas Medianas y Grandes Bolsa 8Kg x 3u,S/ 284.40,vega,HOT DOG,2024-12-05 12:07:26.982545,8.0,kg,Comida para Perros DOG CHOW Adultos Razas Medianas y Grandes Bolsa  x 3u,284.4,vega,,Dog Chow,HOT DOG
