description,price,website,search_term,scrape_timestamp,cantidad,unidad,description_no_unit,price_numeric,WEB,unit,brand,CLASIFICACION
Caigua x un,S/ 0.59,metro,MARGARINA ENVASADA,2024-12-05 15:52:34.363186,1.0,un,Caigua,0.59,metro,,,MARGARINA ENVASADA
Poro x un,S/ 1.49,metro,MARGARINA ENVASADA,2024-12-05 15:52:34.363186,1.0,un,Poro,1.49,metro,,,MARGARINA ENVASADA
"Bebida De Naranja, Mandarina y Limón Citrus Punch Tampico Botella 500 ml",S/ 1.70,metro,MARGARINA ENVASADA,2024-12-05 15:52:34.363186,500.0,ml,"Bebida De Naranja, Mandarina y Limón Citrus Punch Tampico Botella",1.7,metro,,,MARGARINA ENVASADA
Zapallo Macre x kg,S/ 1.99 x kg,metro,MARGARINA ENVASADA,2024-12-05 15:52:34.363186,1.0,kg,Zapallo Macre,1.99,metro,,,MARGARINA ENVASADA
Bebida Rehidratante GATORADE Mandarina Botella...,S/ 2 un,plaza_vea,MARGARINA ENVASADA,2024-12-05 15:10:58.273034,500.0,ml,Bebida Rehidratante GATORADE Mandarina Botella,2.0,plaza_vea,Botella 500ml,,MARGARINA ENVASADA
Bebida Rehidratante SPORADE Mandarina Botella 500ml,S/ 2.00,vega,MARGARINA ENVASADA,2024-12-05 12:30:06.852302,500.0,ml,Bebida Rehidratante SPORADE Mandarina Botella,2.0,vega,,Sporade,MARGARINA ENVASADA
Bebida en Polvo Clight Sin Calorías Sabor Mandarina 14g,S/ 2.30,metro,MARGARINA ENVASADA,2024-12-05 15:52:34.363186,14.0,g,Bebida en Polvo Clight Sin Calorías Sabor Mandarina,2.3,metro,,,MARGARINA ENVASADA
Margarina Manty Pote 90 g,S/ 2.38,metro,MARGARINA ENVASADA,2024-12-05 15:52:34.363186,90.0,g,Margarina Manty Pote,2.38,metro,,,MARGARINA ENVASADA
Bebida Rehidratante Gatorade Mandarina Botella 500ml,S/ 2.40,metro,MARGARINA ENVASADA,2024-12-05 15:52:34.363186,500.0,ml,Bebida Rehidratante Gatorade Mandarina Botella,2.4,metro,,,MARGARINA ENVASADA
Bebida Rehidratante SPORADE Mandarina Botella 500ml,S/ 2.40,vivanda,MARGARINA ENVASADA,2024-12-05 21:58:18.644221,500.0,ml,Bebida Rehidratante SPORADE Mandarina Botella,2.4,vivanda,,SPORADE,MARGARINA ENVASADA
Bebida Rehidratante SPORADE Mandarina Botella ...,S/ 2.40 un,plaza_vea,MARGARINA ENVASADA,2024-12-05 15:10:58.273034,500.0,ml,Bebida Rehidratante SPORADE Mandarina Botella,2.4,plaza_vea,Botella 500ml,,MARGARINA ENVASADA
Zapallito Italiano x un,S/ 2.79,metro,MARGARINA ENVASADA,2024-12-05 15:52:34.363186,1.0,un,Zapallito Italiano,2.79,metro,,,MARGARINA ENVASADA
Margarina MANTY Pote 90g,S/ 2.80,vivanda,MARGARINA ENVASADA,2024-12-05 21:58:18.644221,90.0,g,Margarina MANTY Pote,2.8,vivanda,,MANTY,MARGARINA ENVASADA
Margarina MANTY Pote 90g,S/ 2.80 un,plaza_vea,MARGARINA ENVASADA,2024-12-05 15:10:58.273034,90.0,g,Margarina MANTY Pote,2.8,plaza_vea,Pote 90g,,MARGARINA ENVASADA
Margarina MANTY Pote 90g,S/ 2.80,vega,MARGARINA ENVASADA,2024-12-05 12:30:06.852302,90.0,g,Margarina MANTY Pote,2.8,vega,,Manty,MARGARINA ENVASADA
Pepinillo x un,S/ 2.80,metro,MARGARINA ENVASADA,2024-12-05 15:52:34.363186,1.0,un,Pepinillo,2.8,metro,,,MARGARINA ENVASADA
Ají Pollero Adelmi 100g,S/ 2.90,metro,MARGARINA ENVASADA,2024-12-05 15:52:34.363186,100.0,g,Ají Pollero Adelmi,2.9,metro,,,MARGARINA ENVASADA
Bebida Rehidratante GATORADE Mandarina Botella 500ml,S/ 2.90,vivanda,MARGARINA ENVASADA,2024-12-05 21:58:18.644221,500.0,ml,Bebida Rehidratante GATORADE Mandarina Botella,2.9,vivanda,,GATORADE,MARGARINA ENVASADA
Margarina SELLO DE ORO Barra 90g,S/ 2.90 un,plaza_vea,MARGARINA ENVASADA,2024-12-05 15:10:58.273034,90.0,g,Margarina SELLO DE ORO Barra,2.9,plaza_vea,Barra 90g,,MARGARINA ENVASADA
Margarina Sello de Oro Barra 90g,S/ 2.90,metro,MARGARINA ENVASADA,2024-12-05 15:52:34.363186,90.0,g,Margarina Sello de Oro Barra,2.9,metro,,,MARGARINA ENVASADA
Tornillo Especial MOLITALIA Pasta para Ensalada Bolsa 235g,S/ 3.10,vivanda,MARGARINA ENVASADA,2024-12-05 21:58:18.644221,235.0,g,Tornillo Especial MOLITALIA Pasta para Ensalada Bolsa,3.1,vivanda,,MOLITALIA,MARGARINA ENVASADA
Palitos con Ajonjolí y Linaza Unión 65 g,S/ 3.10,tottus,MARGARINA ENVASADA,2024-12-05 11:52:58.238326,65.0,g,Palitos con Ajonjolí y Linaza Unión,3.1,tottus,,UNION,MARGARINA ENVASADA
Nabo x kg,S/ 3.19 x kg,metro,MARGARINA ENVASADA,2024-12-05 15:52:34.363186,1.0,kg,Nabo,3.19,metro,,,MARGARINA ENVASADA
Margarina esparcible 90 g,S/ 3.20,tottus,MARGARINA ENVASADA,2024-12-05 11:52:58.238326,90.0,g,Margarina esparcible,3.2,tottus,,SELLO DE ORO,MARGARINA ENVASADA
MARGARINA SWIS BARRA X 90 GR,S/ 3.30,tottus,MARGARINA ENVASADA,2024-12-05 11:52:58.238326,90.0,g,MARGARINA SWIS BARRA X R,3.3,tottus,,LAIVE,MARGARINA ENVASADA
Bebida Rehidratante GATORADE Sabor a Mandarina...,S/ 3.30 un,plaza_vea,MARGARINA ENVASADA,2024-12-05 15:10:58.273034,750.0,ml,Bebida Rehidratante GATORADE Sabor a Mandarina,3.3,plaza_vea,Botella 750ml,,MARGARINA ENVASADA
Pasta para Ensalada Molitalia Tornillo Especial 235g,S/ 3.40,metro,MARGARINA ENVASADA,2024-12-05 15:52:34.363186,235.0,g,Pasta para Ensalada Molitalia Tornillo Especial,3.4,metro,,,MARGARINA ENVASADA
Margarina LAIVE Swis Barra 90g,S/ 3.50 un,plaza_vea,MARGARINA ENVASADA,2024-12-05 15:10:58.273034,90.0,g,Margarina LAIVE Swis Barra,3.5,plaza_vea,Barra 90g,,MARGARINA ENVASADA
Hojuelas al ajo 50 gr,S/ 3.60,tottus,MARGARINA ENVASADA,2024-12-05 11:52:58.238326,50.0,g,Hojuelas al ajo r,3.6,tottus,,EL CEDRO,MARGARINA ENVASADA
Mantequilla con Sal Gloria 50g,S/ 3.70,metro,MARGARINA ENVASADA,2024-12-05 15:52:34.363186,50.0,g,Mantequilla con Sal Gloria,3.7,metro,,,MARGARINA ENVASADA
Margarina LAIVE Swis Barra 90g,S/ 3.80,vivanda,MARGARINA ENVASADA,2024-12-05 21:58:18.644221,90.0,g,Margarina LAIVE Swis Barra,3.8,vivanda,,LAIVE,MARGARINA ENVASADA
Margarina LA DANESA Pote 190g,S/ 3.80 un,plaza_vea,MARGARINA ENVASADA,2024-12-05 15:10:58.273034,190.0,g,Margarina LA DANESA Pote,3.8,plaza_vea,Pote 190g,,MARGARINA ENVASADA
Rabanito La Caserita 500g,S/ 3.90,metro,MARGARINA ENVASADA,2024-12-05 15:52:34.363186,500.0,g,Rabanito La Caserita,3.9,metro,,,MARGARINA ENVASADA
Ají De La Casa Metro 100g,S/ 3.90,metro,MARGARINA ENVASADA,2024-12-05 15:52:34.363186,100.0,g,Ají De La Casa Metro,3.9,metro,,,MARGARINA ENVASADA
Ensalada Rusa LA FLORENCIA Bandeja 170g,S/ 3.90,vivanda,MARGARINA ENVASADA,2024-12-05 21:58:18.644221,170.0,g,Ensalada Rusa LA FLORENCIA Bandeja,3.9,vivanda,,LA FLORENCIA,MARGARINA ENVASADA
Margarina BELL'S Pote 240g,S/ 3.90 un,plaza_vea,MARGARINA ENVASADA,2024-12-05 15:10:58.273034,240.0,g,Margarina BELL'S Pote,3.9,plaza_vea,Pote 240g,,MARGARINA ENVASADA
Margarina BELL'S Pote 240g,S/ 3.90,vivanda,MARGARINA ENVASADA,2024-12-05 21:58:18.644221,240.0,g,Margarina BELL'S Pote,3.9,vivanda,,BELL'S,MARGARINA ENVASADA
Ensalada Rusa LA FLORENCIA Bandeja 170g,S/ 3.90 un,plaza_vea,MARGARINA ENVASADA,2024-12-05 15:10:58.273034,180.0,g,Ensalada Rusa LA FLORENCIA Bandeja,3.9,plaza_vea,Bandeja 180g,,MARGARINA ENVASADA
Mix Hierbas Ensalada 4 ESTACIONES Sobre 5g,S/ 3.99 un,plaza_vea,MARGARINA ENVASADA,2024-12-05 15:10:58.273034,5.0,g,Mix Hierbas Ensalada 4 ESTACIONES Sobre,3.99,plaza_vea,Sobre 5g,,MARGARINA ENVASADA
Mix Hierbas Ensalada 4 ESTACIONES Sobre 5g,S/ 3.99,vivanda,MARGARINA ENVASADA,2024-12-05 21:58:18.644221,5.0,g,Mix Hierbas Ensalada 4 ESTACIONES Sobre,3.99,vivanda,,4ESTACIONES,MARGARINA ENVASADA
Pan Arabe Blanco 5 Unidades,S/ 4,tottus,MARGARINA ENVASADA,2024-12-05 11:52:58.238326,5.0,un,Pan Arabe Blanco ades,4.0,tottus,,EL CEDRO,MARGARINA ENVASADA
Pan Árabe con Salvado de Trigo 5 Unidades,S/ 4,tottus,MARGARINA ENVASADA,2024-12-05 11:52:58.238326,5.0,un,Pan Árabe con Salvado de Trigo ades,4.0,tottus,,EL CEDRO,MARGARINA ENVASADA
"Bebida De Naranja, Mandarina y Limón Citrus Punch Tampico Botella 1.5 lt",S/ 4.00,metro,MARGARINA ENVASADA,2024-12-05 15:52:34.363186,1.5,l,"Bebida De Naranja, Mandarina y Limón Citrus Punch Tampico Botella",4.0,metro,,,MARGARINA ENVASADA
Salvia 4 ESTACIONES Ensalada Sobre 5g,S/ 4.10,vivanda,MARGARINA ENVASADA,2024-12-05 21:58:18.644221,5.0,g,Salvia 4 ESTACIONES Ensalada Sobre,4.1,vivanda,,4ESTACIONES,MARGARINA ENVASADA
Salvia 4 ESTACIONES Ensalada Sobre 5g,S/ 4.10 un,plaza_vea,MARGARINA ENVASADA,2024-12-05 15:10:58.273034,5.0,g,Salvia 4 ESTACIONES Ensalada Sobre,4.1,plaza_vea,Sobre 5g,,MARGARINA ENVASADA
Margarina SELLO DE ORO Barra 200g,S/ 4.30 un,plaza_vea,MARGARINA ENVASADA,2024-12-05 15:10:58.273034,200.0,g,Margarina SELLO DE ORO Barra,4.3,plaza_vea,Barra 200g,,MARGARINA ENVASADA
Margarina Sello de Oro Barra 200g,S/ 4.30,metro,MARGARINA ENVASADA,2024-12-05 15:52:34.363186,200.0,g,Margarina Sello de Oro Barra,4.3,metro,,,MARGARINA ENVASADA
Poro Fitz x unid,S/ 4.39,metro,MARGARINA ENVASADA,2024-12-05 15:52:34.363186,1.0,un,Poro Fitz,4.39,metro,,,MARGARINA ENVASADA
Pan Petipan 600 g,S/ 4.40,tottus,MARGARINA ENVASADA,2024-12-05 11:52:58.238326,600.0,g,Pan Petipan,4.4,tottus,,TOTTUS,MARGARINA ENVASADA
Berengena Hidropónica Ecológica x Unidad,S/ 4.40,metro,MARGARINA ENVASADA,2024-12-05 15:52:34.363186,1.0,un,Berengena Hidropónica Ecológica ad,4.4,metro,,,MARGARINA ENVASADA
Margarina 200 g,S/ 4.40,tottus,MARGARINA ENVASADA,2024-12-05 11:52:58.238326,200.0,g,Margarina,4.4,tottus,,SELLO DE ORO,MARGARINA ENVASADA
Margarina Manty Clásica 300g,S/ 4.40,metro,MARGARINA ENVASADA,2024-12-05 15:52:34.363186,300.0,g,Margarina Manty Clásica,4.4,metro,,,MARGARINA ENVASADA
Galletas SAYON Margarita Bolsa 43g,S/ 4.40 un,plaza_vea,MARGARINA ENVASADA,2024-12-05 15:10:58.273034,258.0,g,Galletas SAYON Margarita Bolsa,4.4,plaza_vea,Bolsa 258g,,MARGARINA ENVASADA
Bebida de Piña y Mandarina Frugos del Valle Caja 1L,S/ 4.50,metro,MARGARINA ENVASADA,2024-12-05 15:52:34.363186,1.0,l,Bebida de Piña y Mandarina Frugos del Valle Caja,4.5,metro,,,MARGARINA ENVASADA
Ensalada Rusa Green Food 400g,S/ 4.50,metro,MARGARINA ENVASADA,2024-12-05 15:52:34.363186,400.0,g,Ensalada Rusa Green Food,4.5,metro,,,MARGARINA ENVASADA
Pan Francés Precocido Don Mamino 5 Unidades,S/ 4.50,tottus,MARGARINA ENVASADA,2024-12-05 11:52:58.238326,5.0,un,Pan Francés Precocido Don Mamino ades,4.5,tottus,,DGNOTTAS,MARGARINA ENVASADA
Marshmallows COLOMBINA Millows Margarita Bolsa 145gr,S/ 4.50,vega,MARGARINA ENVASADA,2024-12-05 12:30:06.852302,145.0,g,Marshmallows COLOMBINA Millows Margarita Bolsa r,4.5,vega,,Colombina,MARGARINA ENVASADA
Crema a Base de Mantequilla Laive 90g,S/ 4.60,metro,MARGARINA ENVASADA,2024-12-05 15:52:34.363186,90.0,g,Crema a Base de Mantequilla Laive,4.6,metro,,,MARGARINA ENVASADA
Ensalada Col Zanahoria BELL'S FRESCOS Bolsa 25...,S/ 4.69 un,plaza_vea,MARGARINA ENVASADA,2024-12-05 15:10:58.273034,250.0,g,Ensalada Col Zanahoria BELL'S FRESCOS Bolsa 25,4.69,plaza_vea,Bolsa 250gun,,MARGARINA ENVASADA
Ensalada Col Zanahoria BELL'S FRESCOS Bolsa 250g,S/ 4.69,vivanda,MARGARINA ENVASADA,2024-12-05 21:58:18.644221,250.0,g,Ensalada Col Zanahoria BELL'S FRESCOS Bolsa,4.69,vivanda,,BELL'S FRESCOS,MARGARINA ENVASADA
Margarina LAIVE Swis Barra 200g,S/ 4.80 un,plaza_vea,MARGARINA ENVASADA,2024-12-05 15:10:58.273034,200.0,g,Margarina LAIVE Swis Barra,4.8,plaza_vea,Barra 200g,,MARGARINA ENVASADA
Margarina LAIVE Swis Barra 200g,S/ 4.80,vivanda,MARGARINA ENVASADA,2024-12-05 21:58:18.644221,200.0,g,Margarina LAIVE Swis Barra,4.8,vivanda,,LAIVE,MARGARINA ENVASADA
Margarina Laive Swis 200g,S/ 4.80,metro,MARGARINA ENVASADA,2024-12-05 15:52:34.363186,200.0,g,Margarina Laive Swis,4.8,metro,,,MARGARINA ENVASADA
Marshmallow COLOMBINA Millows sabores Frutado ...,S/ 4.90 un,plaza_vea,MARGARINA ENVASADA,2024-12-05 15:10:58.273034,145.0,g,Marshmallow COLOMBINA Millows sabores Frutado,4.9,plaza_vea,Bolsa 145g,,MARGARINA ENVASADA
Bebida Rehidratante GATORADE Sabor a Mandarina Botella 750ml,S/ 4.90,vivanda,MARGARINA ENVASADA,2024-12-05 21:58:18.644221,750.0,ml,Bebida Rehidratante GATORADE Sabor a Mandarina Botella,4.9,vivanda,,GATORADE,MARGARINA ENVASADA
Tripack Bebida Instantánea Clight Sin Calorías Sabor Mandarina 14g,S/ 5.00,metro,MARGARINA ENVASADA,2024-12-05 15:52:34.363186,14.0,g,Tripack Bebida Instantánea Clight Sin Calorías Sabor Mandarina,5.0,metro,,,MARGARINA ENVASADA
Margarina SELLO DE ORO 0% Grasas Trans Pote 20...,S/ 5.20 un,plaza_vea,MARGARINA ENVASADA,2024-12-05 15:10:58.273034,200.0,g,Margarina SELLO DE ORO 0% Grasas Trans Pote 20,5.2,plaza_vea,Pote 200g,,MARGARINA ENVASADA
Galletas SAYON Margarita Paquete 6u 43g.,S/ 5.20,vega,MARGARINA ENVASADA,2024-12-05 12:30:06.852302,43.0,g,Galletas SAYON Margarita Paquete 6u .,5.2,vega,,Sayon,MARGARINA ENVASADA
Pan De La Casa Blanco 350 g,S/ 5.20,tottus,MARGARINA ENVASADA,2024-12-05 11:52:58.238326,350.0,g,Pan De La Casa Blanco,5.2,tottus,,TOTTUS,MARGARINA ENVASADA
Margarina SELLO DE ORO Pote 200gr,S/ 5.20 10%,vega,MARGARINA ENVASADA,2024-12-05 12:30:06.852302,200.0,g,Margarina SELLO DE ORO Pote r,5.2,vega,,Sello De Oro,MARGARINA ENVASADA
Sixpack Galletas Margarita 46.5g,S/ 5.20,metro,MARGARINA ENVASADA,2024-12-05 15:52:34.363186,46.5,g,Sixpack Galletas Margarita,5.2,metro,,,MARGARINA ENVASADA
Pan De La Casa Integral 350 g,S/ 5.20,tottus,MARGARINA ENVASADA,2024-12-05 11:52:58.238326,350.0,g,Pan De La Casa Integral,5.2,tottus,,TOTTUS,MARGARINA ENVASADA
Pan Árabe Sash 200 g,S/ 5.30,tottus,MARGARINA ENVASADA,2024-12-05 11:52:58.238326,200.0,g,Pan Árabe Sash,5.3,tottus,,EL CEDRO,MARGARINA ENVASADA
Pan Árabe Sash con Salvado de Trigo 200 g,S/ 5.30,tottus,MARGARINA ENVASADA,2024-12-05 11:52:58.238326,200.0,g,Pan Árabe Sash con Salvado de Trigo,5.3,tottus,,EL CEDRO,MARGARINA ENVASADA
Ensalada Mix Personal BELL'S FRESCOS Bolsa 100g,S/ 5.49,vivanda,MARGARINA ENVASADA,2024-12-05 21:58:18.644221,100.0,g,Ensalada Mix Personal BELL'S FRESCOS Bolsa,5.49,vivanda,,BELL'S FRESCOS,MARGARINA ENVASADA
Ensalada Mix Personal BELL'S FRESCOS Envase 10...,S/ 5.49 un,plaza_vea,MARGARINA ENVASADA,2024-12-05 15:10:58.273034,100.0,g,Ensalada Mix Personal BELL'S FRESCOS Envase 10,5.49,plaza_vea,Envase 100gun,,MARGARINA ENVASADA
Yogurt Bebible Oquendo Sabor Mandarina - Maracuyá Bolsa 946ml,S/ 5.50,metro,MARGARINA ENVASADA,2024-12-05 15:52:34.363186,946.0,ml,Yogurt Bebible Oquendo Sabor Mandarina - Maracuyá Bolsa,5.5,metro,,,MARGARINA ENVASADA
Ensalada Jardinera BELL'S Bolsa 500g,S/ 5.50 un,plaza_vea,MARGARINA ENVASADA,2024-12-05 15:10:58.273034,500.0,g,Ensalada Jardinera BELL'S Bolsa,5.5,plaza_vea,Pack 500g,,MARGARINA ENVASADA
Margarina MANTY Clásica Pote 300gr,S/ 5.50 8%,vega,MARGARINA ENVASADA,2024-12-05 12:30:06.852302,300.0,g,Margarina MANTY Clásica Pote r,5.5,vega,,Manty,MARGARINA ENVASADA
Margarina MANTY Clásica Pote 300g,S/ 5.50 un,plaza_vea,MARGARINA ENVASADA,2024-12-05 15:10:58.273034,300.0,g,Margarina MANTY Clásica Pote,5.5,plaza_vea,Pote 300g,,MARGARINA ENVASADA
"Ensalada de Piña, Sandía y Papaya BELL'S Bande...",S/ 5.69 un,plaza_vea,MARGARINA ENVASADA,2024-12-05 15:10:58.273034,300.0,g,"Ensalada de Piña, Sandía y Papaya BELL'S Bande",5.69,plaza_vea,Bandeja 300g,,MARGARINA ENVASADA
Mandarina Costa x kg,S/ 5.69 x kg,metro,MARGARINA ENVASADA,2024-12-05 15:52:34.363186,1.0,kg,Mandarina Costa,5.69,metro,,,MARGARINA ENVASADA
"Ensalada de Papaya, Sandía y Melón BELL'S Band...",S/ 5.69 un,plaza_vea,MARGARINA ENVASADA,2024-12-05 15:10:58.273034,300.0,g,"Ensalada de Papaya, Sandía y Melón BELL'S Band",5.69,plaza_vea,Bandeja 300g,,MARGARINA ENVASADA
Mandarina Malvacea,S/ 5.70 x kg,plaza_vea,MARGARINA ENVASADA,2024-12-05 15:10:58.273034,1.0,kg,Mandarina Malvacea,5.7,plaza_vea,Presentación 1 kg aprox.,,MARGARINA ENVASADA
Alcachofa con Espinas x unid,S/ 5.99,metro,MARGARINA ENVASADA,2024-12-05 15:52:34.363186,1.0,un,Alcachofa con Espinas,5.99,metro,,,MARGARINA ENVASADA
"Ensalada de Uva, Sandía y Piña BELL'S Bandeja ...",S/ 5.99 un,plaza_vea,MARGARINA ENVASADA,2024-12-05 15:10:58.273034,300.0,g,"Ensalada de Uva, Sandía y Piña BELL'S Bandeja",5.99,plaza_vea,Bandeja 300g,,MARGARINA ENVASADA
Alcachofa con Espinas Metro x unid,S/ 5.99,metro,MARGARINA ENVASADA,2024-12-05 15:52:34.363186,1.0,un,Alcachofa con Espinas Metro,5.99,metro,,,MARGARINA ENVASADA
Coliflor Serrano 600g,S/ 6.00,metro,MARGARINA ENVASADA,2024-12-05 15:52:34.363186,600.0,g,Coliflor Serrano,6.0,metro,,,MARGARINA ENVASADA
Rehidratante ELECTROLIFE Sabor a Naranja y Man...,S/ 6 un,plaza_vea,MARGARINA ENVASADA,2024-12-05 15:10:58.273034,625.0,ml,Rehidratante ELECTROLIFE Sabor a Naranja y Man,6.0,plaza_vea,Botella 625ml,,MARGARINA ENVASADA
Mixtura Ensalada Green Food 400g,S/ 6.00,metro,MARGARINA ENVASADA,2024-12-05 15:52:34.363186,400.0,g,Mixtura Ensalada Green Food,6.0,metro,,,MARGARINA ENVASADA
Pan Pita Integral 10 unidades,S/ 6,tottus,MARGARINA ENVASADA,2024-12-05 11:52:58.238326,10.0,un,Pan Pita Integral ades,6.0,tottus,,BIMBO,MARGARINA ENVASADA
Leche Zero Lacto Uht 1 L,S/ 6.20,tottus,MARGARINA ENVASADA,2024-12-05 11:52:58.238326,1.0,l,Leche Zero Lacto Uht,6.2,tottus,,GLORIA,MARGARINA ENVASADA
Apio Hipodrónico Ecologic x un,S/ 6.30,metro,MARGARINA ENVASADA,2024-12-05 15:52:34.363186,1.0,un,Apio Hipodrónico Ecologic,6.3,metro,,,MARGARINA ENVASADA
Mantequilla con Sal Gloria 90g,S/ 6.40,metro,MARGARINA ENVASADA,2024-12-05 15:52:34.363186,90.0,g,Mantequilla con Sal Gloria,6.4,metro,,,MARGARINA ENVASADA
Ensalada Rusa BELL'S Bolsa 500g,S/ 6.49,vivanda,MARGARINA ENVASADA,2024-12-05 21:58:18.644221,500.0,g,Ensalada Rusa BELL'S Bolsa,6.49,vivanda,,BELL'S,MARGARINA ENVASADA
Bebida Rehidratante SUEROX Sabor a Mandarina Botella 630ml,S/ 6.50,vega,MARGARINA ENVASADA,2024-12-05 12:30:06.852302,630.0,ml,Bebida Rehidratante SUEROX Sabor a Mandarina Botella,6.5,vega,,SUEROX,MARGARINA ENVASADA
Bebida Rehidrantante SUEROX Naranja y Mandarin...,S/ 6.50 un,plaza_vea,MARGARINA ENVASADA,2024-12-05 15:10:58.273034,630.0,ml,Bebida Rehidrantante SUEROX Naranja y Mandarin,6.5,plaza_vea,Botella 630ml,,MARGARINA ENVASADA
Croutones 60 g,S/ 6.50,tottus,MARGARINA ENVASADA,2024-12-05 11:52:58.238326,60.0,g,Croutones,6.5,tottus,,DON MAMINO,MARGARINA ENVASADA
Bebida Rehidrantante SUEROX Naranja y Mandarina Botella 630ml,S/ 6.50,vivanda,MARGARINA ENVASADA,2024-12-05 21:58:18.644221,630.0,ml,Bebida Rehidrantante SUEROX Naranja y Mandarina Botella,6.5,vivanda,,SUEROX,MARGARINA ENVASADA
Ensalada Mix BELL'S FRESCOS Bolsa 150g,S/ 6.59 un,plaza_vea,MARGARINA ENVASADA,2024-12-05 15:10:58.273034,150.0,g,Ensalada Mix BELL'S FRESCOS Bolsa,6.59,plaza_vea,Bolsa 150gun,,MARGARINA ENVASADA
Ensalada Mix BELL'S FRESCOS Bolsa 150g,S/ 6.59,vivanda,MARGARINA ENVASADA,2024-12-05 21:58:18.644221,150.0,g,Ensalada Mix BELL'S FRESCOS Bolsa,6.59,vivanda,,BELL'S FRESCOS,MARGARINA ENVASADA
Ensalada SOLEI Coco en Trozos Frasco 130g,S/ 6.79,vivanda,MARGARINA ENVASADA,2024-12-05 21:58:18.644221,130.0,g,Ensalada SOLEI Coco en Trozos Frasco,6.79,vivanda,,SOLEI,MARGARINA ENVASADA
PAN PITA INTEGRAL CERO CERO X300GR,S/ 6.80,tottus,MARGARINA ENVASADA,2024-12-05 11:52:58.238326,300.0,g,PAN PITA INTEGRAL CERO CERO XR,6.8,tottus,,BIMBO,MARGARINA ENVASADA
Mermelada de Mandarina COMPASS Frasco 240g,S/ 6.90 un,plaza_vea,MARGARINA ENVASADA,2024-12-05 15:10:58.273034,240.0,g,Mermelada de Mandarina COMPASS Frasco,6.9,plaza_vea,Frasco 240g,,MARGARINA ENVASADA
Margarina Clásica DORINA Pote 220g,S/ 6.90 un,plaza_vea,MARGARINA ENVASADA,2024-12-05 15:10:58.273034,220.0,g,Margarina Clásica DORINA Pote,6.9,plaza_vea,Pote 220g,,MARGARINA ENVASADA
Semi Baguette Dulce 420 g,S/ 6.90,tottus,MARGARINA ENVASADA,2024-12-05 11:52:58.238326,420.0,g,Semi Baguette Dulce,6.9,tottus,,TOTTUS,MARGARINA ENVASADA
Margarina Light DORINA Pote 220g,S/ 6.90 un,plaza_vea,MARGARINA ENVASADA,2024-12-05 15:10:58.273034,220.0,g,Margarina Light DORINA Pote,6.9,plaza_vea,Pote 220g,,MARGARINA ENVASADA
Margarina Light DORINA Pote 220g,S/ 6.90,vivanda,MARGARINA ENVASADA,2024-12-05 21:58:18.644221,220.0,g,Margarina Light DORINA Pote,6.9,vivanda,,DORINA,MARGARINA ENVASADA
Semi Baguette Multi Semillas 3 Unidades,S/ 6.90,tottus,MARGARINA ENVASADA,2024-12-05 11:52:58.238326,3.0,un,Semi Baguette Multi Semillas ades,6.9,tottus,,TOTTUS,MARGARINA ENVASADA
Ensalada Americana BELL'S FRESCOS Bolsa 500g,S/ 6.99,vivanda,MARGARINA ENVASADA,2024-12-05 21:58:18.644221,500.0,g,Ensalada Americana BELL'S FRESCOS Bolsa,6.99,vivanda,,BELL'S FRESCOS,MARGARINA ENVASADA
Ensalada Americana BELL'S FRESCOS Bolsa 500g,S/ 6.99 un,plaza_vea,MARGARINA ENVASADA,2024-12-05 15:10:58.273034,500.0,g,Ensalada Americana BELL'S FRESCOS Bolsa,6.99,plaza_vea,Bolsa 500gun,,MARGARINA ENVASADA
"Bebida De Naranja, Mandarina y Limón Citrus Punch Tampico Botella 1.87 lt",S/ 7.10,metro,MARGARINA ENVASADA,2024-12-05 15:52:34.363186,1.87,l,"Bebida De Naranja, Mandarina y Limón Citrus Punch Tampico Botella",7.1,metro,,,MARGARINA ENVASADA
Pan Árabe Blanco 10 Unidades,S/ 7.40,tottus,MARGARINA ENVASADA,2024-12-05 11:52:58.238326,10.0,un,Pan Árabe Blanco ades,7.4,tottus,,EL CEDRO,MARGARINA ENVASADA
Pan Árabe Integral 10 Unidades,S/ 7.40,tottus,MARGARINA ENVASADA,2024-12-05 11:52:58.238326,10.0,un,Pan Árabe Integral ades,7.4,tottus,,EL CEDRO,MARGARINA ENVASADA
Ensalada Mix La Itali BELL'S FRESCOS Envase 15...,S/ 7.49 un,plaza_vea,MARGARINA ENVASADA,2024-12-05 15:10:58.273034,150.0,g,Ensalada Mia Itali BELL'S FRESCOS Envase 15,7.49,plaza_vea,Envase 150gun,,MARGARINA ENVASADA
Ensalada Mix Primavera BELL'S FRESCOS Táper 15...,S/ 7.49 un,plaza_vea,MARGARINA ENVASADA,2024-12-05 15:10:58.273034,150.0,g,Ensalada Mix Primavera BELL'S FRESCOS Táper 15,7.49,plaza_vea,Táper 150gun,,MARGARINA ENVASADA
Floretes de Brócoli 500g aprox,S/ 7.49,metro,MARGARINA ENVASADA,2024-12-05 15:52:34.363186,500.0,g,Floretes de Brócoli  aprox,7.49,metro,,,MARGARINA ENVASADA
Ensalada Mix Primavera BELL'S FRESCOS Bolsa 150g,S/ 7.49,vivanda,MARGARINA ENVASADA,2024-12-05 21:58:18.644221,150.0,g,Ensalada Mix Primavera BELL'S FRESCOS Bolsa,7.49,vivanda,,BELL'S FRESCOS,MARGARINA ENVASADA
Margarina BELL'S Pote 490g,S/ 7.50 un,plaza_vea,MARGARINA ENVASADA,2024-12-05 15:10:58.273034,490.0,g,Margarina BELL'S Pote,7.5,plaza_vea,Pote 490g,,MARGARINA ENVASADA
PAN PITA BLANCO X 300G,S/ 7.50,tottus,MARGARINA ENVASADA,2024-12-05 11:52:58.238326,300.0,g,PAN PITA BLANCO X,7.5,tottus,,BIMBO,MARGARINA ENVASADA
PAN MOLDE BLANCO X 480 GR,S/ 7.60,tottus,MARGARINA ENVASADA,2024-12-05 11:52:58.238326,480.0,g,PAN MOLDE BLANCO X R,7.6,tottus,,TOTTUS,MARGARINA ENVASADA
Mantequilla con Sal Laive 100g,S/ 7.60,metro,MARGARINA ENVASADA,2024-12-05 15:52:34.363186,100.0,g,Mantequilla con Sal Laive,7.6,metro,,,MARGARINA ENVASADA
Ensalada Rusa Precocida GREEN FOOD Bolsa 400g,S/ 7.60 un,plaza_vea,MARGARINA ENVASADA,2024-12-05 15:10:58.273034,400.0,g,Ensalada Rusa Precocida GREEN FOOD Bolsa,7.6,plaza_vea,Bolsa 400g,,MARGARINA ENVASADA
Mix Hierbas Ensalada 4 ESTACIONES Pote 12g,S/ 7.70,vivanda,MARGARINA ENVASADA,2024-12-05 21:58:18.644221,12.0,g,Mix Hierbas Ensalada 4 ESTACIONES Pote,7.7,vivanda,,4ESTACIONES,MARGARINA ENVASADA
Mix Hierbas Ensalada 4 ESTACIONES Pote 12g,S/ 7.70 un,plaza_vea,MARGARINA ENVASADA,2024-12-05 15:10:58.273034,12.0,g,Mix Hierbas Ensalada 4 ESTACIONES Pote,7.7,plaza_vea,Pote 12g,,MARGARINA ENVASADA
Sixpack Bebida Frugos del Valle Piña Mandarina Caja 235ml,S/ 7.90,metro,MARGARINA ENVASADA,2024-12-05 15:52:34.363186,235.0,ml,Sixpack Bebida Frugos del Valle Piña Mandarina Caja,7.9,metro,,,MARGARINA ENVASADA
Mini Croissant 320 g,S/ 7.90,tottus,MARGARINA ENVASADA,2024-12-05 11:52:58.238326,320.0,g,Mini Croissant,7.9,tottus,,TOTTUS,MARGARINA ENVASADA
Pan De La Casa Centeno 350 g,S/ 7.90,tottus,MARGARINA ENVASADA,2024-12-05 11:52:58.238326,350.0,g,Pan De La Casa Centeno,7.9,tottus,,TOTTUS,MARGARINA ENVASADA
Pan de Yema Don Mamino 6 Unidades,S/ 7.90,tottus,MARGARINA ENVASADA,2024-12-05 11:52:58.238326,6.0,un,Pan de Yema Don Mamino ades,7.9,tottus,,DGNOTTAS,MARGARINA ENVASADA
Mini Francés 600 g,S/ 7.90,tottus,MARGARINA ENVASADA,2024-12-05 11:52:58.238326,600.0,g,Mini Francés,7.9,tottus,,TOTTUS,MARGARINA ENVASADA
Pan De La Casa Multigrano 350 g,S/ 7.90,tottus,MARGARINA ENVASADA,2024-12-05 11:52:58.238326,350.0,g,Pan De La Casa Multigrano,7.9,tottus,,TOTTUS,MARGARINA ENVASADA
Mini Ciabatta 600 g,S/ 7.90,tottus,MARGARINA ENVASADA,2024-12-05 11:52:58.238326,600.0,g,Mini Ciabatta,7.9,tottus,,TOTTUS,MARGARINA ENVASADA
Brócoli Metro x kg,S/ 7.99 x kg,metro,MARGARINA ENVASADA,2024-12-05 15:52:34.363186,1.0,kg,Brócoli Metro,7.99,metro,,,MARGARINA ENVASADA
Espárragos Atado 250g,S/ 7.99,metro,MARGARINA ENVASADA,2024-12-05 15:52:34.363186,250.0,g,Espárragos Atado,7.99,metro,,,MARGARINA ENVASADA
Agua Saborizada SAN PELLEGRINO Essenza Sabor a Mandarina y Fresa Lata 330ml,S/ 8.00,vivanda,MARGARINA ENVASADA,2024-12-05 21:58:18.644221,330.0,ml,Agua Saborizada SAN PELLEGRINO Essenza Sabor a Mandarina y Fresa Lata,8.0,vivanda,,SAN PELLEGRINO,MARGARINA ENVASADA
Margarina Clásica DORINA Pote 220g,S/ 8.10,vivanda,MARGARINA ENVASADA,2024-12-05 21:58:18.644221,220.0,g,Margarina Clásica DORINA Pote,8.1,vivanda,,DORINA,MARGARINA ENVASADA
Mix Ensalada Precocida Congelada GREEN FOOD Bo...,S/ 8.20 un,plaza_vea,MARGARINA ENVASADA,2024-12-05 15:10:58.273034,400.0,g,Mix Ensalada Precocida Congelada GREEN FOOD Bo,8.2,plaza_vea,Bolsa 400g,,MARGARINA ENVASADA
Mix Ensalada Precocida Congelada GREEN FOOD Bolsa 400g,S/ 8.20,vivanda,MARGARINA ENVASADA,2024-12-05 21:58:18.644221,400.0,g,Mix Ensalada Precocida Congelada GREEN FOOD Bolsa,8.2,vivanda,,GREEN FOOD,MARGARINA ENVASADA
Margarina SELLO DE ORO Pote 400gr,S/ 8.30 5%,vega,MARGARINA ENVASADA,2024-12-05 12:30:06.852302,400.0,g,Margarina SELLO DE ORO Pote r,8.3,vega,,Sello De Oro,MARGARINA ENVASADA
Ensalada Pollera Bandeja 300g,S/ 8.40,vivanda,MARGARINA ENVASADA,2024-12-05 21:58:18.644221,300.0,g,Ensalada Pollera Bandeja,8.4,vivanda,,VIVANDA,MARGARINA ENVASADA
Margarina Sello de Oro Pote 400g,S/ 8.40,metro,MARGARINA ENVASADA,2024-12-05 15:52:34.363186,400.0,g,Margarina Sello de Oro Pote,8.4,metro,,,MARGARINA ENVASADA
Vinagreta Ranch LUREN para Ensalada Frasco 454...,S/ 8.40 un,plaza_vea,MARGARINA ENVASADA,2024-12-05 15:10:58.273034,454.0,g,Vinagreta Ranch LUREN para Ensalada Frasco 454,8.4,plaza_vea,Frasco 454g,,MARGARINA ENVASADA
Zapallo Bebé Metro x kg,S/ 8.49 x kg,metro,MARGARINA ENVASADA,2024-12-05 15:52:34.363186,1.0,kg,Zapallo Bebé Metro,8.49,metro,,,MARGARINA ENVASADA
Verduras para Ensalada Mixta Don Verde 250g,S/ 8.50,metro,MARGARINA ENVASADA,2024-12-05 15:52:34.363186,250.0,g,Verduras para Ensalada Mixta Don Verde,8.5,metro,,,MARGARINA ENVASADA
