unit,description,price,website,search_term,scrape_timestamp,cantidad,unidad,description_no_unit,price_numeric,WEB,brand,CLASIFICACION
Bolsa 13g,Refresco UMSHA Chicha Morada Bolsa 13g,S/ 1 un,plaza_vea,MAÍZ SECO CANCHA,2024-12-05 14:25:48.107727,13.0,g,Refresco UMSHA Chicha Morada Bolsa,1.0,plaza_vea,,MAÍZ SECO CANCHA
Sobre 15g,Bebida Instantánea en Polvo ZUKO Sabores de mi...,S/ 1.20 un,plaza_vea,MAÍZ SECO CANCHA,2024-12-05 14:25:48.107727,15.0,g,Bebida Instantánea en Polvo ZUKO Sabores de mi,1.2,plaza_vea,,MAÍZ SECO CANCHA
Bolsa 20g,Refresco UMSHA Frutisimos Chicha Morada Bolsa ...,S/ 1.60 un,plaza_vea,MAÍZ SECO CANCHA,2024-12-05 14:25:48.107727,20.0,g,Refresco UMSHA Frutisimos Chicha Morada Bolsa,1.6,plaza_vea,,MAÍZ SECO CANCHA
Sobre 10g,Hongos secos BELL'S Sobre 10Gr,S/ 2 un,plaza_vea,MAÍZ SECO CANCHA,2024-12-05 14:25:48.107727,10.0,g,Hongos secos BELL'S Sobre r,2.0,plaza_vea,,MAÍZ SECO CANCHA
Sobre 10g,Canela en Polvo SIBARITA Sobre 10g,S/ 2.50 un,plaza_vea,MAÍZ SECO CANCHA,2024-12-05 14:25:48.107727,10.0,g,Canela en Polvo SIBARITA Sobre,2.5,plaza_vea,,MAÍZ SECO CANCHA
Tableta 90g,Chocolate para Taza SOL DEL CUSCO Canela y Cla...,S/ 2.70 un,plaza_vea,MAÍZ SECO CANCHA,2024-12-05 14:25:48.107727,90.0,g,Chocolate para Taza SOL DEL CUSCO Canela y Cla,2.7,plaza_vea,,MAÍZ SECO CANCHA
,Maíz Gigante Original Inka Corn 42g,S/ 2.80,wong,MAÍZ SECO CANCHA,2024-12-05 17:32:03.263789,42.0,g,Maíz Gigante Original Inka Corn,2.8,wong,,MAÍZ SECO CANCHA
,Hongo Seco Cuisine & Co 10g,S/ 2.90,wong,MAÍZ SECO CANCHA,2024-12-05 17:32:03.263789,10.0,g,Hongo Seco Cuisine & Co,2.9,wong,,MAÍZ SECO CANCHA
,Cancha Chulpi Salada Cuisine & Co Bolsa 100 g,S/ 3.12,wong,MAÍZ SECO CANCHA,2024-12-05 17:32:03.263789,100.0,g,Cancha Chulpi Salada Cuisine & Co Bolsa,3.12,wong,,MAÍZ SECO CANCHA
Caja 20un,Té Canela y Clavo BELL'S Caja 20un,S/ 3.20 un,plaza_vea,MAÍZ SECO CANCHA,2024-12-05 14:25:48.107727,20.0,un,Té Canela y Clavo BELL'S Caja,3.2,plaza_vea,,MAÍZ SECO CANCHA
Bolsa 150g,Tortilla de Maíz BELL'S Picante Bolsa 150g,S/ 3.30 un,plaza_vea,MAÍZ SECO CANCHA,2024-12-05 14:25:48.107727,150.0,g,Tortilla de Maíz BELL'S Picante Bolsa,3.3,plaza_vea,,MAÍZ SECO CANCHA
Bolsa 150g,Piqueo BELL'S Tortilla de maíz natural Bolsa 1...,S/ 3.30 un,plaza_vea,MAÍZ SECO CANCHA,2024-12-05 14:25:48.107727,150.0,g,Piqueo BELL'S Tortilla de maíz natural Bolsa 1,3.3,plaza_vea,,MAÍZ SECO CANCHA
Bolsa 13g,Hongos Secos con Laurel TOÑA Bolsa 13g,S/ 3.40 un,plaza_vea,MAÍZ SECO CANCHA,2024-12-05 14:25:48.107727,13.0,g,Hongos Secos con Laurel TOÑA Bolsa,3.4,plaza_vea,,MAÍZ SECO CANCHA
Sobre 10g,Canela Entera SIBARITA Sobre 10g,S/ 3.59 un,plaza_vea,MAÍZ SECO CANCHA,2024-12-05 14:25:48.107727,10.0,g,Canela Entera SIBARITA Sobre,3.59,plaza_vea,,MAÍZ SECO CANCHA
,Maiz Cuzco Frito y Salado Cuisine&Co Bolsa 100 g,S/ 3.68,wong,MAÍZ SECO CANCHA,2024-12-05 17:32:03.263789,100.0,g,Maiz Cuzco Frito y Salado Cuisine&Co Bolsa,3.68,wong,,MAÍZ SECO CANCHA
Paquete 6un,Bizcocho CANCÚN COSTA Sabor coco y cobertura d...,S/ 3.70 un,plaza_vea,MAÍZ SECO CANCHA,2024-12-05 14:25:48.107727,6.0,un,Bizcocho CANCÚN COSTA Sabor coco y cobertura d,3.7,plaza_vea,,MAÍZ SECO CANCHA
,Maíz con Miel Vita Pluss Bolsa 140 g,S/ 3.90,wong,MAÍZ SECO CANCHA,2024-12-05 17:32:03.263789,140.0,g,Maíz con Miel Vita Pluss Bolsa,3.9,wong,,MAÍZ SECO CANCHA
,Maíz Pop Corn Costeño 500g,S/ 4.00,wong,MAÍZ SECO CANCHA,2024-12-05 17:32:03.263789,500.0,g,Maíz Pop Corn Costeño,4.0,wong,,MAÍZ SECO CANCHA
Sobre 12g,Canela Entera BELL'S Sobre 12g,S/ 4.09 un,plaza_vea,MAÍZ SECO CANCHA,2024-12-05 14:25:48.107727,12.0,g,Canela Entera BELL'S Sobre,4.09,plaza_vea,,MAÍZ SECO CANCHA
Bolsa 500g,Maíz Canchita Pop Corn TESORO VERDE Plaza Vea ...,S/ 4.20 un,plaza_vea,MAÍZ SECO CANCHA,2024-12-05 14:25:48.107727,500.0,g,Maíz Canchita Pop Corn TESORO VERDE Plaza Vea,4.2,plaza_vea,,MAÍZ SECO CANCHA
Sobre 9g,Canela Entera KARIÑO Sobre 9g,S/ 4.20 un,plaza_vea,MAÍZ SECO CANCHA,2024-12-05 14:25:48.107727,9.0,g,Canela Entera KARIÑO Sobre,4.2,plaza_vea,,MAÍZ SECO CANCHA
Bolsa 500g,Maíz Pop Corn BELL'S Bolsa 500g,S/ 4.30 un,plaza_vea,MAÍZ SECO CANCHA,2024-12-05 14:25:48.107727,500.0,g,Maíz Pop Corn BELL'S Bolsa,4.3,plaza_vea,,MAÍZ SECO CANCHA
Bolsa 80g,Canchita para Microondas ACT II Natural Bolsa ...,S/ 4.60 un,plaza_vea,MAÍZ SECO CANCHA,2024-12-05 14:25:48.107727,80.0,g,Canchita para Microondas ACT II Natural Bolsa,4.6,plaza_vea,,MAÍZ SECO CANCHA
Tableta 90g,Chocolate para Taza Instántaneo SOL DEL CUSCO ...,S/ 4.60 un,plaza_vea,MAÍZ SECO CANCHA,2024-12-05 14:25:48.107727,90.0,g,Chocolate para Taza Instántaneo SOL DEL CUSCO,4.6,plaza_vea,,MAÍZ SECO CANCHA
Bolsa 500g,Maíz Pop Corn COSTEÑO Bolsa 500g,S/ 4.60 un,plaza_vea,MAÍZ SECO CANCHA,2024-12-05 14:25:48.107727,500.0,g,Maíz Pop Corn COSTEÑO Bolsa,4.6,plaza_vea,,MAÍZ SECO CANCHA
,Maíz Pop Corn Cuisine & Co 500g,S/ 4.70,wong,MAÍZ SECO CANCHA,2024-12-05 17:32:03.263789,500.0,g,Maíz Pop Corn Cuisine & Co,4.7,wong,,MAÍZ SECO CANCHA
,Pasas Morenas Cuisine&Co 150g,S/ 4.90,wong,MAÍZ SECO CANCHA,2024-12-05 17:32:03.263789,150.0,g,Pasas Morenas Cuisine&Co,4.9,wong,,MAÍZ SECO CANCHA
Bolsa 100g,Tortillas de Maíz MEXI NACHOS Bolsa 100g,S/ 4.90 un,plaza_vea,MAÍZ SECO CANCHA,2024-12-05 14:25:48.107727,100.0,g,Tortillas de Maíz MEXI NACHOS Bolsa,4.9,plaza_vea,,MAÍZ SECO CANCHA
Bolsa 1un,Tamal de Chancho RECUTECU Empaque 180g,S/ 4.90 un,plaza_vea,MAÍZ SECO CANCHA,2024-12-05 14:25:48.107727,1.0,un,Tamal de Chancho RECUTECU Empaque,4.9,plaza_vea,,MAÍZ SECO CANCHA
Bolsa 500g,Maíz Pop Corn TESORO DEL CAMPO Bolsa 500g,S/ 4.99 un,plaza_vea,MAÍZ SECO CANCHA,2024-12-05 14:25:48.107727,500.0,g,Maíz Pop Corn TESORO DEL CAMPO Bolsa,4.99,plaza_vea,,MAÍZ SECO CANCHA
Bolsa 120g,Palitos de Maíz CHEESE TRIS Queso Bolsa 120g,S/ 5 un,plaza_vea,MAÍZ SECO CANCHA,2024-12-05 14:25:48.107727,120.0,g,Palitos de Maíz CHEESE TRIS Queso Bolsa,5.0,plaza_vea,,MAÍZ SECO CANCHA
,Maíz Pop Corn 500 g,S/ 5,tottus,MAÍZ SECO CANCHA,2024-12-05 11:09:49.644898,500.0,g,Maíz Pop Corn,5.0,tottus,TESORO DEL CAMPO,MAÍZ SECO CANCHA
,Maíz Pop Corn Tesoro Del Campo Bolsa 500 g,S/ 5.00,wong,MAÍZ SECO CANCHA,2024-12-05 17:32:03.263789,500.0,g,Maíz Pop Corn Tesoro Del Campo Bolsa,5.0,wong,,MAÍZ SECO CANCHA
,Pasas Morenas Vallealto 150g,S/ 5.10,wong,MAÍZ SECO CANCHA,2024-12-05 17:32:03.263789,150.0,g,Pasas Morenas Vallealto,5.1,wong,,MAÍZ SECO CANCHA
,Tortillas de Maíz Morado Mexi Nachos Bolsa 90 g,S/ 5.10,wong,MAÍZ SECO CANCHA,2024-12-05 17:32:03.263789,90.0,g,Tortillas de Maíz Morado Mexi Nachos Bolsa,5.1,wong,,MAÍZ SECO CANCHA
,Maní Salado Cuisine & Co 200g,S/ 5.28,wong,MAÍZ SECO CANCHA,2024-12-05 17:32:03.263789,200.0,g,Maní Salado Cuisine & Co,5.28,wong,,MAÍZ SECO CANCHA
Táper 140g,Piqueo BELL'S Cancha chulpi Táper 140Gr,S/ 5.39 un,plaza_vea,MAÍZ SECO CANCHA,2024-12-05 14:25:48.107727,140.0,g,Piqueo BELL'S Cancha chulpi Táper r,5.39,plaza_vea,,MAÍZ SECO CANCHA
,Maní Karinto Crocante Picante 200g,S/ 5.50,wong,MAÍZ SECO CANCHA,2024-12-05 17:32:03.263789,200.0,g,Maní Karinto Crocante Picante,5.5,wong,,MAÍZ SECO CANCHA
,Galletas de Maíz Horneadas Salmitas Caja 80 g,S/ 5.50,wong,MAÍZ SECO CANCHA,2024-12-05 17:32:03.263789,80.0,g,Galletas de Maíz Horneadas Salmitas Caja,5.5,wong,,MAÍZ SECO CANCHA
,Maní Karinto Crocante Salado 200g,S/ 5.50,wong,MAÍZ SECO CANCHA,2024-12-05 17:32:03.263789,200.0,g,Maní Karinto Crocante Salado,5.5,wong,,MAÍZ SECO CANCHA
Bolsa 400g,Papa Seca BELL'S Bolsa 400g,S/ 5.60 un,plaza_vea,MAÍZ SECO CANCHA,2024-12-05 14:25:48.107727,400.0,g,Papa Seca BELL'S Bolsa,5.6,plaza_vea,,MAÍZ SECO CANCHA
,Semillas de Girasol Cuisine&Co Pote 200 g,S/ 5.68,wong,MAÍZ SECO CANCHA,2024-12-05 17:32:03.263789,200.0,g,Semillas de Girasol Cuisine&Co Pote,5.68,wong,,MAÍZ SECO CANCHA
,Chips de Maíz Morado Orgánicos Wasi Bolsa 75 g,S/ 5.99,wong,MAÍZ SECO CANCHA,2024-12-05 17:32:03.263789,75.0,g,Chips de Maíz Morado Orgánicos Wasi Bolsa,5.99,wong,,MAÍZ SECO CANCHA
,Cancha Chulpi Salada 150g,S/ 6,tottus,MAÍZ SECO CANCHA,2024-12-05 11:09:49.644898,150.0,g,Cancha Chulpi Salada,6.0,tottus,TOTTUS,MAÍZ SECO CANCHA
Caja 125g,Levadura Seca Instantánea SAF INSTANT Caja 125...,S/ 6 un,plaza_vea,MAÍZ SECO CANCHA,2024-12-05 14:25:48.107727,125.0,g,Levadura Seca Instantánea SAF INSTANT Caja 125,6.0,plaza_vea,,MAÍZ SECO CANCHA
Caja 12un,Cereal Bar COSTA Manzana y Canela Caja 12un,S/ 6 un,plaza_vea,MAÍZ SECO CANCHA,2024-12-05 14:25:48.107727,12.0,un,Cereal Bar COSTA Manzana y Canela Caja,6.0,plaza_vea,,MAÍZ SECO CANCHA
,Maíz Gigante Inka Corn Original 100g,S/ 6.20,wong,MAÍZ SECO CANCHA,2024-12-05 17:32:03.263789,100.0,g,Maíz Gigante Inka Corn Original,6.2,wong,,MAÍZ SECO CANCHA
,Maíz Gigante Inka Corn Chile Picante 100g,S/ 6.20,wong,MAÍZ SECO CANCHA,2024-12-05 17:32:03.263789,100.0,g,Maíz Gigante Inka Corn Chile Picante,6.2,wong,,MAÍZ SECO CANCHA
Bolsa 400g,Maíz Chullpi BELL'S Bolsa 400g,S/ 6.20 un,plaza_vea,MAÍZ SECO CANCHA,2024-12-05 14:25:48.107727,400.0,g,Maíz Chullpi BELL'S Bolsa,6.2,plaza_vea,,MAÍZ SECO CANCHA
Bolsa 150g,Piqueo VALLE ALTO Frutos secos con almendras B...,S/ 6.40 un,plaza_vea,MAÍZ SECO CANCHA,2024-12-05 14:25:48.107727,150.0,g,Piqueo VALLE ALTO Frutos secos con almendras B,6.4,plaza_vea,,MAÍZ SECO CANCHA
,Maíz Pop Corn Valle Norte Bolsa 500 g,S/ 6.40,wong,MAÍZ SECO CANCHA,2024-12-05 17:32:03.263789,500.0,g,Maíz Pop Corn Valle Norte Bolsa,6.4,wong,,MAÍZ SECO CANCHA
,Maiz Cancha x 400 gr,S/ 6.43,tottus,MAÍZ SECO CANCHA,2024-12-05 11:09:49.644898,400.0,g,Maiz Cancha x r,6.43,tottus,TOTTUS,MAÍZ SECO CANCHA
Bolsa 190g,Palitos de Maíz CHIZITOS Bolsa 190g,S/ 6.50 un,plaza_vea,MAÍZ SECO CANCHA,2024-12-05 14:25:48.107727,190.0,g,Palitos de Maíz CHIZITOS Bolsa,6.5,plaza_vea,,MAÍZ SECO CANCHA
,Maní Recubierto Granuts Kraks Oriental 180g,S/ 6.50,wong,MAÍZ SECO CANCHA,2024-12-05 17:32:03.263789,180.0,g,Maní Recubierto Granuts Kraks Oriental,6.5,wong,,MAÍZ SECO CANCHA
Lata 425g,Maíz Dulce FRUTO DE ORO Lata 425g,S/ 6.90 un,plaza_vea,MAÍZ SECO CANCHA,2024-12-05 14:25:48.107727,425.0,g,Maíz Dulce FRUTO DE ORO Lata,6.9,plaza_vea,,MAÍZ SECO CANCHA
,Maíz Dulce en Granos Fruto de Oro 425g,S/ 6.99,wong,MAÍZ SECO CANCHA,2024-12-05 17:32:03.263789,425.0,g,Maíz Dulce en Granos Fruto de Oro,6.99,wong,,MAÍZ SECO CANCHA
Paquete 400g,Tamal Chinchano de Chancho RECUTECU Paquete 40...,S/ 7.50 un,plaza_vea,MAÍZ SECO CANCHA,2024-12-05 14:25:48.107727,400.0,g,Tamal Chinchano de Chancho RECUTECU Paquete 40,7.5,plaza_vea,,MAÍZ SECO CANCHA
Bolsa 500g,Papa Seca TESORO DEL CAMPO Bolsa 500g,S/ 7.69 un,plaza_vea,MAÍZ SECO CANCHA,2024-12-05 14:25:48.107727,500.0,g,Papa Seca TESORO DEL CAMPO Bolsa,7.69,plaza_vea,,MAÍZ SECO CANCHA
,Maní Tostado Villa Natura 200g,S/ 7.70,wong,MAÍZ SECO CANCHA,2024-12-05 17:32:03.263789,200.0,g,Maní Tostado Villa Natura,7.7,wong,,MAÍZ SECO CANCHA
,Cocktail de Nueces Original Vallealto 150g,S/ 7.80,wong,MAÍZ SECO CANCHA,2024-12-05 17:32:03.263789,150.0,g,Cocktail de Nueces Original Vallealto,7.8,wong,,MAÍZ SECO CANCHA
,Aceite de Girasol Cuisine & Co 900ml,S/ 7.90,wong,MAÍZ SECO CANCHA,2024-12-05 17:32:03.263789,900.0,ml,Aceite de Girasol Cuisine & Co,7.9,wong,,MAÍZ SECO CANCHA
,Duraznos en Almíbar Cuisine & Co 820g,S/ 7.90,wong,MAÍZ SECO CANCHA,2024-12-05 17:32:03.263789,820.0,g,Duraznos en Almíbar Cuisine & Co,7.9,wong,,MAÍZ SECO CANCHA
Botella 1L,Jugo de Fruta NATURALE Chicha Morada Botella 1...,S/ 7.90 un,plaza_vea,MAÍZ SECO CANCHA,2024-12-05 14:25:48.107727,1.0,l,Jugo de Fruta NATURALE Chicha Morada Botella 1,7.9,plaza_vea,,MAÍZ SECO CANCHA
Bolsa 500g,Papa Canchan Prefrita con Cascara Congelada BE...,S/ 7.90 un,plaza_vea,MAÍZ SECO CANCHA,2024-12-05 14:25:48.107727,500.0,g,Papa Canchan Prefrita con Cascara Congelada BE,7.9,plaza_vea,,MAÍZ SECO CANCHA
,Frutos Secos Berries Berry Mix Villa Natura 150g,S/ 7.90,wong,MAÍZ SECO CANCHA,2024-12-05 17:32:03.263789,150.0,g,Frutos Secos Berries Berry Mix Villa Natura,7.9,wong,,MAÍZ SECO CANCHA
,Pasas Morenas Cuisine&Co Pote 250 g,S/ 7.99,wong,MAÍZ SECO CANCHA,2024-12-05 17:32:03.263789,250.0,g,Pasas Morenas Cuisine&Co Pote,7.99,wong,,MAÍZ SECO CANCHA
Presentación 0.5 kg aprox.,Maíz Morado x Kg,S/ 7.99 x kg,plaza_vea,MAÍZ SECO CANCHA,2024-12-05 14:25:48.107727,0.5,kg,Maíz Morado,7.99,plaza_vea,,MAÍZ SECO CANCHA
Paquete 90g,Galletas de Maíz SALMAS Horneadas Caja 90g,S/ 8.10 un,plaza_vea,MAÍZ SECO CANCHA,2024-12-05 14:25:48.107727,90.0,g,Galletas de Maíz SALMAS Horneadas Caja,8.1,plaza_vea,,MAÍZ SECO CANCHA
Bolsa 500g,Papa Seca COSTEÑO Bolsa 500g,S/ 8.20 un,plaza_vea,MAÍZ SECO CANCHA,2024-12-05 14:25:48.107727,500.0,g,Papa Seca COSTEÑO Bolsa,8.2,plaza_vea,,MAÍZ SECO CANCHA
,Pasas Morenas Vallealto 250g,S/ 8.20,wong,MAÍZ SECO CANCHA,2024-12-05 17:32:03.263789,250.0,g,Pasas Morenas Vallealto,8.2,wong,,MAÍZ SECO CANCHA
,Mix de Nueces y Frutas Cuisine&Co Pote 200 g,S/ 8.56,wong,MAÍZ SECO CANCHA,2024-12-05 17:32:03.263789,200.0,g,Mix de Nueces y Frutas Cuisine&Co Pote,8.56,wong,,MAÍZ SECO CANCHA
Bolsa 150g,Frutos Secos VILLA NATURA Cocktail Premium Bol...,S/ 8.90 un,plaza_vea,MAÍZ SECO CANCHA,2024-12-05 14:25:48.107727,150.0,g,Frutos Secos VILLA NATURA Cocktail Premium Bol,8.9,plaza_vea,,MAÍZ SECO CANCHA
,Almendra Natural Vallealto 90g,S/ 8.90,wong,MAÍZ SECO CANCHA,2024-12-05 17:32:03.263789,90.0,g,Almendra Natural Vallealto,8.9,wong,,MAÍZ SECO CANCHA
,Frutos de Secos Cocktail Premium Villa Natura 150g,S/ 8.90,wong,MAÍZ SECO CANCHA,2024-12-05 17:32:03.263789,150.0,g,Frutos de Secos Cocktail Premium Villa Natura,8.9,wong,,MAÍZ SECO CANCHA
,Almendras Cuisine&Co Pote 100 g,S/ 8.95,wong,MAÍZ SECO CANCHA,2024-12-05 17:32:03.263789,100.0,g,Almendras Cuisine&Co Pote,8.95,wong,,MAÍZ SECO CANCHA
Bolsa 200g,Tortillas de Maíz TOSTITOS con Sal Bolsa 200g,S/ 9 un,plaza_vea,MAÍZ SECO CANCHA,2024-12-05 14:25:48.107727,200.0,g,Tortillas de Maíz TOSTITOS con Sal Bolsa,9.0,plaza_vea,,MAÍZ SECO CANCHA
Bolsa 200g,Snacks de Papa Maíz y Trigo PIQUEO SNAX Bolsa ...,S/ 9 un,plaza_vea,MAÍZ SECO CANCHA,2024-12-05 14:25:48.107727,200.0,g,Snacks de Papa Maíz y Trigo PIQUEO SNAX Bolsa,9.0,plaza_vea,,MAÍZ SECO CANCHA
Bolsa 190g,Tortillas de Maíz DORITOS Queso Atrevido Bolsa...,S/ 9 un,plaza_vea,MAÍZ SECO CANCHA,2024-12-05 14:25:48.107727,190.0,g,Tortillas de Maíz DORITOS Queso Atrevido Bolsa,9.0,plaza_vea,,MAÍZ SECO CANCHA
,Nueces Peladas Cuisine & Co 90g,S/ 9.20,wong,MAÍZ SECO CANCHA,2024-12-05 17:32:03.263789,90.0,g,Nueces Peladas Cuisine & Co,9.2,wong,,MAÍZ SECO CANCHA
Frasco 56.7g,Canela en Polvo BADIA Frasco 56.7g,S/ 9.30 un,plaza_vea,MAÍZ SECO CANCHA,2024-12-05 14:25:48.107727,56.7,g,Canela en Polvo BADIA Frasco,9.3,plaza_vea,,MAÍZ SECO CANCHA
,Mix de Frutos Secos con Arándanos Granuts 180g,S/ 9.50,wong,MAÍZ SECO CANCHA,2024-12-05 17:32:03.263789,180.0,g,Mix de Frutos Secos con Arándanos Granuts,9.5,wong,,MAÍZ SECO CANCHA
Bolsa 1kg,Harina de Maíz Blanco P.A.N. Precocida Bolsa 1...,S/ 9.50 un,plaza_vea,MAÍZ SECO CANCHA,2024-12-05 14:25:48.107727,1.0,kg,Harina de Maíz Blanco P.A.N. Precocida Bolsa 1,9.5,plaza_vea,,MAÍZ SECO CANCHA
,Guindón Sin Pepa Cuisine & Co 150g,S/ 9.70,wong,MAÍZ SECO CANCHA,2024-12-05 17:32:03.263789,150.0,g,Guindón Sin Pepa Cuisine & Co,9.7,wong,,MAÍZ SECO CANCHA
,Guindón sin Pepa Vallealto 150g,S/ 9.90,wong,MAÍZ SECO CANCHA,2024-12-05 17:32:03.263789,150.0,g,Guindón sin Pepa Vallealto,9.9,wong,,MAÍZ SECO CANCHA
Caja 126g,Galletas de Maíz SALMAS Horneadas con Camote y...,S/ 9.90 un,plaza_vea,MAÍZ SECO CANCHA,2024-12-05 14:25:48.107727,126.0,g,Galletas de Maíz SALMAS Horneadas con Camote y,9.9,plaza_vea,,MAÍZ SECO CANCHA
,Cancha Chulpi Salada 250g,S/ 9.90,tottus,MAÍZ SECO CANCHA,2024-12-05 11:09:49.644898,250.0,g,Cancha Chulpi Salada,9.9,tottus,TOTTUS,MAÍZ SECO CANCHA
,Maíz Morado x kg,S/ 9.99 x kg,wong,MAÍZ SECO CANCHA,2024-12-05 17:32:03.263789,1.0,kg,Maíz Morado,9.99,wong,,MAÍZ SECO CANCHA
,Tortilla de Maíz Tía Rosa 10un.,S/ 10.00,wong,MAÍZ SECO CANCHA,2024-12-05 17:32:03.263789,10.0,un,Tortilla de Maíz Tía Rosa .,10.0,wong,,MAÍZ SECO CANCHA
,Almendras con Sal Vallealto 90g,S/ 10.10,wong,MAÍZ SECO CANCHA,2024-12-05 17:32:03.263789,90.0,g,Almendras con Sal Vallealto,10.1,wong,,MAÍZ SECO CANCHA
,Berry Mix Original Vallealto 150g,S/ 10.10,wong,MAÍZ SECO CANCHA,2024-12-05 17:32:03.263789,150.0,g,Berry Mix Original Vallealto,10.1,wong,,MAÍZ SECO CANCHA
,Nueces Peladas Vallealto 90g,S/ 10.30,wong,MAÍZ SECO CANCHA,2024-12-05 17:32:03.263789,90.0,g,Nueces Peladas Vallealto,10.3,wong,,MAÍZ SECO CANCHA
,Berry Crunch Original Vallealto 250g,S/ 10.30,wong,MAÍZ SECO CANCHA,2024-12-05 17:32:03.263789,250.0,g,Berry Crunch Original Vallealto,10.3,wong,,MAÍZ SECO CANCHA
,Snack de Maíz Tostado con Arándanos Almendras y Maní Salado y Confitado de 180 g,S/ 10.49,tottus,MAÍZ SECO CANCHA,2024-12-05 11:09:49.644898,180.0,g,Snack de Maíz Tostado con Arándanos Almendras y Maní Salado y Confitado de,10.49,tottus,GRANUTS,MAÍZ SECO CANCHA
,Galletas de Maíz Horneadas Salmas 144g,S/ 10.50,wong,MAÍZ SECO CANCHA,2024-12-05 17:32:03.263789,144.0,g,Galletas de Maíz Horneadas Salmas,10.5,wong,,MAÍZ SECO CANCHA
,Tortillas de Maíz Saniito 12un,S/ 10.60,wong,MAÍZ SECO CANCHA,2024-12-05 17:32:03.263789,12.0,un,Tortillas de Maíz Saniito,10.6,wong,,MAÍZ SECO CANCHA
,Pecanas Peladas Vallealto 90g,S/ 10.90,wong,MAÍZ SECO CANCHA,2024-12-05 17:32:03.263789,90.0,g,Pecanas Peladas Vallealto,10.9,wong,,MAÍZ SECO CANCHA
,Puré de Manzana Cuisine&Co Frasco 850 g,S/ 10.90,wong,MAÍZ SECO CANCHA,2024-12-05 17:32:03.263789,850.0,g,Puré de Manzana Cuisine&Co Frasco,10.9,wong,,MAÍZ SECO CANCHA
Caja 126g,Galletas de Maíz SALMAS Horneadas con Granos y...,S/ 10.90 un,plaza_vea,MAÍZ SECO CANCHA,2024-12-05 14:25:48.107727,126.0,g,Galletas de Maíz SALMAS Horneadas con Granos y,10.9,plaza_vea,,MAÍZ SECO CANCHA
,Premium Cocktail Sin Maní Original Vallealto 150g,S/ 11.10,wong,MAÍZ SECO CANCHA,2024-12-05 17:32:03.263789,150.0,g,Premium Cocktail Sin Maní Original Vallealto,11.1,wong,,MAÍZ SECO CANCHA
Display 100un,Té Canela y Clavo HORNIMAN´S Display 100un,S/ 11.20 un,plaza_vea,MAÍZ SECO CANCHA,2024-12-05 14:25:48.107727,100.0,un,Té Canela y Clavo HORNIMAN´S Display,11.2,plaza_vea,,MAÍZ SECO CANCHA
,Semillas de Calabaza Cuisine&Co Pote 200 g,S/ 11.20,wong,MAÍZ SECO CANCHA,2024-12-05 17:32:03.263789,200.0,g,Semillas de Calabaza Cuisine&Co Pote,11.2,wong,,MAÍZ SECO CANCHA
,Maíz Cancha Sierra Exportadora Desgranado Bolsa 425 g,S/ 11.30,wong,MAÍZ SECO CANCHA,2024-12-05 17:32:03.263789,425.0,g,Maíz Cancha Sierra Exportadora Desgranado Bolsa,11.3,wong,,MAÍZ SECO CANCHA
,Galletas de Maíz Horneadas Salmas Granos y Semillas 126g,S/ 11.50,wong,MAÍZ SECO CANCHA,2024-12-05 17:32:03.263789,126.0,g,Galletas de Maíz Horneadas Salmas Granos y Semillas,11.5,wong,,MAÍZ SECO CANCHA
Caja 100un,Té Canela y Clavo BELL'S Caja 100un,S/ 11.50 un,plaza_vea,MAÍZ SECO CANCHA,2024-12-05 14:25:48.107727,100.0,un,Té Canela y Clavo BELL'S Caja,11.5,plaza_vea,,MAÍZ SECO CANCHA
,Galletas de Maíz Horneadas Salmas Maíz Morado 126g,S/ 11.50,wong,MAÍZ SECO CANCHA,2024-12-05 17:32:03.263789,126.0,g,Galletas de Maíz Horneadas Salmas Maíz Morado,11.5,wong,,MAÍZ SECO CANCHA
Bolsa 255g,Tortilla de Maíz TÍA ROSA Bolsa 255g,S/ 11.70 un,plaza_vea,MAÍZ SECO CANCHA,2024-12-05 14:25:48.107727,255.0,g,Tortilla de Maíz TÍA ROSA Bolsa,11.7,plaza_vea,,MAÍZ SECO CANCHA
,Cashews Vallealto 90g,S/ 11.90,wong,MAÍZ SECO CANCHA,2024-12-05 17:32:03.263789,90.0,g,Cashews Vallealto,11.9,wong,,MAÍZ SECO CANCHA
,Aceite de Canola Cuisine & Co Botella 1 lt,S/ 11.90,wong,MAÍZ SECO CANCHA,2024-12-05 17:32:03.263789,1.0,l,Aceite de Canola Cuisine & Co Botella,11.9,wong,,MAÍZ SECO CANCHA
,Tortillas de Maíz El Taco 10un,S/ 12.10,wong,MAÍZ SECO CANCHA,2024-12-05 17:32:03.263789,10.0,un,Tortillas de Maíz El Taco,12.1,wong,,MAÍZ SECO CANCHA
Caja 21g,Galletas de Maíz SALMAS Horneadas Caja 216g,S/ 12.20 un,plaza_vea,MAÍZ SECO CANCHA,2024-12-05 14:25:48.107727,21.0,g,Galletas de Maíz SALMAS Horneadas Caja,12.2,plaza_vea,,MAÍZ SECO CANCHA
,Habas Saladas Villa Natura 250g,S/ 12.20,wong,MAÍZ SECO CANCHA,2024-12-05 17:32:03.263789,250.0,g,Habas Saladas Villa Natura,12.2,wong,,MAÍZ SECO CANCHA
,Cancha Chulpi Villa Natura 250g,S/ 12.30,wong,MAÍZ SECO CANCHA,2024-12-05 17:32:03.263789,250.0,g,Cancha Chulpi Villa Natura,12.3,wong,,MAÍZ SECO CANCHA
Caja 100un,Té Canela y Clavo MC COLIN'S Caja 100un,S/ 12.40 un,plaza_vea,MAÍZ SECO CANCHA,2024-12-05 14:25:48.107727,100.0,un,Té Canela y Clavo MC COLIN'S Caja,12.4,plaza_vea,,MAÍZ SECO CANCHA
,Pistachos con Cáscara Vallealto 90g,S/ 12.40,wong,MAÍZ SECO CANCHA,2024-12-05 17:32:03.263789,90.0,g,Pistachos con Cáscara Vallealto,12.4,wong,,MAÍZ SECO CANCHA
,Pecana Acaramelada Cuisine & Co 80g,S/ 13.20,wong,MAÍZ SECO CANCHA,2024-12-05 17:32:03.263789,80.0,g,Pecana Acaramelada Cuisine & Co,13.2,wong,,MAÍZ SECO CANCHA
,Seco de Pollo con Arroz Blanco Cuisine & Co 400g,S/ 13.20,wong,MAÍZ SECO CANCHA,2024-12-05 17:32:03.263789,400.0,g,Seco de Pollo con Arroz Blanco Cuisine & Co,13.2,wong,,MAÍZ SECO CANCHA
,Maíz Morado Justo al Día 700g,S/ 13.40,wong,MAÍZ SECO CANCHA,2024-12-05 17:32:03.263789,700.0,g,Maíz Morado Justo al Día,13.4,wong,,MAÍZ SECO CANCHA
,Pecanas Peladas Cuisine&Co Pote 100 g,S/ 13.80,wong,MAÍZ SECO CANCHA,2024-12-05 17:32:03.263789,100.0,g,Pecanas Peladas Cuisine&Co Pote,13.8,wong,,MAÍZ SECO CANCHA
,Maíz Desgranado Orgánico The Fresh Market 425g,S/ 13.90,wong,MAÍZ SECO CANCHA,2024-12-05 17:32:03.263789,425.0,g,Maíz Desgranado Orgánico The Fresh Market,13.9,wong,,MAÍZ SECO CANCHA
,Cereal de Maíz Corn Flakes 405g,S/ 13.90,wong,MAÍZ SECO CANCHA,2024-12-05 17:32:03.263789,405.0,g,Cereal de Maíz Corn Flakes,13.9,wong,,MAÍZ SECO CANCHA
Caja 12un,Siu Mai DELI FREEZE de Pollo Caja 12un,S/ 13.99 un,plaza_vea,MAÍZ SECO CANCHA,2024-12-05 14:25:48.107727,12.0,un,Siu Mai DELI FREEZE de Pollo Caja,13.99,plaza_vea,,MAÍZ SECO CANCHA
Caja 12un,Siu Mai DELI FREEZE de Cerdo Caja 12un,S/ 13.99 un,plaza_vea,MAÍZ SECO CANCHA,2024-12-05 14:25:48.107727,12.0,un,Siu Mai DELI FREEZE de Cerdo Caja,13.99,plaza_vea,,MAÍZ SECO CANCHA
Bolsa 380g,Cereal CROSOY Granola manzana pecana y canela ...,S/ 14.20 un,plaza_vea,MAÍZ SECO CANCHA,2024-12-05 14:25:48.107727,380.0,g,Cereal CROSOY Granola manzana pecana y canela,14.2,plaza_vea,,MAÍZ SECO CANCHA
,Pistachos Salados Cuisine&Co Pote 150 g,S/ 14.32,wong,MAÍZ SECO CANCHA,2024-12-05 17:32:03.263789,150.0,g,Pistachos Salados Cuisine&Co Pote,14.32,wong,,MAÍZ SECO CANCHA
,Almendras Saladas Cuisine&Co Pote 200 g,S/ 14.36,wong,MAÍZ SECO CANCHA,2024-12-05 17:32:03.263789,200.0,g,Almendras Saladas Cuisine&Co Pote,14.36,wong,,MAÍZ SECO CANCHA
Botella 1L,Aceite de Maíz BASSO Botella 1L,S/ 14.50 un,plaza_vea,MAÍZ SECO CANCHA,2024-12-05 14:25:48.107727,1.0,l,Aceite de Maíz BASSO Botella,14.5,plaza_vea,,MAÍZ SECO CANCHA
,Seco de Res con Arroz Blanco Cuisine & Co 400g,S/ 14.50,wong,MAÍZ SECO CANCHA,2024-12-05 17:32:03.263789,400.0,g,Seco de Res con Arroz Blanco Cuisine & Co,14.5,wong,,MAÍZ SECO CANCHA
,Maíz Morado en Polvo Ecoandino Orgánico 200g,S/ 14.90,wong,MAÍZ SECO CANCHA,2024-12-05 17:32:03.263789,200.0,g,Maíz Morado en Polvo Ecoandino Orgánico,14.9,wong,,MAÍZ SECO CANCHA
,Twelvepack Galletas de Maíz Salmas Horneadas 18g,S/ 14.90,wong,MAÍZ SECO CANCHA,2024-12-05 17:32:03.263789,18.0,g,Twelvepack Galletas de Maíz Salmas Horneadas,14.9,wong,,MAÍZ SECO CANCHA
,Frutos de Secos Cocktail Premium Villa Natura 250g,S/ 14.90,wong,MAÍZ SECO CANCHA,2024-12-05 17:32:03.263789,250.0,g,Frutos de Secos Cocktail Premium Villa Natura,14.9,wong,,MAÍZ SECO CANCHA
Bolsa 350g,Cereal ÁNGEL Trigo Integral de Avena y Maíz Sa...,S/ 15.70 un,plaza_vea,MAÍZ SECO CANCHA,2024-12-05 14:25:48.107727,350.0,g,Cereal ÁNGEL Trigo Integral de Avena y Maíz Sa,15.7,plaza_vea,,MAÍZ SECO CANCHA
,Seco de Res con Frejoles Nadú Criollo Bandeja 390 gr,S/ 15.90,wong,MAÍZ SECO CANCHA,2024-12-05 17:32:03.263789,390.0,g,Seco de Res con Frejoles Nadú Criollo Bandeja r,15.9,wong,,MAÍZ SECO CANCHA
,Pecanas Peladas Vallealto 135g,S/ 15.90,wong,MAÍZ SECO CANCHA,2024-12-05 17:32:03.263789,135.0,g,Pecanas Peladas Vallealto,15.9,wong,,MAÍZ SECO CANCHA
,Berry Mix Original Vallealto 250g,S/ 16.20,wong,MAÍZ SECO CANCHA,2024-12-05 17:32:03.263789,250.0,g,Berry Mix Original Vallealto,16.2,wong,,MAÍZ SECO CANCHA
,Maíz Chulpi Desgranado Kuski Bolsa 425 g,S/ 16.30,wong,MAÍZ SECO CANCHA,2024-12-05 17:32:03.263789,425.0,g,Maíz Chulpi Desgranado Kuski Bolsa,16.3,wong,,MAÍZ SECO CANCHA
,Hojuelas de Maíz Kellogg's Corn Flakes 410g,S/ 16.80,wong,MAÍZ SECO CANCHA,2024-12-05 17:32:03.263789,410.0,g,Hojuelas de Maíz Kellogg's Corn Flakes,16.8,wong,,MAÍZ SECO CANCHA
,Hojuelas de Maíz Azucaradas Kellogg's Zucaritas 420g,S/ 16.90,wong,MAÍZ SECO CANCHA,2024-12-05 17:32:03.263789,420.0,g,Hojuelas de Maíz Azucaradas Kellogg's Zucaritas,16.9,wong,,MAÍZ SECO CANCHA
,"Aros de Maíz, Trigo y Avena Froot Loops Kellogg's 350g",S/ 16.90,wong,MAÍZ SECO CANCHA,2024-12-05 17:32:03.263789,350.0,g,"Aros de Maíz, Trigo y Avena Froot Loops Kellogg's",16.9,wong,,MAÍZ SECO CANCHA
,Aceite De Canola Borges Botella 1 Litro,S/ 16.90,wong,MAÍZ SECO CANCHA,2024-12-05 17:32:03.263789,1.0,l,Aceite De Canola Borges Botella itro,16.9,wong,,MAÍZ SECO CANCHA
,Cranberry Vallealto 150g,S/ 16.90,wong,MAÍZ SECO CANCHA,2024-12-05 17:32:03.263789,150.0,g,Cranberry Vallealto,16.9,wong,,MAÍZ SECO CANCHA
,Vino Tinto Borgoña Tabernero Semi Seco Botella 750ml,S/ 17.90,wong,MAÍZ SECO CANCHA,2024-12-05 17:32:03.263789,750.0,ml,Vino Tinto Borgoña Tabernero Semi Seco Botella,17.9,wong,,MAÍZ SECO CANCHA
Botella 750ml,Vino Rosé TABERNERO Gran Rosé Semi Seco Botell...,S/ 17.90 un,plaza_vea,MAÍZ SECO CANCHA,2024-12-05 14:25:48.107727,750.0,ml,Vino Rosé TABERNERO Gran Rosé Semi Seco Botell,17.9,plaza_vea,,MAÍZ SECO CANCHA
