description,brand,cantidad,unidad,price_numeric,website,scrape_timestamp,search_term,cantidad_escalada,unidad_escalada,price_numeric_escalado
Jabón de Tocador GLICI Miel de Abeja Barra 90g,Glici,90.0,g,2.7,vega,2024-12-05 13:07:06.103840,MIEL DE ABEJA,90.0,g,2.7
Yogurt Estílo Griego Tigo con Miel de Abeja Vaso 160 g,,160.0,g,6.4,metro,2024-12-05 16:25:59.552421,MIEL DE ABEJA,160.0,g,6.4
Yogurt TIGO Premium Natural con Miel de Abeja Vaso 160g,TIGO,160.0,g,6.4,vivanda,2024-12-05 22:20:50.038883,MIEL DE ABEJA,160.0,g,6.4
Miel de Abeja LA FLORENCIA 200g,,200.0,g,8.9,plaza_vea,2024-12-05 15:44:24.553330,MIEL DE ABEJA,200.0,g,8.9
Miel de Abeja La Reyna de Oxapampa 175 g,,175.0,g,12.7,tottus,2024-12-05 12:27:54.087049,MIEL DE ABEJA,175.0,g,12.7
Miel de Abeja 250 g,OLIVOS DEL SUR,250.0,g,12.9,tottus,2024-12-05 12:27:54.087049,MIEL DE ABEJA,250.0,g,12.9
Sirope sabor a Miel de Abeja SPITZE Botella 48...,,480.0,g,12.9,plaza_vea,2024-12-05 15:44:24.553330,MIEL DE ABEJA,480.0,g,12.9
Miel de Abeja VEGA Frasco 250g,Vega,250.0,g,12.9,vega,2024-12-05 13:07:06.103840,MIEL DE ABEJA,250.0,g,12.9
Sirope Sabor a Miel de Abeja SPITZE Botella 480g,SPITZE,480.0,g,12.9,vivanda,2024-12-05 22:20:50.038883,MIEL DE ABEJA,480.0,g,12.9
Sirope Sabor Miel de Abeja Spitze Frasco 480 g,,480.0,g,13.12,metro,2024-12-05 16:25:59.552421,MIEL DE ABEJA,480.0,g,13.12
Cereal UNIÓN Granola con miel de abeja Doypack...,,400.0,g,15.5,plaza_vea,2024-12-05 15:44:24.553330,MIEL DE ABEJA,400.0,g,15.5
Cereal UNIÓN Granola con miel de abeja Doypack 400g,UNIÓN,400.0,g,15.5,vivanda,2024-12-05 22:20:50.038883,MIEL DE ABEJA,400.0,g,15.5
Miel Eucalipto 300 g,LA ABEJA REAL,300.0,g,15.9,tottus,2024-12-05 12:27:54.087049,MIEL DE ABEJA,300.0,g,15.9
Miel de Abeja LA REYNA DE OXAPAMPA Frasco 175g,LA REYNA DE OXAPAMPA,175.0,g,16.2,vivanda,2024-12-05 22:20:50.038883,MIEL DE ABEJA,175.0,g,16.2
MIEL DE ABEJA 300G,,300.0,g,16.5,tottus,2024-12-05 12:27:54.087049,MIEL DE ABEJA,300.0,g,16.5
Miel de Abeja 300 g,TOTTUS,300.0,g,17.9,tottus,2024-12-05 12:27:54.087049,MIEL DE ABEJA,300.0,g,17.9
Miel de abeja LA REYNA OXAPAMPA Frasco 300Gr,LA REYNA DE OXAPAMPA,300.0,g,21.2,vivanda,2024-12-05 22:20:50.038883,MIEL DE ABEJA,300.0,g,21.2
Miel de Abeja Dulce Natura Floración Eucalipto Frasco 300 g,,300.0,g,21.3,metro,2024-12-05 16:25:59.552421,MIEL DE ABEJA,300.0,g,21.3
Miel de Abeja Dolce Natura Floración Silvestre Frasco 300 g,,300.0,g,21.3,metro,2024-12-05 16:25:59.552421,MIEL DE ABEJA,300.0,g,21.3
Miel de Abeja Callejón de Huaylas Natural Frasco 300 g,,300.0,g,21.5,metro,2024-12-05 16:25:59.552421,MIEL DE ABEJA,300.0,g,21.5
Miel de Abeja La Reyna de Oxapampa Frasco 300 g,,300.0,g,21.88,metro,2024-12-05 16:25:59.552421,MIEL DE ABEJA,300.0,g,21.88
Mantequilla de Maní SPREAD con Miel de Abeja Frasco 410g,SPREAD,410.0,g,21.9,vivanda,2024-12-05 22:20:50.038883,MIEL DE ABEJA,410.0,g,21.9
Miel de Abeja CALLEJÓN DE HUAYLAS Floración Silvestre Frasco 300g,CALLEJON DE HUAYLAS,300.0,g,22.1,vivanda,2024-12-05 22:20:50.038883,MIEL DE ABEJA,300.0,g,22.1
Miel de Abeja La Reyna de Oxapampa Frasco 300 g,,300.0,g,22.28,wong,2024-12-05 19:02:51.895009,MIEL DE ABEJA,300.0,g,22.28
Miel de Abeja Queen Bee's Frasco 450 g,,450.0,g,25.3,wong,2024-12-05 19:02:51.895009,MIEL DE ABEJA,450.0,g,25.3
Miel De Abeja Cruda x 350 g,HACIENDA DE NAJAR,350.0,g,26.11,tottus,2024-12-05 12:27:54.087049,MIEL DE ABEJA,350.0,g,26.11
Miel de Abeja OLIVOS DEL SUR Botella 500ml,OLIVOS DEL SUR,500.0,ml,26.5,vivanda,2024-12-05 22:20:50.038883,MIEL DE ABEJA,500.0,ml,26.5
Polen de Abeja La Reyna de Oxapampa Frasco 140 g,,140.0,g,26.95,metro,2024-12-05 16:25:59.552421,MIEL DE ABEJA,140.0,g,26.95
Miel de Abeja Olivos del Sur 500 g,,500.0,g,27.5,wong,2024-12-05 19:02:51.895009,MIEL DE ABEJA,500.0,g,27.5
Miel de Abeja Artidoro Rodríguez Cusco 300g,,300.0,g,27.6,wong,2024-12-05 19:02:51.895009,MIEL DE ABEJA,300.0,g,27.6
Miel de Abeja Hacienda de Najar 350g,,350.0,g,27.9,metro,2024-12-05 16:25:59.552421,MIEL DE ABEJA,350.0,g,27.9
Miel De Abejas Cosecha Del Paraíso Frasco 300 g,,300.0,g,28.5,metro,2024-12-05 16:25:59.552421,MIEL DE ABEJA,300.0,g,28.5
Miel de Abeja Hacienda de Najar 350g,,350.0,g,28.8,wong,2024-12-05 19:02:51.895009,MIEL DE ABEJA,350.0,g,28.8
Miel De Abeja Cuisine&Co Frasco 600 g,,600.0,g,29.5,metro,2024-12-05 16:25:59.552421,MIEL DE ABEJA,600.0,g,29.5
Miel De Abeja Cuisine&Co Frasco 600 g,,600.0,g,29.5,wong,2024-12-05 19:02:51.895009,MIEL DE ABEJA,600.0,g,29.5
Miel de abeja BELL'S Miel de abeja natural Frasco 600Gr,BELL'S,600.0,g,29.5,vivanda,2024-12-05 22:20:50.038883,MIEL DE ABEJA,600.0,g,29.5
Miel de abeja BELL'S Miel de abeja natural Fra...,,600.0,g,29.5,plaza_vea,2024-12-05 15:44:24.553330,MIEL DE ABEJA,600.0,g,29.5
Miel de Abeja 600 g,TOTTUS,600.0,g,29.9,tottus,2024-12-05 12:27:54.087049,MIEL DE ABEJA,600.0,g,29.9
Miel de abeja LA REYNA OXAPAMPA Frasco 600Gr,,600.0,g,30.7,plaza_vea,2024-12-05 15:44:24.553330,MIEL DE ABEJA,600.0,g,30.7
Miel De Abeja Orgánica Wasi Frasco 300 g,,300.0,g,32.4,wong,2024-12-05 19:02:51.895009,MIEL DE ABEJA,300.0,g,32.4
Miel de Abeja Dolce Natura Floración Eucalipto Frasco 600 g,,600.0,g,32.5,metro,2024-12-05 16:25:59.552421,MIEL DE ABEJA,600.0,g,32.5
Miel de Abeja Dolce Natura Floración Silvestre Frasco 600 g,,600.0,g,32.5,metro,2024-12-05 16:25:59.552421,MIEL DE ABEJA,600.0,g,32.5
Miel De Abeja Cruda x 600 g,HACIENDA DE NAJAR,600.0,g,33.08,tottus,2024-12-05 12:27:54.087049,MIEL DE ABEJA,600.0,g,33.08
Miel de Abeja Dolce Natura Floración Silvestre Frasco 600 g,,600.0,g,33.7,wong,2024-12-05 19:02:51.895009,MIEL DE ABEJA,600.0,g,33.7
Miel de Abeja la Reyna de Oxapampa 750 g,,750.0,g,34.9,tottus,2024-12-05 12:27:54.087049,MIEL DE ABEJA,750.0,g,34.9
Miel de abeja LA REYNA OXAPAMPA Frasco 600Gr,LA REYNA DE OXAPAMPA,600.0,g,35.4,vivanda,2024-12-05 22:20:50.038883,MIEL DE ABEJA,600.0,g,35.4
Miel de Abeja CALLEJÓN DE HUAYLAS Floración Si...,,500.0,g,36.5,plaza_vea,2024-12-05 15:44:24.553330,MIEL DE ABEJA,500.0,g,36.5
Miel de Abeja La Reyna de Oxapampa Frasco 600 g,,600.0,g,37.16,metro,2024-12-05 16:25:59.552421,MIEL DE ABEJA,600.0,g,37.16
Miel de Abejas Silvestre Callejón de Huaylas Frasco 500 g,,500.0,g,37.4,wong,2024-12-05 19:02:51.895009,MIEL DE ABEJA,500.0,g,37.4
Miel de Abeja Hacienda de Najar 600g,,600.0,g,37.5,wong,2024-12-05 19:02:51.895009,MIEL DE ABEJA,600.0,g,37.5
Miel de Abejas CALLEJÓN DE HUAYLAS Floración Eucalipto Frasco 500g,CALLEJON DE HUAYLAS,500.0,g,40.5,vivanda,2024-12-05 22:20:50.038883,MIEL DE ABEJA,500.0,g,40.5
Miel CALLEJÓN DE HUAYLAS Miel de Abejas y Euca...,,500.0,g,40.5,plaza_vea,2024-12-05 15:44:24.553330,MIEL DE ABEJA,500.0,g,40.5
Miel de Abeja La Reyna de Oxapampa Frasco 750 g,,750.0,g,43.45,wong,2024-12-05 19:02:51.895009,MIEL DE ABEJA,750.0,g,43.45
Miel de Abeja Pura HUAGAL Oxapampa Frasco 500g,,500.0,g,45.0,plaza_vea,2024-12-05 15:44:24.553330,MIEL DE ABEJA,500.0,g,45.0
Miel de Abeja Callejón de Huaylas Frasco 600 g,,600.0,g,46.9,wong,2024-12-05 19:02:51.895009,MIEL DE ABEJA,600.0,g,46.9
Miel de Abeja LA REYNA OXAPAMPA Frasco 1100g,,1100.0,g,51.8,plaza_vea,2024-12-05 15:44:24.553330,MIEL DE ABEJA,1100.0,g,51.8
Miel de Abeja Cuisine&Co Frasco 1100 g,,1100.0,g,52.5,metro,2024-12-05 16:25:59.552421,MIEL DE ABEJA,1100.0,g,52.5
Miel De Abeja Dulce Natura Floración Eucalipto Frasco 1100 g,,1100.0,g,56.9,metro,2024-12-05 16:25:59.552421,MIEL DE ABEJA,1100.0,g,56.9
Miel de Abeja Dulce Natura Floración Silvestre Frasco 1100 g,,1100.0,g,56.9,metro,2024-12-05 16:25:59.552421,MIEL DE ABEJA,1100.0,g,56.9
Miel De Abeja Cruda x 1 Kg,HACIENDA DE NAJAR,1.0,kg,58.03,tottus,2024-12-05 12:27:54.087049,MIEL DE ABEJA,1.0,kg,58.03
Miel de Abeja Hacienda de Najar 1kg,,1.0,kg,60.6,metro,2024-12-05 16:25:59.552421,MIEL DE ABEJA,1.0,kg,60.6
Miel de Abeja LA REYNA OXAPAMPA Frasco 1100g,LA REYNA DE OXAPAMPA,1100.0,g,61.3,vivanda,2024-12-05 22:20:50.038883,MIEL DE ABEJA,1100.0,g,61.3
Miel De Abeja Callejón De Huaylas Frasco 1100 g,,1100.0,g,62.5,metro,2024-12-05 16:25:59.552421,MIEL DE ABEJA,1100.0,g,62.5
Miel de Abeja CALLEJÓN DE HUAYLAS Silvestre Fr...,,1100.0,g,62.5,plaza_vea,2024-12-05 15:44:24.553330,MIEL DE ABEJA,1100.0,g,62.5
Miel de Abeja La Reyna de Oxapampa Frasco 1.1 Kg,,1.1,kg,64.05,metro,2024-12-05 16:25:59.552421,MIEL DE ABEJA,1.1,kg,64.05
Miel De Abeja Callejón De Huaylas Frasco 1100 g,,1100.0,g,64.8,wong,2024-12-05 19:02:51.895009,MIEL DE ABEJA,1100.0,g,64.8
Miel De Abejas Cosecha Del Paraíso Frasco 1.5 kg,,1.5,kg,84.7,wong,2024-12-05 19:02:51.895009,MIEL DE ABEJA,1.5,kg,84.7
