brand,description,price,website,search_term,scrape_timestamp,cantidad,unidad,price_numeric
Sedal,Acondicionador SEDAL Células Madre Frasco 340ml x 2u,S/ 27.00,vega,ZAPALLO MACRE,2024-12-04 14:10:22.998742,340.0,ml,27.0
Sedal,Shampoo SEDAL Células Madre Frasco 340ml,S/ 13.50,vega,ZAPALLO MACRE,2024-12-04 14:10:22.998742,340.0,ml,13.5
Axe,Desodorante en Aerosol AXE Body Apollo Frasco 150 ml,S/ 13.50,vega,ZAPALLO MACRE,2024-12-04 14:10:22.998742,150.0,ml,13.5
NUTRIBELA,Tratamiento Para el Cabello NUTRIBELA Células Madre Sachet 27ml,S/ 1.50,vega,ZAPALLO MACRE,2024-12-04 14:10:22.998742,27.0,ml,1.5
Sedal,Shampoo SEDAL Células Madre Frasco 650ml,S/ 22.50,vega,ZAPALLO MACRE,2024-12-04 14:10:22.998742,650.0,ml,22.5
Sedal,Crema para Peinar SEDAL Células Madre Frasco 300ml,S/ 13.20,vega,ZAPALLO MACRE,2024-12-04 14:10:22.998742,300.0,ml,13.2
Sedal,Acondicionador SEDAL Células Madre Frasco 340ml,S/ 13.50,vega,ZAPALLO MACRE,2024-12-04 14:10:22.998742,340.0,ml,13.5
Sedal,Shampoo SEDAL Células Madre Frasco 340ml x 2u,S/ 27.00,vega,ZAPALLO MACRE,2024-12-04 14:10:22.998742,340.0,ml,27.0
