description,brand,cantidad,unidad,price_numeric,website,scrape_timestamp,search_term,cantidad_escalada,unidad_escalada,price_numeric_escalado,CLASIFICACION
Café Instantáneo Folgers Classic Roast 226g,,226.0,g,61.9,wong,2024-12-06 14:59:01.896941,CAFÉ INSTANTÁNEO,226.0,g,61.9,CAFÉ INSTANTÁNEO
Café Instantáneo Folgers Classic Roast 226g,,226.0,g,61.9,metro,2024-12-06 19:34:35.921928,CAFÉ INSTANTÁNEO,226.0,g,61.9,CAFÉ INSTANTÁNEO
Café Instantáneo Descafeinado Folgers Classic 226g,,226.0,g,65.9,metro,2024-12-06 19:34:35.921928,CAFÉ INSTANTÁNEO,226.0,g,65.9,CAFÉ INSTANTÁNEO
Café Instantáneo Folgers Classic Roast 340g,,340.0,g,75.9,metro,2024-12-06 19:34:35.921928,CAFÉ INSTANTÁNEO,340.0,g,75.9,CAFÉ INSTANTÁNEO
Café Instantáneo Folgers Classic Roast 340g,,340.0,g,75.9,wong,2024-12-06 14:59:01.896941,CAFÉ INSTANTÁNEO,340.0,g,75.9,CAFÉ INSTANTÁNEO
Café Instantáneo Altomayo Gourmet 450g,,450.0,g,78.9,metro,2024-12-06 19:34:35.921928,CAFÉ INSTANTÁNEO,450.0,g,78.9,CAFÉ INSTANTÁNEO
Tripack Café Instantáneo Illy Smooth Taste 95g,,95.0,g,85.0,wong,2024-12-06 14:59:01.896941,CAFÉ INSTANTÁNEO,95.0,g,85.0,CAFÉ INSTANTÁNEO
Tripack Café Instantáneo Illy Intenso 95g,,95.0,g,85.0,wong,2024-12-06 14:59:01.896941,CAFÉ INSTANTÁNEO,95.0,g,85.0,CAFÉ INSTANTÁNEO
Sixpack Café Instantáneo Illy Intenso 95g,,95.0,g,150.0,wong,2024-12-06 14:59:01.896941,CAFÉ INSTANTÁNEO,95.0,g,150.0,CAFÉ INSTANTÁNEO
