description,brand,cantidad,unidad,price_numeric,website,scrape_timestamp,search_term,cantidad_escalada,unidad_escalada,price_numeric_escalado,CLASIFICACION
Chocolate Instantáneo Sabor Tradicional Bolsa 90 g,,90.0,g,3.82,metro,2024-12-06 19:34:35.921928,CAFÉ INSTANTÁNEO,90.0,g,3.82,CAFÉ INSTANTÁNEO
Avena Con Chocolate Instantáneo Santa Catalina Bolsa 150 g,,150.0,g,5.8,metro,2024-12-06 19:34:35.921928,CAFÉ INSTANTÁNEO,150.0,g,5.8,CAFÉ INSTANTÁNEO
Café Instantáneo Clásico ALTOMAYO Doypack 45g,,45.0,g,5.9,plaza_vea,2024-12-06 14:43:32.995909,CAFÉ INSTANTÁNEO,45.0,g,5.9,CAFÉ INSTANTÁNEO
Cebada Instantánea Kimbo Doypack 100 g,,100.0,g,6.1,wong,2024-12-06 14:59:01.896941,CAFÉ INSTANTÁNEO,100.0,g,6.1,CAFÉ INSTANTÁNEO
Café Instantáneo Granulado BELL'S Frasco 50g,,50.0,g,6.2,plaza_vea,2024-12-06 14:43:32.995909,CAFÉ INSTANTÁNEO,50.0,g,6.2,CAFÉ INSTANTÁNEO
Café Instantáneo Altomayo Clásico 45g,,45.0,g,6.2,metro,2024-12-06 19:34:35.921928,CAFÉ INSTANTÁNEO,45.0,g,6.2,CAFÉ INSTANTÁNEO
Café Instantáneo Cuisine & Co Puro 50g,,50.0,g,6.9,metro,2024-12-06 19:34:35.921928,CAFÉ INSTANTÁNEO,50.0,g,6.9,CAFÉ INSTANTÁNEO
Cebada Instantánea Ecco 80g,,80.0,g,7.7,wong,2024-12-06 14:59:01.896941,CAFÉ INSTANTÁNEO,80.0,g,7.7,CAFÉ INSTANTÁNEO
Café Instantáneo Altomayo Clásico 45g,,45.0,g,8.1,metro,2024-12-06 19:34:35.921928,CAFÉ INSTANTÁNEO,45.0,g,8.1,CAFÉ INSTANTÁNEO
Café Instantáneo ALTOMAYO Clásico Frasco 50g,,50.0,g,8.1,plaza_vea,2024-12-06 14:43:32.995909,CAFÉ INSTANTÁNEO,50.0,g,8.1,CAFÉ INSTANTÁNEO
Café Instantáneo Kirma Clásico 45g,,45.0,g,8.3,metro,2024-12-06 19:34:35.921928,CAFÉ INSTANTÁNEO,45.0,g,8.3,CAFÉ INSTANTÁNEO
Café Instantáneo ALTOMAYO Gourmet Bolsa 45gr,Altomayo,45.0,g,8.5,vega,2024-12-06 12:42:24.380230,CAFÉ INSTANTÁNEO,45.0,g,8.5,CAFÉ INSTANTÁNEO
Cebada Instantánea Kimbo Frasco 164 g,,164.0,g,8.7,metro,2024-12-06 19:34:35.921928,CAFÉ INSTANTÁNEO,164.0,g,8.7,CAFÉ INSTANTÁNEO
Cebada Instantánea Kimbo Frasco 164 g,,164.0,g,8.7,wong,2024-12-06 14:59:01.896941,CAFÉ INSTANTÁNEO,164.0,g,8.7,CAFÉ INSTANTÁNEO
Café Instantáneo ALTOMAYO Descafeinado Doypack...,,45.0,g,9.8,plaza_vea,2024-12-06 14:43:32.995909,CAFÉ INSTANTÁNEO,45.0,g,9.8,CAFÉ INSTANTÁNEO
CAFE INSTANTANEO GOURMET FRASCO 45 G,ALTOMAYO,45.0,g,9.9,tottus,2024-12-06 14:05:59.306418,CAFÉ INSTANTÁNEO,45.0,g,9.9,CAFÉ INSTANTÁNEO
Café Instantáneo Granulado Descafeinado Cuisine & Co 50g,,50.0,g,9.9,metro,2024-12-06 19:34:35.921928,CAFÉ INSTANTÁNEO,50.0,g,9.9,CAFÉ INSTANTÁNEO
Café Instantáneo BELL'S Doypack 100g,,100.0,g,9.9,plaza_vea,2024-12-06 14:43:32.995909,CAFÉ INSTANTÁNEO,100.0,g,9.9,CAFÉ INSTANTÁNEO
Cebada Instantánea Cuisine & Co 170g,,170.0,g,10.5,metro,2024-12-06 19:34:35.921928,CAFÉ INSTANTÁNEO,170.0,g,10.5,CAFÉ INSTANTÁNEO
Cebada Instantánea Ecco 170g,,170.0,g,10.9,metro,2024-12-06 19:34:35.921928,CAFÉ INSTANTÁNEO,170.0,g,10.9,CAFÉ INSTANTÁNEO
Café Instantáneo ALTOMAYO Gourmet Frasco 45g,,45.0,g,11.1,plaza_vea,2024-12-06 14:43:32.995909,CAFÉ INSTANTÁNEO,45.0,g,11.1,CAFÉ INSTANTÁNEO
Café Instantáneo Altomayo Gourmet 45g,,45.0,g,11.5,metro,2024-12-06 19:34:35.921928,CAFÉ INSTANTÁNEO,45.0,g,11.5,CAFÉ INSTANTÁNEO
Café Granulado Colcafé Frasco 50 g,,50.0,g,11.6,metro,2024-12-06 19:34:35.921928,CAFÉ INSTANTÁNEO,50.0,g,11.6,CAFÉ INSTANTÁNEO
Café Instantáneo Colcafé Clásico Frasco 50 g,,50.0,g,11.7,wong,2024-12-06 14:59:01.896941,CAFÉ INSTANTÁNEO,50.0,g,11.7,CAFÉ INSTANTÁNEO
Café Granulado Colcafé Frasco 50 g,,50.0,g,11.7,wong,2024-12-06 14:59:01.896941,CAFÉ INSTANTÁNEO,50.0,g,11.7,CAFÉ INSTANTÁNEO
Café Instantáneo NESCAFÉ Descafeinado Frasco 40g,NESCAFE,40.0,g,11.9,vivanda,2024-12-06 12:18:56.431720,CAFÉ INSTANTÁNEO,40.0,g,11.9,CAFÉ INSTANTÁNEO
Cremador Almendra Vainilla Nature's Heart Sin Azúcar 500ml,,500.0,ml,11.9,wong,2024-12-06 14:59:01.896941,CAFÉ INSTANTÁNEO,500.0,ml,11.9,CAFÉ INSTANTÁNEO
Café Instantáneo Granulado BELL'S Frasco 100g,,100.0,g,11.9,plaza_vea,2024-12-06 14:43:32.995909,CAFÉ INSTANTÁNEO,100.0,g,11.9,CAFÉ INSTANTÁNEO
Chocolate Instantáneo Choco Listo Sin Azúcar 180g,,180.0,g,11.9,metro,2024-12-06 19:34:35.921928,CAFÉ INSTANTÁNEO,180.0,g,11.9,CAFÉ INSTANTÁNEO
Café Instantáneo Granulado 100 g,TOTTUS,100.0,g,11.9,tottus,2024-12-06 14:05:59.306418,CAFÉ INSTANTÁNEO,100.0,g,11.9,CAFÉ INSTANTÁNEO
Cremador Almendra Nature's Heart Sin Azúcar 500ml,,500.0,ml,11.9,metro,2024-12-06 19:34:35.921928,CAFÉ INSTANTÁNEO,500.0,ml,11.9,CAFÉ INSTANTÁNEO
Cremador Almendra Nature's Heart Sin Azúcar 500ml,,500.0,ml,11.9,wong,2024-12-06 14:59:01.896941,CAFÉ INSTANTÁNEO,500.0,ml,11.9,CAFÉ INSTANTÁNEO
Café Instantáneo ALTOMAYO Descafeinado Frasco ...,,45.0,g,12.4,plaza_vea,2024-12-06 14:43:32.995909,CAFÉ INSTANTÁNEO,45.0,g,12.4,CAFÉ INSTANTÁNEO
Café Instantáneo Altomayo Clásico 80g,,80.0,g,12.5,metro,2024-12-06 19:34:35.921928,CAFÉ INSTANTÁNEO,80.0,g,12.5,CAFÉ INSTANTÁNEO
Café Instantáneo Clásico Polvo Doypack x 150 g,CAFETAL,150.0,g,12.6,tottus,2024-12-06 14:05:59.306418,CAFÉ INSTANTÁNEO,150.0,g,12.6,CAFÉ INSTANTÁNEO
Café Instantáneo Tradición 50 g - Frasco 50 gf,NESCAFE,50.0,g,12.9,tottus,2024-12-06 14:05:59.306418,CAFÉ INSTANTÁNEO,50.0,g,12.9,CAFÉ INSTANTÁNEO
Café Instantáneo 90g,CAFETAL,90.0,g,13.6,tottus,2024-12-06 14:05:59.306418,CAFÉ INSTANTÁNEO,90.0,g,13.6,CAFÉ INSTANTÁNEO
Cappuccino Colcafé Vainilla 6un,,6.0,un,13.7,metro,2024-12-06 19:34:35.921928,CAFÉ INSTANTÁNEO,6.0,un,13.7,CAFÉ INSTANTÁNEO
Cappuccino Colcafé Vainilla 6un,,6.0,un,13.7,wong,2024-12-06 14:59:01.896941,CAFÉ INSTANTÁNEO,6.0,un,13.7,CAFÉ INSTANTÁNEO
Café Instantáneo Granulado Cuisine & Co 100g,,100.0,g,13.9,wong,2024-12-06 14:59:01.896941,CAFÉ INSTANTÁNEO,100.0,g,13.9,CAFÉ INSTANTÁNEO
Café Instantáneo Granulado Cuisine & Co 100g,,100.0,g,13.9,metro,2024-12-06 19:34:35.921928,CAFÉ INSTANTÁNEO,100.0,g,13.9,CAFÉ INSTANTÁNEO
Café Instantáneo Descafeinado Altomayo 45g,,45.0,g,13.9,metro,2024-12-06 19:34:35.921928,CAFÉ INSTANTÁNEO,45.0,g,13.9,CAFÉ INSTANTÁNEO
Café Instantáneo BELL'S Liofilizado Frasco 100g,BELL'S,100.0,g,14.2,vivanda,2024-12-06 12:18:56.431720,CAFÉ INSTANTÁNEO,100.0,g,14.2,CAFÉ INSTANTÁNEO
Café Instantáneo Nescafé Tradición 50g,,50.0,g,14.9,metro,2024-12-06 19:34:35.921928,CAFÉ INSTANTÁNEO,50.0,g,14.9,CAFÉ INSTANTÁNEO
Café Instantáneo KIRMA Bolsa 8gr Tira 16u,Nescafe,8.0,g,14.9,vega,2024-12-06 12:42:24.380230,CAFÉ INSTANTÁNEO,8.0,g,14.9,CAFÉ INSTANTÁNEO
Café Instantáneo NESCAFÉ Descafeinado Frasco 4...,,40.0,g,14.9,plaza_vea,2024-12-06 14:43:32.995909,CAFÉ INSTANTÁNEO,40.0,g,14.9,CAFÉ INSTANTÁNEO
CAFE INSTANTANEO PREMIUM FRASCO 45 G,ALTOMAYO,45.0,g,14.9,tottus,2024-12-06 14:05:59.306418,CAFÉ INSTANTÁNEO,45.0,g,14.9,CAFÉ INSTANTÁNEO
Café Descafeinado Instantáneo Nescafé Original 40 g,NESCAFE,40.0,g,14.9,tottus,2024-12-06 14:05:59.306418,CAFÉ INSTANTÁNEO,40.0,g,14.9,CAFÉ INSTANTÁNEO
Café Instantáneo ALTOMAYO Gourmet Doypack 90g,Altomayo,90.0,g,15.0,vega,2024-12-06 12:42:24.380230,CAFÉ INSTANTÁNEO,90.0,g,15.0,CAFÉ INSTANTÁNEO
Cebada Instantánea Ecco 170g,,170.0,g,15.2,wong,2024-12-06 14:59:01.896941,CAFÉ INSTANTÁNEO,170.0,g,15.2,CAFÉ INSTANTÁNEO
Café Instantáneo ALTOMAYO Liofilizado Frasco 4...,,45.0,g,15.9,plaza_vea,2024-12-06 14:43:32.995909,CAFÉ INSTANTÁNEO,45.0,g,15.9,CAFÉ INSTANTÁNEO
Café Instantáneo Granulado Wong 200g,,200.0,g,15.9,wong,2024-12-06 14:59:01.896941,CAFÉ INSTANTÁNEO,200.0,g,15.9,CAFÉ INSTANTÁNEO
Café Instantáneo Liofilizado Premium 100 g,TOTTUS,100.0,g,16.5,tottus,2024-12-06 14:05:59.306418,CAFÉ INSTANTÁNEO,100.0,g,16.5,CAFÉ INSTANTÁNEO
Café Instantáneo en Polvo MARISCAL Frasco 170g,,170.0,g,16.59,plaza_vea,2024-12-06 14:43:32.995909,CAFÉ INSTANTÁNEO,170.0,g,16.59,CAFÉ INSTANTÁNEO
Café Instantáneo Nescafé Descafeinado 40g,,40.0,g,16.9,metro,2024-12-06 19:34:35.921928,CAFÉ INSTANTÁNEO,40.0,g,16.9,CAFÉ INSTANTÁNEO
Chocolate Instantáneo 40% Cacao Dark Lata 220 g,,220.0,g,17.34,metro,2024-12-06 19:34:35.921928,CAFÉ INSTANTÁNEO,220.0,g,17.34,CAFÉ INSTANTÁNEO
Chocolate Instantáneo Moka Lata 220 g,,220.0,g,17.34,metro,2024-12-06 19:34:35.921928,CAFÉ INSTANTÁNEO,220.0,g,17.34,CAFÉ INSTANTÁNEO
Café Instantáneo Descafeinado 100 g,TOTTUS,100.0,g,17.5,tottus,2024-12-06 14:05:59.306418,CAFÉ INSTANTÁNEO,100.0,g,17.5,CAFÉ INSTANTÁNEO
Café Instantáneo Cafetal Clásico 180g,,180.0,g,17.6,wong,2024-12-06 14:59:01.896941,CAFÉ INSTANTÁNEO,180.0,g,17.6,CAFÉ INSTANTÁNEO
Chocolate Instantáneo Sabor Canela y Clavo Lata 324 g,,324.0,g,17.68,metro,2024-12-06 19:34:35.921928,CAFÉ INSTANTÁNEO,324.0,g,17.68,CAFÉ INSTANTÁNEO
Café Instantáneo Altomayo Premium 45g,,45.0,g,17.8,metro,2024-12-06 19:34:35.921928,CAFÉ INSTANTÁNEO,45.0,g,17.8,CAFÉ INSTANTÁNEO
Café Instantáneo NESCAFÉ Vienés Caja 144g,,144.0,g,17.9,plaza_vea,2024-12-06 14:43:32.995909,CAFÉ INSTANTÁNEO,144.0,g,17.9,CAFÉ INSTANTÁNEO
Café Instantáneo Altomayo Premium 45g,,45.0,g,17.9,wong,2024-12-06 14:59:01.896941,CAFÉ INSTANTÁNEO,45.0,g,17.9,CAFÉ INSTANTÁNEO
Café Instantáneo NESCAFÉ Tradición Frasco 100gr,Nescafe,100.0,g,18.2,vega,2024-12-06 12:42:24.380230,CAFÉ INSTANTÁNEO,100.0,g,18.2,CAFÉ INSTANTÁNEO
Café Cafétal Instantáneo Doypack 150 g,CAFETAL,150.0,g,18.3,tottus,2024-12-06 14:05:59.306418,CAFÉ INSTANTÁNEO,150.0,g,18.3,CAFÉ INSTANTÁNEO
Café KIRMA Doypack 150gr,Kirma,150.0,g,18.5,vega,2024-12-06 12:42:24.380230,CAFÉ INSTANTÁNEO,150.0,g,18.5,CAFÉ INSTANTÁNEO
Cebada Instantánea Ecco 250g,,250.0,g,18.6,wong,2024-12-06 14:59:01.896941,CAFÉ INSTANTÁNEO,250.0,g,18.6,CAFÉ INSTANTÁNEO
CAFE INSTANTANEO GOURMET DOY PACK 90 G,ALTOMAYO,90.0,g,19.2,tottus,2024-12-06 14:05:59.306418,CAFÉ INSTANTÁNEO,90.0,g,19.2,CAFÉ INSTANTÁNEO
Café Instántaneo Gourmet ALTOMAYO Doypack 90g,,90.0,g,19.2,plaza_vea,2024-12-06 14:43:32.995909,CAFÉ INSTANTÁNEO,90.0,g,19.2,CAFÉ INSTANTÁNEO
Bebida Instantánea Nescafé Vainilla Latte 8un,,8.0,un,19.5,wong,2024-12-06 14:59:01.896941,CAFÉ INSTANTÁNEO,8.0,un,19.5,CAFÉ INSTANTÁNEO
Café Instantáneo Liofilizado Cafetal 90g,,90.0,g,19.7,wong,2024-12-06 14:59:01.896941,CAFÉ INSTANTÁNEO,90.0,g,19.7,CAFÉ INSTANTÁNEO
Café Instantáneo Cuisine & Co 100g,,100.0,g,19.9,wong,2024-12-06 14:59:01.896941,CAFÉ INSTANTÁNEO,100.0,g,19.9,CAFÉ INSTANTÁNEO
Chocolate Mild 90 gr,ORQUIDEA,90.0,g,20.4,tottus,2024-12-06 14:05:59.306418,CAFÉ INSTANTÁNEO,90.0,g,20.4,CAFÉ INSTANTÁNEO
Chocolate Instantáneo Choco Listo Chocolate 600g,,600.0,g,20.5,metro,2024-12-06 19:34:35.921928,CAFÉ INSTANTÁNEO,600.0,g,20.5,CAFÉ INSTANTÁNEO
Café Instantáneo Altomayo Gourmet 90g,,90.0,g,20.6,metro,2024-12-06 19:34:35.921928,CAFÉ INSTANTÁNEO,90.0,g,20.6,CAFÉ INSTANTÁNEO
Café Instantáneo Cafetal 150g,,150.0,g,20.7,metro,2024-12-06 19:34:35.921928,CAFÉ INSTANTÁNEO,150.0,g,20.7,CAFÉ INSTANTÁNEO
Café Soluble Descafeinado Doypack x 100 g,ALTOMAYO,100.0,g,20.9,tottus,2024-12-06 14:05:59.306418,CAFÉ INSTANTÁNEO,100.0,g,20.9,CAFÉ INSTANTÁNEO
Café Instantáneo NESCAFÉ Fina Selección Doypac...,,100.0,g,20.9,plaza_vea,2024-12-06 14:43:32.995909,CAFÉ INSTANTÁNEO,100.0,g,20.9,CAFÉ INSTANTÁNEO
Café instantáneo Nescafé Tradición 100 g,NESCAFE,100.0,g,20.9,tottus,2024-12-06 14:05:59.306418,CAFÉ INSTANTÁNEO,100.0,g,20.9,CAFÉ INSTANTÁNEO
Café Instantáneo Kirma Clásico 190g,,190.0,g,21.9,metro,2024-12-06 19:34:35.921928,CAFÉ INSTANTÁNEO,190.0,g,21.9,CAFÉ INSTANTÁNEO
Café Instantáneo BELL'S Granulado Frasco 200g,,200.0,g,21.9,plaza_vea,2024-12-06 14:43:32.995909,CAFÉ INSTANTÁNEO,200.0,g,21.9,CAFÉ INSTANTÁNEO
Café Instantáneo COLCAFÉ Todo en 1 Frasco 380g,,380.0,g,21.9,plaza_vea,2024-12-06 14:43:32.995909,CAFÉ INSTANTÁNEO,380.0,g,21.9,CAFÉ INSTANTÁNEO
Café Instantáneo Granulado 200 g,TOTTUS,200.0,g,21.9,tottus,2024-12-06 14:05:59.306418,CAFÉ INSTANTÁNEO,200.0,g,21.9,CAFÉ INSTANTÁNEO
Café Instantáneo Nescafé Gold 50g,,50.0,g,22.1,metro,2024-12-06 19:34:35.921928,CAFÉ INSTANTÁNEO,50.0,g,22.1,CAFÉ INSTANTÁNEO
Bebida Instantánea Marley Coffee Soul Rebel Cappuccino Classic 8un,,8.0,un,22.2,wong,2024-12-06 14:59:01.896941,CAFÉ INSTANTÁNEO,8.0,un,22.2,CAFÉ INSTANTÁNEO
Bebida Instantánea Marley Coffee Soul Rebel Cappuccino Vainilla 8un,,8.0,un,22.2,wong,2024-12-06 14:59:01.896941,CAFÉ INSTANTÁNEO,8.0,un,22.2,CAFÉ INSTANTÁNEO
Café Instantáneo ALTOMAYO Clásico Frasco 180g,,180.0,g,22.9,plaza_vea,2024-12-06 14:43:32.995909,CAFÉ INSTANTÁNEO,180.0,g,22.9,CAFÉ INSTANTÁNEO
Café Instantáneo KIRMA Lata 190g,,190.0,g,22.9,plaza_vea,2024-12-06 14:43:32.995909,CAFÉ INSTANTÁNEO,190.0,g,22.9,CAFÉ INSTANTÁNEO
Café Clásico 150 gr,KIRMA,150.0,g,22.9,tottus,2024-12-06 14:05:59.306418,CAFÉ INSTANTÁNEO,150.0,g,22.9,CAFÉ INSTANTÁNEO
Café Instantáneo Altomayo Clásico 170g,,170.0,g,22.9,metro,2024-12-06 19:34:35.921928,CAFÉ INSTANTÁNEO,170.0,g,22.9,CAFÉ INSTANTÁNEO
Café Instantáneo en Polvo 180 g,ALTOMAYO,180.0,g,22.9,tottus,2024-12-06 14:05:59.306418,CAFÉ INSTANTÁNEO,180.0,g,22.9,CAFÉ INSTANTÁNEO
Colcafe Todo En 1 Frasco 380 g,,380.0,g,22.9,metro,2024-12-06 19:34:35.921928,CAFÉ INSTANTÁNEO,380.0,g,22.9,CAFÉ INSTANTÁNEO
Café instantáneo Nescafé Tradición 100 gr,NESCAFE,100.0,g,22.9,tottus,2024-12-06 14:05:59.306418,CAFÉ INSTANTÁNEO,100.0,g,22.9,CAFÉ INSTANTÁNEO
Café Instantáneo Liofilizado Cafetal 180g,,180.0,g,23.0,metro,2024-12-06 19:34:35.921928,CAFÉ INSTANTÁNEO,180.0,g,23.0,CAFÉ INSTANTÁNEO
Café Instantáneo Kirma Clásico 190g + Mezcla Láctea Ideal Amanecer Lata 390g,,190.0,g,23.5,metro,2024-12-06 19:34:35.921928,CAFÉ INSTANTÁNEO,190.0,g,23.5,CAFÉ INSTANTÁNEO
Café Instantáneo NESCAFÉ Tradición Doypack 150...,,150.0,g,23.9,plaza_vea,2024-12-06 14:43:32.995909,CAFÉ INSTANTÁNEO,150.0,g,23.9,CAFÉ INSTANTÁNEO
Café Instantáneo MARISCAL Frasco 170g,,170.0,g,23.9,plaza_vea,2024-12-06 14:43:32.995909,CAFÉ INSTANTÁNEO,170.0,g,23.9,CAFÉ INSTANTÁNEO
Café Instantáneo NESCAFÉ Tradición Doypack 150g,NESCAFÉ,150.0,g,24.2,vivanda,2024-12-06 12:18:56.431720,CAFÉ INSTANTÁNEO,150.0,g,24.2,CAFÉ INSTANTÁNEO
Café Instantáneo KIRMA Lata 190g,KIRMA,190.0,g,24.8,vivanda,2024-12-06 12:18:56.431720,CAFÉ INSTANTÁNEO,190.0,g,24.8,CAFÉ INSTANTÁNEO
Café Instantáneo NESCAFÉ Tradición Frasco 170g,,170.0,g,24.9,plaza_vea,2024-12-06 14:43:32.995909,CAFÉ INSTANTÁNEO,170.0,g,24.9,CAFÉ INSTANTÁNEO
Wafer Cub Chocolate 6 unidades,KIT KAT,6.0,un,25.0,tottus,2024-12-06 14:05:59.306418,CAFÉ INSTANTÁNEO,6.0,un,25.0,CAFÉ INSTANTÁNEO
Café Instantáneo Nescafé Tradición 170g + Mezcla Láctea Ideal Cremosita Lata 390g,,170.0,g,25.0,metro,2024-12-06 19:34:35.921928,CAFÉ INSTANTÁNEO,170.0,g,25.0,CAFÉ INSTANTÁNEO
Café Instantáneo Nescafé Tradición 100g,,100.0,g,25.0,metro,2024-12-06 19:34:35.921928,CAFÉ INSTANTÁNEO,100.0,g,25.0,CAFÉ INSTANTÁNEO
Café Instantáneo ALTOMAYO Clàsico en Lata 190g,Altomayo,190.0,g,25.0,vega,2024-12-06 12:42:24.380230,CAFÉ INSTANTÁNEO,190.0,g,25.0,CAFÉ INSTANTÁNEO
Café Instantáneo Colcafé Clásico Frasco 170 g,,170.0,g,25.2,wong,2024-12-06 14:59:01.896941,CAFÉ INSTANTÁNEO,170.0,g,25.2,CAFÉ INSTANTÁNEO
Café Instantáneo Nescafé Tradición 100g,,100.0,g,25.3,wong,2024-12-06 14:59:01.896941,CAFÉ INSTANTÁNEO,100.0,g,25.3,CAFÉ INSTANTÁNEO
Café Instantáneo Nescafé Fina Selección 100g,,100.0,g,25.4,metro,2024-12-06 19:34:35.921928,CAFÉ INSTANTÁNEO,100.0,g,25.4,CAFÉ INSTANTÁNEO
Café Instantáneo Granulado Cuisine & Co 180g,,180.0,g,25.9,metro,2024-12-06 19:34:35.921928,CAFÉ INSTANTÁNEO,180.0,g,25.9,CAFÉ INSTANTÁNEO
Café instantáneo Nescafé 190 gr,KIRMA,190.0,g,25.9,tottus,2024-12-06 14:05:59.306418,CAFÉ INSTANTÁNEO,190.0,g,25.9,CAFÉ INSTANTÁNEO
Café Instantáneo Nescafé Tradición 170g,,170.0,g,25.9,metro,2024-12-06 19:34:35.921928,CAFÉ INSTANTÁNEO,170.0,g,25.9,CAFÉ INSTANTÁNEO
Crema para Café Sin Lactosa Libby's Frasco 454 g,,454.0,g,25.9,wong,2024-12-06 14:59:01.896941,CAFÉ INSTANTÁNEO,454.0,g,25.9,CAFÉ INSTANTÁNEO
Café instantáneo Nescafé Tradición 170 g,NESCAFE,170.0,g,25.9,tottus,2024-12-06 14:05:59.306418,CAFÉ INSTANTÁNEO,170.0,g,25.9,CAFÉ INSTANTÁNEO
Café Instantáneo Nescafé Tradición 170g,,170.0,g,25.9,wong,2024-12-06 14:59:01.896941,CAFÉ INSTANTÁNEO,170.0,g,25.9,CAFÉ INSTANTÁNEO
Café Instantáneo Nescafé Fina Selección 100g,,100.0,g,26.2,wong,2024-12-06 14:59:01.896941,CAFÉ INSTANTÁNEO,100.0,g,26.2,CAFÉ INSTANTÁNEO
Café Instantáneo CAFETAL Doypack 150g,,150.0,g,26.5,plaza_vea,2024-12-06 14:43:32.995909,CAFÉ INSTANTÁNEO,150.0,g,26.5,CAFÉ INSTANTÁNEO
Café Instantáneo Gourmet 150g,ALTOMAYO,150.0,g,26.5,tottus,2024-12-06 14:05:59.306418,CAFÉ INSTANTÁNEO,150.0,g,26.5,CAFÉ INSTANTÁNEO
Café Instantáneo Nescafé Tradición 150g,,150.0,g,26.5,wong,2024-12-06 14:59:01.896941,CAFÉ INSTANTÁNEO,150.0,g,26.5,CAFÉ INSTANTÁNEO
Café Instántaneo Gourmet ALTOMAYO Doypack 150g,,150.0,g,26.5,plaza_vea,2024-12-06 14:43:32.995909,CAFÉ INSTANTÁNEO,150.0,g,26.5,CAFÉ INSTANTÁNEO
Café Instantáneo en Polvo Colcafé Clásico 170 g,COLCAFE,170.0,g,26.5,tottus,2024-12-06 14:05:59.306418,CAFÉ INSTANTÁNEO,170.0,g,26.5,CAFÉ INSTANTÁNEO
Café Gold Suave Cronat Gold Jacobs Frasco 100 g,,100.0,g,26.6,wong,2024-12-06 14:59:01.896941,CAFÉ INSTANTÁNEO,100.0,g,26.6,CAFÉ INSTANTÁNEO
Café Descafeinado Instantáneo Jacobs Frasco 100 g,,100.0,g,26.6,metro,2024-12-06 19:34:35.921928,CAFÉ INSTANTÁNEO,100.0,g,26.6,CAFÉ INSTANTÁNEO
Café Instantáneo Altomayo Gourmet 150g,,150.0,g,26.9,metro,2024-12-06 19:34:35.921928,CAFÉ INSTANTÁNEO,150.0,g,26.9,CAFÉ INSTANTÁNEO
Café Instantáneo Liofilizado Cuisine & Co 180g,,180.0,g,26.9,metro,2024-12-06 19:34:35.921928,CAFÉ INSTANTÁNEO,180.0,g,26.9,CAFÉ INSTANTÁNEO
Café Instantáneo Kirma Clásico 190g,,190.0,g,26.9,wong,2024-12-06 14:59:01.896941,CAFÉ INSTANTÁNEO,190.0,g,26.9,CAFÉ INSTANTÁNEO
Café Instantáneo NESCAFÉ Tradición Frasco 170g,NESCAFÉ,170.0,g,27.1,vivanda,2024-12-06 12:18:56.431720,CAFÉ INSTANTÁNEO,170.0,g,27.1,CAFÉ INSTANTÁNEO
Café instantáneo liofilizado Premium 200 gr,TOTTUS,200.0,g,27.5,tottus,2024-12-06 14:05:59.306418,CAFÉ INSTANTÁNEO,200.0,g,27.5,CAFÉ INSTANTÁNEO
Café Instantáneo Clásico 190g,ALTOMAYO,190.0,g,27.8,tottus,2024-12-06 14:05:59.306418,CAFÉ INSTANTÁNEO,190.0,g,27.8,CAFÉ INSTANTÁNEO
CAFE LIOFILIZADO CRONAT GOLD SUAVE 100G,JACOBS,100.0,g,27.9,tottus,2024-12-06 14:05:59.306418,CAFÉ INSTANTÁNEO,100.0,g,27.9,CAFÉ INSTANTÁNEO
Café Instantáneo Granulado Descafeinado Cuisine & Co 180g,,180.0,g,27.9,metro,2024-12-06 19:34:35.921928,CAFÉ INSTANTÁNEO,180.0,g,27.9,CAFÉ INSTANTÁNEO
Café Instantáneo Kirma Clásico 250g,,250.0,g,27.9,metro,2024-12-06 19:34:35.921928,CAFÉ INSTANTÁNEO,250.0,g,27.9,CAFÉ INSTANTÁNEO
Café Instantáneo ALTOMAYO Gourmet Frasco 170g,Altomayo,170.0,g,27.9,vega,2024-12-06 12:42:24.380230,CAFÉ INSTANTÁNEO,170.0,g,27.9,CAFÉ INSTANTÁNEO
Café Instantáneo Altomayo Gourmet 170g,,170.0,g,28.5,metro,2024-12-06 19:34:35.921928,CAFÉ INSTANTÁNEO,170.0,g,28.5,CAFÉ INSTANTÁNEO
Café Instantáneo ALTOMAYO Gourmet Frasco 170g,,170.0,g,28.5,plaza_vea,2024-12-06 14:43:32.995909,CAFÉ INSTANTÁNEO,170.0,g,28.5,CAFÉ INSTANTÁNEO
Café Instántaneo Gourmet ALTOMAYO Doypack 150g,ALTOMAYO,150.0,g,28.6,vivanda,2024-12-06 12:18:56.431720,CAFÉ INSTANTÁNEO,150.0,g,28.6,CAFÉ INSTANTÁNEO
Chocolate Instantáneo Choco Listo Chocolate 1kg,,1.0,kg,28.7,metro,2024-12-06 19:34:35.921928,CAFÉ INSTANTÁNEO,1.0,kg,28.7,CAFÉ INSTANTÁNEO
Café Granulado Colcafé Frasco 170 g,,170.0,g,28.7,wong,2024-12-06 14:59:01.896941,CAFÉ INSTANTÁNEO,170.0,g,28.7,CAFÉ INSTANTÁNEO
Café Instantáneo ALTOMAYO Gourmet Frasco 170g,ALTOMAYO,170.0,g,28.7,vivanda,2024-12-06 12:18:56.431720,CAFÉ INSTANTÁNEO,170.0,g,28.7,CAFÉ INSTANTÁNEO
Café Instantáneo Nescafé Tradición 170g + Taza,,170.0,g,28.9,metro,2024-12-06 19:34:35.921928,CAFÉ INSTANTÁNEO,170.0,g,28.9,CAFÉ INSTANTÁNEO
Café Instantáneo Altomayo Gourmet 170g,,170.0,g,28.9,wong,2024-12-06 14:59:01.896941,CAFÉ INSTANTÁNEO,170.0,g,28.9,CAFÉ INSTANTÁNEO
Café Instantáneo KIRMA Doypack 250g,,250.0,g,28.9,plaza_vea,2024-12-06 14:43:32.995909,CAFÉ INSTANTÁNEO,250.0,g,28.9,CAFÉ INSTANTÁNEO
Café Instantáneo Nescafé Descafeinado 100g,,100.0,g,29.3,metro,2024-12-06 19:34:35.921928,CAFÉ INSTANTÁNEO,100.0,g,29.3,CAFÉ INSTANTÁNEO
Café Instántaneo Intenso CAFETAL Frasco 180g,CAFETAL,180.0,g,29.8,vivanda,2024-12-06 12:18:56.431720,CAFÉ INSTANTÁNEO,180.0,g,29.8,CAFÉ INSTANTÁNEO
Café Instantáneo ALTOMAYO Descafeinado Frasco ...,,170.0,g,29.9,plaza_vea,2024-12-06 14:43:32.995909,CAFÉ INSTANTÁNEO,170.0,g,29.9,CAFÉ INSTANTÁNEO
Café instantáneo Nescafé Fina Selección de 200 g,NESCAFE,200.0,g,29.9,tottus,2024-12-06 14:05:59.306418,CAFÉ INSTANTÁNEO,200.0,g,29.9,CAFÉ INSTANTÁNEO
Café Instantáneo Gourmet 170g,ALTOMAYO,170.0,g,29.9,tottus,2024-12-06 14:05:59.306418,CAFÉ INSTANTÁNEO,170.0,g,29.9,CAFÉ INSTANTÁNEO
Café Instántaneo Clásico ALTOMAYO Lata 190g,,190.0,g,30.2,plaza_vea,2024-12-06 14:43:32.995909,CAFÉ INSTANTÁNEO,190.0,g,30.2,CAFÉ INSTANTÁNEO
Café Instantáneo Altomayo Clásico 190g,,190.0,g,30.2,metro,2024-12-06 19:34:35.921928,CAFÉ INSTANTÁNEO,190.0,g,30.2,CAFÉ INSTANTÁNEO
Café Instantáneo Altomayo Clásico 190g,,190.0,g,30.4,wong,2024-12-06 14:59:01.896941,CAFÉ INSTANTÁNEO,190.0,g,30.4,CAFÉ INSTANTÁNEO
Café Instantáneo Nescafé Fina Selección 200g,,200.0,g,30.5,metro,2024-12-06 19:34:35.921928,CAFÉ INSTANTÁNEO,200.0,g,30.5,CAFÉ INSTANTÁNEO
Café Instantáneo Nescafé Fina Selección 200g,,200.0,g,30.5,wong,2024-12-06 14:59:01.896941,CAFÉ INSTANTÁNEO,200.0,g,30.5,CAFÉ INSTANTÁNEO
Café Instántaneo Intenso CAFETAL Frasco 180g,,180.0,g,30.6,plaza_vea,2024-12-06 14:43:32.995909,CAFÉ INSTANTÁNEO,180.0,g,30.6,CAFÉ INSTANTÁNEO
Café Instantáneo NESCAFÉ Tradición Doypack 250...,,250.0,g,30.9,plaza_vea,2024-12-06 14:43:32.995909,CAFÉ INSTANTÁNEO,250.0,g,30.9,CAFÉ INSTANTÁNEO
Café Instantáneo Illy Intenso 95g,,95.0,g,31.7,wong,2024-12-06 14:59:01.896941,CAFÉ INSTANTÁNEO,95.0,g,31.7,CAFÉ INSTANTÁNEO
Café Instantáneo Descafeinado Cuisine & Co 190g,,190.0,g,34.9,wong,2024-12-06 14:59:01.896941,CAFÉ INSTANTÁNEO,190.0,g,34.9,CAFÉ INSTANTÁNEO
Café Instantáneo Nescafé Tradición 250g,,250.0,g,34.9,wong,2024-12-06 14:59:01.896941,CAFÉ INSTANTÁNEO,250.0,g,34.9,CAFÉ INSTANTÁNEO
Café Instantáneo Bustelo Espresso 100g,,100.0,g,34.9,metro,2024-12-06 19:34:35.921928,CAFÉ INSTANTÁNEO,100.0,g,34.9,CAFÉ INSTANTÁNEO
Café Instantáneo Descafeinado Cuisine & Co 190g,,190.0,g,34.9,metro,2024-12-06 19:34:35.921928,CAFÉ INSTANTÁNEO,190.0,g,34.9,CAFÉ INSTANTÁNEO
Café Instantáneo Cuisine & Co 190g,,190.0,g,34.9,metro,2024-12-06 19:34:35.921928,CAFÉ INSTANTÁNEO,190.0,g,34.9,CAFÉ INSTANTÁNEO
Café Instantáneo Cuisine & Co 190g,,190.0,g,34.9,wong,2024-12-06 14:59:01.896941,CAFÉ INSTANTÁNEO,190.0,g,34.9,CAFÉ INSTANTÁNEO
Café Instantáneo Bustelo Espresso 100g,,100.0,g,34.9,wong,2024-12-06 14:59:01.896941,CAFÉ INSTANTÁNEO,100.0,g,34.9,CAFÉ INSTANTÁNEO
Café Instantáneo ALTOMAYO Liofilizado Frasco 170g,ALTOMAYO,170.0,g,35.9,vivanda,2024-12-06 12:18:56.431720,CAFÉ INSTANTÁNEO,170.0,g,35.9,CAFÉ INSTANTÁNEO
Café Instantáneo Descafeinado Altomayo 170g,,170.0,g,36.9,metro,2024-12-06 19:34:35.921928,CAFÉ INSTANTÁNEO,170.0,g,36.9,CAFÉ INSTANTÁNEO
Café Instantáneo Nescafé Gold 100g,,100.0,g,38.1,metro,2024-12-06 19:34:35.921928,CAFÉ INSTANTÁNEO,100.0,g,38.1,CAFÉ INSTANTÁNEO
CAFE INSTANTANEO DESCAFEINADO 170 GR,ALTOMAYO,170.0,g,38.5,tottus,2024-12-06 14:05:59.306418,CAFÉ INSTANTÁNEO,170.0,g,38.5,CAFÉ INSTANTÁNEO
Lata Café Instantáneo Altomayo Gourmet 170g + 90g,,170.0,g,38.5,wong,2024-12-06 14:59:01.896941,CAFÉ INSTANTÁNEO,170.0,g,38.5,CAFÉ INSTANTÁNEO
Café Instantáneo Descafeinado Bustelo Espresso 100g,,100.0,g,38.9,metro,2024-12-06 19:34:35.921928,CAFÉ INSTANTÁNEO,100.0,g,38.9,CAFÉ INSTANTÁNEO
Café Instantáneo ALTOMAYO Descafeinado Frasco 170g,Altomayo,170.0,g,38.9,vega,2024-12-06 12:42:24.380230,CAFÉ INSTANTÁNEO,170.0,g,38.9,CAFÉ INSTANTÁNEO
Café Instantáneo Altomayo Premium 170g,,170.0,g,39.8,metro,2024-12-06 19:34:35.921928,CAFÉ INSTANTÁNEO,170.0,g,39.8,CAFÉ INSTANTÁNEO
Café Instantáneo Altomayo Premium 170g,,170.0,g,39.9,wong,2024-12-06 14:59:01.896941,CAFÉ INSTANTÁNEO,170.0,g,39.9,CAFÉ INSTANTÁNEO
Café Instantáneo Nescafé Descafeinado 170g,,170.0,g,41.1,metro,2024-12-06 19:34:35.921928,CAFÉ INSTANTÁNEO,170.0,g,41.1,CAFÉ INSTANTÁNEO
Café Instantáneo Altomayo Gourmet 190g,,190.0,g,41.5,wong,2024-12-06 14:59:01.896941,CAFÉ INSTANTÁNEO,190.0,g,41.5,CAFÉ INSTANTÁNEO
Café Instantáneo Nescafé Gold 200g,,200.0,g,43.9,metro,2024-12-06 19:34:35.921928,CAFÉ INSTANTÁNEO,200.0,g,43.9,CAFÉ INSTANTÁNEO
Café Instantáneo Nescafé Gold 200g,,200.0,g,44.9,wong,2024-12-06 14:59:01.896941,CAFÉ INSTANTÁNEO,200.0,g,44.9,CAFÉ INSTANTÁNEO
Café Instantáneo Liofilizado Cronat Gold Suave 200 g,JACOBS,200.0,g,48.5,tottus,2024-12-06 14:05:59.306418,CAFÉ INSTANTÁNEO,200.0,g,48.5,CAFÉ INSTANTÁNEO
Café Instantáneo Liofilizado Descafeinado Supreme by Bustelo 100g,,100.0,g,49.9,wong,2024-12-06 14:59:01.896941,CAFÉ INSTANTÁNEO,100.0,g,49.9,CAFÉ INSTANTÁNEO
Café Instantáneo Altomayo Clásico 450g,,450.0,g,51.5,metro,2024-12-06 19:34:35.921928,CAFÉ INSTANTÁNEO,450.0,g,51.5,CAFÉ INSTANTÁNEO
Café instantáneo Nescafé Gold Blend 200 gr,NESCAFE,200.0,g,53.9,tottus,2024-12-06 14:05:59.306418,CAFÉ INSTANTÁNEO,200.0,g,53.9,CAFÉ INSTANTÁNEO
Café Liofilizado Clasico 190 gr,JUAN VALDEZ,190.0,g,55.9,tottus,2024-12-06 14:05:59.306418,CAFÉ INSTANTÁNEO,190.0,g,55.9,CAFÉ INSTANTÁNEO
