description,price,website,search_term,scrape_timestamp,cantidad,unidad,description_no_unit,price_numeric,WEB,unit,brand,CLASIFICACION
Pimienta Entera BADIA Molinillo Pote 56.7g,S/ 14.10 un,plaza_vea,AJÍ PIMIENTO,2024-12-04 14:04:33.354931,56.7,g,Pimienta Entera BADIA Molinillo Pote,14.1,plaza_vea,Pote 56.7g,,AJÍ PIMIENTO
Tapenade Ají Limo 260 gr,S/ 14.70,tottus,AJÍ PIMIENTO,2024-12-04 13:36:25.534064,260.0,g,Tapenade Ají Limo r,14.7,tottus,,OLIVOS DEL SUR,AJÍ PIMIENTO
Ajo Entero BELL'S Pelado Bandeja 250g,S/ 14.99 un,plaza_vea,AJÍ PIMIENTO,2024-12-04 14:04:33.354931,250.0,g,Ajo Entero BELL'S Pelado Bandeja,14.99,plaza_vea,Bandeja 250g,,AJÍ PIMIENTO
Salsa SPITZE Base de ají limo Frasco 165g,S/ 15.00,vivanda,AJÍ PIMIENTO,2024-12-04 17:53:47.250094,165.0,g,Salsa SPITZE Base de ají limo Frasco,15.0,vivanda,,SPITZE,AJÍ PIMIENTO
Salsa Ají Parrillero EL CHARRUA Frasco 200g,S/ 15.20,vivanda,AJÍ PIMIENTO,2024-12-04 17:53:47.250094,200.0,g,Salsa Ají Parrillero EL CHARRUA Frasco,15.2,vivanda,,EL CHARRUA,AJÍ PIMIENTO
Sal de Maras gruesa con ají panca molinillo 100 gr,S/ 15.20,tottus,AJÍ PIMIENTO,2024-12-04 13:36:25.534064,100.0,g,Sal de Maras gruesa con ají panca molinillo r,15.2,tottus,,TOTTUS,AJÍ PIMIENTO
Crocantinis Pimiento y Parmesano TABLA GOURMET Caja 160g,S/ 15.30,vivanda,AJÍ PIMIENTO,2024-12-04 17:53:47.250094,160.0,g,Crocantinis Pimiento y Parmesano TABLA GOURMET Caja,15.3,vivanda,,TABLA GOURMET,AJÍ PIMIENTO
Ajos Picados BELL'S Bandeja 200g,S/ 15.99 un,plaza_vea,AJÍ PIMIENTO,2024-12-04 14:04:33.354931,200.0,g,Ajos Picados BELL'S Bandeja,15.99,plaza_vea,Bandeja 200g,,AJÍ PIMIENTO
Salsa TABASCO Picante con ajíes rojos Botella ...,S/ 16.20 un,plaza_vea,AJÍ PIMIENTO,2024-12-04 14:04:33.354931,60.0,ml,Salsa TABASCO Picante con ajíes rojos Botella,16.2,plaza_vea,Botella 60ml,,AJÍ PIMIENTO
Pimiento Piquillo EL CORTE INGLÉS Asado y Ajillo Frasco 290g,S/ 16.90,vivanda,AJÍ PIMIENTO,2024-12-04 17:53:47.250094,290.0,g,Pimiento Piquillo EL CORTE INGLÉS Asado y Ajillo Frasco,16.9,vivanda,,EL CORTE INGLÉS,AJÍ PIMIENTO
Salsa Picante SABORES DE LA SELVA Ají Pipí de Mono Botella 90ml,S/ 18.00,vivanda,AJÍ PIMIENTO,2024-12-04 17:53:47.250094,90.0,ml,Salsa Picante SABORES DE LA SELVA Ají Pipí de Mono Botella,18.0,vivanda,,SABORES DE LA SELVA,AJÍ PIMIENTO
Ají Amarillo Molido SIBARITA Amarillin Doypack...,S/ 18.10 un,plaza_vea,AJÍ PIMIENTO,2024-12-04 14:04:33.354931,550.0,g,Ají Amarillo Molido SIBARITA Amarillin Doypack,18.1,plaza_vea,Doypack 550g,,AJÍ PIMIENTO
Ají Amarillo En Pasta Amarillin Doypack x 550 g,S/ 18.10,tottus,AJÍ PIMIENTO,2024-12-04 13:36:25.534064,550.0,g,Ají Amarillo En Pasta Amarillin Doypack x,18.1,tottus,,SIBARITA,AJÍ PIMIENTO
Sal de Maras ONZA Ají Panca Molinillo Frasco 80g,S/ 18.90,vivanda,AJÍ PIMIENTO,2024-12-04 17:53:47.250094,80.0,g,Sal de Maras ONZA Ají Panca Molinillo Frasco,18.9,vivanda,,ONZA,AJÍ PIMIENTO
Hummus de Pimiento Piquillo OLIVOS DEL SUR Frasco 220g,S/ 19.60,vivanda,AJÍ PIMIENTO,2024-12-04 17:53:47.250094,220.0,g,Hummus de Pimiento Piquillo OLIVOS DEL SUR Frasco,19.6,vivanda,,OLIVOS DEL SUR,AJÍ PIMIENTO
Aceituna Verde Rellena De Pimiento Envase x 350 g,S/ 20.65,tottus,AJÍ PIMIENTO,2024-12-04 13:36:25.534064,350.0,g,Aceituna Verde Rellena De Pimiento Envase x,20.65,tottus,,OLIVALLE,AJÍ PIMIENTO
Aceituna Verde Rellena con Pimiento OLIVALLE Balde 350g,S/ 21.40,vivanda,AJÍ PIMIENTO,2024-12-04 17:53:47.250094,350.0,g,Aceituna Verde Rellena con Pimiento OLIVALLE Balde,21.4,vivanda,,OLIVALLE,AJÍ PIMIENTO
Ají Amarillo Molido PIKI Doypack 1Kg,S/ 21.99 un,plaza_vea,AJÍ PIMIENTO,2024-12-04 14:04:33.354931,1.0,kg,Ají Amarillo Molido PIKI Doypack,21.99,plaza_vea,Doypack 1kg,,AJÍ PIMIENTO
Ají Panca Molido PIKI Doypack 1Kg,S/ 21.99 un,plaza_vea,AJÍ PIMIENTO,2024-12-04 14:04:33.354931,1.0,kg,Ají Panca Molido PIKI Doypack,21.99,plaza_vea,Doypack 1kg,,AJÍ PIMIENTO
Ajo Molido PIKI Doypack 1Kg,S/ 25.20 un,plaza_vea,AJÍ PIMIENTO,2024-12-04 14:04:33.354931,1.0,kg,Ajo Molido PIKI Doypack,25.2,plaza_vea,Doypack 1kg,,AJÍ PIMIENTO
Pimienta negra molida 198 g,S/ 34.50,tottus,AJÍ PIMIENTO,2024-12-04 13:36:25.534064,198.0,g,Pimienta negra molida,34.5,tottus,,BADIA,AJÍ PIMIENTO
Anís NAJAR Seco Especial Botella 750ml,S/ 36.90 un,plaza_vea,AJÍ PIMIENTO,2024-12-04 14:04:33.354931,750.0,ml,Anís NAJAR Seco Especial Botella,36.9,plaza_vea,Botella 750ml,,AJÍ PIMIENTO
Anís NAJAR Crema Especial Botella 750ml,S/ 41.90 un,plaza_vea,AJÍ PIMIENTO,2024-12-04 14:04:33.354931,750.0,ml,Anís NAJAR Crema Especial Botella,41.9,plaza_vea,Botella 750ml,,AJÍ PIMIENTO
