description,price,website,search_term,scrape_timestamp,cantidad,unidad,price_numeric,WEB,brand,CLASIFICACION
Bebida Gaseosa Backus Botella X300mL,S/ 1.20,tottus,BEBIDA HIDRATANTE,2024-12-04 14:01:16.732811,300.0,ml,1.2,tottus,GUARANA,BEBIDA HIDRATANTE
Bebida Rehidratante Electrolight Granadilla Botella 475 ml,S/ 2.10,metro,BEBIDA HIDRATANTE,2024-12-04 22:25:56.514517,475.0,ml,2.1,metro,,BEBIDA HIDRATANTE
Bebida Rehidratante Electrolight Granadilla Botella 475 ml,S/ 2.10,wong,BEBIDA HIDRATANTE,2024-12-04 20:53:27.835546,475.0,ml,2.1,wong,,BEBIDA HIDRATANTE
Bebida Rehidratante Electrolight Fresa Botella 473 ml,S/ 2.10,wong,BEBIDA HIDRATANTE,2024-12-04 20:53:27.835546,473.0,ml,2.1,wong,,BEBIDA HIDRATANTE
Bebida Rehidratante Electrolight Fresa Botella 473 ml,S/ 2.10,metro,BEBIDA HIDRATANTE,2024-12-04 22:25:56.514517,473.0,ml,2.1,metro,,BEBIDA HIDRATANTE
Bebida Rehidratante ELECTROLIGHT Mora Botella 475ml,S/ 2.10,vivanda,BEBIDA HIDRATANTE,2024-12-04 18:20:22.255946,475.0,ml,2.1,vivanda,ELECTROLIGHT,BEBIDA HIDRATANTE
Bebida Rehidratante Electrolight Piña Botella 475 ml,S/ 2.10,wong,BEBIDA HIDRATANTE,2024-12-04 20:53:27.835546,475.0,ml,2.1,wong,,BEBIDA HIDRATANTE
Cero Pina X 475 mL,S/ 2.20,tottus,BEBIDA HIDRATANTE,2024-12-04 14:01:16.732811,475.0,ml,2.2,tottus,ELECTROLIGHT,BEBIDA HIDRATANTE
REHIDRATANTE MARACUYA BOTELLA X 600ML,S/ 2.40,tottus,BEBIDA HIDRATANTE,2024-12-04 14:01:16.732811,600.0,ml,2.4,tottus,POWERADE,BEBIDA HIDRATANTE
REHIDRATANTE LIMON BOTELLA X600ML,S/ 2.40,tottus,BEBIDA HIDRATANTE,2024-12-04 14:01:16.732811,600.0,ml,2.4,tottus,POWERADE,BEBIDA HIDRATANTE
Bebida Rehidratante Powerade Maracuyá Botella 600ml,S/ 2.40,wong,BEBIDA HIDRATANTE,2024-12-04 20:53:27.835546,600.0,ml,2.4,wong,,BEBIDA HIDRATANTE
Uva 600 mL,S/ 2.40,tottus,BEBIDA HIDRATANTE,2024-12-04 14:01:16.732811,600.0,ml,2.4,tottus,POWERADE,BEBIDA HIDRATANTE
Bebida Rehidratante sin Azúcar SPORADE Apple Ice Botella 500ml,S/ 2.40,vivanda,BEBIDA HIDRATANTE,2024-12-04 18:20:22.255946,500.0,ml,2.4,vivanda,SPORADE,BEBIDA HIDRATANTE
Bebida Rehidratante Sabor Cool Blue 500 mL,S/ 2.40,tottus,BEBIDA HIDRATANTE,2024-12-04 14:01:16.732811,500.0,ml,2.4,tottus,GATORADE,BEBIDA HIDRATANTE
Rehidratante Powerade Uva Botella 600ml,S/ 2.40,wong,BEBIDA HIDRATANTE,2024-12-04 20:53:27.835546,600.0,ml,2.4,wong,,BEBIDA HIDRATANTE
Bebida Rehidratante SPORADE Tropical Botella 500ml,S/ 2.40,vivanda,BEBIDA HIDRATANTE,2024-12-04 18:20:22.255946,500.0,ml,2.4,vivanda,SPORADE,BEBIDA HIDRATANTE
Bebida Rehidratante SPORADE Mandarina Botella 500ml,S/ 2.40,vivanda,BEBIDA HIDRATANTE,2024-12-04 18:20:22.255946,500.0,ml,2.4,vivanda,SPORADE,BEBIDA HIDRATANTE
Bebida Rehidratante Sabor Mandarina 500 mL,S/ 2.40,tottus,BEBIDA HIDRATANTE,2024-12-04 14:01:16.732811,500.0,ml,2.4,tottus,GATORADE,BEBIDA HIDRATANTE
Bebida Rehidratante POWERADE Mora Azul Botella 600ml,S/ 2.40,vivanda,BEBIDA HIDRATANTE,2024-12-04 18:20:22.255946,600.0,ml,2.4,vivanda,POWERADE,BEBIDA HIDRATANTE
Bebida Rehidratante Powerade Multifrutas Botella 600ml,S/ 2.40,wong,BEBIDA HIDRATANTE,2024-12-04 20:53:27.835546,600.0,ml,2.4,wong,,BEBIDA HIDRATANTE
Bebida Rehidratante Powerade Limón Botella 600ml,S/ 2.40,metro,BEBIDA HIDRATANTE,2024-12-04 22:25:56.514517,600.0,ml,2.4,metro,,BEBIDA HIDRATANTE
Bebida Rehidratante Tropical 500 mL,S/ 2.40,tottus,BEBIDA HIDRATANTE,2024-12-04 14:01:16.732811,500.0,ml,2.4,tottus,SPORADE,BEBIDA HIDRATANTE
Bebida Rehidratante POWERADE Maracuyá Botella 600ml,S/ 2.40,vivanda,BEBIDA HIDRATANTE,2024-12-04 18:20:22.255946,600.0,ml,2.4,vivanda,POWERADE,BEBIDA HIDRATANTE
Bebida Rehidratante SPORADE Tropical Botella 475ml,S/ 2.40,vivanda,BEBIDA HIDRATANTE,2024-12-04 18:20:22.255946,475.0,ml,2.4,vivanda,SPORADE,BEBIDA HIDRATANTE
Bebida Rehidratante Gatorade Mandarina Botella 500ml,S/ 2.40,metro,BEBIDA HIDRATANTE,2024-12-04 22:25:56.514517,500.0,ml,2.4,metro,,BEBIDA HIDRATANTE
Bebida Rehidratante Sin Azúcar Sporade Apple Ice Botella 500ml,S/ 2.40,metro,BEBIDA HIDRATANTE,2024-12-04 22:25:56.514517,500.0,ml,2.4,metro,,BEBIDA HIDRATANTE
Bebida Rehidratante Sin Azúcar Sporade Apple Ice Botella 500ml,S/ 2.40,wong,BEBIDA HIDRATANTE,2024-12-04 20:53:27.835546,500.0,ml,2.4,wong,,BEBIDA HIDRATANTE
Bebida Rehidratante Sin Azúcar Sporade Tropical Botella 500ml,S/ 2.40,metro,BEBIDA HIDRATANTE,2024-12-04 22:25:56.514517,500.0,ml,2.4,metro,,BEBIDA HIDRATANTE
Bebida Rehidratante Powerade Multifrutas Botella 600ml,S/ 2.40,metro,BEBIDA HIDRATANTE,2024-12-04 22:25:56.514517,600.0,ml,2.4,metro,,BEBIDA HIDRATANTE
Bebida Rehidratante Sporade Blueberry Botella 500 ml,S/ 2.40,wong,BEBIDA HIDRATANTE,2024-12-04 20:53:27.835546,500.0,ml,2.4,wong,,BEBIDA HIDRATANTE
Bebida Rehidratante Sporade Uva Botella 500ml,S/ 2.40,metro,BEBIDA HIDRATANTE,2024-12-04 22:25:56.514517,500.0,ml,2.4,metro,,BEBIDA HIDRATANTE
Bebida Rehidratante Sporade Uva Botella 500ml,S/ 2.40,wong,BEBIDA HIDRATANTE,2024-12-04 20:53:27.835546,500.0,ml,2.4,wong,,BEBIDA HIDRATANTE
Bebida Rehidratante Powerade Limón Botella 600ml,S/ 2.40,wong,BEBIDA HIDRATANTE,2024-12-04 20:53:27.835546,600.0,ml,2.4,wong,,BEBIDA HIDRATANTE
Bebida Rehidratante Gatorade Cool Blue Botella 500ml,S/ 2.40,wong,BEBIDA HIDRATANTE,2024-12-04 20:53:27.835546,500.0,ml,2.4,wong,,BEBIDA HIDRATANTE
Bebida Rehidratante SPORADE Sabor a Uva Botella 500ml,S/ 2.40,vivanda,BEBIDA HIDRATANTE,2024-12-04 18:20:22.255946,500.0,ml,2.4,vivanda,SPORADE,BEBIDA HIDRATANTE
Bebida Rehidratante Gatorade Mandarina Botella 500ml,S/ 2.40,wong,BEBIDA HIDRATANTE,2024-12-04 20:53:27.835546,500.0,ml,2.4,wong,,BEBIDA HIDRATANTE
Bebida Rehidratante Powerade Maracuyá Botella 600ml,S/ 2.40,metro,BEBIDA HIDRATANTE,2024-12-04 22:25:56.514517,600.0,ml,2.4,metro,,BEBIDA HIDRATANTE
Bebida Rehidratante Sporade Tropical Botella 500ml,S/ 2.40,metro,BEBIDA HIDRATANTE,2024-12-04 22:25:56.514517,500.0,ml,2.4,metro,,BEBIDA HIDRATANTE
Bebida Rehidratante Powerade Mora Botella 600ml,S/ 2.40,metro,BEBIDA HIDRATANTE,2024-12-04 22:25:56.514517,600.0,ml,2.4,metro,,BEBIDA HIDRATANTE
Bebida Rehidratante Sporade Mandarina Botella 500 ml,S/ 2.40,metro,BEBIDA HIDRATANTE,2024-12-04 22:25:56.514517,500.0,ml,2.4,metro,,BEBIDA HIDRATANTE
Bebida Rehidratante Blueberry 500 mL,S/ 2.40,tottus,BEBIDA HIDRATANTE,2024-12-04 14:01:16.732811,500.0,ml,2.4,tottus,SPORADE,BEBIDA HIDRATANTE
Bebida Energizante 300 mL,S/ 2.49,tottus,BEBIDA HIDRATANTE,2024-12-04 14:01:16.732811,300.0,ml,2.49,tottus,VOLT,BEBIDA HIDRATANTE
Chicha Morada 500 mL,S/ 2.50,tottus,BEBIDA HIDRATANTE,2024-12-04 14:01:16.732811,500.0,ml,2.5,tottus,TOTTUS,BEBIDA HIDRATANTE
Bebida de té negro sabor frutos rojos 500 mL,S/ 2.50,tottus,BEBIDA HIDRATANTE,2024-12-04 14:01:16.732811,500.0,ml,2.5,tottus,FREE TEA,BEBIDA HIDRATANTE
Bebida De Durazno 500 mL,S/ 2.50,tottus,BEBIDA HIDRATANTE,2024-12-04 14:01:16.732811,500.0,ml,2.5,tottus,GLORIA,BEBIDA HIDRATANTE
Bebida Rehidratante GATORADE Blue Botella 500ml,S/ 2.50,vega,BEBIDA HIDRATANTE,2024-12-04 14:49:03.098549,500.0,ml,2.5,vega,Gatorade,BEBIDA HIDRATANTE
Bebida con leche sabor a chocolate 800 mL,S/ 2.90,tottus,BEBIDA HIDRATANTE,2024-12-04 14:01:16.732811,800.0,ml,2.9,tottus,LA PREFERIDA,BEBIDA HIDRATANTE
Bebida Rehidratante GATORADE Tropical Fruit Botella 500ml,S/ 2.90,vivanda,BEBIDA HIDRATANTE,2024-12-04 18:20:22.255946,500.0,ml,2.9,vivanda,GATORADE,BEBIDA HIDRATANTE
Bebida Rehidratante GATORADE Cool Blue Botella 500ml,S/ 2.90,vivanda,BEBIDA HIDRATANTE,2024-12-04 18:20:22.255946,500.0,ml,2.9,vivanda,GATORADE,BEBIDA HIDRATANTE
Bebida Rehidratante Gatorade Tropical Botella 1 Litro,S/ 3.60,wong,BEBIDA HIDRATANTE,2024-12-04 20:53:27.835546,1.0,l,3.6,wong,,BEBIDA HIDRATANTE
Bebida Choco 800 mL,S/ 3.90,tottus,BEBIDA HIDRATANTE,2024-12-04 14:01:16.732811,800.0,ml,3.9,tottus,VIGOR,BEBIDA HIDRATANTE
Bebida Sabor Mango 1 L,S/ 3.90,tottus,BEBIDA HIDRATANTE,2024-12-04 14:01:16.732811,1.0,l,3.9,tottus,WATTS,BEBIDA HIDRATANTE
Bebida Rehidratante SPORADE Tropical Botella 1L,S/ 3.90,vivanda,BEBIDA HIDRATANTE,2024-12-04 18:20:22.255946,1.0,l,3.9,vivanda,SPORADE,BEBIDA HIDRATANTE
Agua Mineral Sin Gas 2.5 L,S/ 3.90,tottus,BEBIDA HIDRATANTE,2024-12-04 14:01:16.732811,2.5,l,3.9,tottus,SAN MATEO,BEBIDA HIDRATANTE
BEBIDA NARANJA X 970ML,S/ 3.90,tottus,BEBIDA HIDRATANTE,2024-12-04 14:01:16.732811,970.0,ml,3.9,tottus,FRUGOS DEL VALLE,BEBIDA HIDRATANTE
Bebida Rehidratante Sporade Tropical Botella 1L,S/ 3.90,metro,BEBIDA HIDRATANTE,2024-12-04 22:25:56.514517,1.0,l,3.9,metro,,BEBIDA HIDRATANTE
Bebida Rehidratante POWERADE Mora Azul Botella 1L,S/ 4.00,vivanda,BEBIDA HIDRATANTE,2024-12-04 18:20:22.255946,1.0,l,4.0,vivanda,POWERADE,BEBIDA HIDRATANTE
Bebida Rehidratante POWERADE Multifrutas Botella 1L,S/ 4.00,vivanda,BEBIDA HIDRATANTE,2024-12-04 18:20:22.255946,1.0,l,4.0,vivanda,POWERADE,BEBIDA HIDRATANTE
Bebida Rehidratante Powerade Multifrutas Botella 1L,S/ 4.10,wong,BEBIDA HIDRATANTE,2024-12-04 20:53:27.835546,1.0,l,4.1,wong,,BEBIDA HIDRATANTE
Bebida Sabor Durazno 1 Lt Botella,S/ 4.50,tottus,BEBIDA HIDRATANTE,2024-12-04 14:01:16.732811,1.0,l,4.5,tottus,FRUGOS DEL VALLE,BEBIDA HIDRATANTE
Chicha Morada 1 L,S/ 4.80,tottus,BEBIDA HIDRATANTE,2024-12-04 14:01:16.732811,1.0,l,4.8,tottus,TOTTUS,BEBIDA HIDRATANTE
BEBIDA DE MANGO CAJA 1L,S/ 4.90,tottus,BEBIDA HIDRATANTE,2024-12-04 14:01:16.732811,1.0,l,4.9,tottus,GLORIA,BEBIDA HIDRATANTE
BEBIDA BEAUTI DRINK BEAUTITOX 360 ML,S/ 4.90,tottus,BEBIDA HIDRATANTE,2024-12-04 14:01:16.732811,360.0,ml,4.9,tottus,SAPPE,BEBIDA HIDRATANTE
Bebida Rehidratante Tropical 1.5 L,S/ 4.90,tottus,BEBIDA HIDRATANTE,2024-12-04 14:01:16.732811,1.5,l,4.9,tottus,SPORADE,BEBIDA HIDRATANTE
Bebida de Piña 1 L,S/ 4.90,tottus,BEBIDA HIDRATANTE,2024-12-04 14:01:16.732811,1.0,l,4.9,tottus,GLORIA,BEBIDA HIDRATANTE
Bebida Rehidratante GATORADE Sabor a Mandarina Botella 750ml,S/ 4.90,vivanda,BEBIDA HIDRATANTE,2024-12-04 18:20:22.255946,750.0,ml,4.9,vivanda,GATORADE,BEBIDA HIDRATANTE
Bebida Rehidratante Gatorade Mandarina Botella 750ml,S/ 4.99,metro,BEBIDA HIDRATANTE,2024-12-04 22:25:56.514517,750.0,ml,4.99,metro,,BEBIDA HIDRATANTE
Bebida Rehidratante Gatorade Apple Ice Botella 750ml,S/ 4.99,metro,BEBIDA HIDRATANTE,2024-12-04 22:25:56.514517,750.0,ml,4.99,metro,,BEBIDA HIDRATANTE
Bebida Rehidratante Gatorade Tropical Botella 750ml,S/ 4.99,metro,BEBIDA HIDRATANTE,2024-12-04 22:25:56.514517,750.0,ml,4.99,metro,,BEBIDA HIDRATANTE
Bebida Rehidratante GATORADE Gatorlyte Uva 591ml,S/ 5.00,vivanda,BEBIDA HIDRATANTE,2024-12-04 18:20:22.255946,591.0,ml,5.0,vivanda,GATORADE,BEBIDA HIDRATANTE
Bebida Rehidratante Gatorade Mandarina Botella 750ml,S/ 5.10,wong,BEBIDA HIDRATANTE,2024-12-04 20:53:27.835546,750.0,ml,5.1,wong,,BEBIDA HIDRATANTE
Bebida Rehidratante Gatorade Tropical Botella 750ml,S/ 5.10,wong,BEBIDA HIDRATANTE,2024-12-04 20:53:27.835546,750.0,ml,5.1,wong,,BEBIDA HIDRATANTE
Bebida Rehidratante Gatorlit Recover Fresa Kiwi Botella 591ml,S/ 5.50,wong,BEBIDA HIDRATANTE,2024-12-04 20:53:27.835546,591.0,ml,5.5,wong,,BEBIDA HIDRATANTE
Bebida Rehidratante POWERADE Frutas Botella 1.5L,S/ 5.50,vivanda,BEBIDA HIDRATANTE,2024-12-04 18:20:22.255946,1.5,l,5.5,vivanda,POWERADE,BEBIDA HIDRATANTE
Bebida Rehidratante SPORADE Tropical Electrolitos Botella 1.5L,S/ 5.50,vivanda,BEBIDA HIDRATANTE,2024-12-04 18:20:22.255946,1.5,l,5.5,vivanda,SPORADE,BEBIDA HIDRATANTE
Bebida Rehidratante SPORADE Blueberry Botella 1.5L,S/ 5.50,vivanda,BEBIDA HIDRATANTE,2024-12-04 18:20:22.255946,1.5,l,5.5,vivanda,SPORADE,BEBIDA HIDRATANTE
Bebida Rehidratante Powerade Multifrutas Botella 1.5L,S/ 5.50,metro,BEBIDA HIDRATANTE,2024-12-04 22:25:56.514517,1.5,l,5.5,metro,,BEBIDA HIDRATANTE
Bebida Rehidratante Powerade Mora Botella 1.5L,S/ 5.50,wong,BEBIDA HIDRATANTE,2024-12-04 20:53:27.835546,1.5,l,5.5,wong,,BEBIDA HIDRATANTE
Bebida Rehidratante Powerade Multifrutas Botella 1.5L,S/ 5.50,wong,BEBIDA HIDRATANTE,2024-12-04 20:53:27.835546,1.5,l,5.5,wong,,BEBIDA HIDRATANTE
REHIDRATANTE MORA BOTELLA X 1.5L,S/ 5.50,tottus,BEBIDA HIDRATANTE,2024-12-04 14:01:16.732811,1.5,l,5.5,tottus,POWERADE,BEBIDA HIDRATANTE
Bebida Rehidratante Powerade Mora Botella 1.5L,S/ 5.50,metro,BEBIDA HIDRATANTE,2024-12-04 22:25:56.514517,1.5,l,5.5,metro,,BEBIDA HIDRATANTE
Bebida Sabor Manzana 1.5 Lt Caja,S/ 5.50,tottus,BEBIDA HIDRATANTE,2024-12-04 14:01:16.732811,1.5,l,5.5,tottus,FRUGOS DEL VALLE,BEBIDA HIDRATANTE
Bebida Rehidratante POWERADE Mora Botella 1.5L,S/ 5.50,vivanda,BEBIDA HIDRATANTE,2024-12-04 18:20:22.255946,1.5,l,5.5,vivanda,POWERADE,BEBIDA HIDRATANTE
Rehidratante Sporade Pet 1.5L Tropical,S/ 5.60,wong,BEBIDA HIDRATANTE,2024-12-04 20:53:27.835546,1.5,l,5.6,wong,,BEBIDA HIDRATANTE
Bebida Life SOS Relax Lata 355ml,S/ 5.90,wong,BEBIDA HIDRATANTE,2024-12-04 20:53:27.835546,1.0,l,5.9,wong,,BEBIDA HIDRATANTE
Bebida Rehidratante Life SOS Recovery Tropical Lata 355ml,S/ 5.90,wong,BEBIDA HIDRATANTE,2024-12-04 20:53:27.835546,355.0,ml,5.9,wong,,BEBIDA HIDRATANTE
BEBIDA FRUGOS VALLE FRESH FRUIT PUNCH BOT X 3L,S/ 5.90,tottus,BEBIDA HIDRATANTE,2024-12-04 14:01:16.732811,3.0,l,5.9,tottus,FRUGOS DEL VALLE,BEBIDA HIDRATANTE
BEBIDA DE NARANJA CAJA 1.5L,S/ 5.90,tottus,BEBIDA HIDRATANTE,2024-12-04 14:01:16.732811,1.5,l,5.9,tottus,GLORIA,BEBIDA HIDRATANTE
Bebida Frugos Fresh Naranja de 3 L,S/ 5.90,tottus,BEBIDA HIDRATANTE,2024-12-04 14:01:16.732811,3.0,l,5.9,tottus,FRUGOS DEL VALLE,BEBIDA HIDRATANTE
Bebida de Aloe Vera con sabor a piña de 300 mL,S/ 5.90,tottus,BEBIDA HIDRATANTE,2024-12-04 14:01:16.732811,300.0,ml,5.9,tottus,SAPPE,BEBIDA HIDRATANTE
Bebida Rehidratante Flashlyte Fresa Botella 625ml,S/ 6.00,wong,BEBIDA HIDRATANTE,2024-12-04 20:53:27.835546,625.0,ml,6.0,wong,,BEBIDA HIDRATANTE
BEBIDA ELECTROL FLASHLYTE FRESA BOT625ML,S/ 6,tottus,BEBIDA HIDRATANTE,2024-12-04 14:01:16.732811,625.0,ml,6.0,tottus,,BEBIDA HIDRATANTE
BEBIDA ELECTROL FLASHLYTE UVA BOT X625ML,S/ 6,tottus,BEBIDA HIDRATANTE,2024-12-04 14:01:16.732811,625.0,ml,6.0,tottus,,BEBIDA HIDRATANTE
Bebida Rehidratante SUEROX Sabor a Manzana Botella 630ml,S/ 6.50,vivanda,BEBIDA HIDRATANTE,2024-12-04 18:20:22.255946,630.0,ml,6.5,vivanda,SUEROX,BEBIDA HIDRATANTE
Bebida Rehidratante Suerox Sabor Naranja - Mandarina Botella 630ml,S/ 6.50,wong,BEBIDA HIDRATANTE,2024-12-04 20:53:27.835546,630.0,ml,6.5,wong,,BEBIDA HIDRATANTE
Bebida Rehidratante Suerox Sabor Naranja - Mandarina Botella 630ml,S/ 6.50,metro,BEBIDA HIDRATANTE,2024-12-04 22:25:56.514517,630.0,ml,6.5,metro,,BEBIDA HIDRATANTE
Bebida Rehidratante Suerox Kiwi Botella 630ml,S/ 6.50,metro,BEBIDA HIDRATANTE,2024-12-04 22:25:56.514517,630.0,ml,6.5,metro,,BEBIDA HIDRATANTE
Bebida Rehidratante Suerox Mora Azul Botella 630ml,S/ 6.50,metro,BEBIDA HIDRATANTE,2024-12-04 22:25:56.514517,630.0,ml,6.5,metro,,BEBIDA HIDRATANTE
"REHIDRATANTE SUEROX 630ML , FRUTOS ROJOS",S/ 6.50,wong,BEBIDA HIDRATANTE,2024-12-04 20:53:27.835546,630.0,ml,6.5,wong,,BEBIDA HIDRATANTE
Rehidratante Fresa Kiwi 630 mL,S/ 6.50,tottus,BEBIDA HIDRATANTE,2024-12-04 14:01:16.732811,630.0,ml,6.5,tottus,SUEROX,BEBIDA HIDRATANTE
ADULTO FRUTOS ROJOS 630 ML,S/ 6.50,tottus,BEBIDA HIDRATANTE,2024-12-04 14:01:16.732811,630.0,ml,6.5,tottus,SUEROX,BEBIDA HIDRATANTE
Bebida de Aloe Vera con sabor a uva baja en azúcar de 300 mL,S/ 6.50,tottus,BEBIDA HIDRATANTE,2024-12-04 14:01:16.732811,300.0,ml,6.5,tottus,SAPPE,BEBIDA HIDRATANTE
Bebida Rehidratante Suerox Kiwi Botella 630ml,S/ 6.50,wong,BEBIDA HIDRATANTE,2024-12-04 20:53:27.835546,630.0,ml,6.5,wong,,BEBIDA HIDRATANTE
Bebida Rehidratante Suerox Mora Azul Botella 630ml,S/ 6.50,wong,BEBIDA HIDRATANTE,2024-12-04 20:53:27.835546,630.0,ml,6.5,wong,,BEBIDA HIDRATANTE
Ginger Ale 1.5 L,S/ 6.60,tottus,BEBIDA HIDRATANTE,2024-12-04 14:01:16.732811,1.5,l,6.6,tottus,SCHWEPPES,BEBIDA HIDRATANTE
Bebida con Electrolitos Electrolife Uva Botella 625ml,S/ 6.90,wong,BEBIDA HIDRATANTE,2024-12-04 20:53:27.835546,625.0,ml,6.9,wong,,BEBIDA HIDRATANTE
Bebida con Electrolitos Electrolife Fresa Kiwi Botella 625ml,S/ 6.90,wong,BEBIDA HIDRATANTE,2024-12-04 20:53:27.835546,625.0,ml,6.9,wong,,BEBIDA HIDRATANTE
Bebida con Electrolitos Electrolife Fresa Botella 625ml,S/ 6.90,wong,BEBIDA HIDRATANTE,2024-12-04 20:53:27.835546,625.0,ml,6.9,wong,,BEBIDA HIDRATANTE
Bebida Energizante Energy Ultra 473 mL,S/ 8,tottus,BEBIDA HIDRATANTE,2024-12-04 14:01:16.732811,473.0,ml,8.0,tottus,MONSTER,BEBIDA HIDRATANTE
Electrolight 3 Sabores Six Pack Botella 475 ml c/u - ELECTRO 6P 3 SAB,S/ 9.60,wong,BEBIDA HIDRATANTE,2024-12-04 20:53:27.835546,475.0,ml,9.6,wong,,BEBIDA HIDRATANTE
Bebida Rehidratante Sporade Pack Surtido 6un x 500ml,S/ 9.90,metro,BEBIDA HIDRATANTE,2024-12-04 22:25:56.514517,6.0,un,9.9,metro,,BEBIDA HIDRATANTE
Bebida Rehidratante Sporade Pack Surtido 6un x 500ml,S/ 9.90,wong,BEBIDA HIDRATANTE,2024-12-04 20:53:27.835546,6.0,un,9.9,wong,,BEBIDA HIDRATANTE
Bebida Energizante Regular Pack 6 Unidades 300 mL,S/ 9.90,tottus,BEBIDA HIDRATANTE,2024-12-04 14:01:16.732811,6.0,un,9.9,tottus,VOLT,BEBIDA HIDRATANTE
Two Pack Gaseosa Ginger Ale 1.5 L,S/ 9.90,tottus,BEBIDA HIDRATANTE,2024-12-04 14:01:16.732811,1.5,l,9.9,tottus,SCHWEPPES,BEBIDA HIDRATANTE
Bebida Rehidratante SPORADE Sabores Surtidos Botella 500ml Paquete 6un,S/ 9.90,vivanda,BEBIDA HIDRATANTE,2024-12-04 18:20:22.255946,500.0,ml,9.9,vivanda,SPORADE,BEBIDA HIDRATANTE
Tropical Pack 6 Unidades 500 mL,S/ 10.90,tottus,BEBIDA HIDRATANTE,2024-12-04 14:01:16.732811,6.0,un,10.9,tottus,GATORADE,BEBIDA HIDRATANTE
Bebida Rehidratante Gatorade Monosabor Pack 6 Unid x 500ml,S/ 10.90,wong,BEBIDA HIDRATANTE,2024-12-04 20:53:27.835546,6.0,un,10.9,wong,,BEBIDA HIDRATANTE
Bebida Rehidratante Gatorade Pack 6 Unid x 500ml,S/ 10.90,wong,BEBIDA HIDRATANTE,2024-12-04 20:53:27.835546,6.0,un,10.9,wong,,BEBIDA HIDRATANTE
Sixpack Rehidratante Powerade Mora Botella 600ml,S/ 11.40,wong,BEBIDA HIDRATANTE,2024-12-04 20:53:27.835546,600.0,ml,11.4,wong,,BEBIDA HIDRATANTE
Sixpack Rehidratante Powerade Multifrutas Botella 600ml,S/ 11.40,wong,BEBIDA HIDRATANTE,2024-12-04 20:53:27.835546,600.0,ml,11.4,wong,,BEBIDA HIDRATANTE
Sixpack Bebida Rehidratante Powerade Multisabores Botella 600ml,S/ 11.40,wong,BEBIDA HIDRATANTE,2024-12-04 20:53:27.835546,600.0,ml,11.4,wong,,BEBIDA HIDRATANTE
Sixpack Bebida Rehidratante Powerade Uva Botella 600ml,S/ 11.40,wong,BEBIDA HIDRATANTE,2024-12-04 20:53:27.835546,600.0,ml,11.4,wong,,BEBIDA HIDRATANTE
Sixpack Rehidratante Powerade Multifrutas Botella 600ml,S/ 11.40,metro,BEBIDA HIDRATANTE,2024-12-04 22:25:56.514517,600.0,ml,11.4,metro,,BEBIDA HIDRATANTE
Sixpack Rehidratante Powerade Mora Botella 600ml,S/ 11.40,metro,BEBIDA HIDRATANTE,2024-12-04 22:25:56.514517,600.0,ml,11.4,metro,,BEBIDA HIDRATANTE
6PACK REHIDRATANTE MULTIFRUTAS 600ML,S/ 11.40,tottus,BEBIDA HIDRATANTE,2024-12-04 14:01:16.732811,600.0,ml,11.4,tottus,POWERADE,BEBIDA HIDRATANTE
Sixpack Bebida Rehidratante Powerade Surtido Mix 600ml,S/ 11.40,wong,BEBIDA HIDRATANTE,2024-12-04 20:53:27.835546,600.0,ml,11.4,wong,,BEBIDA HIDRATANTE
Twelve Pack de Bebida de Durazno Forti Hierro de 145 mL,S/ 11.50,tottus,BEBIDA HIDRATANTE,2024-12-04 14:01:16.732811,145.0,ml,11.5,tottus,PULP,BEBIDA HIDRATANTE
Bebida Rehidratante GATORADE Sabores Surtidos Botella 500ml Paquete 6un,S/ 12.70,vivanda,BEBIDA HIDRATANTE,2024-12-04 18:20:22.255946,500.0,ml,12.7,vivanda,GATORADE,BEBIDA HIDRATANTE
Bebida Rehidratante GATORADE Tropical Fruit Botella 500ml Paquete 6un,S/ 12.70,vivanda,BEBIDA HIDRATANTE,2024-12-04 18:20:22.255946,500.0,ml,12.7,vivanda,GATORADE,BEBIDA HIDRATANTE
Bebida Rehidratante Gatorade Pack 6 Unid x 500ml,S/ 12.90,metro,BEBIDA HIDRATANTE,2024-12-04 22:25:56.514517,6.0,un,12.9,metro,,BEBIDA HIDRATANTE
Sin gas 20 unidades de 500 mL,S/ 12.90,tottus,BEBIDA HIDRATANTE,2024-12-04 14:01:16.732811,20.0,un,12.9,tottus,SAN CARLOS,BEBIDA HIDRATANTE
Bebida Rehidratante BODY ARMOR Fruit Punch Botella 16oz,S/ 14.90,vivanda,BEBIDA HIDRATANTE,2024-12-04 18:20:22.255946,16.0,oz,14.9,vivanda,BODY ARMOR,BEBIDA HIDRATANTE
Bebida Rehidratante BODY ARMOR Tropical Punch Botella 16oz,S/ 14.90,vivanda,BEBIDA HIDRATANTE,2024-12-04 18:20:22.255946,16.0,oz,14.9,vivanda,BODY ARMOR,BEBIDA HIDRATANTE
Bebida Rehidratante BODY ARMOR Orange Mango Botella 16oz,S/ 14.90,vivanda,BEBIDA HIDRATANTE,2024-12-04 18:20:22.255946,16.0,oz,14.9,vivanda,BODY ARMOR,BEBIDA HIDRATANTE
Pack de Agua Sin Gas 6 Unidades 2.5 L,S/ 14.90,tottus,BEBIDA HIDRATANTE,2024-12-04 14:01:16.732811,6.0,un,14.9,tottus,SAN LUIS,BEBIDA HIDRATANTE
Pack de Agua sin Gas de 15 unidades,S/ 17.90,tottus,BEBIDA HIDRATANTE,2024-12-04 14:01:16.732811,15.0,un,17.9,tottus,SAN LUIS,BEBIDA HIDRATANTE
Pack 12 Bebida Rehidratante SPORADE Mandarina Botella 500ml,S/ 18.00 32%,vega,BEBIDA HIDRATANTE,2024-12-04 14:49:03.098549,500.0,ml,18.0,vega,Sporade,BEBIDA HIDRATANTE
Pack 12 Energizante VOLT Botella 300ml,S/ 18.49 30%,vega,BEBIDA HIDRATANTE,2024-12-04 14:49:03.098549,300.0,ml,18.49,vega,Volt,BEBIDA HIDRATANTE
Fourpack Bebida Rehidratante Suerox Mora Botella 630ml,S/ 19.50,wong,BEBIDA HIDRATANTE,2024-12-04 20:53:27.835546,630.0,ml,19.5,wong,,BEBIDA HIDRATANTE
Fourpack Bebida Rehidratante Suerox Fresa Botella 630ml,S/ 19.50,wong,BEBIDA HIDRATANTE,2024-12-04 20:53:27.835546,630.0,ml,19.5,wong,,BEBIDA HIDRATANTE
Four Pack Rehidratante Fresa Kiwi 630 mL,S/ 19.50,tottus,BEBIDA HIDRATANTE,2024-12-04 14:01:16.732811,630.0,ml,19.5,tottus,SUEROX,BEBIDA HIDRATANTE
Bebida Rehidratante SUEROX Fresa Botella 630ml Paquete 4un,S/ 19.50,vivanda,BEBIDA HIDRATANTE,2024-12-04 18:20:22.255946,630.0,ml,19.5,vivanda,SUEROX,BEBIDA HIDRATANTE
Pack x12 Sporade Surtido Pet 500ml,S/ 19.50,wong,BEBIDA HIDRATANTE,2024-12-04 20:53:27.835546,500.0,ml,19.5,wong,,BEBIDA HIDRATANTE
Fourpack Bebida Rehidratante Suerox Mix Botella 630ml,S/ 19.50,wong,BEBIDA HIDRATANTE,2024-12-04 20:53:27.835546,630.0,ml,19.5,wong,,BEBIDA HIDRATANTE
Gaseosa Coca-Cola Original 3 Lt Twopack,S/ 20.50,tottus,BEBIDA HIDRATANTE,2024-12-04 14:01:16.732811,3.0,l,20.5,tottus,COCA COLA,BEBIDA HIDRATANTE
+ Inca Kola Two Pack 2 Unidades 3 L,S/ 20.50,tottus,BEBIDA HIDRATANTE,2024-12-04 14:01:16.732811,2.0,un,20.5,tottus,COCA COLA,BEBIDA HIDRATANTE
Two Pack Gaseosa Sabor Original 3 L,S/ 20.50,tottus,BEBIDA HIDRATANTE,2024-12-04 14:01:16.732811,3.0,l,20.5,tottus,INCA KOLA,BEBIDA HIDRATANTE
Agua Mineral sin gas 20 L,S/ 24.50,tottus,BEBIDA HIDRATANTE,2024-12-04 14:01:16.732811,20.0,l,24.5,tottus,SAN LUIS,BEBIDA HIDRATANTE
Four Pack de Bebida Energizante Sin Azúcar de 250 mL,S/ 28.50,tottus,BEBIDA HIDRATANTE,2024-12-04 14:01:16.732811,250.0,ml,28.5,tottus,RED BULL,BEBIDA HIDRATANTE
Bebida Energizante Pack 4 Unidades 250 mL,S/ 28.50,tottus,BEBIDA HIDRATANTE,2024-12-04 14:01:16.732811,4.0,un,28.5,tottus,RED BULL,BEBIDA HIDRATANTE
Gaseosa: 1 Inca Kola 3 L + 2 Coca-Cola Sabor Original 3 L,S/ 30.30,tottus,BEBIDA HIDRATANTE,2024-12-04 14:01:16.732811,3.0,l,30.3,tottus,COCA COLA,BEBIDA HIDRATANTE
Pack de Gaseosa Coca-Cola Sabor Original 3 L + Inka Kola Sabor Original 3 L,S/ 30.30,tottus,BEBIDA HIDRATANTE,2024-12-04 14:01:16.732811,3.0,l,30.3,tottus,INCA KOLA,BEBIDA HIDRATANTE
Pack 12 Energizante VOLT Maca Botella 300ml,,vega,BEBIDA HIDRATANTE,2024-12-04 14:49:03.098549,300.0,ml,,vega,Volt,BEBIDA HIDRATANTE
