description,price,website,search_term,scrape_timestamp,cantidad,unidad,description_no_unit,price_numeric,WEB,brand,CLASIFICACION
Fourpack Bebida Rehidratante Suerox Mora Botella 630ml,S/ 19.50,wong,BEBIDA HIDRATANTE,2024-12-04 20:53:27.835546,630.0,ml,Fourpack Bebida Rehidratante Suerox Mora Botella,19.5,wong,,BEBIDA HIDRATANTE
Bebida Rehidratante SUEROX Surtido Botella 630ml Paquete 4un,S/ 19.50,vivanda,BEBIDA HIDRATANTE,2024-12-04 18:20:22.255946,630.0,ml,Bebida Rehidratante SUEROX Surtido Botella  Paquete,19.5,vivanda,SUEROX,BEBIDA HIDRATANTE
Fourpack Bebida Rehidratante Suerox Fresa Botella 630ml,S/ 19.50,wong,BEBIDA HIDRATANTE,2024-12-04 20:53:27.835546,630.0,ml,Fourpack Bebida Rehidratante Suerox Fresa Botella,19.5,wong,,BEBIDA HIDRATANTE
Four Pack Rehidratante Fresa Kiwi 630 mL,S/ 19.50,tottus,BEBIDA HIDRATANTE,2024-12-04 14:01:16.732811,630.0,ml,Four Pack Rehidratante Fresa Kiwi,19.5,tottus,SUEROX,BEBIDA HIDRATANTE
Pack x12 Sporade Surtido Pet 500ml,S/ 19.50,metro,BEBIDA HIDRATANTE,2024-12-04 22:25:56.514517,500.0,ml,Pack x12 Sporade Surtido Pet,19.5,metro,,BEBIDA HIDRATANTE
Bebida Rehidratante SUEROX Fresa Botella 630ml Paquete 4un,S/ 19.50,vivanda,BEBIDA HIDRATANTE,2024-12-04 18:20:22.255946,630.0,ml,Bebida Rehidratante SUEROX Fresa Botella  Paquete,19.5,vivanda,SUEROX,BEBIDA HIDRATANTE
Fourpack Bebida Rehidratante Suerox Mora Botella 630ml,S/ 19.50,metro,BEBIDA HIDRATANTE,2024-12-04 22:25:56.514517,630.0,ml,Fourpack Bebida Rehidratante Suerox Mora Botella,19.5,metro,,BEBIDA HIDRATANTE
Pack x12 Sporade Surtido Pet 500ml,S/ 19.50,wong,BEBIDA HIDRATANTE,2024-12-04 20:53:27.835546,500.0,ml,Pack x12 Sporade Surtido Pet,19.5,wong,,BEBIDA HIDRATANTE
Fourpack Bebida Rehidratante Suerox Mix Botella 630ml,S/ 19.50,wong,BEBIDA HIDRATANTE,2024-12-04 20:53:27.835546,630.0,ml,Fourpack Bebida Rehidratante Suerox Mix Botella,19.5,wong,,BEBIDA HIDRATANTE
Gaseosa Coca-Cola Original 3 Lt Twopack,S/ 20.50,tottus,BEBIDA HIDRATANTE,2024-12-04 14:01:16.732811,3.0,l,Gaseosa Coca-Cola Original t Twopack,20.5,tottus,COCA COLA,BEBIDA HIDRATANTE
Agua Mineral sin gas 20 L,S/ 24.50,tottus,BEBIDA HIDRATANTE,2024-12-04 14:01:16.732811,20.0,l,Agua Mineral sin gas,24.5,tottus,SAN LUIS,BEBIDA HIDRATANTE
Four Pack de Bebida Energizante Sin Azúcar de 250 mL,S/ 28.50,tottus,BEBIDA HIDRATANTE,2024-12-04 14:01:16.732811,250.0,ml,Four Pack de Bebida Energizante Sin Azúcar de,28.5,tottus,RED BULL,BEBIDA HIDRATANTE
Gaseosa: 1 Inca Kola 3 L + 2 Coca-Cola Sabor Original 3 L,S/ 30.30,tottus,BEBIDA HIDRATANTE,2024-12-04 14:01:16.732811,3.0,l,Gaseosa: 1 Inca Kola  + 2 Coca-Cola Sabor Original,30.3,tottus,COCA COLA,BEBIDA HIDRATANTE
2X Agua Sin Gas Bidon 20L,S/ 51,tottus,BEBIDA HIDRATANTE,2024-12-04 14:01:16.732811,20.0,l,2X Agua Sin Gas Bidon,51.0,tottus,SAN LUIS,BEBIDA HIDRATANTE
Pack 12 Energizante VOLT Maca Botella 300ml,,vega,BEBIDA HIDRATANTE,2024-12-04 14:49:03.098549,300.0,ml,Pack 12 Energizante VOLT Maca Botella,,vega,Volt,BEBIDA HIDRATANTE
