description,price,website,search_term,scrape_timestamp,cantidad,unidad,price_numeric,WEB,unit,brand,CLASIFICACION
Cereal de Trigo Integral Fitness Original 570g,S/ 24.90,metro,CEREALES PROCESADOS SIMPLES (HOJUELAS),2024-12-04 20:54:40.266422,570.0,g,24.9,metro,,,CEREALES PROCESADOS SIMPLES (HOJUELAS)
Cereal Müsli Arándanos KELLOGGS Caja 275g,S/ 24.90,vivanda,CEREALES PROCESADOS SIMPLES (HOJUELAS),2024-12-04 17:21:26.245803,275.0,g,24.9,vivanda,,KELLOGG S,CEREALES PROCESADOS SIMPLES (HOJUELAS)
Cereal en Barra NATURA VALLEY Crunchy Miel y Avena Caja 253g,S/ 27.10,vivanda,CEREALES PROCESADOS SIMPLES (HOJUELAS),2024-12-04 17:21:26.245803,253.0,g,27.1,vivanda,,NATURE VALLEY,CEREALES PROCESADOS SIMPLES (HOJUELAS)
Cereal NESTLÉ FITNESS Caja 570g,S/ 27.50 un,plaza_vea,CEREALES PROCESADOS SIMPLES (HOJUELAS),2024-12-04 13:11:00.538759,570.0,g,27.5,plaza_vea,Caja 570g,,CEREALES PROCESADOS SIMPLES (HOJUELAS)
Hojuelas de Maíz con Miel Sin Gluten Nature's Path Caja 300 g,S/ 27.50,wong,CEREALES PROCESADOS SIMPLES (HOJUELAS),2024-12-04 18:32:07.751419,300.0,g,27.5,wong,,,CEREALES PROCESADOS SIMPLES (HOJUELAS)
Hojuelas de Maíz Orgánico Sin Gluten Fruit Juice Nature's Path Caja 300 g,S/ 27.50,wong,CEREALES PROCESADOS SIMPLES (HOJUELAS),2024-12-04 18:32:07.751419,300.0,g,27.5,wong,,,CEREALES PROCESADOS SIMPLES (HOJUELAS)
Comida para Perros RICOCAN Adultos Razas Peque...,S/ 28.90 un,plaza_vea,CEREALES PROCESADOS SIMPLES (HOJUELAS),2024-12-04 13:11:00.538759,3.0,kg,28.9,plaza_vea,Bolsa 3Kg,,CEREALES PROCESADOS SIMPLES (HOJUELAS)
Spray de Entrenamiento para Perro Simple Solution 473ml,S/ 29.90,wong,CEREALES PROCESADOS SIMPLES (HOJUELAS),2024-12-04 18:32:07.751419,473.0,ml,29.9,wong,,,CEREALES PROCESADOS SIMPLES (HOJUELAS)
Spray de Entrenamiento para Perro Simple Solution 473ml,S/ 29.90,metro,CEREALES PROCESADOS SIMPLES (HOJUELAS),2024-12-04 20:54:40.266422,473.0,ml,29.9,metro,,,CEREALES PROCESADOS SIMPLES (HOJUELAS)
Pañales de Entrenamiento para Perros Simple Solution 10un,S/ 30.99,wong,CEREALES PROCESADOS SIMPLES (HOJUELAS),2024-12-04 18:32:07.751419,10.0,un,30.99,wong,,,CEREALES PROCESADOS SIMPLES (HOJUELAS)
Hojuelas de Fruta Fruity Pebbles 311g,S/ 34.90,metro,CEREALES PROCESADOS SIMPLES (HOJUELAS),2024-12-04 20:54:40.266422,311.0,g,34.9,metro,,,CEREALES PROCESADOS SIMPLES (HOJUELAS)
Hojuelas de Chocolate Cocoa Pebbles 311g,S/ 34.90,wong,CEREALES PROCESADOS SIMPLES (HOJUELAS),2024-12-04 18:32:07.751419,311.0,g,34.9,wong,,,CEREALES PROCESADOS SIMPLES (HOJUELAS)
Carne para Guiso simple Wong Premium x kg,S/ 35.10 x kg,wong,CEREALES PROCESADOS SIMPLES (HOJUELAS),2024-12-04 18:32:07.751419,1.0,kg,35.1,wong,,,CEREALES PROCESADOS SIMPLES (HOJUELAS)
Arena Aglomerable para Gatos Simple 4kg,S/ 35.99,metro,CEREALES PROCESADOS SIMPLES (HOJUELAS),2024-12-04 20:54:40.266422,4.0,kg,35.99,metro,,,CEREALES PROCESADOS SIMPLES (HOJUELAS)
Cereal en Barra PROTEIN SNACK Rich Caramel Caja 210g,S/ 38.50,vivanda,CEREALES PROCESADOS SIMPLES (HOJUELAS),2024-12-04 17:21:26.245803,210.0,g,38.5,vivanda,,PROTEIN SNACK,CEREALES PROCESADOS SIMPLES (HOJUELAS)
Hojuelas Integrales Honey Bunches Miel Tostada 340g,S/ 38.90,metro,CEREALES PROCESADOS SIMPLES (HOJUELAS),2024-12-04 20:54:40.266422,340.0,g,38.9,metro,,,CEREALES PROCESADOS SIMPLES (HOJUELAS)
Hojuelas Integrales Honey Bunches Almendras 340g,S/ 38.90,metro,CEREALES PROCESADOS SIMPLES (HOJUELAS),2024-12-04 20:54:40.266422,340.0,g,38.9,metro,,,CEREALES PROCESADOS SIMPLES (HOJUELAS)
Hojuelas Integrales Cheerios Honey Nut 306g,S/ 38.90,metro,CEREALES PROCESADOS SIMPLES (HOJUELAS),2024-12-04 20:54:40.266422,306.0,g,38.9,metro,,,CEREALES PROCESADOS SIMPLES (HOJUELAS)
Hojuelas Integrales Honey Bunches Almendras 340g,S/ 38.90,wong,CEREALES PROCESADOS SIMPLES (HOJUELAS),2024-12-04 18:32:07.751419,340.0,g,38.9,wong,,,CEREALES PROCESADOS SIMPLES (HOJUELAS)
Hojuelas Integrales Cinnamon Toast Crunch 340g,S/ 38.90,metro,CEREALES PROCESADOS SIMPLES (HOJUELAS),2024-12-04 20:54:40.266422,340.0,g,38.9,metro,,,CEREALES PROCESADOS SIMPLES (HOJUELAS)
Cereal en Barra PROTEIN SNACK Chocolate & Crispis Caja 210g,S/ 39.90,vivanda,CEREALES PROCESADOS SIMPLES (HOJUELAS),2024-12-04 17:21:26.245803,210.0,g,39.9,vivanda,,PROTEIN SNACK,CEREALES PROCESADOS SIMPLES (HOJUELAS)
Removedor de Olor de Perro Simple Solution 500ml,S/ 39.99,wong,CEREALES PROCESADOS SIMPLES (HOJUELAS),2024-12-04 18:32:07.751419,500.0,ml,39.99,wong,,,CEREALES PROCESADOS SIMPLES (HOJUELAS)
Removedor de Olor de Gato Simple Solution 500ml,S/ 39.99,wong,CEREALES PROCESADOS SIMPLES (HOJUELAS),2024-12-04 18:32:07.751419,500.0,ml,39.99,wong,,,CEREALES PROCESADOS SIMPLES (HOJUELAS)
Hojuelas de Galletas Oreo 311g,S/ 42.90,metro,CEREALES PROCESADOS SIMPLES (HOJUELAS),2024-12-04 20:54:40.266422,311.0,g,42.9,metro,,,CEREALES PROCESADOS SIMPLES (HOJUELAS)
Cereal Capitán Crunch Original Caja 360 g,S/ 45.90,wong,CEREALES PROCESADOS SIMPLES (HOJUELAS),2024-12-04 18:32:07.751419,360.0,g,45.9,wong,,,CEREALES PROCESADOS SIMPLES (HOJUELAS)
Comida para Perros MIMASKOT Adultos Raza Media...,S/ 94.90 un,plaza_vea,CEREALES PROCESADOS SIMPLES (HOJUELAS),2024-12-04 13:11:00.538759,15.0,kg,94.9,plaza_vea,Bolsa 15Kg,,CEREALES PROCESADOS SIMPLES (HOJUELAS)
Comida para Perros MIMASKOT Adultos Raza Media...,S/ 94.90 un,plaza_vea,CEREALES PROCESADOS SIMPLES (HOJUELAS),2024-12-04 13:11:00.538759,15.0,kg,94.9,plaza_vea,Bolsa 15Kg,,CEREALES PROCESADOS SIMPLES (HOJUELAS)
Comida para Perros RICOCAN Adultos Razas Peque...,S/ 105.90 un,plaza_vea,CEREALES PROCESADOS SIMPLES (HOJUELAS),2024-12-04 13:11:00.538759,15.0,kg,105.9,plaza_vea,Bolsa 15Kg,,CEREALES PROCESADOS SIMPLES (HOJUELAS)
Comida para Perros RICOCAN Adultos Razas Media...,S/ 105.90 un,plaza_vea,CEREALES PROCESADOS SIMPLES (HOJUELAS),2024-12-04 13:11:00.538759,15.0,kg,105.9,plaza_vea,Bolsa 15Kg,,CEREALES PROCESADOS SIMPLES (HOJUELAS)
Ricocan Alimento para Perros Adultos Raza Pequeña Cordero y Cereales Bolsa 15 Kg,S/ 109.90,metro,CEREALES PROCESADOS SIMPLES (HOJUELAS),2024-12-04 20:54:40.266422,15.0,kg,109.9,metro,,,CEREALES PROCESADOS SIMPLES (HOJUELAS)
"Comida para Perros MIMASKOT Carne, Cereal y Ve...",S/ 133.90 un,plaza_vea,CEREALES PROCESADOS SIMPLES (HOJUELAS),2024-12-04 13:11:00.538759,22.0,kg,133.9,plaza_vea,Bolsa 22Kg,,CEREALES PROCESADOS SIMPLES (HOJUELAS)
