description,price,website,search_term,scrape_timestamp,cantidad,unidad,price_numeric,WEB,unit,brand,CLASIFICACION
Cereal de Avena Cuisine & Co Sin Gluten 250g,S/ 13.20,metro,CEREALES PROCESADOS SIMPLES (HOJUELAS),2024-12-04 20:54:40.266422,250.0,g,13.2,metro,,,CEREALES PROCESADOS SIMPLES (HOJUELAS)
Cereal de Avena Cuisine & Co Sin Gluten 250g,S/ 13.20,wong,CEREALES PROCESADOS SIMPLES (HOJUELAS),2024-12-04 18:32:07.751419,250.0,g,13.2,wong,,,CEREALES PROCESADOS SIMPLES (HOJUELAS)
Cereal Corn Flakes Sin Gluten 180g,S/ 13.40,metro,CEREALES PROCESADOS SIMPLES (HOJUELAS),2024-12-04 20:54:40.266422,180.0,g,13.4,metro,,,CEREALES PROCESADOS SIMPLES (HOJUELAS)
Cereal CROSOY Granola Bolsa 380Gr,S/ 13.50 un,plaza_vea,CEREALES PROCESADOS SIMPLES (HOJUELAS),2024-12-04 13:11:00.538759,380.0,g,13.5,plaza_vea,Bolsa 380g,,CEREALES PROCESADOS SIMPLES (HOJUELAS)
Cereal NESTLÉ Kitkat Caja 210g,S/ 13.50,vivanda,CEREALES PROCESADOS SIMPLES (HOJUELAS),2024-12-04 17:21:26.245803,210.0,g,13.5,vivanda,,NESTLÉ,CEREALES PROCESADOS SIMPLES (HOJUELAS)
Cereal NESTLÉ Kitkat Caja 210g,S/ 13.50 un,plaza_vea,CEREALES PROCESADOS SIMPLES (HOJUELAS),2024-12-04 13:11:00.538759,210.0,g,13.5,plaza_vea,Caja 210g,,CEREALES PROCESADOS SIMPLES (HOJUELAS)
Cereal CROSOY Granola kiwicha y chia Bolsa 80G...,S/ 13.50 un,plaza_vea,CEREALES PROCESADOS SIMPLES (HOJUELAS),2024-12-04 13:11:00.538759,80.0,g,13.5,plaza_vea,Bolsa 80g,,CEREALES PROCESADOS SIMPLES (HOJUELAS)
Cereal Cuadritos de Avena Cuisine & Co Caja 370 gr,S/ 13.90,wong,CEREALES PROCESADOS SIMPLES (HOJUELAS),2024-12-04 18:32:07.751419,370.0,g,13.9,wong,,,CEREALES PROCESADOS SIMPLES (HOJUELAS)
Cereal Mix Avena y Almendras Cuisine & Co Caja 380 gr,S/ 13.90,metro,CEREALES PROCESADOS SIMPLES (HOJUELAS),2024-12-04 20:54:40.266422,380.0,g,13.9,metro,,,CEREALES PROCESADOS SIMPLES (HOJUELAS)
Cereal Cuisine & Co Fruty Flow 370g,S/ 13.90,wong,CEREALES PROCESADOS SIMPLES (HOJUELAS),2024-12-04 18:32:07.751419,370.0,g,13.9,wong,,,CEREALES PROCESADOS SIMPLES (HOJUELAS)
Cereal Kit Kat 210g,S/ 13.90,wong,CEREALES PROCESADOS SIMPLES (HOJUELAS),2024-12-04 18:32:07.751419,210.0,g,13.9,wong,,,CEREALES PROCESADOS SIMPLES (HOJUELAS)
Cereal Mix Avena y Almendras Cuisine & Co Caja 380 gr,S/ 13.90,wong,CEREALES PROCESADOS SIMPLES (HOJUELAS),2024-12-04 18:32:07.751419,380.0,g,13.9,wong,,,CEREALES PROCESADOS SIMPLES (HOJUELAS)
Cereal MCCALLUM'S Multicereal con Arándanos Caja 350g,S/ 13.90,vivanda,CEREALES PROCESADOS SIMPLES (HOJUELAS),2024-12-04 17:21:26.245803,350.0,g,13.9,vivanda,,MCCALLUM S,CEREALES PROCESADOS SIMPLES (HOJUELAS)
Cereal MCCALLUM'S Multicereal con Manzana Caja 350g,S/ 13.90,vivanda,CEREALES PROCESADOS SIMPLES (HOJUELAS),2024-12-04 17:21:26.245803,350.0,g,13.9,vivanda,,MCCALLUM S,CEREALES PROCESADOS SIMPLES (HOJUELAS)
Cereal de Maíz Corn Flakes 405g,S/ 13.90,metro,CEREALES PROCESADOS SIMPLES (HOJUELAS),2024-12-04 20:54:40.266422,405.0,g,13.9,metro,,,CEREALES PROCESADOS SIMPLES (HOJUELAS)
Hojuelas de Maíz Corn Flakes Cuisine & Co Caja 500 g,S/ 13.90,wong,CEREALES PROCESADOS SIMPLES (HOJUELAS),2024-12-04 18:32:07.751419,500.0,g,13.9,wong,,,CEREALES PROCESADOS SIMPLES (HOJUELAS)
Cereal CORN FLAKES Nestlé Sin Gluten Caja 405g,S/ 13.90 un,plaza_vea,CEREALES PROCESADOS SIMPLES (HOJUELAS),2024-12-04 13:11:00.538759,405.0,g,13.9,plaza_vea,Caja 405g,,CEREALES PROCESADOS SIMPLES (HOJUELAS)
Cereal Kit Kat 210g,S/ 13.90,metro,CEREALES PROCESADOS SIMPLES (HOJUELAS),2024-12-04 20:54:40.266422,210.0,g,13.9,metro,,,CEREALES PROCESADOS SIMPLES (HOJUELAS)
Cereal CROSOY Granola manzana pecana y canela ...,S/ 14.20 un,plaza_vea,CEREALES PROCESADOS SIMPLES (HOJUELAS),2024-12-04 13:11:00.538759,380.0,g,14.2,plaza_vea,Bolsa 380g,,CEREALES PROCESADOS SIMPLES (HOJUELAS)
Cereal CROSOY Granola manzana pecana y canela Bolsa 380Gr,S/ 14.20,vivanda,CEREALES PROCESADOS SIMPLES (HOJUELAS),2024-12-04 17:21:26.245803,380.0,g,14.2,vivanda,,CROSOY,CEREALES PROCESADOS SIMPLES (HOJUELAS)
Cereal NESTLÉ FITNESS Caja 285g,S/ 14.30,vivanda,CEREALES PROCESADOS SIMPLES (HOJUELAS),2024-12-04 17:21:26.245803,285.0,g,14.3,vivanda,,NESTLE FITNESS,CEREALES PROCESADOS SIMPLES (HOJUELAS)
Cereal NESTLÉ Fitness Caja 285g,S/ 14.30 un,plaza_vea,CEREALES PROCESADOS SIMPLES (HOJUELAS),2024-12-04 13:11:00.538759,285.0,g,14.3,plaza_vea,Caja 285g,,CEREALES PROCESADOS SIMPLES (HOJUELAS)
Cereal BHAKTI NATURA Granola Chococereal Caja 300g,S/ 14.30,vivanda,CEREALES PROCESADOS SIMPLES (HOJUELAS),2024-12-04 17:21:26.245803,300.0,g,14.3,vivanda,,BHAKTI NATURA,CEREALES PROCESADOS SIMPLES (HOJUELAS)
Cereal Sublime 230g,S/ 14.40,metro,CEREALES PROCESADOS SIMPLES (HOJUELAS),2024-12-04 20:54:40.266422,230.0,g,14.4,metro,,,CEREALES PROCESADOS SIMPLES (HOJUELAS)
Cereal NESTLÉ Sublime Caja 230g,S/ 14.40 un,plaza_vea,CEREALES PROCESADOS SIMPLES (HOJUELAS),2024-12-04 13:11:00.538759,230.0,g,14.4,plaza_vea,Caja 230g,,CEREALES PROCESADOS SIMPLES (HOJUELAS)
Cereal Corn Flakes Ángel 650g,S/ 14.40,wong,CEREALES PROCESADOS SIMPLES (HOJUELAS),2024-12-04 18:32:07.751419,650.0,g,14.4,wong,,,CEREALES PROCESADOS SIMPLES (HOJUELAS)
Cereal Ángel Diver Plátano & Manzana 350g,S/ 14.50,wong,CEREALES PROCESADOS SIMPLES (HOJUELAS),2024-12-04 18:32:07.751419,350.0,g,14.5,wong,,,CEREALES PROCESADOS SIMPLES (HOJUELAS)
Cereal de Trigo Integral Fitness Original 285g,S/ 14.50,metro,CEREALES PROCESADOS SIMPLES (HOJUELAS),2024-12-04 20:54:40.266422,285.0,g,14.5,metro,,,CEREALES PROCESADOS SIMPLES (HOJUELAS)
Avena Quaker Tradicional 900g,S/ 14.50,metro,CEREALES PROCESADOS SIMPLES (HOJUELAS),2024-12-04 20:54:40.266422,900.0,g,14.5,metro,,,CEREALES PROCESADOS SIMPLES (HOJUELAS)
Avena Quaker Tradicional 900g,S/ 14.50,wong,CEREALES PROCESADOS SIMPLES (HOJUELAS),2024-12-04 18:32:07.751419,900.0,g,14.5,wong,,,CEREALES PROCESADOS SIMPLES (HOJUELAS)
Granola con Granos Andinos Unión Doypack 280 g,S/ 14.60,metro,CEREALES PROCESADOS SIMPLES (HOJUELAS),2024-12-04 20:54:40.266422,280.0,g,14.6,metro,,,CEREALES PROCESADOS SIMPLES (HOJUELAS)
Cereal Chock Bolsa 420 g,S/ 14.90,metro,CEREALES PROCESADOS SIMPLES (HOJUELAS),2024-12-04 20:54:40.266422,420.0,g,14.9,metro,,,CEREALES PROCESADOS SIMPLES (HOJUELAS)
Cereal Zuck Bolsa 500 g,S/ 14.90,metro,CEREALES PROCESADOS SIMPLES (HOJUELAS),2024-12-04 20:54:40.266422,500.0,g,14.9,metro,,,CEREALES PROCESADOS SIMPLES (HOJUELAS)
Cereal de Trigo Integral Fitness Original 285g,S/ 14.90,wong,CEREALES PROCESADOS SIMPLES (HOJUELAS),2024-12-04 18:32:07.751419,285.0,g,14.9,wong,,,CEREALES PROCESADOS SIMPLES (HOJUELAS)
Cereal Angel Meli Bolsa 420 g,S/ 14.90,metro,CEREALES PROCESADOS SIMPLES (HOJUELAS),2024-12-04 20:54:40.266422,420.0,g,14.9,metro,,,CEREALES PROCESADOS SIMPLES (HOJUELAS)
Cereal Fruta Aros Maiz Cereal Angel Bolsa 420 g,S/ 14.90,metro,CEREALES PROCESADOS SIMPLES (HOJUELAS),2024-12-04 20:54:40.266422,420.0,g,14.9,metro,,,CEREALES PROCESADOS SIMPLES (HOJUELAS)
Cereal Semillitas Con Harina 7 Semillas Angel Bolsa 350 g,S/ 14.90,metro,CEREALES PROCESADOS SIMPLES (HOJUELAS),2024-12-04 20:54:40.266422,350.0,g,14.9,metro,,,CEREALES PROCESADOS SIMPLES (HOJUELAS)
Cereal Milo 320g,S/ 15.50,metro,CEREALES PROCESADOS SIMPLES (HOJUELAS),2024-12-04 20:54:40.266422,320.0,g,15.5,metro,,,CEREALES PROCESADOS SIMPLES (HOJUELAS)
Cereal UNIÓN Granola con miel de abeja Doypack 400g,S/ 15.50,vivanda,CEREALES PROCESADOS SIMPLES (HOJUELAS),2024-12-04 17:21:26.245803,400.0,g,15.5,vivanda,,UNIÓN,CEREALES PROCESADOS SIMPLES (HOJUELAS)
Cereal Milo 320g,S/ 15.50,wong,CEREALES PROCESADOS SIMPLES (HOJUELAS),2024-12-04 18:32:07.751419,320.0,g,15.5,wong,,,CEREALES PROCESADOS SIMPLES (HOJUELAS)
Granola con Miel de Abeja Unión Doypack 400g,S/ 15.50,wong,CEREALES PROCESADOS SIMPLES (HOJUELAS),2024-12-04 18:32:07.751419,400.0,g,15.5,wong,,,CEREALES PROCESADOS SIMPLES (HOJUELAS)
Cereal en Barra DYFFERENT Chocolate Brownie Caja 210g,S/ 15.60,vivanda,CEREALES PROCESADOS SIMPLES (HOJUELAS),2024-12-04 17:21:26.245803,210.0,g,15.6,vivanda,,DYFFERENT,CEREALES PROCESADOS SIMPLES (HOJUELAS)
Cereal Cuisine & Co Fruty Color Sin Gluten 350g,S/ 15.70,metro,CEREALES PROCESADOS SIMPLES (HOJUELAS),2024-12-04 20:54:40.266422,350.0,g,15.7,metro,,,CEREALES PROCESADOS SIMPLES (HOJUELAS)
Cereal ÁNGEL Maíz Trigo y Avena Sabor a Frutas...,S/ 15.70 un,plaza_vea,CEREALES PROCESADOS SIMPLES (HOJUELAS),2024-12-04 13:11:00.538759,420.0,g,15.7,plaza_vea,Bolsa 420g,,CEREALES PROCESADOS SIMPLES (HOJUELAS)
Cereal ANGEL Hojuelas de maíz azucaradas Bolsa...,S/ 15.70 un,plaza_vea,CEREALES PROCESADOS SIMPLES (HOJUELAS),2024-12-04 13:11:00.538759,500.0,g,15.7,plaza_vea,Bolsa 500g,,CEREALES PROCESADOS SIMPLES (HOJUELAS)
Cereal de Avena y Arroz Cuisine & Co 350g,S/ 15.70,wong,CEREALES PROCESADOS SIMPLES (HOJUELAS),2024-12-04 18:32:07.751419,350.0,g,15.7,wong,,,CEREALES PROCESADOS SIMPLES (HOJUELAS)
Cereal de Avena y Arroz Cuisine & Co 350g,S/ 15.70,metro,CEREALES PROCESADOS SIMPLES (HOJUELAS),2024-12-04 20:54:40.266422,350.0,g,15.7,metro,,,CEREALES PROCESADOS SIMPLES (HOJUELAS)
Cereal Hojuelas de Maíz Azúcaradas Zuck 500 g,S/ 15.70,tottus,CEREALES PROCESADOS SIMPLES (HOJUELAS),2024-12-04 13:06:23.303851,500.0,g,15.7,tottus,,ANGEL,CEREALES PROCESADOS SIMPLES (HOJUELAS)
Cereal AGE Salvado de Trigo Molido Bolsa 500g,S/ 15.70,vivanda,CEREALES PROCESADOS SIMPLES (HOJUELAS),2024-12-04 17:21:26.245803,500.0,g,15.7,vivanda,,AGE,CEREALES PROCESADOS SIMPLES (HOJUELAS)
Cereal Cuisine & Co Fruty Color Sin Gluten 350g,S/ 15.70,wong,CEREALES PROCESADOS SIMPLES (HOJUELAS),2024-12-04 18:32:07.751419,350.0,g,15.7,wong,,,CEREALES PROCESADOS SIMPLES (HOJUELAS)
Cereal UNIÓN Granola con Granos Andinos Doypack 280g,S/ 15.90,vivanda,CEREALES PROCESADOS SIMPLES (HOJUELAS),2024-12-04 17:21:26.245803,280.0,g,15.9,vivanda,,UNIÓN,CEREALES PROCESADOS SIMPLES (HOJUELAS)
Cereal LA PURITA Pops Caramel Caja 200g,S/ 15.90,vivanda,CEREALES PROCESADOS SIMPLES (HOJUELAS),2024-12-04 17:21:26.245803,200.0,g,15.9,vivanda,,LA PURITA,CEREALES PROCESADOS SIMPLES (HOJUELAS)
Cereal KELLOGGS Froot Loops Caja 350g,S/ 15.90,vivanda,CEREALES PROCESADOS SIMPLES (HOJUELAS),2024-12-04 17:21:26.245803,350.0,g,15.9,vivanda,,KELLOGG S,CEREALES PROCESADOS SIMPLES (HOJUELAS)
Granola con Granos Andinos Unión Doypack 280g,S/ 15.90,wong,CEREALES PROCESADOS SIMPLES (HOJUELAS),2024-12-04 18:32:07.751419,280.0,g,15.9,wong,,,CEREALES PROCESADOS SIMPLES (HOJUELAS)
Cereal UNIÓN Granola con Granos Andinos Doypac...,S/ 15.90 un,plaza_vea,CEREALES PROCESADOS SIMPLES (HOJUELAS),2024-12-04 13:11:00.538759,280.0,g,15.9,plaza_vea,Doypack 280g,,CEREALES PROCESADOS SIMPLES (HOJUELAS)
Cereal en Hojuelas de Maíz ángel Flakes 1 kg,S/ 15.90,tottus,CEREALES PROCESADOS SIMPLES (HOJUELAS),2024-12-04 13:06:23.303851,1.0,kg,15.9,tottus,,ANGEL,CEREALES PROCESADOS SIMPLES (HOJUELAS)
Cereal CORN FLAKES Bolsa 405g,S/ 16.00,vega,CEREALES PROCESADOS SIMPLES (HOJUELAS),2024-12-04 13:17:08.620683,405.0,g,16.0,vega,,Nestle,CEREALES PROCESADOS SIMPLES (HOJUELAS)
Cereal de Garbanzo Sabor Cinnamon Roll Dyfferent 210g,S/ 16.10,metro,CEREALES PROCESADOS SIMPLES (HOJUELAS),2024-12-04 20:54:40.266422,210.0,g,16.1,metro,,,CEREALES PROCESADOS SIMPLES (HOJUELAS)
Cereal de Garbanzo Sabor Miel Vainilla Dyfferent 210g,S/ 16.10,metro,CEREALES PROCESADOS SIMPLES (HOJUELAS),2024-12-04 20:54:40.266422,210.0,g,16.1,metro,,,CEREALES PROCESADOS SIMPLES (HOJUELAS)
Cereal de Garbanzo Sabor Cinnamon Roll Dyfferent 210g,S/ 16.10,wong,CEREALES PROCESADOS SIMPLES (HOJUELAS),2024-12-04 18:32:07.751419,210.0,g,16.1,wong,,,CEREALES PROCESADOS SIMPLES (HOJUELAS)
Cereal de Garbanzo Sabor Chocolate Brownie Dyfferent 210g,S/ 16.10,metro,CEREALES PROCESADOS SIMPLES (HOJUELAS),2024-12-04 20:54:40.266422,210.0,g,16.1,metro,,,CEREALES PROCESADOS SIMPLES (HOJUELAS)
Cereal UNIÓN Granola Pasas y Almendras Doypack 400g,S/ 16.49,vivanda,CEREALES PROCESADOS SIMPLES (HOJUELAS),2024-12-04 17:21:26.245803,400.0,g,16.49,vivanda,,UNIÓN,CEREALES PROCESADOS SIMPLES (HOJUELAS)
Granola con Pasas y Almendras Unión Doypack 400g,S/ 16.50,wong,CEREALES PROCESADOS SIMPLES (HOJUELAS),2024-12-04 18:32:07.751419,400.0,g,16.5,wong,,,CEREALES PROCESADOS SIMPLES (HOJUELAS)
Cereal Flakes Angel 1 kg,S/ 16.50,metro,CEREALES PROCESADOS SIMPLES (HOJUELAS),2024-12-04 20:54:40.266422,1.0,kg,16.5,metro,,,CEREALES PROCESADOS SIMPLES (HOJUELAS)
Hojuelas de Maíz Azucaradas Kellogg's Zucaritas 420g,S/ 16.90,metro,CEREALES PROCESADOS SIMPLES (HOJUELAS),2024-12-04 20:54:40.266422,420.0,g,16.9,metro,,,CEREALES PROCESADOS SIMPLES (HOJUELAS)
Cereal Azucarado Zucosos 500g,S/ 16.90,metro,CEREALES PROCESADOS SIMPLES (HOJUELAS),2024-12-04 20:54:40.266422,500.0,g,16.9,metro,,,CEREALES PROCESADOS SIMPLES (HOJUELAS)
Cereal Azucarado Trix Minis 300g,S/ 16.90,metro,CEREALES PROCESADOS SIMPLES (HOJUELAS),2024-12-04 20:54:40.266422,300.0,g,16.9,metro,,,CEREALES PROCESADOS SIMPLES (HOJUELAS)
Cereal Chock Bolsa 420g,S/ 16.90,wong,CEREALES PROCESADOS SIMPLES (HOJUELAS),2024-12-04 18:32:07.751419,420.0,g,16.9,wong,,,CEREALES PROCESADOS SIMPLES (HOJUELAS)
Cereal Azucarado Zucosos 500g,S/ 16.90,wong,CEREALES PROCESADOS SIMPLES (HOJUELAS),2024-12-04 18:32:07.751419,500.0,g,16.9,wong,,,CEREALES PROCESADOS SIMPLES (HOJUELAS)
Cereal Tito Almohada Angel Chocolate Bolsa 350 g,S/ 16.90,metro,CEREALES PROCESADOS SIMPLES (HOJUELAS),2024-12-04 20:54:40.266422,350.0,g,16.9,metro,,,CEREALES PROCESADOS SIMPLES (HOJUELAS)
Cereal Angel Meli Bolsa 420 g,S/ 16.90,wong,CEREALES PROCESADOS SIMPLES (HOJUELAS),2024-12-04 18:32:07.751419,420.0,g,16.9,wong,,,CEREALES PROCESADOS SIMPLES (HOJUELAS)
Granola con Pasas y Almendras Unión Doypack 400 g,S/ 16.90,metro,CEREALES PROCESADOS SIMPLES (HOJUELAS),2024-12-04 20:54:40.266422,400.0,g,16.9,metro,,,CEREALES PROCESADOS SIMPLES (HOJUELAS)
Cereal Chocapic Minis 330g,S/ 17.50,metro,CEREALES PROCESADOS SIMPLES (HOJUELAS),2024-12-04 20:54:40.266422,330.0,g,17.5,metro,,,CEREALES PROCESADOS SIMPLES (HOJUELAS)
Cereal Chocapic Minis 330g,S/ 17.50,wong,CEREALES PROCESADOS SIMPLES (HOJUELAS),2024-12-04 18:32:07.751419,330.0,g,17.5,wong,,,CEREALES PROCESADOS SIMPLES (HOJUELAS)
Cereal Infantil NESTUM Trigo Quinua y otros 6 ...,S/ 17.50 un,plaza_vea,CEREALES PROCESADOS SIMPLES (HOJUELAS),2024-12-04 13:11:00.538759,350.0,g,17.5,plaza_vea,Caja 350g,,CEREALES PROCESADOS SIMPLES (HOJUELAS)
Cereal Tito Almohada Angel Chocolate Bolsa 350 g,S/ 17.50,wong,CEREALES PROCESADOS SIMPLES (HOJUELAS),2024-12-04 18:32:07.751419,350.0,g,17.5,wong,,,CEREALES PROCESADOS SIMPLES (HOJUELAS)
Cereal Trix 330g,S/ 17.90,metro,CEREALES PROCESADOS SIMPLES (HOJUELAS),2024-12-04 20:54:40.266422,330.0,g,17.9,metro,,,CEREALES PROCESADOS SIMPLES (HOJUELAS)
Cereal Infantil en Polvo Nestum 5 Cereales 350g,S/ 17.90,metro,CEREALES PROCESADOS SIMPLES (HOJUELAS),2024-12-04 20:54:40.266422,350.0,g,17.9,metro,,,CEREALES PROCESADOS SIMPLES (HOJUELAS)
Cereal Infantil en Polvo Nestum Arroz 350g,S/ 17.90,metro,CEREALES PROCESADOS SIMPLES (HOJUELAS),2024-12-04 20:54:40.266422,350.0,g,17.9,metro,,,CEREALES PROCESADOS SIMPLES (HOJUELAS)
Cereal Infantil en Polvo Nestum Trigo Quinua y Otros Cereales 350g,S/ 17.90,metro,CEREALES PROCESADOS SIMPLES (HOJUELAS),2024-12-04 20:54:40.266422,350.0,g,17.9,metro,,,CEREALES PROCESADOS SIMPLES (HOJUELAS)
Cereal Trix 330g,S/ 17.90,wong,CEREALES PROCESADOS SIMPLES (HOJUELAS),2024-12-04 18:32:07.751419,330.0,g,17.9,wong,,,CEREALES PROCESADOS SIMPLES (HOJUELAS)
Avena en Hojuelas sin Gluten 800g,S/ 18,tottus,CEREALES PROCESADOS SIMPLES (HOJUELAS),2024-12-04 13:06:23.303851,800.0,g,18.0,tottus,,LA PURITA,CEREALES PROCESADOS SIMPLES (HOJUELAS)
Cereal Kellogg's Choco Copos 310 g,S/ 18.10,wong,CEREALES PROCESADOS SIMPLES (HOJUELAS),2024-12-04 18:32:07.751419,310.0,g,18.1,wong,,,CEREALES PROCESADOS SIMPLES (HOJUELAS)
Cereal de Quinua Nura Choco Pops 200g,S/ 18.50,wong,CEREALES PROCESADOS SIMPLES (HOJUELAS),2024-12-04 18:32:07.751419,200.0,g,18.5,wong,,,CEREALES PROCESADOS SIMPLES (HOJUELAS)
Cereal de Quinua Nura Caramel Pops 200g,S/ 18.50,wong,CEREALES PROCESADOS SIMPLES (HOJUELAS),2024-12-04 18:32:07.751419,200.0,g,18.5,wong,,,CEREALES PROCESADOS SIMPLES (HOJUELAS)
Cereal de Quinua Toffee +NUTRI Co Caja 200g,S/ 18.90,vivanda,CEREALES PROCESADOS SIMPLES (HOJUELAS),2024-12-04 17:21:26.245803,200.0,g,18.9,vivanda,,+NUTRI CO,CEREALES PROCESADOS SIMPLES (HOJUELAS)
Cereal de Trigo Integral Fitness Frutas 330g,S/ 18.90,metro,CEREALES PROCESADOS SIMPLES (HOJUELAS),2024-12-04 20:54:40.266422,330.0,g,18.9,metro,,,CEREALES PROCESADOS SIMPLES (HOJUELAS)
Cereal de Trigo Integral Fitness Miel y Almendras 330g,S/ 18.90,metro,CEREALES PROCESADOS SIMPLES (HOJUELAS),2024-12-04 20:54:40.266422,330.0,g,18.9,metro,,,CEREALES PROCESADOS SIMPLES (HOJUELAS)
Cereal Zucaritas Milkshake de Fresa 330g,S/ 19.00,wong,CEREALES PROCESADOS SIMPLES (HOJUELAS),2024-12-04 18:32:07.751419,330.0,g,19.0,wong,,,CEREALES PROCESADOS SIMPLES (HOJUELAS)
Cereal NESTLÉ TRIX Caja 330g,S/ 19.00,vivanda,CEREALES PROCESADOS SIMPLES (HOJUELAS),2024-12-04 17:21:26.245803,330.0,g,19.0,vivanda,,NESTLÉ,CEREALES PROCESADOS SIMPLES (HOJUELAS)
Cereal Orgánico Andean Bites KIDS ORGANICS Caja 240g,S/ 19.50,vivanda,CEREALES PROCESADOS SIMPLES (HOJUELAS),2024-12-04 17:21:26.245803,240.0,g,19.5,vivanda,,KIDS ORGANICS,CEREALES PROCESADOS SIMPLES (HOJUELAS)
Cereal NESTLE Chocapic Caja 350g,S/ 19.70,vega,CEREALES PROCESADOS SIMPLES (HOJUELAS),2024-12-04 13:17:08.620683,350.0,g,19.7,vega,,Nestle,CEREALES PROCESADOS SIMPLES (HOJUELAS)
Cereal en hojuelas con pasas y coco de 330 g,S/ 19.70,tottus,CEREALES PROCESADOS SIMPLES (HOJUELAS),2024-12-04 13:06:23.303851,330.0,g,19.7,tottus,,FITNESS,CEREALES PROCESADOS SIMPLES (HOJUELAS)
Cereal Infantil en Polvo Nestum Trigo Quinua y Otros Cereales 350g,S/ 19.90,wong,CEREALES PROCESADOS SIMPLES (HOJUELAS),2024-12-04 18:32:07.751419,350.0,g,19.9,wong,,,CEREALES PROCESADOS SIMPLES (HOJUELAS)
"Cereal Orgánico de Quinua, Arroz y Cacao Kids Organics Caja 240 gr",S/ 20.10,wong,CEREALES PROCESADOS SIMPLES (HOJUELAS),2024-12-04 18:32:07.751419,240.0,g,20.1,wong,,,CEREALES PROCESADOS SIMPLES (HOJUELAS)
"Cereal Orgánico de Quinua, Kiwicha y Arroz Kids Organics Caja 240 gr",S/ 20.10,wong,CEREALES PROCESADOS SIMPLES (HOJUELAS),2024-12-04 18:32:07.751419,240.0,g,20.1,wong,,,CEREALES PROCESADOS SIMPLES (HOJUELAS)
"Cereal Orgánico de Quinua, Arroz y Cacao Kids Organics Caja 240 gr",S/ 20.10,metro,CEREALES PROCESADOS SIMPLES (HOJUELAS),2024-12-04 20:54:40.266422,240.0,g,20.1,metro,,,CEREALES PROCESADOS SIMPLES (HOJUELAS)
Cereal Naturandes 7 Semillas Vainilla 200g,S/ 20.50,metro,CEREALES PROCESADOS SIMPLES (HOJUELAS),2024-12-04 20:54:40.266422,200.0,g,20.5,metro,,,CEREALES PROCESADOS SIMPLES (HOJUELAS)
Cereal 2 CERRITOS Cubierto de chocolate Caja 3...,S/ 20.50 un,plaza_vea,CEREALES PROCESADOS SIMPLES (HOJUELAS),2024-12-04 13:11:00.538759,350.0,g,20.5,plaza_vea,Caja 350g,,CEREALES PROCESADOS SIMPLES (HOJUELAS)
Cereal Naturandes 7 Semillas Chocolate 200g,S/ 20.50,metro,CEREALES PROCESADOS SIMPLES (HOJUELAS),2024-12-04 20:54:40.266422,200.0,g,20.5,metro,,,CEREALES PROCESADOS SIMPLES (HOJUELAS)
Cereales Bañados con Chocolate Choco Yogurt 2 Cerritos Caja 350 gr,S/ 20.50,metro,CEREALES PROCESADOS SIMPLES (HOJUELAS),2024-12-04 20:54:40.266422,350.0,g,20.5,metro,,,CEREALES PROCESADOS SIMPLES (HOJUELAS)
Cereal Naturandes 7 Semillas Chocolate 200g,S/ 20.60,wong,CEREALES PROCESADOS SIMPLES (HOJUELAS),2024-12-04 18:32:07.751419,200.0,g,20.6,wong,,,CEREALES PROCESADOS SIMPLES (HOJUELAS)
Hojuelas de Avena Huella Verde 400g,S/ 20.70,wong,CEREALES PROCESADOS SIMPLES (HOJUELAS),2024-12-04 18:32:07.751419,400.0,g,20.7,wong,,,CEREALES PROCESADOS SIMPLES (HOJUELAS)
Cereal CHOCAPIC Caja 540g,S/ 20.80 un,plaza_vea,CEREALES PROCESADOS SIMPLES (HOJUELAS),2024-12-04 13:11:00.538759,540.0,g,20.8,plaza_vea,Caja 540g,,CEREALES PROCESADOS SIMPLES (HOJUELAS)
Cereal Froot Loops Spinners 265g,S/ 20.90,metro,CEREALES PROCESADOS SIMPLES (HOJUELAS),2024-12-04 20:54:40.266422,265.0,g,20.9,metro,,,CEREALES PROCESADOS SIMPLES (HOJUELAS)
Cereal Chocapic Nestlé 350g,S/ 20.90,metro,CEREALES PROCESADOS SIMPLES (HOJUELAS),2024-12-04 20:54:40.266422,350.0,g,20.9,metro,,,CEREALES PROCESADOS SIMPLES (HOJUELAS)
Cereal Froot Loops Spinners 265g,S/ 20.90,wong,CEREALES PROCESADOS SIMPLES (HOJUELAS),2024-12-04 18:32:07.751419,265.0,g,20.9,wong,,,CEREALES PROCESADOS SIMPLES (HOJUELAS)
Cereal Corn Flakes Sin Gluten 740g,S/ 20.90,metro,CEREALES PROCESADOS SIMPLES (HOJUELAS),2024-12-04 20:54:40.266422,740.0,g,20.9,metro,,,CEREALES PROCESADOS SIMPLES (HOJUELAS)
Cereal NESTLÉ Corn Flakes sin Gluten Bolsa 740...,S/ 20.90 un,plaza_vea,CEREALES PROCESADOS SIMPLES (HOJUELAS),2024-12-04 13:11:00.538759,740.0,g,20.9,plaza_vea,Bolsa 740g,,CEREALES PROCESADOS SIMPLES (HOJUELAS)
Cereal NESTLÉ Corn Flakes sin Gluten Bolsa 740g,S/ 20.90,vivanda,CEREALES PROCESADOS SIMPLES (HOJUELAS),2024-12-04 17:21:26.245803,740.0,g,20.9,vivanda,,NESTLÉ,CEREALES PROCESADOS SIMPLES (HOJUELAS)
Cereal Infantil CERELAC 5 Cereales y Leche Caj...,S/ 21.10 un,plaza_vea,CEREALES PROCESADOS SIMPLES (HOJUELAS),2024-12-04 13:11:00.538759,400.0,g,21.1,plaza_vea,Caja 400g,,CEREALES PROCESADOS SIMPLES (HOJUELAS)
Cereal Chocapic Nestlé 350g,S/ 21.30,wong,CEREALES PROCESADOS SIMPLES (HOJUELAS),2024-12-04 18:32:07.751419,350.0,g,21.3,wong,,,CEREALES PROCESADOS SIMPLES (HOJUELAS)
Cereal Ángel Life Fibra en Hojuelas de Trigo 560 g,S/ 21.50,tottus,CEREALES PROCESADOS SIMPLES (HOJUELAS),2024-12-04 13:06:23.303851,560.0,g,21.5,tottus,,ANGEL,CEREALES PROCESADOS SIMPLES (HOJUELAS)
Cereales con Marshmellows Trix 300g,S/ 21.50,metro,CEREALES PROCESADOS SIMPLES (HOJUELAS),2024-12-04 20:54:40.266422,300.0,g,21.5,metro,,,CEREALES PROCESADOS SIMPLES (HOJUELAS)
Cereales con Marshmellows Trix 300g,S/ 21.50,wong,CEREALES PROCESADOS SIMPLES (HOJUELAS),2024-12-04 18:32:07.751419,300.0,g,21.5,wong,,,CEREALES PROCESADOS SIMPLES (HOJUELAS)
Cereales ANGEL LIFE Fibra Caja 560g,S/ 21.50,vivanda,CEREALES PROCESADOS SIMPLES (HOJUELAS),2024-12-04 17:21:26.245803,560.0,g,21.5,vivanda,,ÁNGEL,CEREALES PROCESADOS SIMPLES (HOJUELAS)
Cereal de Quinua Nura Choco Pops 200g,S/ 21.50,metro,CEREALES PROCESADOS SIMPLES (HOJUELAS),2024-12-04 20:54:40.266422,200.0,g,21.5,metro,,,CEREALES PROCESADOS SIMPLES (HOJUELAS)
Cereal ÁNGEL Copix Chocolate Doypack 740g,S/ 21.90 un,plaza_vea,CEREALES PROCESADOS SIMPLES (HOJUELAS),2024-12-04 13:11:00.538759,740.0,g,21.9,plaza_vea,Bolsa 740g,,CEREALES PROCESADOS SIMPLES (HOJUELAS)
Cereal ÁNGEL Trigo y Avena Frutas Doypack 840g,S/ 21.90 un,plaza_vea,CEREALES PROCESADOS SIMPLES (HOJUELAS),2024-12-04 13:11:00.538759,840.0,g,21.9,plaza_vea,Bolsa 840g,,CEREALES PROCESADOS SIMPLES (HOJUELAS)
Cereal ÁNGEL Zuck Hojuelas de Maíz Azucaradas ...,S/ 21.90 un,plaza_vea,CEREALES PROCESADOS SIMPLES (HOJUELAS),2024-12-04 13:11:00.538759,1.0,kg,21.9,plaza_vea,Bolsa 1Kg,,CEREALES PROCESADOS SIMPLES (HOJUELAS)
Cereal ANGEL Aritos de Maíz Trigo y Miel Bolsa...,S/ 21.90 un,plaza_vea,CEREALES PROCESADOS SIMPLES (HOJUELAS),2024-12-04 13:11:00.538759,840.0,g,21.9,plaza_vea,Bolsa 840g,,CEREALES PROCESADOS SIMPLES (HOJUELAS)
Cereal en Hojuelas de Maíz Azúcaradas Zuck 1 kg,S/ 22,tottus,CEREALES PROCESADOS SIMPLES (HOJUELAS),2024-12-04 13:06:23.303851,1.0,kg,22.0,tottus,,ANGEL,CEREALES PROCESADOS SIMPLES (HOJUELAS)
Cereales Angel Life Fibra Contenido 560 g,S/ 22.60,metro,CEREALES PROCESADOS SIMPLES (HOJUELAS),2024-12-04 20:54:40.266422,560.0,g,22.6,metro,,,CEREALES PROCESADOS SIMPLES (HOJUELAS)
Cereales Angel Life Fibra Contenido 560 g,S/ 22.60,wong,CEREALES PROCESADOS SIMPLES (HOJUELAS),2024-12-04 18:32:07.751419,560.0,g,22.6,wong,,,CEREALES PROCESADOS SIMPLES (HOJUELAS)
Cereales Angel Life Protein Contenido 560 g,S/ 22.60,wong,CEREALES PROCESADOS SIMPLES (HOJUELAS),2024-12-04 18:32:07.751419,560.0,g,22.6,wong,,,CEREALES PROCESADOS SIMPLES (HOJUELAS)
Cereales Angel Life Protein Contenido 560 g,S/ 22.60,metro,CEREALES PROCESADOS SIMPLES (HOJUELAS),2024-12-04 20:54:40.266422,560.0,g,22.6,metro,,,CEREALES PROCESADOS SIMPLES (HOJUELAS)
Cereal ÁNGEL Copix Chocolate Bolsa 740g,S/ 22.80,vivanda,CEREALES PROCESADOS SIMPLES (HOJUELAS),2024-12-04 17:21:26.245803,740.0,g,22.8,vivanda,,ÁNGEL,CEREALES PROCESADOS SIMPLES (HOJUELAS)
Cereal Chocapic 540g,S/ 22.90,wong,CEREALES PROCESADOS SIMPLES (HOJUELAS),2024-12-04 18:32:07.751419,540.0,g,22.9,wong,,,CEREALES PROCESADOS SIMPLES (HOJUELAS)
Cereal Chocapic 540g,S/ 22.90,metro,CEREALES PROCESADOS SIMPLES (HOJUELAS),2024-12-04 20:54:40.266422,540.0,g,22.9,metro,,,CEREALES PROCESADOS SIMPLES (HOJUELAS)
Cereal con Sabor a Frutas Angel Frutt Bolsa 840 gr,S/ 23.20,metro,CEREALES PROCESADOS SIMPLES (HOJUELAS),2024-12-04 20:54:40.266422,840.0,g,23.2,metro,,,CEREALES PROCESADOS SIMPLES (HOJUELAS)
Cereal Angel Meli Bolsa 840 g,S/ 23.20,metro,CEREALES PROCESADOS SIMPLES (HOJUELAS),2024-12-04 20:54:40.266422,840.0,g,23.2,metro,,,CEREALES PROCESADOS SIMPLES (HOJUELAS)
Cereal Angel Chock Contenido 840 g,S/ 23.20,metro,CEREALES PROCESADOS SIMPLES (HOJUELAS),2024-12-04 20:54:40.266422,840.0,g,23.2,metro,,,CEREALES PROCESADOS SIMPLES (HOJUELAS)
Cereal Zuck Bolsa 1 Kg,S/ 23.20,metro,CEREALES PROCESADOS SIMPLES (HOJUELAS),2024-12-04 20:54:40.266422,1.0,kg,23.2,metro,,,CEREALES PROCESADOS SIMPLES (HOJUELAS)
Cereal Copix con Marshmallows Bolsa 740 g,S/ 23.20,metro,CEREALES PROCESADOS SIMPLES (HOJUELAS),2024-12-04 20:54:40.266422,740.0,g,23.2,metro,,,CEREALES PROCESADOS SIMPLES (HOJUELAS)
Cereal Angel Chock Contenido 840 g,S/ 23.50,wong,CEREALES PROCESADOS SIMPLES (HOJUELAS),2024-12-04 18:32:07.751419,840.0,g,23.5,wong,,,CEREALES PROCESADOS SIMPLES (HOJUELAS)
Cereal Orgánico Hearty Flakes Ecoandino Caja 300 g,S/ 23.90,wong,CEREALES PROCESADOS SIMPLES (HOJUELAS),2024-12-04 18:32:07.751419,300.0,g,23.9,wong,,,CEREALES PROCESADOS SIMPLES (HOJUELAS)
Cereal Infantil en Polvo Cerelac 5 Cereales y Leche 400g,S/ 24.60,metro,CEREALES PROCESADOS SIMPLES (HOJUELAS),2024-12-04 20:54:40.266422,400.0,g,24.6,metro,,,CEREALES PROCESADOS SIMPLES (HOJUELAS)
Cereal Infantil en Polvo Cerelac 5 Cereales y Leche 400g,S/ 24.60,wong,CEREALES PROCESADOS SIMPLES (HOJUELAS),2024-12-04 18:32:07.751419,400.0,g,24.6,wong,,,CEREALES PROCESADOS SIMPLES (HOJUELAS)
