description,price,website,search_term,scrape_timestamp,cantidad,unidad,price_numeric,WEB,unit,brand,CLASIFICACION
Hamburguesa de Carne Artesanales Los Hierros 4un,S/ 24.90,metro,HAMBURGUESA,2024-12-04 21:07:33.504356,4.0,un,24.9,metro,,,HAMBURGUESA
HAMBURGUESA GARBANZOS Y ESPINACA X 600G,S/ 24.90,tottus,HAMBURGUESA,2024-12-04 13:14:21.788160,600.0,g,24.9,tottus,,SANUA,HAMBURGUESA
Hamburguesas de Lentejas y Champiñones de 600 g,S/ 24.90,tottus,HAMBURGUESA,2024-12-04 13:14:21.788160,600.0,g,24.9,tottus,,SANUA,HAMBURGUESA
Hamburguesa La Magnifica Bolsa 10un,S/ 24.90 un,plaza_vea,HAMBURGUESA,2024-12-04 13:26:59.470052,10.0,un,24.9,plaza_vea,Caja 10un,,HAMBURGUESA
Hamburguesa de Pollo Oregon Foods 8un,S/ 25.00,metro,HAMBURGUESA,2024-12-04 21:07:33.504356,8.0,un,25.0,metro,,,HAMBURGUESA
Hamburguesa de Pollo Oregon Foods 8un,S/ 25.00,wong,HAMBURGUESA,2024-12-04 18:56:29.906518,8.0,un,25.0,wong,,,HAMBURGUESA
Hamburguesas de Res Oregon Foods 8un,S/ 25.10,wong,HAMBURGUESA,2024-12-04 18:56:29.906518,8.0,un,25.1,wong,,,HAMBURGUESA
Hamburguesa Parrillera de Pollo Oregon Foods 4un,S/ 25.40,wong,HAMBURGUESA,2024-12-04 18:56:29.906518,4.0,un,25.4,wong,,,HAMBURGUESA
Hamburguesa Parrillera de Pollo Oregon Foods 4un,S/ 25.40,metro,HAMBURGUESA,2024-12-04 21:07:33.504356,4.0,un,25.4,metro,,,HAMBURGUESA
Carbon Vegetal Arizona x 5 Kg,S/ 25.49,wong,HAMBURGUESA,2024-12-04 18:56:29.906518,5.0,kg,25.49,wong,,,HAMBURGUESA
Milanesa de Pollo AVINKA Bolsa 4un,S/ 25.70 un,plaza_vea,HAMBURGUESA,2024-12-04 13:26:59.470052,600.0,g,25.7,plaza_vea,Bolsa 600g,,HAMBURGUESA
Hamburguesa de Pollo Parrillera Premium,S/ 25.90 x kg,plaza_vea,HAMBURGUESA,2024-12-04 13:26:59.470052,1.0,kg,25.9,plaza_vea,Presentación 1 kg aprox.,,HAMBURGUESA
Hamburguesa de Res y Cerdo SAN FERNANDO Bolsa ...,S/ 25.90 un,plaza_vea,HAMBURGUESA,2024-12-04 13:26:59.470052,8.0,un,25.9,plaza_vea,Bolsa 8un,,HAMBURGUESA
Hamburguesa de Pollo OREGON FOODS Bolsa 8un,S/ 25.90,vivanda,HAMBURGUESA,2024-12-04 17:30:35.099051,8.0,un,25.9,vivanda,,OREGON FOODS,HAMBURGUESA
Albóndigas de Res Oregon Foods 15un,S/ 25.90,metro,HAMBURGUESA,2024-12-04 21:07:33.504356,15.0,un,25.9,metro,,,HAMBURGUESA
Hamburguesa de Res Premium LA FLORENCIA,S/ 25.90 x kg,plaza_vea,HAMBURGUESA,2024-12-04 13:26:59.470052,1.2,kg,25.9,plaza_vea,Presentación 1.2 kg aprox.,,HAMBURGUESA
ENROLLADO DE POLLO CON JAMON QUESO X1KG,S/ 26.18,tottus,HAMBURGUESA,2024-12-04 13:14:21.788160,1.0,kg,26.18,tottus,,TOTTUS,HAMBURGUESA
Enrollado de Pollo con Frutas Secas 1 kg,S/ 26.18,tottus,HAMBURGUESA,2024-12-04 13:14:21.788160,1.0,kg,26.18,tottus,,TOTTUS,HAMBURGUESA
Hamburguesas Parrilleras Wong Caja 4un,S/ 26.90,wong,HAMBURGUESA,2024-12-04 18:56:29.906518,4.0,un,26.9,wong,,,HAMBURGUESA
Hamburguesa de Res OREGON Foods Bolsa 8un,S/ 26.90,vivanda,HAMBURGUESA,2024-12-04 17:30:35.099051,8.0,un,26.9,vivanda,,OREGON FOODS,HAMBURGUESA
Hamburguesa de Res OREGON Foods Bolsa 8un,S/ 26.90 un,plaza_vea,HAMBURGUESA,2024-12-04 13:26:59.470052,8.0,un,26.9,plaza_vea,Bolsa 8un,,HAMBURGUESA
HAMBURGUESA PREMIUM PARRILLERA OK X 4UN,S/ 26.90,tottus,HAMBURGUESA,2024-12-04 13:14:21.788160,4.0,un,26.9,tottus,,OTTO KUNZ,HAMBURGUESA
Hamburguesa Premium Cong LA FLORENCIA x kg,S/ 27.20,vivanda,HAMBURGUESA,2024-12-04 17:30:35.099051,1.0,kg,27.2,vivanda,,LA FLORENCIA,HAMBURGUESA
Hamburguesa de Cordero La Genovesa 2un,S/ 27.50,wong,HAMBURGUESA,2024-12-04 18:56:29.906518,2.0,un,27.5,wong,,,HAMBURGUESA
Mini Burgers de Res Oregon Foods 12un,S/ 27.50,metro,HAMBURGUESA,2024-12-04 21:07:33.504356,12.0,un,27.5,metro,,,HAMBURGUESA
ENROLLADO DE CERDO CON JAMON Y QUESO X1KG,S/ 27.68,tottus,HAMBURGUESA,2024-12-04 13:14:21.788160,1.0,kg,27.68,tottus,,TOTTUS,HAMBURGUESA
ENROLLADO DE CERDO CON TOCINO Y GUINDONES X1KG,S/ 27.68,tottus,HAMBURGUESA,2024-12-04 13:14:21.788160,1.0,kg,27.68,tottus,,TOTTUS,HAMBURGUESA
Milanesa de Pechuga de Pollo OREGON FOODS Bols...,S/ 27.90 un,plaza_vea,HAMBURGUESA,2024-12-04 13:26:59.470052,4.0,un,27.9,plaza_vea,Bolsa 4un,,HAMBURGUESA
Hamburguesa OTTO KUNZ Premium de Res Bolsa 8un,S/ 28.00,vivanda,HAMBURGUESA,2024-12-04 17:30:35.099051,8.0,un,28.0,vivanda,,OTTO KUNZ,HAMBURGUESA
Hamburguesa de Garbanzos y Espinacas SANÚA Caja 5un,S/ 28.00,vivanda,HAMBURGUESA,2024-12-04 17:30:35.099051,5.0,un,28.0,vivanda,,SANUA,HAMBURGUESA
Hamburguesas de Res Oregon Foods 8un,S/ 28.50,metro,HAMBURGUESA,2024-12-04 21:07:33.504356,8.0,un,28.5,metro,,,HAMBURGUESA
Hamburguesa de Res Metro Bolsa 12un,S/ 28.90,metro,HAMBURGUESA,2024-12-04 21:07:33.504356,12.0,un,28.9,metro,,,HAMBURGUESA
Hamburguesa de Res Otto Kunz 8un,S/ 28.90,wong,HAMBURGUESA,2024-12-04 18:56:29.906518,8.0,un,28.9,wong,,,HAMBURGUESA
Hamburguesa de Res Otto Kunz 8un,S/ 28.90,metro,HAMBURGUESA,2024-12-04 21:07:33.504356,8.0,un,28.9,metro,,,HAMBURGUESA
Hamburguesa OTTO KUNZ Parrillera de Res Bolsa 4un,S/ 29.00,vivanda,HAMBURGUESA,2024-12-04 17:30:35.099051,4.0,un,29.0,vivanda,,OTTO KUNZ,HAMBURGUESA
Hamburguesa de Pechuga de Pollo Rico 16un.,S/ 29.40,metro,HAMBURGUESA,2024-12-04 21:07:33.504356,16.0,un,29.4,metro,,,HAMBURGUESA
Mini Hamburguesa Parrillera OTTO KUNZ Caja 600...,S/ 29.90 un,plaza_vea,HAMBURGUESA,2024-12-04 13:26:59.470052,12.0,un,29.9,plaza_vea,Caja 12un,,HAMBURGUESA
Hamburguesa De la Casa Metro x kg,S/ 29.90 x kg,metro,HAMBURGUESA,2024-12-04 21:07:33.504356,1.0,kg,29.9,metro,,,HAMBURGUESA
Filete de Tilapia Apanada SANTA PRISCILA Bolsa...,S/ 29.90 un,plaza_vea,HAMBURGUESA,2024-12-04 13:26:59.470052,454.0,g,29.9,plaza_vea,Bolsa 454g,,HAMBURGUESA
Hamburguesa de Langostino Santa Priscila 4un.,S/ 29.90,metro,HAMBURGUESA,2024-12-04 21:07:33.504356,4.0,un,29.9,metro,,,HAMBURGUESA
MINI HAMBURGUESA X 600G,S/ 29.90,tottus,HAMBURGUESA,2024-12-04 13:14:21.788160,600.0,g,29.9,tottus,,OTTO KUNZ,HAMBURGUESA
Hamburguesa Parrillera de Res Otto Kunz 4un,S/ 29.90,wong,HAMBURGUESA,2024-12-04 18:56:29.906518,4.0,un,29.9,wong,,,HAMBURGUESA
Mini Hamburguesa Angus BELL'S SELECCIÓN Paquete 10un,S/ 30.90,vivanda,HAMBURGUESA,2024-12-04 17:30:35.099051,10.0,un,30.9,vivanda,,BELL'S SELECCIÓN,HAMBURGUESA
Mini Hamburguesa Parrillera OTTO KUNZ Caja 600g,S/ 30.90,vivanda,HAMBURGUESA,2024-12-04 17:30:35.099051,600.0,g,30.9,vivanda,,OTTO KUNZ,HAMBURGUESA
Hamburguesa de Ternero Wong Gourmet 4un,S/ 30.90,wong,HAMBURGUESA,2024-12-04 18:56:29.906518,4.0,un,30.9,wong,,,HAMBURGUESA
Hamburguesa OREGON FOODS Parrillera Novillo Ca...,S/ 31 un,plaza_vea,HAMBURGUESA,2024-12-04 13:26:59.470052,4.0,un,31.0,plaza_vea,Caja 4un,,HAMBURGUESA
Hamburguesa de Langostino Santa Priscila 4un.,S/ 31.50,wong,HAMBURGUESA,2024-12-04 18:56:29.906518,4.0,un,31.5,wong,,,HAMBURGUESA
Mini Hamburguesa Parrillera Otto Kunz 600g,S/ 31.90,wong,HAMBURGUESA,2024-12-04 18:56:29.906518,600.0,g,31.9,wong,,,HAMBURGUESA
Tilapia Marina en Filetes Apanados Santa Priscila 454g,S/ 32.50,metro,HAMBURGUESA,2024-12-04 21:07:33.504356,454.0,g,32.5,metro,,,HAMBURGUESA
Hamburguesa al Guanciale La Genovesa 2un,S/ 32.90,wong,HAMBURGUESA,2024-12-04 18:56:29.906518,2.0,un,32.9,wong,,,HAMBURGUESA
Hamburguesa BEST MEATS Parrillera Novillo Caja 4un,S/ 32.90,vivanda,HAMBURGUESA,2024-12-04 17:30:35.099051,4.0,un,32.9,vivanda,,BEST MEATS,HAMBURGUESA
Hamburguesas Parrilleras Oregon Foods 4un,S/ 33.90,metro,HAMBURGUESA,2024-12-04 21:07:33.504356,4.0,un,33.9,metro,,,HAMBURGUESA
Mini Burger de Res Argentina Cuisine & Co 12un,S/ 33.90,wong,HAMBURGUESA,2024-12-04 18:56:29.906518,12.0,un,33.9,wong,,,HAMBURGUESA
Mini Burger de Res Argentina Cuisine & Co 12un,S/ 33.90,metro,HAMBURGUESA,2024-12-04 21:07:33.504356,12.0,un,33.9,metro,,,HAMBURGUESA
Tizón Especial Arizona Bolsa 5 Kg,S/ 34.49,wong,HAMBURGUESA,2024-12-04 18:56:29.906518,5.0,kg,34.49,wong,,,HAMBURGUESA
Hamburguesa Parrillera BON BEEF Caja 4un,S/ 34.90,vivanda,HAMBURGUESA,2024-12-04 17:30:35.099051,4.0,un,34.9,vivanda,,BON BEEF,HAMBURGUESA
Hamburguesa Parrillera BON BEEF Caja 4un,S/ 34.90 un,plaza_vea,HAMBURGUESA,2024-12-04 13:26:59.470052,4.0,un,34.9,plaza_vea,Caja 4un,,HAMBURGUESA
Hamburguesa Angus BELL'S SELECCIÓN Paquete 4un,S/ 35.90 un,plaza_vea,HAMBURGUESA,2024-12-04 13:26:59.470052,4.0,un,35.9,plaza_vea,Paquete 4un,,HAMBURGUESA
Enrollado de Pollo con Fruta 1.3 kg,S/ 35.90,tottus,HAMBURGUESA,2024-12-04 13:14:21.788160,1.3,kg,35.9,tottus,,REDONDOS,HAMBURGUESA
Mini Hamburguesa Angus BON BEEF Caja 8un,S/ 36.80 un,plaza_vea,HAMBURGUESA,2024-12-04 13:26:59.470052,8.0,un,36.8,plaza_vea,Caja 8un,,HAMBURGUESA
Mini Hamburguesa Angus BON BEEF Caja 8un,S/ 36.80 un,plaza_vea,HAMBURGUESA,2024-12-04 13:26:59.470052,8.0,un,36.8,plaza_vea,Caja 8un,,HAMBURGUESA
Mini Hamburguesa Angus BON BEEF Caja 8un,S/ 36.80,vivanda,HAMBURGUESA,2024-12-04 17:30:35.099051,8.0,un,36.8,vivanda,,BON BEEF,HAMBURGUESA
Mini Hamburguesas Angus Bon Beef Caja 8 Unid,S/ 37.90,wong,HAMBURGUESA,2024-12-04 18:56:29.906518,8.0,un,37.9,wong,,,HAMBURGUESA
Hamburguesa de Res Argentina Cuisine & Co Burger 4un,S/ 39.90,metro,HAMBURGUESA,2024-12-04 21:07:33.504356,4.0,un,39.9,metro,,,HAMBURGUESA
Hamburguesa de Carne de Res Wong Gourmet 4un,S/ 39.90,wong,HAMBURGUESA,2024-12-04 18:56:29.906518,4.0,un,39.9,wong,,,HAMBURGUESA
Enrollado de Cerdo con Frutas 1.3 kg,S/ 39.90,tottus,HAMBURGUESA,2024-12-04 13:14:21.788160,1.3,kg,39.9,tottus,,REDONDOS,HAMBURGUESA
Mini Hamburguesas Wong Gourmet 10un,S/ 39.90,wong,HAMBURGUESA,2024-12-04 18:56:29.906518,10.0,un,39.9,wong,,,HAMBURGUESA
Hamburguesa Angus BELL'S SELECCIÓN Paquete 4un,S/ 40.90,vivanda,HAMBURGUESA,2024-12-04 17:30:35.099051,4.0,un,40.9,vivanda,,BELL'S SELECCIÓN,HAMBURGUESA
Hamburguesa de Res Osso 4un,S/ 46.90,wong,HAMBURGUESA,2024-12-04 18:56:29.906518,4.0,un,46.9,wong,,,HAMBURGUESA
Mini Hamburguesas OREGON FOODS Carne Angus Caj...,S/ 49.50 un,plaza_vea,HAMBURGUESA,2024-12-04 13:26:59.470052,600.0,g,49.5,plaza_vea,Caja 600g,,HAMBURGUESA
Enrollado Delizia de Cerdo San Fernando 1.3 kg,S/ 49.90,tottus,HAMBURGUESA,2024-12-04 13:14:21.788160,1.3,kg,49.9,tottus,,,HAMBURGUESA
Enrollado Delizia de Pavo San Fernando 1 kg,S/ 49.90,tottus,HAMBURGUESA,2024-12-04 13:14:21.788160,1.0,kg,49.9,tottus,,,HAMBURGUESA
Enrollado Americano de Pavo San Fernando 1.3 kg,S/ 49.90,tottus,HAMBURGUESA,2024-12-04 13:14:21.788160,1.3,kg,49.9,tottus,,,HAMBURGUESA
Hamburguesa Angus Rellena de Cheddar Bon Beef 4un,S/ 50.90,metro,HAMBURGUESA,2024-12-04 21:07:33.504356,4.0,un,50.9,metro,,,HAMBURGUESA
Hamburguesas Angus Bon Beef Caja 4 Unid,S/ 51.90,metro,HAMBURGUESA,2024-12-04 21:07:33.504356,4.0,un,51.9,metro,,,HAMBURGUESA
Hamburguesa Angus BON BEEF Caja 4un,S/ 51.90,vivanda,HAMBURGUESA,2024-12-04 17:30:35.099051,4.0,un,51.9,vivanda,,BON BEEF,HAMBURGUESA
Hamburguesa Angus BON BEEF Caja 4un,S/ 51.90 un,plaza_vea,HAMBURGUESA,2024-12-04 13:26:59.470052,4.0,un,51.9,plaza_vea,Caja 4un,,HAMBURGUESA
Hamburguesa Angus BON BEEF Caja 4un,S/ 51.90 un,plaza_vea,HAMBURGUESA,2024-12-04 13:26:59.470052,4.0,un,51.9,plaza_vea,Caja 4un,,HAMBURGUESA
Hamburguesa Angus Rellena de Queso Cheddar BON...,S/ 54.90 un,plaza_vea,HAMBURGUESA,2024-12-04 13:26:59.470052,4.0,un,54.9,plaza_vea,Paquete 4un,,HAMBURGUESA
HAMBURGUESA ANGUS X 800G,S/ 54.90,tottus,HAMBURGUESA,2024-12-04 13:14:21.788160,800.0,g,54.9,tottus,,OTTO KUNZ,HAMBURGUESA
Hamburguesa Angus Rellena de Queso Cheddar BON BEFF Paquete 4un,S/ 54.90,vivanda,HAMBURGUESA,2024-12-04 17:30:35.099051,4.0,un,54.9,vivanda,,BON BEEF,HAMBURGUESA
Hamburguesa Angus Rellena de Cheddar Bon Beef 4un,S/ 55.90,wong,HAMBURGUESA,2024-12-04 18:56:29.906518,4.0,un,55.9,wong,,,HAMBURGUESA
Hamburguesa al Tartufo La Genovesa 2un,S/ 56.50,wong,HAMBURGUESA,2024-12-04 18:56:29.906518,2.0,un,56.5,wong,,,HAMBURGUESA
Hamburguesa BEST MEATS Bife Caja 4un,S/ 56.70,vivanda,HAMBURGUESA,2024-12-04 17:30:35.099051,4.0,un,56.7,vivanda,,BEST MEATS,HAMBURGUESA
Hamburguesa de Cordero y Res Terraza Grill Caja 4un 800g,S/ 56.90,wong,HAMBURGUESA,2024-12-04 18:56:29.906518,4.0,un,56.9,wong,,,HAMBURGUESA
Hamburguesa de Carne Angus Terraza Grill 4un 800g,S/ 57.90,wong,HAMBURGUESA,2024-12-04 18:56:29.906518,4.0,un,57.9,wong,,,HAMBURGUESA
Hamburguesa Angus OTTO KUNZ Caja 4 un,S/ 57.90 un,plaza_vea,HAMBURGUESA,2024-12-04 13:26:59.470052,4.0,un,57.9,plaza_vea,Caja 4un,,HAMBURGUESA
Mini Hamburguesas BEST MEATS Carne Angus Caja 600g,S/ 58.10,vivanda,HAMBURGUESA,2024-12-04 17:30:35.099051,600.0,g,58.1,vivanda,,BEST MEATS,HAMBURGUESA
Hamburguesas Angus Oregon Foods 4un,S/ 58.90,metro,HAMBURGUESA,2024-12-04 21:07:33.504356,4.0,un,58.9,metro,,,HAMBURGUESA
American Angus Beef Chuck Burger Porthos Caja 4 Unid / 760 g,S/ 58.90,wong,HAMBURGUESA,2024-12-04 18:56:29.906518,4.0,un,58.9,wong,,,HAMBURGUESA
Hamburguesa Angus con Sal de Maras Otto Kunz Caja 4 unid,S/ 59.90,metro,HAMBURGUESA,2024-12-04 21:07:33.504356,4.0,un,59.9,metro,,,HAMBURGUESA
Mini Burgers Angus Oregon Foods 12un,S/ 59.90,wong,HAMBURGUESA,2024-12-04 18:56:29.906518,12.0,un,59.9,wong,,,HAMBURGUESA
Hamburguesa Angus con Sal de Maras Otto Kunz Caja 4 unid,S/ 59.90,wong,HAMBURGUESA,2024-12-04 18:56:29.906518,4.0,un,59.9,wong,,,HAMBURGUESA
Hamburguesa BEST MEATS Carne Angus Caja 4un,S/ 60.00,vivanda,HAMBURGUESA,2024-12-04 17:30:35.099051,4.0,un,60.0,vivanda,,BEST MEATS,HAMBURGUESA
Hamburguesas Angus Oregon Foods 4un,S/ 61.90,wong,HAMBURGUESA,2024-12-04 18:56:29.906518,4.0,un,61.9,wong,,,HAMBURGUESA
