description,price,website,search_term,scrape_timestamp,cantidad,unidad,price_numeric,WEB,unit,brand,CLASIFICACION
Pan para Hamburguesa 5un,S/ 3.00,wong,HAMBURGUESA,2024-12-04 18:56:29.906518,5.0,un,3.0,wong,,,HAMBURGUESA
Arveja Partida 500 g,S/ 4.20,tottus,HAMBURGUESA,2024-12-04 13:14:21.788160,500.0,g,4.2,tottus,,TESORO DEL CAMPO,HAMBURGUESA
Nuggets de Pollo San Fernando Paquete 10un,S/ 4.40 un,plaza_vea,HAMBURGUESA,2024-12-04 13:26:59.470052,10.0,un,4.4,plaza_vea,Paquete 10un,,HAMBURGUESA
Nuggets De Pollo (10 unidades),S/ 4.90,tottus,HAMBURGUESA,2024-12-04 13:14:21.788160,10.0,un,4.9,tottus,,SAN FERNANDO,HAMBURGUESA
CHIKI NUGGETS X 200 GR,S/ 4.90,tottus,HAMBURGUESA,2024-12-04 13:14:21.788160,200.0,g,4.9,tottus,,REDONDOS,HAMBURGUESA
Nuggets de Pollo Crispy San Fernando Paquete 1...,S/ 5 un,plaza_vea,HAMBURGUESA,2024-12-04 13:26:59.470052,10.0,un,5.0,plaza_vea,Paquete 10un,,HAMBURGUESA
Pan Hamburguesa LA FLORENCIA Bolsa 405g,S/ 5.00,vivanda,HAMBURGUESA,2024-12-04 17:30:35.099051,405.0,g,5.0,vivanda,,LA FLORENCIA,HAMBURGUESA
Chiqui Nuggets REDONDOS Bolsa 270g,S/ 5.10 un,plaza_vea,HAMBURGUESA,2024-12-04 13:26:59.470052,10.0,un,5.1,plaza_vea,Bolsa 10un,,HAMBURGUESA
NUGGETS PECHUGA X 180 GR,S/ 5.50,tottus,HAMBURGUESA,2024-12-04 13:14:21.788160,180.0,g,5.5,tottus,,REDONDOS,HAMBURGUESA
Frijol Panamito 500 g,S/ 5.70,tottus,HAMBURGUESA,2024-12-04 13:14:21.788160,500.0,g,5.7,tottus,,TOTTUS,HAMBURGUESA
Nuggets de Pechuga de Pollo REDONDOS Bolsa 12u...,S/ 5.90 un,plaza_vea,HAMBURGUESA,2024-12-04 13:26:59.470052,12.0,un,5.9,plaza_vea,Bolsa 12un,,HAMBURGUESA
HAMB. LA REDONDITA X 6 UNIDADES,S/ 5.90,tottus,HAMBURGUESA,2024-12-04 13:14:21.788160,6.0,un,5.9,tottus,,REDONDOS,HAMBURGUESA
Frijol Castilla Costeño 500 g,S/ 6.60,tottus,HAMBURGUESA,2024-12-04 13:14:21.788160,500.0,g,6.6,tottus,,COSTENO,HAMBURGUESA
Hamburguesa de Pollo REDONDOS Bolsa 360g,S/ 6.60 un,plaza_vea,HAMBURGUESA,2024-12-04 13:26:59.470052,6.0,un,6.6,plaza_vea,Bolsa 6un,,HAMBURGUESA
Nuggets de Pollo Dinosaurios San Fernando Paqu...,S/ 6.70 un,plaza_vea,HAMBURGUESA,2024-12-04 13:26:59.470052,5.0,un,6.7,plaza_vea,Paquete 5un,,HAMBURGUESA
Hamburguesas de Pollo Redondos 6un,S/ 6.80,wong,HAMBURGUESA,2024-12-04 18:56:29.906518,6.0,un,6.8,wong,,,HAMBURGUESA
Hamburguesas de Pollo Redondos 6un,S/ 6.80,metro,HAMBURGUESA,2024-12-04 21:07:33.504356,6.0,un,6.8,metro,,,HAMBURGUESA
Nuggets Pechuga Pollo Chia Sin Freír 180 g,S/ 6.90,tottus,HAMBURGUESA,2024-12-04 13:14:21.788160,180.0,g,6.9,tottus,,SAN FERNANDO,HAMBURGUESA
Pan para Hamburguesa Cuisine & Co 400g,S/ 6.90,wong,HAMBURGUESA,2024-12-04 18:56:29.906518,400.0,g,6.9,wong,,,HAMBURGUESA
Nuggets de Tilapia Marina Santa Priscila 142g,S/ 6.90,metro,HAMBURGUESA,2024-12-04 21:07:33.504356,142.0,g,6.9,metro,,,HAMBURGUESA
Hamburguesa de Carne x un,S/ 7.20,wong,HAMBURGUESA,2024-12-04 18:56:29.906518,1.0,un,7.2,wong,,,HAMBURGUESA
Frijol Canario 500 g,S/ 7.74,tottus,HAMBURGUESA,2024-12-04 13:14:21.788160,500.0,g,7.74,tottus,,TOTTUS,HAMBURGUESA
Burger de Quinua Della Natura 100g,S/ 7.90,metro,HAMBURGUESA,2024-12-04 21:07:33.504356,100.0,g,7.9,metro,,,HAMBURGUESA
Burger de Quinua Della Natura 100g,S/ 7.90,wong,HAMBURGUESA,2024-12-04 18:56:29.906518,100.0,g,7.9,wong,,,HAMBURGUESA
Hamburguesa de Soya BHAKTI NATURA Caja 150g,S/ 8 un,plaza_vea,HAMBURGUESA,2024-12-04 13:26:59.470052,150.0,g,8.0,plaza_vea,Caja 150g,,HAMBURGUESA
Papas Peruanas INKA CHIPS Bembos Hamburguesa Bolsa 120g,S/ 8.30,vivanda,HAMBURGUESA,2024-12-04 17:30:35.099051,120.0,g,8.3,vivanda,,INKA CHIPS,HAMBURGUESA
Pan Hamburguesa Brioche Wong 4un,S/ 8.50,wong,HAMBURGUESA,2024-12-04 18:56:29.906518,4.0,un,8.5,wong,,,HAMBURGUESA
Papa Hamburguesa Bembos 120 g,S/ 8.50,tottus,HAMBURGUESA,2024-12-04 13:14:21.788160,120.0,g,8.5,tottus,,INKA CHIPS,HAMBURGUESA
NUGGETS DE POLLO MULTIGRANOS X 270 GR,S/ 8.60,tottus,HAMBURGUESA,2024-12-04 13:14:21.788160,270.0,g,8.6,tottus,,REDONDOS,HAMBURGUESA
Nuggets De Pechuga De Pollo 12 Un,S/ 8.60,tottus,HAMBURGUESA,2024-12-04 13:14:21.788160,12.0,un,8.6,tottus,,TOTTUS,HAMBURGUESA
Nuggets de Pavita con Cereales SAN FERNANDO Bo...,S/ 8.79 un,plaza_vea,HAMBURGUESA,2024-12-04 13:26:59.470052,10.0,un,8.79,plaza_vea,Bolsa 10un,,HAMBURGUESA
Hamburguesa Cerdo Duroc 360 g,S/ 8.90,tottus,HAMBURGUESA,2024-12-04 13:14:21.788160,360.0,g,8.9,tottus,,REDONDOS,HAMBURGUESA
El Churrasquito de Carne Schilcayo 6un,S/ 8.90,metro,HAMBURGUESA,2024-12-04 21:07:33.504356,6.0,un,8.9,metro,,,HAMBURGUESA
Nuggets de Pollo BELL'S Bolsa 15un,S/ 9 un,plaza_vea,HAMBURGUESA,2024-12-04 13:26:59.470052,15.0,un,9.0,plaza_vea,Paquete 15un,,HAMBURGUESA
Pan Hamburguesa Brioche LA FLORENCIA Bolsa 340g,S/ 9.10,vivanda,HAMBURGUESA,2024-12-04 17:30:35.099051,340.0,g,9.1,vivanda,,LA FLORENCIA,HAMBURGUESA
Nuggets de Pollo con Quinua AVINKA Bolsa 15un,S/ 9.49 un,plaza_vea,HAMBURGUESA,2024-12-04 13:26:59.470052,270.0,g,9.49,plaza_vea,Bolsa 270g,,HAMBURGUESA
Nuggets de Pollo con Brócoli AVINKA Bolsa 15un,S/ 9.50 un,plaza_vea,HAMBURGUESA,2024-12-04 13:26:59.470052,270.0,g,9.5,plaza_vea,Bolsa 270g,,HAMBURGUESA
Deli Bistec San Fernando 4un.,S/ 9.90,metro,HAMBURGUESA,2024-12-04 21:07:33.504356,4.0,un,9.9,metro,,,HAMBURGUESA
Pan Hamburguesa Brioche Artesano 4P Bolsa 360 gr,S/ 10,tottus,HAMBURGUESA,2024-12-04 13:14:21.788160,360.0,g,10.0,tottus,,BIMBO,HAMBURGUESA
Pan Hamburguesa 480 g,S/ 10.50,tottus,HAMBURGUESA,2024-12-04 13:14:21.788160,480.0,g,10.5,tottus,,BIMBO,HAMBURGUESA
Nuggets de Pollo Precocido AVINKA Bolsa 15un,S/ 10.50 un,plaza_vea,HAMBURGUESA,2024-12-04 13:26:59.470052,270.0,g,10.5,plaza_vea,Bolsa 270g,,HAMBURGUESA
NUGGETS PECHUGA X 350 GR,S/ 10.90,tottus,HAMBURGUESA,2024-12-04 13:14:21.788160,350.0,g,10.9,tottus,,REDONDOS,HAMBURGUESA
Hamburguesa Vegana Notburger 95g,S/ 10.90,wong,HAMBURGUESA,2024-12-04 18:56:29.906518,95.0,g,10.9,wong,,,HAMBURGUESA
Nuggets de Pechuga de Pollo REDONDOS Caja 23un,S/ 10.90 un,plaza_vea,HAMBURGUESA,2024-12-04 13:26:59.470052,23.0,un,10.9,plaza_vea,Caja 23un,,HAMBURGUESA
Nuggets de Pollo Safari SAN FERNANDO Bolsa 15u...,S/ 11.40 un,plaza_vea,HAMBURGUESA,2024-12-04 13:26:59.470052,15.0,un,11.4,plaza_vea,Bolsa 15un,,HAMBURGUESA
Dedos de Pollo AVINKA 270g Bolsa 12un x 270g,S/ 11.50 un,plaza_vea,HAMBURGUESA,2024-12-04 13:26:59.470052,276.0,g,11.5,plaza_vea,Bolsa 276g,,HAMBURGUESA
Pan para Hamburguesa Bimbo Bolsa 8 unid,S/ 11.50,wong,HAMBURGUESA,2024-12-04 18:56:29.906518,8.0,un,11.5,wong,,,HAMBURGUESA
Hamburguesa de Pollo LOS HIERROS Bolsa 8un x 6...,S/ 11.90 un,plaza_vea,HAMBURGUESA,2024-12-04 13:26:59.470052,504.0,g,11.9,plaza_vea,Bolsa 504g,,HAMBURGUESA
Chicken Pop Empanizados REDONDOS Bolsa 300g,S/ 11.90 un,plaza_vea,HAMBURGUESA,2024-12-04 13:26:59.470052,300.0,g,11.9,plaza_vea,Bolsa 300g,,HAMBURGUESA
Pan Hamburguesa Brioche Don Mamino 600g,S/ 11.90,tottus,HAMBURGUESA,2024-12-04 13:14:21.788160,600.0,g,11.9,tottus,,DGNOTTAS,HAMBURGUESA
Hamburguesa de pollo REDONDOS Bolsa 14un,S/ 11.99 un,plaza_vea,HAMBURGUESA,2024-12-04 13:26:59.470052,14.0,un,11.99,plaza_vea,Paquete 14un,,HAMBURGUESA
Hamburguesa de pollo REDONDOS Bolsa 14un,S/ 11.99,vivanda,HAMBURGUESA,2024-12-04 17:30:35.099051,14.0,un,11.99,vivanda,,REDONDOS,HAMBURGUESA
Deditos de Pechuga de Pollo REDONDOS Bolsa 300...,S/ 11.99 un,plaza_vea,HAMBURGUESA,2024-12-04 13:26:59.470052,300.0,g,11.99,plaza_vea,Bolsa 300g,,HAMBURGUESA
Hamburguesa San Fernando La Super Rica 14un,S/ 12.45,metro,HAMBURGUESA,2024-12-04 21:07:33.504356,14.0,un,12.45,metro,,,HAMBURGUESA
Hamburguesa San Fernando La Super Rica 14un,S/ 12.45,wong,HAMBURGUESA,2024-12-04 18:56:29.906518,14.0,un,12.45,wong,,,HAMBURGUESA
Hamburguesa de Pollo La Magnífica 14un,S/ 12.49,wong,HAMBURGUESA,2024-12-04 18:56:29.906518,14.0,un,12.49,wong,,,HAMBURGUESA
Hamburguesa de Pollo La Magnífica 14un,S/ 12.49,metro,HAMBURGUESA,2024-12-04 21:07:33.504356,14.0,un,12.49,metro,,,HAMBURGUESA
Nugget De Pollo Con Brocoli Y Queso 12 Un,S/ 12.50,tottus,HAMBURGUESA,2024-12-04 13:14:21.788160,12.0,un,12.5,tottus,,TOTTUS,HAMBURGUESA
Hamburguesa de Carne La Casera SAN FERNANDO Bo...,S/ 12.60 un,plaza_vea,HAMBURGUESA,2024-12-04 13:26:59.470052,910.0,g,12.6,plaza_vea,Bolsa 910g,,HAMBURGUESA
Hamburguesa de Carne La Casera SAN FERNANDO Bolsa 910g,S/ 12.60,vivanda,HAMBURGUESA,2024-12-04 17:30:35.099051,910.0,g,12.6,vivanda,,SAN FERNANDO,HAMBURGUESA
Hamburguesa La Casera de Pollo SAN FERNANDO Bo...,S/ 12.69 un,plaza_vea,HAMBURGUESA,2024-12-04 13:26:59.470052,910.0,g,12.69,plaza_vea,Bolsa 910g,,HAMBURGUESA
Hamburguesa de Carne La Super SAN FERNANDO Bol...,S/ 12.70 un,plaza_vea,HAMBURGUESA,2024-12-04 13:26:59.470052,850.0,g,12.7,plaza_vea,Bolsa 850g,,HAMBURGUESA
Hamburguesa de Carne La Super SAN FERNANDO Bolsa 850g,S/ 12.70,vivanda,HAMBURGUESA,2024-12-04 17:30:35.099051,850.0,g,12.7,vivanda,,SAN FERNANDO,HAMBURGUESA
Pan Hamburguesa Brioche DON MAMINO 600g,S/ 12.90,vivanda,HAMBURGUESA,2024-12-04 17:30:35.099051,600.0,g,12.9,vivanda,,DON MAMINO,HAMBURGUESA
Hamburguesa de Carne de Res La Magnífica 14un.,S/ 12.90,metro,HAMBURGUESA,2024-12-04 21:07:33.504356,14.0,un,12.9,metro,,,HAMBURGUESA
Hamburguesas Pollo 12 unds 600 g,S/ 12.90,tottus,HAMBURGUESA,2024-12-04 13:14:21.788160,12.0,un,12.9,tottus,,NATURAL HOME,HAMBURGUESA
Hamburguesas Practiburguer con Carne BELL'S Bo...,S/ 12.99 un,plaza_vea,HAMBURGUESA,2024-12-04 13:26:59.470052,14.0,un,12.99,plaza_vea,Bolsa 14un,,HAMBURGUESA
Hamburguesas de Pollo Natural Home 600g,S/ 12.99,wong,HAMBURGUESA,2024-12-04 18:56:29.906518,600.0,g,12.99,wong,,,HAMBURGUESA
Queso para Hamburguesa President en Tajadas 200g,S/ 13.20,wong,HAMBURGUESA,2024-12-04 18:56:29.906518,200.0,g,13.2,wong,,,HAMBURGUESA
Hamburguesas Premium de Pollo Los Hierros Bolsa 8 Unid /504 g,S/ 13.25,metro,HAMBURGUESA,2024-12-04 21:07:33.504356,8.0,un,13.25,metro,,,HAMBURGUESA
Pan para Hamburguesa Brioche Don Mamino 600g,S/ 13.30,wong,HAMBURGUESA,2024-12-04 18:56:29.906518,600.0,g,13.3,wong,,,HAMBURGUESA
Nuggets Pechuga 550 g,S/ 13.40,tottus,HAMBURGUESA,2024-12-04 13:14:21.788160,550.0,g,13.4,tottus,,REDONDOS,HAMBURGUESA
Hamburguesa de Res LOS HIERROS Bolsa 4un x 85g,S/ 13.49 un,plaza_vea,HAMBURGUESA,2024-12-04 13:26:59.470052,340.0,g,13.49,plaza_vea,Bolsa 340g,,HAMBURGUESA
La Casera 910 g 14 Un,S/ 13.50,tottus,HAMBURGUESA,2024-12-04 13:14:21.788160,910.0,g,13.5,tottus,,SAN FERNANDO,HAMBURGUESA
HAMBURGUESA CASERA DE CARNE X 14 UNID,S/ 13.50,tottus,HAMBURGUESA,2024-12-04 13:14:21.788160,14.0,un,13.5,tottus,,TOTTUS,HAMBURGUESA
Hamburguesas de Pollo Redondos 14un,S/ 13.50,wong,HAMBURGUESA,2024-12-04 18:56:29.906518,14.0,un,13.5,wong,,,HAMBURGUESA
Hamburguesas de Pollo Redondos 14un,S/ 13.50,metro,HAMBURGUESA,2024-12-04 21:07:33.504356,14.0,un,13.5,metro,,,HAMBURGUESA
Pop Corn Chicken AVINKA Bolsa 350g,S/ 13.70 un,plaza_vea,HAMBURGUESA,2024-12-04 13:26:59.470052,350.0,g,13.7,plaza_vea,Bolsa 350g,,HAMBURGUESA
Tiras de Pechuga de Pollo Empanizados REDONDOS...,S/ 13.70 un,plaza_vea,HAMBURGUESA,2024-12-04 13:26:59.470052,8.0,un,13.7,plaza_vea,Bolsa 8un,,HAMBURGUESA
Hamburguesa OTTO KUNZ Premium de Res Bolsa 4un,S/ 13.90 un,plaza_vea,HAMBURGUESA,2024-12-04 13:26:59.470052,4.0,un,13.9,plaza_vea,Bolsa 4un,,HAMBURGUESA
DEDITOS DE PECHUGA DE POLLO X 300GR,S/ 13.90,tottus,HAMBURGUESA,2024-12-04 13:14:21.788160,300.0,g,13.9,tottus,,REDONDOS,HAMBURGUESA
HAMB. RES PREMIUM X 4 UNIDADES,S/ 13.90,tottus,HAMBURGUESA,2024-12-04 13:14:21.788160,4.0,un,13.9,tottus,,OTTO KUNZ,HAMBURGUESA
Hamburguesa San Fernando La Casera 14un,S/ 14.10,wong,HAMBURGUESA,2024-12-04 18:56:29.906518,14.0,un,14.1,wong,,,HAMBURGUESA
Hamburguesa San Fernando La Casera 14un,S/ 14.10,metro,HAMBURGUESA,2024-12-04 21:07:33.504356,14.0,un,14.1,metro,,,HAMBURGUESA
Alitas sabor a la Brasa REDONDOS Caja 400g,S/ 14.40 un,plaza_vea,HAMBURGUESA,2024-12-04 13:26:59.470052,400.0,g,14.4,plaza_vea,Caja 400g,,HAMBURGUESA
TIRAS DE PECHUGA DE POLLO X 300GR,S/ 14.50,tottus,HAMBURGUESA,2024-12-04 13:14:21.788160,300.0,g,14.5,tottus,,REDONDOS,HAMBURGUESA
Nuggets Pechuga Pollo (24 unidades),S/ 14.50,tottus,HAMBURGUESA,2024-12-04 13:14:21.788160,24.0,un,14.5,tottus,,SAN FERNANDO,HAMBURGUESA
La Super 850 g 14 Un,S/ 14.90,tottus,HAMBURGUESA,2024-12-04 13:14:21.788160,850.0,g,14.9,tottus,,SAN FERNANDO,HAMBURGUESA
Hamburguesas Res 12 unds 600 g,S/ 14.90,tottus,HAMBURGUESA,2024-12-04 13:14:21.788160,12.0,un,14.9,tottus,,NATURAL HOME,HAMBURGUESA
Chicharrón de Pechuga de Pollo OREGAN FOODS Bo...,S/ 14.90 un,plaza_vea,HAMBURGUESA,2024-12-04 13:26:59.470052,300.0,g,14.9,plaza_vea,Bolsa 300g,,HAMBURGUESA
La Súper San Fernando 14un,S/ 14.90,metro,HAMBURGUESA,2024-12-04 21:07:33.504356,14.0,un,14.9,metro,,,HAMBURGUESA
Hamburguesas Premium Artesanales Clásicas Los Hierros Bolsa 4 Unid / 340 g,S/ 14.90,metro,HAMBURGUESA,2024-12-04 21:07:33.504356,4.0,un,14.9,metro,,,HAMBURGUESA
La Sanguchera de Carne Schilcayo 16un,S/ 14.90,metro,HAMBURGUESA,2024-12-04 21:07:33.504356,16.0,un,14.9,metro,,,HAMBURGUESA
Hamburguesa OTTO KUNZ Premium de Res Bolsa 4un,S/ 15.40,vivanda,HAMBURGUESA,2024-12-04 17:30:35.099051,4.0,un,15.4,vivanda,,OTTO KUNZ,HAMBURGUESA
Súper Hamburguesa de Pollo La Segoviana Bolsa 16 unid,S/ 15.50,metro,HAMBURGUESA,2024-12-04 21:07:33.504356,16.0,un,15.5,metro,,,HAMBURGUESA
Milanesa de Pavo SAN FERNANDO Bolsa 415g,S/ 15.79 un,plaza_vea,HAMBURGUESA,2024-12-04 13:26:59.470052,4.0,un,15.79,plaza_vea,Bolsa 4un,,HAMBURGUESA
Hamburguesa de Pollo Schilcayo El Churrasquito 14 un.,S/ 15.80,metro,HAMBURGUESA,2024-12-04 21:07:33.504356,14.0,un,15.8,metro,,,HAMBURGUESA
Hamburguesas Pavo 12 unds 600 g,S/ 15.90,tottus,HAMBURGUESA,2024-12-04 13:14:21.788160,12.0,un,15.9,tottus,,NATURAL HOME,HAMBURGUESA
Mini Hamburguesa Parrillera 8 Un,S/ 15.90,tottus,HAMBURGUESA,2024-12-04 13:14:21.788160,8.0,un,15.9,tottus,,TOTTUS,HAMBURGUESA
Hamburguesa de Res Otto Kunz Bolsa 4 unid,S/ 15.90,metro,HAMBURGUESA,2024-12-04 21:07:33.504356,4.0,un,15.9,metro,,,HAMBURGUESA
Hamburguesas de Pavo Natural Home 600g,S/ 15.99,wong,HAMBURGUESA,2024-12-04 18:56:29.906518,600.0,g,15.99,wong,,,HAMBURGUESA
Nuggets de Pechuga de Pollo REDONDOS Caja 36un,S/ 16.10 un,plaza_vea,HAMBURGUESA,2024-12-04 13:26:59.470052,36.0,un,16.1,plaza_vea,Caja 36un,,HAMBURGUESA
La Casera San Fernando 14un,S/ 16.50,metro,HAMBURGUESA,2024-12-04 21:07:33.504356,14.0,un,16.5,metro,,,HAMBURGUESA
Chicharrón de Pollo AVINKA Bolsa 350g,S/ 16.70 un,plaza_vea,HAMBURGUESA,2024-12-04 13:26:59.470052,350.0,g,16.7,plaza_vea,Bolsa 350g,,HAMBURGUESA
Hamburguesa de Pescado BELL'S Caja 500g,S/ 16.90 un,plaza_vea,HAMBURGUESA,2024-12-04 13:26:59.470052,500.0,g,16.9,plaza_vea,Caja 500g,,HAMBURGUESA
El Churrasquito de Carne Schilcayo 14un,S/ 16.90,metro,HAMBURGUESA,2024-12-04 21:07:33.504356,14.0,un,16.9,metro,,,HAMBURGUESA
Hamburguesa de Pescado BELL'S Caja 500g,S/ 16.90 un,plaza_vea,HAMBURGUESA,2024-12-04 13:26:59.470052,500.0,g,16.9,plaza_vea,Caja 500g,,HAMBURGUESA
Hamburguesa de Salmón Nutritiva 360g,S/ 16.90,metro,HAMBURGUESA,2024-12-04 21:07:33.504356,360.0,g,16.9,metro,,,HAMBURGUESA
Hamburguesa de Pollo Casera REDONDOS,S/ 16.90 x kg,plaza_vea,HAMBURGUESA,2024-12-04 13:26:59.470052,1.0,kg,16.9,plaza_vea,Presentación 1 kg aprox.,,HAMBURGUESA
Queso para Hamburguesa en Tajadas PRESIDENT 200g,S/ 16.90,vivanda,HAMBURGUESA,2024-12-04 17:30:35.099051,200.0,g,16.9,vivanda,,PRESIDENT,HAMBURGUESA
Hamburguesa Vegetal de Finas Hierbas DELLANATU...,S/ 16.90 un,plaza_vea,HAMBURGUESA,2024-12-04 13:26:59.470052,400.0,g,16.9,plaza_vea,Caja 400g,,HAMBURGUESA
Trilogía de Mini Burgers Vegetarianas Della Natura 12un,S/ 16.90,wong,HAMBURGUESA,2024-12-04 18:56:29.906518,12.0,un,16.9,wong,,,HAMBURGUESA
Hamburguesa de Pescado BELL'S Caja 500g,S/ 17.40,vivanda,HAMBURGUESA,2024-12-04 17:30:35.099051,500.0,g,17.4,vivanda,,BELL'S,HAMBURGUESA
Mini Hamburguesas de Res RANCHERAS Bolsa 600g,S/ 17.70 un,plaza_vea,HAMBURGUESA,2024-12-04 13:26:59.470052,12.0,un,17.7,plaza_vea,Bolsa 12un,,HAMBURGUESA
Hamburguesas de Pollo x kg,S/ 17.75 x kg,wong,HAMBURGUESA,2024-12-04 18:56:29.906518,1.0,kg,17.75,wong,,,HAMBURGUESA
Hamburguesas de Pollo x kg,S/ 17.75 x kg,metro,HAMBURGUESA,2024-12-04 21:07:33.504356,1.0,kg,17.75,metro,,,HAMBURGUESA
HAMBURGUESA PARRILLERA DE POLLO - PAQUETE 600 GR,S/ 17.90,tottus,HAMBURGUESA,2024-12-04 13:14:21.788160,600.0,g,17.9,tottus,,REDONDOS,HAMBURGUESA
HAMBURGUESA DE FINAS HIERBAS X600 GR,S/ 17.90,tottus,HAMBURGUESA,2024-12-04 13:14:21.788160,600.0,g,17.9,tottus,,REDONDOS,HAMBURGUESA
Hamburguesa de Pollo Avinka 4un,S/ 17.90,metro,HAMBURGUESA,2024-12-04 21:07:33.504356,4.0,un,17.9,metro,,,HAMBURGUESA
Hamburguesa de Pollo Avinka 4un,S/ 17.90,wong,HAMBURGUESA,2024-12-04 18:56:29.906518,4.0,un,17.9,wong,,,HAMBURGUESA
Hamburguesa de Salmón UMI Bolsa 360g,S/ 17.90 un,plaza_vea,HAMBURGUESA,2024-12-04 13:26:59.470052,4.0,un,17.9,plaza_vea,Bolsa 4un,,HAMBURGUESA
Súper Hamburguesa de Res La Segoviana Bolsa 16 unid,S/ 18.30,metro,HAMBURGUESA,2024-12-04 21:07:33.504356,16.0,un,18.3,metro,,,HAMBURGUESA
Hamburguesa de Salmón UMI Bolsa 360g,S/ 18.40,vivanda,HAMBURGUESA,2024-12-04 17:30:35.099051,360.0,g,18.4,vivanda,,UMIFOODS,HAMBURGUESA
Hamburguesa Vegetariana de Soya Kartriso Bandeja 500 g,S/ 18.60,metro,HAMBURGUESA,2024-12-04 21:07:33.504356,500.0,g,18.6,metro,,,HAMBURGUESA
Milanesa Vegetariana de Soya Kartriso Bandeja 500 g,S/ 18.60,metro,HAMBURGUESA,2024-12-04 21:07:33.504356,500.0,g,18.6,metro,,,HAMBURGUESA
Hamburguesa Vegetariana de Soya Kartriso Bandeja 500 g,S/ 18.60,wong,HAMBURGUESA,2024-12-04 18:56:29.906518,500.0,g,18.6,wong,,,HAMBURGUESA
Filete Vegetariano de Soya Kartriso Bandeja 500 g,S/ 18.60,metro,HAMBURGUESA,2024-12-04 21:07:33.504356,500.0,g,18.6,metro,,,HAMBURGUESA
Carbón Vegetal Beef Maker 3kg,S/ 19.43,wong,HAMBURGUESA,2024-12-04 18:56:29.906518,3.0,kg,19.43,wong,,,HAMBURGUESA
Hamburguesa de Pollo Parrillera Finas Hierbas ...,S/ 19.50 un,plaza_vea,HAMBURGUESA,2024-12-04 13:26:59.470052,4.0,un,19.5,plaza_vea,Caja 4un,,HAMBURGUESA
Hamburguesa Parrillera de Pollo Finas Hierba Redondos 4un,S/ 19.90,wong,HAMBURGUESA,2024-12-04 18:56:29.906518,4.0,un,19.9,wong,,,HAMBURGUESA
Hamburguesa de Res La Segoviana Bolsa 14un,S/ 19.90,wong,HAMBURGUESA,2024-12-04 18:56:29.906518,14.0,un,19.9,wong,,,HAMBURGUESA
Hamburguesa Vegana Flexfood Flex Burger 2un,S/ 19.90,metro,HAMBURGUESA,2024-12-04 21:07:33.504356,2.0,un,19.9,metro,,,HAMBURGUESA
Nuggets de Tilapia Marina Santa Priscila 454g,S/ 19.90,metro,HAMBURGUESA,2024-12-04 21:07:33.504356,454.0,g,19.9,metro,,,HAMBURGUESA
Hamburguesa de Res La Segoviana Bolsa 14un,S/ 19.90,metro,HAMBURGUESA,2024-12-04 21:07:33.504356,14.0,un,19.9,metro,,,HAMBURGUESA
Hamburguesa Parrillera de Pollo Redondos 600g,S/ 19.90,wong,HAMBURGUESA,2024-12-04 18:56:29.906518,600.0,g,19.9,wong,,,HAMBURGUESA
Hamburguesa Vegana Flexfood Flex Burger 2un,S/ 19.90,wong,HAMBURGUESA,2024-12-04 18:56:29.906518,2.0,un,19.9,wong,,,HAMBURGUESA
Nuggets de Pollo REDONDOS,S/ 19.90 x kg,plaza_vea,HAMBURGUESA,2024-12-04 13:26:59.470052,1.2,kg,19.9,plaza_vea,Presentación 1.2 kg aprox.,,HAMBURGUESA
Hamburguesa de Trucha Piscis Bolsa 500 g,S/ 19.90,metro,HAMBURGUESA,2024-12-04 21:07:33.504356,500.0,g,19.9,metro,,,HAMBURGUESA
Hamburguesa Parrillera de Pollo Redondos 600g,S/ 19.90,metro,HAMBURGUESA,2024-12-04 21:07:33.504356,600.0,g,19.9,metro,,,HAMBURGUESA
Hamburguesa Vegetariana de Lentejas Della Natura 400g,S/ 19.90,metro,HAMBURGUESA,2024-12-04 21:07:33.504356,400.0,g,19.9,metro,,,HAMBURGUESA
Hamburguesa Parrillera de Pollo Finas Hierba Redondos 4un,S/ 19.90,metro,HAMBURGUESA,2024-12-04 21:07:33.504356,4.0,un,19.9,metro,,,HAMBURGUESA
Hamburguesa Casera de Res LA FLORENCIA,S/ 19.90 x kg,plaza_vea,HAMBURGUESA,2024-12-04 13:26:59.470052,1.1,kg,19.9,plaza_vea,Presentación 1.1 kg aprox.,,HAMBURGUESA
Hamburguesa Vegetariana de Garbanzo Della Natura 400g,S/ 19.90,wong,HAMBURGUESA,2024-12-04 18:56:29.906518,400.0,g,19.9,wong,,,HAMBURGUESA
Hamburguesa Parrillera de Pollo AVINKA Caja 4un,S/ 20.40,vivanda,HAMBURGUESA,2024-12-04 17:30:35.099051,4.0,un,20.4,vivanda,,AVINKA,HAMBURGUESA
Hamburguesa Parrillera de Pollo AVINKA Caja 4u...,S/ 20.40 un,plaza_vea,HAMBURGUESA,2024-12-04 13:26:59.470052,600.0,g,20.4,plaza_vea,Caja 600g,,HAMBURGUESA
Nuggets de Tilapia Marina Santa Priscila 454g,S/ 20.50,wong,HAMBURGUESA,2024-12-04 18:56:29.906518,454.0,g,20.5,wong,,,HAMBURGUESA
Hamburguesa Gluten Free FLEXFOOD Caja 240g,S/ 20.50 un,plaza_vea,HAMBURGUESA,2024-12-04 13:26:59.470052,240.0,g,20.5,plaza_vea,Caja 240g,,HAMBURGUESA
Nuggets de Pescado Empanizado Seafrost 500g,S/ 20.50,wong,HAMBURGUESA,2024-12-04 18:56:29.906518,500.0,g,20.5,wong,,,HAMBURGUESA
Hamburguesa de Pollo SAN FERNANDO Bolsa 6un,S/ 20.70 un,plaza_vea,HAMBURGUESA,2024-12-04 13:26:59.470052,510.0,g,20.7,plaza_vea,Bolsa 510g,,HAMBURGUESA
Hamburguesa Vegetariana de Lentejas Della Natura 400g,S/ 20.90,wong,HAMBURGUESA,2024-12-04 18:56:29.906518,400.0,g,20.9,wong,,,HAMBURGUESA
Hamburguesas Vegetarianas Della Natura Sabor Ahumado 400g,S/ 20.90,wong,HAMBURGUESA,2024-12-04 18:56:29.906518,400.0,g,20.9,wong,,,HAMBURGUESA
Hamburguesas Vegetarianas Finas Hierbas Della Natura 400g,S/ 20.90,wong,HAMBURGUESA,2024-12-04 18:56:29.906518,400.0,g,20.9,wong,,,HAMBURGUESA
Hamburguesa de Lentejas DELLANATURA Caja 400g,S/ 20.90,vivanda,HAMBURGUESA,2024-12-04 17:30:35.099051,400.0,g,20.9,vivanda,,DELLANATURA,HAMBURGUESA
Hamburguesa de Lentejas DELLANATURA Caja 400g,S/ 20.90 un,plaza_vea,HAMBURGUESA,2024-12-04 13:26:59.470052,400.0,g,20.9,plaza_vea,Caja 400g,,HAMBURGUESA
Mix Mini Hamburguesas SANÚA Caja 500g,S/ 21.19,vivanda,HAMBURGUESA,2024-12-04 17:30:35.099051,500.0,g,21.19,vivanda,,SANUA,HAMBURGUESA
Hamburguesa de Garbanzos y Espinacas SANÚA Caj...,S/ 21.19 un,plaza_vea,HAMBURGUESA,2024-12-04 13:26:59.470052,5.0,un,21.19,plaza_vea,Caja 5un,,HAMBURGUESA
Hamburguesa de Lentejas y Champiñones SANÚA Ca...,S/ 21.19 un,plaza_vea,HAMBURGUESA,2024-12-04 13:26:59.470052,5.0,un,21.19,plaza_vea,Caja 5un,,HAMBURGUESA
Hamburguesa Mixta SANÚA Caja 5un,S/ 21.19 un,plaza_vea,HAMBURGUESA,2024-12-04 13:26:59.470052,5.0,un,21.19,plaza_vea,Caja 5un,,HAMBURGUESA
Hamburguesa de Lentejas y Champiñones SANÚA Ca...,S/ 21.19 un,plaza_vea,HAMBURGUESA,2024-12-04 13:26:59.470052,5.0,un,21.19,plaza_vea,Caja 5un,,HAMBURGUESA
Mix Mini Hamburguesas SANÚA Caja 500g,S/ 21.19 un,plaza_vea,HAMBURGUESA,2024-12-04 13:26:59.470052,10.0,un,21.19,plaza_vea,Caja 10un,,HAMBURGUESA
Hamburguesa Parrillera 680 g,S/ 21.38,tottus,HAMBURGUESA,2024-12-04 13:14:21.788160,680.0,g,21.38,tottus,,LOS HIERROS,HAMBURGUESA
Hamburguesas de Pavita San Fernando 6un,S/ 21.40,metro,HAMBURGUESA,2024-12-04 21:07:33.504356,6.0,un,21.4,metro,,,HAMBURGUESA
Hamburguesas de Pavita San Fernando 6un,S/ 21.40,wong,HAMBURGUESA,2024-12-04 18:56:29.906518,6.0,un,21.4,wong,,,HAMBURGUESA
Hamburguesas de Pollo San Fernando 6un,S/ 21.50,metro,HAMBURGUESA,2024-12-04 21:07:33.504356,6.0,un,21.5,metro,,,HAMBURGUESA
Hamburguesa de Perico Umi Foods Caja 500 g,S/ 21.50,metro,HAMBURGUESA,2024-12-04 21:07:33.504356,500.0,g,21.5,metro,,,HAMBURGUESA
Hamburguesas de Pollo San Fernando 6un,S/ 21.50,wong,HAMBURGUESA,2024-12-04 18:56:29.906518,6.0,un,21.5,wong,,,HAMBURGUESA
Choriburger San Fernando 12un,S/ 21.90,metro,HAMBURGUESA,2024-12-04 21:07:33.504356,12.0,un,21.9,metro,,,HAMBURGUESA
Filete de Merluza Empanizada Seafrost 500g,S/ 21.90,wong,HAMBURGUESA,2024-12-04 18:56:29.906518,500.0,g,21.9,wong,,,HAMBURGUESA
Mini Hamburguesas de Garbanzos y Espinaca Sanúa 10un,S/ 22.40,wong,HAMBURGUESA,2024-12-04 18:56:29.906518,10.0,un,22.4,wong,,,HAMBURGUESA
Mini Hamburguesas de Quinua y Chía Sanúa 10un,S/ 22.40,wong,HAMBURGUESA,2024-12-04 18:56:29.906518,10.0,un,22.4,wong,,,HAMBURGUESA
Mini Hamburguesas de Frijol Negro y Quinua Sanúa 10un,S/ 22.40,wong,HAMBURGUESA,2024-12-04 18:56:29.906518,10.0,un,22.4,wong,,,HAMBURGUESA
Mini Hamburguesas de Lentejas y Champiñones Sanúa 10un,S/ 22.40,wong,HAMBURGUESA,2024-12-04 18:56:29.906518,10.0,un,22.4,wong,,,HAMBURGUESA
Hamburguesa de Res LOS HIERROS Bolsa 4un x 150...,S/ 22.49 un,plaza_vea,HAMBURGUESA,2024-12-04 13:26:59.470052,600.0,g,22.49,plaza_vea,Bolsa 600g,,HAMBURGUESA
Porciones de Perico Empanizado Seafrost 500g,S/ 22.50,metro,HAMBURGUESA,2024-12-04 21:07:33.504356,500.0,g,22.5,metro,,,HAMBURGUESA
Hamburguesa de Perico Umi Foods Caja 500 g,S/ 22.50,wong,HAMBURGUESA,2024-12-04 18:56:29.906518,500.0,g,22.5,wong,,,HAMBURGUESA
Hamburguesa de Quinua DELLANATURA Caja 400g,S/ 22.90 un,plaza_vea,HAMBURGUESA,2024-12-04 13:26:59.470052,400.0,g,22.9,plaza_vea,Caja 400g,,HAMBURGUESA
Hamburguesa Parrillera BELL'S SELECCIÓN Paquete 4un,S/ 22.90,vivanda,HAMBURGUESA,2024-12-04 17:30:35.099051,4.0,un,22.9,vivanda,,BELL'S SELECCIÓN,HAMBURGUESA
Hamburguesa de Trucha PISCIS Bolsa 500g,S/ 22.90 un,plaza_vea,HAMBURGUESA,2024-12-04 13:26:59.470052,500.0,g,22.9,plaza_vea,Bolsa 500g,,HAMBURGUESA
Hamburguesa de Quinua DELLANATURA Caja 400g,S/ 22.90,vivanda,HAMBURGUESA,2024-12-04 17:30:35.099051,400.0,g,22.9,vivanda,,DELLANATURA,HAMBURGUESA
Hamburguesas de Camote y Frijoles Negros Sanúa 5un,S/ 23.20,wong,HAMBURGUESA,2024-12-04 18:56:29.906518,5.0,un,23.2,wong,,,HAMBURGUESA
Hamburguesa de Res La Magnífica Tradicional 10un,S/ 23.90,metro,HAMBURGUESA,2024-12-04 21:07:33.504356,10.0,un,23.9,metro,,,HAMBURGUESA
Hamburguesa Veggie BON BEEF Caja 600g,S/ 23.90 un,plaza_vea,HAMBURGUESA,2024-12-04 13:26:59.470052,600.0,g,23.9,plaza_vea,Caja 600g,,HAMBURGUESA
Hamburguesa OTTO KUNZ Premium de Res Bolsa 8un,S/ 23.90 un,plaza_vea,HAMBURGUESA,2024-12-04 13:26:59.470052,8.0,un,23.9,plaza_vea,Paquete 8un,,HAMBURGUESA
Hamburguesa Parrillera Duroc 600 g,S/ 24.50,tottus,HAMBURGUESA,2024-12-04 13:14:21.788160,600.0,g,24.5,tottus,,REDONDOS,HAMBURGUESA
Hamburguesa BEST MEATS Parrillera de Pollo Caja 4un,S/ 24.60,vivanda,HAMBURGUESA,2024-12-04 17:30:35.099051,4.0,un,24.6,vivanda,,BEST MEATS,HAMBURGUESA
Suprema de Pollo AVINKA Bolsa 4un,S/ 24.70 un,plaza_vea,HAMBURGUESA,2024-12-04 13:26:59.470052,600.0,g,24.7,plaza_vea,Bolsa 600g,,HAMBURGUESA
Mini Hamburguesa Angus BELL'S SELECCIÓN Paquet...,S/ 24.90 un,plaza_vea,HAMBURGUESA,2024-12-04 13:26:59.470052,10.0,un,24.9,plaza_vea,Paquete 10un,,HAMBURGUESA
