description,price,website,search_term,scrape_timestamp,cantidad,unidad,price_numeric,WEB,unit,brand,CLASIFICACION
Harina BENOTI Sin Prepar Paquete 180 gr,S/ 1.20,vega,HARINA DE TRIGO PREPARADA,2024-12-04 13:02:17.410024,180.0,g,1.2,vega,,Benoti,HARINA DE TRIGO PREPARADA
Harina GRANO DE ORO Sin Preparar Paquete 180gr,S/ 1.30,vega,HARINA DE TRIGO PREPARADA,2024-12-04 13:02:17.410024,180.0,g,1.3,vega,,Grano De Oro,HARINA DE TRIGO PREPARADA
Sémola de Trigo MOLITALIA Bolsa 200gr,S/ 1.70,vega,HARINA DE TRIGO PREPARADA,2024-12-04 13:02:17.410024,200.0,g,1.7,vega,,Molitalia,HARINA DE TRIGO PREPARADA
Pudin UNIVERSAL sabor a Vainilla Bolsa 100gr,S/ 2.50,vega,HARINA DE TRIGO PREPARADA,2024-12-04 13:02:17.410024,100.0,g,2.5,vega,,Universal,HARINA DE TRIGO PREPARADA
Trigo mote VEGA Bolsa 400g,S/ 2.60,vega,HARINA DE TRIGO PREPARADA,2024-12-04 13:02:17.410024,400.0,g,2.6,vega,,Vega,HARINA DE TRIGO PREPARADA
Trigo mote TIMONEL Bolsa 400g,S/ 2.90,vega,HARINA DE TRIGO PREPARADA,2024-12-04 13:02:17.410024,400.0,g,2.9,vega,,Timonel,HARINA DE TRIGO PREPARADA
Chuño UNIVERSAL Bolsa 180gr,S/ 3.30,vega,HARINA DE TRIGO PREPARADA,2024-12-04 13:02:17.410024,180.0,g,3.3,vega,,Universal,HARINA DE TRIGO PREPARADA
Galletas Integral COSTA con Salvado de Trigo Paquete 6u 37g,S/ 4.30,vega,HARINA DE TRIGO PREPARADA,2024-12-04 13:02:17.410024,37.0,g,4.3,vega,,Costa,HARINA DE TRIGO PREPARADA
Harina BENOTI Sin Preparar Paquete 1Kg,S/ 5.30,vega,HARINA DE TRIGO PREPARADA,2024-12-04 13:02:17.410024,1.0,kg,5.3,vega,,Benoti,HARINA DE TRIGO PREPARADA
Harina BENOTI Preparada Paquete 1Kg,S/ 6.00,vega,HARINA DE TRIGO PREPARADA,2024-12-04 13:02:17.410024,1.0,kg,6.0,vega,,Benoti,HARINA DE TRIGO PREPARADA
Harina MOLITALIA sin Preparar Bolsa 1kg,S/ 6.20,vega,HARINA DE TRIGO PREPARADA,2024-12-04 13:02:17.410024,1.0,kg,6.2,vega,,Molitalia,HARINA DE TRIGO PREPARADA
Harina GRANO DE ORO Preparada Paquete 1kg,S/ 6.30,vega,HARINA DE TRIGO PREPARADA,2024-12-04 13:02:17.410024,1.0,kg,6.3,vega,,Grano De Oro,HARINA DE TRIGO PREPARADA
Harina MOLITALIA Preparada Bolsa 1kg,S/ 6.90,vega,HARINA DE TRIGO PREPARADA,2024-12-04 13:02:17.410024,1.0,kg,6.9,vega,,Molitalia,HARINA DE TRIGO PREPARADA
Harina BELL'S De trigo preparada Bolsa 1Kg,S/ 6.90 un,plaza_vea,HARINA DE TRIGO PREPARADA,2024-12-04 12:54:28.760316,1.0,kg,6.9,plaza_vea,Bolsa 1kg,,HARINA DE TRIGO PREPARADA
Harina de Trigo Preparada BELL'S Bolsa 1Kg,S/ 6.90,vivanda,HARINA DE TRIGO PREPARADA,2024-12-04 17:12:47.583570,1.0,kg,6.9,vivanda,,BELL'S,HARINA DE TRIGO PREPARADA
Harina de Trigo Preparada Nicolini 1kg,S/ 6.99,metro,HARINA DE TRIGO PREPARADA,2024-12-04 20:36:42.101296,1.0,kg,6.99,metro,,,HARINA DE TRIGO PREPARADA
Harina de Trigo NICOLINI Preparada Bolsa 1Kg,S/ 6.99,vivanda,HARINA DE TRIGO PREPARADA,2024-12-04 17:12:47.583570,1.0,kg,6.99,vivanda,,NICOLINI,HARINA DE TRIGO PREPARADA
Harina de Trigo NICOLINI Preparada Bolsa 1Kg,S/ 6.99 un,plaza_vea,HARINA DE TRIGO PREPARADA,2024-12-04 12:54:28.760316,1.0,kg,6.99,plaza_vea,Bolsa 1kg,,HARINA DE TRIGO PREPARADA
Harina de Trigo Preparada Nicolini 1kg,S/ 6.99,wong,HARINA DE TRIGO PREPARADA,2024-12-04 18:02:48.695700,1.0,kg,6.99,wong,,,HARINA DE TRIGO PREPARADA
Harina BLANCA FLOR Preparada Paquete 1Kg,S/ 8.00,vega,HARINA DE TRIGO PREPARADA,2024-12-04 13:02:17.410024,1.0,kg,8.0,vega,,Blanca Flor,HARINA DE TRIGO PREPARADA
Harina de Trigo Preparada BLANCA FLOR Bolsa 1K...,S/ 8.49 un,plaza_vea,HARINA DE TRIGO PREPARADA,2024-12-04 12:54:28.760316,1.0,kg,8.49,plaza_vea,Bolsa 1kg,,HARINA DE TRIGO PREPARADA
Harina de Maíz PAN Precocida Bolsa 1kg,S/ 8.50 13%,vega,HARINA DE TRIGO PREPARADA,2024-12-04 13:02:17.410024,1.0,kg,8.5,vega,,P.A.N.,HARINA DE TRIGO PREPARADA
Mizena DURYEA Caja 500gr,S/ 8.90 10%,vega,HARINA DE TRIGO PREPARADA,2024-12-04 13:02:17.410024,500.0,g,8.9,vega,,Duryea,HARINA DE TRIGO PREPARADA
Cerveza CUSQUEÑA Trigo Pack 6 Botella 310ml,S/ 22.50 2%,vega,HARINA DE TRIGO PREPARADA,2024-12-04 13:02:17.410024,310.0,ml,22.5,vega,,Cusqueña,HARINA DE TRIGO PREPARADA
Cerveza CUSQUEÑA Trigo Pack 6 Lata 355ml,S/ 22.90,vega,HARINA DE TRIGO PREPARADA,2024-12-04 13:02:17.410024,6.0,l,22.9,vega,,Cusqueña,HARINA DE TRIGO PREPARADA
