description,price,website,search_term,scrape_timestamp,cantidad,unidad,price_numeric,WEB,unit,brand,CLASIFICACION
Almidón Niagara Original Limón Spray 20 Onzas,S/ 26.60,wong,LIMÓN,2024-12-04 19:21:57.922532,20.0,oz,26.6,wong,,,LIMÓN
Detergente en Polvo Home Care Limón 4kg,S/ 26.90,wong,LIMÓN,2024-12-04 19:21:57.922532,4.0,kg,26.9,wong,,,LIMÓN
Detergente en Polvo Ace Limón 2kg,S/ 27.90,wong,LIMÓN,2024-12-04 19:21:57.922532,2.0,kg,27.9,wong,,,LIMÓN
Detergente en Polvo ACE Limón Bolsa 2Kg,S/ 29.90,vivanda,LIMÓN,2024-12-04 17:41:58.501116,2.0,kg,29.9,vivanda,,ACE,LIMÓN
Té STASH Limón Jengibre Caja 20un,S/ 30.30 un,plaza_vea,LIMÓN,2024-12-04 13:45:54.170665,20.0,un,30.3,plaza_vea,Caja 20un,,LIMÓN
Helado Wong Diet Limón 500g,S/ 32.50,wong,LIMÓN,2024-12-04 19:21:57.922532,500.0,g,32.5,wong,,,LIMÓN
Trapero de Piso con Ojal Virutex Aroma Limón 10un,S/ 32.80,wong,LIMÓN,2024-12-04 19:21:57.922532,10.0,un,32.8,wong,,,LIMÓN
Pack x33 Suplemento Nutricional Efervescente Magnesol Sabor Limón 5g,S/ 36.50,wong,LIMÓN,2024-12-04 19:21:57.922532,5.0,g,36.5,wong,,,LIMÓN
Desinfectante para Pisos Lysol Limón 3.8L,S/ 40.30,wong,LIMÓN,2024-12-04 19:21:57.922532,3.8,l,40.3,wong,,,LIMÓN
Detergente en Polvo ACE Limón Bolsa 4Kg,S/ 42.50 7%,vega,LIMÓN,2024-12-04 13:50:24.287231,4.0,kg,42.5,vega,,Ace,LIMÓN
Limpiador Liquido Metal Silvo Pulidor 200 mL,S/ 43.30,tottus,LIMÓN,2024-12-04 13:25:45.944963,200.0,ml,43.3,tottus,,,LIMÓN
Lavavajillas Líquido Ayudín Limón y Sábila 2.6L,S/ 44.90,wong,LIMÓN,2024-12-04 19:21:57.922532,2.6,l,44.9,wong,,,LIMÓN
Detergente en Polvo Ace Limón 4kg,S/ 44.90,metro,LIMÓN,2024-12-04 21:26:34.557750,4.0,kg,44.9,metro,,,LIMÓN
Pie de Limón LA FLORENCIA 1un,S/ 45.90 un,plaza_vea,LIMÓN,2024-12-04 13:45:54.170665,1.0,un,45.9,plaza_vea,Bandeja 1un,,LIMÓN
Pie de Limón LA FLORENCIA 1un,S/ 45.90,vivanda,LIMÓN,2024-12-04 17:41:58.501116,1.0,un,45.9,vivanda,,LA FLORENCIA,LIMÓN
Pastillas para Lavavajillas Frosch Limón 30un,S/ 50.90,wong,LIMÓN,2024-12-04 19:21:57.922532,30.0,un,50.9,wong,,,LIMÓN
Ron BACARDI Limón Botella 750ml,S/ 52.90 un,plaza_vea,LIMÓN,2024-12-04 13:45:54.170665,750.0,ml,52.9,plaza_vea,Botella 750ml,,LIMÓN
Ron Blanco Bacardí Limón Botella 750ml,S/ 54.90,metro,LIMÓN,2024-12-04 21:26:34.557750,750.0,ml,54.9,metro,,,LIMÓN
Detergente en Polvo ACE Limón Bolsa 4Kg,S/ 54.90,vivanda,LIMÓN,2024-12-04 17:41:58.501116,4.0,kg,54.9,vivanda,,ACE,LIMÓN
Pack Pisco CUATRO GALLOS Puro Quebranta Botell...,S/ 68.89 un,plaza_vea,LIMÓN,2024-12-04 13:45:54.170665,2.0,un,68.89,plaza_vea,Pack 2un,,LIMÓN
Detergente en Polvo PEROS Limón Bolsa 15Kg,S/ 72.90,vega,LIMÓN,2024-12-04 13:50:24.287231,15.0,kg,72.9,vega,,PEROS,LIMÓN
Twopack Detergente en Polvo Ace Limón 4kg,S/ 86.90,metro,LIMÓN,2024-12-04 21:26:34.557750,4.0,kg,86.9,metro,,,LIMÓN
Helado Pye de Limón Dulce Pasión 5L,S/ 99.90,metro,LIMÓN,2024-12-04 21:26:34.557750,5.0,l,99.9,metro,,,LIMÓN
