description,price,website,search_term,scrape_timestamp,cantidad,unidad,price_numeric,WEB,unit,brand,CLASIFICACION
"Bebida De Naranja, Mandarina y Limón Citrus Punch Tampico Botella 500 ml",S/ 1.70,metro,LIMÓN,2024-12-04 21:26:34.557750,500.0,ml,1.7,metro,,,LIMÓN
Agua Socosani Saborizada Limon Botella 500 ml,S/ 1.99,metro,LIMÓN,2024-12-04 21:26:34.557750,500.0,ml,1.99,metro,,,LIMÓN
YOG. GRIEGO PIE DE LIMON LAIVE VASO 115G,S/ 2.00,metro,LIMÓN,2024-12-04 21:26:34.557750,115.0,g,2.0,metro,,,LIMÓN
Yogurt Griego LAIVE Sabor a Pie de Limón Vaso ...,S/ 2.20 un,plaza_vea,LIMÓN,2024-12-04 13:45:54.170665,115.0,g,2.2,plaza_vea,Vaso 115g,,LIMÓN
Agua sin Gas SAN LUIS Sabor Limón Botella 625ml,S/ 2.20,vivanda,LIMÓN,2024-12-04 17:41:58.501116,625.0,ml,2.2,vivanda,,SAN LUIS,LIMÓN
Bebida de Agua San Luis Sabor Limón Botella 625ml,S/ 2.20,wong,LIMÓN,2024-12-04 19:21:57.922532,625.0,ml,2.2,wong,,,LIMÓN
Bebida Instantánea en Polvo CLIGHT Limón con Splenda Sobre 7g,S/ 2.30,vivanda,LIMÓN,2024-12-04 17:41:58.501116,7.0,g,2.3,vivanda,,CLIGHT,LIMÓN
Bebida en Polvo Clight Sin Calorías Sabor Limón 14g,S/ 2.30,metro,LIMÓN,2024-12-04 21:26:34.557750,14.0,g,2.3,metro,,,LIMÓN
Bebida Rehidratante Powerade Limón Botella 600ml,S/ 2.40,metro,LIMÓN,2024-12-04 21:26:34.557750,600.0,ml,2.4,metro,,,LIMÓN
Doritos Dinamita Limón 35g,S/ 2.50,metro,LIMÓN,2024-12-04 21:26:34.557750,35.0,g,2.5,metro,,,LIMÓN
Free Tea Limon Light Frasco Vidrio 450 ml,S/ 2.70,metro,LIMÓN,2024-12-04 21:26:34.557750,450.0,ml,2.7,metro,,,LIMÓN
Gaseosa Sprite Lima Limón Botella 500ml,S/ 2.70,wong,LIMÓN,2024-12-04 19:21:57.922532,500.0,ml,2.7,wong,,,LIMÓN
Gaseosa Sprite Lima Limón Botella 500ml,S/ 2.70,metro,LIMÓN,2024-12-04 21:26:34.557750,500.0,ml,2.7,metro,,,LIMÓN
Bebida de Té Verde Sabor Limón Free Tea Botella 500ml,S/ 2.70,wong,LIMÓN,2024-12-04 19:21:57.922532,500.0,ml,2.7,wong,,,LIMÓN
Bebida de Té Verde Sabor Limón Free Tea Botella 500ml,S/ 2.70,metro,LIMÓN,2024-12-04 21:26:34.557750,500.0,ml,2.7,metro,,,LIMÓN
Té Negro Free Tea Limon Botella 500 ml,S/ 2.70,metro,LIMÓN,2024-12-04 21:26:34.557750,500.0,ml,2.7,metro,,,LIMÓN
Free Tea Limon Frasco Vidrio 450 ml,S/ 2.70,metro,LIMÓN,2024-12-04 21:26:34.557750,450.0,ml,2.7,metro,,,LIMÓN
Marshmellows Mr. Mallo Limones Bolsa 100 g,S/ 2.90,metro,LIMÓN,2024-12-04 21:26:34.557750,100.0,g,2.9,metro,,,LIMÓN
Limón x kg,S/ 2.99 x kg,metro,LIMÓN,2024-12-04 21:26:34.557750,1.0,kg,2.99,metro,,,LIMÓN
"Bebida De Naranja, Mandarina y Limón Citrus Punch Tampico Botella 600 ml",S/ 2.99,metro,LIMÓN,2024-12-04 21:26:34.557750,600.0,ml,2.99,metro,,,LIMÓN
Limón Sutil x kg,S/ 2.99 x kg,metro,LIMÓN,2024-12-04 21:26:34.557750,1.0,kg,2.99,metro,,,LIMÓN
Limón Sútil x kg,S/ 2.99 x kg,metro,LIMÓN,2024-12-04 21:26:34.557750,1.0,kg,2.99,metro,,,LIMÓN
Gelatina UMSHA Sabor Limón Bolsa 120g,S/ 3.20,vega,LIMÓN,2024-12-04 13:50:24.287231,120.0,g,3.2,vega,,UMSHA,LIMÓN
Jabón para Ropa Bolívar Limón 190g,S/ 3.20,wong,LIMÓN,2024-12-04 19:21:57.922532,190.0,g,3.2,wong,,,LIMÓN
Limón Ácido,S/ 3.29 x kg,plaza_vea,LIMÓN,2024-12-04 13:45:54.170665,0.5,kg,3.29,plaza_vea,Presentación 0.5 kg aprox.,,LIMÓN
Chicles Sin Azúcar Trident Splash Sabor Fresa y Limón 9un,S/ 3.60,wong,LIMÓN,2024-12-04 19:21:57.922532,9.0,un,3.6,wong,,,LIMÓN
Chicles Sin Azúcar Trident Splash Sabor Fresa y Limón 9un,S/ 3.60,metro,LIMÓN,2024-12-04 21:26:34.557750,9.0,un,3.6,metro,,,LIMÓN
Gelatina UNIVERSAL Sabor a Limón Diet Caja 19g,S/ 3.70 un,plaza_vea,LIMÓN,2024-12-04 13:45:54.170665,19.0,g,3.7,plaza_vea,Caja 19g,,LIMÓN
Gelatina Sabor Limón Diet Universal 19g,S/ 3.70,metro,LIMÓN,2024-12-04 21:26:34.557750,19.0,g,3.7,metro,,,LIMÓN
Gelatina UMSHA Sabor a Limón Bolsa 120g,S/ 3.70 un,plaza_vea,LIMÓN,2024-12-04 13:45:54.170665,120.0,g,3.7,plaza_vea,Sobre 120g,,LIMÓN
Gelatina UMSHA Sabor a Limón Bolsa 120g,S/ 3.70,vivanda,LIMÓN,2024-12-04 17:41:58.501116,120.0,g,3.7,vivanda,,UMSHA,LIMÓN
Gelatina Sabor Limón Diet Universal 19g,S/ 3.80,wong,LIMÓN,2024-12-04 19:21:57.922532,19.0,g,3.8,wong,,,LIMÓN
Lavavajillas en Pasta Home Care Limón 800g,S/ 3.90,wong,LIMÓN,2024-12-04 19:21:57.922532,800.0,g,3.9,wong,,,LIMÓN
Bebida de Agua San Luis Sabor Limón Botella 1.5L,S/ 3.90,wong,LIMÓN,2024-12-04 19:21:57.922532,1.5,l,3.9,wong,,,LIMÓN
Bebida de Agua San Luis Sabor Limón Botella 1.5L,S/ 3.90,metro,LIMÓN,2024-12-04 21:26:34.557750,1.5,l,3.9,metro,,,LIMÓN
Gelatina UNIVERSAL Sabor a Limón Bolsa 130g,S/ 3.99 un,plaza_vea,LIMÓN,2024-12-04 13:45:54.170665,130.0,g,3.99,plaza_vea,Bolsa 130g,,LIMÓN
Limón Acido x kg,S/ 3.99,vivanda,LIMÓN,2024-12-04 17:41:58.501116,1.0,kg,3.99,vivanda,,VIVANDA,LIMÓN
Gelatina Universal de Limón Sobre 130g,S/ 3.99,metro,LIMÓN,2024-12-04 21:26:34.557750,130.0,g,3.99,metro,,,LIMÓN
Limón Tahiti Metro x kg,S/ 3.99 x kg,metro,LIMÓN,2024-12-04 21:26:34.557750,1.0,kg,3.99,metro,,,LIMÓN
"Bebida De Naranja, Mandarina y Limón Citrus Punch Tampico Botella 1.5 lt",S/ 4.00,metro,LIMÓN,2024-12-04 21:26:34.557750,1.5,l,4.0,metro,,,LIMÓN
Gelatina Universal de Limón Sobre 130g,S/ 4.10,wong,LIMÓN,2024-12-04 19:21:57.922532,130.0,g,4.1,wong,,,LIMÓN
Limón Tahíti x kg,S/ 4.19 x kg,metro,LIMÓN,2024-12-04 21:26:34.557750,1.0,kg,4.19,metro,,,LIMÓN
Lejía BOREAL Limón Botella 2000g,S/ 4.20,vivanda,LIMÓN,2024-12-04 17:41:58.501116,2000.0,g,4.2,vivanda,,BOREAL,LIMÓN
Limón Tahití x kg,S/ 4.20,vivanda,LIMÓN,2024-12-04 17:41:58.501116,1.0,kg,4.2,vivanda,,VIVANDA,LIMÓN
Caramelos de Limón BELL'S Bolsa 250g,S/ 4.50,vivanda,LIMÓN,2024-12-04 17:41:58.501116,250.0,g,4.5,vivanda,,BELL'S,LIMÓN
Lejía Home Care Limón 2kg,S/ 4.60,wong,LIMÓN,2024-12-04 19:21:57.922532,2.0,kg,4.6,wong,,,LIMÓN
Lavavajilla en Pasta VCLEAN Limón Pote 800g,S/ 4.90 2%,vega,LIMÓN,2024-12-04 13:50:24.287231,800.0,g,4.9,vega,,Vclean,LIMÓN
Sixpack Galleta con Crema Casino Pie de Limón 43g,S/ 5.00,wong,LIMÓN,2024-12-04 19:21:57.922532,43.0,g,5.0,wong,,,LIMÓN
Sixpack Galleta con Crema Casino Pie de Limón 43g,S/ 5.00,metro,LIMÓN,2024-12-04 21:26:34.557750,43.0,g,5.0,metro,,,LIMÓN
Tripack Bebida Instantánea Clight Sin Calorías Sabor Limón 14g,S/ 5.00,wong,LIMÓN,2024-12-04 19:21:57.922532,14.0,g,5.0,wong,,,LIMÓN
Tripack Bebida Instantánea Clight Sin Calorías Sabor Limón 14g,S/ 5.00,metro,LIMÓN,2024-12-04 21:26:34.557750,14.0,g,5.0,metro,,,LIMÓN
Lavavajilla Líquido Home Care Limón 500ml,S/ 5.00,wong,LIMÓN,2024-12-04 19:21:57.922532,500.0,ml,5.0,wong,,,LIMÓN
Gelatina en Polvo Royal Sabor Limón 160g,S/ 5.20,metro,LIMÓN,2024-12-04 21:26:34.557750,160.0,g,5.2,metro,,,LIMÓN
Lavavajillas Líquido Cif Limón 300ml,S/ 5.20,wong,LIMÓN,2024-12-04 19:21:57.922532,300.0,ml,5.2,wong,,,LIMÓN
Gelatina en Polvo Royal Sabor Limón 160g,S/ 5.20,wong,LIMÓN,2024-12-04 19:21:57.922532,160.0,g,5.2,wong,,,LIMÓN
Limón Eureka x kg,S/ 5.30 x kg,metro,LIMÓN,2024-12-04 21:26:34.557750,1.0,kg,5.3,metro,,,LIMÓN
Galletas Sabor a Limón Colombina Casita de Navidad 50g Surtido,S/ 5.40,metro,LIMÓN,2024-12-04 21:26:34.557750,50.0,g,5.4,metro,,,LIMÓN
Limón Eureka x kg,S/ 5.50 x kg,wong,LIMÓN,2024-12-04 19:21:57.922532,1.0,kg,5.5,wong,,,LIMÓN
Lavavajilla en Pasta SAPOLIO Limón Pote 800g,S/ 5.50 8%,vega,LIMÓN,2024-12-04 13:50:24.287231,800.0,g,5.5,vega,,Sapolio,LIMÓN
Desinfectante Home Care Limón 900ml,S/ 5.50,wong,LIMÓN,2024-12-04 19:21:57.922532,900.0,ml,5.5,wong,,,LIMÓN
Lavavajilla en Pasta BOREAL Limón Pote 800g,S/ 5.50,vivanda,LIMÓN,2024-12-04 17:41:58.501116,800.0,g,5.5,vivanda,,BOREAL,LIMÓN
Lavavajillas en Pasta Home Care Limón 800g,S/ 5.50,metro,LIMÓN,2024-12-04 21:26:34.557750,800.0,g,5.5,metro,,,LIMÓN
Lavavajillas Ayudín Limón y Sábila 280ml,S/ 5.60,wong,LIMÓN,2024-12-04 19:21:57.922532,280.0,ml,5.6,wong,,,LIMÓN
Lavavajilla Líquido AYUDIN Limón y Sábila Botella 280 ml,S/ 5.60,vivanda,LIMÓN,2024-12-04 17:41:58.501116,280.0,ml,5.6,vivanda,,AYUDIN,LIMÓN
Jabón Aroma Limón BOLÍVAR Cuidado Total Paquete 380g,S/ 5.70,vivanda,LIMÓN,2024-12-04 17:41:58.501116,380.0,g,5.7,vivanda,,BOLÍVAR,LIMÓN
Sacagrasa Sapolio Aroma Limón Repuesto 500ml,S/ 5.80,wong,LIMÓN,2024-12-04 19:21:57.922532,500.0,ml,5.8,wong,,,LIMÓN
Lavavajilla Lìquido VCLEAN Limón Frasco 750ml,S/ 5.80 11%,vega,LIMÓN,2024-12-04 13:50:24.287231,750.0,ml,5.8,vega,,Vclean,LIMÓN
Chilcano Bar TABERNERO Limón Botella 275 ml,S/ 5.90 16%,vega,LIMÓN,2024-12-04 13:50:24.287231,275.0,ml,5.9,vega,,Tabernero,LIMÓN
Lavavajilla Líquido AYUDIN Limón y Sábila 280ml,S/ 5.90,vivanda,LIMÓN,2024-12-04 17:41:58.501116,280.0,ml,5.9,vivanda,,AYUDIN,LIMÓN
Limón Gold,S/ 5.90 x kg,plaza_vea,LIMÓN,2024-12-04 13:45:54.170665,0.5,kg,5.9,plaza_vea,Presentación 0.5 kg aprox.,,LIMÓN
Ready To Drink (RTD) PISCANO Chilcano Limón La...,S/ 5.90 un,plaza_vea,LIMÓN,2024-12-04 13:45:54.170665,355.0,ml,5.9,plaza_vea,Lata 355ml,,LIMÓN
Ready To Drink (RTD) PISCANO Chilcano Limón Bo...,S/ 5.90 un,plaza_vea,LIMÓN,2024-12-04 13:45:54.170665,275.0,ml,5.9,plaza_vea,Botella 275ml,,LIMÓN
Bebida Ready to Drink Chilcano Bar Limón Botella 275ml,S/ 5.90,metro,LIMÓN,2024-12-04 21:26:34.557750,275.0,ml,5.9,metro,,,LIMÓN
Bebida Chilcano de Pisco Piscano Limón Botella 275ml,S/ 5.90,metro,LIMÓN,2024-12-04 21:26:34.557750,275.0,ml,5.9,metro,,,LIMÓN
Teja de Limón Helena 30g,S/ 5.99,wong,LIMÓN,2024-12-04 19:21:57.922532,30.0,g,5.99,wong,,,LIMÓN
Lavavajilla en Pasta Sapolio Limón 800g,S/ 6.00,wong,LIMÓN,2024-12-04 19:21:57.922532,800.0,g,6.0,wong,,,LIMÓN
Lavavajilla en Pasta CLORANDINA Limón Pote 1100gr,S/ 6.30,vega,LIMÓN,2024-12-04 13:50:24.287231,1100.0,g,6.3,vega,,Clorandina,LIMÓN
Gaseosa Sprite Lima Limón Botella 2.25L,S/ 6.40,metro,LIMÓN,2024-12-04 21:26:34.557750,2.25,l,6.4,metro,,,LIMÓN
Maní Oriental Granuts Kraks Sabor Limón 180g,S/ 6.50,wong,LIMÓN,2024-12-04 19:21:57.922532,180.0,g,6.5,wong,,,LIMÓN
Lavavajillas en Pasta Ayudín Limón y Sábila 520g,S/ 6.50,wong,LIMÓN,2024-12-04 19:21:57.922532,520.0,g,6.5,wong,,,LIMÓN
Ready To Drink (RTD) CHILCANO BAR Tabernero Li...,S/ 6.50 un,plaza_vea,LIMÓN,2024-12-04 13:45:54.170665,275.0,ml,6.5,plaza_vea,Botella 275ml,,LIMÓN
Bebida Chilcano de Pisco Piscano Limón Lata 473ml,S/ 6.90,metro,LIMÓN,2024-12-04 21:26:34.557750,473.0,ml,6.9,metro,,,LIMÓN
Gaseosa Sprite Lima Limón Botella 3L,S/ 6.90,wong,LIMÓN,2024-12-04 19:21:57.922532,3.0,l,6.9,wong,,,LIMÓN
Gaseosa Sprite Lima Limón Botella 3L,S/ 6.90,metro,LIMÓN,2024-12-04 21:26:34.557750,3.0,l,6.9,metro,,,LIMÓN
"Bebida De Naranja, Mandarina y Limón Citrus Punch Tampico Botella 1.87 lt",S/ 7.10,wong,LIMÓN,2024-12-04 19:21:57.922532,1.87,l,7.1,wong,,,LIMÓN
"Bebida De Naranja, Mandarina y Limón Citrus Punch Tampico Botella 3 Litros",S/ 7.10,wong,LIMÓN,2024-12-04 19:21:57.922532,3.0,l,7.1,wong,,,LIMÓN
"Bebida De Naranja, Mandarina y Limón Citrus Punch Tampico Botella 1.87 lt",S/ 7.10,metro,LIMÓN,2024-12-04 21:26:34.557750,1.87,l,7.1,metro,,,LIMÓN
"Bebida De Naranja, Mandarina y Limón Citrus Punch Tampico Botella 3L",S/ 7.10,metro,LIMÓN,2024-12-04 21:26:34.557750,3.0,l,7.1,metro,,,LIMÓN
Gaseosa SPRITE Lima Limón Botella 3L,S/ 7.50,vivanda,LIMÓN,2024-12-04 17:41:58.501116,3.0,l,7.5,vivanda,,SPRITE,LIMÓN
Bebida Ready to Drink Chilcano Bar Limón Lata 310ml,S/ 7.50,metro,LIMÓN,2024-12-04 21:26:34.557750,310.0,ml,7.5,metro,,,LIMÓN
Lavavajillas Líquido Cif Limón 500ml,S/ 7.64,wong,LIMÓN,2024-12-04 19:21:57.922532,500.0,ml,7.64,wong,,,LIMÓN
Mayonesa DELGA-C con Limón Libre de Grasa Doyp...,S/ 7.70 un,plaza_vea,LIMÓN,2024-12-04 13:45:54.170665,400.0,g,7.7,plaza_vea,Doypack 400g,,LIMÓN
Caramelos Ambrosoli Cocoroko Limón 350g,S/ 7.70,metro,LIMÓN,2024-12-04 21:26:34.557750,350.0,g,7.7,metro,,,LIMÓN
Limpiador Mr Músculo Líquido Quitagrasa Limón Repuesto 500ml,S/ 7.70,wong,LIMÓN,2024-12-04 19:21:57.922532,500.0,ml,7.7,wong,,,LIMÓN
Caramelos Ambrosoli Cocoroko Limón 350g,S/ 7.80,wong,LIMÓN,2024-12-04 19:21:57.922532,350.0,g,7.8,wong,,,LIMÓN
Caramelo de Limón Ambrosoli Gajos 100un,S/ 7.99,wong,LIMÓN,2024-12-04 19:21:57.922532,100.0,un,7.99,wong,,,LIMÓN
Chilcano de Limón PORTÓN Botella 355ml,S/ 8.00,vivanda,LIMÓN,2024-12-04 17:41:58.501116,355.0,ml,8.0,vivanda,,PORTON,LIMÓN
Limpiador Líquido Quitagrasa Naranja Mr. Músculo Repuesto 500 mL,S/ 8,tottus,LIMÓN,2024-12-04 13:25:45.944963,500.0,ml,8.0,tottus,,MR MUSCULO,LIMÓN
Bebida Ready to Drink Portón Chilcano Sabor Limón Lata 355ml,S/ 8.00,metro,LIMÓN,2024-12-04 21:26:34.557750,355.0,ml,8.0,metro,,,LIMÓN
Ready To Drink (RTD) PORTON Chilcano de Limón ...,S/ 8 un,plaza_vea,LIMÓN,2024-12-04 13:45:54.170665,355.0,ml,8.0,plaza_vea,Botella 355ml,,LIMÓN
Lavavajillas en Pasta Ayudín Limón y Sábila 750g,S/ 8.00,wong,LIMÓN,2024-12-04 19:21:57.922532,750.0,g,8.0,wong,,,LIMÓN
Maní Cervecero Sabor Limón y Pimienta Granuts 180g,S/ 8.10,wong,LIMÓN,2024-12-04 19:21:57.922532,180.0,g,8.1,wong,,,LIMÓN
Papas Nativas Fritas Tiyapuy Sabor Limón y Pimienta 142g,S/ 8.50,wong,LIMÓN,2024-12-04 19:21:57.922532,142.0,g,8.5,wong,,,LIMÓN
Lavavajillas en Pasta Ayudín Limón y Sábila 850g,S/ 8.50,wong,LIMÓN,2024-12-04 19:21:57.922532,850.0,g,8.5,wong,,,LIMÓN
Twopack Doritos Dinamita Limón Taquero 80g,S/ 8.50,metro,LIMÓN,2024-12-04 21:26:34.557750,80.0,g,8.5,metro,,,LIMÓN
Infusión Té Verde con Limón BELL'S Caja 20un,S/ 8.59,vivanda,LIMÓN,2024-12-04 17:41:58.501116,20.0,un,8.59,vivanda,,BELL'S,LIMÓN
Infusión Té Verde con Limón BELL'S Caja 20un,S/ 8.59 un,plaza_vea,LIMÓN,2024-12-04 13:45:54.170665,20.0,un,8.59,plaza_vea,Caja 20un,,LIMÓN
Limpia Vidrios Fresco Repuesto Mr. Músculo 500 mL,S/ 8.60,tottus,LIMÓN,2024-12-04 13:25:45.944963,500.0,ml,8.6,tottus,,MR MUSCULO,LIMÓN
Mix Para Hacer Pisco Sour WASSKA Limón verde S...,S/ 8.90 un,plaza_vea,LIMÓN,2024-12-04 13:45:54.170665,125.0,g,8.9,plaza_vea,Sobre 125g,,LIMÓN
Limpiador Quitagrasa Home Care Limón 650ml,S/ 8.90,wong,LIMÓN,2024-12-04 19:21:57.922532,650.0,ml,8.9,wong,,,LIMÓN
Lavavajilla Líquido SAPOLIO Limón Botella 750 ml,S/ 8.90 3%,vega,LIMÓN,2024-12-04 13:50:24.287231,750.0,ml,8.9,vega,,Sapolio,LIMÓN
Chicle Sin Azúcar Trident X Splash Fresa y Limón 23un,S/ 8.90,wong,LIMÓN,2024-12-04 19:21:57.922532,23.0,un,8.9,wong,,,LIMÓN
Té Frío Sabor Limón Don Simon 1.5L,S/ 8.99,metro,LIMÓN,2024-12-04 21:26:34.557750,1.5,l,8.99,metro,,,LIMÓN
Lavavajilla Lìquido VCLEAN Limón Frasco 1.2L,S/ 9.20 7%,vega,LIMÓN,2024-12-04 13:50:24.287231,1.2,l,9.2,vega,,Vclean,LIMÓN
Té Frío Sabor Limón Don Simon 1.5L,S/ 9.30,wong,LIMÓN,2024-12-04 19:21:57.922532,1.5,l,9.3,wong,,,LIMÓN
Lavavajilla Líquida Sapolio Limón Frasco 750 ml,S/ 9.50,wong,LIMÓN,2024-12-04 19:21:57.922532,750.0,ml,9.5,wong,,,LIMÓN
Toallitas Húmedas PET CARE Mascotas Limón Paquete 50un,S/ 9.60,vivanda,LIMÓN,2024-12-04 17:41:58.501116,50.0,un,9.6,vivanda,,PET CARE,LIMÓN
Infusiones WAWASANA Té verde limón Caja 20Un,S/ 9.60,vivanda,LIMÓN,2024-12-04 17:41:58.501116,20.0,un,9.6,vivanda,,WAWASANA,LIMÓN
Infusiones LIPTON Té Limón y Jengibre Caja 10u...,S/ 9.70 un,plaza_vea,LIMÓN,2024-12-04 13:45:54.170665,10.0,un,9.7,plaza_vea,Caja 10un,,LIMÓN
Lavavajillas Líquido Home Care Limón 900ml,S/ 9.80,wong,LIMÓN,2024-12-04 19:21:57.922532,900.0,ml,9.8,wong,,,LIMÓN
Té Verde de Menta y Limón SAINT GOTTARD Matcha Caja 20un,S/ 9.80,vivanda,LIMÓN,2024-12-04 17:41:58.501116,20.0,un,9.8,vivanda,,SAINT GOTTARD,LIMÓN
Pet Care Toallitas Húmedas para Mascotas Aroma Limón Paquete 50 unid,S/ 9.90,wong,LIMÓN,2024-12-04 19:21:57.922532,50.0,un,9.9,wong,,,LIMÓN
Té Verde con Limón Wawasana 20un,S/ 9.90,wong,LIMÓN,2024-12-04 19:21:57.922532,20.0,un,9.9,wong,,,LIMÓN
Caramelos Arcor Limón Bolsa 390 g,S/ 10.20,wong,LIMÓN,2024-12-04 19:21:57.922532,390.0,g,10.2,wong,,,LIMÓN
Caramelos Arcor Limón Bolsa 390 g,S/ 10.20,metro,LIMÓN,2024-12-04 21:26:34.557750,390.0,g,10.2,metro,,,LIMÓN
Lavavajilla Lìquido AYUDIN Limón Frasco 640 ml,S/ 10.50 13%,vega,LIMÓN,2024-12-04 13:50:24.287231,640.0,ml,10.5,vega,,Ayudin,LIMÓN
Cóctel Montesierpe Sour de Limón Lata 473 ml,S/ 10.50,metro,LIMÓN,2024-12-04 21:26:34.557750,473.0,ml,10.5,metro,,,LIMÓN
Desinfectante PineSol Limón 900ml,S/ 10.70,wong,LIMÓN,2024-12-04 19:21:57.922532,900.0,ml,10.7,wong,,,LIMÓN
Kombucha Veda Kión y Limón Botella 260ml,S/ 10.75,metro,LIMÓN,2024-12-04 21:26:34.557750,260.0,ml,10.75,metro,,,LIMÓN
Kombucha Veda Kión y Limón Botella 260ml,S/ 10.75,wong,LIMÓN,2024-12-04 19:21:57.922532,260.0,ml,10.75,wong,,,LIMÓN
Quita Esmalte Family Care Aroma Limón 175ml,S/ 10.90,metro,LIMÓN,2024-12-04 21:26:34.557750,175.0,ml,10.9,metro,,,LIMÓN
Sixpack Agua Sin Gas Sabor Limón San Luis Botella 625ml,S/ 11.00,metro,LIMÓN,2024-12-04 21:26:34.557750,625.0,ml,11.0,metro,,,LIMÓN
Sixpack Agua Sin Gas Sabor Limón San Luis Botella 625ml,S/ 11.00,wong,LIMÓN,2024-12-04 19:21:57.922532,625.0,ml,11.0,wong,,,LIMÓN
Desinfectante Home Care Limón 1.8L,S/ 11.00,wong,LIMÓN,2024-12-04 19:21:57.922532,1.8,l,11.0,wong,,,LIMÓN
Twopack Lavavajilla Líquido Home Care Limón 500ml,S/ 11.40,wong,LIMÓN,2024-12-04 19:21:57.922532,500.0,ml,11.4,wong,,,LIMÓN
Limpiador Multiuso en Crema Cif Bioactive Limón 500ml,S/ 11.73,wong,LIMÓN,2024-12-04 19:21:57.922532,500.0,ml,11.73,wong,,,LIMÓN
Infusión Limón y Jengibre Lipton 10un,S/ 11.80,metro,LIMÓN,2024-12-04 21:26:34.557750,10.0,un,11.8,metro,,,LIMÓN
Helado Momenti Gelato Pie de Limón 120ml,S/ 11.90,metro,LIMÓN,2024-12-04 21:26:34.557750,120.0,ml,11.9,metro,,,LIMÓN
Sacagrasa Sapolio Aroma Limón 650ml,S/ 11.90,wong,LIMÓN,2024-12-04 19:21:57.922532,650.0,ml,11.9,wong,,,LIMÓN
"Bebida De Naranja, Mandarina y Limón Citrus Punch Tampico Botella 3.78 lt",S/ 11.90,wong,LIMÓN,2024-12-04 19:21:57.922532,3.78,l,11.9,wong,,,LIMÓN
Detergente en Polvo Ace Limón 750g,S/ 12.90,wong,LIMÓN,2024-12-04 19:21:57.922532,750.0,g,12.9,wong,,,LIMÓN
Lavavajillas Líquido Ayudín Limón y Sábila 640ml,S/ 12.90,wong,LIMÓN,2024-12-04 19:21:57.922532,640.0,ml,12.9,wong,,,LIMÓN
Detergente en Polvo ACE Aroma Limón Bolsa 750g,S/ 12.90,vivanda,LIMÓN,2024-12-04 17:41:58.501116,750.0,g,12.9,vivanda,,ACE,LIMÓN
Limpiador en Crema CIF Bioactive Limón Botella 750g,S/ 13.20,vivanda,LIMÓN,2024-12-04 17:41:58.501116,750.0,g,13.2,vivanda,,CIF,LIMÓN
Sixpack Gaseosa Sprite Lima Limón Botella 500ml,S/ 13.50,metro,LIMÓN,2024-12-04 21:26:34.557750,500.0,ml,13.5,metro,,,LIMÓN
Sixpack Gaseosa Sprite Lima Limón Botella 500ml,S/ 13.50,wong,LIMÓN,2024-12-04 19:21:57.922532,500.0,ml,13.5,wong,,,LIMÓN
Lavavajilla Líquida Sapolio Limón 1.25 L,S/ 13.90,wong,LIMÓN,2024-12-04 19:21:57.922532,1.25,l,13.9,wong,,,LIMÓN
Lavavajillas Líquido FROSCH Limón Botella 750ml,S/ 13.90,vivanda,LIMÓN,2024-12-04 17:41:58.501116,750.0,ml,13.9,vivanda,,FROSCH,LIMÓN
Lavavajillas Lima Limón Sapolio Frasco 1250 ml,S/ 13.90,metro,LIMÓN,2024-12-04 21:26:34.557750,1250.0,ml,13.9,metro,,,LIMÓN
Lavavajillas Lima Limón Sapolio Frasco 1250 ml,S/ 13.90,wong,LIMÓN,2024-12-04 19:21:57.922532,1250.0,ml,13.9,wong,,,LIMÓN
Pack x2 Chicle Sin Azúcar Trident X Splash Sabor Fresa y Limón 44.6g,S/ 14.00,metro,LIMÓN,2024-12-04 21:26:34.557750,44.6,g,14.0,metro,,,LIMÓN
Lavavajillas Líquido Frosch Limón 750ml,S/ 14.30,wong,LIMÓN,2024-12-04 19:21:57.922532,750.0,ml,14.3,wong,,,LIMÓN
Lavavajilla Lìquido AYUDIN Limón Frasco 900 ml,S/ 14.50 6%,vega,LIMÓN,2024-12-04 13:50:24.287231,900.0,ml,14.5,vega,,Ayudin,LIMÓN
Set Jarra y Exprimidor Basa de Limón Top 2.8L,S/ 14.90,metro,LIMÓN,2024-12-04 21:26:34.557750,2.8,l,14.9,metro,,,LIMÓN
Lustramuebles Premio Aroma Limón 360ml,S/ 15.70,wong,LIMÓN,2024-12-04 19:21:57.922532,360.0,ml,15.7,wong,,,LIMÓN
Lavavajillas Líquido Ayudín Limón y Sábila 900ml,S/ 15.90,wong,LIMÓN,2024-12-04 19:21:57.922532,900.0,ml,15.9,wong,,,LIMÓN
Alfajor de Pie de Limón Nestlé el Manjar 14un.,S/ 15.90,metro,LIMÓN,2024-12-04 21:26:34.557750,14.0,un,15.9,metro,,,LIMÓN
Sazonador Badia Chile con Limón 184g,S/ 16.50,wong,LIMÓN,2024-12-04 19:21:57.922532,184.0,g,16.5,wong,,,LIMÓN
Sardinas al Limón en Aceite Vegetal Vigilante 120g,S/ 16.60,metro,LIMÓN,2024-12-04 21:26:34.557750,120.0,g,16.6,metro,,,LIMÓN
Infusión Té Verde WAWASANA Limón Caja 50un,S/ 16.90,vivanda,LIMÓN,2024-12-04 17:41:58.501116,50.0,un,16.9,vivanda,,WAWASANA,LIMÓN
Té Verde con Limón Wawasana 50un,S/ 16.90,metro,LIMÓN,2024-12-04 21:26:34.557750,50.0,un,16.9,metro,,,LIMÓN
Infusión Té Verde WAWASANA Limón Caja 50un,S/ 16.90 un,plaza_vea,LIMÓN,2024-12-04 13:45:54.170665,50.0,un,16.9,plaza_vea,Caja 50un,,LIMÓN
Sardinas al Limón en Aceite Vegetal Vigilante 120g,S/ 16.90,wong,LIMÓN,2024-12-04 19:21:57.922532,120.0,g,16.9,wong,,,LIMÓN
Sardinas Palacio del Oriente con Limón en Aceite de Oliva Lata 125 g,S/ 17.40,metro,LIMÓN,2024-12-04 21:26:34.557750,125.0,g,17.4,metro,,,LIMÓN
Lavavajilla Lìquido AYUDIN Limón Frasco 1.2L,S/ 17.50 15%,vega,LIMÓN,2024-12-04 13:50:24.287231,1.2,l,17.5,vega,,Ayudin,LIMÓN
Sardinas Palacio del Oriente con Limón en Aceite de Oliva Lata 125 g,S/ 17.60,wong,LIMÓN,2024-12-04 19:21:57.922532,125.0,g,17.6,wong,,,LIMÓN
Renovador De Madera New Look Amarillo 260 mL,S/ 18,tottus,LIMÓN,2024-12-04 13:25:45.944963,260.0,ml,18.0,tottus,,,LIMÓN
Detergente Líquido SAPOLIO Matic Limón Botella 2Lt,S/ 18.50 13%,vega,LIMÓN,2024-12-04 13:50:24.287231,2.0,l,18.5,vega,,Sapolio,LIMÓN
Lavavajillas Líquido Ayudín Limón y Sábila 1.2L,S/ 18.50,metro,LIMÓN,2024-12-04 21:26:34.557750,1.2,l,18.5,metro,,,LIMÓN
Lavavajillas Líquido Ayudín Limón y Sábila 1.2L,S/ 18.50,wong,LIMÓN,2024-12-04 19:21:57.922532,1.2,l,18.5,wong,,,LIMÓN
Lavavajillas Ayudín Lima Limón 1.2L,S/ 18.50,wong,LIMÓN,2024-12-04 19:21:57.922532,1.2,l,18.5,wong,,,LIMÓN
Detergente en Polvo SAPOLIO Limón Bolsa 2000g,S/ 18.50 4%,vega,LIMÓN,2024-12-04 13:50:24.287231,2000.0,g,18.5,vega,,Sapolio,LIMÓN
Infusión Sabor Limón y Frambuesa Twinings 10un.,S/ 19.20,metro,LIMÓN,2024-12-04 21:26:34.557750,10.0,un,19.2,metro,,,LIMÓN
Té TWININGS Limón Jengibre Caja 10un,S/ 19.30,vivanda,LIMÓN,2024-12-04 17:41:58.501116,10.0,un,19.3,vivanda,,TWININGS,LIMÓN
Té TWININGS Limón Jengibre Caja 10un,S/ 19.70 un,plaza_vea,LIMÓN,2024-12-04 13:45:54.170665,10.0,un,19.7,plaza_vea,Caja 10un,,LIMÓN
Ready To Drink (RTD) TABERNERO Sour Limón Bote...,S/ 19.90 un,plaza_vea,LIMÓN,2024-12-04 13:45:54.170665,700.0,ml,19.9,plaza_vea,Botella 700ml,,LIMÓN
Pisco Sour TABERNERO Limón Botella 700ml,S/ 19.90,vivanda,LIMÓN,2024-12-04 17:41:58.501116,700.0,ml,19.9,vivanda,,TABERNERO,LIMÓN
Fourpack Bebida Ready to Drink Corona Tropical Limón & Toronja Lata 355ml,S/ 19.90,metro,LIMÓN,2024-12-04 21:26:34.557750,355.0,ml,19.9,metro,,,LIMÓN
Infusión Sabor Limón y Frambuesa Twinings 10un.,S/ 19.90,wong,LIMÓN,2024-12-04 19:21:57.922532,10.0,un,19.9,wong,,,LIMÓN
Infusión de Hierbas Limón y Jengibre Caja 10 unid,S/ 19.90,wong,LIMÓN,2024-12-04 19:21:57.922532,10.0,un,19.9,wong,,,LIMÓN
Limpiador de Inodoro FROSCH Limón Botella 750 ml,S/ 19.90,vivanda,LIMÓN,2024-12-04 17:41:58.501116,750.0,ml,19.9,vivanda,,FROSCH,LIMÓN
Bebida Ready to Drink Tabernero Sour Limón Botella 700ml,S/ 19.90,metro,LIMÓN,2024-12-04 21:26:34.557750,700.0,ml,19.9,metro,,,LIMÓN
Helado Peziduri Sabor Pie de Limón 900ml,S/ 19.90,metro,LIMÓN,2024-12-04 21:26:34.557750,900.0,ml,19.9,metro,,,LIMÓN
Sour de Limón Santiago Queirolo Botella 700ml,S/ 19.90,metro,LIMÓN,2024-12-04 21:26:34.557750,700.0,ml,19.9,metro,,,LIMÓN
Limón Tahití Deshidratado GO BARMAN Bolsa 25g,S/ 19.90 un,plaza_vea,LIMÓN,2024-12-04 13:45:54.170665,25.0,g,19.9,plaza_vea,Bolsa 25g,,LIMÓN
Detergente en Polvo Home Care Limón 2.4kg,S/ 19.90,wong,LIMÓN,2024-12-04 19:21:57.922532,2.4,kg,19.9,wong,,,LIMÓN
Limón Tahití Deshidratado Go Barman 25g,S/ 19.99,wong,LIMÓN,2024-12-04 19:21:57.922532,25.0,g,19.99,wong,,,LIMÓN
Limpiador Líquido Quitagrasa Limón gatillo Mr. Músculo 500 mL,S/ 20,tottus,LIMÓN,2024-12-04 13:25:45.944963,500.0,ml,20.0,tottus,,MR MUSCULO,LIMÓN
Salpimienta Culantro y Limón Badia 227g,S/ 20.10,wong,LIMÓN,2024-12-04 19:21:57.922532,227.0,g,20.1,wong,,,LIMÓN
Desinfectante PineSol Limón 1.8L,S/ 20.50,wong,LIMÓN,2024-12-04 19:21:57.922532,1.8,l,20.5,wong,,,LIMÓN
Sazonador Pimienta y Limón Badía Frasco 184 g,S/ 20.70,metro,LIMÓN,2024-12-04 21:26:34.557750,184.0,g,20.7,metro,,,LIMÓN
Pack Quitagrasa Cocinas Perfectas Limón 500 ml + Doypack 500 ml,S/ 20.90,tottus,LIMÓN,2024-12-04 13:25:45.944963,500.0,ml,20.9,tottus,,BINNER,LIMÓN
Sazonador Pimienta y Limón Badía Frasco 184 g,S/ 21.60,wong,LIMÓN,2024-12-04 19:21:57.922532,184.0,g,21.6,wong,,,LIMÓN
Lavavajillas Líquido Home Care Limón 4L,S/ 21.90,metro,LIMÓN,2024-12-04 21:26:34.557750,4.0,l,21.9,metro,,,LIMÓN
Limpiador de Hornos y Parrillas Sapolio Aroma Limón 360ml,S/ 21.90,wong,LIMÓN,2024-12-04 19:21:57.922532,360.0,ml,21.9,wong,,,LIMÓN
Detergente Líquido Home Care Limón 3L,S/ 21.90,wong,LIMÓN,2024-12-04 19:21:57.922532,3.0,l,21.9,wong,,,LIMÓN
Lavavajillas Líquido AYUDÍN Limón Botella 1.2L,S/ 22.50,vivanda,LIMÓN,2024-12-04 17:41:58.501116,1.2,l,22.5,vivanda,,AYUDIN,LIMÓN
Helado Sabor Pye de Limón Dulce Pasión 650g,S/ 23.50,wong,LIMÓN,2024-12-04 19:21:57.922532,650.0,g,23.5,wong,,,LIMÓN
Tripack Toallitas Humedas para Mascota Pet Care Limón 50un,S/ 23.70,metro,LIMÓN,2024-12-04 21:26:34.557750,50.0,un,23.7,metro,,,LIMÓN
Twopack Lavavajillas Cif Limón 900ml,S/ 24.16,wong,LIMÓN,2024-12-04 19:21:57.922532,900.0,ml,24.16,wong,,,LIMÓN
Limpiador FROSCH Baño y Ducha Aroma Limón Botella 500ml,S/ 24.50,vivanda,LIMÓN,2024-12-04 17:41:58.501116,500.0,ml,24.5,vivanda,,FROSCH,LIMÓN
Goma de Mascar sin Azúcar TRIDENT Fresa y Limón 10un x17g,S/ 24.90,vivanda,LIMÓN,2024-12-04 17:41:58.501116,10.0,un,24.9,vivanda,,TRIDENT,LIMÓN
Lavavajillas Líquido Ayudín Limón y Sabila 1.4L,S/ 25.50,wong,LIMÓN,2024-12-04 19:21:57.922532,1.4,l,25.5,wong,,,LIMÓN
Ron Saborizado Cartavio Limón Botella 750ml,S/ 25.90,metro,LIMÓN,2024-12-04 21:26:34.557750,750.0,ml,25.9,metro,,,LIMÓN
