description,price,website,search_term,scrape_timestamp,cantidad,unidad,description_no_unit,price_numeric,WEB,unit,brand,CLASIFICACION
Refresco Instantáneo Sabores de Mi Tierra Mango Criollo Sobre 15 g,S/ 1.20,wong,MANGO,2024-12-04 19:35:08.820601,15.0,g,Refresco Instantáneo Sabores de Mi Tierra Mango Criollo Sobre,1.2,wong,,,MANGO
Yogurt Griego Mango Descremado 120g,S/ 1.80,tottus,MANGO,2024-12-04 13:31:58.297897,120.0,g,Yogurt Griego Mango Descremado,1.8,tottus,,GLORIA,MANGO
Yogurt Batido GLORIA Griego Sabor Mango Vaso 120g,S/ 2.20,vivanda,MANGO,2024-12-04 17:49:19.486801,120.0,g,Yogurt Batido GLORIA Griego Sabor Mango Vaso,2.2,vivanda,,GLORIA,MANGO
Bebida de Mango Frugos del Valle Botella 300ml,S/ 2.25,wong,MANGO,2024-12-04 19:35:08.820601,300.0,ml,Bebida de Mango Frugos del Valle Botella,2.25,wong,,,MANGO
Mango Kent x kg,S/ 2.40 x kg,plaza_vea,MANGO,2024-12-04 13:56:16.641590,0.6,kg,Mango Kent,2.4,plaza_vea,Presentación 0.6 kg aprox.,,MANGO
Té negro de mango maracuyá Huerto del Edén 25 unidades,S/ 2.70,tottus,MANGO,2024-12-04 13:31:58.297897,25.0,un,Té negro de mango maracuyá Huerto del Edén ades,2.7,tottus,,HUERTO DEL EDEN,MANGO
Mango Haden,S/ 2.80 x kg,plaza_vea,MANGO,2024-12-04 13:56:16.641590,0.4,kg,Mango Haden,2.8,plaza_vea,Presentación 0.4 kg aprox.,,MANGO
Mango Edward,S/ 2.90 x kg,plaza_vea,MANGO,2024-12-04 13:56:16.641590,0.6,kg,Mango Edward,2.9,plaza_vea,Presentación 0.6 kg aprox.,,MANGO
Bebida Sabor Mango 1 L,S/ 3.90,tottus,MANGO,2024-12-04 13:31:58.297897,1.0,l,Bebida Sabor Mango,3.9,tottus,,WATTS,MANGO
Bebida FRUGOS Sabor a Mango Caja 970ml,S/ 3.90,vivanda,MANGO,2024-12-04 17:49:19.486801,970.0,ml,Bebida FRUGOS Sabor a Mango Caja,3.9,vivanda,,FRUGOS,MANGO
Bebida de Mango Gloria Caja 1L,S/ 3.90,wong,MANGO,2024-12-04 19:35:08.820601,1.0,l,Bebida de Mango Gloria Caja,3.9,wong,,,MANGO
Bebida de Mango Frugos del Valle Caja 970ml,S/ 3.90,wong,MANGO,2024-12-04 19:35:08.820601,970.0,ml,Bebida de Mango Frugos del Valle Caja,3.9,wong,,,MANGO
BEBIDA MANGO X 970ML,S/ 3.90,tottus,MANGO,2024-12-04 13:31:58.297897,970.0,ml,BEBIDA MANGO X,3.9,tottus,,FRUGOS DEL VALLE,MANGO
Bebida GLORIA Mango Caja 1L,S/ 4.00,vega,MANGO,2024-12-04 14:00:44.377946,1.0,l,Bebida GLORIA Mango Caja,4.0,vega,,Gloria,MANGO
Bebida GLORIA Mango Caja 1L,S/ 4.40,vivanda,MANGO,2024-12-04 17:49:19.486801,1.0,l,Bebida GLORIA Mango Caja,4.4,vivanda,,GLORIA,MANGO
Néctar de Mango Selva Botella 300 ml,S/ 4.40,wong,MANGO,2024-12-04 19:35:08.820601,300.0,ml,Néctar de Mango Selva Botella,4.4,wong,,,MANGO
Bebida sabor mango maracuyá y camu camu de 475 mL,S/ 4.40,tottus,MANGO,2024-12-04 13:31:58.297897,475.0,ml,Bebida sabor mango maracuyá y camu camu de,4.4,tottus,,KERO,MANGO
Bebida de Mango Pulp Caja 1 L,S/ 4.50,wong,MANGO,2024-12-04 19:35:08.820601,1.0,l,Bebida de Mango Pulp Caja,4.5,wong,,,MANGO
Bebida de Mango y Fresa Frugos del Valle Caja 1L,S/ 4.50,wong,MANGO,2024-12-04 19:35:08.820601,1.0,l,Bebida de Mango y Fresa Frugos del Valle Caja,4.5,wong,,,MANGO
BEBIDAS DE MANGO CAJA 946ML,S/ 4.50,tottus,MANGO,2024-12-04 13:31:58.297897,946.0,ml,BEBIDAS DE MANGO CAJA,4.5,tottus,,WATTS,MANGO
Bebida de Mango Watts Caja 1L,S/ 4.50,wong,MANGO,2024-12-04 19:35:08.820601,1.0,l,Bebida de Mango Watts Caja,4.5,wong,,,MANGO
Bebida FRUGOS Mango y Fresa Caja 1L,S/ 4.50,vivanda,MANGO,2024-12-04 17:49:19.486801,1.0,l,Bebida FRUGOS Mango y Fresa Caja,4.5,vivanda,,FRUGOS,MANGO
Agua Gasificada LACROIX Mango Lata 355ml,S/ 4.70,vivanda,MANGO,2024-12-04 17:49:19.486801,355.0,ml,Agua Gasificada LACROIX Mango Lata,4.7,vivanda,,LACROIX,MANGO
BEBIDA DE MANGO CAJA 1L,S/ 4.90,tottus,MANGO,2024-12-04 13:31:58.297897,1.0,l,BEBIDA DE MANGO CAJA,4.9,tottus,,GLORIA,MANGO
Compota Mango 6 meses pote x 113g,S/ 4.90,tottus,MANGO,2024-12-04 13:31:58.297897,113.0,g,Compota Mango 6 meses pote x,4.9,tottus,,GERBER,MANGO
Bebida sabor mango 320 mL,S/ 4.95,tottus,MANGO,2024-12-04 13:31:58.297897,320.0,ml,Bebida sabor mango,4.95,tottus,,MOGU MOGU,MANGO
Compota Mango con Quinua CASA VERDE Frasco 120...,S/ 4.99 un,plaza_vea,MANGO,2024-12-04 13:56:16.641590,120.0,g,Compota Mango con Quinua CASA VERDE Frasco 120,4.99,plaza_vea,Frasco 120g,,MANGO
REP BEBIDA MANGO SANDIA 400ML,S/ 5.50,tottus,MANGO,2024-12-04 13:31:58.297897,400.0,ml,REP BEBIDA MANGO SANDIA,5.5,tottus,,FRUMAS,MANGO
BEBIDA MANGO MARACUYA 400ML,S/ 5.50,tottus,MANGO,2024-12-04 13:31:58.297897,400.0,ml,BEBIDA MANGO MARACUYA,5.5,tottus,,FRUMAS,MANGO
Yogurt Griego VAKIMU Sabor a Mango Pasión Pote 160g,S/ 5.50,vivanda,MANGO,2024-12-04 17:49:19.486801,160.0,g,Yogurt Griego VAKIMU Sabor a Mango Pasión Pote,5.5,vivanda,,VAKIMU,MANGO
JUGO DE MANGO DURAZNO X 400 ML,S/ 5.50,tottus,MANGO,2024-12-04 13:31:58.297897,400.0,ml,JUGO DE MANGO DURAZNO X,5.5,tottus,,FRUMAS,MANGO
Bebida FRU+ Sabor a Mango y Durazno Botella 400ml,S/ 5.70,vivanda,MANGO,2024-12-04 17:49:19.486801,400.0,ml,Bebida FRU+ Sabor a Mango y Durazno Botella,5.7,vivanda,,FRU +,MANGO
Jugo de Fruta KERO Mango y Maracuyá Botella 475ml,S/ 5.70,vivanda,MANGO,2024-12-04 17:49:19.486801,475.0,ml,Jugo de Fruta KERO Mango y Maracuyá Botella,5.7,vivanda,,KERO,MANGO
Bebida de Mango y Maracuyá Frumas Botella 400 ml,S/ 5.90,wong,MANGO,2024-12-04 19:35:08.820601,400.0,ml,Bebida de Mango y Maracuyá Frumas Botella,5.9,wong,,,MANGO
Bebida de Mango y Durazno Frumas Botella 400 ml,S/ 5.90,wong,MANGO,2024-12-04 19:35:08.820601,400.0,ml,Bebida de Mango y Durazno Frumas Botella,5.9,wong,,,MANGO
Bebida de Mango Mogu Mogue Botella 320 ml,S/ 5.90,wong,MANGO,2024-12-04 19:35:08.820601,320.0,ml,Bebida de Mango Mogu Mogue Botella,5.9,wong,,,MANGO
"Jugo de Mango, Maracuyá y Camu Camu Kero Botella 475 ml",S/ 5.90,wong,MANGO,2024-12-04 19:35:08.820601,475.0,ml,"Jugo de Mango, Maracuyá y Camu Camu Kero Botella",5.9,wong,,,MANGO
Bebida de Mango y Sandía Frumas Botella 400 ml,S/ 5.90,wong,MANGO,2024-12-04 19:35:08.820601,400.0,ml,Bebida de Mango y Sandía Frumas Botella,5.9,wong,,,MANGO
Pulpa de Mango Congelada El Frutero 500g,S/ 6.59,wong,MANGO,2024-12-04 19:35:08.820601,500.0,g,Pulpa de Mango Congelada El Frutero,6.59,wong,,,MANGO
Jugo Ama Manzana Mango Tetra 200ml,S/ 6.60,wong,MANGO,2024-12-04 19:35:08.820601,200.0,ml,Jugo Ama Manzana Mango Tetra,6.6,wong,,,MANGO
Mermelada de Mango De la Casa 250g,S/ 6.90,metro,MANGO,2024-12-04 21:35:38.941540,250.0,g,Mermelada de Mango De la Casa,6.9,metro,,,MANGO
Melocotón para Dulce,S/ 6.90 x kg,plaza_vea,MANGO,2024-12-04 13:56:16.641590,0.75,kg,Melocotón para Dulce,6.9,plaza_vea,Presentación 0.75 kg aprox.,,MANGO
Mango Kafro x kg,S/ 7.43 x kg,wong,MANGO,2024-12-04 19:35:08.820601,1.0,kg,Mango Kafro,7.43,wong,,,MANGO
Twopack Bebida de Mango Frugos del Valle Caja 1L,S/ 7.50,wong,MANGO,2024-12-04 19:35:08.820601,1.0,l,Twopack Bebida de Mango Frugos del Valle Caja,7.5,wong,,,MANGO
"Yogurt GLORIA ActiBio con Linaza Sabor a Pitahaya, Mango y Arándanos Botella 950g",S/ 7.50,vivanda,MANGO,2024-12-04 17:49:19.486801,950.0,g,"Yogurt GLORIA ActiBio con Linaza Sabor a Pitahaya, Mango y Arándanos Botella",7.5,vivanda,,GLORIA,MANGO
Yogurt Batido GLORIA Griego Sabor Mango Bolsa 800g,S/ 7.70,vivanda,MANGO,2024-12-04 17:49:19.486801,800.0,g,Yogurt Batido GLORIA Griego Sabor Mango Bolsa,7.7,vivanda,,GLORIA,MANGO
Jugo de Naranja Mango Maracuya ECOFRESH Botell...,S/ 7.80 un,plaza_vea,MANGO,2024-12-04 13:56:16.641590,475.0,ml,Jugo de Naranja Mango Maracuya ECOFRESH Botell,7.8,plaza_vea,Botella 475ml,,MANGO
Sixpack Bebida Frugos del Valle Mango Fresa Caja 235ml,S/ 7.90,wong,MANGO,2024-12-04 19:35:08.820601,235.0,ml,Sixpack Bebida Frugos del Valle Mango Fresa Caja,7.9,wong,,,MANGO
Bebida FRUGOS DEL VALLE Mango Caja 235ml Six Pack,S/ 7.90,vivanda,MANGO,2024-12-04 17:49:19.486801,235.0,ml,Bebida FRUGOS DEL VALLE Mango Caja  Six Pack,7.9,vivanda,,FRUGOS,MANGO
Nectar Mango Selva Botella Vidrio 900 ml,S/ 7.90,wong,MANGO,2024-12-04 19:35:08.820601,900.0,ml,Nectar Mango Selva Botella Vidrio,7.9,wong,,,MANGO
"Jugo Cold Pressed de Naranja, Mango y Maracuyá Ecofresh Botella 475ml",S/ 7.90,wong,MANGO,2024-12-04 19:35:08.820601,475.0,ml,"Jugo Cold Pressed de Naranja, Mango y Maracuyá Ecofresh Botella",7.9,wong,,,MANGO
Paleta de Helado Cuisine & Co Mango Maracuyá 108g,S/ 7.90,metro,MANGO,2024-12-04 21:35:38.941540,108.0,g,Paleta de Helado Cuisine & Co Mango Maracuyá,7.9,metro,,,MANGO
Sixpack Bebida de Mango Frugos del Valle Caja 235ml,S/ 7.90,wong,MANGO,2024-12-04 19:35:08.820601,235.0,ml,Sixpack Bebida de Mango Frugos del Valle Caja,7.9,wong,,,MANGO
Bebida Energizante MONSTER Mango Loco Lata 473ml,S/ 8.00,vega,MANGO,2024-12-04 14:00:44.377946,473.0,ml,Bebida Energizante MONSTER Mango Loco Lata,8.0,vega,,MONSTER,MANGO
Chilcano de Mango PORTÓN Lata 355ml,S/ 8.00,vivanda,MANGO,2024-12-04 17:49:19.486801,355.0,ml,Chilcano de Mango PORTÓN Lata,8.0,vivanda,,PORTON,MANGO
Bebida Energizante Monster Energy Mango Loco Lata 473ml,S/ 8.00,wong,MANGO,2024-12-04 19:35:08.820601,473.0,ml,Bebida Energizante Monster Energy Mango Loco Lata,8.0,wong,,,MANGO
Bebida Energizante MONSTER Energy Mango Loco Lata 473ml,S/ 8.00,vivanda,MANGO,2024-12-04 17:49:19.486801,473.0,ml,Bebida Energizante MONSTER Energy Mango Loco Lata,8.0,vivanda,,MONSTER,MANGO
Ready To Drink (RTD) PORTON Chilcano de Mango ...,S/ 8 un,plaza_vea,MANGO,2024-12-04 13:56:16.641590,355.0,ml,Ready To Drink (RTD) PORTON Chilcano de Mango,8.0,plaza_vea,Lata 355ml,,MANGO
Bebida energizante Mango Loco de 473 mL,S/ 8,tottus,MANGO,2024-12-04 13:31:58.297897,473.0,ml,Bebida energizante Mango Loco de,8.0,tottus,,MONSTER,MANGO
Bebida Ready to Drink Portón Chilcano Mango Lata 355ml,S/ 8.00,wong,MANGO,2024-12-04 19:35:08.820601,355.0,ml,Bebida Ready to Drink Portón Chilcano Mango Lata,8.0,wong,,,MANGO
Six Pack Mango Fresa 235 mL,S/ 8.20,tottus,MANGO,2024-12-04 13:31:58.297897,235.0,ml,Six Pack Mango Fresa,8.2,tottus,,FRUGOS DEL VALLE,MANGO
Artesco Pincel Mango de Madera Pack 5 unid,S/ 8.30,wong,MANGO,2024-12-04 19:35:08.820601,5.0,un,Artesco Pincel Mango de Madera Pack,8.3,wong,,,MANGO
Mango en Trozos Congelado FEST Paquete 500g,S/ 8.70 un,plaza_vea,MANGO,2024-12-04 13:56:16.641590,500.0,g,Mango en Trozos Congelado FEST Paquete,8.7,plaza_vea,Paquete 500g,,MANGO
Mix Para Hacer Pisco Sour WASSKA Mango y Camu ...,S/ 8.90 un,plaza_vea,MANGO,2024-12-04 13:56:16.641590,125.0,g,Mix Para Hacer Pisco Sour WASSKA Mango y Camu,8.9,plaza_vea,Caja 125g,,MANGO
Sour WASSKA Mango y Camu Camu Caja 125g,S/ 8.90,vivanda,MANGO,2024-12-04 17:49:19.486801,125.0,g,Sour WASSKA Mango y Camu Camu Caja,8.9,vivanda,,WASSKA,MANGO
Mermelada de Arándano y Mango Casa Verde 210g,S/ 9.00,metro,MANGO,2024-12-04 21:35:38.941540,210.0,g,Mermelada de Arándano y Mango Casa Verde,9.0,metro,,,MANGO
Mermelada CASA VERDE Arándano y Mango Frasco 210g,S/ 9.00,vivanda,MANGO,2024-12-04 17:49:19.486801,210.0,g,Mermelada CASA VERDE Arándano y Mango Frasco,9.0,vivanda,,CASAVERDE,MANGO
Mermelada CASA VERDE Arándano y Mango Frasco 2...,S/ 9 un,plaza_vea,MANGO,2024-12-04 13:56:16.641590,210.0,g,Mermelada CASA VERDE Arándano y Mango Frasco 2,9.0,plaza_vea,Frasco 210g,,MANGO
Base para Mango Camu Camu Sour Wasska 125g,S/ 9.40,wong,MANGO,2024-12-04 19:35:08.820601,125.0,g,Base para Mango Camu Camu Sour Wasska,9.4,wong,,,MANGO
Pulpa de Mango Congelada El Frutero 500g,S/ 9.49,metro,MANGO,2024-12-04 21:35:38.941540,500.0,g,Pulpa de Mango Congelada El Frutero,9.49,metro,,,MANGO
Pulpa de Mango Congelado EL FRUTERO Bolsa 500g,S/ 9.80 un,plaza_vea,MANGO,2024-12-04 13:56:16.641590,500.0,g,Pulpa de Mango Congelado EL FRUTERO Bolsa,9.8,plaza_vea,Bolsa 500g,,MANGO
Pulpa de Mango Agroselva Doypack 250g,S/ 9.89,wong,MANGO,2024-12-04 19:35:08.820601,250.0,g,Pulpa de Mango Agroselva Doypack,9.89,wong,,,MANGO
Paleta de Helado Sanúa Maracuyá Mango 70g,S/ 9.90,wong,MANGO,2024-12-04 19:35:08.820601,70.0,g,Paleta de Helado Sanúa Maracuyá Mango,9.9,wong,,,MANGO
Helado Vegano Atelier Mango Coco 85g,S/ 9.90,wong,MANGO,2024-12-04 19:35:08.820601,85.0,g,Helado Vegano Atelier Mango Coco,9.9,wong,,,MANGO
Caramelos AMBROSOLI Trifruna Chicha Mango Piña...,S/ 9.90 un,plaza_vea,MANGO,2024-12-04 13:56:16.641590,420.0,g,Caramelos AMBROSOLI Trifruna Chicha Mango Piña,9.9,plaza_vea,Bolsa 420g,,MANGO
Mango en Trozos SOLEI Caja 300g,S/ 9.90 un,plaza_vea,MANGO,2024-12-04 13:56:16.641590,300.0,g,Mango en Trozos SOLEI Caja,9.9,plaza_vea,Caja 300g,,MANGO
Mango Picado SOLEI Bandeja 300g,S/ 9.90,vivanda,MANGO,2024-12-04 17:49:19.486801,300.0,g,Mango Picado SOLEI Bandeja,9.9,vivanda,,SOLEI,MANGO
Yogurt Griego Mango Maracuyá 800 g,S/ 10.50,tottus,MANGO,2024-12-04 13:31:58.297897,800.0,g,Yogurt Griego Mango Maracuyá,10.5,tottus,,LAIVE,MANGO
"Pulpa Congelada de Aguaje, Lúcuma y Mango Berries del Perú 200g",S/ 10.80,metro,MANGO,2024-12-04 21:35:38.941540,200.0,g,"Pulpa Congelada de Aguaje, Lúcuma y Mango Berries del Perú",10.8,metro,,,MANGO
"PALETA PALETTI 75GR , Fresa c/ Mango",S/ 10.90,wong,MANGO,2024-12-04 19:35:08.820601,75.0,g,"PALETA PALETTI R , Fresa c/ Mango",10.9,wong,,,MANGO
Melocotón Premium x Kg,S/ 10.90 x kg,plaza_vea,MANGO,2024-12-04 13:56:16.641590,0.3,kg,Melocotón Premium,10.9,plaza_vea,Presentación 0.3 kg aprox.,,MANGO
"Pulpa Congelada de Acaí, Arándano y Mango Berries del Perú 200g",S/ 10.96,wong,MANGO,2024-12-04 19:35:08.820601,200.0,g,"Pulpa Congelada de Acaí, Arándano y Mango Berries del Perú",10.96,wong,,,MANGO
Mango en Trozos Congelado Fest 500g,S/ 10.99,metro,MANGO,2024-12-04 21:35:38.941540,500.0,g,Mango en Trozos Congelado Fest,10.99,metro,,,MANGO
Shampoo Bendito Clima Lima Mango Amaras 400 mL,S/ 11.13,tottus,MANGO,2024-12-04 13:31:58.297897,400.0,ml,Shampoo Bendito Clima Lima Mango Amaras,11.13,tottus,,,MANGO
Artesco Pincel Mango de Madera Pack 6 unid Blanco,S/ 11.50,wong,MANGO,2024-12-04 19:35:08.820601,6.0,un,Artesco Pincel Mango de Madera Pack  Blanco,11.5,wong,,,MANGO
YOGURT GRIEGO DESCREMADO SABOR MANGO X 420 G,S/ 11.70,tottus,MANGO,2024-12-04 13:31:58.297897,420.0,g,YOGURT GRIEGO DESCREMADO SABOR MANGO X,11.7,tottus,,DANLAC,MANGO
Pack Bebida FRUGOS Mango Caja 235ml Paquete 6un + Galletas Saladas RITZ Bolsa 20g Paquete 6un,S/ 11.90,vivanda,MANGO,2024-12-04 17:49:19.486801,235.0,ml,Pack Bebida FRUGOS Mango Caja  Paquete  + Galletas Saladas RITZ Bolsa  Paquete,11.9,vivanda,,FRUGOS,MANGO
Escobilla de Baño BOREAL Mango de Madera Paquete 1un,S/ 11.90,vivanda,MANGO,2024-12-04 17:49:19.486801,1.0,un,Escobilla de Baño BOREAL Mango de Madera Paquete,11.9,vivanda,,BOREAL,MANGO
Helado Momenti Sorbetto Mango 120ml,S/ 11.90,wong,MANGO,2024-12-04 19:35:08.820601,120.0,ml,Helado Momenti Sorbetto Mango,11.9,wong,,,MANGO
Helado Momenti Sorbetto Mango 120ml,S/ 11.90,metro,MANGO,2024-12-04 21:35:38.941540,120.0,ml,Helado Momenti Sorbetto Mango,11.9,metro,,,MANGO
Helado Veggie Mango & Piña Lift Pote 110 g,S/ 12.90,metro,MANGO,2024-12-04 21:35:38.941540,110.0,g,Helado Veggie Mango & Piña Lift Pote,12.9,metro,,,MANGO
Helado Lift Maracuya & Mango 110g,S/ 12.90,metro,MANGO,2024-12-04 21:35:38.941540,110.0,g,Helado Lift Maracuya & Mango,12.9,metro,,,MANGO
Helado Lift Maracuya & Mango 110g,S/ 12.90,wong,MANGO,2024-12-04 19:35:08.820601,110.0,g,Helado Lift Maracuya & Mango,12.9,wong,,,MANGO
Mermelada de Mango con Chía y Stevia 230 g,S/ 12.90,tottus,MANGO,2024-12-04 13:31:58.297897,230.0,g,Mermelada de Mango con Chía y Stevia,12.9,tottus,,KUSI,MANGO
Mix de Frutas El Frutero 1kg: Fresa + Mango + Piña,S/ 12.91,metro,MANGO,2024-12-04 21:35:38.941540,1.0,kg,Mix de Frutas El Frutero : Fresa + Mango + Piña,12.91,metro,,,MANGO
Pack x2 Bebida Energizante Monster Energy Mango Loco Lata 473ml,S/ 13.90,wong,MANGO,2024-12-04 19:35:08.820601,473.0,ml,Pack x2 Bebida Energizante Monster Energy Mango Loco Lata,13.9,wong,,,MANGO
Jugo de Naranja Mango Maracuya ECOFRESH Botell...,S/ 13.90 un,plaza_vea,MANGO,2024-12-04 13:56:16.641590,1.0,l,Jugo de Naranja Mango Maracuya ECOFRESH Botell,13.9,plaza_vea,Botella 1L,,MANGO
"Jugo Cold Pressed de Naranja, Mango y Maracuyá Ecofresh Botella 1L",S/ 14.50,wong,MANGO,2024-12-04 19:35:08.820601,1.0,l,"Jugo Cold Pressed de Naranja, Mango y Maracuyá Ecofresh Botella",14.5,wong,,,MANGO
Pack x2 Sixpack Bebida de Mango Frugos del Valle Caja 235ml,S/ 14.50,wong,MANGO,2024-12-04 19:35:08.820601,235.0,ml,Pack x2 Sixpack Bebida de Mango Frugos del Valle Caja,14.5,wong,,,MANGO
Bebida Ready to Drink Three Birds Mango Lata 355ml,S/ 14.90,wong,MANGO,2024-12-04 19:35:08.820601,355.0,ml,Bebida Ready to Drink Three Birds Mango Lata,14.9,wong,,,MANGO
Bebida Rehidratante BODY ARMOR Orange Mango Botella 16oz,S/ 14.90,vivanda,MANGO,2024-12-04 17:49:19.486801,16.0,oz,Bebida Rehidratante BODY ARMOR Orange Mango Botella,14.9,vivanda,,BODY ARMOR,MANGO
Mango en Trozos Natifrut 280g,S/ 14.99,wong,MANGO,2024-12-04 19:35:08.820601,280.0,g,Mango en Trozos Natifrut,14.99,wong,,,MANGO
Bebida Energizante MONSTER Mango Loco Lata 473ml x 2u,S/ 15.00,vega,MANGO,2024-12-04 14:00:44.377946,473.0,ml,Bebida Energizante MONSTER Mango Loco Lata  x 2u,15.0,vega,,MONSTER,MANGO
Bebida MOGU MOGU Mango y Coco Botella 1L,S/ 15.90,vivanda,MANGO,2024-12-04 17:49:19.486801,1.0,l,Bebida MOGU MOGU Mango y Coco Botella,15.9,vivanda,,MOGU MOGU,MANGO
Tratamiento Capilar Amarás Bendito Clima De Lima Mango Frasco 300mL,S/ 15.90,tottus,MANGO,2024-12-04 13:31:58.297897,300.0,ml,Tratamiento Capilar Amarás Bendito Clima De Lima Mango Frasco,15.9,tottus,,,MANGO
Mango Congelada En Trozos 1Kg,S/ 16.90,tottus,MANGO,2024-12-04 13:31:58.297897,1.0,kg,Mango Congelada En Trozos,16.9,tottus,,TOTTUS,MANGO
MIX DE FRUTAS FRESA PINA Y MANGO BL X 1 KG,S/ 16.95,tottus,MANGO,2024-12-04 13:31:58.297897,1.0,kg,MIX DE FRUTAS FRESA PINA Y MANGO BL X,16.95,tottus,,EL FRUTERO,MANGO
"Mix Fresa, Piña y Mango Congelado EL FRUTERO Bolsa 1kg",S/ 16.99,vivanda,MANGO,2024-12-04 17:49:19.486801,1.0,kg,"Mix Fresa, Piña y Mango Congelado EL FRUTERO Bolsa",16.99,vivanda,,EL FRUTERO,MANGO
"Mix Fresa, Piña y Mango Congelado EL FRUTERO B...",S/ 16.99 un,plaza_vea,MANGO,2024-12-04 13:56:16.641590,1.0,kg,"Mix Fresa, Piña y Mango Congelado EL FRUTERO B",16.99,plaza_vea,Bolsa 1Kg,,MANGO
Shampoo Bendito Clima Lima Mango Amaras 700 mL,S/ 17.43,tottus,MANGO,2024-12-04 13:31:58.297897,700.0,ml,Shampoo Bendito Clima Lima Mango Amaras,17.43,tottus,,,MANGO
Yogurt Griego Parcialmente Descremado TIGO Sabor Mango - Maracuyá Pote 1Kg,S/ 17.80,vivanda,MANGO,2024-12-04 17:49:19.486801,1.0,kg,Yogurt Griego Parcialmente Descremado TIGO Sabor Mango - Maracuyá Pote,17.8,vivanda,,TIGO,MANGO
Pisco Sour Mango 700 mL,S/ 17.90,tottus,MANGO,2024-12-04 13:31:58.297897,700.0,ml,Pisco Sour Mango,17.9,tottus,,PISCANO,MANGO
BODYMIST MINNIE MANGO X175 ML,S/ 17.90,tottus,MANGO,2024-12-04 13:31:58.297897,175.0,ml,BODYMIST MINNIE MANGO X,17.9,tottus,,,MANGO
Ready To Drink (RTD) PISCANO Sour Mango Botell...,S/ 17.90 un,plaza_vea,MANGO,2024-12-04 13:56:16.641590,700.0,ml,Ready To Drink (RTD) PISCANO Sour Mango Botell,17.9,plaza_vea,Botella 700ml,,MANGO
Mango Congelado En Trozos Del Ande Bolsa 1 Kg,S/ 17.99,metro,MANGO,2024-12-04 21:35:38.941540,1.0,kg,Mango Congelado En Trozos Del Ande Bolsa,17.99,metro,,,MANGO
"Infusión de Naranja, Mango y Canela TWININGS C...",S/ 19.20 un,plaza_vea,MANGO,2024-12-04 13:56:16.641590,10.0,un,"Infusión de Naranja, Mango y Canela TWININGS C",19.2,plaza_vea,Caja 10un,,MANGO
Yogurt Descremado Con Mango 900 g - Envase 900 g,S/ 19.50,tottus,MANGO,2024-12-04 13:31:58.297897,900.0,g,Yogurt Descremado Con Mango  - Envase,19.5,tottus,,DANLAC,MANGO
EXFOLIANTE MANGO Y DURAZNO 300 ML,S/ 20.72,tottus,MANGO,2024-12-04 13:31:58.297897,300.0,ml,EXFOLIANTE MANGO Y DURAZNO,20.72,tottus,,MURANA,MANGO
HIDRATANTE BATIDO MANGO Y DURAZNO 300 ML,S/ 20.72,tottus,MANGO,2024-12-04 13:31:58.297897,300.0,ml,HIDRATANTE BATIDO MANGO Y DURAZNO,20.72,tottus,,MURANA,MANGO
Bebida Ready to Drink Piscano Sour Sabor Mango Botella 700ml,S/ 24.50,wong,MANGO,2024-12-04 19:35:08.820601,700.0,ml,Bebida Ready to Drink Piscano Sour Sabor Mango Botella,24.5,wong,,,MANGO
Mango Deshidratado Sufrut 200g,S/ 28.00,metro,MANGO,2024-12-04 21:35:38.941540,200.0,g,Mango Deshidratado Sufrut,28.0,metro,,,MANGO
Avena Mix Mango y Chocolate 400 g,S/ 29.90,tottus,MANGO,2024-12-04 13:31:58.297897,400.0,g,Avena Mix Mango y Chocolate,29.9,tottus,,NUTRI CO,MANGO
Avena Mix Mango y Chocolate +NUTRI Co Caja 400...,S/ 29.90 un,plaza_vea,MANGO,2024-12-04 13:56:16.641590,400.0,un,Avena Mix Mango y Chocolate +NUTRI Co Caja 400,29.9,plaza_vea,Caja 400un,,MANGO
Helado Wong Premium Mango 480g,S/ 32.50,wong,MANGO,2024-12-04 19:35:08.820601,480.0,g,Helado Wong Premium Mango,32.5,wong,,,MANGO
Helado Momenti Sorbetto Mango 500ml,S/ 32.90,wong,MANGO,2024-12-04 19:35:08.820601,500.0,ml,Helado Momenti Sorbetto Mango,32.9,wong,,,MANGO
Helado Maracuyá y Mango Lift 390g,S/ 33.50,metro,MANGO,2024-12-04 21:35:38.941540,390.0,g,Helado Maracuyá y Mango Lift,33.5,metro,,,MANGO
Helado Veggie Mango & Piña Lift Pote 390 g,S/ 33.50,wong,MANGO,2024-12-04 19:35:08.820601,390.0,g,Helado Veggie Mango & Piña Lift Pote,33.5,wong,,,MANGO
Helado Maracuyá y Mango Lift 390g,S/ 33.50,wong,MANGO,2024-12-04 19:35:08.820601,390.0,g,Helado Maracuyá y Mango Lift,33.5,wong,,,MANGO
Helado Veggie Mango & Piña Lift Pote 390 g,S/ 33.50,metro,MANGO,2024-12-04 21:35:38.941540,390.0,g,Helado Veggie Mango & Piña Lift Pote,33.5,metro,,,MANGO
Brocha Gruesa con Mango Extra Corto KISS Caja ...,S/ 33.50 un,plaza_vea,MANGO,2024-12-04 13:56:16.641590,1.0,un,Brocha Gruesa con Mango Extra Corto KISS Caja,33.5,plaza_vea,Caja 1un,,MANGO
Shampoo Bio:Renew 6X Aloe y Mango Repara 400 mL,S/ 33.90,tottus,MANGO,2024-12-04 13:31:58.297897,400.0,ml,Shampoo Bio:Renew 6X Aloe y Mango Repara,33.9,tottus,,HERBAL ESSENCES,MANGO
Shampoo HERBAL ESSENCES Aloe & Mango Frasco 400ml,S/ 33.90,vivanda,MANGO,2024-12-04 17:49:19.486801,400.0,ml,Shampoo HERBAL ESSENCES Aloe & Mango Frasco,33.9,vivanda,,HERBAL ESSENCES,MANGO
Helado Häagen Dazs Mango y Frambuesa 460ml,S/ 38.70,metro,MANGO,2024-12-04 21:35:38.941540,460.0,ml,Helado Häagen Dazs Mango y Frambuesa,38.7,metro,,,MANGO
Helado Häagen Dazs Mango y Frambuesa 460ml,S/ 38.70,wong,MANGO,2024-12-04 19:35:08.820601,460.0,ml,Helado Häagen Dazs Mango y Frambuesa,38.7,wong,,,MANGO
Helado de Mango Dulce Pasión 5L,S/ 99.90,metro,MANGO,2024-12-04 21:35:38.941540,5.0,l,Helado de Mango Dulce Pasión,99.9,metro,,,MANGO
Helado de Mango Dulce Pasión 5L,S/ 99.90,wong,MANGO,2024-12-04 19:35:08.820601,5.0,l,Helado de Mango Dulce Pasión,99.9,wong,,,MANGO
