description,price,website,search_term,scrape_timestamp,cantidad,unidad,price_numeric,WEB,unit,brand,CLASIFICACION
"Comida para Gatos MIMASKOT Adultos Pollo, Carn...",S/ 79.90 un,plaza_vea,PANCETA (CARNE DE CERDO),2024-12-04 13:13:13.396619,9.0,kg,79.9,plaza_vea,Bolsa 9Kg,,PANCETA (CARNE DE CERDO)
Comida para Gatos RICOCAT Gatitos Carne Pescad...,S/ 85.90 un,plaza_vea,PANCETA (CARNE DE CERDO),2024-12-04 13:13:13.396619,9.0,kg,85.9,plaza_vea,Bolsa 9Kg,,PANCETA (CARNE DE CERDO)
Pañales PAMPERS Premium Care Talla XXG Paquete...,S/ 86.90 un,plaza_vea,PANCETA (CARNE DE CERDO),2024-12-04 13:13:13.396619,60.0,un,86.9,plaza_vea,Paquete 60un,,PANCETA (CARNE DE CERDO)
"Comida para Gatos RICOCAT Gatitos Carne, Pescado y Leche Bolsa 9 kg",S/ 87.00,vega,PANCETA (CARNE DE CERDO),2024-12-04 13:18:37.215800,9.0,kg,87.0,vega,,Ricocat,PANCETA (CARNE DE CERDO)
Comida para Perros DOG CHOW Adultos razas Pequ...,S/ 89.90 un,plaza_vea,PANCETA (CARNE DE CERDO),2024-12-04 13:13:13.396619,8.0,kg,89.9,plaza_vea,Bolsa 8Kg,,PANCETA (CARNE DE CERDO)
Comida para Perros DOG CHOW Adultos todos los ...,S/ 92.90 un,plaza_vea,PANCETA (CARNE DE CERDO),2024-12-04 13:13:13.396619,8.0,kg,92.9,plaza_vea,Bolsa 8Kg,,PANCETA (CARNE DE CERDO)
Comida para Perros MIMASKOT Adultos Raza Media...,S/ 94.90 un,plaza_vea,PANCETA (CARNE DE CERDO),2024-12-04 13:13:13.396619,15.0,kg,94.9,plaza_vea,Bolsa 15Kg,,PANCETA (CARNE DE CERDO)
Comida para Perro ZEUS Adulto Sabor a Carne Bolsa 25Kg,S/ 97.50,vega,PANCETA (CARNE DE CERDO),2024-12-04 13:18:37.215800,25.0,kg,97.5,vega,,ZEUS,PANCETA (CARNE DE CERDO)
Alimento para Gatos CAT CHOW Adulto Sabor Salm...,S/ 104.90 un,plaza_vea,PANCETA (CARNE DE CERDO),2024-12-04 13:13:13.396619,8.0,kg,104.9,plaza_vea,Bolsa 8Kg,,PANCETA (CARNE DE CERDO)
Comida para Perros RICOCAN Cachorros Pequeños ...,S/ 105.90 un,plaza_vea,PANCETA (CARNE DE CERDO),2024-12-04 13:13:13.396619,15.0,kg,105.9,plaza_vea,Bolsa 15Kg,,PANCETA (CARNE DE CERDO)
Comida para Perros RICOCAN Adulto Carne Bolsa ...,S/ 105.90 un,plaza_vea,PANCETA (CARNE DE CERDO),2024-12-04 13:13:13.396619,15.0,kg,105.9,plaza_vea,Bolsa 15Kg,,PANCETA (CARNE DE CERDO)
"Comida para Perros THOR Adulto Clásico Carne, Pollo, Cerdo Bolsa 25kg",S/ 110.90 5%,vega,PANCETA (CARNE DE CERDO),2024-12-04 13:18:37.215800,25.0,kg,110.9,vega,,Thor,PANCETA (CARNE DE CERDO)
"Comida para Perros THOR Adulto Carne, Hígado, Cereal Bolsa 25kg",S/ 110.90 5%,vega,PANCETA (CARNE DE CERDO),2024-12-04 13:18:37.215800,25.0,kg,110.9,vega,,Thor,PANCETA (CARNE DE CERDO)
Comida para Perros RICOCAN Cachorros Razas Pequeñas Carne y Leche Bolsa 15 Kg,S/ 112.50,vega,PANCETA (CARNE DE CERDO),2024-12-04 13:18:37.215800,15.0,kg,112.5,vega,,Ricocan,PANCETA (CARNE DE CERDO)
Pack Pañales para Bebé HUGGIES Natural Care XX...,S/ 115.90 un,plaza_vea,PANCETA (CARNE DE CERDO),2024-12-04 13:13:13.396619,2.0,un,115.9,plaza_vea,Pack 2un,,PANCETA (CARNE DE CERDO)
Pack Pañales para Bebé HUGGIES Natural Care Ta...,S/ 115.90 un,plaza_vea,PANCETA (CARNE DE CERDO),2024-12-04 13:13:13.396619,2.0,un,115.9,plaza_vea,Pack 2un,,PANCETA (CARNE DE CERDO)
Comida para Perros THOR Cachorros Carne Bolsa 25kg,S/ 120.90,vega,PANCETA (CARNE DE CERDO),2024-12-04 13:18:37.215800,25.0,kg,120.9,vega,,Thor,PANCETA (CARNE DE CERDO)
Comida para Perros MIMASKOT Carnes Bolsa 22Kg,S/ 128.90,vega,PANCETA (CARNE DE CERDO),2024-12-04 13:18:37.215800,22.0,kg,128.9,vega,,Mimaskot,PANCETA (CARNE DE CERDO)
"Comida para Perros MIMASKOT Carne, Cereal y Ve...",S/ 133.90 un,plaza_vea,PANCETA (CARNE DE CERDO),2024-12-04 13:13:13.396619,22.0,kg,133.9,plaza_vea,Bolsa 22Kg,,PANCETA (CARNE DE CERDO)
Packs Pañales PAMPERS Premium Care + Pañales P...,S/ 145.90 un,plaza_vea,PANCETA (CARNE DE CERDO),2024-12-04 13:13:13.396619,2.0,un,145.9,plaza_vea,Pack 2un,,PANCETA (CARNE DE CERDO)
Comida para Perros SUPERCAN Cachorros Carne y Leche Bolsa 25kg,S/ 152.50,vega,PANCETA (CARNE DE CERDO),2024-12-04 13:18:37.215800,25.0,kg,152.5,vega,,Super Can,PANCETA (CARNE DE CERDO)
Comida para Perro SUPERCAN Adultos Carne y Cereal Razas Medianas y Grandes Bolsa 25kg,S/ 152.50,vega,PANCETA (CARNE DE CERDO),2024-12-04 13:18:37.215800,25.0,kg,152.5,vega,,Super Can,PANCETA (CARNE DE CERDO)
Comida para Perros RICOCAN Cachorros Razas Medianas y Grandes Sabor Carne y Leche Bolsa 22Kg,S/ 162.90,vega,PANCETA (CARNE DE CERDO),2024-12-04 13:18:37.215800,22.0,kg,162.9,vega,,Ricocan,PANCETA (CARNE DE CERDO)
Panceta de Cerdo Kurobuta Sin Piel Sin Hueso SRF x kg,S/ 206.90 x kg,wong,PANCETA (CARNE DE CERDO),2024-12-04 18:33:11.434731,1.0,kg,206.9,wong,,,PANCETA (CARNE DE CERDO)
Paleta Curada de Cerdo Reserva Cuisine & Co 4kg,S/ 490.00,wong,PANCETA (CARNE DE CERDO),2024-12-04 18:33:11.434731,4.0,kg,490.0,wong,,,PANCETA (CARNE DE CERDO)
