description,price,website,search_term,scrape_timestamp,cantidad,unidad,price_numeric,WEB,unit,brand,CLASIFICACION
Sopa Instántanea AJINOMEN Sabor a Carne Bolsa ...,S/ 1.60 un,plaza_vea,PANCETA (CARNE DE CERDO),2024-12-04 13:13:13.396619,80.0,g,1.6,plaza_vea,Bolsa 80g,,PANCETA (CARNE DE CERDO)
Caldo de Carne DOÑA GUSTA Concentrado en Polvo...,S/ 2.20 un,plaza_vea,PANCETA (CARNE DE CERDO),2024-12-04 13:13:13.396619,42.0,g,2.2,plaza_vea,Caja 42g,,PANCETA (CARNE DE CERDO)
Yogurt Descremado GLORIA Slim Triple Cero Frut...,S/ 2.20 un,plaza_vea,PANCETA (CARNE DE CERDO),2024-12-04 13:13:13.396619,180.0,g,2.2,plaza_vea,Botella 180g,,PANCETA (CARNE DE CERDO)
Ají Panca Molido RICASA Doypack 100g,S/ 2.20 un,plaza_vea,PANCETA (CARNE DE CERDO),2024-12-04 13:13:13.396619,100.0,g,2.2,plaza_vea,Doypack 100g,,PANCETA (CARNE DE CERDO)
Paleta de Chocolate con Temática Bolsa 1un PV,S/ 2.90,vivanda,PANCETA (CARNE DE CERDO),2024-12-04 17:22:40.161252,1.0,un,2.9,vivanda,,VIVANDA,PANCETA (CARNE DE CERDO)
Jabón para ropa ÑA PANCHA Barra Floral 180gr,S/ 2.90,vega,PANCETA (CARNE DE CERDO),2024-12-04 13:18:37.215800,180.0,g,2.9,vega,,ÑA PANCHA,PANCETA (CARNE DE CERDO)
Jabón para ropa ÑA PANCHA Barra Limon180gr,S/ 2.90,vega,PANCETA (CARNE DE CERDO),2024-12-04 13:18:37.215800,180.0,g,2.9,vega,,ÑA PANCHA,PANCETA (CARNE DE CERDO)
Paleta de Chocolate 1un,S/ 3.20,vivanda,PANCETA (CARNE DE CERDO),2024-12-04 17:22:40.161252,1.0,un,3.2,vivanda,,GIARDINO,PANCETA (CARNE DE CERDO)
Sopa Instantánea AJINOMEN Sabor a Carne Vaso 5...,S/ 3.30 un,plaza_vea,PANCETA (CARNE DE CERDO),2024-12-04 13:13:13.396619,51.0,g,3.3,plaza_vea,Vaso 51g,,PANCETA (CARNE DE CERDO)
Hojuelas al Ajo EL CEDRO con Pan Árabe Bolsa 5...,S/ 3.60 un,plaza_vea,PANCETA (CARNE DE CERDO),2024-12-04 13:13:13.396619,50.0,g,3.6,plaza_vea,Bolsa 50g,,PANCETA (CARNE DE CERDO)
Hojuelas al Ajo EL CEDRO con Pan Árabe Bolsa 50g,S/ 3.70,vivanda,PANCETA (CARNE DE CERDO),2024-12-04 17:22:40.161252,50.0,g,3.7,vivanda,,EL CEDRO,PANCETA (CARNE DE CERDO)
Alimento Húmedo para Gatos FELIX Classic con C...,S/ 3.90 un,plaza_vea,PANCETA (CARNE DE CERDO),2024-12-04 13:13:13.396619,85.0,g,3.9,plaza_vea,Paquete 85g,,PANCETA (CARNE DE CERDO)
Alimento Húmedo para Perros DOG CHOW Adultos T...,S/ 3.90 un,plaza_vea,PANCETA (CARNE DE CERDO),2024-12-04 13:13:13.396619,100.0,g,3.9,plaza_vea,Paquete 100g,,PANCETA (CARNE DE CERDO)
Paté de Cerdo BRAEDT Paquete 100g,S/ 3.90 un,plaza_vea,PANCETA (CARNE DE CERDO),2024-12-04 13:13:13.396619,100.0,g,3.9,plaza_vea,Paquete 100g,,PANCETA (CARNE DE CERDO)
Pan Árabe Integral EL CEDRO con Salvado de Tri...,S/ 4 un,plaza_vea,PANCETA (CARNE DE CERDO),2024-12-04 13:13:13.396619,5.0,un,4.0,plaza_vea,Bolsa 5un,,PANCETA (CARNE DE CERDO)
Caldo MAGGI Cubito Sabor Carne 100g Paquete 25...,S/ 5.50 un,plaza_vea,PANCETA (CARNE DE CERDO),2024-12-04 13:13:13.396619,25.0,un,5.5,plaza_vea,Paquete 25un,,PANCETA (CARNE DE CERDO)
Tostadas Integrales BIMBO Cero Cero Bolsa 140g,S/ 5.80 un,plaza_vea,PANCETA (CARNE DE CERDO),2024-12-04 13:13:13.396619,140.0,g,5.8,plaza_vea,Bolsa 140g,,PANCETA (CARNE DE CERDO)
Comida para Perros RICOCAN Adultos Paté con Ca...,S/ 5.90 un,plaza_vea,PANCETA (CARNE DE CERDO),2024-12-04 13:13:13.396619,330.0,g,5.9,plaza_vea,Lata 330g,,PANCETA (CARNE DE CERDO)
Aderezo BELL'S Con ají panca molido y especias...,S/ 5.90 un,plaza_vea,PANCETA (CARNE DE CERDO),2024-12-04 13:13:13.396619,250.0,g,5.9,plaza_vea,Frasco 250g,,PANCETA (CARNE DE CERDO)
Lavavajilla en Pasta ÑA PANCHA Limón Pote 800gr,S/ 6.50,vega,PANCETA (CARNE DE CERDO),2024-12-04 13:18:37.215800,800.0,g,6.5,vega,,ÑA PANCHA,PANCETA (CARNE DE CERDO)
Pan Pita BIMBO Cero Cero Bolsa 240g,S/ 6.80 un,plaza_vea,PANCETA (CARNE DE CERDO),2024-12-04 13:13:13.396619,240.0,g,6.8,plaza_vea,Bolsa 240g,,PANCETA (CARNE DE CERDO)
Pan Árabe Integral EL CEDRO con Salvado de Tri...,S/ 7.20 un,plaza_vea,PANCETA (CARNE DE CERDO),2024-12-04 13:13:13.396619,10.0,un,7.2,plaza_vea,Paquete 10un,,PANCETA (CARNE DE CERDO)
Pan Árabe Blanco EL CEDRO Bolsa 10un,S/ 7.30 un,plaza_vea,PANCETA (CARNE DE CERDO),2024-12-04 13:13:13.396619,10.0,un,7.3,plaza_vea,Paquete 10un,,PANCETA (CARNE DE CERDO)
Pan Árabe Blanco EL CEDRO Bolsa 10un,S/ 7.50,vivanda,PANCETA (CARNE DE CERDO),2024-12-04 17:22:40.161252,10.0,un,7.5,vivanda,,EL CEDRO,PANCETA (CARNE DE CERDO)
Pan Árabe Integral EL CEDRO con Salvado de Trigo Bolsa 10un,S/ 7.50,vivanda,PANCETA (CARNE DE CERDO),2024-12-04 17:22:40.161252,10.0,un,7.5,vivanda,,EL CEDRO,PANCETA (CARNE DE CERDO)
Panela Granulada Orgánica BELL'S Doypack 500g,S/ 8.20 un,plaza_vea,PANCETA (CARNE DE CERDO),2024-12-04 13:13:13.396619,500.0,g,8.2,plaza_vea,Doypack 500g,,PANCETA (CARNE DE CERDO)
Enrollado de Pollo EL CEDRO 1un,S/ 8.20,vivanda,PANCETA (CARNE DE CERDO),2024-12-04 17:22:40.161252,1.0,un,8.2,vivanda,,EL CEDRO,PANCETA (CARNE DE CERDO)
Enrollado Vegetariano EL CEDRO 1un,S/ 8.20,vivanda,PANCETA (CARNE DE CERDO),2024-12-04 17:22:40.161252,1.0,un,8.2,vivanda,,EL CEDRO,PANCETA (CARNE DE CERDO)
Panela Granulada Orgánica BELL'S Doypack 500g,S/ 8.20,vivanda,PANCETA (CARNE DE CERDO),2024-12-04 17:22:40.161252,500.0,g,8.2,vivanda,,BELL'S,PANCETA (CARNE DE CERDO)
Ají Panca Molido SIBARITA Panquita Doypack 250...,S/ 8.40 un,plaza_vea,PANCETA (CARNE DE CERDO),2024-12-04 13:13:13.396619,250.0,g,8.4,plaza_vea,Doypack 250g,,PANCETA (CARNE DE CERDO)
Tortilla Sash Blanco Artesanal EL CEDRO Bolsa 5un,S/ 8.50,vivanda,PANCETA (CARNE DE CERDO),2024-12-04 17:22:40.161252,5.0,un,8.5,vivanda,,EL CEDRO,PANCETA (CARNE DE CERDO)
Ají Panca Seco BELL'S Bandeja 100g,S/ 8.50 un,plaza_vea,PANCETA (CARNE DE CERDO),2024-12-04 13:13:13.396619,100.0,g,8.5,plaza_vea,Bandeja 100g,,PANCETA (CARNE DE CERDO)
Tortilla Sash Integral Artesanal EL CEDRO Bolsa 5un,S/ 8.50,vivanda,PANCETA (CARNE DE CERDO),2024-12-04 17:22:40.161252,5.0,un,8.5,vivanda,,EL CEDRO,PANCETA (CARNE DE CERDO)
Tortilla Artesanal Clásica EL CEDRO Bolsa 12un,S/ 8.50 un,plaza_vea,PANCETA (CARNE DE CERDO),2024-12-04 13:13:13.396619,12.0,un,8.5,plaza_vea,Bolsa 12un,,PANCETA (CARNE DE CERDO)
Salsa PIKI Ají panca molido Doypack 350g,S/ 8.69 un,plaza_vea,PANCETA (CARNE DE CERDO),2024-12-04 13:13:13.396619,350.0,g,8.69,plaza_vea,Doypack 350g,,PANCETA (CARNE DE CERDO)
Pan Árabe Blanco Andino EL CEDRO con Quinua Bolsa 10un,S/ 8.70,vivanda,PANCETA (CARNE DE CERDO),2024-12-04 17:22:40.161252,10.0,un,8.7,vivanda,,EL CEDRO,PANCETA (CARNE DE CERDO)
Ají Panca FERYMAR Envase 250g,S/ 8.70 un,plaza_vea,PANCETA (CARNE DE CERDO),2024-12-04 13:13:13.396619,250.0,g,8.7,plaza_vea,Envase 250g,,PANCETA (CARNE DE CERDO)
Tortillas BIMBO Cero Cero Bolsa 280g,S/ 8.90 un,plaza_vea,PANCETA (CARNE DE CERDO),2024-12-04 13:13:13.396619,10.0,un,8.9,plaza_vea,Bolsa 10un,,PANCETA (CARNE DE CERDO)
Toallitas Húmedas PET CARE Mascotas Limón Paquete 50un,S/ 9.60,vivanda,PANCETA (CARNE DE CERDO),2024-12-04 17:22:40.161252,50.0,un,9.6,vivanda,,PET CARE,PANCETA (CARNE DE CERDO)
Costillar de Cerdo con Salsa BBQ HIBERO Paquet...,S/ 9.90 un,plaza_vea,PANCETA (CARNE DE CERDO),2024-12-04 13:13:13.396619,475.0,g,9.9,plaza_vea,Paquete 475g,,PANCETA (CARNE DE CERDO)
Panela Orgánica ONZA Doypack 500g,S/ 10 un,plaza_vea,PANCETA (CARNE DE CERDO),2024-12-04 13:13:13.396619,500.0,g,10.0,plaza_vea,Doypack 500g,,PANCETA (CARNE DE CERDO)
Panela Orgánica ONZA Doypack 500g,S/ 10.00,vivanda,PANCETA (CARNE DE CERDO),2024-12-04 17:22:40.161252,500.0,g,10.0,vivanda,,PANELA ONZA,PANCETA (CARNE DE CERDO)
Pan Blanco BIMBO Cero Cero Bolsa 530g,S/ 10.50 un,plaza_vea,PANCETA (CARNE DE CERDO),2024-12-04 13:13:13.396619,530.0,g,10.5,plaza_vea,Bolsa 530g,,PANCETA (CARNE DE CERDO)
Pan Integral BIMBO Cero Cero Bolsa 560g,S/ 10.80 un,plaza_vea,PANCETA (CARNE DE CERDO),2024-12-04 13:13:13.396619,560.0,g,10.8,plaza_vea,Bolsa 560g,,PANCETA (CARNE DE CERDO)
Carne Molida Congelada LOS HIERROS 500g,S/ 10.90 un,plaza_vea,PANCETA (CARNE DE CERDO),2024-12-04 13:13:13.396619,0.5,kg,10.9,plaza_vea,NO MAPEADO 0.5Kg,,PANCETA (CARNE DE CERDO)
Tortilla Artesanal Integral EL CEDRO Bolsa 12un,S/ 11.20,vivanda,PANCETA (CARNE DE CERDO),2024-12-04 17:22:40.161252,12.0,un,11.2,vivanda,,EL CEDRO,PANCETA (CARNE DE CERDO)
Cereal Cero ÁNGEL Life Caja 300g,S/ 12.50 un,plaza_vea,PANCETA (CARNE DE CERDO),2024-12-04 13:13:13.396619,300.0,g,12.5,plaza_vea,Caja 300g,,PANCETA (CARNE DE CERDO)
Hamburguesa de Carne La Casera SAN FERNANDO Bo...,S/ 12.60 un,plaza_vea,PANCETA (CARNE DE CERDO),2024-12-04 13:13:13.396619,910.0,g,12.6,plaza_vea,Bolsa 910g,,PANCETA (CARNE DE CERDO)
Hamburguesa de Carne La Super SAN FERNANDO Bol...,S/ 12.70 un,plaza_vea,PANCETA (CARNE DE CERDO),2024-12-04 13:13:13.396619,850.0,g,12.7,plaza_vea,Bolsa 850g,,PANCETA (CARNE DE CERDO)
Carne Molida de Pavita x500g,S/ 12.90 un,plaza_vea,PANCETA (CARNE DE CERDO),2024-12-04 13:13:13.396619,500.0,g,12.9,plaza_vea,Paquete 500g,,PANCETA (CARNE DE CERDO)
Panela Granulada Orgánica BELL'S Doypack 1Kg,S/ 13.60,vivanda,PANCETA (CARNE DE CERDO),2024-12-04 17:22:40.161252,1.0,kg,13.6,vivanda,,BELL'S,PANCETA (CARNE DE CERDO)
Siu Mai DELI FREEZE de Cerdo Caja 12un,S/ 13.99 un,plaza_vea,PANCETA (CARNE DE CERDO),2024-12-04 13:13:13.396619,12.0,un,13.99,plaza_vea,Caja 12un,,PANCETA (CARNE DE CERDO)
Comida para gatos RICOCAT Gatitos carne pescad...,S/ 14.50 un,plaza_vea,PANCETA (CARNE DE CERDO),2024-12-04 13:13:13.396619,1.0,kg,14.5,plaza_vea,Bolsa 1Kg,,PANCETA (CARNE DE CERDO)
Carne Molida de Cerdo SAN FERNANDO Paquete 500g,S/ 15.50,vivanda,PANCETA (CARNE DE CERDO),2024-12-04 17:22:40.161252,500.0,g,15.5,vivanda,,SAN FERNANDO,PANCETA (CARNE DE CERDO)
Albóndigas de Carne de Res RANCHERAS Bolsa 600...,S/ 15.60 un,plaza_vea,PANCETA (CARNE DE CERDO),2024-12-04 13:13:13.396619,600.0,g,15.6,plaza_vea,Bolsa 600g,,PANCETA (CARNE DE CERDO)
Carne Molida de Pavita x 500g,S/ 15.90,vivanda,PANCETA (CARNE DE CERDO),2024-12-04 17:22:40.161252,500.0,g,15.9,vivanda,,VIVANDA,PANCETA (CARNE DE CERDO)
Chicharrón de Cerdo REDONDOS Bolsa 300g,S/ 17.90 un,plaza_vea,PANCETA (CARNE DE CERDO),2024-12-04 13:13:13.396619,300.0,g,17.9,plaza_vea,Bolsa 300g,,PANCETA (CARNE DE CERDO)
Chuleta de Pierna de Cerdo con Piel,S/ 18.89 x kg,plaza_vea,PANCETA (CARNE DE CERDO),2024-12-04 13:13:13.396619,1.04,kg,18.89,plaza_vea,Presentación 1.04 kg aprox.,,PANCETA (CARNE DE CERDO)
Chuleta Parrillera de Cerdo,S/ 18.89 x kg,plaza_vea,PANCETA (CARNE DE CERDO),2024-12-04 13:13:13.396619,1.04,kg,18.89,plaza_vea,Presentación 1.04 kg aprox.,,PANCETA (CARNE DE CERDO)
Pernil de Cerdo EL BUEN CORTE,S/ 18.90 x kg,plaza_vea,PANCETA (CARNE DE CERDO),2024-12-04 13:13:13.396619,1.4,kg,18.9,plaza_vea,Presentación 1.4 kg aprox.,,PANCETA (CARNE DE CERDO)
Carne Molida de Res Empacada al vacío EL BUEN ...,S/ 19.80 x kg,plaza_vea,PANCETA (CARNE DE CERDO),2024-12-04 13:13:13.396619,0.6,kg,19.8,plaza_vea,Presentación 0.6 kg aprox.,,PANCETA (CARNE DE CERDO)
Guiso de Cerdo Nacional Fresco x kg,S/ 19.90 x kg,plaza_vea,PANCETA (CARNE DE CERDO),2024-12-04 13:13:13.396619,1.4,kg,19.9,plaza_vea,Presentación 1.4 kg aprox.,,PANCETA (CARNE DE CERDO)
Carne Molida Congelada LOS HIERROS 1kg,S/ 20.90 un,plaza_vea,PANCETA (CARNE DE CERDO),2024-12-04 13:13:13.396619,1.0,kg,20.9,plaza_vea,NO MAPEADO 1Kg,,PANCETA (CARNE DE CERDO)
Ravioles de Carne y Verdura BELL'S Bolsa 1Kg,S/ 21.90 un,plaza_vea,PANCETA (CARNE DE CERDO),2024-12-04 13:13:13.396619,1.0,kg,21.9,plaza_vea,Bolsa 1Kg,,PANCETA (CARNE DE CERDO)
REDONDOS Cerdo Sabor Adobo Bolsa 530g,S/ 22.50,vivanda,PANCETA (CARNE DE CERDO),2024-12-04 17:22:40.161252,530.0,g,22.5,vivanda,,REDONDOS,PANCETA (CARNE DE CERDO)
Esponja SCOTCH-BRITE ESPONJA Cero rayas Paquet...,S/ 22.90 un,plaza_vea,PANCETA (CARNE DE CERDO),2024-12-04 13:13:13.396619,6.0,un,22.9,plaza_vea,Paquete 6un,,PANCETA (CARNE DE CERDO)
REDONDOS Cerdo Sabor Oriental Bolsa 530g,S/ 23.30,vivanda,PANCETA (CARNE DE CERDO),2024-12-04 17:22:40.161252,530.0,g,23.3,vivanda,,REDONDOS,PANCETA (CARNE DE CERDO)
Carne Molida de Pollo AVINKA,S/ 23.50 x kg,plaza_vea,PANCETA (CARNE DE CERDO),2024-12-04 13:13:13.396619,1.0,kg,23.5,plaza_vea,Presentación 1 kg aprox.,,PANCETA (CARNE DE CERDO)
Pan Artesanal Congelado PANCITOS DEL SUR Relleno con Cabanossi y Queso Bolsa 6un,S/ 24.20,vivanda,PANCETA (CARNE DE CERDO),2024-12-04 17:22:40.161252,6.0,un,24.2,vivanda,,PANCITOS DEL SUR,PANCETA (CARNE DE CERDO)
Pan Artesanal Congelado PANCITOS DEL SUR Relleno con Jamón y Queso Bolsa 6un,S/ 24.20,vivanda,PANCETA (CARNE DE CERDO),2024-12-04 17:22:40.161252,6.0,un,24.2,vivanda,,PANCITOS DEL SUR,PANCETA (CARNE DE CERDO)
Pan Artesanal Congelado PANCITOS DEL SUR Relleno con Aceitunas Botija Bolsa 6un,S/ 24.20,vivanda,PANCETA (CARNE DE CERDO),2024-12-04 17:22:40.161252,6.0,un,24.2,vivanda,,PANCITOS DEL SUR,PANCETA (CARNE DE CERDO)
Panceta de Cerdo con Hueso y Piel EL BUEN CORT...,S/ 24.89 x kg,plaza_vea,PANCETA (CARNE DE CERDO),2024-12-04 13:13:13.396619,1.35,kg,24.89,plaza_vea,Presentación 1.35 kg aprox.,,PANCETA (CARNE DE CERDO)
Asado de Cerdo EL BUEN CORTE,S/ 24.90 x kg,plaza_vea,PANCETA (CARNE DE CERDO),2024-12-04 13:13:13.396619,1.2,kg,24.9,plaza_vea,Presentación 1.2 kg aprox.,,PANCETA (CARNE DE CERDO)
Panceta de Cerdo con Piel Congelada x Kg,S/ 24.90 x kg,plaza_vea,PANCETA (CARNE DE CERDO),2024-12-04 13:13:13.396619,2.6,kg,24.9,plaza_vea,Presentación 2.6 kg aprox.,,PANCETA (CARNE DE CERDO)
Enrollado de Pollo con Frutas Secas 1 kg,S/ 26.18,tottus,PANCETA (CARNE DE CERDO),2024-12-04 13:07:18.304415,1.0,kg,26.18,tottus,,TOTTUS,PANCETA (CARNE DE CERDO)
Bife de Lomo de Cerdo EL BUEN CORTE,S/ 28.90 x kg,plaza_vea,PANCETA (CARNE DE CERDO),2024-12-04 13:13:13.396619,1.2,kg,28.9,plaza_vea,Presentación 1.2 kg aprox.,,PANCETA (CARNE DE CERDO)
Panceta de Cerdo en Tiras Sin Piel y con Hueso x kg,S/ 28.90 x kg,wong,PANCETA (CARNE DE CERDO),2024-12-04 18:33:11.434731,1.0,kg,28.9,wong,,,PANCETA (CARNE DE CERDO)
Panceta de Cerdo con Hueso sin Piel EL BUEN CO...,S/ 29.90 x kg,plaza_vea,PANCETA (CARNE DE CERDO),2024-12-04 13:13:13.396619,1.196,kg,29.9,plaza_vea,Presentación 1.196 kg aprox.,,PANCETA (CARNE DE CERDO)
Enrollado de Bondiola de Cerdo SAN FERNANDO,S/ 29.90 x kg,plaza_vea,PANCETA (CARNE DE CERDO),2024-12-04 13:13:13.396619,1.2,kg,29.9,plaza_vea,Presentación 1.2 kg aprox.,,PANCETA (CARNE DE CERDO)
Panceta de Cerdo sin Piel,S/ 29.90 x kg,plaza_vea,PANCETA (CARNE DE CERDO),2024-12-04 13:13:13.396619,1.95,kg,29.9,plaza_vea,Presentación 1.95 kg aprox.,,PANCETA (CARNE DE CERDO)
Bondiola de Cerdo EL BUEN CORTE,S/ 29.90 x kg,plaza_vea,PANCETA (CARNE DE CERDO),2024-12-04 13:13:13.396619,1.4,kg,29.9,plaza_vea,Presentación 1.4 kg aprox.,,PANCETA (CARNE DE CERDO)
Cerveza CORONA Cero sin Alcohol Botella 355ml ...,S/ 29.90 un,plaza_vea,PANCETA (CARNE DE CERDO),2024-12-04 13:13:13.396619,2130.0,ml,29.9,plaza_vea,Botella 2130ml,,PANCETA (CARNE DE CERDO)
Panceta de Cerdo en Tiras con Piel y con Hueso x kg,S/ 30.60 x kg,metro,PANCETA (CARNE DE CERDO),2024-12-04 20:55:37.897298,1.0,kg,30.6,metro,,,PANCETA (CARNE DE CERDO)
Panceta de Cerdo en Tiras con Piel y con Hueso x kg,S/ 30.60 x kg,wong,PANCETA (CARNE DE CERDO),2024-12-04 18:33:11.434731,1.0,kg,30.6,wong,,,PANCETA (CARNE DE CERDO)
Panceta de Cerdo Sin Piel y con Hueso x kg,S/ 30.60 x kg,metro,PANCETA (CARNE DE CERDO),2024-12-04 20:55:37.897298,1.0,kg,30.6,metro,,,PANCETA (CARNE DE CERDO)
Enrollado de Pierna de Cerdo SAN FERNANDO,S/ 30.90 x kg,plaza_vea,PANCETA (CARNE DE CERDO),2024-12-04 13:13:13.396619,1.4,kg,30.9,plaza_vea,Presentación 1.4 kg aprox.,,PANCETA (CARNE DE CERDO)
Panceta de Cerdo con Piel y con Hueso en Tiras x kg,S/ 33.90 x kg,wong,PANCETA (CARNE DE CERDO),2024-12-04 18:33:11.434731,1.0,kg,33.9,wong,,,PANCETA (CARNE DE CERDO)
Panceta de Cerdo con Piel y con Hueso en Tiras x kg,S/ 33.90 x kg,metro,PANCETA (CARNE DE CERDO),2024-12-04 20:55:37.897298,1.0,kg,33.9,metro,,,PANCETA (CARNE DE CERDO)
Panceta de Cerdo con Piel y con Hueso x kg,S/ 33.90 x kg,metro,PANCETA (CARNE DE CERDO),2024-12-04 20:55:37.897298,1.0,kg,33.9,metro,,,PANCETA (CARNE DE CERDO)
Panceta de Cerdo con Piel y con Hueso x kg,S/ 33.90 x kg,wong,PANCETA (CARNE DE CERDO),2024-12-04 18:33:11.434731,1.0,kg,33.9,wong,,,PANCETA (CARNE DE CERDO)
Panceta de Cerdo Con Piel y Con Hueso Congelado x kg,S/ 33.90 x kg,metro,PANCETA (CARNE DE CERDO),2024-12-04 20:55:37.897298,1.0,kg,33.9,metro,,,PANCETA (CARNE DE CERDO)
Panceta Sin Piel con Hueso en Tiras x kg,S/ 33.90 x kg,wong,PANCETA (CARNE DE CERDO),2024-12-04 18:33:11.434731,1.0,kg,33.9,wong,,,PANCETA (CARNE DE CERDO)
Panceta de Cerdo en Tiras Sin Piel y con Hueso x kg,S/ 33.90 x kg,metro,PANCETA (CARNE DE CERDO),2024-12-04 20:55:37.897298,1.0,kg,33.9,metro,,,PANCETA (CARNE DE CERDO)
Panceta Sin Piel con Hueso en Tiras x kg,S/ 33.90 x kg,metro,PANCETA (CARNE DE CERDO),2024-12-04 20:55:37.897298,1.0,kg,33.9,metro,,,PANCETA (CARNE DE CERDO)
Panceta de Cerdo Sin Piel y Con Hueso Congelado x kg,S/ 33.90 x kg,metro,PANCETA (CARNE DE CERDO),2024-12-04 20:55:37.897298,1.0,kg,33.9,metro,,,PANCETA (CARNE DE CERDO)
Panceta de Cerdo Sin Piel y Con Hueso Congelado x kg,S/ 33.90 x kg,wong,PANCETA (CARNE DE CERDO),2024-12-04 18:33:11.434731,1.0,kg,33.9,wong,,,PANCETA (CARNE DE CERDO)
Panceta de Cerdo Con Piel y Con Hueso Congelado x kg,S/ 33.90 x kg,wong,PANCETA (CARNE DE CERDO),2024-12-04 18:33:11.434731,1.0,kg,33.9,wong,,,PANCETA (CARNE DE CERDO)
Panceta de Cerdo Sin Piel y con Hueso x kg,S/ 33.90 x kg,wong,PANCETA (CARNE DE CERDO),2024-12-04 18:33:11.434731,1.0,kg,33.9,wong,,,PANCETA (CARNE DE CERDO)
Carne Molida Light de Res Empacada al vacío EL...,S/ 34.80 x kg,plaza_vea,PANCETA (CARNE DE CERDO),2024-12-04 13:13:13.396619,0.6,kg,34.8,plaza_vea,Presentación 0.6 kg aprox.,,PANCETA (CARNE DE CERDO)
Panceta EL BUEN CORTE sin Hueso con Piel,S/ 34.90 x kg,plaza_vea,PANCETA (CARNE DE CERDO),2024-12-04 13:13:13.396619,1.469,kg,34.9,plaza_vea,Presentación 1.469 kg aprox.,,PANCETA (CARNE DE CERDO)
Bife Lomo de Cerdo SAN FERNANDO,S/ 34.90 x kg,plaza_vea,PANCETA (CARNE DE CERDO),2024-12-04 13:13:13.396619,1.2,kg,34.9,plaza_vea,Presentación 1.2 kg aprox.,,PANCETA (CARNE DE CERDO)
Lomito Fino de Cerdo EL BUEN CORTE,S/ 34.90 x kg,plaza_vea,PANCETA (CARNE DE CERDO),2024-12-04 13:13:13.396619,1.274,kg,34.9,plaza_vea,Presentación 1.274 kg aprox.,,PANCETA (CARNE DE CERDO)
Pañales para Bebé HUGGIES Natural Care Primero...,S/ 35.50 un,plaza_vea,PANCETA (CARNE DE CERDO),2024-12-04 13:13:13.396619,50.0,un,35.5,plaza_vea,Paquete 50un,,PANCETA (CARNE DE CERDO)
Carne Molida Light EL BUEN CORTE x kg,S/ 36.50,vivanda,PANCETA (CARNE DE CERDO),2024-12-04 17:22:40.161252,1.0,kg,36.5,vivanda,,EL BUEN CORTE,PANCETA (CARNE DE CERDO)
Panceta de Cerdo en Tiras con Piel y con Hueso San Fernando x kg,S/ 38.90 x kg,wong,PANCETA (CARNE DE CERDO),2024-12-04 18:33:11.434731,1.0,kg,38.9,wong,,,PANCETA (CARNE DE CERDO)
Tira de Panceta Con Piel de Cerdo Duroc Redondos x kg,S/ 38.90 x kg,wong,PANCETA (CARNE DE CERDO),2024-12-04 18:33:11.434731,1.0,kg,38.9,wong,,,PANCETA (CARNE DE CERDO)
Panceta de Cerdo en Tiras con Piel y con Hueso San Fernando x kg,S/ 38.90 x kg,metro,PANCETA (CARNE DE CERDO),2024-12-04 20:55:37.897298,1.0,kg,38.9,metro,,,PANCETA (CARNE DE CERDO)
Tira de Panceta Sin Piel de Cerdo Duroc Redondos x kg,S/ 39.90 x kg,wong,PANCETA (CARNE DE CERDO),2024-12-04 18:33:11.434731,1.0,kg,39.9,wong,,,PANCETA (CARNE DE CERDO)
Shampoo Fórmula Vegana URBAN CARE Twisted Curls Tubo 250ml,S/ 39.90,vivanda,PANCETA (CARNE DE CERDO),2024-12-04 17:22:40.161252,250.0,ml,39.9,vivanda,,URBAN CARE,PANCETA (CARNE DE CERDO)
Crema Para Peinar URBAN CARE Twisted Curls Frasco 175ml,S/ 39.90,vivanda,PANCETA (CARNE DE CERDO),2024-12-04 17:22:40.161252,175.0,ml,39.9,vivanda,,URBAN CARE,PANCETA (CARNE DE CERDO)
Shampoo Fórmula Vegana URBAN CARE Ácido Hialurónico Tubo 250ml,S/ 39.90,vivanda,PANCETA (CARNE DE CERDO),2024-12-04 17:22:40.161252,250.0,ml,39.9,vivanda,,URBAN CARE,PANCETA (CARNE DE CERDO)
Mascarilla Capilar URBAN CARE Night Hyaluronic Frasco 230ml,S/ 39.90,vivanda,PANCETA (CARNE DE CERDO),2024-12-04 17:22:40.161252,230.0,ml,39.9,vivanda,,URBAN CARE,PANCETA (CARNE DE CERDO)
Medallón de Lomo de Cerdo SAN FERNANDO,S/ 39.90 x kg,plaza_vea,PANCETA (CARNE DE CERDO),2024-12-04 13:13:13.396619,1.2,kg,39.9,plaza_vea,Presentación 1.2 kg aprox.,,PANCETA (CARNE DE CERDO)
Enrollado de Cerdo con Frutas 1.3 kg,S/ 39.90,tottus,PANCETA (CARNE DE CERDO),2024-12-04 13:07:18.304415,1.3,kg,39.9,tottus,,REDONDOS,PANCETA (CARNE DE CERDO)
Tira de Panceta Sin Piel de Cerdo Duroc Redondos x kg,S/ 39.90 x kg,metro,PANCETA (CARNE DE CERDO),2024-12-04 20:55:37.897298,1.0,kg,39.9,metro,,,PANCETA (CARNE DE CERDO)
Crema Para Peinar URBAN CARE Mask Intensive Twisted Curls Frasco 230ml,S/ 39.90,vivanda,PANCETA (CARNE DE CERDO),2024-12-04 17:22:40.161252,230.0,ml,39.9,vivanda,,URBAN CARE,PANCETA (CARNE DE CERDO)
Detergente en Polvo ÑA PANCHA Bolsa 4Kg,S/ 41.50,vega,PANCETA (CARNE DE CERDO),2024-12-04 13:18:37.215800,4.0,kg,41.5,vega,,ÑA PANCHA,PANCETA (CARNE DE CERDO)
Panceta de Cerdo en Tiras Sin Piel y con Hueso San Fernando x kg,S/ 41.90 x kg,metro,PANCETA (CARNE DE CERDO),2024-12-04 20:55:37.897298,1.0,kg,41.9,metro,,,PANCETA (CARNE DE CERDO)
Panceta de Cerdo en Tiras Sin Piel y con Hueso San Fernando x kg,S/ 41.90 x kg,wong,PANCETA (CARNE DE CERDO),2024-12-04 18:33:11.434731,1.0,kg,41.9,wong,,,PANCETA (CARNE DE CERDO)
Pañales HUGGIES Natural Care Pants XXG Paquete...,S/ 41.90 un,plaza_vea,PANCETA (CARNE DE CERDO),2024-12-04 13:13:13.396619,34.0,un,41.9,plaza_vea,Bolsa 34un,,PANCETA (CARNE DE CERDO)
Panceta de Cerdo con Piel y con Hueso Otto Kunz x kg,S/ 43.20 x kg,wong,PANCETA (CARNE DE CERDO),2024-12-04 18:33:11.434731,1.0,kg,43.2,wong,,,PANCETA (CARNE DE CERDO)
Panceta de Cerdo Sin Piel y con Hueso Otto Kunz x kg,S/ 43.70 x kg,wong,PANCETA (CARNE DE CERDO),2024-12-04 18:33:11.434731,1.0,kg,43.7,wong,,,PANCETA (CARNE DE CERDO)
Panceta de Cerdo en Tiras con Piel y Sin Hueso San Fernando x kg,S/ 43.90 x kg,wong,PANCETA (CARNE DE CERDO),2024-12-04 18:33:11.434731,1.0,kg,43.9,wong,,,PANCETA (CARNE DE CERDO)
Panceta de Cerdo en Tiras Sin Piel y Sin Hueso San Fernando x kg,S/ 43.90 x kg,wong,PANCETA (CARNE DE CERDO),2024-12-04 18:33:11.434731,1.0,kg,43.9,wong,,,PANCETA (CARNE DE CERDO)
Panceta de Cerdo en Tiras con Piel y Sin Hueso San Fernando x kg,S/ 43.90 x kg,metro,PANCETA (CARNE DE CERDO),2024-12-04 20:55:37.897298,1.0,kg,43.9,metro,,,PANCETA (CARNE DE CERDO)
Carne para Lomo Saltado EL BUEN CORTE x kg,S/ 45.00,vivanda,PANCETA (CARNE DE CERDO),2024-12-04 17:22:40.161252,1.0,kg,45.0,vivanda,,EL BUEN CORTE,PANCETA (CARNE DE CERDO)
Panceta de Cerdo Marinada Mediterránea Zimmermann x kg,S/ 45.90 x kg,wong,PANCETA (CARNE DE CERDO),2024-12-04 18:33:11.434731,1.0,kg,45.9,wong,,,PANCETA (CARNE DE CERDO)
Panceta Gaucha Zimmermann x kg,S/ 45.90 x kg,wong,PANCETA (CARNE DE CERDO),2024-12-04 18:33:11.434731,1.0,kg,45.9,wong,,,PANCETA (CARNE DE CERDO)
Panceta de Cerdo Sin Piel y con Hueso Otto Kunz x kg,S/ 45.90 x kg,metro,PANCETA (CARNE DE CERDO),2024-12-04 20:55:37.897298,1.0,kg,45.9,metro,,,PANCETA (CARNE DE CERDO)
Sérum URBAN CARE Pure Coconut Frasco 75ml,S/ 49.90,vivanda,PANCETA (CARNE DE CERDO),2024-12-04 17:22:40.161252,75.0,ml,49.9,vivanda,,URBAN CARE,PANCETA (CARNE DE CERDO)
Sérum Capilar URBAN CARE Ácido Hialurónico Frasco 75ml,S/ 49.90,vivanda,PANCETA (CARNE DE CERDO),2024-12-04 17:22:40.161252,75.0,ml,49.9,vivanda,,URBAN CARE,PANCETA (CARNE DE CERDO)
Pañales para Bebé HUGGIES Natural Care Unisex Talla G Paquete 52 und,S/ 49.90,vega,PANCETA (CARNE DE CERDO),2024-12-04 13:18:37.215800,52.0,un,49.9,vega,,Huggies,PANCETA (CARNE DE CERDO)
Sérum URBAN CARE Hair Tonic Spray Biotin & Caffeine Frasco 200ml,S/ 49.90,vivanda,PANCETA (CARNE DE CERDO),2024-12-04 17:22:40.161252,200.0,ml,49.9,vivanda,,URBAN CARE,PANCETA (CARNE DE CERDO)
Shampoo URBAN CARE Expert Biotin & Caffeine Frasco 350ml,S/ 49.90,vivanda,PANCETA (CARNE DE CERDO),2024-12-04 17:22:40.161252,350.0,ml,49.9,vivanda,,URBAN CARE,PANCETA (CARNE DE CERDO)
Acondicionador URBAN CARE Biotin & Caffeine Tubo 200ml,S/ 49.90,vivanda,PANCETA (CARNE DE CERDO),2024-12-04 17:22:40.161252,200.0,ml,49.9,vivanda,,URBAN CARE,PANCETA (CARNE DE CERDO)
Enrollado Delizia de Cerdo San Fernando 1.3 kg,S/ 49.90,tottus,PANCETA (CARNE DE CERDO),2024-12-04 13:07:18.304415,1.3,kg,49.9,tottus,,,PANCETA (CARNE DE CERDO)
Hamburguesa OREGON FOODS Carne Angus Caja 4un,S/ 52.59 un,plaza_vea,PANCETA (CARNE DE CERDO),2024-12-04 13:13:13.396619,4.0,un,52.59,plaza_vea,Caja 4un,,PANCETA (CARNE DE CERDO)
Pañales para Bebé HUGGIES Natural Care Bigpack Talla XXG Paquete 58un,S/ 58.50,vega,PANCETA (CARNE DE CERDO),2024-12-04 13:18:37.215800,58.0,un,58.5,vega,,Huggies,PANCETA (CARNE DE CERDO)
Pañales para Bebé HUGGIES Natural Care XXXG Pa...,S/ 62.90 un,plaza_vea,PANCETA (CARNE DE CERDO),2024-12-04 13:13:13.396619,54.0,un,62.9,plaza_vea,Paquete 54un,,PANCETA (CARNE DE CERDO)
Pañales para Bebé HUGGIES Natural Care Talla X...,S/ 62.90 un,plaza_vea,PANCETA (CARNE DE CERDO),2024-12-04 13:13:13.396619,58.0,un,62.9,plaza_vea,Paquete 58un,,PANCETA (CARNE DE CERDO)
Protector Solar Facial NEUTROGENA Sun Fresh De...,S/ 65.90 un,plaza_vea,PANCETA (CARNE DE CERDO),2024-12-04 13:13:13.396619,40.0,g,65.9,plaza_vea,Tubo 40g,,PANCETA (CARNE DE CERDO)
Protector Solar Facial NEUTROGENA Sun Fresh De...,S/ 65.90 un,plaza_vea,PANCETA (CARNE DE CERDO),2024-12-04 13:13:13.396619,6.0,g,65.9,plaza_vea,Frasco 6g,,PANCETA (CARNE DE CERDO)
Protector Solar Facial NEUTROGENA Sun Fresh De...,S/ 65.90 un,plaza_vea,PANCETA (CARNE DE CERDO),2024-12-04 13:13:13.396619,40.0,g,65.9,plaza_vea,Tubo 40g,,PANCETA (CARNE DE CERDO)
Panceta Horneada Zimmermann x kg,S/ 72.99 x kg,wong,PANCETA (CARNE DE CERDO),2024-12-04 18:33:11.434731,1.0,kg,72.99,wong,,,PANCETA (CARNE DE CERDO)
"Comida para Gatos SUPER CAT Adulto Carne, Pollo y Leche Bolsa 9 kg",S/ 73.50 43%,vega,PANCETA (CARNE DE CERDO),2024-12-04 13:18:37.215800,9.0,kg,73.5,vega,,Ricocat,PANCETA (CARNE DE CERDO)
Panceta Estílo Caja China x kg,S/ 76.00 x kg,wong,PANCETA (CARNE DE CERDO),2024-12-04 18:33:11.434731,1.0,kg,76.0,wong,,,PANCETA (CARNE DE CERDO)
