description,price,website,search_term,scrape_timestamp,cantidad,unidad,price_numeric,WEB,unit,brand,CLASIFICACION
2 Pollo Rostizado + 2un Papas Fritas + Gaseosa Inca Kola Sin Azúcar 1.5L,S/ 59.99,metro,POLLO EVISCERADO,2024-12-04 21:03:17.398980,2.0,un,59.99,metro,,,POLLO EVISCERADO
2 Pollo Rostizado + 2un Papas Fritas + Chicha Morada Naturale 1L,S/ 59.99,metro,POLLO EVISCERADO,2024-12-04 21:03:17.398980,2.0,un,59.99,metro,,,POLLO EVISCERADO
Alimento para Gatos Esterilizados Purina One Pollo y Salmón 2kg,S/ 64.50,wong,POLLO EVISCERADO,2024-12-04 18:48:25.850057,2.0,kg,64.5,wong,,,POLLO EVISCERADO
Detergente en polvo ACE Regular Bolsa 5.8Kg,S/ 64.90 un,plaza_vea,POLLO EVISCERADO,2024-12-04 13:21:01.580362,5.8,kg,64.9,plaza_vea,Bolsa 5.8Kg,,POLLO EVISCERADO
Detergente en Polvo ARIEL Regular Bolsa 5.8Kg,S/ 70.90 un,plaza_vea,POLLO EVISCERADO,2024-12-04 13:21:01.580362,5.8,kg,70.9,plaza_vea,Bolsa 5.8Kg,,POLLO EVISCERADO
2 Pollo Rostizado + 2un Papas Fritas + Gaseosa Inca Kola Sin Azúcar 1.5L,S/ 73.50,wong,POLLO EVISCERADO,2024-12-04 18:48:25.850057,2.0,un,73.5,wong,,,POLLO EVISCERADO
"Comida para Gatos SUPER CAT Adulto Carne, Pollo y Leche Bolsa 9 kg",S/ 73.50 43%,vega,POLLO EVISCERADO,2024-12-04 13:25:27.785871,9.0,kg,73.5,vega,,Ricocat,POLLO EVISCERADO
Alimento para Gatos Esterilizados Purina One Pollo y Salmón 2kg,S/ 74.10,metro,POLLO EVISCERADO,2024-12-04 21:03:17.398980,2.0,kg,74.1,metro,,,POLLO EVISCERADO
Pollo Rostizado 2un + Papas Fritas 2un + Ensalada + Chicha Morada 1L,S/ 84.90,wong,POLLO EVISCERADO,2024-12-04 18:48:25.850057,2.0,un,84.9,wong,,,POLLO EVISCERADO
ALIM GATO ADUL POLLO CARNE SLMON BOL9KG,S/ 85.50,tottus,POLLO EVISCERADO,2024-12-04 13:10:52.795575,9.0,kg,85.5,tottus,,MIMASKOT,POLLO EVISCERADO
"Comida para Gatos RICOCAT Adultos Pollo, Sardi...",S/ 85.90 un,plaza_vea,POLLO EVISCERADO,2024-12-04 13:21:01.580362,9.0,kg,85.9,plaza_vea,Bolsa 9Kg,,POLLO EVISCERADO
"Ricocat Alimento para Gatos Adultos Pollo, Sardina y Salmón 9kg",S/ 89.90,metro,POLLO EVISCERADO,2024-12-04 21:03:17.398980,9.0,kg,89.9,metro,,,POLLO EVISCERADO
Alimento para Gatos CAT CHOW Adulto Sabor Salm...,S/ 104.90 un,plaza_vea,POLLO EVISCERADO,2024-12-04 13:21:01.580362,8.0,kg,104.9,plaza_vea,Bolsa 8Kg,,POLLO EVISCERADO
"Comida para Perros THOR Adulto Clásico Carne, Pollo, Cerdo Bolsa 25kg",S/ 110.90 5%,vega,POLLO EVISCERADO,2024-12-04 13:25:27.785871,25.0,kg,110.9,vega,,Thor,POLLO EVISCERADO
Freidora De Aire 1.8 Lts Negra,S/ 129,tottus,POLLO EVISCERADO,2024-12-04 13:10:52.795575,1.8,l,129.0,tottus,,OSTER,POLLO EVISCERADO
Alimento seco para gato GATI sabor carne y pollo de 15 kg,S/ 142.90,tottus,POLLO EVISCERADO,2024-12-04 13:10:52.795575,15.0,kg,142.9,tottus,,PURINA,POLLO EVISCERADO
Alimento Purina One Esterilizados One Pollo Y Salmon 6kg,S/ 167.50,wong,POLLO EVISCERADO,2024-12-04 18:48:25.850057,6.0,kg,167.5,wong,,,POLLO EVISCERADO
Alimento Purina One Esterilizados One Pollo Y Salmon 6kg,S/ 189.90,metro,POLLO EVISCERADO,2024-12-04 21:03:17.398980,6.0,kg,189.9,metro,,,POLLO EVISCERADO
Super Freidora de Aire 10Lts CKSTAFOV3-053,S/ 599,tottus,POLLO EVISCERADO,2024-12-04 13:10:52.795575,10.0,l,599.0,tottus,,OSTER,POLLO EVISCERADO
