description,brand,cantidad,unidad,price_numeric,website,scrape_timestamp,search_term,cantidad_escalada,unidad_escalada,price_numeric_escalado,CLASIFICACION
Sopa Instantánea Ajinomen Sabor Pollo 80g,,80.0,g,1.6,metro,2024-12-04 21:03:17.398980,POLLO EVISCERADO,1.0,kg,20.0,POLLO EVISCERADO
Trocitos en Salsa Cat Chow Adulto Pollo Pouch 85g,,85.0,g,4.0,metro,2024-12-04 21:03:17.398980,POLLO EVISCERADO,1.0,kg,47.05882352941176,POLLO EVISCERADO
Paté de Hígado de Pollo San Fernando 100 g,,100.0,g,4.1,wong,2024-12-04 18:48:25.850057,POLLO EVISCERADO,1.0,kg,41.0,POLLO EVISCERADO
Hot Dog de Pollo Ahumado San Fernando 220g,,220.0,g,4.2,metro,2024-12-04 21:03:17.398980,POLLO EVISCERADO,1.0,kg,19.090909090909093,POLLO EVISCERADO
Hot Dog Ahumado de Pollo SAN FERNANDO Paquete 220g,SAN FERNANDO,220.0,g,4.6,vivanda,2024-12-04 17:26:31.945603,POLLO EVISCERADO,1.0,kg,20.90909090909091,POLLO EVISCERADO
Nuggets de Pollo San Fernando 180g,,180.0,g,5.0,metro,2024-12-04 21:03:17.398980,POLLO EVISCERADO,1.0,kg,27.77777777777778,POLLO EVISCERADO
Hot Dog con Pollo Suiza 200g,,200.0,g,5.6,metro,2024-12-04 21:03:17.398980,POLLO EVISCERADO,1.0,kg,28.0,POLLO EVISCERADO
Causa de Pollo LA FLORENCIA Bandeja 170g,LA FLORENCIA,170.0,g,6.0,vivanda,2024-12-04 17:26:31.945603,POLLO EVISCERADO,1.0,kg,35.29411764705882,POLLO EVISCERADO
Tamal Chinchano de Pollo RECUTECU Paquete 400g,RECUTECU,400.0,g,7.5,vivanda,2024-12-04 17:26:31.945603,POLLO EVISCERADO,1.0,kg,18.75,POLLO EVISCERADO
Patas de Pollo Redondos x kg,,1.0,kg,7.9,metro,2024-12-04 21:03:17.398980,POLLO EVISCERADO,1.0,kg,7.9,POLLO EVISCERADO
Ricocan Paté para Perros Adultos Pollo Lata 330 gr,,330.0,g,7.9,metro,2024-12-04 21:03:17.398980,POLLO EVISCERADO,1.0,kg,23.93939393939394,POLLO EVISCERADO
Ricocat Paté para Gatos Adultos Sardina y Pollo Lata 330 gr,,330.0,g,8.4,metro,2024-12-04 21:03:17.398980,POLLO EVISCERADO,1.0,kg,25.454545454545457,POLLO EVISCERADO
Ricocat Paté para Gatos Adultos Hígado y Pollo Lata 330 gr,,330.0,g,8.4,metro,2024-12-04 21:03:17.398980,POLLO EVISCERADO,1.0,kg,25.454545454545457,POLLO EVISCERADO
Hígado de Pollo Redondos x kg,,1.0,kg,8.9,metro,2024-12-04 21:03:17.398980,POLLO EVISCERADO,1.0,kg,8.9,POLLO EVISCERADO
Hígado de Pollo x kg,,1.0,kg,8.9,wong,2024-12-04 18:48:25.850057,POLLO EVISCERADO,1.0,kg,8.9,POLLO EVISCERADO
Salchicha de Pollo SAN FERNANDO Paquete 500g,SAN FERNANDO,500.0,g,9.4,vivanda,2024-12-04 17:26:31.945603,POLLO EVISCERADO,1.0,kg,18.8,POLLO EVISCERADO
Pollo Entero Fresco Metro x kg,,1.0,kg,9.4,metro,2024-12-04 21:03:17.398980,POLLO EVISCERADO,1.0,kg,9.4,POLLO EVISCERADO
Pollo Entero con Menudencia x kg,,1.0,kg,9.5,wong,2024-12-04 18:48:25.850057,POLLO EVISCERADO,1.0,kg,9.5,POLLO EVISCERADO
Hot Dog Ahumado de Pollo SAN FERNANDO Paquete 440g,SAN FERNANDO,440.0,g,10.0,vivanda,2024-12-04 17:26:31.945603,POLLO EVISCERADO,1.0,kg,22.72727272727273,POLLO EVISCERADO
Pollo con Menudencia Redondos x kg,,1.0,kg,10.25,metro,2024-12-04 21:03:17.398980,POLLO EVISCERADO,1.0,kg,10.25,POLLO EVISCERADO
Pollo con Menudencia Redondos x kg,,1.0,kg,10.25,wong,2024-12-04 18:48:25.850057,POLLO EVISCERADO,1.0,kg,10.25,POLLO EVISCERADO
Pollo Fresco con Menudencia San Fernando x Kg,,1.0,kg,10.45,wong,2024-12-04 18:48:25.850057,POLLO EVISCERADO,1.0,kg,10.45,POLLO EVISCERADO
Pollo Entero con Menudencia Avinka x kg,,1.0,kg,10.65,wong,2024-12-04 18:48:25.850057,POLLO EVISCERADO,1.0,kg,10.65,POLLO EVISCERADO
Dedos de Pollo AVINKA 270g Bolsa 12un x 270g,AVINKA,270.0,g,11.5,vivanda,2024-12-04 17:26:31.945603,POLLO EVISCERADO,1.0,kg,42.59259259259259,POLLO EVISCERADO
Pollo Entero sin Menudencia x kg,,1.0,kg,11.7,wong,2024-12-04 18:48:25.850057,POLLO EVISCERADO,1.0,kg,11.7,POLLO EVISCERADO
Pollo Entero Sin Menudencia Redondos x kg,,1.0,kg,11.9,wong,2024-12-04 18:48:25.850057,POLLO EVISCERADO,1.0,kg,11.9,POLLO EVISCERADO
Pollo Entero Sin Menudencia Redondos x kg,,1.0,kg,11.9,metro,2024-12-04 21:03:17.398980,POLLO EVISCERADO,1.0,kg,11.9,POLLO EVISCERADO
Pollo Enrollado con Salsa de Ostión y Arroz Chaufa Cuisine & Co 400g,,400.0,g,12.9,metro,2024-12-04 21:03:17.398980,POLLO EVISCERADO,1.0,kg,32.25,POLLO EVISCERADO
Corazón de Pollo x kg,,1.0,kg,12.9,wong,2024-12-04 18:48:25.850057,POLLO EVISCERADO,1.0,kg,12.9,POLLO EVISCERADO
Causa de Pollo LA FLORENCIA Bandeja 500g,LA FLORENCIA,500.0,g,12.9,vivanda,2024-12-04 17:26:31.945603,POLLO EVISCERADO,1.0,kg,25.8,POLLO EVISCERADO
Corazón de Pollo Redondos x kg,,1.0,kg,12.9,metro,2024-12-04 21:03:17.398980,POLLO EVISCERADO,1.0,kg,12.9,POLLO EVISCERADO
Hamburguesas de Pollo Natural Home 600g,,600.0,g,12.99,wong,2024-12-04 18:48:25.850057,POLLO EVISCERADO,1.0,kg,21.650000000000002,POLLO EVISCERADO
Tallarín Saltado con Pollo HOME CHEF 450g,HOME CHEF,450.0,g,13.2,vivanda,2024-12-04 17:26:31.945603,POLLO EVISCERADO,1.0,kg,29.333333333333332,POLLO EVISCERADO
Pollo Tipakay con Chaufa HOME CHEF 450g,HOME CHEF,450.0,g,13.2,vivanda,2024-12-04 17:26:31.945603,POLLO EVISCERADO,1.0,kg,29.333333333333332,POLLO EVISCERADO
Pechuga de Pollo en Salsa de Champiñones HOME CHEF 450g,HOME CHEF,450.0,g,13.2,vivanda,2024-12-04 17:26:31.945603,POLLO EVISCERADO,1.0,kg,29.333333333333332,POLLO EVISCERADO
Pollo Deshilachado Bolsa 250 g,,250.0,g,13.5,metro,2024-12-04 21:03:17.398980,POLLO EVISCERADO,1.0,kg,54.0,POLLO EVISCERADO
Pierna con Encuentro de Pollo Congelado San Fernando x kg,,1.0,kg,13.9,wong,2024-12-04 18:48:25.850057,POLLO EVISCERADO,1.0,kg,13.9,POLLO EVISCERADO
Pollo Tipakay con Arroz Chaufa Cuisine & Co 400g,,400.0,g,13.9,metro,2024-12-04 21:03:17.398980,POLLO EVISCERADO,1.0,kg,34.75,POLLO EVISCERADO
Molleja de Pollo Redondos x kg,,1.0,kg,13.9,metro,2024-12-04 21:03:17.398980,POLLO EVISCERADO,1.0,kg,13.9,POLLO EVISCERADO
Molleja de Pollo x kg,,1.0,kg,13.9,wong,2024-12-04 18:48:25.850057,POLLO EVISCERADO,1.0,kg,13.9,POLLO EVISCERADO
Pollo Entero sin Menudencia Congelado PERDIX 1300g,PERDIX,1300.0,g,13.9,vivanda,2024-12-04 17:26:31.945603,POLLO EVISCERADO,1.0,kg,10.692307692307692,POLLO EVISCERADO
Alimento Congelado Pollo Origo Pet 800g,,800.0,g,14.49,wong,2024-12-04 18:48:25.850057,POLLO EVISCERADO,1.0,kg,18.1125,POLLO EVISCERADO
Pierna con Encuentro de Pollo x kg,,1.0,kg,14.5,wong,2024-12-04 18:48:25.850057,POLLO EVISCERADO,1.0,kg,14.5,POLLO EVISCERADO
Pollo Chijaukay con Chaufa Cuisine & Co 400g,,400.0,g,14.5,wong,2024-12-04 18:48:25.850057,POLLO EVISCERADO,1.0,kg,36.25,POLLO EVISCERADO
Pechuga con Ala de Pollo x kg,,1.0,kg,14.5,wong,2024-12-04 18:48:25.850057,POLLO EVISCERADO,1.0,kg,14.5,POLLO EVISCERADO
Pollo Enrollado con Salsa de Ostión y Arroz Chaufa Cuisine & Co 400g,,400.0,g,14.5,wong,2024-12-04 18:48:25.850057,POLLO EVISCERADO,1.0,kg,36.25,POLLO EVISCERADO
Pollo Tipakay con Arroz Chaufa Cuisine & Co 400g,,400.0,g,14.5,wong,2024-12-04 18:48:25.850057,POLLO EVISCERADO,1.0,kg,36.25,POLLO EVISCERADO
Pechuga Especial Importada x kg,,1.0,kg,14.5,wong,2024-12-04 18:48:25.850057,POLLO EVISCERADO,1.0,kg,14.5,POLLO EVISCERADO
Pierna con Encuentro de Pollo Redondos x kg,,1.0,kg,14.5,metro,2024-12-04 21:03:17.398980,POLLO EVISCERADO,1.0,kg,14.5,POLLO EVISCERADO
Pollo Oriental San Fernando Bolsa 800 g / Medio Pollo en 4 Piezas,,800.0,g,14.6,metro,2024-12-04 21:03:17.398980,POLLO EVISCERADO,1.0,kg,18.25,POLLO EVISCERADO
Pollo Oriental San Fernando Bolsa 800 g / Medio Pollo en 4 Piezas,,800.0,g,14.6,wong,2024-12-04 18:48:25.850057,POLLO EVISCERADO,1.0,kg,18.25,POLLO EVISCERADO
Pollo al Horno San Fernando Bolsa 800 g / Medio pollo en 4 Piezas,,800.0,g,14.6,wong,2024-12-04 18:48:25.850057,POLLO EVISCERADO,1.0,kg,18.25,POLLO EVISCERADO
Pollo Entero Light x kg,,1.0,kg,14.7,metro,2024-12-04 21:03:17.398980,POLLO EVISCERADO,1.0,kg,14.7,POLLO EVISCERADO
Pollo Entero Light x kg,,1.0,kg,14.7,wong,2024-12-04 18:48:25.850057,POLLO EVISCERADO,1.0,kg,14.7,POLLO EVISCERADO
Tiras de Pechuga de Pollo Bolsa 300 g,,300.0,g,14.9,wong,2024-12-04 18:48:25.850057,POLLO EVISCERADO,1.0,kg,49.66666666666667,POLLO EVISCERADO
Piernitas de Alas de Pollo x kg,,1.0,kg,14.9,wong,2024-12-04 18:48:25.850057,POLLO EVISCERADO,1.0,kg,14.9,POLLO EVISCERADO
Pechuga Entera de Pollo Redondos x kg,,1.0,kg,15.5,metro,2024-12-04 21:03:17.398980,POLLO EVISCERADO,1.0,kg,15.5,POLLO EVISCERADO
Alitas de Pollo Redondo Sabor Brasa Caja 400g,,400.0,g,15.7,metro,2024-12-04 21:03:17.398980,POLLO EVISCERADO,1.0,kg,39.25,POLLO EVISCERADO
Milanesa de Pollo Cuisine & Co 400g,,400.0,g,15.7,metro,2024-12-04 21:03:17.398980,POLLO EVISCERADO,1.0,kg,39.25,POLLO EVISCERADO
Pierna de Pollo Redondos x kg,,1.0,kg,15.9,metro,2024-12-04 21:03:17.398980,POLLO EVISCERADO,1.0,kg,15.9,POLLO EVISCERADO
Encuentro de Pollo Redondos x kg,,1.0,kg,15.9,metro,2024-12-04 21:03:17.398980,POLLO EVISCERADO,1.0,kg,15.9,POLLO EVISCERADO
Pierna Especial de Pollo x kg,,1.0,kg,15.95,wong,2024-12-04 18:48:25.850057,POLLO EVISCERADO,1.0,kg,15.95,POLLO EVISCERADO
Nuggets de Pechuga Pollo Oregon Foods 330g,,330.0,g,16.0,wong,2024-12-04 18:48:25.850057,POLLO EVISCERADO,1.0,kg,48.484848484848484,POLLO EVISCERADO
Alas Pollo Congeladas San Fernando x kg,,1.0,kg,16.3,wong,2024-12-04 18:48:25.850057,POLLO EVISCERADO,1.0,kg,16.3,POLLO EVISCERADO
Pierna o Encuentro de Pollo x kg,,1.0,kg,16.49,wong,2024-12-04 18:48:25.850057,POLLO EVISCERADO,1.0,kg,16.49,POLLO EVISCERADO
Muslo de de Pollo Redondos x kg,,1.0,kg,16.49,metro,2024-12-04 21:03:17.398980,POLLO EVISCERADO,1.0,kg,16.49,POLLO EVISCERADO
Filete de Pechuga Importado x kg,,1.0,kg,16.5,wong,2024-12-04 18:48:25.850057,POLLO EVISCERADO,1.0,kg,16.5,POLLO EVISCERADO
Filete de Pechuga Importado x kg,,1.0,kg,16.5,metro,2024-12-04 21:03:17.398980,POLLO EVISCERADO,1.0,kg,16.5,POLLO EVISCERADO
Muslo de Pollo Congelado San Fernando x kg,,1.0,kg,16.5,metro,2024-12-04 21:03:17.398980,POLLO EVISCERADO,1.0,kg,16.5,POLLO EVISCERADO
Muslo de Pollo Congelado San Fernando x kg,,1.0,kg,16.5,wong,2024-12-04 18:48:25.850057,POLLO EVISCERADO,1.0,kg,16.5,POLLO EVISCERADO
Pierna de Pollo Congelada San Fernando x kg,,1.0,kg,16.5,metro,2024-12-04 21:03:17.398980,POLLO EVISCERADO,1.0,kg,16.5,POLLO EVISCERADO
Pierna de Pollo Congelada San Fernando x kg,,1.0,kg,16.5,wong,2024-12-04 18:48:25.850057,POLLO EVISCERADO,1.0,kg,16.5,POLLO EVISCERADO
Chicharrón de Pollo AVINKA Bolsa 350g,AVINKA,350.0,g,16.7,vivanda,2024-12-04 17:26:31.945603,POLLO EVISCERADO,1.0,kg,47.714285714285715,POLLO EVISCERADO
Pollo Pollada San Fernando Bolsa 800 g / 2 Cuartos de Pollo,,800.0,g,17.2,metro,2024-12-04 21:03:17.398980,POLLO EVISCERADO,1.0,kg,21.5,POLLO EVISCERADO
Nuggets de Pechuga de Pollo Cuisine & Co 480g,,480.0,g,17.2,wong,2024-12-04 18:48:25.850057,POLLO EVISCERADO,1.0,kg,35.833333333333336,POLLO EVISCERADO
Pollo Pollada San Fernando Bolsa 800 g / 2 Cuartos de Pollo,,800.0,g,17.2,wong,2024-12-04 18:48:25.850057,POLLO EVISCERADO,1.0,kg,21.5,POLLO EVISCERADO
Pollo Trozado Macerado SAN FERNANDO Asu Olla! Sazón Pollo Oriental Bolsa 800g,SAN FERNANDO,800.0,g,17.3,vivanda,2024-12-04 17:26:31.945603,POLLO EVISCERADO,1.0,kg,21.625,POLLO EVISCERADO
Pollo Trozado Macerado SAN FERNANDO Asu Olla! Sazón Pollo Al Horno Bolsa 800g,SAN FERNANDO,800.0,g,17.3,vivanda,2024-12-04 17:26:31.945603,POLLO EVISCERADO,1.0,kg,21.625,POLLO EVISCERADO
Pechuga Especial de Pollo x kg,,1.0,kg,17.5,wong,2024-12-04 18:48:25.850057,POLLO EVISCERADO,1.0,kg,17.5,POLLO EVISCERADO
Pechuga Especial de Pollo x kg,,1.0,kg,17.5,metro,2024-12-04 21:03:17.398980,POLLO EVISCERADO,1.0,kg,17.5,POLLO EVISCERADO
Ala Media de de Pollo Redondos x kg,,1.0,kg,17.5,metro,2024-12-04 21:03:17.398980,POLLO EVISCERADO,1.0,kg,17.5,POLLO EVISCERADO
Drumetts de Pollo x kg,,1.0,kg,17.5,wong,2024-12-04 18:48:25.850057,POLLO EVISCERADO,1.0,kg,17.5,POLLO EVISCERADO
Pollo Trozado Macerado SAN FERNANDO Asu Olla! Sazón Pollo Pollada Bolsa 800g,SAN FERNANDO,800.0,g,17.7,vivanda,2024-12-04 17:26:31.945603,POLLO EVISCERADO,1.0,kg,22.125,POLLO EVISCERADO
Pollo Sabor Criollo Redondos 780g,,780.0,g,17.89,wong,2024-12-04 18:48:25.850057,POLLO EVISCERADO,1.0,kg,22.935897435897434,POLLO EVISCERADO
Pollo Sabor Oriental Redondos 780g,,780.0,g,17.89,metro,2024-12-04 21:03:17.398980,POLLO EVISCERADO,1.0,kg,22.935897435897434,POLLO EVISCERADO
Pollo Sabor Oriental Redondos 780g,,780.0,g,17.89,wong,2024-12-04 18:48:25.850057,POLLO EVISCERADO,1.0,kg,22.935897435897434,POLLO EVISCERADO
Pollo Sabor Estofado Redondos 780g,,780.0,g,17.89,metro,2024-12-04 21:03:17.398980,POLLO EVISCERADO,1.0,kg,22.935897435897434,POLLO EVISCERADO
Pollo Sabor Pachamanca Redondos 780g,,780.0,g,17.89,metro,2024-12-04 21:03:17.398980,POLLO EVISCERADO,1.0,kg,22.935897435897434,POLLO EVISCERADO
Pollo Sabor Criollo Redondos 780g,,780.0,g,17.89,metro,2024-12-04 21:03:17.398980,POLLO EVISCERADO,1.0,kg,22.935897435897434,POLLO EVISCERADO
Pollo Sabor Pachamanca Redondos 780g,,780.0,g,17.89,wong,2024-12-04 18:48:25.850057,POLLO EVISCERADO,1.0,kg,22.935897435897434,POLLO EVISCERADO
Encuentro de Pollo Especial sin Espinazo x kg,,1.0,kg,18.9,wong,2024-12-04 18:48:25.850057,POLLO EVISCERADO,1.0,kg,18.9,POLLO EVISCERADO
Pollo Fresco Sin Menudencia Artisan Libre de Antibióticos x kg,,1.0,kg,19.49,metro,2024-12-04 21:03:17.398980,POLLO EVISCERADO,1.0,kg,19.49,POLLO EVISCERADO
Pechuga Light de Pollo Redondos x kg,,1.0,kg,19.5,metro,2024-12-04 21:03:17.398980,POLLO EVISCERADO,1.0,kg,19.5,POLLO EVISCERADO
Pechuga de Pollo Light x kg,,1.0,kg,19.5,wong,2024-12-04 18:48:25.850057,POLLO EVISCERADO,1.0,kg,19.5,POLLO EVISCERADO
Muslo de Pollo Light Redondos x kg,,1.0,kg,19.9,metro,2024-12-04 21:03:17.398980,POLLO EVISCERADO,1.0,kg,19.9,POLLO EVISCERADO
Encuentro Especial Light de Pollo x kg,,1.0,kg,19.9,wong,2024-12-04 18:48:25.850057,POLLO EVISCERADO,1.0,kg,19.9,POLLO EVISCERADO
Pollo Entero Aderezo Leña REDONDOS Paquete 1Kg,REDONDOS,1.0,kg,20.3,vivanda,2024-12-04 17:26:31.945603,POLLO EVISCERADO,1.0,kg,20.3,POLLO EVISCERADO
Filete de Pierna de Pollo Redondos x kg,,1.0,kg,20.9,metro,2024-12-04 21:03:17.398980,POLLO EVISCERADO,1.0,kg,20.9,POLLO EVISCERADO
Filete Parrillero de Pierna de Pollo con Piel x kg,,1.0,kg,20.9,wong,2024-12-04 18:48:25.850057,POLLO EVISCERADO,1.0,kg,20.9,POLLO EVISCERADO
Alitas Orientales San Fernando 1kg,,1.0,kg,21.9,wong,2024-12-04 18:48:25.850057,POLLO EVISCERADO,1.0,kg,21.9,POLLO EVISCERADO
Pollo Entero Marinado Sazón Brasa San Fernando 1.4kg,,1.4,kg,21.9,metro,2024-12-04 21:03:17.398980,POLLO EVISCERADO,1.0,kg,15.642857142857142,POLLO EVISCERADO
Filete de Pierna de Pollo Sin Piel Redondos x kg,,1.0,kg,22.9,metro,2024-12-04 21:03:17.398980,POLLO EVISCERADO,1.0,kg,22.9,POLLO EVISCERADO
Filete de Pierna de Pollo x kg,,1.0,kg,22.9,wong,2024-12-04 18:48:25.850057,POLLO EVISCERADO,1.0,kg,22.9,POLLO EVISCERADO
Filete de Pechuga de Pollo x kg,,1.0,kg,24.0,wong,2024-12-04 18:48:25.850057,POLLO EVISCERADO,1.0,kg,24.0,POLLO EVISCERADO
Pollo con Frutas x kg,,1.0,kg,24.9,metro,2024-12-04 21:03:17.398980,POLLO EVISCERADO,1.0,kg,24.9,POLLO EVISCERADO
Filete de Pechuga Pollo Redondos x kg,,1.0,kg,25.4,metro,2024-12-04 21:03:17.398980,POLLO EVISCERADO,1.0,kg,25.4,POLLO EVISCERADO
Filete de Pejerrey de Pollo x kg,,1.0,kg,25.4,wong,2024-12-04 18:48:25.850057,POLLO EVISCERADO,1.0,kg,25.4,POLLO EVISCERADO
Filete de Pechuga de Pollo Congelada San Fernando x kg,,1.0,kg,26.7,metro,2024-12-04 21:03:17.398980,POLLO EVISCERADO,1.0,kg,26.7,POLLO EVISCERADO
Alas de Pollo Artisan x Kg. Libre de Antibióticos,,1.0,kg,27.5,wong,2024-12-04 18:48:25.850057,POLLO EVISCERADO,1.0,kg,27.5,POLLO EVISCERADO
Alitas de Pollo a La Barbecue Wong Bolsa x 1 Kg,,1.0,kg,28.99,wong,2024-12-04 18:48:25.850057,POLLO EVISCERADO,1.0,kg,28.99,POLLO EVISCERADO
Filete de Pechuga de Pollo x kg,,1.0,kg,29.9,metro,2024-12-04 21:03:17.398980,POLLO EVISCERADO,1.0,kg,29.9,POLLO EVISCERADO
Milanesa de Pollo x kg,,1.0,kg,29.99,wong,2024-12-04 18:48:25.850057,POLLO EVISCERADO,1.0,kg,29.99,POLLO EVISCERADO
Pollo Entero Light Sin Menudencia Artisan x kg,,1.0,kg,30.9,wong,2024-12-04 18:48:25.850057,POLLO EVISCERADO,1.0,kg,30.9,POLLO EVISCERADO
Muslos de Pollo Artisan x Kg. Libre de Antibióticos,,1.0,kg,31.4,wong,2024-12-04 18:48:25.850057,POLLO EVISCERADO,1.0,kg,31.4,POLLO EVISCERADO
Milanesa de Pollo Redondos 1kg,,1.0,kg,32.9,wong,2024-12-04 18:48:25.850057,POLLO EVISCERADO,1.0,kg,32.9,POLLO EVISCERADO
Metro Pollo Entero + Porción de Papas x 400 g Delivery,,400.0,g,35.99,metro,2024-12-04 21:03:17.398980,POLLO EVISCERADO,1.0,kg,89.97500000000001,POLLO EVISCERADO
Pollo con Frutas x kg,,1.0,kg,37.9,wong,2024-12-04 18:48:25.850057,POLLO EVISCERADO,1.0,kg,37.9,POLLO EVISCERADO
Pollo Tipackay x kg,,1.0,kg,37.9,wong,2024-12-04 18:48:25.850057,POLLO EVISCERADO,1.0,kg,37.9,POLLO EVISCERADO
Suprema de Pollo Artisan 550g,,550.0,g,39.5,wong,2024-12-04 18:48:25.850057,POLLO EVISCERADO,1.0,kg,71.81818181818181,POLLO EVISCERADO
Filete de Pierna de Pollo con Piel Avinka Artisan x kg,,1.0,kg,40.75,wong,2024-12-04 18:48:25.850057,POLLO EVISCERADO,1.0,kg,40.75,POLLO EVISCERADO
Pollo Enrollado con Verduras x kg,,1.0,kg,41.5,metro,2024-12-04 21:03:17.398980,POLLO EVISCERADO,1.0,kg,41.5,POLLO EVISCERADO
Pollo Enrollado con Jamon y Queso x kg,,1.0,kg,41.5,wong,2024-12-04 18:48:25.850057,POLLO EVISCERADO,1.0,kg,41.5,POLLO EVISCERADO
Pollo Enrollado Jamon y Queso Sin Piel x kg,,1.0,kg,41.5,metro,2024-12-04 21:03:17.398980,POLLO EVISCERADO,1.0,kg,41.5,POLLO EVISCERADO
Pollo Enrollado Jamon y Queso Sin Piel x kg,,1.0,kg,41.5,wong,2024-12-04 18:48:25.850057,POLLO EVISCERADO,1.0,kg,41.5,POLLO EVISCERADO
"Pollo Enrollado con Jamón, Tocino y Guindones x kg",,1.0,kg,41.5,metro,2024-12-04 21:03:17.398980,POLLO EVISCERADO,1.0,kg,41.5,POLLO EVISCERADO
Pollo Enrollado De La Casa Surtido x kg,,1.0,kg,41.99,wong,2024-12-04 18:48:25.850057,POLLO EVISCERADO,1.0,kg,41.99,POLLO EVISCERADO
Metro Pollo Entero + Porción de Papas x 400 g + Gaseosa 1.5 Litro,,400.0,g,42.99,metro,2024-12-04 21:03:17.398980,POLLO EVISCERADO,1.0,kg,107.47500000000001,POLLO EVISCERADO
Metro Pollo Entero + Porción de Papas x 400 g + Chicha Morada Naturale 1 Litro,,400.0,g,42.99,metro,2024-12-04 21:03:17.398980,POLLO EVISCERADO,1.0,kg,107.47500000000001,POLLO EVISCERADO
Filete de Pechuga Artisan x Kg. Libre de Antibióticos,,1.0,kg,46.6,metro,2024-12-04 21:03:17.398980,POLLO EVISCERADO,1.0,kg,46.6,POLLO EVISCERADO
Filete de Pechuga Artisan x Kg. Libre de Antibióticos,,1.0,kg,46.6,wong,2024-12-04 18:48:25.850057,POLLO EVISCERADO,1.0,kg,46.6,POLLO EVISCERADO
Tiras de Pollo Artisan x kg,,1.0,kg,46.9,wong,2024-12-04 18:48:25.850057,POLLO EVISCERADO,1.0,kg,46.9,POLLO EVISCERADO
Filete de Pejerrey Artisan x Kg. Libre de Antibióticos,,1.0,kg,47.79,wong,2024-12-04 18:48:25.850057,POLLO EVISCERADO,1.0,kg,47.79,POLLO EVISCERADO
Metro Pollo Entero + Porción de Papas x 400 g + Gaseosa 1.5 Litro + Ensalada,,400.0,g,52.99,metro,2024-12-04 21:03:17.398980,POLLO EVISCERADO,1.0,kg,132.475,POLLO EVISCERADO
Metro Pollo Entero + Porción de Papas x 400 g + Chicha Morada Naturale 1 Litro + Ensalada,,400.0,g,52.99,metro,2024-12-04 21:03:17.398980,POLLO EVISCERADO,1.0,kg,132.475,POLLO EVISCERADO
Alimento para Gatos Esterilizados Purina One Pollo y Salmón 2kg,,2.0,kg,74.1,metro,2024-12-04 21:03:17.398980,POLLO EVISCERADO,1.0,kg,37.05,POLLO EVISCERADO
"Ricocat Alimento para Gatos Adultos Pollo, Sardina y Salmón 9kg",,9.0,kg,89.9,metro,2024-12-04 21:03:17.398980,POLLO EVISCERADO,1.0,kg,9.988888888888889,POLLO EVISCERADO
Alimento Purina One Esterilizados One Pollo Y Salmon 6kg,,6.0,kg,167.5,wong,2024-12-04 18:48:25.850057,POLLO EVISCERADO,1.0,kg,27.916666666666664,POLLO EVISCERADO
