description,price,website,search_term,scrape_timestamp,cantidad,unidad,price_numeric,WEB,unit,brand,CLASIFICACION
Pechuga Especial Importada x kg,S/ 14.50 x kg,wong,POLLO EVISCERADO,2024-12-04 18:48:25.850057,1.0,kg,14.5,wong,,,POLLO EVISCERADO
Pollo Tipakay con Arroz Chaufa Cuisine & Co 400g,S/ 14.50,wong,POLLO EVISCERADO,2024-12-04 18:48:25.850057,400.0,g,14.5,wong,,,POLLO EVISCERADO
TIRAS DE PECHUGA DE POLLO X 300GR,S/ 14.50,tottus,POLLO EVISCERADO,2024-12-04 13:10:52.795575,300.0,g,14.5,tottus,,REDONDOS,POLLO EVISCERADO
Pollo Oriental San Fernando Bolsa 800 g / Medio Pollo en 4 Piezas,S/ 14.60,metro,POLLO EVISCERADO,2024-12-04 21:03:17.398980,800.0,g,14.6,metro,,,POLLO EVISCERADO
Pollo Oriental San Fernando Bolsa 800 g / Medio Pollo en 4 Piezas,S/ 14.60,wong,POLLO EVISCERADO,2024-12-04 18:48:25.850057,800.0,g,14.6,wong,,,POLLO EVISCERADO
Pollo Entero Light x kg,S/ 14.70 x kg,metro,POLLO EVISCERADO,2024-12-04 21:03:17.398980,1.0,kg,14.7,metro,,,POLLO EVISCERADO
Pollo Entero Light x kg,S/ 14.70 x kg,wong,POLLO EVISCERADO,2024-12-04 18:48:25.850057,1.0,kg,14.7,wong,,,POLLO EVISCERADO
Ala de Pollo Empacada al vacío SAN FERNANDO,S/ 14.90 x kg,plaza_vea,POLLO EVISCERADO,2024-12-04 13:21:01.580362,1.2,kg,14.9,plaza_vea,Presentación 1.2 kg aprox.,,POLLO EVISCERADO
Nuggets De Pollo 24 Unidades,S/ 14.90,tottus,POLLO EVISCERADO,2024-12-04 13:10:52.795575,24.0,un,14.9,tottus,,TOTTUS,POLLO EVISCERADO
Pechuga Entera de Pollo Empacada al vacío SAN ...,S/ 14.90 x kg,plaza_vea,POLLO EVISCERADO,2024-12-04 13:21:01.580362,1.2,kg,14.9,plaza_vea,Presentación 1.2 kg aprox.,,POLLO EVISCERADO
Tiras de Pechuga de Pollo Bolsa 300 g,S/ 14.90,wong,POLLO EVISCERADO,2024-12-04 18:48:25.850057,300.0,g,14.9,wong,,,POLLO EVISCERADO
"Comida para Gatos RICOCAT Pollo, Sardina, Salmón Bolsa 1 kg",S/ 14.90,vega,POLLO EVISCERADO,2024-12-04 13:25:27.785871,1.0,kg,14.9,vega,,Ricocat,POLLO EVISCERADO
Pollo Entero Congelado PERDIX Bolsa 1400g,S/ 15.20,vivanda,POLLO EVISCERADO,2024-12-04 17:26:31.945603,1400.0,g,15.2,vivanda,,PERDIX,POLLO EVISCERADO
Pechuga Entera de Pollo Redondos x kg,S/ 15.50 x kg,metro,POLLO EVISCERADO,2024-12-04 21:03:17.398980,1.0,kg,15.5,metro,,,POLLO EVISCERADO
Alitas Búfalo Redondos Caja 400 g,S/ 15.70,metro,POLLO EVISCERADO,2024-12-04 21:03:17.398980,400.0,g,15.7,metro,,,POLLO EVISCERADO
Apanado De Pollo 4 Un,S/ 15.70,tottus,POLLO EVISCERADO,2024-12-04 13:10:52.795575,4.0,un,15.7,tottus,,AVINKA,POLLO EVISCERADO
Milanesa de Pollo Cuisine & Co 400g,S/ 15.70,metro,POLLO EVISCERADO,2024-12-04 21:03:17.398980,400.0,g,15.7,metro,,,POLLO EVISCERADO
Nuggets de Pechuga de Pollo San Fernando 24un,S/ 15.80,metro,POLLO EVISCERADO,2024-12-04 21:03:17.398980,24.0,un,15.8,metro,,,POLLO EVISCERADO
Pechuga de Pollo con Alas Congelado SAN FERNAN...,S/ 15.90 x kg,plaza_vea,POLLO EVISCERADO,2024-12-04 13:21:01.580362,1.3,kg,15.9,plaza_vea,Presentación 1.3 kg aprox.,,POLLO EVISCERADO
Pierna de Pollo Redondos x kg,S/ 15.90 x kg,metro,POLLO EVISCERADO,2024-12-04 21:03:17.398980,1.0,kg,15.9,metro,,,POLLO EVISCERADO
Encuentro de Pollo Redondos x kg,S/ 15.90 x kg,metro,POLLO EVISCERADO,2024-12-04 21:03:17.398980,1.0,kg,15.9,metro,,,POLLO EVISCERADO
Detergente en Polvo BOREAL Explosión Floral Bo...,S/ 15.90 un,plaza_vea,POLLO EVISCERADO,2024-12-04 13:21:01.580362,2000.0,g,15.9,plaza_vea,Bolsa 2000g,,POLLO EVISCERADO
Pierna de Pollo Empacada al vacío SAN FERNANDO,S/ 15.90 x kg,plaza_vea,POLLO EVISCERADO,2024-12-04 13:21:01.580362,1.2,kg,15.9,plaza_vea,Presentación 1.2 kg aprox.,,POLLO EVISCERADO
Nuggets de Pechuga Pollo Oregon Foods 330g,S/ 16.00,wong,POLLO EVISCERADO,2024-12-04 18:48:25.850057,330.0,g,16.0,wong,,,POLLO EVISCERADO
Alas Pollo Congeladas San Fernando x kg,S/ 16.30 x kg,metro,POLLO EVISCERADO,2024-12-04 21:03:17.398980,1.0,kg,16.3,metro,,,POLLO EVISCERADO
Alas Pollo Congeladas San Fernando x kg,S/ 16.30 x kg,wong,POLLO EVISCERADO,2024-12-04 18:48:25.850057,1.0,kg,16.3,wong,,,POLLO EVISCERADO
Muslo de Pollo Empacada al vacío SAN FERNANDO,S/ 16.49 x kg,plaza_vea,POLLO EVISCERADO,2024-12-04 13:21:01.580362,1.0,kg,16.49,plaza_vea,Presentación 1 kg aprox.,,POLLO EVISCERADO
Pierna o Encuentro de Pollo x kg,S/ 16.49 x kg,wong,POLLO EVISCERADO,2024-12-04 18:48:25.850057,1.0,kg,16.49,wong,,,POLLO EVISCERADO
Muslo de de Pollo Redondos x kg,S/ 16.49 x kg,metro,POLLO EVISCERADO,2024-12-04 21:03:17.398980,1.0,kg,16.49,metro,,,POLLO EVISCERADO
Filete de Pechuga Importado x kg,S/ 16.50 x kg,wong,POLLO EVISCERADO,2024-12-04 18:48:25.850057,1.0,kg,16.5,wong,,,POLLO EVISCERADO
Pierna de Pollo Congelada San Fernando x kg,S/ 16.50 x kg,wong,POLLO EVISCERADO,2024-12-04 18:48:25.850057,1.0,kg,16.5,wong,,,POLLO EVISCERADO
Muslo de Pollo Congelado San Fernando x kg,S/ 16.50 x kg,wong,POLLO EVISCERADO,2024-12-04 18:48:25.850057,1.0,kg,16.5,wong,,,POLLO EVISCERADO
Filete de Pechuga Importado x kg,S/ 16.50 x kg,metro,POLLO EVISCERADO,2024-12-04 21:03:17.398980,1.0,kg,16.5,metro,,,POLLO EVISCERADO
Pollo Fresco Sin Menudencia Artisan Libre de Antibióticos x kg,S/ 16.50 x kg,wong,POLLO EVISCERADO,2024-12-04 18:48:25.850057,1.0,kg,16.5,wong,,,POLLO EVISCERADO
Nuggets de Pechuga de Pollo Redondos 36un,S/ 16.60,metro,POLLO EVISCERADO,2024-12-04 21:03:17.398980,36.0,un,16.6,metro,,,POLLO EVISCERADO
Nuggets de Pechuga de Pollo Redondos 36un,S/ 16.60,wong,POLLO EVISCERADO,2024-12-04 18:48:25.850057,36.0,un,16.6,wong,,,POLLO EVISCERADO
Chicharrón de Pollo AVINKA Bolsa 350g,S/ 16.70 un,plaza_vea,POLLO EVISCERADO,2024-12-04 13:21:01.580362,350.0,g,16.7,plaza_vea,Bolsa 350g,,POLLO EVISCERADO
Chicharrón de Pollo AVINKA Bolsa 350g,S/ 16.70,vivanda,POLLO EVISCERADO,2024-12-04 17:26:31.945603,350.0,g,16.7,vivanda,,AVINKA,POLLO EVISCERADO
Papel Toalla SCOTT Multiuso Paquete 6un,S/ 16.90 un,plaza_vea,POLLO EVISCERADO,2024-12-04 13:21:01.580362,6.0,un,16.9,plaza_vea,Paquete 6un,,POLLO EVISCERADO
Pollito Sabor Leña Redondos x Unid,S/ 16.90,metro,POLLO EVISCERADO,2024-12-04 21:03:17.398980,1.0,un,16.9,metro,,,POLLO EVISCERADO
Pollo Pollada San Fernando Bolsa 800 g / 2 Cuartos de Pollo,S/ 17.20,metro,POLLO EVISCERADO,2024-12-04 21:03:17.398980,800.0,g,17.2,metro,,,POLLO EVISCERADO
Pollo Pollada San Fernando Bolsa 800 g / 2 Cuartos de Pollo,S/ 17.20,wong,POLLO EVISCERADO,2024-12-04 18:48:25.850057,800.0,g,17.2,wong,,,POLLO EVISCERADO
Nuggets de Pechuga de Pollo Cuisine & Co 480g,S/ 17.20,wong,POLLO EVISCERADO,2024-12-04 18:48:25.850057,480.0,g,17.2,wong,,,POLLO EVISCERADO
Pollo Trozado Macerado SAN FERNANDO Asu Olla! Sazón Pollo Oriental Bolsa 800g,S/ 17.30,vivanda,POLLO EVISCERADO,2024-12-04 17:26:31.945603,800.0,g,17.3,vivanda,,SAN FERNANDO,POLLO EVISCERADO
Pollo Trozado Macerado SAN FERNANDO Asu Olla! Sazón Pollo Al Horno Bolsa 800g,S/ 17.30,vivanda,POLLO EVISCERADO,2024-12-04 17:26:31.945603,800.0,g,17.3,vivanda,,SAN FERNANDO,POLLO EVISCERADO
Pechuga Especial de Pollo x kg,S/ 17.50 x kg,metro,POLLO EVISCERADO,2024-12-04 21:03:17.398980,1.0,kg,17.5,metro,,,POLLO EVISCERADO
Drumetts de Pollo x kg,S/ 17.50 x kg,wong,POLLO EVISCERADO,2024-12-04 18:48:25.850057,1.0,kg,17.5,wong,,,POLLO EVISCERADO
Pechuga Especial de Pollo x kg,S/ 17.50 x kg,wong,POLLO EVISCERADO,2024-12-04 18:48:25.850057,1.0,kg,17.5,wong,,,POLLO EVISCERADO
Pechuga Especial de Pollo Redondos x kg,S/ 17.50 x kg,metro,POLLO EVISCERADO,2024-12-04 21:03:17.398980,1.0,kg,17.5,metro,,,POLLO EVISCERADO
Ala Media de de Pollo Redondos x kg,S/ 17.50 x kg,metro,POLLO EVISCERADO,2024-12-04 21:03:17.398980,1.0,kg,17.5,metro,,,POLLO EVISCERADO
Treats Mollejas De Pollo 100 g,S/ 17.60,tottus,POLLO EVISCERADO,2024-12-04 13:10:52.795575,100.0,g,17.6,tottus,,NATURAL HOME,POLLO EVISCERADO
Treats Corazón De Pollo 100 g,S/ 17.60,tottus,POLLO EVISCERADO,2024-12-04 13:10:52.795575,100.0,g,17.6,tottus,,NATURAL HOME,POLLO EVISCERADO
Pollo Trozado Macerado SAN FERNANDO Asu Olla! Sazón Pollo Pollada Bolsa 800g,S/ 17.70,vivanda,POLLO EVISCERADO,2024-12-04 17:26:31.945603,800.0,g,17.7,vivanda,,SAN FERNANDO,POLLO EVISCERADO
Pollo Sabor Pachamanca Redondos 780g,S/ 17.89,metro,POLLO EVISCERADO,2024-12-04 21:03:17.398980,780.0,g,17.89,metro,,,POLLO EVISCERADO
Pollo Sabor Oriental Redondos 780g,S/ 17.89,wong,POLLO EVISCERADO,2024-12-04 18:48:25.850057,780.0,g,17.89,wong,,,POLLO EVISCERADO
Pollo Sabor Estofado Redondos 780g,S/ 17.89,metro,POLLO EVISCERADO,2024-12-04 21:03:17.398980,780.0,g,17.89,metro,,,POLLO EVISCERADO
Pollo Sabor Oriental Redondos 780g,S/ 17.89,metro,POLLO EVISCERADO,2024-12-04 21:03:17.398980,780.0,g,17.89,metro,,,POLLO EVISCERADO
Pollo Sabor Criollo Redondos 780g,S/ 17.89,wong,POLLO EVISCERADO,2024-12-04 18:48:25.850057,780.0,g,17.89,wong,,,POLLO EVISCERADO
Pollo Sabor Criollo Redondos 780g,S/ 17.89,metro,POLLO EVISCERADO,2024-12-04 21:03:17.398980,780.0,g,17.89,metro,,,POLLO EVISCERADO
Pollo Sabor Pachamanca Redondos 780g,S/ 17.89,wong,POLLO EVISCERADO,2024-12-04 18:48:25.850057,780.0,g,17.89,wong,,,POLLO EVISCERADO
Hamburguesa de Pollo Avinka 4un,S/ 17.90,wong,POLLO EVISCERADO,2024-12-04 18:48:25.850057,4.0,un,17.9,wong,,,POLLO EVISCERADO
HAMBURGUESA PARRILLERA DE POLLO - PAQUETE 600 GR,S/ 17.90,tottus,POLLO EVISCERADO,2024-12-04 13:10:52.795575,600.0,g,17.9,tottus,,REDONDOS,POLLO EVISCERADO
Pollo Teriyaki Wong Ready Con Arroz Oriental Bandeja 370 g,S/ 17.90,wong,POLLO EVISCERADO,2024-12-04 18:48:25.850057,370.0,g,17.9,wong,,,POLLO EVISCERADO
Pack Gaseosa INCA KOLA Sin Azúcar Botella 1L + Empanada de Pollo Paquete 4un,S/ 18.10,vivanda,POLLO EVISCERADO,2024-12-04 17:26:31.945603,1.0,l,18.1,vivanda,,COCA COLA,POLLO EVISCERADO
Patas de Pollo Rambala Deshidratada 20un,S/ 18.30,metro,POLLO EVISCERADO,2024-12-04 21:03:17.398980,20.0,un,18.3,metro,,,POLLO EVISCERADO
Pierna de Pollo Light x kg,S/ 18.50 x kg,wong,POLLO EVISCERADO,2024-12-04 18:48:25.850057,1.0,kg,18.5,wong,,,POLLO EVISCERADO
Detergente en Polvo SAPOLIO Bebé Bolsa 2Kg,S/ 18.90 un,plaza_vea,POLLO EVISCERADO,2024-12-04 13:21:01.580362,2.0,kg,18.9,plaza_vea,Bolsa 2Kg,,POLLO EVISCERADO
Trucha Eviscerada,S/ 18.90 x kg,plaza_vea,POLLO EVISCERADO,2024-12-04 13:21:01.580362,0.4,kg,18.9,plaza_vea,Presentación 0.4 kg aprox.,,POLLO EVISCERADO
Papel Toalla NOVA Ultra Absorbente Paquete 6un,S/ 18.90 un,plaza_vea,POLLO EVISCERADO,2024-12-04 13:21:01.580362,6.0,un,18.9,plaza_vea,Paquete 6un,,POLLO EVISCERADO
Encuentro de Pollo Especial sin Espinazo x kg,S/ 18.90 x kg,wong,POLLO EVISCERADO,2024-12-04 18:48:25.850057,1.0,kg,18.9,wong,,,POLLO EVISCERADO
Pollo Fresco Sin Menudencia Artisan Libre de Antibióticos x kg,S/ 19.49 x kg,metro,POLLO EVISCERADO,2024-12-04 21:03:17.398980,1.0,kg,19.49,metro,,,POLLO EVISCERADO
Pechuga de Pollo Light x kg,S/ 19.50 x kg,wong,POLLO EVISCERADO,2024-12-04 18:48:25.850057,1.0,kg,19.5,wong,,,POLLO EVISCERADO
Pechuga Light de Pollo Redondos x kg,S/ 19.50 x kg,metro,POLLO EVISCERADO,2024-12-04 21:03:17.398980,1.0,kg,19.5,metro,,,POLLO EVISCERADO
Muslo de Pollo Light Redondos x kg,S/ 19.90 x kg,metro,POLLO EVISCERADO,2024-12-04 21:03:17.398980,1.0,kg,19.9,metro,,,POLLO EVISCERADO
EMPANADITAS DE POLLO X 15 UNID.,S/ 19.90,tottus,POLLO EVISCERADO,2024-12-04 13:10:52.795575,15.0,un,19.9,tottus,,TOTTUS,POLLO EVISCERADO
Encuentro Especial Light de Pollo x kg,S/ 19.90 x kg,wong,POLLO EVISCERADO,2024-12-04 18:48:25.850057,1.0,kg,19.9,wong,,,POLLO EVISCERADO
Pollo Entero Aderezo Leña REDONDOS Paquete 1Kg,S/ 20.30,vivanda,POLLO EVISCERADO,2024-12-04 17:26:31.945603,1.0,kg,20.3,vivanda,,REDONDOS,POLLO EVISCERADO
Pollito Sabor Leña Redondos x Unid,S/ 20.90,wong,POLLO EVISCERADO,2024-12-04 18:48:25.850057,1.0,un,20.9,wong,,,POLLO EVISCERADO
Filete Pierna Pollo con Piel Empacada al vacío...,S/ 20.90 x kg,plaza_vea,POLLO EVISCERADO,2024-12-04 13:21:01.580362,1.2,kg,20.9,plaza_vea,Presentación 1.2 kg aprox.,,POLLO EVISCERADO
Filete de Pierna de Pollo Redondos x kg,S/ 20.90 x kg,metro,POLLO EVISCERADO,2024-12-04 21:03:17.398980,1.0,kg,20.9,metro,,,POLLO EVISCERADO
Alitas Orientales San Fernando 1kg,S/ 21.90,wong,POLLO EVISCERADO,2024-12-04 18:48:25.850057,1.0,kg,21.9,wong,,,POLLO EVISCERADO
Pollo Rostizado 1un,S/ 22.50 un,plaza_vea,POLLO EVISCERADO,2024-12-04 13:21:01.580362,1.0,un,22.5,plaza_vea,Bandeja 1un,,POLLO EVISCERADO
Detergente en Polvo BOLIVAR Baby Kids Bolsa 1....,S/ 22.50 un,plaza_vea,POLLO EVISCERADO,2024-12-04 13:21:01.580362,1.5,kg,22.5,plaza_vea,Bolsa 1.5Kg,,POLLO EVISCERADO
Pollo Rostizado 1un,S/ 22.80,vivanda,POLLO EVISCERADO,2024-12-04 17:26:31.945603,1.0,un,22.8,vivanda,,VIVANDA,POLLO EVISCERADO
Filete de Pechuga de Pollo Congelado SAN FERNA...,S/ 22.90 x kg,plaza_vea,POLLO EVISCERADO,2024-12-04 13:21:01.580362,1.2,kg,22.9,plaza_vea,Presentación 1.2 kg aprox.,,POLLO EVISCERADO
Filete de Pierna de Pollo x kg,S/ 22.90 x kg,wong,POLLO EVISCERADO,2024-12-04 18:48:25.850057,1.0,kg,22.9,wong,,,POLLO EVISCERADO
Detergente en Polvo MARSELLA Lavanda y Rosas B...,S/ 22.90 un,plaza_vea,POLLO EVISCERADO,2024-12-04 13:21:01.580362,2.0,kg,22.9,plaza_vea,Bolsa 2Kg,,POLLO EVISCERADO
Filete de Pierna de Pollo Sin Piel Redondos x kg,S/ 22.90 x kg,metro,POLLO EVISCERADO,2024-12-04 21:03:17.398980,1.0,kg,22.9,metro,,,POLLO EVISCERADO
Detergente en Polvo MARSELLA Jazmín y Rosas Bo...,S/ 22.90 un,plaza_vea,POLLO EVISCERADO,2024-12-04 13:21:01.580362,2.0,kg,22.9,plaza_vea,Bolsa 2Kg,,POLLO EVISCERADO
Nuggets de Pollo x kg,S/ 22.99 x kg,metro,POLLO EVISCERADO,2024-12-04 21:03:17.398980,1.0,kg,22.99,metro,,,POLLO EVISCERADO
Suprema de Pollo,S/ 23.10 x kg,plaza_vea,POLLO EVISCERADO,2024-12-04 13:21:01.580362,0.3,kg,23.1,plaza_vea,Presentación 0.3 kg aprox.,,POLLO EVISCERADO
Detergente en Polvo CARICIA Rosa Ropa Delicada...,S/ 23.40 un,plaza_vea,POLLO EVISCERADO,2024-12-04 13:21:01.580362,700.0,g,23.4,plaza_vea,Bolsa 700g,,POLLO EVISCERADO
Filete de Pechuga de Pollo x kg,S/ 24.00 x kg,wong,POLLO EVISCERADO,2024-12-04 18:48:25.850057,1.0,kg,24.0,wong,,,POLLO EVISCERADO
Pollo Entero Marinado Sazón Brasa San Fernando 1.4kg,S/ 24.40,wong,POLLO EVISCERADO,2024-12-04 18:48:25.850057,1.4,kg,24.4,wong,,,POLLO EVISCERADO
Sasami de Pollo Empacada al vacío SAN FERNANDO,S/ 24.90 x kg,plaza_vea,POLLO EVISCERADO,2024-12-04 13:21:01.580362,1.2,kg,24.9,plaza_vea,Presentación 1.2 kg aprox.,,POLLO EVISCERADO
Pollo con Frutas x kg,S/ 24.90 x kg,metro,POLLO EVISCERADO,2024-12-04 21:03:17.398980,1.0,kg,24.9,metro,,,POLLO EVISCERADO
Nuggets De Pollo 900 g (60 unidades),S/ 24.90,tottus,POLLO EVISCERADO,2024-12-04 13:10:52.795575,900.0,g,24.9,tottus,,SAN FERNANDO,POLLO EVISCERADO
Hamburguesa Parrillera de Pollo Oregon Foods 4un,S/ 25.40,wong,POLLO EVISCERADO,2024-12-04 18:48:25.850057,4.0,un,25.4,wong,,,POLLO EVISCERADO
Filete de Pechuga Pollo Redondos x kg,S/ 25.40 x kg,metro,POLLO EVISCERADO,2024-12-04 21:03:17.398980,1.0,kg,25.4,metro,,,POLLO EVISCERADO
Milanesa de Pollo AVINKA Bolsa 4un,S/ 25.70,vivanda,POLLO EVISCERADO,2024-12-04 17:26:31.945603,4.0,un,25.7,vivanda,,AVINKA,POLLO EVISCERADO
Enrollado de Pollo con Frutas Secas 1 kg,S/ 26.18,tottus,POLLO EVISCERADO,2024-12-04 13:10:52.795575,1.0,kg,26.18,tottus,,TOTTUS,POLLO EVISCERADO
ENROLLADO DE POLLO CON JAMON QUESO X1KG,S/ 26.18,tottus,POLLO EVISCERADO,2024-12-04 13:10:52.795575,1.0,kg,26.18,tottus,,TOTTUS,POLLO EVISCERADO
Pollo Rostizado Sin Papas + Gaseosa Inca Kola Sin Azúcar 1.5L,S/ 26.50,metro,POLLO EVISCERADO,2024-12-04 21:03:17.398980,1.5,l,26.5,metro,,,POLLO EVISCERADO
Filete de Pechuga de Pollo Congelada San Fernando x kg,S/ 26.70 x kg,metro,POLLO EVISCERADO,2024-12-04 21:03:17.398980,1.0,kg,26.7,metro,,,POLLO EVISCERADO
Filete de Pechuga de Pollo Congelada San Fernando x kg,S/ 26.70 x kg,wong,POLLO EVISCERADO,2024-12-04 18:48:25.850057,1.0,kg,26.7,wong,,,POLLO EVISCERADO
SUPREMA DE POLLO X 600G 4UN,S/ 27.80,tottus,POLLO EVISCERADO,2024-12-04 13:10:52.795575,600.0,g,27.8,tottus,,AVINKA,POLLO EVISCERADO
MINI EMPANADA POLLO PASTIFICIOX320G,S/ 27.90,tottus,POLLO EVISCERADO,2024-12-04 13:10:52.795575,320.0,g,27.9,tottus,,,POLLO EVISCERADO
Pollo Rostizado + Papas Fritas,S/ 27.90 un,plaza_vea,POLLO EVISCERADO,2024-12-04 13:21:01.580362,2.0,un,27.9,plaza_vea,Paquete 2un,,POLLO EVISCERADO
Milanesa de Pechuga de Pollo OREGAN FOODS Bolsa 4un,S/ 27.90,vivanda,POLLO EVISCERADO,2024-12-04 17:26:31.945603,4.0,un,27.9,vivanda,,OREGON FOODS,POLLO EVISCERADO
Pollo Sabor Cilindro x un,S/ 28.50,metro,POLLO EVISCERADO,2024-12-04 21:03:17.398980,1.0,un,28.5,metro,,,POLLO EVISCERADO
Suprema de Pollo x kg,S/ 28.50 x kg,wong,POLLO EVISCERADO,2024-12-04 18:48:25.850057,1.0,kg,28.5,wong,,,POLLO EVISCERADO
Pollo Sabor Cilindro x un,S/ 28.50,wong,POLLO EVISCERADO,2024-12-04 18:48:25.850057,1.0,un,28.5,wong,,,POLLO EVISCERADO
HAMBURGUESA POLLO OF TRAD 8UN X 680G,S/ 28.50,tottus,POLLO EVISCERADO,2024-12-04 13:10:52.795575,8.0,un,28.5,tottus,,OREGON FOODS,POLLO EVISCERADO
SUPREMA DE POLLO CG X 550G,S/ 28.60,tottus,POLLO EVISCERADO,2024-12-04 13:10:52.795575,550.0,g,28.6,tottus,,ARTISAN,POLLO EVISCERADO
Alitas de Pollo a La Barbecue Wong Bolsa x 1 Kg,S/ 28.99,wong,POLLO EVISCERADO,2024-12-04 18:48:25.850057,1.0,kg,28.99,wong,,,POLLO EVISCERADO
Milanesa De Pollo 4 Un,S/ 29,tottus,POLLO EVISCERADO,2024-12-04 13:10:52.795575,4.0,un,29.0,tottus,,AVINKA,POLLO EVISCERADO
MILANESA DE POLLO X 1 KG,S/ 29.90,tottus,POLLO EVISCERADO,2024-12-04 13:10:52.795575,1.0,kg,29.9,tottus,,REDONDOS,POLLO EVISCERADO
Detergente en Polvo BOREAL Explosión Floral Bo...,S/ 29.90 un,plaza_vea,POLLO EVISCERADO,2024-12-04 13:21:01.580362,4000.0,g,29.9,plaza_vea,Bolsa 4000g,,POLLO EVISCERADO
Detergente en Polvo ACE Limón Bolsa 2Kg,S/ 29.90 un,plaza_vea,POLLO EVISCERADO,2024-12-04 13:21:01.580362,2.0,kg,29.9,plaza_vea,Bolsa 2Kg,,POLLO EVISCERADO
Comida para perros adultos pequeños sabor carne pollo y cereales de 3 kg,S/ 29.90,tottus,POLLO EVISCERADO,2024-12-04 13:10:52.795575,3.0,kg,29.9,tottus,,MIMASKOT,POLLO EVISCERADO
Pollo Entero Light Sin Menudencia Artisan x kg,S/ 30.90 x kg,wong,POLLO EVISCERADO,2024-12-04 18:48:25.850057,1.0,kg,30.9,wong,,,POLLO EVISCERADO
Muslos de Pollo Artisan x Kg. Libre de Antibióticos,S/ 31.40 x kg,wong,POLLO EVISCERADO,2024-12-04 18:48:25.850057,1.0,kg,31.4,wong,,,POLLO EVISCERADO
Combo: Pollo Rostizado + Papas Fritas + Gaseosa Fanta Naranja Botella 2.25L,S/ 31.50,metro,POLLO EVISCERADO,2024-12-04 21:03:17.398980,2.25,l,31.5,metro,,,POLLO EVISCERADO
MILANESA PECHUG POLLO OF TRAD 4UN X 600G,S/ 31.90,tottus,POLLO EVISCERADO,2024-12-04 13:10:52.795575,4.0,un,31.9,tottus,,OREGON FOODS,POLLO EVISCERADO
Milanesa de Pollo Oregon Foods 4un,S/ 31.90,wong,POLLO EVISCERADO,2024-12-04 18:48:25.850057,4.0,un,31.9,wong,,,POLLO EVISCERADO
Combo: Pollo Rostizado + Papas Fritas + Gaseosa Guaraná Botella 3L,S/ 32.50,metro,POLLO EVISCERADO,2024-12-04 21:03:17.398980,3.0,l,32.5,metro,,,POLLO EVISCERADO
Pollo Rostizado + Papas Fritas + Chicha Morada Naturale 1L,S/ 32.90,metro,POLLO EVISCERADO,2024-12-04 21:03:17.398980,1.0,l,32.9,metro,,,POLLO EVISCERADO
Milanesa de Pollo Redondos 1kg,S/ 32.90,wong,POLLO EVISCERADO,2024-12-04 18:48:25.850057,1.0,kg,32.9,wong,,,POLLO EVISCERADO
Pollo Rostizado + Papas Fritas + Chicha Morada Naturale 1L,S/ 33.90,metro,POLLO EVISCERADO,2024-12-04 21:03:17.398980,1.0,l,33.9,metro,,,POLLO EVISCERADO
Pollo Rostizado + Papas Fritas + Gaseosa Inca Kola Sin Azúcar 1.5L,S/ 33.90,metro,POLLO EVISCERADO,2024-12-04 21:03:17.398980,1.5,l,33.9,metro,,,POLLO EVISCERADO
Pollo Rostizado + Papas Fritas + Gaseosa Inca Kola Sin Azúcar 1.5L,S/ 33.90,metro,POLLO EVISCERADO,2024-12-04 21:03:17.398980,1.5,l,33.9,metro,,,POLLO EVISCERADO
Pollo Enrollado con Verduras Redondos x un,S/ 34.90,metro,POLLO EVISCERADO,2024-12-04 21:03:17.398980,1.0,un,34.9,metro,,,POLLO EVISCERADO
Pollo Enrollado con Champiñones Redondos x un,S/ 34.90,metro,POLLO EVISCERADO,2024-12-04 21:03:17.398980,1.0,un,34.9,metro,,,POLLO EVISCERADO
Pollo Enrollado Cordon Bleu Redondos x un,S/ 35.40,wong,POLLO EVISCERADO,2024-12-04 18:48:25.850057,1.0,un,35.4,wong,,,POLLO EVISCERADO
Pollo Enrollado con Champiñones Redondos x un,S/ 35.40,wong,POLLO EVISCERADO,2024-12-04 18:48:25.850057,1.0,un,35.4,wong,,,POLLO EVISCERADO
Combo Pollo Rostizado + Papas Fritas + Chicha NATURALE 1L,S/ 35.80,vivanda,POLLO EVISCERADO,2024-12-04 17:26:31.945603,1.0,l,35.8,vivanda,,VIVANDA,POLLO EVISCERADO
ADULT SABOR POLLO CARNE ATUN SARDINA 3KG,S/ 35.90,tottus,POLLO EVISCERADO,2024-12-04 13:10:52.795575,3.0,kg,35.9,tottus,,SUPERCAT,POLLO EVISCERADO
Metro Pollo Entero + Porción de Papas x 400 g Delivery,S/ 35.99,metro,POLLO EVISCERADO,2024-12-04 21:03:17.398980,400.0,g,35.99,metro,,,POLLO EVISCERADO
Pollo Rostizado + Papas Fritas + Chicha Morada Naturale 1L,S/ 36.90,wong,POLLO EVISCERADO,2024-12-04 18:48:25.850057,1.0,l,36.9,wong,,,POLLO EVISCERADO
Filete de Pechuga de Pollo ARTISAN Libre de An...,S/ 37.90 x kg,plaza_vea,POLLO EVISCERADO,2024-12-04 13:21:01.580362,0.7,kg,37.9,plaza_vea,Presentación 0.7 kg aprox.,,POLLO EVISCERADO
Pollo Rostizado + Papas Fritas + Gaseosa Inca Kola Sin Azúcar 1.5L,S/ 37.90,wong,POLLO EVISCERADO,2024-12-04 18:48:25.850057,1.5,l,37.9,wong,,,POLLO EVISCERADO
Suprema de Pollo Artisan 550g,S/ 39.50,wong,POLLO EVISCERADO,2024-12-04 18:48:25.850057,550.0,g,39.5,wong,,,POLLO EVISCERADO
Pollo Rostizado + 1/4 Pollo Rostizado + Papas Fritas + Gaseosa Inca Kola Sin Azúcar 1.5L,S/ 39.99,metro,POLLO EVISCERADO,2024-12-04 21:03:17.398980,1.5,l,39.99,metro,,,POLLO EVISCERADO
Filete de Pierna de Pollo con Piel Avinka Artisan x kg,S/ 40.75 x kg,wong,POLLO EVISCERADO,2024-12-04 18:48:25.850057,1.0,kg,40.75,wong,,,POLLO EVISCERADO
Papel Higiénico HIGIENOL Mega Rollo Doble Hoja...,S/ 40.90 un,plaza_vea,POLLO EVISCERADO,2024-12-04 13:21:01.580362,24.0,un,40.9,plaza_vea,Paquete 24un,,POLLO EVISCERADO
Pollo Enrollado con Jamon y Queso x kg,S/ 41.50 x kg,metro,POLLO EVISCERADO,2024-12-04 21:03:17.398980,1.0,kg,41.5,metro,,,POLLO EVISCERADO
"Pollo Enrollado con Jamón, Tocino y Guindones x kg",S/ 41.50 x kg,metro,POLLO EVISCERADO,2024-12-04 21:03:17.398980,1.0,kg,41.5,metro,,,POLLO EVISCERADO
Pollo Enrollado Jamon y Queso Sin Piel x kg,S/ 41.50 x kg,wong,POLLO EVISCERADO,2024-12-04 18:48:25.850057,1.0,kg,41.5,wong,,,POLLO EVISCERADO
"Pollo Enrollado con Jamón, Tocino y Guindones x kg",S/ 41.50 x kg,wong,POLLO EVISCERADO,2024-12-04 18:48:25.850057,1.0,kg,41.5,wong,,,POLLO EVISCERADO
Pollo Enrollado con Jamon y Queso x kg,S/ 41.50 x kg,wong,POLLO EVISCERADO,2024-12-04 18:48:25.850057,1.0,kg,41.5,wong,,,POLLO EVISCERADO
Pollo Enrollado De La Casa Surtido x kg,S/ 41.99 x kg,wong,POLLO EVISCERADO,2024-12-04 18:48:25.850057,1.0,kg,41.99,wong,,,POLLO EVISCERADO
Pollo Rostizado + Ensalada + Gaseosa1.5L,S/ 42.50,wong,POLLO EVISCERADO,2024-12-04 18:48:25.850057,1.5,l,42.5,wong,,,POLLO EVISCERADO
Pollo Rostizado + Ensalada + Chicha Morada 1L,S/ 42.50,wong,POLLO EVISCERADO,2024-12-04 18:48:25.850057,1.0,l,42.5,wong,,,POLLO EVISCERADO
Metro Pollo Entero + Porción de Papas x 400 g + Gaseosa 1.5 Litro,S/ 42.99,metro,POLLO EVISCERADO,2024-12-04 21:03:17.398980,400.0,g,42.99,metro,,,POLLO EVISCERADO
Metro Pollo Entero + Porción de Papas x 400 g + Chicha Morada Naturale 1 Litro,S/ 42.99,metro,POLLO EVISCERADO,2024-12-04 21:03:17.398980,400.0,g,42.99,metro,,,POLLO EVISCERADO
Detergente en Polvo MARSELLA Lavanda y Rosas B...,S/ 44.50 un,plaza_vea,POLLO EVISCERADO,2024-12-04 13:21:01.580362,4.0,kg,44.5,plaza_vea,Bolsa 4Kg,,POLLO EVISCERADO
Detergente en Polvo ACE Regular Bolsa 4Kg,S/ 44.90 un,plaza_vea,POLLO EVISCERADO,2024-12-04 13:21:01.580362,4.0,kg,44.9,plaza_vea,Bolsa 4Kg,,POLLO EVISCERADO
Detergente en Polvo ACE Limón Bolsa 4Kg,S/ 44.90 un,plaza_vea,POLLO EVISCERADO,2024-12-04 13:21:01.580362,4.0,kg,44.9,plaza_vea,Bolsa 4Kg,,POLLO EVISCERADO
Pollo Rostizado + Papas Fritas + Ensalada + Gaseosa Inca Kola Sin Azúcar 1.5L,S/ 44.99,metro,POLLO EVISCERADO,2024-12-04 21:03:17.398980,1.5,l,44.99,metro,,,POLLO EVISCERADO
Sopa Instantánea AJINOMEN Sabor a Pollo Bolsa 80g x 24u,S/ 45.60,vega,POLLO EVISCERADO,2024-12-04 13:25:27.785871,80.0,g,45.6,vega,,Ajinomen,POLLO EVISCERADO
Pollo Rostizado + Papas Fritas + Ensalada + Chicha Morada Naturale 1L,S/ 45.99,metro,POLLO EVISCERADO,2024-12-04 21:03:17.398980,1.0,l,45.99,metro,,,POLLO EVISCERADO
Filete de Pechuga Artisan x Kg. Libre de Antibióticos,S/ 46.60 x kg,metro,POLLO EVISCERADO,2024-12-04 21:03:17.398980,1.0,kg,46.6,metro,,,POLLO EVISCERADO
Filete de Pechuga Artisan x Kg. Libre de Antibióticos,S/ 46.60 x kg,wong,POLLO EVISCERADO,2024-12-04 18:48:25.850057,1.0,kg,46.6,wong,,,POLLO EVISCERADO
Tiras de Pollo Artisan x kg,S/ 46.90 x kg,wong,POLLO EVISCERADO,2024-12-04 18:48:25.850057,1.0,kg,46.9,wong,,,POLLO EVISCERADO
Filete de Pejerrey Artisan x Kg. Libre de Antibióticos,S/ 47.79 x kg,wong,POLLO EVISCERADO,2024-12-04 18:48:25.850057,1.0,kg,47.79,wong,,,POLLO EVISCERADO
Pollo Rostizado + Papas Fritas + Ensalada + Gaseosa 1.5L,S/ 47.99,wong,POLLO EVISCERADO,2024-12-04 18:48:25.850057,1.5,l,47.99,wong,,,POLLO EVISCERADO
APANADO DE POLLO 2.1 KG,S/ 49.90,tottus,POLLO EVISCERADO,2024-12-04 13:10:52.795575,2.1,kg,49.9,tottus,,REDONDOS,POLLO EVISCERADO
Pollo Rostizado + Papas Fritas + Ensalada + Chicha Morada 1L,S/ 50.50,wong,POLLO EVISCERADO,2024-12-04 18:48:25.850057,1.0,l,50.5,wong,,,POLLO EVISCERADO
Detergente en Polvo BOLIVAR Cuidado Total Flor...,S/ 52.60 un,plaza_vea,POLLO EVISCERADO,2024-12-04 13:21:01.580362,4.0,kg,52.6,plaza_vea,Bolsa 4Kg,,POLLO EVISCERADO
Metro Pollo Entero + Porción de Papas x 400 g + Gaseosa 1.5 Litro + Ensalada,S/ 52.99,metro,POLLO EVISCERADO,2024-12-04 21:03:17.398980,400.0,g,52.99,metro,,,POLLO EVISCERADO
Metro Pollo Entero + Porción de Papas x 400 g + Chicha Morada Naturale 1 Litro + Ensalada,S/ 52.99,metro,POLLO EVISCERADO,2024-12-04 21:03:17.398980,400.0,g,52.99,metro,,,POLLO EVISCERADO
Detergente en Polvo ARIEL Perlas Limpiadoras B...,S/ 54.90 un,plaza_vea,POLLO EVISCERADO,2024-12-04 13:21:01.580362,4.0,kg,54.9,plaza_vea,Bolsa 4Kg,,POLLO EVISCERADO
Detergente en Polvo ARIEL Revitacolor para Rop...,S/ 54.90 un,plaza_vea,POLLO EVISCERADO,2024-12-04 13:21:01.580362,4.0,kg,54.9,plaza_vea,Bolsa 4Kg,,POLLO EVISCERADO
