description,price,website,search_term,scrape_timestamp,cantidad,unidad,price_numeric,WEB,unit,brand,CLASIFICACION
Cereal BELL'S Corn Flakes Bolsa 20g,S/ 0.59,vivanda,POP CORN (BOCADITOS),2024-12-04 18:15:54.619597,20.0,g,0.59,vivanda,,BELL'S,POP CORN (BOCADITOS)
Agua Mineral SAN MATEO Con Gas Botella 600ml,S/ 1.80 un,plaza_vea,POP CORN (BOCADITOS),2024-12-04 14:39:06.213842,600.0,ml,1.8,plaza_vea,Botella 600ml,,POP CORN (BOCADITOS)
Yogurt Griego LAIVE con Trozos de Blueberry Va...,S/ 2.20 un,plaza_vea,POP CORN (BOCADITOS),2024-12-04 14:39:06.213842,120.0,g,2.2,plaza_vea,Vaso 120g,,POP CORN (BOCADITOS)
Caramelos Ring Pop TOPPS Surtidos Unidad 14g,S/ 2.40,vivanda,POP CORN (BOCADITOS),2024-12-04 18:15:54.619597,14.0,g,2.4,vivanda,,TOPPS,POP CORN (BOCADITOS)
Maíz Gigante Original Inka Corn 42g,S/ 2.80,wong,POP CORN (BOCADITOS),2024-12-04 20:46:19.323253,42.0,g,2.8,wong,,,POP CORN (BOCADITOS)
Agua Mineral SAN LUIS Con Gas Botella 2.5L,S/ 3 un,plaza_vea,POP CORN (BOCADITOS),2024-12-04 14:39:06.213842,2.5,l,3.0,plaza_vea,Botella 2.5L,,POP CORN (BOCADITOS)
Yogurt Battimix GLORIA Fresa con Bolitas de Ch...,S/ 3.10 un,plaza_vea,POP CORN (BOCADITOS),2024-12-04 14:39:06.213842,146.0,g,3.1,plaza_vea,Vaso 146g,,POP CORN (BOCADITOS)
Yogur Battimix GLORIA Vainilla con Hojuelas Va...,S/ 3.10 un,plaza_vea,POP CORN (BOCADITOS),2024-12-04 14:39:06.213842,144.0,g,3.1,plaza_vea,Vaso 144g,,POP CORN (BOCADITOS)
Pop Corn TIMONEL Bolsa 400g,S/ 3.10,vega,POP CORN (BOCADITOS),2024-12-04 14:42:44.525172,400.0,g,3.1,vega,,Timonel,POP CORN (BOCADITOS)
Caramelo Spring Pop Minions 14g Surtido,S/ 3.30,metro,POP CORN (BOCADITOS),2024-12-04 22:19:52.906004,14.0,g,3.3,metro,,,POP CORN (BOCADITOS)
Caramelo Spring Pop Minions 14g Surtido,S/ 3.30,wong,POP CORN (BOCADITOS),2024-12-04 20:46:19.323253,14.0,g,3.3,wong,,,POP CORN (BOCADITOS)
Maíz Pop Corn Cuisine & Co 500g,S/ 3.50,metro,POP CORN (BOCADITOS),2024-12-04 22:19:52.906004,500.0,g,3.5,metro,,,POP CORN (BOCADITOS)
Cereal de Trigo con Miel VITA PLUSS Bolsa 140g,S/ 3.60 un,plaza_vea,POP CORN (BOCADITOS),2024-12-04 14:39:06.213842,140.0,g,3.6,plaza_vea,Bolsa 140g,,POP CORN (BOCADITOS)
Pop Corn PLANET POP Mantequilla Bolsa 85g,S/ 3.70,vivanda,POP CORN (BOCADITOS),2024-12-04 18:15:54.619597,85.0,g,3.7,vivanda,,PLANET POP,POP CORN (BOCADITOS)
Maíz Pop Corn Bolsa 350 g,S/ 3.80,metro,POP CORN (BOCADITOS),2024-12-04 22:19:52.906004,350.0,g,3.8,metro,,,POP CORN (BOCADITOS)
Artesco Banderitas Adhesivas Rectangulares Pop Up Sticky Notes Blíster 150 und,S/ 4.00,wong,POP CORN (BOCADITOS),2024-12-04 20:46:19.323253,150.0,un,4.0,wong,,,POP CORN (BOCADITOS)
Artesco Banderitas Adhesivas Rectangulares Pop Up Sticky Notes Blíster 150 und,S/ 4.00,metro,POP CORN (BOCADITOS),2024-12-04 22:19:52.906004,150.0,un,4.0,metro,,,POP CORN (BOCADITOS)
Maíz Pop Corn Costeño 500g,S/ 4.00,wong,POP CORN (BOCADITOS),2024-12-04 20:46:19.323253,500.0,g,4.0,wong,,,POP CORN (BOCADITOS)
Maíz Pop Corn Costeño 500g,S/ 4.00,metro,POP CORN (BOCADITOS),2024-12-04 22:19:52.906004,500.0,g,4.0,metro,,,POP CORN (BOCADITOS)
Galletas Choco Donuts COSTA Sabor a Chocolate ...,S/ 4.19 un,plaza_vea,POP CORN (BOCADITOS),2024-12-04 14:39:06.213842,6.0,un,4.19,plaza_vea,Paquete 6un,,POP CORN (BOCADITOS)
Wafer Cuadrado NIK Relleno con Crema Sabor a V...,S/ 4.20 un,plaza_vea,POP CORN (BOCADITOS),2024-12-04 14:39:06.213842,6.0,un,4.2,plaza_vea,Paquete 6un,,POP CORN (BOCADITOS)
Trigo Atómico Original FORTE GOLPE con Miel Bo...,S/ 4.20 un,plaza_vea,POP CORN (BOCADITOS),2024-12-04 14:39:06.213842,125.0,g,4.2,plaza_vea,Bolsa 125g,,POP CORN (BOCADITOS)
Wafer Cuadrado NIK Relleno con Crema Sabor a F...,S/ 4.20 un,plaza_vea,POP CORN (BOCADITOS),2024-12-04 14:39:06.213842,6.0,un,4.2,plaza_vea,Paquete 6un,,POP CORN (BOCADITOS)
Galletas COSTA con Chips de Chocolate Bolsa 34...,S/ 4.20 un,plaza_vea,POP CORN (BOCADITOS),2024-12-04 14:39:06.213842,6.0,un,4.2,plaza_vea,Paquete 6un,,POP CORN (BOCADITOS)
Maíz Pop Corn TESORO VERDE Bolsa 500g,S/ 4.20,vivanda,POP CORN (BOCADITOS),2024-12-04 18:15:54.619597,500.0,g,4.2,vivanda,,TESORO VERDE,POP CORN (BOCADITOS)
Maíz Canchita Pop Corn TESORO VERDE Plaza Vea ...,S/ 4.20 un,plaza_vea,POP CORN (BOCADITOS),2024-12-04 14:39:06.213842,500.0,g,4.2,plaza_vea,Bolsa 500g,,POP CORN (BOCADITOS)
Maíz Pop Corn BELL'S Bolsa 500g,S/ 4.30,vivanda,POP CORN (BOCADITOS),2024-12-04 18:15:54.619597,500.0,g,4.3,vivanda,,BELL'S,POP CORN (BOCADITOS)
Galletas CASINO Rellenas con Crema Sabor a Fre...,S/ 4.50 un,plaza_vea,POP CORN (BOCADITOS),2024-12-04 14:39:06.213842,6.0,un,4.5,plaza_vea,Paquete 6un,,POP CORN (BOCADITOS)
Galletas CASINO Rellenas con Crema Sabor a Men...,S/ 4.50 un,plaza_vea,POP CORN (BOCADITOS),2024-12-04 14:39:06.213842,6.0,un,4.5,plaza_vea,Paquete 6un,,POP CORN (BOCADITOS)
Galletas CASINO Rellenas con Crema Sabor a Cho...,S/ 4.50 un,plaza_vea,POP CORN (BOCADITOS),2024-12-04 14:39:06.213842,6.0,un,4.5,plaza_vea,Paquete 6un,,POP CORN (BOCADITOS)
Bizcocho Relleno con Manjar CHOCMAN Paquete 6u...,S/ 4.50 un,plaza_vea,POP CORN (BOCADITOS),2024-12-04 14:39:06.213842,6.0,un,4.5,plaza_vea,Paquete 6un,,POP CORN (BOCADITOS)
Maíz Pop Corn COSTEÑO Bolsa 500g,S/ 4.60,vivanda,POP CORN (BOCADITOS),2024-12-04 18:15:54.619597,500.0,g,4.6,vivanda,,COSTENO,POP CORN (BOCADITOS)
Pop Corn Natural Act II Bolsa 80 g,S/ 4.60,metro,POP CORN (BOCADITOS),2024-12-04 22:19:52.906004,80.0,g,4.6,metro,,,POP CORN (BOCADITOS)
Pop Corn ACT II con Extra Mantequilla Sobre 85g,S/ 4.60,vega,POP CORN (BOCADITOS),2024-12-04 14:42:44.525172,85.0,g,4.6,vega,,Act II,POP CORN (BOCADITOS)
Pop Corn ACT II con Mantequilla Sobre 80g,S/ 4.60,vega,POP CORN (BOCADITOS),2024-12-04 14:42:44.525172,80.0,g,4.6,vega,,Act II,POP CORN (BOCADITOS)
Pop Corn para Microondas Act II Sabor Mantequilla 91g,S/ 4.60,metro,POP CORN (BOCADITOS),2024-12-04 22:19:52.906004,91.0,g,4.6,metro,,,POP CORN (BOCADITOS)
Pop Corn Butter Extra Act II 91g,S/ 4.60,metro,POP CORN (BOCADITOS),2024-12-04 22:19:52.906004,91.0,g,4.6,metro,,,POP CORN (BOCADITOS)
Maiz Pop Corn 500 g,S/ 4.64,tottus,POP CORN (BOCADITOS),2024-12-04 13:57:45.205345,500.0,g,4.64,tottus,,TOTTUS,POP CORN (BOCADITOS)
Galletas Sandwich de Chocolate RELLENITAS con ...,S/ 4.69 un,plaza_vea,POP CORN (BOCADITOS),2024-12-04 14:39:06.213842,8.0,un,4.69,plaza_vea,Paquete 8un,,POP CORN (BOCADITOS)
Caramelo PUSH POP Surtido Barra 15g,S/ 4.70,vivanda,POP CORN (BOCADITOS),2024-12-04 18:15:54.619597,15.0,g,4.7,vivanda,,TOPS,POP CORN (BOCADITOS)
Maíz Pop Corn Cuisine & Co 500g,S/ 4.70,wong,POP CORN (BOCADITOS),2024-12-04 20:46:19.323253,500.0,g,4.7,wong,,,POP CORN (BOCADITOS)
Galletas GLACITAS Bañadas con Sabor a Toffee B...,S/ 4.79 un,plaza_vea,POP CORN (BOCADITOS),2024-12-04 14:39:06.213842,6.0,un,4.79,plaza_vea,Paquete 6un,,POP CORN (BOCADITOS)
Galletas GLACITAS Bañadas con Sabor a Fresa Bo...,S/ 4.79 un,plaza_vea,POP CORN (BOCADITOS),2024-12-04 14:39:06.213842,6.0,un,4.79,plaza_vea,Paquete 6un,,POP CORN (BOCADITOS)
Caramelo Push Pop Sabor Frutos del Bosque 14g,S/ 4.80,wong,POP CORN (BOCADITOS),2024-12-04 20:46:19.323253,14.0,g,4.8,wong,,,POP CORN (BOCADITOS)
Galletas CHOCO ¡BUM! Bañadas con Sabor a Choco...,S/ 4.80 un,plaza_vea,POP CORN (BOCADITOS),2024-12-04 14:39:06.213842,6.0,un,4.8,plaza_vea,Paquete 6un,,POP CORN (BOCADITOS)
Caramelo Push Pop Sabor Frutos del Bosque 14g,S/ 4.80,metro,POP CORN (BOCADITOS),2024-12-04 22:19:52.906004,14.0,g,4.8,metro,,,POP CORN (BOCADITOS)
Maíz Gigante Inka Corn Original 100g,S/ 4.90,wong,POP CORN (BOCADITOS),2024-12-04 20:46:19.323253,100.0,g,4.9,wong,,,POP CORN (BOCADITOS)
Maíz Pop Corn COSTEÑO Bolsa 500g,S/ 4.90,vega,POP CORN (BOCADITOS),2024-12-04 14:42:44.525172,500.0,g,4.9,vega,,Costeño,POP CORN (BOCADITOS)
Pop Corn Natural Act II Bolsa 80 g,S/ 4.90,wong,POP CORN (BOCADITOS),2024-12-04 20:46:19.323253,80.0,g,4.9,wong,,,POP CORN (BOCADITOS)
Pop Corn para Microondas Act II Sabor Mantequilla 91g,S/ 4.90,wong,POP CORN (BOCADITOS),2024-12-04 20:46:19.323253,91.0,g,4.9,wong,,,POP CORN (BOCADITOS)
Pop Corn Butter Extra Act II 91g,S/ 4.90,wong,POP CORN (BOCADITOS),2024-12-04 20:46:19.323253,91.0,g,4.9,wong,,,POP CORN (BOCADITOS)
Artesco Banderitas Adhesivas Sign Here Pop Up Sticky Notes Neón Blíster 60 und,S/ 4.90,wong,POP CORN (BOCADITOS),2024-12-04 20:46:19.323253,60.0,un,4.9,wong,,,POP CORN (BOCADITOS)
Maíz Pop Corn TESORO DEL CAMPO Bolsa 500g,S/ 4.99 un,plaza_vea,POP CORN (BOCADITOS),2024-12-04 14:39:06.213842,500.0,g,4.99,plaza_vea,Bolsa 500g,,POP CORN (BOCADITOS)
Maíz Pop Corn 500 g,S/ 5,tottus,POP CORN (BOCADITOS),2024-12-04 13:57:45.205345,500.0,g,5.0,tottus,,TESORO DEL CAMPO,POP CORN (BOCADITOS)
Popcorn con mantequilla extra Act Li 80 g,S/ 5,tottus,POP CORN (BOCADITOS),2024-12-04 13:57:45.205345,80.0,g,5.0,tottus,,ACT II,POP CORN (BOCADITOS)
Maíz Pop Corn Tesoro Del Campo Bolsa 500 g,S/ 5.00,wong,POP CORN (BOCADITOS),2024-12-04 20:46:19.323253,500.0,g,5.0,wong,,,POP CORN (BOCADITOS)
Piqueos TORTEES con Sal Bolsa 138g,S/ 5 un,plaza_vea,POP CORN (BOCADITOS),2024-12-04 14:39:06.213842,138.0,g,5.0,plaza_vea,Bolsa 138g,,POP CORN (BOCADITOS)
Pop Corn con Mantequilla Act Li 80 g,S/ 5,tottus,POP CORN (BOCADITOS),2024-12-04 13:57:45.205345,80.0,g,5.0,tottus,,ACT II,POP CORN (BOCADITOS)
Galletas MARQUESITAS con sabor a Coco Paquete ...,S/ 5.20 un,plaza_vea,POP CORN (BOCADITOS),2024-12-04 14:39:06.213842,6.0,un,5.2,plaza_vea,Paquete 6un,,POP CORN (BOCADITOS)
Maíz Pop Corn VALLENORTE Bolsa 500gr,S/ 5.30,vega,POP CORN (BOCADITOS),2024-12-04 14:42:44.525172,500.0,g,5.3,vega,,VALLENORTE,POP CORN (BOCADITOS)
Stick'n Banderitas Adhesivas Pop Up Lite Pack 20 unid Surtido,S/ 5.60,metro,POP CORN (BOCADITOS),2024-12-04 22:19:52.906004,20.0,un,5.6,metro,,,POP CORN (BOCADITOS)
Avena con Cereales Andinos Premium 3 OSITOS Bo...,S/ 5.60 un,plaza_vea,POP CORN (BOCADITOS),2024-12-04 14:39:06.213842,270.0,g,5.6,plaza_vea,Bolsa 270g,,POP CORN (BOCADITOS)
Avena SANTA CATALINA con Quinua Bolsa 280g,S/ 5.60 un,plaza_vea,POP CORN (BOCADITOS),2024-12-04 14:39:06.213842,280.0,g,5.6,plaza_vea,Bolsa 280g,,POP CORN (BOCADITOS)
Stick'n Banderitas Adhesivas Pop Up Lite Pack 20 unid Surtido,S/ 5.60,wong,POP CORN (BOCADITOS),2024-12-04 20:46:19.323253,20.0,un,5.6,wong,,,POP CORN (BOCADITOS)
Ensal Pina Sand Pap BELL'S FRESCOS Bandeja 300g,S/ 5.69,vivanda,POP CORN (BOCADITOS),2024-12-04 18:15:54.619597,300.0,g,5.69,vivanda,,BELL'S FRESCOS,POP CORN (BOCADITOS)
Maíz Pop Corn Valle Norte Bolsa 500 g,S/ 5.80,metro,POP CORN (BOCADITOS),2024-12-04 22:19:52.906004,500.0,g,5.8,metro,,,POP CORN (BOCADITOS)
Comida para Perros RICOCAN Adultos Paté con Co...,S/ 5.90 un,plaza_vea,POP CORN (BOCADITOS),2024-12-04 14:39:06.213842,330.0,g,5.9,plaza_vea,Lata 330g,,POP CORN (BOCADITOS)
Aderezo BELL'S Con ají panca molido y especias...,S/ 5.90 un,plaza_vea,POP CORN (BOCADITOS),2024-12-04 14:39:06.213842,250.0,g,5.9,plaza_vea,Frasco 250g,,POP CORN (BOCADITOS)
Filete de Atún con Agua y Sal PRIMOR Lata 140g,S/ 5.90 un,plaza_vea,POP CORN (BOCADITOS),2024-12-04 14:39:06.213842,140.0,g,5.9,plaza_vea,Lata 140g,,POP CORN (BOCADITOS)
Maíz Gigante Inka Corn Original 100g,S/ 5.99,metro,POP CORN (BOCADITOS),2024-12-04 22:19:52.906004,100.0,g,5.99,metro,,,POP CORN (BOCADITOS)
Maíz Gigante Inka Corn Chile Picante 100g,S/ 6.20,wong,POP CORN (BOCADITOS),2024-12-04 20:46:19.323253,100.0,g,6.2,wong,,,POP CORN (BOCADITOS)
Cereal KELLOGG'S Corn Flakes Bolsa 110g,S/ 6.40,vivanda,POP CORN (BOCADITOS),2024-12-04 18:15:54.619597,110.0,g,6.4,vivanda,,KELLOGG S,POP CORN (BOCADITOS)
Maíz Pop Corn VALLENORTE Bolsa 500g,S/ 6.40,vivanda,POP CORN (BOCADITOS),2024-12-04 18:15:54.619597,500.0,g,6.4,vivanda,,VALLENORTE,POP CORN (BOCADITOS)
Maíz Pop Corn Valle Norte Bolsa 500 g,S/ 6.40,wong,POP CORN (BOCADITOS),2024-12-04 20:46:19.323253,500.0,g,6.4,wong,,,POP CORN (BOCADITOS)
Paté COREN sabor Roquefort Frasco 160g,S/ 6.50,vivanda,POP CORN (BOCADITOS),2024-12-04 18:15:54.619597,160.0,g,6.5,vivanda,,COREN,POP CORN (BOCADITOS)
Chupetin Mister Pops Pintalengua Sabor Uva 432g,S/ 6.50,metro,POP CORN (BOCADITOS),2024-12-04 22:19:52.906004,432.0,g,6.5,metro,,,POP CORN (BOCADITOS)
Paté COREN al Oporto Frasco 160g,S/ 6.50,vivanda,POP CORN (BOCADITOS),2024-12-04 18:15:54.619597,160.0,g,6.5,vivanda,,COREN,POP CORN (BOCADITOS)
Champiñones en Conserva Pou Yen 184g,S/ 6.50,wong,POP CORN (BOCADITOS),2024-12-04 20:46:19.323253,184.0,g,6.5,wong,,,POP CORN (BOCADITOS)
Chupetin Mister Pops Extreme Duo Ácido Dulce 432g,S/ 6.50,metro,POP CORN (BOCADITOS),2024-12-04 22:19:52.906004,432.0,g,6.5,metro,,,POP CORN (BOCADITOS)
Champiñones en Conserva Pou Yen 184g,S/ 6.80,metro,POP CORN (BOCADITOS),2024-12-04 22:19:52.906004,184.0,g,6.8,metro,,,POP CORN (BOCADITOS)
Chupete Mini Mr Pops Pintalengua 200g,S/ 6.80,metro,POP CORN (BOCADITOS),2024-12-04 22:19:52.906004,200.0,g,6.8,metro,,,POP CORN (BOCADITOS)
Caja Olego Pop Corn Premium Rojo 10un,S/ 6.90,metro,POP CORN (BOCADITOS),2024-12-04 22:19:52.906004,10.0,un,6.9,metro,,,POP CORN (BOCADITOS)
Hojuelas de Maíz Corn Flakes Cuisine & Co 200g,S/ 6.90,metro,POP CORN (BOCADITOS),2024-12-04 22:19:52.906004,200.0,g,6.9,metro,,,POP CORN (BOCADITOS)
Caja Olego Pop Corn Premium Azul 10un,S/ 6.90,metro,POP CORN (BOCADITOS),2024-12-04 22:19:52.906004,10.0,un,6.9,metro,,,POP CORN (BOCADITOS)
Mantequilla LAIVE con Sal Barra 100g,S/ 6.90 un,plaza_vea,POP CORN (BOCADITOS),2024-12-04 14:39:06.213842,100.0,g,6.9,plaza_vea,Barra 100g,,POP CORN (BOCADITOS)
Chocolate Chin Chin Pop Barra 90g,S/ 6.99,metro,POP CORN (BOCADITOS),2024-12-04 22:19:52.906004,90.0,g,6.99,metro,,,POP CORN (BOCADITOS)
Chocolate Chin Chin Pop Barra 90g,S/ 6.99,wong,POP CORN (BOCADITOS),2024-12-04 20:46:19.323253,90.0,g,6.99,wong,,,POP CORN (BOCADITOS)
Cereal Quinua Pop INCASUR Caja 80g,S/ 7.20,vivanda,POP CORN (BOCADITOS),2024-12-04 18:15:54.619597,80.0,g,7.2,vivanda,,INCASUR,POP CORN (BOCADITOS)
Cereal INCASUR Kiwicha Pop Bolsa 80g,S/ 7.20,vivanda,POP CORN (BOCADITOS),2024-12-04 18:15:54.619597,80.0,g,7.2,vivanda,,INCASUR,POP CORN (BOCADITOS)
Pan Árabe Integral EL CEDRO con Salvado de Tri...,S/ 7.20 un,plaza_vea,POP CORN (BOCADITOS),2024-12-04 14:39:06.213842,10.0,un,7.2,plaza_vea,Paquete 10un,,POP CORN (BOCADITOS)
Maíz Pop Corn de 1 kg,S/ 7.42,tottus,POP CORN (BOCADITOS),2024-12-04 13:57:45.205345,1.0,kg,7.42,tottus,,TOTTUS,POP CORN (BOCADITOS)
Galletas INTEGRACKERS Con salvado sabor a miel...,S/ 7.50 un,plaza_vea,POP CORN (BOCADITOS),2024-12-04 14:39:06.213842,9.0,un,7.5,plaza_vea,Paquete 9un,,POP CORN (BOCADITOS)
Chupete GLOBO POP Neon Bolsa 24un 18g,S/ 7.50,vega,POP CORN (BOCADITOS),2024-12-04 14:42:44.525172,24.0,un,7.5,vega,,Globo Pop,POP CORN (BOCADITOS)
Chupete Globo Pop Shake 24un.,S/ 7.80,metro,POP CORN (BOCADITOS),2024-12-04 22:19:52.906004,24.0,un,7.8,metro,,,POP CORN (BOCADITOS)
Chupete GLOBO POP con Chicle Sabor a Fresa Bolsa 24un,S/ 7.80,vega,POP CORN (BOCADITOS),2024-12-04 14:42:44.525172,24.0,un,7.8,vega,,Globo Pop,POP CORN (BOCADITOS)
Chupete GLOBO POP con Chicle Surtido Bolsa 24un,S/ 7.80,vega,POP CORN (BOCADITOS),2024-12-04 14:42:44.525172,24.0,un,7.8,vega,,Globo Pop,POP CORN (BOCADITOS)
Papa Canchan Prefrita con Cascara Congelada BE...,S/ 7.90 un,plaza_vea,POP CORN (BOCADITOS),2024-12-04 14:39:06.213842,500.0,g,7.9,plaza_vea,Bolsa 500g,,POP CORN (BOCADITOS)
Hojuelas de Maíz Corn Flakes Cuisine & Co 200g,S/ 7.90,wong,POP CORN (BOCADITOS),2024-12-04 20:46:19.323253,200.0,g,7.9,wong,,,POP CORN (BOCADITOS)
Chupete Globo Pop Maracuyá 25un,S/ 8.00,metro,POP CORN (BOCADITOS),2024-12-04 22:19:52.906004,25.0,un,8.0,metro,,,POP CORN (BOCADITOS)
Chupetes Globo Pop Cereza Acida Bolsa 24 Unidades,S/ 8.00,metro,POP CORN (BOCADITOS),2024-12-04 22:19:52.906004,24.0,un,8.0,metro,,,POP CORN (BOCADITOS)
Chupetes GLOBO POP!! Con chicle sabores surtidos Bolsa 480Gr,S/ 8.00,vivanda,POP CORN (BOCADITOS),2024-12-04 18:15:54.619597,480.0,g,8.0,vivanda,,GLOBO POP,POP CORN (BOCADITOS)
Chupete Globo Pop Fresa Bolsa 24 Undiades,S/ 8.00,metro,POP CORN (BOCADITOS),2024-12-04 22:19:52.906004,24.0,un,8.0,metro,,,POP CORN (BOCADITOS)
Chupete Globo Pop Yogurt Surtido Bolsa 24 Unidades,S/ 8.00,metro,POP CORN (BOCADITOS),2024-12-04 22:19:52.906004,24.0,un,8.0,metro,,,POP CORN (BOCADITOS)
Chupete Globo Pop Surtido 24un,S/ 8.00,metro,POP CORN (BOCADITOS),2024-12-04 22:19:52.906004,24.0,un,8.0,metro,,,POP CORN (BOCADITOS)
Chupetes GLOBO POP NEON!! Con chicle sabor limonada Bolsa 480Gr,S/ 8.00,vivanda,POP CORN (BOCADITOS),2024-12-04 18:15:54.619597,480.0,g,8.0,vivanda,,GLOBO POP,POP CORN (BOCADITOS)
Chupetes GLOBO POP!! Relleno con chicle sabor fresa Bolsa 480Gr,S/ 8.00,vivanda,POP CORN (BOCADITOS),2024-12-04 18:15:54.619597,480.0,g,8.0,vivanda,,GLOBO POP,POP CORN (BOCADITOS)
Chupete Globo Pop Leche y Chocolate Bolsa 24 Unidades,S/ 8.00,metro,POP CORN (BOCADITOS),2024-12-04 22:19:52.906004,24.0,un,8.0,metro,,,POP CORN (BOCADITOS)
Chupete Globo Pop Neon Renovado Bolsa 24 Unidades,S/ 8.00,metro,POP CORN (BOCADITOS),2024-12-04 22:19:52.906004,24.0,un,8.0,metro,,,POP CORN (BOCADITOS)
Chupetín Globo Pop Sabor Maracuyá 24un,S/ 8.00,metro,POP CORN (BOCADITOS),2024-12-04 22:19:52.906004,24.0,un,8.0,metro,,,POP CORN (BOCADITOS)
Agua Mineral SAN LUIS Con Gas Botella 625ml Pa...,S/ 8.20 un,plaza_vea,POP CORN (BOCADITOS),2024-12-04 14:39:06.213842,6.0,un,8.2,plaza_vea,Paquete 6un,,POP CORN (BOCADITOS)
Chupete Globo Pop Surtido 24un,S/ 8.20,wong,POP CORN (BOCADITOS),2024-12-04 20:46:19.323253,24.0,un,8.2,wong,,,POP CORN (BOCADITOS)
Chupete Globo Pop Maracuyá 25un,S/ 8.20,wong,POP CORN (BOCADITOS),2024-12-04 20:46:19.323253,25.0,un,8.2,wong,,,POP CORN (BOCADITOS)
Chupete Globo Pop Leche y Chocolate Bolsa 24 Unidades,S/ 8.20,wong,POP CORN (BOCADITOS),2024-12-04 20:46:19.323253,24.0,un,8.2,wong,,,POP CORN (BOCADITOS)
Chupetes Globo Pop Cereza Acida Bolsa 24 Unidades,S/ 8.20,wong,POP CORN (BOCADITOS),2024-12-04 20:46:19.323253,24.0,un,8.2,wong,,,POP CORN (BOCADITOS)
Chupete Globo Pop Shake 24un.,S/ 8.20,wong,POP CORN (BOCADITOS),2024-12-04 20:46:19.323253,24.0,un,8.2,wong,,,POP CORN (BOCADITOS)
Chupete Globo Pop Fresa Bolsa 24 Undiades,S/ 8.20,wong,POP CORN (BOCADITOS),2024-12-04 20:46:19.323253,24.0,un,8.2,wong,,,POP CORN (BOCADITOS)
Cereal Corn Flakes Caja 200 g,S/ 8.90,wong,POP CORN (BOCADITOS),2024-12-04 20:46:19.323253,200.0,g,8.9,wong,,,POP CORN (BOCADITOS)
Detergente en Polvo BOREAL con Suavizante Flor...,S/ 8.90 un,plaza_vea,POP CORN (BOCADITOS),2024-12-04 14:39:06.213842,900.0,g,8.9,plaza_vea,Bolsa 900g,,POP CORN (BOCADITOS)
Pack Jamonada con Pollo SUIZA Paquete 400g,S/ 8.90 un,plaza_vea,POP CORN (BOCADITOS),2024-12-04 14:39:06.213842,400.0,g,8.9,plaza_vea,Paquete 400g,,POP CORN (BOCADITOS)
Cereal BELL'S Corn Flakes Azucarados Bolsa 500g,S/ 9.40,vivanda,POP CORN (BOCADITOS),2024-12-04 18:15:54.619597,500.0,g,9.4,vivanda,,BELL'S,POP CORN (BOCADITOS)
Nuggets de Pollo con Quinua AVINKA Bolsa 15un,S/ 9.49 un,plaza_vea,POP CORN (BOCADITOS),2024-12-04 14:39:06.213842,270.0,g,9.49,plaza_vea,Bolsa 270g,,POP CORN (BOCADITOS)
Cachito con Mantequilla DON MAMINO Bolsa 6un,S/ 9.80 un,plaza_vea,POP CORN (BOCADITOS),2024-12-04 14:39:06.213842,6.0,un,9.8,plaza_vea,Bolsa 6un,,POP CORN (BOCADITOS)
Bocaditos Salvado con Orégano Fibralight 200 g,S/ 9.80,tottus,POP CORN (BOCADITOS),2024-12-04 13:57:45.205345,200.0,g,9.8,tottus,,FIBERLIGHT,POP CORN (BOCADITOS)
Enchufes para Computadora Pack 2 unid,S/ 9.89,metro,POP CORN (BOCADITOS),2024-12-04 22:19:52.906004,2.0,un,9.89,metro,,,POP CORN (BOCADITOS)
Chupete Mr Pops Halloween Cíclope 432g,S/ 9.90,wong,POP CORN (BOCADITOS),2024-12-04 20:46:19.323253,432.0,g,9.9,wong,,,POP CORN (BOCADITOS)
Chupetin Mister Pops Extreme Duo Halloween 432g,S/ 9.90,metro,POP CORN (BOCADITOS),2024-12-04 22:19:52.906004,432.0,g,9.9,metro,,,POP CORN (BOCADITOS)
Mantequilla con Sal GLORIA Paquete 180g,S/ 9.90 un,plaza_vea,POP CORN (BOCADITOS),2024-12-04 14:39:06.213842,180.0,g,9.9,plaza_vea,Paquete 180g,,POP CORN (BOCADITOS)
Galletas de Maíz SALMAS Horneadas con Camote y...,S/ 9.90 un,plaza_vea,POP CORN (BOCADITOS),2024-12-04 14:39:06.213842,126.0,g,9.9,plaza_vea,Caja 126g,,POP CORN (BOCADITOS)
Hojuelas de Maíz Corn Flakes Kellogg's 200g,S/ 10.00,metro,POP CORN (BOCADITOS),2024-12-04 22:19:52.906004,200.0,g,10.0,metro,,,POP CORN (BOCADITOS)
Hojuelas de Maíz Corn Flakes Kellogg's 200g,S/ 10.20,wong,POP CORN (BOCADITOS),2024-12-04 20:46:19.323253,200.0,g,10.2,wong,,,POP CORN (BOCADITOS)
Sazonador Pop Corn BELL'S Sabor a Mantequilla Frasco 80g,S/ 10.20,vivanda,POP CORN (BOCADITOS),2024-12-04 18:15:54.619597,80.0,g,10.2,vivanda,,BELL'S,POP CORN (BOCADITOS)
Sazonador Pop Corn BELL'S Sabor a Caramelo Frasco 65g,S/ 10.30,vivanda,POP CORN (BOCADITOS),2024-12-04 18:15:54.619597,65.0,g,10.3,vivanda,,BELL'S,POP CORN (BOCADITOS)
Canchita para Microondas PLANET POP sabor Natural Bolsa 85g Paquete 3un,S/ 10.50,vivanda,POP CORN (BOCADITOS),2024-12-04 18:15:54.619597,85.0,g,10.5,vivanda,,PLANET POP,POP CORN (BOCADITOS)
Maíz Pop Corn PLANET POP Mantequilla Paquete 3un,S/ 10.50,vivanda,POP CORN (BOCADITOS),2024-12-04 18:15:54.619597,3.0,un,10.5,vivanda,,PLANET POP,POP CORN (BOCADITOS)
Palomitas de Maíz PLANET POP Mantequilla Extrema Paquete 3un,S/ 10.50,vivanda,POP CORN (BOCADITOS),2024-12-04 18:15:54.619597,3.0,un,10.5,vivanda,,PLANET POP,POP CORN (BOCADITOS)
Mantequilla con Sal GLORIA Pote 180g,S/ 10.50 un,plaza_vea,POP CORN (BOCADITOS),2024-12-04 14:39:06.213842,180.0,g,10.5,plaza_vea,Pote 180g,,POP CORN (BOCADITOS)
Porciones de Bonito con Piel PESCANOVA Bolsa 5...,S/ 10.50 un,plaza_vea,POP CORN (BOCADITOS),2024-12-04 14:39:06.213842,500.0,g,10.5,plaza_vea,Bolsa 500g,,POP CORN (BOCADITOS)
Avena con Quinua 3 OSITOS Premium 900g,S/ 10.69 14%,vega,POP CORN (BOCADITOS),2024-12-04 14:42:44.525172,900.0,g,10.69,vega,,3 Ositos,POP CORN (BOCADITOS)
Pop Corn Butter Light Act II Pack 3 Unid,S/ 10.90,metro,POP CORN (BOCADITOS),2024-12-04 22:19:52.906004,3.0,un,10.9,metro,,,POP CORN (BOCADITOS)
Pop Corn Butter Act II Pack 3 Unid,S/ 10.90,metro,POP CORN (BOCADITOS),2024-12-04 22:19:52.906004,3.0,un,10.9,metro,,,POP CORN (BOCADITOS)
Pop Corn Butter Light Act II Pack 3 Unid,S/ 10.90,wong,POP CORN (BOCADITOS),2024-12-04 20:46:19.323253,3.0,un,10.9,wong,,,POP CORN (BOCADITOS)
Sazonador Pops COSTEÑO de Pop Corn Sabor Mantequilla Frasco 81g,S/ 10.90,vivanda,POP CORN (BOCADITOS),2024-12-04 18:15:54.619597,81.0,g,10.9,vivanda,,COSTEÑO,POP CORN (BOCADITOS)
Champiñones Pou Yen Lata 425 g,S/ 10.90,metro,POP CORN (BOCADITOS),2024-12-04 22:19:52.906004,425.0,g,10.9,metro,,,POP CORN (BOCADITOS)
Pollo Fresco con Menudencia Trozado en 8 Pieza...,S/ 10.90 x kg,plaza_vea,POP CORN (BOCADITOS),2024-12-04 14:39:06.213842,2.3,kg,10.9,plaza_vea,Presentación 2.3 kg aprox.,,POP CORN (BOCADITOS)
Galletas de Maíz SALMAS Horneadas con Granos y...,S/ 10.90 un,plaza_vea,POP CORN (BOCADITOS),2024-12-04 14:39:06.213842,126.0,g,10.9,plaza_vea,Caja 126g,,POP CORN (BOCADITOS)
Sazonador de Pop Corn Sabor Mantequilla Costeño Pops 81g,S/ 11.20,wong,POP CORN (BOCADITOS),2024-12-04 20:46:19.323253,81.0,g,11.2,wong,,,POP CORN (BOCADITOS)
Sazonador de Pop Corn COSTEÑO Sabor a Queso Frasco 64g,S/ 11.20,vivanda,POP CORN (BOCADITOS),2024-12-04 18:15:54.619597,64.0,g,11.2,vivanda,,COSTEÑO,POP CORN (BOCADITOS)
Sazonador Costeño Pops Sabor Queso 64g,S/ 11.20,metro,POP CORN (BOCADITOS),2024-12-04 22:19:52.906004,64.0,g,11.2,metro,,,POP CORN (BOCADITOS)
Sazonador de Pop Corn Sabor Mantequilla Costeño Pops 81g,S/ 11.20,metro,POP CORN (BOCADITOS),2024-12-04 22:19:52.906004,81.0,g,11.2,metro,,,POP CORN (BOCADITOS)
Sazonador Costeño Pops Sabor Queso 64g,S/ 11.20,wong,POP CORN (BOCADITOS),2024-12-04 20:46:19.323253,64.0,g,11.2,wong,,,POP CORN (BOCADITOS)
Banderitas Pop Up X 130 unid Neón,S/ 11.50,wong,POP CORN (BOCADITOS),2024-12-04 20:46:19.323253,130.0,un,11.5,wong,,,POP CORN (BOCADITOS)
Yogurt DANLAC Frutado con Aguaymanto Botella 9...,S/ 11.50 un,plaza_vea,POP CORN (BOCADITOS),2024-12-04 14:39:06.213842,900.0,g,11.5,plaza_vea,Botella 900g,,POP CORN (BOCADITOS)
Cereal ANGEL Capas de trigo con chocolate Bols...,S/ 11.60 un,plaza_vea,POP CORN (BOCADITOS),2024-12-04 14:39:06.213842,380.0,g,11.6,plaza_vea,Bolsa 380g,,POP CORN (BOCADITOS)
Maiz Gigante con Chocolate Inka Corn 100g,S/ 11.90,metro,POP CORN (BOCADITOS),2024-12-04 22:19:52.906004,100.0,g,11.9,metro,,,POP CORN (BOCADITOS)
Acondicionador SAVITAL con Multivitaminas y Sábila Frasco 490ml,S/ 11.90 20%,vega,POP CORN (BOCADITOS),2024-12-04 14:42:44.525172,490.0,ml,11.9,vega,,Savital,POP CORN (BOCADITOS)
Acondicionador SAVITAL con Multióleos y Sábila Frasco 490ml,S/ 11.90 20%,vega,POP CORN (BOCADITOS),2024-12-04 14:42:44.525172,490.0,ml,11.9,vega,,Savital,POP CORN (BOCADITOS)
Chicken Pop Redondos Bolsa 300 g,S/ 12.70,metro,POP CORN (BOCADITOS),2024-12-04 22:19:52.906004,300.0,g,12.7,metro,,,POP CORN (BOCADITOS)
Salsa HEINZ Tomato ketchup con un toque de dul...,S/ 12.70 un,plaza_vea,POP CORN (BOCADITOS),2024-12-04 14:39:06.213842,397.0,g,12.7,plaza_vea,Doypack 397g,,POP CORN (BOCADITOS)
Cereal CORN FLAKES Nestlé Sin Gluten Caja 180g,S/ 12.80,vivanda,POP CORN (BOCADITOS),2024-12-04 18:15:54.619597,180.0,g,12.8,vivanda,,CORN FLAKES,POP CORN (BOCADITOS)
Shampoo SAVITAL con Multióleos y Sábila Frasco...,S/ 12.90 un,plaza_vea,POP CORN (BOCADITOS),2024-12-04 14:39:06.213842,510.0,ml,12.9,plaza_vea,Frasco 510ml,,POP CORN (BOCADITOS)
Mantequilla con Sal LAIVE Pote 180g,S/ 12.90 un,plaza_vea,POP CORN (BOCADITOS),2024-12-04 14:39:06.213842,180.0,g,12.9,plaza_vea,Pote 180g,,POP CORN (BOCADITOS)
Hojuelas de Maíz Corn Flakes Cuisine & Co Caja 500 g,S/ 12.90,metro,POP CORN (BOCADITOS),2024-12-04 22:19:52.906004,500.0,g,12.9,metro,,,POP CORN (BOCADITOS)
Hojuelas de Maíz Kellogg's Corn Flakes 410g,S/ 13.00,wong,POP CORN (BOCADITOS),2024-12-04 20:46:19.323253,410.0,g,13.0,wong,,,POP CORN (BOCADITOS)
Hojuelas de Maíz Kellogg's Corn Flakes 410g,S/ 13.00,metro,POP CORN (BOCADITOS),2024-12-04 22:19:52.906004,410.0,g,13.0,metro,,,POP CORN (BOCADITOS)
Cereal KELLOGGS Corn Flakes Caja 410g,S/ 13.10 un,plaza_vea,POP CORN (BOCADITOS),2024-12-04 14:39:06.213842,410.0,g,13.1,plaza_vea,Caja 410g,,POP CORN (BOCADITOS)
