description,price,website,search_term,scrape_timestamp,cantidad,unidad,price_numeric
Papa Blanca Yungay x kg,S/ 2.99 x kg,wong,PAPA BLANCA,2024-12-04 20:02:34.039402,1.0,kg,2.99
Papa Blanca Canchán Procesada x kgs,S/ 3.39 x kg,wong,PAPA BLANCA,2024-12-04 20:02:34.039402,1.0,kg,3.39
Papa Blanca Cocktail x kg,S/ 3.29 x kg,wong,PAPA BLANCA,2024-12-04 20:02:34.039402,1.0,kg,3.29
Papa Blanca Yungay Agro Selecto 2kg,S/ 8.08,wong,PAPA BLANCA,2024-12-04 20:02:34.039402,2.0,kg,8.08
Papa Cocktail Blanca Agro Selecto 800g,S/ 6.00,wong,PAPA BLANCA,2024-12-04 20:02:34.039402,800.0,g,6.0
Papa Blanca Perricholi Procesada Wong x kg,S/ 4.79 x kg,wong,PAPA BLANCA,2024-12-04 20:02:34.039402,1.0,kg,4.79
